RepJoshG,1322216815897006080,2020-10-30 16:40:29,"It's heartbreaking how many veterans lost their lives during the height of the COVID crisis, and their families deserve answers and accountability. (2/2)"
RepJoshG,1321892736522506242,2020-10-29 19:12:42,Health insurance is more important than ever and I’m encouraging all constituents in need of coverage to sign up during the enrollment period starting Nov. 1. Learn more here: https://t.co/0XYle6Z7lO (2/2)
RepJoshG,1321892735507439618,2020-10-29 19:12:42,"New Jersey recently announced the launch of the state’s official health insurance marketplace, Get Covered New Jersey. Residents can now browse health plans, and compare prices for the Affordable Care Act Open Enrollment Period that begins Nov. 1 (1/2)"
RepJoshG,1321550220900139010,2020-10-28 20:31:40,"Join me Thursday 10/29 at 11:00am for my 55th ""Cup of Joe with Josh"" Town Hall — Live on Facebook. I'll be answering questions from Fifth District residents on #COVID19 and issues impacting you. Send your questions to coronavirusNJ5@mail.house.gov https://t.co/P17tzMcBNx"
RepJoshG,1321517378623209480,2020-10-28 18:21:10,"...and we must be prepared for every eventuality. My bipartisan, bicameral bill the Nursing Home Pandemic Protection Act, will ensure that all facilities have crisis plans in place and a stockpile of PPE. (3/3)"
RepJoshG,1321501229508403202,2020-10-28 17:17:00,"Today, we honor National First Responders Day and thank all of our brave firefighters, law enforcement, and EMTs for protecting us every day, especially during the pandemic. I will always get your backs and appreciate you always getting ours! #NJ5 https://t.co/vXAnOjo3ij"
RepJoshG,1320820475195465728,2020-10-26 20:11:55,"...are communicating outbreaks to the CDC, to their residents and to loved ones, and ensures crisis plans and stockpiles of PPE are in place which are vital protections for our seniors and veterans need as we enter the fall, winter and flu season. (2/2)"
RepJoshG,1320820474193076224,2020-10-26 20:11:55,"Last week, I was proud to join @CoryBooker in announcing our bicameral Nursing Home Pandemic Protection Act which ensures facilities... (1/2)
https://t.co/geLegh0ERE"
RepJoshG,1320469177770102784,2020-10-25 20:55:59,"ICYMI: @SenBooker and I announced bicameral legislation called the Nursing Home Pandemic Protection Act to protect and support our seniors from a second wave of COVID-19.  Learn more here:
https://t.co/Ch1WOQfvCd"
RepJoshG,1320068271639613443,2020-10-24 18:22:56,"Yesterday, I was proud to announce that @SenBooker is introducing my bipartisan Nursing Home Pandemic Protection Act in the U.S. Senate... (1/2)
https://t.co/QM5rmfWKVC"
RepJoshG,1319790867905941513,2020-10-24 00:00:38,"Today, I was proud to announce that @SenBooker is introducing my bipartisan Nursing Home Pandemic Protection Act in the U.S. Senate, to help get these vital protections across the finish line to support our seniors and long-term care residents as we enter flu season. https://t.co/D560oQzCvD"
RepJoshG,1319710510368100352,2020-10-23 18:41:19,"...to install the physical infrastructure necessary to connect our homes, schools, health care providers, and businesses to the services we all need in Warren and Sussex Counties. My fight for rural broadband is not over until everyone in the Fifth District is connected. (3/3)"
RepJoshG,1319710509386661893,2020-10-23 18:41:19,"I will continue to work with broadband providers and our great mayors like Knowlton Mayor Adele Starrs, and local leaders like Shade Cronan of @Zufall_Health to help expand access to high-speed internet, to get costs down and make it easier... (2/3)"
RepJoshG,1319669914555326464,2020-10-23 16:00:00,The @ProbSolveCaucus released a list of budget principles for addressing the national debt once we emerge from the current COVID-19 crisis. We must look towards the future while simultaneously helping and addressing our economic recovery. (2/2)
RepJoshG,1319445187488325632,2020-10-23 01:07:01,"Join me tomorrow on Facebook Live w/ @SenBooker as we announce new protections for nursing homes and long-term care facilities as we prepare for a second wave of COVID-19.

On Facebook Live Friday 10/23 at 10:00 AM ET: https://t.co/Ci3eHZBFxa https://t.co/JiB3L4w8Nf"
RepJoshG,1319318206180397057,2020-10-22 16:42:26,"Last week, I announced that Sussex &amp; Warren veterans now have access to health care services much closer to home, instead of having to drive more than an hour to the East Orange VA facility. (2/3)"
RepJoshG,1319042205001125891,2020-10-21 22:25:42,"A recent survey showed that during this COVID crisis, 36% reported an increase in illicit drug use and 55% reported increased alcohol use. We must continue to stand and fight for our families and loved ones and tell their stories. (2/2)"
RepJoshG,1319042204015464449,2020-10-21 22:25:42,"While we deal with this pandemic, the opioid epidemic is continuing to absolutely devastate families throughout #NJ5. (1/2)
https://t.co/Mi8a00MdPT"
RepJoshG,1318923046628003843,2020-10-21 14:32:13,"More than 500 people from their staff come to work every day to care for the seniors because they are committed to a mission to control and stop this virus. Thank you to everyone from the Jewish Home Family for their constant dedication, you are true heroes. (2/2)"
RepJoshG,1318923043780124682,2020-10-21 14:32:12,"This weekend, #TeamGottheimer attended The Jewish Home Family-Annual Gala saluting their heroes. CEO and President, Carol Silver Elliot, spoke about the organization's defense against COVID and how their team was committed to fighting to keep their seniors safe. (1/2) https://t.co/emImgLn7hM"
RepJoshG,1318915125118631939,2020-10-21 14:00:44,"RT @ProbSolveCaucus: With elections 13 days away, it is critical that we provide real COVID relief to Americans NOW. Problem Solvers Co-Cha…"
RepJoshG,1317918658824470532,2020-10-18 20:01:08,We need to keep up the pressure on the negotiators until we reach a bipartisan COVID-19 relief deal. (1/2) https://t.co/RXb9KpsaMv
RepJoshG,1317585976978452480,2020-10-17 21:59:11,"This announcement is a long time coming. 

The explosion of COVID-19 demanded transparency, honesty, cooperation, and competency, and the people in charge at the state-run Paramus Veterans Home and elsewhere provided none of these. (1/2)

https://t.co/Uo0qmL0mL7"
RepJoshG,1317575491923181569,2020-10-17 21:17:31,"No family should feel alone in this fight.

At the federal level, I’m supporting a robust legislative agenda that gives municipalities &amp; providers — like The Center for Prevention @cfpcnj — tools necessary to crack down on the opioid epidemic &amp; help those who need it most. (2/2)"
RepJoshG,1317575490476167171,2020-10-17 21:17:30,"While we deal with this pandemic, the opioid epidemic is continuing to absolutely devastate families throughout Northern NJ and their stories are not being told. 

We've had 300 drug-related overdose deaths in #NJ5 counties in 2020 thus far. (1/2)

https://t.co/xxLb7uqqOk"
RepJoshG,1317274541136224257,2020-10-17 01:21:39,"I will never stop fighting to get North Jersey the resources we need, which is why I'm continuing to push the negotiators in Washington to come together to get a new bipartisan COVID-19 relief deal done. (2/2)"
RepJoshG,1317124369043378176,2020-10-16 15:24:55,"Yesterday, I announced how Sussex &amp; Warren veterans now have access to health care services much closer to home, instead of having to drive more than an hour to the East Orange VA facility.

We cut through red tape so our vets can now utilize the ImageCare Centers in NJ. (1/3) https://t.co/VycxfCZjim"
RepJoshG,1316896073978437632,2020-10-16 00:17:45,"**TOMORROW**

If you're a retiree living in an #NJ5 long-term care facility or nursing home, join me for a Senior Residence Townhall — 10/16 @ 10:15 AM — to discuss issues impacting you during the #COVID19 pandemic. 

To register, contact my Glen Rock office at 201-389-1100. https://t.co/03lJ3rOO1G"
RepJoshG,1316516934360367111,2020-10-14 23:11:11,"If you're a retiree living in a Fifth District long-term care facility or nursing home, join me for a Senior Residence Townhall this Friday 10/16 @ 10:15 AM to discuss issues impacting you during the #COVID19 pandemic. 

To register, contact my Glen Rock office at 201-389-1100. https://t.co/BK9z1nN25k"
RepJoshG,1316006256428093442,2020-10-13 13:21:56,"The deadline for the Census has been extended to October 31st, so fill it out now! 

This determines how much federal investment the Fifth District can claw back to invest in fixing our roads, and helping our schools and hospitals. 

Get counted today!

https://t.co/nGFBI3Dos3"
RepJoshG,1315689726179934210,2020-10-12 16:24:09,Solid argument for why we should absolutely move forward with reaching a new COVID-19 relief deal — read this ⬇️ https://t.co/jh4OqnOfJY
RepJoshG,1315339552995897344,2020-10-11 17:12:41,"We need to keep up the pressure on the negotiators until we reach a bipartisan COVID-19 relief deal.

The @ProbSolveCaucus is continuing to push for the negotiators to stay at the table, so we can get a deal done to help #NJ5 &amp; American families, small biz, &amp; local communities. https://t.co/DWVgOP6c4r"
RepJoshG,1315261523388960772,2020-10-11 12:02:38,"It’s always a top priority of mine to ensure our first responders have all the resources they need to do their jobs safely and effectively, especially throughout this pandemic. (2/3)"
RepJoshG,1315121107805052930,2020-10-11 02:44:40,"Today is #WorldMentalHealthDay.

Whether it’s passing bipartisan House legislation that invests in mental health services for veterans to incorporating mental health services into schools from our Anti-Bullying Report, I'm working to help residents get the care they need. https://t.co/gppoMNSnXf"
RepJoshG,1314623023958364161,2020-10-09 17:45:28,"I will never stop fighting to get North Jersey the resources we need. You have my word on that, and I will continue to push everyone to get a new bipartisan COVID-19 relief agreement done. (3/3)"
RepJoshG,1314623022184136705,2020-10-09 17:45:27,"Yesterday, I joined local officials in announcing new, updated reporting on federal COVID-19 relief investment clawed back to every single community in New Jersey’s Fifth Congressional District to date. (1/3)
https://t.co/9YCblAaDB3"
RepJoshG,1314001555981467648,2020-10-08 00:35:58,"While I’m glad that Facebook is taking action to get rid of groups and accounts associated with the fringe conspiracy movement QAnon, we must remain vigilant to ensure that all companies eliminate hate, misinformation, and conspiratorial content from their platforms. (2/2)"
RepJoshG,1313581826418540548,2020-10-06 20:48:07,RT @ProbSolveCaucus: Statement from the Leaders of the Problem Solvers Caucus COVID-19 Working Group https://t.co/USyJCcVsiY
RepJoshG,1313550482313564161,2020-10-06 18:43:34,Please visit: https://t.co/8ABVWulizY for available Mental Health hotlines and call if you need help. (2/2)
RepJoshG,1313550481495601154,2020-10-06 18:43:34,"This week is #MentalIllnessAwarenessWeek. For many, the pandemic has contributed to or exposed hidden mental health issues and we need to remind our fellow Fifth District residents that we are all in this together. (1/2)"
RepJoshG,1312905092866113536,2020-10-04 23:59:01,This is why I'm glad the bipartisan CARES Act got resources back to NJ to help combat these very issues &amp; why I'm fighting for a new COVID relief package to help us back home. (3/3)
RepJoshG,1312905090932580353,2020-10-04 23:59:00,"THREAD:

The Community FoodBank of NJ @CFBNJ has released a look at the impact of COVID on hunger in NJ, w/ estimates showing the number of food-insecure NJ residents will increase by 56% &amp; that 1 in 5 children will experience food insecurity this year.

https://t.co/H5qUQ6L9dO"
RepJoshG,1312171653691043846,2020-10-02 23:24:35,"Quick update here as we continue to push for a bipartisan deal on COVID-19 relief to get help out to NJ families, businesses, and local communities.

All sides must stay at the table until we reach an agreement. https://t.co/CEkWwZlQJm"
RepJoshG,1312136831631147009,2020-10-02 21:06:13,RT @ProbSolveCaucus: Statement from Problem Solvers Caucus Co-Chairs Tom Reed (NY-23) &amp; Josh Gottheimer (NJ-5) on Ongoing COVID-19 Relief N…
RepJoshG,1312091006133821440,2020-10-02 18:04:07,Happy National Manufacturing Day! Thank you to all our incredible front line workers in North Jersey making sure our critical supply chains stay functioning and protected during this pandemic. #MFGDay.
RepJoshG,1312019881592868865,2020-10-02 13:21:30,"My family and I are wishing the President and the First Lady a speedy recovery. 

Please keep taking the right precautions — wearing masks, staying socially distanced, and washing your hands.

Stay safe everyone!"
RepJoshG,1311348470670929921,2020-09-30 16:53:33,"With families, businesses, and local communities truly hurting from the impacts of this health and economic crisis, it would be unconscionable for Congress to go home without taking action.

Let's get a deal done. We cannot afford any more delays.

https://t.co/VBKrFtmdUp"
RepJoshG,1311094588002766848,2020-09-30 00:04:43,"I’m thrilled that there has been progress from both sides toward a COVID relief deal. 

As we wrote to leadership earlier this week, I do not believe a discharge petition is the best path forward. The key is keeping both sides at the table until we get something done!"
RepJoshG,1310737876737339393,2020-09-29 00:27:16,"With families, businesses, and local communities truly hurting from the impacts of this health and economic crisis, it’s unconscionable for Congress to go home without taking action. (1/3)

https://t.co/GpKCg3QoKc"
RepJoshG,1310659060723863552,2020-09-28 19:14:05,"As of right now, this is the last week that the House has votes before the October district work period. 

American families, businesses, &amp; communities are hurting. 

We need the negotiators back at the table to get a bipartisan COVID relief deal done.

https://t.co/oNlehXqYfo"
RepJoshG,1310383786425806849,2020-09-28 01:00:15,"bring both sides back to the table for COVID relief to businesses and families — as well as all my work to improve our infrastructure, help lower taxes, and protect access to health care. (2/3)"
RepJoshG,1309251842828832771,2020-09-24 22:02:18,"Earlier this week, the House voted overwhelmingly to extend government funding through Dec. 11.

With that taken care of for now, it's now time for Congress to come together on a new bipartisan COVID-19 relief deal to help the American people and businesses.

#MarchtoCommonGround https://t.co/SVgzNRF8Sw"
RepJoshG,1309193811738984448,2020-09-24 18:11:43,"There are only 6 more days to complete the #2020Census

What's at stake for NJ?

➡️ Trillions in federal investment that #NJ5 needs
➡️ Federal support for food, health care, and more
➡️ Numerous policy decisions made based on Census data

More info here: https://t.co/HAJhEbPmli"
RepJoshG,1309110160347017221,2020-09-24 12:39:18,Send your questions to coronavirusNJ5@mail.house.gov
RepJoshG,1309110158581280769,2020-09-24 12:39:18,"Join me today 9/24 at 10:30 AM for a Facebook Live ""Cup of Joe with Josh"" Virtual Town Hall, featuring special guest Bergen Commissioner Germaine Ortiz.

We’ll be honoring Hispanic Heritage Month and I'll be answering your #COVID19 questions. https://t.co/C5sGUgC399"
RepJoshG,1308929242118447111,2020-09-24 00:40:24,"Thank you to @MountainCreek owner Joe Hession for inviting me to @AmericanDream's Big Snow indoor skiing and snowboard park! 

Big Snow is the largest indoor park of its kind in North America, employing hundreds of Jersey residents while adhering to health guidelines. https://t.co/JEkop6JpPw"
RepJoshG,1308809660229713922,2020-09-23 16:45:14,"It is absolutely critical that both parties come together to get the negotiators back to the table to get a new COVID-19 relief deal done to help the American people.

We cannot delay.

@CNNnewsroom @RepTomReed https://t.co/vKwaBE0unr"
RepJoshG,1308547842663997440,2020-09-22 23:24:51,"NJ's long-term care facilities have seen 7,142 resident and staff COVID deaths.

With flu season around the corner, we must take steps now to prevent new COVID-19 tragedies like the ones we saw at the state-run Paramus Vets Home and at Andover Subacute.

https://t.co/9qB0wQbsOT"
RepJoshG,1308468137373954048,2020-09-22 18:08:08,"In honor of #NationalSmallBusinessWeek, I want to recognize the thousands of NJ small businesses responsible for fueling our local economies.
 
Small businesses are struggling right now, which is why I'm fighting for a second round of PPP and to get a new COVID relief deal done. https://t.co/INJDZUWytl"
RepJoshG,1307719891672334341,2020-09-20 16:34:53,"That's what the Problem Solvers Caucus ""March to Common Ground"" COVID relief framework is all about. (2/2)"
RepJoshG,1307482067706564615,2020-09-20 00:49:51,RT @NJDeptofHealth: We must keep up all the public health measures that have allowed us to flatten the curve of COVID-19 in our state.…
RepJoshG,1307032712222519296,2020-09-18 19:04:16,"No one should have to choose between a healthy pregnancy &amp; a paycheck.

That's why I’m proud the House passed the bipartisan Pregnant Workers Fairness Act this week, which I cosponsored, to provide job security &amp; stronger access to workplace accommodations for pregnant workers. https://t.co/LvZeuU49rO"
RepJoshG,1307021183251099651,2020-09-18 18:18:28,"In a crisis, Democrats and Republicans have to find a way to come together.

That's exactly the goal of our new bipartisan #MarchToCommonGround COVID relief framework from the @probsolvecaucus: getting the negotiators back to the table.

https://t.co/BACqU5Otms"
RepJoshG,1306717698236256256,2020-09-17 22:12:31,"RT @sarahnferris: NEW: the Dem Blue Dog Coalition today officially endorsed the Problem Solvers' Covid relief package. 

Requires 2/3 of th…"
RepJoshG,1306702357858865152,2020-09-17 21:11:34,"That's what the @ProbSolveCaucus ""March to Common Ground"" COVID relief framework is all about. 

Watch more here ⬆️"
RepJoshG,1306640919991652352,2020-09-17 17:07:26,RT @timkaine: The first 4 COVID relief bills were bipartisan—and here is a solid bipartisan proposal from 50 House members that would help…
RepJoshG,1306592152105877505,2020-09-17 13:53:39,"Congress needs to help get families, businesses, &amp; communities back on their feet.

I joined PBS @NewsHour w/ my Problem Solvers Caucus Co-Chair Tom Reed to discuss our new bipartisan COVID relief framework to break the stalemate here in Washington. https://t.co/kEu8sxYPuf"
RepJoshG,1306342901610360832,2020-09-16 21:23:13,"This week, the @ProbSolveCaucus — which I'm proud to Co-Chair — unveiled our ""March to Common Ground"" bipartisan framework to help break the gridlock on a new COVID-19 relief package &amp; help encourage negotiators to get back to the table. https://t.co/kR0wm42jXJ"
RepJoshG,1305582358138060800,2020-09-14 19:01:05,"FEMA's new policy will halt emergency funding for cloth masks in schools, PPE for teachers, &amp; disinfection services.

I'm leading a bipartisan group of the NJ delegation to urge FEMA to reverse this harmful policy that will only hinder our efforts to slow the spread. https://t.co/gJs2WETzdn"
RepJoshG,1305214063580975106,2020-09-13 18:37:37,"RT @NJDeptofHealth: NJ is seeing case numbers climb among the 19-24 age group.  

If you want to socialize, DO IT SAFELY:

🧍‍♂️ 🧍‍♀️Stay at…"
RepJoshG,1303777584807804929,2020-09-09 19:29:33,"The severity of a new wave of cases this fall comes down to how prepared we are for it — which all depends on our communities continuing to follow proper protocols and getting the federal resources and local support we need back here to North Jersey.

https://t.co/vCzxL6KrGi"
RepJoshG,1303468430025256961,2020-09-08 23:01:05,That's why we must get both sides back to the table now for a new bipartisan COVID-19 relief package and ensure we're prepared. (2/2)
RepJoshG,1303468429056376832,2020-09-08 23:01:05,"As this pandemic continues, we must be proactive in strengthening our economy and making sure we have the supplies necessary to combat COVID-19. (1/2)
https://t.co/41Mzoupc2t"
RepJoshG,1303094235231551488,2020-09-07 22:14:10,"As we celebrate Labor Day, please continue to be mindful of health guidelines like social distancing and wearing masks. New Jersey is continuing to reopen because we have been diligent so far but we must all remain prepared.
https://t.co/EjuOy3TRL0"
RepJoshG,1303026031209648128,2020-09-07 17:43:09,"Happy Labor Day, North Jersey! Today, we honor the hardworking women and men of our great country and all the contributions they’ve made.

We must continue to fight to protect their health care, secure worker protections, ensure paycheck equity, and help keep workers safe."
RepJoshG,1303020114107826177,2020-09-07 17:19:38,"RT @NJOHSP: “Social distancing, masks, hand-washing, and other preventative measures will help slow the spread of both COVID-19 and common…"
RepJoshG,1302790432196358145,2020-09-07 02:06:58,"Since the start of this crisis, we’ve known that a second wave is likely.

This fall, we need to ensure we're prepared and that we have the right protections in place.

This past week I joined health experts to discuss what we can do:

https://t.co/9iAA8F7KQK"
RepJoshG,1302668563526844416,2020-09-06 18:02:42,"Over this #LaborDayWeekend, please remember to be safe, responsible, &amp; practice precautions to help keep everyone healthy:

🧼 Wash your hands 
😷 Wear a mask 
↔️ Practice social distancing

Find testing sites throughout NJ here: https://t.co/jTSSy97Eyy"
RepJoshG,1302344021289861127,2020-09-05 20:33:05,"This virus does not see race, religion, gender, or party -- I am urging Congressional leadership and the White House to get back to the negotiating table ASAP. (2/2)"
RepJoshG,1302344020350377984,2020-09-05 20:33:05,"People are still hurting from this pandemic and we need more relief now. It's crucial that we set aside our differences and come together in a bipartisan manner to reach a deal. (1/2)
https://t.co/0E0uuSdcOM"
RepJoshG,1302293096873558017,2020-09-05 17:10:44,"This week, I joined doctors, local officials, and first responders to discuss challenges and safety steps to help protect North Jersey from a potential second wave of the Coronavirus. (1/2)
https://t.co/6YyU3z1APi"
RepJoshG,1302037737231572993,2020-09-05 00:16:01,"The Paramus Veterans Home is being fined for the horrific mismanagement of a COVID-19 outbreak that resulted in 81 residents' deaths. (1/2)

https://t.co/wmCAQFpxR1"
RepJoshG,1301907213355810819,2020-09-04 15:37:22,"Since the start of this crisis, we’ve known that a second wave is likely.

The severity of a new wave this fall comes down to how prepared we are for it — which I discussed this week with #NJ5 hospital officials and local leaders.

More from @News12NJ here: https://t.co/jHkRp79RhG"
RepJoshG,1301652305574494209,2020-09-03 22:44:27,"This morning, I joined @FoxBusiness @dagenmcdowell with my @ProbSolveCaucus Co-Chair @RepTomReed to discuss how we're working to bring both sides of the aisle together for a new COVID-19 package and how to avoid a government shutdown — watch here: https://t.co/pq0YF62N6J"
RepJoshG,1301574917155151874,2020-09-03 17:36:56,"...free or reduced-price school meal eligible children during the pandemic. 

We know that children who receive nutritious, balanced meals are healthier, more focused, &amp; perform better in school. 

We must get resources to our students and combat hunger in our communities. (2/2)"
RepJoshG,1301216483100561411,2020-09-02 17:52:39,"ALERT: Applications have just opened for small businesses grants for restaurants and other food service establishments hit hard by the Coronavirus pandemic. (1/2)
https://t.co/UmWa2kZyhP"
RepJoshG,1300860932684480512,2020-09-01 18:19:49,"There are hundreds of #COVID19 testing sites open throughout New Jersey — both public and private. 

Many locations no longer require you to exhibit symptoms and are available at no cost.

Use this searchable database to find testing sites near you:
https://t.co/mUce9ty5tE"
RepJoshG,1300477440351973379,2020-08-31 16:55:58,"With our nation surpassing 6 million #COVID19 cases, New Jersey residents need to continue doing their part to help stop any spread: wear a mask, wash your hands, practice smart social distancing, and stay safe. https://t.co/BnXY4RxyRa"
RepJoshG,1300454850254249989,2020-08-31 15:26:12,"NJ COVID-19 UPDATE:

The State of New Jersey has announced that indoor dining at restaurants will be able to resume this coming Friday, September 4th, at 25% capacity.

It's great that NJ is continuing to reopen safely as we combat the spread of #COVID19."
RepJoshG,1300444501924868096,2020-08-31 14:45:05,"RT @NJDeptofHealth: Fight the Bite NJ!

As we enter the peak of West Nile Virus season, NJDOH &amp; @NewJerseyDEP  are urging residents to take…"
RepJoshG,1300072894349877250,2020-08-30 14:08:26,"NJ COVID-19 UPDATE: 

- The State of New Jersey has announced that NJ's public-health emergency, originally declared in March, will be extended another 30 days.

- Indoor amusement parks will be allowed to reopen in NJ on Sept. 1."
RepJoshG,1299768796375326726,2020-08-29 18:00:04,"It’s up to us to #MaskUp &amp; stop the spread of #COVID19 here in New Jersey.

Join my colleagues and me in wearing your mask &amp; keeping our communities safe! #MaskUpNewJersey https://t.co/noJLVRF5el"
