RepJoshG,1278706816470462471,2020-07-02 15:07:16,"Americans deserve #LowerCostsForCare.
This week, I helped pass the Patient Protection &amp; Affordable Care Enhancement Act — to lower premiums, expand coverage, lower drug costs, &amp; fight inequity in health care. (2/2)"
RepJoshG,1278706815472107520,2020-07-02 15:07:16,"It's vital that we fight to protect and strengthen Obamacare and ensure Americans have access to quality, affordable health care. (1/2)
https://t.co/d33HPddElU"
RepJoshG,1278052559995928577,2020-06-30 19:47:30,HOMETOWN HEROES SPOTLIGHT: Thank you to Jagdeep Singh from Lodi who brought together his Sikh community to donate hand sanitizer and masks to the Lodi Police Department. (1/2) https://t.co/3weZW0rPn8
RepJoshG,1277985740887134208,2020-06-30 15:21:59,"Americans deserve #LowerCostsForCare. 

This week, I helped pass the Patient Protection &amp; Affordable Care Enhancement Act — to lower premiums, expand coverage, lower drug costs, &amp; fight inequity in health care.

It's vital that we fight to protect &amp; strengthen Obamacare. https://t.co/luwbZaPHWb"
RepJoshG,1277688919799271424,2020-06-29 19:42:31,"Jack woke up on April 7th and was released from the hospital and is still recovering but the worst is over. Their strength, advocacy, and courage during this difficult time are what make them true Hometown Heroes. (3/3)"
RepJoshG,1277688918989770753,2020-06-29 19:42:31,"Genny would not stop until her son got the proper treatment and was vocal about the effects this virus had on young people. This allowed Jack’s doctor to lead a Remdesivir trial for many other patients, also saving their lives. (2/3)"
RepJoshG,1277688917110775808,2020-06-29 19:42:30,Hometown Heroes Spotlight: Our first Coronavirus Hometown Heroes are Jack and Genny Allard from Ridgewood! Jack became ill with Coronavirus and was in a coma for 20 days. (1/3) https://t.co/EMrBAwCect
RepJoshG,1277662590089531393,2020-06-29 17:57:53,"With Americans’ health care and rights under attack every day, this is a great #SCOTUS win in our fight to protect women’s right to choose and to protect access to health care. 

https://t.co/HeSIRWB28O"
RepJoshG,1277380703261515777,2020-06-28 23:17:46,New Jersey is doing an incredible job in stemming the spread of the virus but we must remain vigilant. (2/2)
RepJoshG,1277380702363926529,2020-06-28 23:17:46,"The United States has hit a record in single day coronavirus cases. As we continue to open up in New Jersey it is imperative that we continue to wear masks, social distance, and follow health guidelines. (1/2)
https://t.co/Y9nIoXOdof"
RepJoshG,1277320731865595906,2020-06-28 19:19:28,"Yesterday, I was proud to honor veterans, first responders, students, teachers, and community leaders in the Fith District for their contributions during the pandemic in my special Coronavirus Hometown Heroes event. (1/2)https://t.co/CxcW8ypJ0m"
RepJoshG,1277015732501524480,2020-06-27 23:07:31,...informed of outbreaks — my bipartisan Nursing Home Pandemic Protection Act does just that.
RepJoshG,1277015731515928576,2020-06-27 23:07:30,"43% of #COVID19 deaths in the U.S. are linked to nursing homes, including nearly half of NJ's coronavirus deaths. We need to ensure our long-term care facilities have crisis plans and PPE in place and that families, residents, &amp; the CDC are kept... (1/2)

https://t.co/ImTpQqoD47"
RepJoshG,1276916017680338946,2020-06-27 16:31:17,"Tune in here for a special version of our biannual awards — our Fifth District Coronavirus Hometown Heroes — to honor our stand out neighbors, friends, frontline workers, &amp; leaders who've worked to help our community throughout the COVID-19 pandemic. 

https://t.co/9ThqBKSSVH"
RepJoshG,1276208390620971008,2020-06-25 17:39:25,Join me on Friday 6/26 at 12:30 PM for a Facebook Live Virtual Town Hall where I'll be answering your #COVID19 questions. Send your questions to coronavirusNJ5@mail.house.gov. https://t.co/14IItC9iEk
RepJoshG,1275855009771634690,2020-06-24 18:15:13,"I'd like to give a big #NJ5ThanksYou to the owners of Caffe Anello for donating more 10,000+ meals across North Jersey since the pandemic has started. To Alissa and John, thank you for your dedication to giving back to our community! https://t.co/moH0BZcVHN"
RepJoshG,1275828645609816064,2020-06-24 16:30:27,"The New Jersey Business and Industry Assoc. @NJBIA has recently endorsed the Senate led SMART Fund thanks to @SenatorMenendez. I'm honored to help lead this legislation in the House to provide $500 billion in #COVID19 relief to... (1/2) 
https://t.co/BeqokIX06X"
RepJoshG,1275449856903966730,2020-06-23 15:25:17,"Thank you to the Sussex County Child Health Crisis work group, led by recently-retired Sussex-Wantage school nurse Deb Fisher, for promoting nutritional wellness for young students during the coronavirus. (1/2)
https://t.co/WhlfXO9KiU"
RepJoshG,1275073841908248577,2020-06-22 14:31:08,"Today, 6/22, @NJDeptofHealth will be holding a Q&amp;A info session for youth camp operators and staff about NJ's youth camp and pool guidelines.

Tune in here — https://t.co/Ta1JCVBHxP"
RepJoshG,1274370423975706628,2020-06-20 15:56:00,"One of my top priorities throughout this crisis has been working to ensure our education systems have the resources it needs to combat the impacts of this pandemic.  (1/2)
https://t.co/NJn9g7cLFo"
RepJoshG,1274086808817668098,2020-06-19 21:09:01,"One of my top priorities throughout this crisis has been working to ensure our frontline medical workers, health centers, hospitals, and first responders in each North Jersey county have the supplies, resources, and full support they need to do their jobs safely and effectively."
RepJoshG,1274086807723036674,2020-06-19 21:09:01,"This week, I announced that $243 million from the bipartisan CARES Act will be going to local hospitals in #NJ5 — or “hot spot” hospitals here in the eye of the #COVID19 storm. 

https://t.co/zvhaR4Qt5D"
RepJoshG,1273701988950331392,2020-06-18 19:39:53,"...requested the National Guard and VA, hand delivered PPE to nurses and introduced the bipartisan Pandemic Protection Act of 2020 that requires nursing homes to take steps... (2/3)"
RepJoshG,1273672154748420101,2020-06-18 17:41:20,"...our hospitals, schools, small businesses, and infrastructure projects. You can respond at https://t.co/GvEASc0GiG, by phone or by mail. (2/2)"
RepJoshG,1272980801966276614,2020-06-16 19:54:08,"BD recently had a “Day of Thanks” to thank their associates during this time and I'd like to continue to thank all our frontliners in our hospitals, labs, EMS teams, and first responder depts. for the work they do every day to get us through this pandemic. (3/3)"
RepJoshG,1272980801152585729,2020-06-16 19:54:08,I want to thank BD for everything they have done to ramp up testing for New Jersey and increasing syringe capacity for a potential COVID19 vaccine. (2/3)
RepJoshG,1272980798916964352,2020-06-16 19:54:07,Great visiting @BDandCo today in Franklin Lakes to learn more about cutting edge development in #COVID19 testing and vaccine deployment. (1/3) https://t.co/hKKKz0r7TX
RepJoshG,1272942789366624258,2020-06-16 17:23:05,"That's why I helped introduce the COVID-19 Youth Sports and Working Families Relief Act, to help North Jersey families recoup costs and fees, while making sure these organizations survive this crisis so our kids can return to these activities as we continue to reopen. (2/2)"
RepJoshG,1272942788351537154,2020-06-16 17:23:05,"While youth sports may be reopening in a limited capacity on June 22nd, these activity groups have seen at least $8.5 billion in losses nationwide due to #COVID19. (1/2)
https://t.co/55yxunLkVR"
RepJoshG,1272200197771268101,2020-06-14 16:12:18,"Thank you to all the incredible healthcare workers and staff at CareOne for all their hard work. To the Clifford family, congratulations! (2/2)"
RepJoshG,1272200196668219394,2020-06-14 16:12:17,"After 41 days of fighting COVID-19 in the Paramus CareOne Facility, 92-year-old Angeline Clifford has successfully beaten the virus! (1/2) https://t.co/c9jDhEy2lj"
RepJoshG,1271597508217757696,2020-06-13 00:17:25,"The Administration just finalized a rule change that will scrap nondiscrimination health care and health insurance protections for #LGBTQ, women, those seeking health care, and others (during #Pride Month no less). https://t.co/2QXiJoNlBa"
RepJoshG,1271491535729811456,2020-06-12 17:16:19,"I'm so happy to see that 96-year-old and avid Yankees fan, Florence Simek, has beaten COVID19! Learn more about Florence's story below and hopefully, she'll see the return of her favorite team soon! https://t.co/8dgQLPzZUm"
RepJoshG,1271133653259689985,2020-06-11 17:34:14,"Thank you to Lisa Swain, Chris Tully, Mayor Richard LaBarbiera, and Paramus Councilman Pat Verile for joining me to help our front line healthcare workers. (3/3)"
RepJoshG,1271133410900291595,2020-06-11 17:33:16,"I'm committed to making sure our front liners have all the equipment they need to handle this pandemic. I fought for the Paramus Veterans Home by requesting the National Guard and VA, introducing the bipartisan Nursing Home Pandemic Protection Act... (1/3) https://t.co/nLElqkNZ0j"
RepJoshG,1271112701041926144,2020-06-11 16:10:58,"The State has outlined NJ's contact tracing plans. It's vital that NJ residents participate so that we can effectively combat #COVID19.
https://t.co/V8vJHBAcJu"
RepJoshG,1270865265224568832,2020-06-10 23:47:45,"NJ has still not stopped receiving price gouging complaints throughout this pandemic. That's why I've helped introduce the Preventing Pandemic Profiting Act... (1/2)
https://t.co/lLGVPj9Z5j"
RepJoshG,1270467796179341312,2020-06-09 21:28:21,"UPDATE: @NJDOH has issued COVID-19 guidelines for summer youth camps following
@GovMurphy executive order allowing operations beginning July 6.

Cloth face coverings for staff and campers
Daily health screenings for COVID-19 will be put in place at entry. (1/2)"
RepJoshG,1269694989635850242,2020-06-07 18:17:29,"The coronavirus is taking a devastating toll on nursing homes and has been spreading like wildfire. We need to put measures in place so that our nursing homes never experience the same catastrophes ever again. (1/2)
https://t.co/52qNHSVJry"
RepJoshG,1269057989538914305,2020-06-06 00:06:17,"While the mission was limited in scope &amp; timeline, I'm glad to hear @GovMurphy is recalling NJ's National Guard servicemembers back home tomorrow morning. With the ongoing COVID-19 pandemic in North Jersey and across the state, I'm relieved that they will be resuming... https://t.co/Ykk4OWdUuS"
RepJoshG,1268984524517650433,2020-06-05 19:14:21,"To deploy a single dose of #COVID19 vaccine for everyone in the U.S., 300+ million syringes &amp; needles will be needed, which could take more than a year to produce.

That's why 25 bipartisan members are asking House leadership to address this national shortage. https://t.co/3wvGnTx7Da"
RepJoshG,1268609315167965184,2020-06-04 18:23:25,"Just delivered masks to frontline medical workers &amp; staff at the Paramus Veterans Home this morning. I'm committed to making sure our front liners have all the equipment they need to handle this pandemic, and we must always get the backs of our veterans here in NJ. https://t.co/EL31VNAqsz"
RepJoshG,1268222492516274179,2020-06-03 16:46:19,"This week, I've asked our nation's credit card issuers for their detailed emergency assistance programs to help customers who may not be able to make timely payments due to the ongoing pandemic &amp; economic crisis. (1/2) https://t.co/UJ3AAYNzKb"
RepJoshG,1268190920270401538,2020-06-03 14:40:51,"Thanks to Teaneck Volunteer Ambulance Corps for going above and beyond the call to make sure COVID-19 patients are transported safely to get the care they need. 

https://t.co/XAgZUkCyp6"
RepJoshG,1267516510022631424,2020-06-01 18:00:59,"During this time, everyone's mental health is vital and there are resources available to help. The Mental Health Association of New Jersey has free emotional support from trained staff. We will get through this together. https://t.co/UEch7Oq3UI"
RepJoshG,1267476033256796160,2020-06-01 15:20:09,"Today we observe June 1st as the National Day of Mourning and Lament for the 100,000+ lives lost in our country because of COVID-19.
Doctors.
Nurses.
Parents.
Grandparents.
Siblings.
Friends.
Neighbors.
They will never be forgotten. #DayOfMourning"
RepJoshG,1267175819799117825,2020-05-31 19:27:13,"Congratulations to Healthway Natural Foods in Tenafly which adapted by taking more orders by email primarily or over the phone during the Coronavirus. Small businesses are the backbone of our economy and we have to do everything to support them.
https://t.co/seTaOhxLhF"
RepJoshG,1267131669687029761,2020-05-31 16:31:46,"Families and youth sports activities groups have lost $8.5 billion nationwide due to COVID-19. That's why I have become an original co-sponsor of the COVID-19 Youth Sports and Working Families Relief Act which... (1/2)
https://t.co/m7fAqeYqkI"
RepJoshG,1266851511105175552,2020-05-30 21:58:31,"In the House-passed Heroes Act, we included legislation I helped introduce: the Emergency Rental Assistance and Rental Market Stabilization Act — to provide significant emergency rental assistance to help renters struggling during the pandemic. (2/2)"
RepJoshG,1266760874355830787,2020-05-30 15:58:22,"This week, I met with our #NJ5 Mayors to discuss what they need to combat the impacts of this pandemic. 

Keeping constant lines of communication with State and Local stakeholders is the key to getting through this. 

https://t.co/G6wYnHn53O"
RepJoshG,1266401965669523460,2020-05-29 16:12:11,"Kids love little league, dance, &amp; soccer — but activities that families paid for are cancelled due to COVID-19.

With this new bill, North Jersey families can recoup costs, while we help these organizations survive this crisis for our to kids return to.

https://t.co/oI3aV9g4Ze"
RepJoshG,1266357007440850945,2020-05-29 13:13:33,"My Facebook Live Virtual ""Cup of Joe with Josh"" Coronavirus Town Hall is starting soon!

Tune in here: https://t.co/dsbUPfEHGH https://t.co/hO8eXal7wK"
RepJoshG,1266042003785220097,2020-05-28 16:21:50,"Join me on Friday 5/29 at 9:00 AM for a Facebook Live Virtual ""Cup of Joe with Josh"" Town Hall, where I'll be answering your #COVID19 questions. Send your questions to coronavirusNJ5@mail.house.gov https://t.co/0MAZJ8ObG4"
RepJoshG,1265744263977086977,2020-05-27 20:38:43,"With this new bill, we can invest in strike teams to come in to help stop the spread. We will not beat this or flatten the curve if the virus is able to continue to spread like wildfire in our nursing homes. (2/2)"
RepJoshG,1265744263096283137,2020-05-27 20:38:43,"Medical personnel and staff at NJ's long-term care facilities are working hard to protect residents, but many are out sick or are still recovering. (1/2)
https://t.co/9d05MrXlPC"
RepJoshG,1265700543672049664,2020-05-27 17:44:59,Thank you to Family Promise of NJ for bringing meals to former residents of the county shelter during the #COVID19 crisis... (1/2) https://t.co/kKL7d9zNca
RepJoshG,1265669389459820547,2020-05-27 15:41:12,"With our state at the epicenter of this pandemic, I'm working hard to get federal relief to our businesses and workers, so they can survive this economic crisis, recover, and grow. (2/2)"
RepJoshG,1265308353112297473,2020-05-26 15:46:34,ALERT FOR NJ FARMERS: The Coronavirus Food Assistance Program is now open if you've been directly impacted by the coronavirus pandemic and are looking for direct relief. Learn more and apply here: https://t.co/Y7MdOma85A
RepJoshG,1264696948759691265,2020-05-24 23:17:04,"Too many families, loved ones, friends, and neighbors have been lost, and we honor their memory by coming together as one nation to help get through this pandemic. https://t.co/If0oTVNz8H"
RepJoshG,1264637290321784834,2020-05-24 19:20:00,"During this crisis, we must put country ahead of party and continue to take care of our small businesses, frontline healthcare workers, and first responders.
https://t.co/1bT4gKL9Iw"
RepJoshG,1264570565073010688,2020-05-24 14:54:51,"Thanks to NJ delegation &amp; state requests to @FEMA, the @BergenCC testing site will be extended thru the end of June &amp; testing capacity will increase!

More info from Bergen County here: https://t.co/mB7AwcMXmo https://t.co/mjvTvNVmA3"
RepJoshG,1264210501740965888,2020-05-23 15:04:06,"I've also asked the State to invest in hydro-raking, herbicides, increased water quality monitoring and year-round testing to obtain a comprehensive picture of Greenwood Lake under different weather conditions. (4/4)"
RepJoshG,1263887686441590790,2020-05-22 17:41:21,"Starting today, @CVSHealth is bringing drive-thru #COVID19 testing to 1,000 locations around the country, including five sites in the Fifth District. Find drive-thru test sites and make an appointment here: https://t.co/woOPSY0e92"
RepJoshG,1263501413138796545,2020-05-21 16:06:26,"This week, @BillPascrell and I visited the Paramus Veterans Home for Oradell Boy Scout Alex Saldana's nightly ""Taps,"" to recognize the service of North Jersey’s veterans, and honor those veterans who lost their lives at the state-run facility during the COVID-19 pandemic. (1/2) https://t.co/RHbjLmU1Eo"
RepJoshG,1263471106985529344,2020-05-21 14:06:00,"...to nursing homes experiencing outbreaks of COVID-19 in North Jersey and across the country.

Medical personnel and staff at these facilities are working hard to protect residents, but many are out sick or are still recovering. (2/3)"
RepJoshG,1263122405389631488,2020-05-20 15:00:23,Robust testing throughout NJ is a key part to safely lifting restrictions and reopening our state. More info on testing sites will be made available soon. (2/2)
RepJoshG,1263122404315930628,2020-05-20 15:00:23,"18,000+ licensed NJ pharmacists have now been granted permission to administer coronavirus tests, as our state continues to expand testing. (1/2)
https://t.co/6hFyeYny4I"
RepJoshG,1262905991521341441,2020-05-20 00:40:26,"...which is key to our national security, and ways we can expand cooperation with Israel to help find a cure for COVID-19. Thank you to all who joined! (2/2)"
RepJoshG,1262804424747073537,2020-05-19 17:56:51,"These brave men and women have put themselves at risk and served honorably in responding to COVID-19, especially at our State Veterans Homes and long-term care facilities."
RepJoshG,1262789172064108550,2020-05-19 16:56:14,"During this #NationalEMSweek, let's take a moment to thank everyone on the front lines that are getting us through this pandemic. You are truly going above and beyond the call. #EMSWeek2020 https://t.co/bI2QmCkad1"
RepJoshG,1262491321958387712,2020-05-18 21:12:41,"This will help our families and workers, our frontline health care workers, and first responders, our local businesses, and our state, county, and local governments battle this crisis and recover. (2/2)"
RepJoshG,1262491276768882689,2020-05-18 21:12:30,"This weekend, I spoke with @WolfBlitzer about our fight to get critically-needed resources, economic assistance, and tax cuts to North Jersey — the eye of the COVID storm. (1/2) https://t.co/Dz7hWnuuIa"
