RepJoshG,1298732065010208771,2020-08-26 21:20:28,"Our brave veterans and their loved ones are overdue for answers and accountability — and that's exactly what @BillPascrell and I are fighting for, after 81 resident deaths at the state-run Paramus Vets Home from poor COVID-19 infection control. (1/2)

https://t.co/KFWe7T47xW"
RepJoshG,1298322361138241536,2020-08-25 18:12:27,"I will continue to fight for our communities, families, businesses, first responders, and frontline health care workers and ensure they have the continued support they need. (3/3)"
RepJoshG,1298279108007297025,2020-08-25 15:20:34,"Last week, I joined a bipartisan group of Members of Congress in two letters to urge House leadership to immediately return to the negotiating table to work on a fifth COVID-19 relief package. (1/2) 
https://t.co/qEKrD7gtYB"
RepJoshG,1297910180429127684,2020-08-24 14:54:35,I’m proud that the medical strike teams @BillPascrell and I pushed for are continuing to help mitigate the effects of coronavirus on our most vulnerable populations. (2/2)
RepJoshG,1297910175823802368,2020-08-24 14:54:34,"North Jersey has been in the eye of the COVID storm since the start of the pandemic and so have our long term care facilities. (1/2)
https://t.co/BqJnZbE4od"
RepJoshG,1297657638478655491,2020-08-23 22:11:04,"I will continue to fight for our communities, families, businesses, first responders, and frontline health care workers and ensure they have the continued support they need. (2/2)"
RepJoshG,1297608149189439489,2020-08-23 18:54:25,"Yesterday, I voted to pass the Delivering for America Act to save the U.S. Postal Service. We must do everything in our power to support the USPS and our local mail handlers–– including wearings masks! https://t.co/HIG9PEb8GV"
RepJoshG,1296897206876856320,2020-08-21 19:49:23,"It’s vital that we continue clawing back more resources to help our local community organizations respond and adapt to the COVID-19 crisis. That's why I was proud to host a non-profit grant roundtable over zoom this week. (1/2)
https://t.co/ZmCBIrs5BL"
RepJoshG,1296870951234215937,2020-08-21 18:05:04,"I'm proud that with a great deal of cooperation — from across the aisle and from every corner of this great State — we are all able to ensure our communities, families, businesses, first responders, and frontline health care workers have the continued support they need. (2/2)"
RepJoshG,1296107343999127552,2020-08-19 15:30:45,"With more schools, students, families, and businesses working and learning online right now because of COVID-19, we must ensure they have access to the high-speed broadband internet they need especially in Warren and Sussex Counties. (1/2)
https://t.co/ywxeDgH8Za"
RepJoshG,1296079426489376769,2020-08-19 13:39:49,"Join me today, 8/19 at 1:00 PM for a Facebook Live ""Cup of Joe with Josh"" Virtual Town Hall — where I'll be answering your #COVID19 questions. Send your questions to coronavirusNJ5@mail.house.gov https://t.co/BXbDHVI0NQ"
RepJoshG,1295449402035843072,2020-08-17 19:56:20,"It is vital that we break the logjam between the two parties and get negotiators back in the room to help our nation's response to the COVID crisis, from helping those who’ve lost their job, to small businesses, to schools, to testing. 
https://t.co/N0mwJnSzqr"
RepJoshG,1295080978617171968,2020-08-16 19:32:21,"As we work through this pandemic together, we must continue to be wary of price gouging. If you are aware of any price gouging occurring, visit: https://t.co/pz9c0WKYVs to file a complaint.

https://t.co/ub60vLrKeW"
RepJoshG,1294366399750709249,2020-08-14 20:12:52,"Thank you to our doctors, nurses, EMTs, lab technicians, volunteers, hospital staff, and faculty for sacrificing so much to get us through this pandemic — we are all truly grateful. @AtlanticHealth"
RepJoshG,1294366398425239558,2020-08-14 20:12:52,"I was proud to take part in naming the entrance to the Newton Medical Center ""Heroes Way,"" to honor our health care heroes during #COVID19. 

https://t.co/beQzXiKjPX"
RepJoshG,1294040300084764679,2020-08-13 22:37:04,"The CEO of Paramus Veterans Home must step down. 

After 81 deaths at the state-run facility, we demand accountability for these documented failures — especially as we know that a resurgence of coronavirus later this year remains a threat. https://t.co/oUkEcw95D7"
RepJoshG,1293687039498637318,2020-08-12 23:13:20,"By clawing back more to NJ, we’re lifting significant expenses off of our town budgets and helping provide tax cuts to our families — all by getting resources and equipment to help our towns manage crises like storm aftermath and the current pandemic, ..."
RepJoshG,1293652044964941826,2020-08-12 20:54:17,"What happened at the Paramus Veterans Home can never happen again. That's why I've introduced the Nursing Home Pandemic Protection Act, called for the National Guard and VA to assist... (1/2)
https://t.co/9A4FM1jjSl"
RepJoshG,1293288000693075968,2020-08-11 20:47:42,"NJ food banks have seen much higher demand due to COVID-19, which is why I helped pass bipartisan legislation to get more investment to food banks and meal programs to help our local communities. (2/2)"
RepJoshG,1292942290659442691,2020-08-10 21:53:58,"Knowing a resurgence of COVID-19 later this year remains a threat, there must be accountability now for these documented failures. 

Our veterans and seniors deserve better."
RepJoshG,1292942288788893698,2020-08-10 21:53:58,"In Paramus, the pandemic exposed the known deficiencies at the facility. 

The situation demanded transparency, honesty, cooperation, and competency."
RepJoshG,1292942287698374661,2020-08-10 21:53:57,"Today, @BillPascrell &amp; I demanded that the CEO of the state-run New Jersey Veterans Home in Paramus resign.

As coronavirus swept through NJ, mismanagement &amp; a lack of communication &amp; transparency at the state-run facility resulted in preventable tragedy.

https://t.co/phu9kZhGwK"
RepJoshG,1292914288626216969,2020-08-10 20:02:42,"NJ food banks have seen much higher demand due to COVID-19, which is why I helped pass bipartisan legislation to get more investment to food banks and meal programs to help our local communities. https://t.co/lIT8hbOyzt"
RepJoshG,1292901112471785472,2020-08-10 19:10:20,"North Jersey students have dealt with a lot over these past few months — and this is a great read on how they've gotten through it. 

We were in the eye of the COVID storm from early on &amp; it's inspiring to see how much of our community has come together.

https://t.co/mVMSW7f0sK"
RepJoshG,1292581036963110913,2020-08-09 21:58:28,"As I saw at the state-run Paramus Veterans Home, the spread of #COVID19 into long-term care facilities has been one of the great tragedies of this pandemic. (1/2)

https://t.co/H7fTEcZeFX"
RepJoshG,1292511813658181635,2020-08-09 17:23:24,"Are you a veteran in North Jersey having issues accessing VA benefits, health care, or other federal resources? 

I am dedicated to helping assist #NJ5 vets with issues you may be having.

To get help with a federal agency, click here to get started: 
https://t.co/xfn1RlXGV9"
RepJoshG,1292177366593277955,2020-08-08 19:14:26,"THREAD: 

These findings are damning beyond all measure, and confirm what we’ve feared. 

The spread of COVID-19 into nursing homes and long-term care facilities is one of the great tragedies of this pandemic, ... (1/4)

https://t.co/lrku8ZYSD6"
RepJoshG,1291555735910912005,2020-08-07 02:04:18,"It's absurd to say the House is blocking a COVID relief package over SALT, when we passed a bill *more than 2 months ago* to get American families &amp; businesses relief AND fully reinstate SALT — all while the Senate hasn't passed a single COVID bill since.

https://t.co/GqxOxiYcn0"
RepJoshG,1291089701630365696,2020-08-05 19:12:26,"But I'm making sure we're fighting to claw more resources back for our communities — for our families, small businesses, health care workers, nonprofits, schools, and first responders. (3/3)"
RepJoshG,1291038847204315138,2020-08-05 15:50:22,We must get real tax cuts to help rescue Jersey families from this health and economic crisis and reinstating SALT is the right way to help get that done. (3/3)
RepJoshG,1291038846499553281,2020-08-05 15:50:22,"The coronavirus outbreak has hit NJ hard for months now — impacting our families, jobs, incomes, and local business owners. (2/3)"
RepJoshG,1290347339056652288,2020-08-03 18:02:33,"Our federal bipartisan legislation has brought tax dollars to every NJ-5 county and each of our 79 towns through direct payments to families, PPP $ to small businesses, federal unemployment enhancements, &amp; direct grants to local hospitals, first responders, and food banks. (2/2)"
RepJoshG,1290281728292995073,2020-08-03 13:41:50,"Our federal bipartisan legislation has brought tax dollars to every NJ-5 county and each of our 79 towns through direct payments to families, PPP $ to small businesses, federal unemployment enhancements, &amp; direct grants to local hospitals, first responders, and food banks. (2/2)"
RepJoshG,1290078892196130817,2020-08-03 00:15:51,"As we head into this week, I'm confident a bipartisan deal will be reached with both Republicans and Democrats so we can fight this resurgance of COVID-19, help our economy, and our country. (2/2)"
RepJoshG,1290078891025920000,2020-08-03 00:15:50,"We need to work together regardless of party lines to battle this pandemic and provide economic relief for all Americans.

Period. (1/2)

https://t.co/hwJ6cG3BhM"
RepJoshG,1289648727196606464,2020-08-01 19:46:31,"...report #COVID19 cases to the CDC, keep families informed, communicate with family members, and have crisis plans in place, and maintain a stockpile of PPE. (2/3)"
RepJoshG,1289648726215024640,2020-08-01 19:46:31,"As we head into the fall during this pandemic, we must keep our veterans and vulnerable populations healthy and safe. In Congress, I've introduced the Nursing Home Pandemic Protection Act that requires all long-term care facilities... (1/3)
https://t.co/zo4w5FFsgB"
RepJoshG,1289606623539822592,2020-08-01 16:59:13,"This week, we heard some GREAT news: The Valley Hospital in Ridgewood recently reported no new coronavirus patients. Thanks to all the front-line health care workers there who are making these recoveries possible!
https://t.co/tuQcGJbtMk"
RepJoshG,1289242980847513603,2020-07-31 16:54:14,What I'm focused on in Washington is securing critical resources in this next coronavirus package to ensure that they have the PPE available to do their jobs safely and effectively — and that we are prepared in NJ. (2/2)
RepJoshG,1289242979576684546,2020-07-31 16:54:13,"Yesterday, I held a health care roundtable with nurses, doctors, and health officials from the Fifth District to hear their concerns about COVID-19 and preparation for the fall. (1/2)
https://t.co/h5lX6GmsfW"
RepJoshG,1288956998382387200,2020-07-30 21:57:50,"3) Improve the U.S. manufacturing supply chain to address challenges caused by COVID-19;

4) Prioritize clean and lead-free school drinking water for our kids."
RepJoshG,1288913125366956037,2020-07-30 19:03:30,"Our federal bipartisan legislation has brought tax dollars to every NJ-5 county and each of our 79 towns — thru direct payments to families, PPP $ to small businesses, federal unemployment enhancements, &amp; direct grants to local hospitals, first responders, and food banks."
RepJoshG,1288658042112933889,2020-07-30 02:09:54,"The coronavirus outbreak has been hitting North Jersey hard for five months now — impacting our families, jobs, incomes, and local business owners.

We must get real tax cuts to help rescue Jersey families from this health and economic crisis. (2/2)"
RepJoshG,1288658040661643264,2020-07-30 02:09:53,I just listened to the Senate Majority Leader's interview with @JudyWoodruff tonight &amp; he complained about the House's most recently-passed COVID bill including a reinstatement of our SALT deduction — at a time when NJ families need dollars in their pockets more than ever. (1/2)
RepJoshG,1288534815105593344,2020-07-29 18:00:14,"Our federal bipartisan legislation has gotten dollars to every NJ-5 county and each of our 79 towns — thru PPP $ to small businesses, direct payments to families, federal unemployment enhancements, &amp; direct grants to local hospitals, colleges, food banks, and non-profit orgs."
RepJoshG,1288281931436695553,2020-07-29 01:15:22,"- Bergen County has received an estimated $2.38 billion with 20,341 cases in the entire county.

- Passaic County has received an estimated $122 million with 17,348 cases in the entire county."
RepJoshG,1288281930631385089,2020-07-29 01:15:22,"Estimates based on public data — of the communities within the Fifth District:

- Sussex County has received an estimated $277 million with 1,286 cases in the entire county.

- Warren County has received an estimated $216 million with 1,321 cases in the entire county.

and"
RepJoshG,1288118333674463232,2020-07-28 14:25:17,"Join me today, 7/28 at 11:30 AM for a Facebook Live ""Cup of Joe with Josh"" Virtual Town Hall — where I'll be answering your #COVID19 questions. Send your questions to coronavirusNJ5@mail.house.gov https://t.co/QBAgLUa783"
RepJoshG,1287842813548298242,2020-07-27 20:10:28,"Join me on Tuesday 7/28 at 11:30 AM for a Facebook Live ""Cup of Joe with Josh"" Virtual Town Hall — where I'll be answering your #COVID19 questions. Send your questions to coronavirusNJ5@mail.house.gov https://t.co/Sndf4o0gau"
RepJoshG,1287788776547328005,2020-07-27 16:35:44,"For many small businesses, the initial round of PPP has already been exhausted. 

With no clear end to the pandemic in sight, small businesses must be allowed to apply for a second round of #PPP to mitigate the damage to... (1/2)

https://t.co/mcG4NlEHUJ"
RepJoshG,1287434070071353344,2020-07-26 17:06:16,"The House has passed my provision to provide resources to the VA to investigate and ensure proper compliance at state-run veterans homes — including the state-run Paramus Veterans Home, where eighty-one residents and one staff member tragically died from the COVID outbreak. (1/2) https://t.co/4eWGCx4Akq"
RepJoshG,1287396551535603712,2020-07-26 14:37:11,"The House has passed my provision to provide National Guard members, who are serving on the frontlines of the #COVID19 pandemic, with at least two weeks of housing to be able to quarantine safely before returning home to their families &amp; communities. https://t.co/yMHA9e9qCf"
RepJoshG,1287113077519982593,2020-07-25 19:50:45,"My legislation will help fight global terror on social media platforms, to stand up for our brave military families &amp; their children, to support our National Guard as they work to get us thru this pandemic, to help North Jersey dairy farmers during this difficult time, ... (2/4)"
RepJoshG,1286711360261435392,2020-07-24 17:14:28,"Small biz continues to be impacted by #COVID19, they need more relief, &amp; our nation deserves greater transparency.

I'm leading a bipartisan call in Congress to allow small biz to apply for a second round of PPP &amp; for greater oversight into how these taxpayer $$ are disbursed. https://t.co/asZGrEgN3P"
RepJoshG,1286366796824678401,2020-07-23 18:25:18,"We need to protect everyone from this virus, especially our most vulnerable populations, and access to testing is the first step in doing so. (2/2)"
RepJoshG,1286366795893440516,2020-07-23 18:25:18,"We are finally seeing the Administration mandate COVID-19 tests for all nursing home staff and provide the proper funding for those tests — something I've been calling for since April. (1/2)
https://t.co/yhUVlTTLgi"
RepJoshG,1286030892805296140,2020-07-22 20:10:32,"...so our local economies can survive, more resources for PPE, direct assistance to families, and more protective equipment for our frontline health care workers. (2/2)"
RepJoshG,1286030764803534851,2020-07-22 20:10:02,"This morning, I joined @SRuhle on @MSNBC to discuss what we need in the next COVID-19 relief bill. It must include help for states and local municipalities... (1/2) https://t.co/SUCu0YtiMM"
RepJoshG,1285991360257044486,2020-07-22 17:33:27,"These brave service members have put their health on the line for our communities, so the last thing they should have to worry about is a place to quarantine safely without putting their families and communities at risk. (2/2)"
RepJoshG,1285991359342694400,2020-07-22 17:33:27,"I'm proud that the House passed my provision to protect our National Guard on the front lines of COVID-19 by providing them two weeks of housing to quarantine safely before returning to their families and communities. (1/2)
https://t.co/CeveoEVAJD"
RepJoshG,1285957037009117185,2020-07-22 15:17:04,"While I’m glad the Department of Justice is taking strong action in this case, we must do much more to deter these intrusions that threaten our national security and public health. (2/2)"
RepJoshG,1285957035784364032,2020-07-22 15:17:03,"Hackers backed by authoritarian governments including China, Iran, and Russia continue to try to steal sensitive information from Americans and our companies —including valuable research that could lead to a cure for COVID. (1/2)

https://t.co/LApdC4UQ39"
RepJoshG,1285671239927963648,2020-07-21 20:21:24,"The House is voting on legislation that includes my provisions to:

1) Combat terrorists like Hamas and Hezbollah from using social media;

2) Protect National Guard from COVID-19; .... https://t.co/7f7Ke1hL6n"
RepJoshG,1285640778275053570,2020-07-21 18:20:22,"...American citizens and companies – including trying to steal research that could cure COVID.

We must do more to thwart these attempted attacks on our national security and public health. (2/3)"
RepJoshG,1285597414951399424,2020-07-21 15:28:03,"This is unacceptable. We need a new package now that gets supplies to hard-hit areas like New Jersey and prepares us for the Fall. This shouldn't be political. Our frontline health care workers need every resource to stop this virus.
https://t.co/pVbZvkIw8C"
RepJoshG,1285370126066483201,2020-07-21 00:24:53,We must continue responding to this emergency and we need the full force of the federal government to increase testing &amp; manufacturing of PPE. (2/2)
RepJoshG,1285370124137005064,2020-07-21 00:24:53,I'm joining the entire NJ House delegation in asking @HHSGov Sec. Azar to extend the current public health emergency as #COVID19 continues to spread throughout our nation. (1/2) https://t.co/8hIsQySMmS
RepJoshG,1284979767268311047,2020-07-19 22:33:44,"Coronavirus cases continue to increase across the country, and we need more funding for contact tracing and testing, not less. (1/2)
https://t.co/MmnwHaeT5Y"
RepJoshG,1284914434230624262,2020-07-19 18:14:08,"Whether it's fighting for women’s healthcare or equal pay, the fight for equality is not over. (2/2)"
RepJoshG,1284161879250804738,2020-07-17 16:23:45,"I'm helping introduce this new bipartisan bill to help provide safe places for those infected to self-isolate during the coronavirus pandemic, especially those who aren’t able to quarantine in their own homes, like frontline health care workers and first responders. (1/2) https://t.co/tKhnW0UaUU"
RepJoshG,1283848826663710727,2020-07-16 19:39:47,"We are one step closer to ensuring children are safer on school buses throughout our country, with the House passing the safety provisions I originally introduced to get three-point lap-and-shoulder seatbelts on all our school buses. (1/2)

https://t.co/LV5pBSiCKU"
RepJoshG,1283439823097913344,2020-07-15 16:34:33,"...social distancing is not practicable.

Please stay safe, wear a mask, &amp; wash your hands."
RepJoshG,1283160801558355973,2020-07-14 22:05:49,"HOMETOWN HERO SPOTLIGHT: 

Thank you to Rabbi Chanoch Kaplan — a staple in the Franklin Lakes area community as a Rabbi for more than 20 years. During the pandemic, Rabbi Kaplan organized the Chabad of Northwest Bergen County to donate food, N95 masks, &amp; items to those in need. https://t.co/D7wXMskMit"
RepJoshG,1282734315076493313,2020-07-13 17:51:07,"Also, within 24 hours, Sal received $7,500 in donations for gloves and masks for frontline health care workers. Sal, thank you for supporting our community — you are a true Hometown Hero! #NJ5HometownHeroes (2/2)"
RepJoshG,1282734311318392833,2020-07-13 17:51:06,"Thank you to Salvatore Reina from Glen Rock, the owner of Francesca’s Brick Oven Pizza &amp; Pasta for 12 1/2 years. During the pandemic, Sal bought gift certificates to help local Glen Rock businesses and created a raffle on his Facebook page. (1/2) https://t.co/cpAecc4BJe"
RepJoshG,1282713068548521984,2020-07-13 16:26:41,"The Bergen County CARES Small Business Grant program opens today, July 13th. If your business was forced to close to help stop the spread of COVID-19, you may be eligible to receive up to $10,000 in financial relief to cover rent, property mortgage payment, and utilities. (1/2)"
RepJoshG,1282115435291451392,2020-07-12 00:51:54,"It's been a difficult few months in North Jersey, with so many lives lost — but our incredible frontline workers at @HolyNameMedCtr and other #NJ5 hospitals helped save so many more. 

This is incredible news. 

#JerseyStrong

https://t.co/A4nyPfZUy7"
RepJoshG,1281751626634665984,2020-07-11 00:46:16,"We must continue to ensure our frontliners have everything they need as we work through this pandemic. Thank you to everyone involved, and thank you to our frontliners working so hard to keep us safe and healthy. (2/2)"
RepJoshG,1281751527351255040,2020-07-11 00:45:52,I was proud to join North Jersey community members and volunteers in donating more than 270 KN95 masks to frontline health care workers at the Buckingham Care &amp; Rehabilitation Center in Norwood. (1/2) https://t.co/Li6oy0oNNE
RepJoshG,1281629906120712192,2020-07-10 16:42:35,"Thanks to all the doctors and frontline health care workers who cared for Michael. We are truly grateful for all these incredible efforts for Michael and so many others. To Michael and Elana, you are true Hometown Heroes! #NJ5HometownHeroes (3/3)"
RepJoshG,1281629905353048064,2020-07-10 16:42:35,"After a long fight while on a ventilator, he beat the virus and was welcomed home to a massive homecoming ceremony in April thanks to his wonderful wife, Elana. I'm thrilled that Michael is continuing to recover from the coronavirus with his loving family. (2/3)"
RepJoshG,1281629901880205314,2020-07-10 16:42:34,HOMETOWN HERO SPOTLIGHT: Congratulations to Michael and Elana Goldsmith for being Hometown Heroes! Michael Goldsmith was diagnosed with coronavirus on March 15 and was admitted to @HMHNewJersey on March 18. (1/3) https://t.co/9CF6GJqYnc
RepJoshG,1281306500741431297,2020-07-09 19:17:29,Thank you to all the community volunteers who helped put this together and to our frontline health care workers who sacrifice so much every day to keep us healthy. (3/3)
RepJoshG,1281306500003176449,2020-07-09 19:17:29,"As we continue to fight this virus, it’s imperative that we make sure our frontliners have the necessary equipment they need. (2/3)"
RepJoshG,1281306498828767233,2020-07-09 19:17:29,"Today, members of the North Jersey community and I helped deliver more than 270 KN95 masks to frontline health care workers at the Buckingham Care and Rehabilitation Center in Norwood. (1/3) https://t.co/vpd9k5SoHN"
RepJoshG,1280914114001408000,2020-07-08 17:18:17,"Proud to see that @BDandCo — here in #NJ5 — is partnering with the federal government for a mass vaccination campaign that will produce millions of needles and syringes for a potential COVID-19 vaccine. (1/2)
https://t.co/IgRDgCh6EV"
RepJoshG,1280876077032902659,2020-07-08 14:47:08,"We've clawed back $135,000+ in federal dollars to help #NJ5 firehouses &amp; EMS fight COVID-19 and lower our taxes — investment allocated thru the bipartisan #CARESAct.  (1/2)

Read more here:

https://t.co/K7rkfVncp2"
RepJoshG,1279902527186665478,2020-07-05 22:18:36,"They have volunteered their time at all times of the day and night. Throughout the pandemic, they have literally put their lives on the line to answer a call from someone who could have the virus and is in need of help. (2/3)"
RepJoshG,1279902525089624072,2020-07-05 22:18:36,"HOMETOWN HERO SPOTLIGHT: Big shout out to the Waldwick Volunteer Ambulance Corps who has spent countless hours responding to the calls of the community for their urgent health needs, especially on the front line during this pandemic. (1/3) https://t.co/9wnfL9fpP3"
RepJoshG,1279861392678453249,2020-07-05 19:35:09,Chief Wanous was someone that did the work that needed to be done and was always ready to lend a hand. Thank you to everyone who attended and let's continue to thank our frontline first responders and frontline healthcare workers for everything they continue to do. (2/2)
RepJoshG,1279527357074857984,2020-07-04 21:27:49,"Happy Independence Day, #NJ5! 

Today, we honor the brave men and women who are serving and have served to protect and defend our freedoms, and we honor all those who have served to keep us safe and healthy these past few months. https://t.co/1yOVGSdvN2"
RepJoshG,1278751715743973381,2020-07-02 18:05:41,...and residents in #NJ5 for their dedication to helping their neighbors during the pandemic. Thank you to everyone who attended our virtual Coronavirus Hometown Heroes event — the community is truly grateful for all that you do! #NJ5HometownHeroes (2/2)
RepJoshG,1278751714770812930,2020-07-02 18:05:41,"Last weekend, I was proud to honor more than 100 frontline health care workers and first responders, veterans, students, search and rescuers, life-saving bystanders, volunteers, teachers, community leaders... (1/2)
https://t.co/fQsuYZ5jRQ"
