RepRonEstes,1241064802518269953,2020-03-20 18:11:21,"🇺🇸AMERICANS are #InItTOGETHER combating #COVID19.

🏥Health care workers on the frontlines
🌾Ag producers feeding the world
🧻Workers stocking shelves &amp; delivering goods
⚙️Companies offering manufacturing support
👋Americans using social distancing
🏛Congress providing stability"
RepRonEstes,1241040781114310659,2020-03-20 16:35:54,The impact of the COVID-19 outbreak on American commerce will be felt by small businesses. The @SBAgov will continue to back small biz. owners &amp; their employees – join SBA Admin. @SBAJovita Carranza at 1:30 today to discuss #COVID-19 relief. #InItTogether https://t.co/XGKx4I7Lpm
RepRonEstes,1241029549275611136,2020-03-20 15:51:16,"March is Women’s History Month. Today we highlight Kansas-native Emily Morgan, called the “Angel of Yukon” during Alaska’s diphtheria epidemic. #kansashistory #womenshistorymonth Find out more on my Facebook page: https://t.co/FLwNO2f3Is https://t.co/HraB7xYJar"
RepRonEstes,1240748702148571136,2020-03-19 21:15:17,"RT @SenateGOP: To the health care workers on the frontlines.

To postal carriers, truck drivers &amp; supermarket employees.

To those staying…"
RepRonEstes,1240734760013574145,2020-03-19 20:19:53,"RT @WhiteHouse: We're ALL at risk of transmitting Coronavirus. 

Help protect the most vulnerable—do your part, slow the spread. 

Learn mo…"
RepRonEstes,1240690770484449280,2020-03-19 17:25:05,"This morning's #coronavirus briefing was encouraging as the FDA, scientists, medical professionals, &amp; innovators are working around the clock to develop &amp; approve safe &amp; effective anti-viral treatments. This is only possible because of unleashed American ingenuity. #InItTogether"
RepRonEstes,1240682561329868801,2020-03-19 16:52:28,Last night @realDonaldTrump signed into the law the Families First #Coronavirus Response Act. #InItTogether https://t.co/Ns07qmAQTT
RepRonEstes,1240648450045292544,2020-03-19 14:36:55,RT @HHSGov: HHS announced a historic expansion of telehealth access to combat COVID-19. Read more: https://t.co/jXhACAWrFa https://t.co/Ah7…
RepRonEstes,1240039129339047939,2020-03-17 22:15:41,"RT @WaysandMeansGOP: Every American can play a part in helping to ""flatten the curve"" of #coronavirus. Learn how and why it's so important.…"
RepRonEstes,1240025696845672455,2020-03-17 21:22:19,This morning @realDonaldTrump announced the expansion of Medicare's telemedicine coverage – great news for seniors needing to review new or ongoing health care concerns with their medical providers without potential exposure to #COVID19. https://t.co/zfkrnpgQJF
RepRonEstes,1239976290599358465,2020-03-17 18:05:59,RT @WaysandMeansGOP: #SocialDistancing is a powerful tool that is CRITICAL in fighting #coronavirus and keeping American families and worke…
RepRonEstes,1239718807016538122,2020-03-17 01:02:51,"Two weeks ago, Congress passed the first emergency funding bill in response to COVID-19. I'm glad that $5.9 million in funding will go directly to the state of Kansas. https://t.co/WCO2koNENZ"
RepRonEstes,1239658483575853057,2020-03-16 21:03:08,"(4/4) We are working together – federal and state, private and public, Republicans and Democrats – to tackle the spread of this virus, and all Americans can do their part by following the CDC guidelines. https://t.co/xvLeYPaTdB"
RepRonEstes,1239658480061108225,2020-03-16 21:03:08,"(2/4) That includes avoiding gatherings greater than 10 over the next 15 days. The developments of anti-viral therapies &amp; a vaccine are moving rapidly, we are strengthening the supply chain to ensure health care professionals have supplies &amp; testing capabilities continue to grow."
RepRonEstes,1239658477460566017,2020-03-16 21:03:07,"Today the #coronavirus task force outlined bold guidelines to further contain &amp; mitigate the virus while recognizing the ingenuity &amp; compassion of the American people. Now is the time to pull together as Americans, take these guidelines seriously, &amp; care for one another. (1/4)"
RepRonEstes,1239631411998531584,2020-03-16 19:15:34,Here's some good news to start the week. Canada became the final country to ratify the U.S.-Mexico-Canada Agreement Friday. This is encouraging in the midst of COVID-19. https://t.co/Yd4D1ePHwA
RepRonEstes,1238694111500292096,2020-03-14 05:11:04,"(4/5) The bill is not perfect, but it helps Kansas families now and in the near future, and compliments the unprecedented actions the president already took this week to mitigate the health and economic impact of this pandemic."
RepRonEstes,1238694109843468289,2020-03-14 05:11:04,"(3/5) Thankfully, we’ve been able to work together to limit the size and scope of this legislation so that it actually benefits those impacted by the coronavirus."
RepRonEstes,1238694108295835651,2020-03-14 05:11:03,(2/5) These are priorities for the president and for Congress. My colleagues and I fought against the majority’s desire to expand this bill well beyond the bounds of the COVID-19 outbreak and play politics with the lives of the American people.
RepRonEstes,1238694104843902978,2020-03-14 05:11:03,"In the early morning hours, the House finally voted on a relief package that ensures Americans have access to free COVID-19 testing and financial relief for those who are ill, quarantined, or caring for others due to the coronavirus. (1/5)"
RepRonEstes,1238558671841497090,2020-03-13 20:12:53,"Kansans rely on broadband and telephone for access to their community. Due to the recent COVID-19 outbreak, more people are working from home and taking classes online. I want to thank @FCC Chair and fellow Kansan @AjitPaiFCC for keeping Kansans connected. https://t.co/I0IkYsch1O"
RepRonEstes,1238457753393299459,2020-03-13 13:31:52,"Free &amp; fair trade strengthens our country &amp; our partners around the world. @USTradeRep’s decision to grant tariff exclusions on Chinese medical products like gloves, face masks, surgical drapes, etc. comes at a critical time. I commend the admin. for yesterday’s announcement."
RepRonEstes,1238285172249853953,2020-03-13 02:06:05,"(2/2) You can see some of those items, as well as a list of resources and CDC preventative measures, at https://t.co/IbZAmx67Zt."
RepRonEstes,1238285169859211265,2020-03-13 02:06:05,"As we work today and tomorrow on further legislation that helps affected Americans during this time, government agencies and employers have continued tackling the health and economic impacts of the COVID-19 virus. (1/2)"
RepRonEstes,1237938223353073664,2020-03-12 03:07:26,Tonight @realDonaldTrump addressed the nation regarding COVID-19. Read my full response below. https://t.co/y0RaVjp86F
RepRonEstes,1237746267050201094,2020-03-11 14:24:40,@ACUConservative is following CDC guidelines and working closely with health officials. I’m glad that no new cases have been confirmed since the event. @mschlapp and his team have done a good job handling this difficult situation as well as providing regular updates to attendees. https://t.co/JyViQ58SwV
RepRonEstes,1237532782621945856,2020-03-11 00:16:22,"(3/3) HHS is working closely with state and local health officials, and Congress has provided the necessary funding to ensure the needs are met at the @CDCgov and other federal and local health agencies. https://t.co/YVfopgjbIE"
RepRonEstes,1237532778071113730,2020-03-11 00:16:21,"(2/3) We've developed a number of partnerships in that time, and advancements in medicine and therapies that once took years only take a matter of months. Our preparation and continued research have helped us better tackle COVID-19. https://t.co/XLJjMwmfHb"
RepRonEstes,1237532773570625537,2020-03-11 00:16:20,"This morning I visited the @HHSGov #Coronavirus Response Center for a briefing by @SecAzar and other officials. In the nearly two decades since the SARS epidemic, I asked what we've learned and how that shapes our preparedness today. (1/3) https://t.co/StMas4ZrXX"
RepRonEstes,1237394928616869891,2020-03-10 15:08:35,Today I’m at the @HHSgov Coronavirus Command Center getting the latest updates from @SecAzar and other officials on the Trump administration’s response to the COVID-19 outbreak. I’ll have details to share later today. https://t.co/aErASqJQLB
RepRonEstes,1235616380839485440,2020-03-05 17:21:16,"Our country continues to address the threat of COVID-19. While we work to ensure Kansans are safe, the CDC reminds us that you can take steps to help prevent the spread of respiratory diseases. These simple yet effective measures can help keep you and your family healthy. https://t.co/yS5Sv4Ij7F"
RepRonEstes,1233174502399512579,2020-02-27 23:38:07,@SecAzar @DrJeffColyer @HHSGov I also asked how @HHSgov will assist rural hospitals and patient-care centers in handling coronavirus: https://t.co/Dt54ZszBkj
RepRonEstes,1233174013293232128,2020-02-27 23:36:10,@SecAzar @DrJeffColyer @HHSGov I had the opportunity to ask @SecAzar to outline his plans to make rural health care a major initiative at @HHSgov: https://t.co/nCL3CkP0Dr
RepRonEstes,1233077983704993798,2020-02-27 17:14:35,"In his opening statement, @SecAzar announced that former Kansas Governor @DrJeffColyer will be Chairman of the National Advisory Committee on Rural Health and Human Services. @HHSGov will benefit from his knowledge of rural America and his experience in the medical field. https://t.co/86oiU8nU1J"
RepRonEstes,1219771270788796416,2020-01-21 23:58:27,"(2/2) Today, laid-off workers from any industry can visit https://t.co/6JUdwqQpUs to discover information on finding a job, training, education, community resources, health care and more. Together we are working to keep our world-class workforce here in KS. #AirCapitaloftheWorld"
RepRonEstes,1206718127259738112,2019-12-16 23:29:55,(2/2) We owe it to our veterans to fulfill the promises that were made when they enlisted. Today's ribbon-cutting exhibits the dedication of our community to thanking our veterans through quality health care in Wichita. #WheresRon https://t.co/CqUbfuU3bL
RepRonEstes,1205985965854121984,2019-12-14 23:00:35,"(2/3) First place winner Abir Haque’s Bangla Alphabet App helps English speakers develop literacy in Bengali, while the second-place team of Judah Hansen and Jessica Ta entered their app Bloom, which encourages a healthy sleep schedule. https://t.co/fvIwVjS79a"
RepRonEstes,1196799999432183809,2019-11-19 14:38:49,"For a 2nd week, this is the scene outside our @WaysandMeansGOP room as it’s used for impeachment instead of key committee work like passing USMCA &amp; lowering health care costs. How long will this impeachment media circus keep our committee &amp; Congress from doing work we need to do? https://t.co/YVtsaz6f66"
RepRonEstes,1195468602901696514,2019-11-15 22:28:20,"The rules announced today by President Trump provide needed transparency in health care costs, empowering patients and allowing families to plan for the future. 

Read my full statement: https://t.co/Bw2QjUCQy4 https://t.co/XRaeEFfQFW"
RepRonEstes,1195365666360037376,2019-11-15 15:39:18,"RT @knssradio: The USMCA trade deal, health care, and impeachment https://t.co/aga7gxVakl via @knssradio"
RepRonEstes,1191457325699227648,2019-11-04 20:48:57,"I applaud the Trump administration for recently unveiling this life-saving resource for substance use disorders and mental health. There are numerous facilities throughout #KS04 ready to help, including COMCARE of Sedgwick County. Learn more at https://t.co/FsGo4o9IJS. https://t.co/Rgai1jsxIk"
RepRonEstes,1181563130293424130,2019-10-08 13:32:57,"RT @DerbyInformer: U.S. Congressman Ron Estes discusses why improving health care throughout the District remains a top priority.

https://…"
RepRonEstes,1177275634168619008,2019-09-26 17:35:58,"RT @ahcancal: Two Congressmen making a difference: @RepDwightEvans and @RepRonEstes.

It's time more lawmakers started taking the health ca…"
RepRonEstes,1172212201257615360,2019-09-12 18:15:42,"I’ve enjoyed meeting with members of the @KansasChamber this week in Washington and discussing top priorities like passing the #USMCA,  improving health care, and growing the economy in Kansas and our country. #ksleg #WheresRon https://t.co/gKL2h6Hj1h"
RepRonEstes,1171511954260709378,2019-09-10 19:53:10,"RT @FRCdc: For the first time in years, the House minority held a #prolife hearing in open defiance of Speaker Pelosi. 
""Not only would [De…"
RepRonEstes,1171426519350165505,2019-09-10 14:13:40,"Today, House Republicans are holding a hearing on the Born Alive Abortion Survivors Protection Act. While Speaker Pelosi has blocked a vote on this life-saving and common sense bill 80 times, I joined @FRCdc to discuss why it's important. #EndInfanticide 
https://t.co/NyR3dd8Qwf"
RepRonEstes,1171164766628454407,2019-09-09 20:53:34,"As Congress returns to Washington today, I’m grateful for the recent district work period during which I enjoyed meeting with farmers, ranchers, health care providers, veterans, small businesses, and everyday Kansans across the Fourth District. #WheresRon https://t.co/SyGDKft15K"
RepRonEstes,1169276518733885441,2019-09-04 15:50:20,"A significant cost of health care continues to be drug prices, which is why I’m pursuing options to address the issue like H.R. 803 – the Improving Transparency and Accuracy in Medicare Part D Spending Act. (1/2) https://t.co/hCxhIYm0W4"
RepRonEstes,1169011747900067842,2019-09-03 22:18:14,"I enjoyed learning how EagleMed in Wichita transports patients from crash sites or rural hospitals throughout the state in difficult conditions, as well as the challenges the company and patients face when it comes to billing and paying for this life-saving service. #WheresRon https://t.co/NBVuHgtRjy"
RepRonEstes,1165027979702996992,2019-08-23 22:28:10,I continued to talk about the future of health care today as I toured the proposed Kansas College of Osteopathic Medicine at Kansas Health Science Center. It will help bring more economic development to #KS04 and continue filling the demand of doctors in rural Kansas. #WheresRon https://t.co/6y3l5zVasp
RepRonEstes,1164624738280443906,2019-08-22 19:45:49,Second stop today to discuss improving health care at another rural hospital: Newton Medical Center. Our rural medical facilities work toward exceptional health care while facing new challenges. I value hearing from these health care providers firsthand. #WheresRon https://t.co/KWiRq2ZupW
RepRonEstes,1164589552121581578,2019-08-22 17:26:00,Providing exceptional health care closer to home is the goal of Rock Regional Hospital in Derby. It was great to tour this new facility and learn about their operations as a new medical center serving patients in south central Kansas. #WheresRon https://t.co/ZRIsrcTxYO
RepRonEstes,1164207689179832321,2019-08-21 16:08:37,"Ahead of National Senior Citizen Day, last night I enjoyed discussing issues important to seniors like retirement security, Social Security, health care and drug prices at a town hall meeting with the Association of Mature American Citizens (AMAC) in Wichita. #WheresRon https://t.co/aJBAOTbacR"
RepRonEstes,1151624545977151501,2019-07-17 22:47:42,"(2/2) I’m glad my colleagues realized the bad implications of the Cadillac tax and worked in a bipartisan way to repeal it. Instead of propping up the failed Obamacare through higher taxes and reduced choices, we must get serious about improving health care and our economy."
RepRonEstes,1151624540457459715,2019-07-17 22:47:41,"The House voted to repeal the Cadillac Tax today, a 40% tax intended as a way to help pay for Obamacare by targeting expensive employer health insurance plans. However, it would have been middle-class workers bearing the burden through higher income and payroll taxes. (1/2) https://t.co/fuVvdJVjAt"
RepRonEstes,1143199655947382786,2019-06-24 16:50:12,#MedicareForAll would devastate rural hospitals and take choices away from patients. Read more from my latest op-ed ⬇️ https://t.co/IEzphKVRC3
RepRonEstes,1141046048833572864,2019-06-18 18:12:32,"Kansas has the second largest number of rural critical access hospitals in the country. Under Democrats' #MedicareForAll, rural hospitals throughout the US would be devastated by slashing reimbursement rates 40%. Read more: https://t.co/CUi08OLwPE"
RepRonEstes,1141046045444575232,2019-06-18 18:12:31,"In addition to doubling taxes &amp; eliminating insurance plans for 158 million Americans, I joined @RepKevinBrady &amp; @WaysandMeansGOP to discuss why #MedicareForAll will devastate rural hospitals. Patients, families &amp; rural hospitals deserve better than one-size-fits-all health care. https://t.co/YY9f8j2uze"
RepRonEstes,1139572657366687744,2019-06-14 16:37:48,The Taxpayer First Act – a bipartisan IRS reform bill that modernizes its IT infrastructure &amp; emphasizes customer service – has passed the House &amp; Senate. I want to thank former Rep. Lynn Jenkins for her tireless work on this endeavor during her tenure. https://t.co/4j6owcDCV3
RepRonEstes,1138919878285516801,2019-06-12 21:23:53,"At a @WaysandMeansGOP  hearing today, I asked our expert witness what impact #MedicareForAll would have on rural hospitals.

Her response: ""It's very hard to see how most of them would be able to keep their doors open."" 

Learn more: https://t.co/hIyr8hh6F1 https://t.co/PWPwndWcCz"
RepRonEstes,1138852051583197185,2019-06-12 16:54:22,"Conclusion: One-size-fits-all, government-run health care like #MedicareForAll would..

🚨Eliminate choice
🚨Jeopardize rural hospitals
🚨Double taxes
🚨Increase wait times

Instead we need a system with more affordable options that allows people to choose the best plan for them."
RepRonEstes,1138852050693959681,2019-06-12 16:54:22,"Did you know the median wait time for patients in Canada to see a specialist is 19.8 weeks? In Britain, 1 in 5 cancer patients wait 2 months for treatment. In the US, look no further than wait times at the VA to see what government-run health care looks like in our own country."
RepRonEstes,1138852049158848512,2019-06-12 16:54:22,"Did you know Kansas has the second largest number of rural critical access hospitals in the country? Under #MedicareForAll, reimbursements to these hospitals would be slashed 40%, forcing many rural hospitals to close their doors."
RepRonEstes,1138852047737040896,2019-06-12 16:54:21,"Did you know 1.5 million Kansans would lose their private health insurance under #MedicareForAll, including 507,000 people in #KS04? https://t.co/TYigu7KvPM"
RepRonEstes,1138811036449103872,2019-06-12 14:11:23,"I look forward to discussing the disastrous impacts of #MedicareForAll in today's @WaysandMeansGOP hearing. Along with higher costs, less choice and longer wait times, Medicare for All would double everyone's taxes and eliminate private health insurance for 158 million Americans. https://t.co/tahSYdnaqJ"
RepRonEstes,1134235412313124864,2019-05-30 23:09:30,"Our local law enforcement plays a critical role in the safety of our community. I enjoyed sitting down with Harvey Co. Sheriff Chad Gay to discuss mental health, drug trafficking and legislation I’ve supported to address the opioid epidemic. #WheresRon https://t.co/gSzzQLGmSJ"
RepRonEstes,1134153316722778113,2019-05-30 17:43:16,"I visited Excel Industries in Hesston, a phenomenal manufacturer of Hustler Turf Equipment &amp; BigDog lawn mowers. While many recognize the name from the 2016 tragedy, Excel’s a thriving company with deep roots in our community since 1960 that showcases our talent in KS. #WheresRon https://t.co/MrOeqhanN9"
RepRonEstes,1133880186326437889,2019-05-29 23:37:57,Today in Wichita I discussed patient care and insurance challenges with patients and staff at Wesley Rehabilitation Hospital. (1/2) https://t.co/MOQ8062t77
RepRonEstes,1131330234358345728,2019-05-22 22:45:21,"Today I asked unanimous consent to bring the Born Alive Abortion Survivors Protection Act for a vote. Sadly, for the 49th time, House Democrats refused to consider the bill that would require health care practitioners care for a baby that’s survived a botched abortion. https://t.co/wPEPQyx4sA"
RepRonEstes,1128065482450460673,2019-05-13 22:32:24,"Today I had the opportunity to discuss mental health issues, drug addiction and criminal justice reform with @WichitaPolice Chief Gordon Ramsay and other WPD officers and staff. (1/3) https://t.co/6NL2vO7prj"
RepRonEstes,1126605726267342850,2019-05-09 21:51:51,"Instead of one-size-fits-all health care, states &amp; people deserve flexibility to have the most affordable &amp; quality care possible, while protecting pre-existing conditions. Dems should stop playing politics with misleading bill titles &amp; work w/ us on solutions to fix health care."
RepRonEstes,1126605725378203648,2019-05-09 21:51:50,"Today's vote has nothing to do with protecting pre-existing conditions (which Republicans have repeatedly called for and voted to protect). This bill is all about putting Washington in control of one-size-fits-all, government-run health care. https://t.co/OVJEjmFOaf"
RepRonEstes,1123244145097752576,2019-04-30 15:14:07,"RT @WaysandMeansGOP: ⚠️ Dangerous #SideEffects of Dems’ gov-controlled health insurance:
- 158M forced OFF their plan
- Higher taxes for wo…"
RepRonEstes,1123243763411890176,2019-04-30 15:12:36,"Today, House Democrats hold the first hearing on their government-run health care proposal that should be called Medicaid-for-All. In addition to eliminating all private health insurance plans, doubling all federal individual and corporate taxes would not be enough to pay for it. https://t.co/0txL60pSGo"
RepRonEstes,1121538244380897280,2019-04-25 22:15:29,"Two years ago, I had the great honor to be sworn-in to represent the people of the Fourth District of Kansas. Today, I continue to fight for limited government, quality and affordable health care, free and fair trade, and retirement security. https://t.co/cS1F69oFxq"
RepRonEstes,1119021417079558144,2019-04-18 23:34:30,"I enjoyed meeting with Sedgwick County Sheriff Jeff Easter and Sedgwick County DA Marc Bennett today in Wichita to discuss the First Step Act criminal justice reform bill we passed, as well as what we can do to address mental health issues in our community and country. #WheresRon https://t.co/f6N9dEpMyp"
RepRonEstes,1116776879061647360,2019-04-12 18:55:31,"Yesterday was #NationalPetDay. It was great to meet with men &amp; women in Wichita who make sure your dog, cat, or any other animal is healthy. We discussed various bills and challenges to the veterinary industry and the incredible medical advances to caring for your pet. #WheresRon https://t.co/2Z47ycqzsq"
