RepSusanWild,1258466386218754049,2020-05-07 18:39:02,"Proud to join this effort w/ @RepKClark &amp; our colleagues who know that investing in child care is a down payment on our future economy. 

We need to provide desperately needed relief to our child care industry hard hit by #COVID19 &amp; support affordable child care long term. https://t.co/5dzKwRK6q8"
RepSusanWild,1258427868897558532,2020-05-07 16:05:59,"Under the #CARESAct, we created a new temporary federal program called Pandemic Unemployment Assistance (PUA) which provides unemployment benefits to individuals not eligible for regular unemployment compensation. As of today, this system is up and running in PA! 

File⬇️ https://t.co/xPCIhqY7Te"
RepSusanWild,1258397169490571266,2020-05-07 14:03:59,RT @PennsylvaniaGov: #COVID19 has taken a financial toll on many Pennsylvanians. Apply for benefits at https://t.co/O0qvlenlPJ. https://t.c…
RepSusanWild,1258397033779662848,2020-05-07 14:03:27,"RT @GovernorTomWolf: Experts say wearing a mask lowers the chance of spreading #COVID19 to others.

That's why we're going to continue to a…"
RepSusanWild,1258176308024139778,2020-05-06 23:26:22,"Endangering the health care of millions in the middle of a pandemic is pure politics &gt; policy. Millions of Pennsylvanians rely on ACA protections &amp; in this extreme hour of need they cannot be ripped away. 

This lawsuit needs to be dropped.https://t.co/QBIumiq7Mk"
RepSusanWild,1258155710724136961,2020-05-06 22:04:31,"RT @UnitedWayGLV: 🌎 @RepSusanWild will be hosting a Racial Health Disparities conversation tomorrow that brings together health experts, po…"
RepSusanWild,1258125807110799361,2020-05-06 20:05:41,"In the face of this crisis, we turn to our health care heroes to get us through –– especially our nurses, who are working day in and day out, putting themselves at risk for OUR health and safety.

Happy #NationalNursesDay, #PA07. We are grateful for your service, now and always. https://t.co/u2DGVq7JBL"
RepSusanWild,1258117099509223427,2020-05-06 19:31:05,".@BetsyDeVosED, a pandemic has turned students' lives upside-down. We should be spending our time ensuring students have the support they need to succeed in school, not rolling back the rights of survivors.

Now is not the time to release the #TitleIX rule.https://t.co/kxG8B5lC0R"
RepSusanWild,1258098605346488325,2020-05-06 18:17:36,"In early April, the @CrisisTextLine reported a 47-116% increase in texts per day. 

This pandemic has made the mental health crisis even worse — especially among young people, whose futures have been upended. Let’s equip colleges to respond to this crisis.
https://t.co/zm1P0CeZKX"
RepSusanWild,1257739338399354881,2020-05-05 18:30:00,"Thanks to @RepJeffries for joining me yesterday to talk public health, the economy, &amp; priorities for the next federal #COVID19 relief package.

The only way we get through this crisis &amp; begin to rebuild is by listening to our communities &amp; working together.https://t.co/ZaYT1GtQ8U"
RepSusanWild,1257720462680850432,2020-05-05 17:15:00,"My mask protects you, your mask protects me.😷

Making sure all workers have access to the PPE (masks, hand sanitizer, thermometers, etc.) they need to stay safe is critical.

Get connected with Pennsylvanians who can lend a hand (or in this case, a mask)⬇️https://t.co/NGdrWDmkDj"
RepSusanWild,1257320596599271426,2020-05-04 14:46:04,"RT @GovernorTomWolf: As we begin to reopen Pennsylvania, we won’t risk all of the progress we’ve already made against #COVID19 through sacr…"
RepSusanWild,1257055549184753664,2020-05-03 21:12:52,"RT @GovernorTomWolf: You are #NotAlone this Mental Health Awareness Month.
 
I know #COVID19 makes life especially challenging. Resources a…"
RepSusanWild,1256324117470384128,2020-05-01 20:46:25,"Nearly half of Americans report that #COVID19 has negatively impacted their mental health. Just like washing our hands &amp; social distancing, caring for our mental health is absolutely essential.

Don’t be afraid to reach out for help. Your mental health matters. #MentalHealthMonth https://t.co/fUuAoU6Hkb"
RepSusanWild,1256299035352236032,2020-05-01 19:06:45,"Our postal workers are on the frontlines of this #COVID19 crisis – working diligently to serve our communities in need. For all of them, I’m proud to support the Protect Our Post Offices Act and get these workers the immediate emergency relief they deserve and save the USPS. https://t.co/GcmWNTt4Vt"
RepSusanWild,1256274644362985472,2020-05-01 17:29:50,"And the countless health care workers I’ve heard from across #PA07 who continue to put our most vulnerable first. We need to make sure that all our frontline health workers can receive the paid sick leave they need, so they never have to worry about coworkers coming in sick."
RepSusanWild,1256274640789479425,2020-05-01 17:29:49,"Throughout this #COVID19 crisis, I’ve heard from thousands of first responders, frontline medical professionals, teachers, small businesses owners, &amp; essential workers.
 
Today, I’m joining the @EdLaborCmte for a virtual forum to share your challenges, your stories, &amp; your needs."
RepSusanWild,1255869832286949378,2020-04-30 14:41:15,"RT @GovernorTomWolf: Unemployment compensation resources for PA'ians:
ℹ️ #COVID19 Guide: https://t.co/wq5TsKKSw7
😷 Pandemic Unemployment As…"
RepSusanWild,1255259198662811651,2020-04-28 22:14:49,"On this #WorkersMemorialDay, against the backdrop of #COVID19, we honor those who have lost their lives on the job. We'll never be able to fully thank our workers for keeping our country moving through this crisis –– but we can start by prioritizing legislation to keep them safe. https://t.co/rkAfwGWRX0"
RepSusanWild,1254846368767713280,2020-04-27 18:54:22,"Lifesaving prescription drugs are useless if you can't afford them. Millions live w/ conditions worsened by COVID19, making temporary price caps on certain drugs vital for survival.

Big Pharma’s profits shouldn't dictate who lives &amp; dies. 

And that’s what I wrote in my letter👇 https://t.co/CGfyVZy0KX"
RepSusanWild,1253703395753549827,2020-04-24 15:12:36,"RT @GovernorTomWolf: It’s normal to feel stress, fear, and anxiety in the middle of a global pandemic. 

Mental health resources are availa…"
RepSusanWild,1253461633839411200,2020-04-23 23:11:56,"The House just passed a funding package to help our small businesses and local hospitals get the resources they desperately need.

There is still so much left to be done, but our #PA07 community is resilient. Step by step, we’ll keep pushing and get through this crisis together. https://t.co/SyfEKoGOHj"
RepSusanWild,1253404092686352385,2020-04-23 19:23:17,"Today, I’m voting on a relief package that provides resources Pennsylvanians desperately need to protect their lives &amp; livelihoods. We're talking:

➡️$370B to support small businesses 
➡️$75B for our hospitals &amp; health care workers 
➡️$25B for testing https://t.co/USFzveUHoi"
RepSusanWild,1253393940696502279,2020-04-23 18:42:57,Pennsylvanians stick together –– even when 6 ft apart! @RepMGS and I are in the House and ready to vote to support our small businesses and health care workers! https://t.co/tmnqy3Frlp
RepSusanWild,1253365400693325827,2020-04-23 16:49:32,"RT @SecretaryLevine: If you need to make a trip to the store for essential items, use these tips for safe grocery shopping during #COVID19…"
RepSusanWild,1253359920969322497,2020-04-23 16:27:46,"RT @PAHealthDept: 🏠 Debe usar una mascarilla cada vez que salga de su casa. 
😷 ¡Mi mascarilla lo protege, su mascarilla me protege a mí!…"
RepSusanWild,1253058494380441600,2020-04-22 20:30:00,"On this #EarthDay in the midst of a pandemic, we're reminded of the dire need to listen to scientists in order to protect our planet. As a co-chair of the @NewDemCoalition Climate Task Force, I'll always work to preserve our Earth for generations to come.https://t.co/eeg2gS79fK"
RepSusanWild,1253012098399035395,2020-04-22 17:25:38,"Every American deserves health care – especially during a public health crisis.

That’s why I’m co-leading ANOTHER effort to open the enrollment period during this pandemic — and I’ll keep working to ensure everyone who needs coverage can get it.https://t.co/hADsV0MMjg"
RepSusanWild,1252638657816809473,2020-04-21 16:41:43,"It's impossible for the 1.7M+ SNAP recipients in PA to order food &amp; have it delivered—putting those who rely on SNAP at higher risk of #COVID19.

That's why I cosponsored the SNAP Online Purchasing Flexibility Act, enabling SNAP recipients nationwide to make online purchases.⬇️ https://t.co/mR6gSvladU"
RepSusanWild,1252283396178481154,2020-04-20 17:10:02,"Throughout this pandemic, I've been deeply grateful to serve alongside these 3 women. Together, we are working to help get Pennsylvanians through this crisis. 

We’re going live on Facebook @4PM to share stories of strength from each of our communities &amp; give a #COVID19 update.👇 https://t.co/maxohV4ANE"
RepSusanWild,1252265774003228674,2020-04-20 16:00:01,"Child care is a vital service for working families &amp; providers need relief to continue serving our communities.
 
I'm thrilled that PA will receive $106M+ in funding through the CARES Act to support our state's crucial child care providers during #COVID19.
https://t.co/2FAEGthWjR"
RepSusanWild,1252252482526416899,2020-04-20 15:07:12,"The #COVID19 pandemic has affected every aspect of life in #PA07 – I know the uncertainty that this crisis presents is difficult for you and your loved ones. @GovernorTomWolf has released his plan for PA as we move forward. Read about it here ⬇️

https://t.co/TOSHJuQRPS"
RepSusanWild,1251242557318631424,2020-04-17 20:14:07,"Our students are facing an unprecedented level of uncertainty about their education – continuing their education online, securing financial aid, paying for housing, food, or child care, &amp; staying mentally healthy. For resources to help navigate this time👇https://t.co/64XpliSlLL"
RepSusanWild,1251218251088039937,2020-04-17 18:37:32,"On Monday, I spoke with the Executive Director of @PreventSuicideP about how we can care for our #MentalHealth &amp; connect with friends, family members, &amp; community. No matter what, there are resources &amp; support systems near you to help.

Our conversation👇
https://t.co/ULcoOZ9baF"
RepSusanWild,1251192672624181249,2020-04-17 16:55:53,"On my telephone town hall last night, we talked unemployment compensation, COVID-19 testing, small business assistance, and how we are all working to get through this crisis together.

In case you missed it, you can listen to the full town hall here.👇
https://t.co/cm4fNd4QoN"
RepSusanWild,1250908567038832641,2020-04-16 22:06:57,"Our front-line health care workers are nothing short of heroes, working tirelessly to protect us—&amp; we must protect them in return.

That's why I joined a letter calling for the next #COVID19 bill to include adequate PPE for our most vulnerable workers.
👇
https://t.co/O4ZC2ZbhY2"
RepSusanWild,1250869561878085633,2020-04-16 19:31:58,"As a proud member of @WeArePREVENTS, I was happy to talk with @SecondLady Pence &amp; @Surgeon_General Adams this morning about the importance of mental well-being during this challenging time. 

#MoreThanEverBefore, your #mentalhealth deserves the same care as your physical health."
RepSusanWild,1250841332807020546,2020-04-16 17:39:47,"RT @PAHealthDept: My mask protects you, your mask protects me 😷 

When going to a supermarket, pharmacy or other life-sustaining business,…"
RepSusanWild,1250807147279024128,2020-04-16 15:23:57,"Tonight @ 7:15PM I’m hosting a #COVID19 telephone town hall with @PALaborIndustry Sec. Jerry Oleksiak, PA State Director of Unemployment Comp. Benefits Susan Dickinson, &amp; @LVHN Infectious Disease Expert Dr. Amy Slenker.

Register &amp; we’ll give you a call👇https://t.co/2xoEmYoJyk"
RepSusanWild,1250774111044935680,2020-04-16 13:12:40,"RT @PBS39Channel: 📺Today we will welcome @RepSusanWild and @LVHN's Dr. Tibisay Villalobos to Community Update on #Coronavirus.

☎️Call 484-…"
RepSusanWild,1250078771782303747,2020-04-14 15:09:39,"Many life-sustaining businesses across PA are hiring &amp; they need help!

@PALaborIndustry has created a COVID-19 job portal to increase connectivity between employers &amp; people looking for a job.

If you are seeking employment, visit the link below 
👇👇
https://t.co/zyC5iqXgm4"
RepSusanWild,1248402735382188032,2020-04-10 00:09:40,"Scammers are taking advantage of the #COVID19 pandemic to con people into giving up the financial resources they need now more than ever. 

At a time when information is rapidly changing, staying informed about these scams can help protect you and your loved ones."
RepSusanWild,1247665177987858433,2020-04-07 23:18:53,"Words cannot express the gratitude I feel for our #HealthCareHeroes.
 
They have been on the front lines of this pandemic, tirelessly protecting us. Since day 1 of this crisis, health care workers around the globe have sent us this message—we are in this TOGETHER. #WorldHealthDay https://t.co/0ciY99z06c"
RepSusanWild,1247271648325242882,2020-04-06 21:15:08,"I know that for so many who have been laid off b/c of #COVID19, finding a new source of income – even temporarily – seems impossible.

If you are looking for work, right now the @SBAgov is hiring temporary employees to assist with disaster relief efforts.👇https://t.co/60Guu2yum3"
RepSusanWild,1246167380725846016,2020-04-03 20:07:10,"RT @GovernorTomWolf: Please wear a mask if you leave your house. Masks help keep those wearing them from sharing illnesses.
 
See instructi…"
RepSusanWild,1246155784020545536,2020-04-03 19:21:06,"Thousands of you have shared stories of how #COVID19 has impacted you, your access to meals, your business, your education -- every aspect of your lives. And I want to hear all of them so I can keep working to get the help you need. 

Share your story👇
https://t.co/oqZAq07ehl"
RepSusanWild,1245449474287247361,2020-04-01 20:34:28,"RT @GovernorTomWolf: Today I am issuing a statewide Stay at Home Order to further mitigate the spread of #COVID19.
 
Each and every one of…"
RepSusanWild,1245348760160526336,2020-04-01 13:54:16,"The loss of Douglas Linn Hickok to #COVID19 is heartbreaking for both our military community and our Lehigh Valley community. My thoughts are with his family, loved ones, and our National Guard service members at this difficult time. https://t.co/wa9b54tTAw"
RepSusanWild,1245090297270452226,2020-03-31 20:47:14,"On #TransgenderDayofVisibility, it’s important to consider how this pandemic can affect transgender communities, which have higher rates of poverty and often experience discrimination when accessing health care.

Today and all days, I see you, I hear you, and I’m working for you. https://t.co/sWznbxp3eY"
RepSusanWild,1245030345919156224,2020-03-31 16:49:00,"Last night, I joined @69News to discuss how the bipartisan #CARESAct will support working families, health care providers, and local businesses in #PA07.

Watch here 👇https://t.co/dREY7m9XLX"
RepSusanWild,1244717448319950858,2020-03-30 20:05:40,"RT @PADeptofEd: Extraordinary times call for extraordinary measures to protect everyone’s health and safety.

We’ll share information very…"
RepSusanWild,1244706248110608386,2020-03-30 19:21:09,"RT @GovernorTomWolf: Pennsylvania #COVID19 updates —
 
🏫 Schools/businesses closed: Until further notice
🏡 Added to Stay at Home Order: Car…"
RepSusanWild,1244663007596118016,2020-03-30 16:29:20,"Today is #NationalDoctorsDay.

Right now, more than ever, our doctors are our heroes. #PA07 is home to two of the finest hospital networks in the country –– our health care providers are owed our full debt of gratitude.

To all the doctors working to keep us healthy, THANK YOU."
RepSusanWild,1244293237772185600,2020-03-29 16:00:00,"While we must continue working to #flattenthecurve, we must also make our mental health a priority.
I know that social distancing can feel very isolating, but you are not alone; we are all in this together. 
 
Text PA to 741-741 for support."
RepSusanWild,1243930853220073472,2020-03-28 16:00:01,"During the #COVID19 pandemic, we must continue to protect the most vulnerable Americans &amp; expand access to health care—people need it now more than ever.
APPLY HERE FOR MEDICAID
👇👇👇
https://t.co/KHPEymJF4q"
RepSusanWild,1243919457770246146,2020-03-28 15:14:44,RT @WLVRNews: PA will see about $5 billion dollars in federal funding for #coronavirus-related expenses as part of the just-passed Congress…
RepSusanWild,1243635166511276033,2020-03-27 20:25:03,"The #CARESAct has passed the House and is on its way to the President's desk.

Today, we voted to provide support to our health care providers, working families, and at-risk seniors. I'm proud of this show of unity at a time when Americans need it most. https://t.co/YjJwEuUHu9"
RepSusanWild,1243548433811718146,2020-03-27 14:40:25,"RT @lauraolson: @RepSusanWild In her one-minute floor speech on coronavirus bill, @RepSusanWild gives a shoutout to workers in #PA7's hospi…"
RepSusanWild,1243275574723960834,2020-03-26 20:36:10,"Because of current discrepancies in paid sick leave, if we fail to establish a national guarantee, then many workers could contract #COVID19, transmit it, and inadvertently endanger others.

Our health care workers need our support to keep our communities safe and healthy. https://t.co/8bNo3NeGYA"
RepSusanWild,1243275571750146054,2020-03-26 20:36:09,"During this crisis, our front-line health care workers are nothing short of heroes.

They are protecting us and we need to protect them – that’s why I led a letter with more than 50 of my colleagues to ensure guaranteed paid sick leave for all affected health care workers. https://t.co/IDULmTQCAu"
RepSusanWild,1243255571123441664,2020-03-26 19:16:41,"RT @PAHealthDept: In PA, we're seeing the most positive #COVID19 cases in patients in 50 + ⬆️ age bracket—making up 46% of cases.

But that…"
RepSusanWild,1243185693091934208,2020-03-26 14:39:01,"Access to nutritious food is absolutely crucial for the health and well-being of all families—especially during these uncertain times.

To apply for #WIC, call the number below 👇

1-800-942-9467

Or visit https://t.co/CBUdbFWGvw to get started online."
RepSusanWild,1242537549064744960,2020-03-24 19:43:31,"RT @PAHealthDept: In addition to cough, fever + shortness of breath, studies show that diarrhea has also been found in patients with #COVID…"
RepSusanWild,1242236993683234816,2020-03-23 23:49:13,"Every American should have the right to health care, especially when an individual’s health can seriously impact broader public health. That’s why I’m co-leading an effort to open the enrollment period during #COVID19 so no one is left uninsured. https://t.co/ySC1tJwHYQ"
RepSusanWild,1241402283319087105,2020-03-21 16:32:23,RT @AllentownSD: What is social distancing and why is it important? COVID-19 is mainly spread from person to person. One of the most effect…
RepSusanWild,1241068777321750533,2020-03-20 18:27:09,"The @SBAgov is offering low-interest federal disaster loans to #PA small businesses who are hurting due to #COVID19.

Businesses can apply online here ➡️https://t.co/Bm0szFk0Ze

For more information, call (800) 659-2955 or email disastercustomerservice@sba.gov"
RepSusanWild,1241019756594987009,2020-03-20 15:12:21,"RT @PBS39Channel: ❗Join us at 3 p.m. for Community Update on #Coronavirus. We will welcome @RepSusanWild &amp; @LVHN's Dr. Amy Slenker, MD, Inf…"
RepSusanWild,1240763595622932481,2020-03-19 22:14:28,"Based on concerns I've heard from those in the medical field, I fully support @GovernorTomWolf's action to stop the spread of #COVID19.

More information on life-sustaining vs. non-life-sustaining business here ➡️ https://t.co/HPyPsBfvv0 https://t.co/09hAmFJSnY"
RepSusanWild,1240404054339174402,2020-03-18 22:25:46,"I was heartbroken to learn of the loss of one of #PA07’s own in Northampton County due to #COVID19.

As we gather details, I must again emphasize to the people of #PA to heed the warnings set forth by the @CDCgov and @GovernorTomWolf.

My full statement ⬇️ https://t.co/Nzm73DGjsa"
RepSusanWild,1240402254760419328,2020-03-18 22:18:37,"RT @PAHealthDept: Fear and anxiety can be overwhelming and cause strong emotions—please remember to be kind to each other online, in person…"
RepSusanWild,1240319430678196225,2020-03-18 16:49:30,"For all pet owners, here are the guidelines that @ASPCA has given to keep our furry friends safe!

While there is no current evidence that suggests the #coronavirus can be transmitted to or from companion animals, here are some tips on factoring our pets into emergency plans 👇 https://t.co/K46hHMPLeY"
RepSusanWild,1240294500980965383,2020-03-18 15:10:27,"ICYMI: on Monday, I hosted a telephone town hall with @peter_schweyer and Dr. Peter Ender from @mystlukes on the effects of #COVID19 on our community.

You can now listen to the full audio recording online ⬇️ https://t.co/5pGUXg98uw"
RepSusanWild,1240079809558073344,2020-03-18 00:57:20,"As our community deals with the effects of #COVID19, no one should go hungry in #PA07.

Resources and guidance for how to receive food assistance below ⬇️ https://t.co/l9RYumHXX3"
RepSusanWild,1240031081832812545,2020-03-17 21:43:43,"RT @PADCEDnews: Due to the #COVID19 pandemic, @GovernorTomWolf has issued guidance that all non-essential businesses across #Pennsylvania s…"
RepSusanWild,1240014694095753216,2020-03-17 20:38:36,"To limit risk of exposure and spread of #COVID19, @CMSGov is expanding Medicare’s telehealth coverage. This is incredibly important for at-risk individuals who do not want to put themselves in harm’s way by going to a doctor’s office, but still need care. https://t.co/NainTzW5EF"
RepSusanWild,1240003011881074694,2020-03-17 19:52:10,"RT @PAHealthDept: There are things you can do to help during the #COVID19 outbreak in PA:
🩸 donate blood
🥫 donate to food banks
👵 call on s…"
RepSusanWild,1239990903990820866,2020-03-17 19:04:04,"LEHIGH VALLEY HEALTH NETWORK
Call Number: (888) 402-LVHN (5846)

ST. LUKE'S UNIVERSITY HEALTH NETWORK
Call Number: 1-(866)-STLUKES or (866)-785-8537

You may also call your Primary Care Physician or the Pennsylvania Department of Health at 1-877-PA-HEALTH"
RepSusanWild,1239990901935661057,2020-03-17 19:04:03,"If you are experiencing symptoms of the #Covid_19 please contact the emergency help lines provided by @mystlukes and @LVHN to be evaluated and provided guidance. 

These hotlines will be led by nurses who can provide information based on CDC guidelines."
RepSusanWild,1239979757502107649,2020-03-17 18:19:46,"Last night I held a telephone town hall with thousands of folks in #PA07 to address the impact of #coronavirus on our community. From questions about health to the effects of this on “gig” workers, I want to hear your voice and your concerns. https://t.co/RURxK7y859"
RepSusanWild,1239977570524938240,2020-03-17 18:11:05,"RT @lauraolson: ‘My son is a mail carrier, and I’d like to know his risk for contagion’: Lehigh Valley residents seek answers about coronav…"
RepSusanWild,1239962523064922113,2020-03-17 17:11:17,RT @PAHealthDept: 🔴 LIVE at 2 pm: @SecretaryLevine + @PEMADirector will provide an update on #COVID19 and outline ongoing efforts to mitiga…
RepSusanWild,1239911659755495424,2020-03-17 13:49:10,"RT @GovernorTomWolf: Yesterday, @PAHealthDept joined me at @PEMAHQ to announce the latest #COVID19 mitigation efforts in PA.

Starting toda…"
RepSusanWild,1239640855536979971,2020-03-16 19:53:06,"Tonight @ 7:15PM, I’m hosting a live #COVID19 telephone town hall with @RepSchweyer &amp; local infectious disease expert from @mystlukes, Dr. Peter Ender, to answer your questions &amp; give updates on how to keep our community safe. RSVP 👇

https://t.co/Jx3WzhJn1G https://t.co/bwb6mRO7Cy"
RepSusanWild,1239630539235176451,2020-03-16 19:12:06,"For all of the veterans in our community, here are resources from the @DeptVetAffairs on how you can protect yourself from #COVID19, access virtual health options, and find your closest VA facility.

https://t.co/9wMbX1sR50"
RepSusanWild,1239584599258390530,2020-03-16 16:09:33,"RT @PAHealthDept: All of the #COVID19 information can be overwhelming for adults + kids. 

Mental health resources are available. If you or…"
RepSusanWild,1239269247597137925,2020-03-15 19:16:27,"RT @peter_schweyer: This Monday evening, I will be joining @RepSusanWild during her telephone town hall to discuss the Coronavirus crisis.…"
RepSusanWild,1238916987683815424,2020-03-14 19:56:42,"Monday @ 7:15PM, I’m hosting a live #COVID19 telephone town hall. Joining me will be @RepSchweyer &amp; local infectious disease expert from @mystlukes, Dr. Jeffrey Jahre, to answer your questions &amp; give updates on how to keep our community safe. RSVP👇 

https://t.co/Jx3WzhJn1G https://t.co/jsYJz5h5Vo"
RepSusanWild,1238877223580565506,2020-03-14 17:18:41,Please follow this link for locations and information on #COVID19 emergency meal pick up for the @AllentownSD ⬇️ https://t.co/S3taWU7rW7
RepSusanWild,1238832087194624005,2020-03-14 14:19:20,The #FamiliesFirstCoronavirusResponseAct that we passed early this morning includes some of the most important measures we can take to support American workers and families right now. Proud to see bipartisan support from the #PA delegation. https://t.co/yz8V8iJ2zX
