RepSusanWild,1282806564257173507,2020-07-13 22:38:12,"RT @PAHealthDept: I have #COVID19 symptoms. Now what?

Most people who have mild symptoms can recover at home without medical care. To get…"
RepSusanWild,1282672117067264000,2020-07-13 13:43:58,"RT @PennsylvaniaGov: We’re all still getting used to wearing masks during the #COVID19 pandemic.
 
Here’s how to keep them the most effecti…"
RepSusanWild,1281683108102840320,2020-07-10 20:14:00,"After storms and during pandemics, lineworkers are keeping the lights on across America. Proud to support #LineworkerDay to thank and honor these heroes for their dedication and sacrifice. They are essential to powering our country. https://t.co/ZI9N5gJd3n"
RepSusanWild,1281649167744372738,2020-07-10 17:59:08,RT @PennsylvaniaGov: Health experts say to wash your hands frequently with soap and warm water to kill germs and protect yourself from #COV…
RepSusanWild,1281294162571206656,2020-07-09 18:28:28,"Though the impact of #COVID19 on children’s hospitals has been significant, they’ve barely received 1% of the #COVID19 relief funding for health care providers.

In PA, we know we can’t leave children’s health providers hanging. Our bipartisan letter calling for better support👇 https://t.co/pAEzildMC8"
RepSusanWild,1281241527965057026,2020-07-09 14:59:19,"Last night, when I spoke with a group of #PA07 workers who have been on the front lines of this pandemic since the beginning, all of them had the same plea: Please, please wear a mask. 
 
We are all counting on each other to take this seriously. #MaskUpPA https://t.co/WjaXmUzvGH"
RepSusanWild,1280914759945158665,2020-07-08 17:20:51,"For months, frontline workers have been facing this pandemic head on to keep our country connected – helping the rest of us get the health care we needed, purchase groceries, order takeout, or get to our different destinations – despite the risk to their own health."
RepSusanWild,1280578993008324608,2020-07-07 19:06:38,"RT @PennsylvaniaGov: Good news! If your license expired during #COVID19, you now have until the end of the July to get it renewed.
 
🚘 You…"
RepSusanWild,1280509806596456454,2020-07-07 14:31:43,Please wear a mask — it really does save lives. #MaskUpPA https://t.co/WcFUmMPmEn
RepSusanWild,1280509601788702727,2020-07-07 14:30:54,"RT @PennsylvaniaGov: Social distancing is important, but remember: masks must be worn any time you leave your home.
And when you're out, ke…"
RepSusanWild,1279140353560293377,2020-07-03 19:50:00,"It was a busy week here in Washington – filled with votes to expand health care coverage, rebuild our nation’s infrastructure, expand rental assistance, and lots more. Before I head back to PA-07 for the next couple weeks, let me catch you up on all the action.👇 https://t.co/L1wPcHW0Q7"
RepSusanWild,1279070855599972354,2020-07-03 15:13:50,"RT @GovernorTomWolf: As of today, all Pennsylvania counties are in the green phase of reopening.
 
Masks are required in all public spaces.…"
RepSusanWild,1278772214096109568,2020-07-02 19:27:08,"This legislation has passed the House and my bill to fix the ACA's ""family glitch"" and ensure health care for working families is on its way to the Senate. 
 
Lower health care premiums, less expensive prescription drugs, expanded care for families = Done, done, and done. https://t.co/71afPzPixx"
RepSusanWild,1278735173094383618,2020-07-02 16:59:57,"This situation is dire. Without immediate action to extend that moratorium our nation will face one of the largest homelessness crises in our history – in the middle of a pandemic. 
 
I voted this week to keep Americans housed through this emergency👇
https://t.co/zHterSYBAo"
RepSusanWild,1278696108542304264,2020-07-02 14:24:43,"My mask protects you, your mask protects me. Let's all do our part to keep each other safe, PA. #MaskUpPA https://t.co/XgUhLFaIaX"
RepSusanWild,1278687704759353345,2020-07-02 13:51:20,"When a mental health patient is in crisis, they need an expert who can get to them quickly. @RepCheri and l led this bill to address that need for immediate, specialized help. 
https://t.co/xJQDIRLHbA"
RepSusanWild,1278687702456598528,2020-07-02 13:51:19,"Earlier this week, not one but TWO bills I introduced to help improve access to mental health care were part of an @EnergyCommerce hearing!
 
Here are the details👇"
RepSusanWild,1278594824296374273,2020-07-02 07:42:15,"RT @paulkrugman: Another thought on Arizona's numbers: AZ, with 7 million people, is reporting as many new cases per day as the European Un…"
RepSusanWild,1278433264282349570,2020-07-01 21:00:17,"Happy #NationalPostalWorkerDay to the more than 630,000 postal workers who – even through a pandemic – consistently delivered for our country when it mattered most. 

They never stopped showing up for us. Now, we have to show up for them. #ProtectTheUSPS https://t.co/eIcICuFtuD"
RepSusanWild,1278369645213483010,2020-07-01 16:47:29,"RT @PennsylvaniaGov: Wearing a mask protects those you come in contact with from your germs, but it also protects you from respiratory drop…"
RepSusanWild,1278063447398326273,2020-06-30 20:30:45,"It’s time to be proactive – not reactive – when it comes to tackling the climate crisis. The @ClimateCrisis' Action Plan represents a step in that direction – a commitment to our next generation to take the health of their future planet seriously through bold, necessary policies. https://t.co/H5LUG5a986"
RepSusanWild,1278048944552054787,2020-06-30 19:33:08,"RT @PennsylvaniaGov: Don’t forget to #MaskUpPA!
                  ⏠

            ◉           ◉      
➰🔵🔵🔵🔵🔵🔵➰
          🔵🔵🔵🔵🔵
            🔵…"
RepSusanWild,1277709170813341697,2020-06-29 21:02:59,"Today, #SCOTUS protected a woman’s right to make her own health decisions. But this law was just one of HUNDREDS designed to restrict her constitutional rights.
 
We've got to pass the Women’s Health Protection Act ASAP so women’s basic rights aren’t constantly in limbo. https://t.co/BUFJRfAIj9"
RepSusanWild,1277644742273138689,2020-06-29 16:46:58,"These continued attacks to dismantle the #ACA represent petty partisan politics at best, and a blatant disregard for the health of 23M Americans at worst. 

We can’t just upend our current health care law &amp; hope for the best – we have to strengthen, improve, &amp; stabilize the #ACA."
RepSusanWild,1277644741610536960,2020-06-29 16:46:58,"With more Americans jobless and struggling to afford care than ever, this Administration is still doing everything in its power to completely gut the #ACA. 

And they have absolutely no replacement policy. No backup plan for your health and well-being."
RepSusanWild,1277598849629126656,2020-06-29 13:44:37,"RT @PEMAHQ: #COVID19 isn't gone. We must continue to do our part in preventing its spread. If you're participating in any celebrations, rem…"
RepSusanWild,1276900229204320257,2020-06-27 15:28:32,"RT @SenBobCasey: What do you call a barista’s face mask? A coughey filter!

Now that I have your attention: seriously, wear a mask, it save…"
RepSusanWild,1276628804291776513,2020-06-26 21:30:00,"My mask protects you, your mask protects me. 

As Lehigh and Northampton counties move into the Green phase of reopening (!) today, let’s keep those masks on and our #COVID19 cases down! #MaskUpPA https://t.co/APzTWliX8A"
RepSusanWild,1276566194573774848,2020-06-26 17:21:12,"In 7 states, #COVID19 hospitalizations have hit an all-time high.
 
Ripping away health care from millions of Americans is never good policy, but right now – in the middle of a pandemic – seems like egregiously poor timing.https://t.co/kklMi4pp0J"
RepSusanWild,1276528416599277569,2020-06-26 14:51:05,"This week, I joined my colleagues @RepCartwright, @RepMeuser, @RepBrianFitz &amp; @RepMalinowski on Business Matters to discuss the future of our region in the midst of #COVID19. Watch our full bipartisan conversation here👇👇
https://t.co/c35mK6dbCn"
RepSusanWild,1275907984229572608,2020-06-24 21:45:43,"RT @SparkMedia: An important message from @RepSusanWild.  We have to make overcoming the stigma surrounding #mentalhealth a reality, and th…"
RepSusanWild,1275907839349985285,2020-06-24 21:45:08,"During this time of extreme stress for young people, our schools need the resources to reach out to students and better support their mental health. 

In the next #COVID19 aid package, we have to address this need. Check out our bipartisan letter ⬇️ https://t.co/TUqQ8TLHAW"
RepSusanWild,1275873101390270464,2020-06-24 19:27:06,"As parts of our community begin to move into the Green phase of reopening, routine #COVID19 testing has become even more important. 

Click here 👇👇for info regarding testing locations. 

https://t.co/GaQW5mlJmM"
RepSusanWild,1275832686532321283,2020-06-24 16:46:30,"Throughout #COVID19, our local craft brewers reallocated resources to make hand sanitizer for front line workers – &amp; now, as we start to reopen, they need help to be able to focus on rebuilding. 

I joined this bipartisan effort to help these small businesses get back on track⬇️ https://t.co/GFLfH1nhAw"
RepSusanWild,1275795514928308224,2020-06-24 14:18:48,"The government has to do everything in its power to make #COVID19 testing universally available – and universally affordable – especially in the communities hardest hit by this pandemic.

My conversation from our @EdLaborCmte hearing on why this is so important. ⬇ https://t.co/P6VGbCoxir"
RepSusanWild,1275479248774586368,2020-06-23 17:22:04,"Thanks to @First_Focus for this great conversation on why protecting children’s access to health care is more important than ever.

No family should have to worry their child may not be able to get the care they need. @RepBrianFitz &amp; I’s #CHIPPERAct helps keep that care in reach. https://t.co/9Tkp3340ge"
RepSusanWild,1275436676223873024,2020-06-23 14:32:54,"#COVID19 &amp; the resulting economic crisis have put our local restaurants in danger of permanently shutting their doors – and the livelihoods of millions at risk. 

They need support. Like right now. 

I'm leading the #RESTAURANTSAct to get them relief ASAP.
https://t.co/fYkA4EpAGr"
RepSusanWild,1275097262725771265,2020-06-22 16:04:12,"RT @EdLaborCmte: #COVID19 has exacerbated existing racial inequities in our education, labor, and health care systems.
 
STARTING NOW:
Toda…"
RepSusanWild,1273707909348823040,2020-06-18 20:03:24,"The #COVID19 crisis has hit the Postal Service hard, and without relief, it could begin to collapse as soon as September. That’s why 137 of my colleagues and I joined together in an effort to secure that relief ASAP.
 
Check out our letter to save @USPS 👇👇👇 https://t.co/wCmdZtN3El"
RepSusanWild,1273684403856846849,2020-06-18 18:30:00,"“The coronavirus has simply exacerbated [workplace] gender inequities by stripping away what supports women had in place to walk this tightrope, including childcare.”
 
Just another reason we have to prioritize making child care affordable &amp; accessible.⬇️https://t.co/GP7JDvV7Rz"
RepSusanWild,1273300036424785920,2020-06-17 17:02:40,"More than two-thirds of folks in #PA07 have completed the #2020Census – &amp; there's still time to make sure everyone's voice is heard. 
 
If you want a say in funding for our hospitals, schools, &amp; roads for the next *decade*, please complete the Census.
👇👇https://t.co/xLl8sroNWa"
RepSusanWild,1272998745341341696,2020-06-16 21:05:26,"Enock Benjamin was a union chief steward of his meat packaging plant in PA who died of #COVID19 in April. He didn’t have the PPE or safety protocols in place to protect him. 

Enock deserved better. On behalf of the Pennsylvanian workers affected by this –– we need answers. https://t.co/5wVpCAPiKz"
RepSusanWild,1272921414052515845,2020-06-16 15:58:09,"Our local restaurant community is one of the best parts of the Greater Lehigh Valley. But restaurants have been hit especially hard during #COVID19. Right now, I’m hosting a roundtable with local eatery owners to talk new legislation &amp; what they need to get through this pandemic. https://t.co/QOA2e04QZZ"
RepSusanWild,1272555041937817602,2020-06-15 15:42:19,"Thanks to the @EDCoalition for all of their work to support mental health in our communities. With this bill, we can expand their ability to reach folks most in need 👇 https://t.co/irTgHlKmSh"
RepSusanWild,1271186751432900609,2020-06-11 21:05:13,RT @RepTedYoho: Happy to join @RepSusanWild in leading a letter to increase funding to fight #COVID19 internationally. By helping other nat…
RepSusanWild,1271186590589730817,2020-06-11 21:04:35,"If this pandemic has taught us anything it’s that we – as a global society – are all in this public health crisis together. Combating #COVID19 means supporting vaccine development and research around the world. 

Let’s lead the world against this pandemic⬇️ https://t.co/plt70MS3Av"
RepSusanWild,1271122501268123649,2020-06-11 16:49:55,"RT @RepCheri: We have a mental health crisis in our country, and #COVID19 has laid bare a desperate need for access to mental health resour…"
RepSusanWild,1271122374600077313,2020-06-11 16:49:25,"In this prolonged time of stress, it has been made clear we haven't done enough to support the #MentalHealth needs of those in crisis.
 
Our states need 24/7 mobile crisis units that offer support &amp; can travel to folks in need.
 
So @RepCheri &amp; I wrote a bill to help create them."
RepSusanWild,1270832529474453506,2020-06-10 21:37:40,"I joined an @EdLaborCmte briefing today on how the @NLRB is blocking workers from voting to unionize &amp; bargain for safer workplaces, paid sick leave, &amp; other protections.

Considering companies vote electronically or by mail for board elections, it's ridiculous workers can't too. https://t.co/htO3DKkhlw"
RepSusanWild,1270471939262472193,2020-06-09 21:44:49,"We were long overdue for an investment in school infrastructure before #COVID19, but now this pandemic has exacerbated existing issues which could prevent schools from meeting @CDCgov reopening guidelines.

The Rebuild America's Schools Act can help. https://t.co/GR1vKWdQd1"
RepSusanWild,1270411239987052545,2020-06-09 17:43:37,"This is worth a read. June is #PTSD Awareness Month and for those on the front lines, this pandemic has been a prolonged period of relentless trauma. Making sure our mental health care system is equipped to support them is literally the least we can do. 👇
https://t.co/jkpJZIgWOe"
RepSusanWild,1270359312666431492,2020-06-09 14:17:16,"From April to May, @samhsagov hotlines saw a 1000% increase in emotional distress calls. 

More than ever before, mental health demands our attention.

Right now, I’m bringing together experts from our community to talk about how we can better support #MentalHealth. https://t.co/IU2De9Dkmt"
RepSusanWild,1270116657831251975,2020-06-08 22:13:03,"Every day for more than three months, I have heard from our local small business owners about how Congress can help support them during this pandemic. For them, this funding is absolutely essential. 

Proud to see the #CARESAct aid hitting our community 
👇👇👇 https://t.co/L6OhgPNo5M"
RepSusanWild,1269020637663825920,2020-06-05 21:37:51,"Mr. President,
 
13.3% is the highest unemployment rate since the Great Depression. That’s tens of thousands of struggling Pennsylvanians — too many families still feeling the devastation of this pandemic.
 
Our work is far from done.
 
Thanks,
SW
https://t.co/DaebpKzHcv"
RepSusanWild,1268985490340020225,2020-06-05 19:18:12,"RT @TheBlackCaucus: Join us today for Living While Black in America. 

COVID-19 stopped everything, except racism. https://t.co/auXID0zclD…"
RepSusanWild,1268605483348344838,2020-06-04 18:08:11,"“Mental health issues on college campuses I think have been neglected, as mental health has been in every sector — it just hasn't been enough of a priority.” 

I'm working to change that.☝️

Every college student deserves access to #MentalHealth services. https://t.co/YCjNzCx6An"
RepSusanWild,1267868896092184576,2020-06-02 17:21:15,"Your voice &amp; your vote make a difference. If you are voting in person, be sure to wear a mask, social distance, &amp; verify your polling location before heading out. 

If you didn’t return your mail-in ballot, you may vote by provisional ballot at the polls.➡️https://t.co/as244K9h0j https://t.co/sWKUKbybxC"
RepSusanWild,1267572019824132096,2020-06-01 21:41:34,"During #Pride2020, let's honor #LGBTQ activists of the past, celebrate progress, and commit to continue working on issues like:

🧠access to mental health
🏫school safety and inclusion
❌federal anti-discrimination protections

Equality takes work. Let's do it together. 🏳️‍🌈 https://t.co/2uPvD7DBzW"
RepSusanWild,1266171551600254978,2020-05-29 00:56:36,"Americans deserve to know exactly where federal COVID-19 relief funds are going and how money is being spent. Sadly, today a bill introduced by @RepDeanPhillips to do just that — the #TRUTHAct — failed. Transparency in government should not be a partisan issue. https://t.co/DnrHyXoN5p"
RepSusanWild,1266092629323927553,2020-05-28 19:43:00,"We know basic protections for workers (like proper PPE and social distancing) save lives in the workplace – especially for those on the #COVID19 front lines. 

@OSHA_DOL, protecting workers’ lives shouldn't be optional. #COVID19-specific, enforceable standards need to be set. https://t.co/vbFFso5Rhd"
RepSusanWild,1266080247667134470,2020-05-28 18:53:48,"Our efforts in combating #COVID19 wouldn't be possible without the @USNationalGuard's support for testing, tracing, &amp; direct care at Veterans Living Centers &amp; w/ homeless populations. We have an obligation to ensure they receive their benefits earned on the #COVID19 front lines."
RepSusanWild,1266023526173204480,2020-05-28 15:08:24,Right now I’m in an @EdLaborCmte hearing on protections for workers amid the #COVID19 pandemic — this is so important to the health and safety of working families in #PA07 who deserve safe working conditions. OSHA needs to implement emergency safety standards NOW. https://t.co/91Z1lKsWTa
RepSusanWild,1265781549389295616,2020-05-27 23:06:53,I was deeply moved by this piece about Roy Halladay – addiction &amp; mental health issues have taken the lives of too many Pennsylvanians. We can ALL work to reduce the stigma &amp; end the culture of silence. You never know who is struggling and needs a lifeline.https://t.co/MUSFVU2djn
RepSusanWild,1265446642863480834,2020-05-27 00:56:05,"I led an effort calling for a cap on Rx drug prices for EVERYONE with a condition that makes them more likely to get #COVID19.

This is a good start, but we need to give relief to diabetics who aren't Medicare recipients and struggling to afford insulin. https://t.co/L8KnBMzO96"
RepSusanWild,1265384376055062528,2020-05-26 20:48:39,"Through this pandemic, 100,000+ child care providers have temporarily closed. Without increased support, millions of families will not have access to child care when they try to return to work.

Rebuilding our economy means ensuring affordable &amp; accessible child care. Full stop. https://t.co/ZCJ8rJXznK"
RepSusanWild,1263532383841722371,2020-05-21 18:09:30,"#MoreThanEverBefore, we must address the mental health crisis with compassion &amp; urgency – &amp; while I'll continue advocating for federal action, we can all play a role in combating this crisis with a call or text.

Reach out to your loved ones today. It can make all the difference. https://t.co/lXDtUbFpVG"
RepSusanWild,1263205530216140801,2020-05-20 20:30:42,"Making food delivery services accessible to everyone is critical to combating food insecurity through this pandemic.
 
As a cosponsor of this effort on the federal level, I’m thrilled to see this pilot program being implemented so those in need can safely get their groceries. https://t.co/OVh0EcNjqp"
RepSusanWild,1263168956136927235,2020-05-20 18:05:22,"It's so easy to feel disconnected from our support systems right now – but no one should ever feel disconnected from their health specialist. We have to make mental health care affordable &amp; accessible for all those who need it. #MentalHealthAwareness 

 https://t.co/uR8YMftKP5"
RepSusanWild,1262786322873356289,2020-05-19 16:44:55,"In the middle of a pandemic, no American should be stuck abroad without being able to get home to their family. 

I'm proud that my office is able to cut the red tape and help Pennsylvanians like Balwinder and Sona get home in times of crisis. 

You are not alone. Welcome home. https://t.co/VH0wmDWthl"
RepSusanWild,1262512411304747008,2020-05-18 22:36:29,"Going to work shouldn't mean risking your health. 
Thousands of essential workers have been exposed to #COVID19 and without stronger, #COVID19-specific protections enforced by @OSHA_DOL, millions will be at risk as we begin to reopen. 
 
Worker safety needs to be taken seriously. https://t.co/T5N8hriFZh"
RepSusanWild,1262419943561330689,2020-05-18 16:29:03,"RT @PALaborIndustry: Pandemic Emergency Unemployment Compensation (PEUC) is now available! 

FYI: Claimants still within their benefit year…"
RepSusanWild,1261479517555752960,2020-05-16 02:12:08,"Tonight I voted against a partisan bill in the midst of a pandemic.

Now is the time to bring our nation together around solutions that will improve the lives of Americans who are hurting, not engage in partisan gamesmanship. 

My full statement ⬇️ https://t.co/wA0QVeyMDJ"
RepSusanWild,1261334058245685252,2020-05-15 16:34:08,"If we don’t look at the #COVID19 crisis through a global lens, our economies and health systems will never be able to fully recover. We must face this together. https://t.co/z3322bi54j"
RepSusanWild,1260985731780132866,2020-05-14 17:30:01,"Millions have lost their jobs &amp; health care in this crisis. If this is you, visit https://t.co/19aLTUYdMX for help. 

(By the way, you shouldn’t need to be laid off to be able to sign up on exchange during a PANDEMIC — we need an Emergency #COVID19 ACA Enrollment Period). https://t.co/Rzx0XOWAf9"
RepSusanWild,1260954746057302016,2020-05-14 15:26:53,RT @GovernorTomWolf: Thank you to all the Pennsylvanians who are stepping up to fight COVID-19. https://t.co/OWYmIKnWSb
RepSusanWild,1260677563506188289,2020-05-13 21:05:28,"The effects of this #COVID19 crisis can compound the challenges that many are already facing. This #MentalHealthMonth and beyond, we must reach out to friends, family, and neighbors who may be vulnerable. A simple call or text can make all the difference.

Reach out today."
RepSusanWild,1260602810938294272,2020-05-13 16:08:25,"During this tough time, we must remember to look for the helpers. 100+ students from China, who study at @LehighU, remind us that a seemingly small contribution can make a big difference by donating thousands of masks to @mystlukes.

Together we are strong.https://t.co/YW3yvNk3xi"
RepSusanWild,1260290950242459651,2020-05-12 19:29:12,"Right now, access to affordable health care could not be more important. I’m leading this bipartisan effort b/c we can’t leave American families &amp; vulnerable children without access to health care in the middle of a pandemic. 

Health care = human right.https://t.co/NVddAu8Qsr"
RepSusanWild,1259945219488976898,2020-05-11 20:35:23,"#COVID19 is impacting marginalized groups globally—especially the LGBTQ community.
 
We’re hearing stories of this crisis being used as an excuse to conduct raids to arrest or target LGBTQ people for persecution. In the name of equality, we must protect human rights worldwide. ⬇️ https://t.co/YSA5N7Tiz4"
RepSusanWild,1259920087617867776,2020-05-11 18:55:31,"RT @PennsylvaniaGov: It’s normal to feel COVID-19 related stress.
 
Here are tips to help feel better from @CDCgov. https://t.co/kFKvoh6fC2"
RepSusanWild,1259899564171104258,2020-05-11 17:33:58,I stand with those on the frontlines –– our nursing home and elderly care workers –– who are desperately in need of more PPE and more rapid testing. These workers are doing backbreaking work to combat this crisis without the support they need from this admin. That must change. https://t.co/moZKisiSQX
RepSusanWild,1259868417236111361,2020-05-11 15:30:12,"Nearly two-thirds of Lehigh Valley residents have filled out their #2020Census!
 
You have the power to improve our roads, hospitals, &amp; schools by taking just 5 minutes to fill out the #2020Census. AND you can do it online, over the phone, or by mail. 
https://t.co/yBFzcMWcVu"
RepSusanWild,1259560119865663490,2020-05-10 19:05:08,"RT @GovernorTomWolf: Check out the #COVID19 resource guide to learn about:

👩‍⚕️️ Cases by county
💳 Financial help for PA'ians
🥫 Food assis…"
RepSusanWild,1258832205184450562,2020-05-08 18:52:40,"We must act NOW!

Without action, federal cuts to the Children's Health Insurance Program will take effect in October –– at a time of crisis, when families need coverage most. That's why I'm leading a bipartisan bill with @RepBrianFitz to protect #CHIP and protect our kids. https://t.co/JklDlA84V3"
RepSusanWild,1258528184078790657,2020-05-07 22:44:36,"Today, I was happy to join @PPLElectric as the keynote speaker for their Mental Health Lunch. 

#MoreThanEverBefore, our mental health deserves the same attention as our physical health. It’s okay to ask for help when you need it. We all do better when we see we are not alone."
RepSusanWild,1258502194900488193,2020-05-07 21:01:19,RT @RepYvetteClarke: Join me and @RepSusanWild tonight for this important conversation on #racial health disparities within #COVID19 .  Reg…
