RepThompson,1298595067989458950,2020-08-26 12:16:05,RT @RedCrossNorCal: REMINDER: This is a very stressful time. Massive #wildfires combined with an ongoing #covid-19 #pandemic have made this…
RepThompson,1298311277245325325,2020-08-25 17:28:24,This legislation will provide much needed assistance for our cash-strapped state and local governments to effectively respond to these disasters on top of the current public health crisis.
RepThompson,1298311276435832835,2020-08-25 17:28:24,That’s why I have introduced bipartisan legislation to increase the Federal cost share provided from 75 percent to 90 percent for any federal disaster declaration beginning at the start of the COVID-19 pandemic through the end of 2020.
RepThompson,1298311275605360640,2020-08-25 17:28:24,"As State and local communities work around the clock to combat the COVID-19 pandemic, natural disasters like the #LNULightningComplex have made matters worse by placing additional strain on governments already stretched thin."
RepThompson,1298047439597735936,2020-08-25 00:00:00,"Listen to the Science Guy, Bill Nye, who shows the most effective way to wear your mask to help reduce the spread for COVID and help save lives. https://t.co/XThfgoitnB"
RepThompson,1297987040248655872,2020-08-24 20:00:00,It's been 100 days since the House passed the #HeroesAct to fight COVID-19. How many days must American families and frontline heroes go without desperately-needed support before Republicans in Congress are ready and willing to act? https://t.co/gZHjKUCrCY
RepThompson,1297931519063973889,2020-08-24 16:19:23,RT @NWSSacramento: Today's air quality forecast shows unhealthy conditions persisting across interior #NorCal. Stay indoors if possible. To…
RepThompson,1297715626090409984,2020-08-24 02:01:30,RT @CoCoHealth: Wildfire Smoke and COVID-19 | CDC https://t.co/YzxBpt6N3G via @CDCgov
RepThompson,1297715615516569600,2020-08-24 02:01:27,"RT @CountyofSonoma: COVID-19 está circulando en nuestra comunidad, y la mejor manera de protegerse del virus y la mala calidad del aire es…"
RepThompson,1297715595950067718,2020-08-24 02:01:23,"RT @CountyofSonoma: COVID-19 is circulating in our community, and the best way to protect yourself from the virus and poor air quality is t…"
RepThompson,1297676121681666053,2020-08-23 23:24:31,"RT @CAgovernor: Have an emergency supply kit ready in the event of an evacuation:
✔️ Facemasks &amp; sanitation supplies
✔️ 3 days supply of no…"
RepThompson,1297662066648547328,2020-08-23 22:28:40,RT @CoCoHealth: Wear a face covering and keep at least 6 feet of social distance to help prevent the spread of COVID-19. Learn more about h…
RepThompson,1297598647232757764,2020-08-23 18:16:40,RT @NWSSacramento: Air quality continues to be unhealthy for much of #NorCal today. Limit outdoor activities if possible and check on sensi…
RepThompson,1297308176807845888,2020-08-22 23:02:26,"The Delivering for America Act will prohibit operational changes during the COVID public health emergency and ensure the level of service that was in place on January 1, 2020. People across our nation need reliable mail service, now more than ever."
RepThompson,1296960273434066946,2020-08-22 00:00:00,"Proud to join @RepMcNerney on a letter to major airlines requesting info on their policies to help prevent #COVID19 transmission, and urge them to work together to establish comprehensive industry-wide policies that ensure the health and safety of all passengers and employees. https://t.co/NaokjpEkiC"
RepThompson,1296643184785727495,2020-08-21 03:00:00,Read this letter from @CountyofSonoma leaders on why they need additional Federal funding to combat #COVID19 and recover from the economic losses caused by this crisis. I will continue fighting to ensure the next package has the funding our state and local governments badly need. https://t.co/WpyQux9eqM
RepThompson,1296598320199225347,2020-08-21 00:01:43,Mr. DeJoy’s sabotage of our Postal Service is unconscionable at a time when more people than ever are relying on the mail due to the COVID pandemic. He is unfit to continue leading the USPS. Read the full letter below: https://t.co/G7I09AeEcB
RepThompson,1296280798983667713,2020-08-20 03:00:00,"The @cityofmartinez needs more Federal funding to continue delivering the services we all rely on, especially during a pandemic. Read the city’s letter to me about why these resources are so critical to city operations. https://t.co/WVs4GnS6HH"
RepThompson,1296235499569414151,2020-08-20 00:00:00,"Just another reason POTUS &amp; GOP need to get serious about passing meaningful COVID relief. This ridiculous exec order doesn’t help anyone who has lost their job, gives employers severe uncertainty, and threatens funding for Social Security and Medicare. https://t.co/mfriWFgjgq"
RepThompson,1296190625738625024,2020-08-19 21:01:41,The recent Red Flag Warning and fires in some parts of our district this week are a good reminder that we should all take a moment to review our family’s Wildfire Action Plan and ensure it’s revised with #COVID19 precautions in mind.
RepThompson,1295797614491979776,2020-08-18 19:00:00,Smaller cities like Rohnert Park absolutely need funding from Congress to maintain essential services and help bring relief to families and local businesses who have been hit hard by #COVID19. I’m doing everything I can to ensure these resources are included in the next package. https://t.co/nY9puZGx1r
RepThompson,1295450326317793280,2020-08-17 20:00:00,Hercules has lost revenue even while facing increased costs to help things stay safe during #COVID19. The city needs Federal funding to help keep our community healthy and I will continue fighting to ensure the next bill has what it needs. https://t.co/rCSWnzVk7S
RepThompson,1295389928445153281,2020-08-17 16:00:00,"Lake County is depending on further Federal funding to help people who are out of work, and ensure they have the health care tools they need during #COVID19. I’m fighting to ensure the next legislative package has strong funding for state and local governments. https://t.co/3wIO013gWC"
RepThompson,1295072841205866496,2020-08-16 19:00:01,"Coauthored the Delivering for America Act, which prohibits the USPS from making any operational changes that would get in the way of prompt, reliable and efficient mail service during #COVID19. This is an absolutely essential bill now, more than ever. https://t.co/FSysKOlmDH"
RepThompson,1295027542777303040,2020-08-16 16:00:01,Solano County shared with me why it needs more Federal funding like the resources provided in the #HeroesAct that the House passed 2+ months ago. Local govs are at the tip of the spear in fighting #COVID19 and I’m going to ensure funding for them is included in the next bill. https://t.co/MSSXOg9TcG
RepThompson,1294710448768479234,2020-08-15 19:00:00,"ICYMI I had a great thirteenth Virtual Town Hall this week with special guest, @RepRaskin. He discussed his work on the House @COVIDOversight Subcommittee. Watch the replay here: https://t.co/9HKryY0HgL"
RepThompson,1294664792418988033,2020-08-15 15:58:34,"Over the past few days, I’ve been receiving letters from our local government leaders about why they need Federal funding to help respond to the #COVID19 crisis and urging Congressional leaders to include funding for state and local governments in the next legislative package."
RepThompson,1294408462089166853,2020-08-14 23:00:00,Read this signed letter from medical experts on the Yale faculty regarding the promotion of hydroxychloroquine as an effective treatment for COVID-19. https://t.co/xVZ5JffncV
RepThompson,1294303734231703552,2020-08-14 16:03:51,"Last night we encountered some technical difficulties streaming my Virtual Town Hall live so I am posting the recording here now. We had a great discussion with special guest, @RepRaskin, a member of the @COVIDOversight Subcommittee. Watch here: https://t.co/yYfLqbxTzA"
RepThompson,1293939784633790470,2020-08-13 15:57:39,RT @COVIDOversight: Be sure to tune in as Subcommittee Member @RepRaskin discusses congressional response to #COVID19 &amp; the Administration'…
RepThompson,1293935511564951552,2020-08-13 15:40:40,"Don’t forget that tonight at 7pm PT I am holding my 13th Virtual Town Hall. We will be joined by special guest, @RepRaskin who is a member of the @COVIDOversight Subcommittee. Be sure to register ASAP and I look forward to talking with you! https://t.co/r7nf4sirDu"
RepThompson,1293653487176343559,2020-08-12 21:00:00,Joined a bipartisan call for the President to fully fund the National Guard’s #COVID19 response in states and territories across our nation. States and local governments should not have to bear the burden of this response. More here: https://t.co/rKJqHomTCQ
RepThompson,1293623285796622336,2020-08-12 19:00:00,"This week is National Health Center Week, a chance to recommit to supporting our incredible local health centers and #ValueCHCs for the work they do to keep our community healthy and safe, particularly during the pandemic. https://t.co/n0ICpRhyug"
RepThompson,1293575136902348801,2020-08-12 15:48:40,"Don’t forget, tomorrow at 7pm PT, I am holding my 13th Virtual Town Hall. Our special guest is @RepRaskin who is a member of the @COVIDOversight Subcommittee and will help answer questions about the Federal response to the crisis. https://t.co/loUftE1NJU"
RepThompson,1293215725461667842,2020-08-11 16:00:30,"Excited to announce that this Thursday, August 13 at 7pm PT, I am holding my 13th Virtual Town Hall, with special guest @RepRaskin. He’s a member of the Select Subcommittee on the Coronavirus Crisis and will help answer your questions about the Federal response to the pandemic. https://t.co/FmlG6FbF47"
RepThompson,1292897022459236353,2020-08-10 18:54:05,Yet another reason that Republicans need to come back to the negotiating table so we can get a bill signed into law to provide funding to combat the spread of the virus.
RepThompson,1292897020643020800,2020-08-10 18:54:05,"Our nation just hit 5 million #COVID19 cases. We need to continue funding testing, tracing and treatment efforts to curb the spread, which is why I voted to pass the #HeroesAct 2+ months ago, which included $75 billion for those critical efforts. https://t.co/2WwoZBLYew"
RepThompson,1292172993528049664,2020-08-08 18:57:03,"The #HeroesAct that I voted to pass two months ago included funding for hazard pay for essential workers, another round of stimulus payments, funding for state and local govs, an extension of the expanded UI, funding for testing and tracing and resources and money for schools."
RepThompson,1291811350469963776,2020-08-07 19:00:01,"Great to have pediatrician @RepKimSchrier join me for last night’s twelfth Virtual Town Hall. We will continue working to ensure the next #COVID19 relief bill includes funding to help health care providers, small businesses and working families. https://t.co/M7FRdrMaAO"
RepThompson,1291424916357754888,2020-08-06 17:24:28,"Don’t forget – tonight is my twelfth Virtual Town Hall at 7pm PT with special guest, @RepKimSchrier. We will answer your questions about the next Coronavirus relief package. Be sure to register now by emailing Thompson.Townhall@mail.house.gov. https://t.co/sW75TWcCva"
RepThompson,1291414598395076610,2020-08-06 16:43:28,"It’s simple – wear a mask. Today I am inviting @RepDeSaulnier, Supervisor Tina Scott, Napa Councilmember Liz Alessio, Pastor Dante R. Quick, and State Senator @ilike_mike to join me in the #WearAMask Challenge and to spread the word. https://t.co/lhVTedoNDo"
RepThompson,1291117542891753472,2020-08-05 21:03:04,That’s why I joined my colleagues in a letter to Congressional leaders asking that strong funding for USPS be a priority in the upcoming Coronavirus relief crisis. More here: https://t.co/7IOtmJBmHB
RepThompson,1291117541906096128,2020-08-05 21:03:04,"The United States Postal Service is vital and essential, now more than ever. People are using USPS to communicate, to get life-saving prescription medications and so much more during the Coronavirus crisis."
RepThompson,1291067047334608896,2020-08-05 17:42:25,"Don’t forget – tomorrow at 7pm PT I am holding my twelfth Virtual Town Hall. Our special guest is @RepKimSchrier, a pediatrician and member of the House Education and Labor Committee. Together we will answer your questions about how Congress is delivering relief during #COVID19. https://t.co/XabLyuijPW"
RepThompson,1290761852801163269,2020-08-04 21:29:41,"Excited to announce that this Thursday, August 6 at 7pm PT, I will hold my twelfth Virtual Town Hall, with special guest @RepKimSchrier. She’s a pediatrician and will help answer your questions about what Congress is doing to respond to the Coronavirus crisis. https://t.co/wgv58H4bBp"
RepThompson,1289304903936913408,2020-07-31 21:00:17,"Particularly during the Coronavirus crisis, broadband is needed to help our students who are learning remotely, patients seeing their doctors through telehealth and small businesses grow and thrive."
RepThompson,1289282181659889664,2020-07-31 19:30:00,Met virtually with Kevin Reid from Napa and James Stewart from Santa Rosa to talk about their work with the NorCal MS Society and what Congress can do to continue funding MS research and boosting telehealth services. https://t.co/vOiBlfWTlQ
