rosadelauro,1242127524781572096,2020-03-23 16:34:14,RT @GreensteinCBPP: Final stimulus/ #COVID19 response package should include a 15% increase in the basic SNAP benefit level. This is good f…
rosadelauro,1241132678969262085,2020-03-20 22:41:04,RT @ctchildrens: We know that parents and families may have many questions regarding the coronavirus. To ensure there is a trusted one-stop…
rosadelauro,1241130328128962563,2020-03-20 22:31:43,"Work sharing programs were a bright spot in the aftermath of the financial crisis, and we should immediately reinstate federal support for them in the next coronavirus response package."
rosadelauro,1241130322839953410,2020-03-20 22:31:42,Businesses are closing and people are losing their jobs right now because of the coronavirus pandemic. Working people and families are facing an unprecedented threat to their economic security. https://t.co/svsCJfMKLo
rosadelauro,1241078111627874304,2020-03-20 19:04:14,"The absence of direct funding for programs that millions of people rely on is a mistake that must be fixed. As the debate continues over the third coronavirus response package, I will fight to make sure working people and families are put first."
rosadelauro,1241078109849427973,2020-03-20 19:04:14,"The economic impact families are facing is not their fault, and programs like paid sick days, paid leave, increased food assistance through programs like the Supplemental Nutrition Assistance Program and the Emergency Food Assistance Program—"
rosadelauro,1241078108779884547,2020-03-20 19:04:13,"Our public health is at grave risk, working families are losing any semblance of economic security, and our most vulnerable are on the precipice. What people in Connecticut and across America need from Congress is an assurance they will be able to weather this storm."
rosadelauro,1241058862586900481,2020-03-20 17:47:45,"During this public health emergency, the End Hunger CT SNAP call center will remain in full operation. If you have any questions related to SNAP or SNAP services during COVID-19, please call 866-974-7627. #CTCOVIDRESPONSE @EndHungerCT https://t.co/QZeM3jg7rW"
rosadelauro,1241049311032549383,2020-03-20 17:09:47,"I want to take a moment to express my gratitude to those who have worked to ensure our safety throughout #COVID19. To our healthcare workers, retail employees, cleaning crews, teachers and others—it is because of your work that we will be able to beat this together. Thank you."
rosadelauro,1240748183044718593,2020-03-19 21:13:13,Working people need access to paid sick days and paid leave now more than ever. Thank you @AJFaultLines &amp; @melissakchan for shining a spotlight on this issue at this critical time. https://t.co/iy0vs78fdY
rosadelauro,1240716123387150337,2020-03-19 19:05:49,Thank you to all that participated in last night's live Tele-Town Hall discussion on the federal response to the Coronavirus. I was pleased to be joined by Dr. Richard A. Martinello of Yale New Haven Hospital and I hope that we were able to answer many of your questions.
rosadelauro,1240628597863432192,2020-03-19 13:18:02,"REMINDER: New special enrollment period for health insurance begins today, March 19th. To see if you qualify to sign up for or to modify your health insurance coverage, visit https://t.co/DUWy7iqkfq before April 2nd to #GetCovered. https://t.co/oWOIv2H8KK"
rosadelauro,1240397753349476352,2020-03-18 22:00:44,This is especially important to protect our seniors and those who have underlying health issues.
rosadelauro,1240397751952846850,2020-03-18 22:00:44,"Once again, I urge everyone to follow the CDC guidelines if they can: stay home if you are sick, avoid close contact with others and large gatherings, wash your hands frequently, clean frequently touched surfaces, and stock up on essentials like food and prescription medication."
rosadelauro,1240397747787890688,2020-03-18 22:00:43,Congress needs to address the health and economic crisis facing families during this difficult time. We need to control the spread of this virus and ensure everyone can make ends meet.
rosadelauro,1240397746160447488,2020-03-18 22:00:42,This tragic event underscores the need for all of us to do everything we can to protect each other from the spread of this deadly virus.
rosadelauro,1240397744298176513,2020-03-18 22:00:42,"My heart goes out to the family of the Connecticut man who died today from complications due to the coronavirus, as well as all the health professionals involved who undoubtedly did their best to keep this from happening. https://t.co/98kOUqzo7Q"
rosadelauro,1240311699632201729,2020-03-18 16:18:47,"TONIGHT: Join me for a live telephone town hall meeting where I will provide a federal update on the coronavirus. To participate, dial 855-920-0553 at 5PM. I look forward to hearing from you and taking your questions. https://t.co/wup8m6siaB"
rosadelauro,1240069952117174272,2020-03-18 00:18:10,"I urge you and your families to take the precautions outlined by the CDC, like frequently washing your hands, staying home if you are sick, avoiding close contact with others and large gatherings, cleaning frequently touched surfaces, and stocking up on essentials."
rosadelauro,1240069951010025474,2020-03-18 00:18:10,"That is why Congress has taken swift action on two emergency bills in recent weeks to help our country deal with the coronavirus pandemic and stem its immediate impact on working people, families, and businesses."
rosadelauro,1240069551620046848,2020-03-18 00:16:35,"This is a time of crisis. With thousands of positive coronavirus cases across the country and the case count rising exponentially, people are rightly concerned. https://t.co/EG3AoBwRe6"
rosadelauro,1240063752336179201,2020-03-17 23:53:32,"As of this week, our New Haven, CT and Washington, DC offices are serving constituents remotely in order to protect the public health and prevent the potential spread of coronavirus. (THREAD) https://t.co/GAQC5PEacF"
rosadelauro,1240015931696386051,2020-03-17 20:43:31,Joined @WTNH yesterday afternoon to talk about what Congress is doing to deal with the coronavirus on the public health front and help ensure people are economically secure. https://t.co/9tRC14n9Hr
rosadelauro,1240000689700470784,2020-03-17 19:42:57,"I am disappointed that, in Congress’s latest coronavirus response bill, the administration has left out tens of millions of workers from access to meaningful paid sick days or longer term paid leave, including our frontline health care workers and first responders."
rosadelauro,1240000688614236168,2020-03-17 19:42:56,"As businesses and schools shut down to prevent the spread of the coronavirus, people are fearful of how they and their families are going to make ends meet. Congress has the power to change that—and we should."
rosadelauro,1240000687632781312,2020-03-17 19:42:56,"There has never been a more urgent need to expand paid sick days and paid leave to the workers of this country.
https://t.co/oaw2ikiNm9"
rosadelauro,1239368042381008897,2020-03-16 01:49:02,Excellent interview with @jkbrennan &amp; @ailsachang on how critical it is to follow @CDCgov and medical professionals’ guidance to avoid catching or spreading the coronavirus.  We have a responsibility to protect others and their families. https://t.co/FiykmK4lGf
rosadelauro,1238882657494274048,2020-03-14 17:40:17,"The hour may be dark, but we can be the light forward. People need a lifeline amidst this pandemic and when they are forced out of work. Let us show them that this community can help, and help them now."
rosadelauro,1238882656110227470,2020-03-14 17:40:17,"We are also providing $500 million for mothers and their children through WIC, as well as $400 million for food banks through the Emergency Food Assistance Program. This is to help people meet increased demand during this public health emergency."
rosadelauro,1238882654663200770,2020-03-14 17:40:16,"On sick days and #paidleave, these are temporary measures. While this will help millions, millions are still left out. So, I will build on these programs. It should not, and must not, take a pandemic to get working people the economic relief and stability they need."
rosadelauro,1238882653945901057,2020-03-14 17:40:16,"To help, we are providing free testing for coronavirus, funding to help stabilize the unemployment insurance system, 14 paid sick days for eligible workers as well as 12 weeks of paid leave for longer term care, and food assistance."
rosadelauro,1238882653098647553,2020-03-14 17:40:16,"No one should face the impossible choice of their health or their paycheck, but unless we act, countless workers may have to."
rosadelauro,1238882652381483013,2020-03-14 17:40:16,"This is a time of crisis. Last week we provided $8.3 billion to address the nation’s health needs. Now we are addressing the economic well-being of working people and middle-class families—paid sick days, paid family &amp; medical leave, unemployment insurance &amp; nutrition assistance."
rosadelauro,1238882651550998528,2020-03-14 17:40:16,"This will be the first time paid sick days and #PaidLeave legislation will be signed into law. I first introduced paid sick days legislation—the Healthy Families Act—in 2004, and paid family and medical leave legislation—the FAMILY Act—in 2013.

https://t.co/7e5Tc4ERK9"
rosadelauro,1238238213422166017,2020-03-12 22:59:30,I am glad that the USDA granted a waiver for Connecticut to ensure kids whose schools are shutting down will continue to have access to school meals. This is critical for keeping kids in low-income families from going hungry during the coronavirus public health emergency.
rosadelauro,1238172045646667780,2020-03-12 18:36:34,Proud to have worked with my colleagues @RepKatiePorter &amp; @RepUnderwood to ensure cost is not a barrier for people getting tested for coronavirus. @CDCDirector Redfield must uphold this commitment. https://t.co/hQpTzmyKeq
rosadelauro,1237945963865661440,2020-03-12 03:38:12,"This bill is directly targeted at helping working people and families affected by the coronavirus pandemic. Proud that it includes paid sick days, paid leave, food security, and free diagnostic testing for all who need it. https://t.co/3cyAfy9gti"
rosadelauro,1237462404780503045,2020-03-10 19:36:42,RT @NydiaVelazquez: One critical component of our nation’s response to #COVID19 must be ensuring workers have adequate paid sick time. My c…
rosadelauro,1237462360325009414,2020-03-10 19:36:32,RT @RepLindaSanchez: Workers shouldn't have to choose between their health and paycheck—especially during a public health emergency. Proud…
rosadelauro,1237462295195922434,2020-03-10 19:36:16,"RT @USRepKCastor: When you're sick, you shouldn’t have to choose between a paycheck &amp;staying home to safeguard yourself + others.

#Coronav…"
rosadelauro,1237462085031821312,2020-03-10 19:35:26,"RT @RepMikeLevin: It's simple: We want people to stay home if they’re feeling sick, but not everyone can afford to miss time. 

That’s why…"
rosadelauro,1237461978844745728,2020-03-10 19:35:01,RT @RepJohnLarson: American’s shouldn’t have to choose between putting food on the table &amp; following urgent public health recommendations.…
rosadelauro,1237420118176673794,2020-03-10 16:48:40,"We must be able to depend on our public health infrastructure at this critical time, and the CDC is fundamental to that infrastructure. That is why we are not going to cut the CDC’s budget, as President Trump’s budget proposal for next year would do. https://t.co/4mDDU2NQai"
rosadelauro,1237413935944523776,2020-03-10 16:24:07,The coronavirus outbreak is affecting people in the U.S. and around the world—with the first case just reported in South Africa. We must ensure the CDC can help stop the spread of this virus wherever it is. https://t.co/no4ZaitdUa
rosadelauro,1237408529155346433,2020-03-10 16:02:37,We also included funding for gun violence prevention research for the first time in more than two decades—and the CDC is moving forward with hearing from applicants for research grants.
rosadelauro,1237408447802589184,2020-03-10 16:02:18,"We urgently need to modernize our public health data systems at CDC, which is why I secured $50 million in last year’s funding bill to do just that. https://t.co/KV52TuX8ls"
rosadelauro,1237400979672379392,2020-03-10 15:32:38,"The U.S. remains behind the curve on diagnostic testing, and that needs to change immediately."
rosadelauro,1237400897103241216,2020-03-10 15:32:18,"Last week, we appropriated $2.2 billion for the CDC to deal with the coronavirus outbreak—much of which will go to state and local health agencies, who are on the frontlines dealing with this crisis. https://t.co/iZSwyi4sHi"
rosadelauro,1237400252455493633,2020-03-10 15:29:44,The delay in the distribution of testing kits has been unacceptable.
rosadelauro,1237400251360821248,2020-03-10 15:29:44,"Other countries have been testing thousands of people for weeks. But the U.S. is woefully behind the curve. The low number of positive tests in the U.S. is likely a by-product of under-testing, as opposed to an accurate count of the prevalence of coronavirus in the U.S."
rosadelauro,1237400140467646464,2020-03-10 15:29:17,The Coronavirus outbreak is a crisis and there are questions about our country's preparedness and ongoing response efforts. I am very concerned about our nation’s testing capabilities for coronavirus. https://t.co/2JYgUoZ98I
rosadelauro,1237059650392072194,2020-03-09 16:56:18,"“The US Department of Homeland Security recommends storing up enough food and water for two weeks before a pandemic strikes.”
 
For millions of people living paycheck to paycheck this isn’t possible. We need to expand food assistance programs immediately. 
https://t.co/aHbvrANizj"
rosadelauro,1236665181129904128,2020-03-08 14:48:49,"RT @RepRaulRuizMD: When it comes to fighting public health crises like #COVID19, we need to prepare for the worst as we work for the best.…"
rosadelauro,1236096090493120513,2020-03-07 01:07:28,Proud to lead this critical fight with @PattyMurray. All workers deserve paid sick days—especially during public health emergencies like the one we are currently facing. https://t.co/npDpe6fwno
rosadelauro,1236072814450532355,2020-03-06 23:34:58,Proud to lead this effort to ensure all people have access to affordable coronavirus testing with @RepKatiePorter &amp; @RepUnderwood. https://t.co/E2SoyG9Hzg
rosadelauro,1235667135025774592,2020-03-05 20:42:57,Proud to get this $8.3 billion emergency funding bill to the stem the spread of the coronavirus quickly to the President’s desk. Especially important to help our state and local health agencies at this critical time. https://t.co/ZxR1DYI76b
rosadelauro,1235218044298944515,2020-03-04 14:58:25,"Tune in at 10:00am as @NIHDirector and others testify before my subcommittee regarding the National Institutes of Health Budget Request for FY 2021, the coronavirus and more. 
https://t.co/4uaJaBbuuN"
rosadelauro,1234555496545357824,2020-03-02 19:05:41,"I’m a proud to work with my fellow @HouseDemWomen to fight for:

💵 Equal Pay
🏥 Better health care
🤰 Reproductive freedom
✊ Equality for all
#WomensHistoryMonth"
rosadelauro,1233151044944900096,2020-02-27 22:04:54,"RT @AppropsDems: 1 year ago, @HouseDemocrats passed #HR8 to help #EndGunViolence. @AppropsDems took further action, providing $25M to @CDCg…"
rosadelauro,1233025941745676289,2020-02-27 13:47:47,"RT @janschakowsky: Yesterday, @SecAzar refused to promise that a #coronavirus vaccine would be affordable to all.
 
House Democrats passed…"
rosadelauro,1232742239698325504,2020-02-26 19:00:27,"That is the wrong path, and as Chair of the Subcommittee that funds the Department of Health and Human Services: it is not going to happen on my watch."
rosadelauro,1232724505308663814,2020-02-26 17:49:59,Our federal government must be adequately prepared to deal with and prevent the spread of the coronavirus. That means having robust funding and a detailed plan of action—like President Obama and his administration presented when dealing with Ebola a few years ago. https://t.co/p2JIgYRKon
rosadelauro,1232671063391297536,2020-02-26 14:17:38,Tune in at 9:30am as @HHSGov @SecAzar defends the #TrumpBudget—which proposed $10.1 billion in cuts to essential health programs—before my Appropriations subcommittee. https://t.co/ekEhRFZQef https://t.co/ZyUZetBpfx
rosadelauro,1232379823395364875,2020-02-25 19:00:21,All while withholding key information about their efforts to date to stem the spread of the coronavirus.  That is unacceptable.
rosadelauro,1232379822623645697,2020-02-25 19:00:20,"The Trump administration wants Congress to rubber stamp their plan to steal funds from programs like medical research at the National Institutes of Health, school readiness for kids through Head Start, Ebola vaccine funding, and much more."
rosadelauro,1232379821503778825,2020-02-25 19:00:20,"The United States is in the midst of a public health emergency, yet last night's emergency supplemental funding request from the Trump administration lacks critical details necessary to ensuring we protect our people. 
https://t.co/ffyMO3R8HU"
rosadelauro,1230962455934885889,2020-02-21 21:08:14,"This week alone there were 9 flu-related deaths in Connecticut. If you not already gotten a flu shot, there is still time to get one to protect yourself and your family. https://t.co/Nje4GdtCou"
rosadelauro,1230159634746531840,2020-02-19 15:58:06,"The more than $10 billion in cuts to programs that provide groundbreaking medical research, home energy assistance for low income families, keep us safe from infectous diseases, and much more will threaten the health of people at every stage of their life."
rosadelauro,1230159553981034503,2020-02-19 15:57:47,"Next week, Health and Human Services Secretary Alex Azar will come before my Subcommittee to defend the President’s budget—which included considerable cuts to important programs at HHS. https://t.co/pgQS6rivqI"
rosadelauro,1229801071473831936,2020-02-18 16:13:18,"That is why as Chair of the Appropriations Subcommittee that funds the Department of Health and Human Services, I fight every year to increase funding at the National Institutes of Health."
rosadelauro,1228424591506395136,2020-02-14 21:03:40,"With so many lives lost each day, @HouseDemocrats have taken action. Last year, my Subcommittee dedicated $25 million to gun violence prevention research at the CDC and the NIH. The House also passed bipartisan background checks legislation, which Senator McConnell should act on."
rosadelauro,1227013749959254021,2020-02-10 23:37:29,"As Chair of the House Appropriations Subcommittee on Labor, Health and Human Services, and Education, we are going to continue investing in working people, the middle class, and the most vulnerable—not millionaires, billionaires, corporations, and special interests."
rosadelauro,1224878473237422085,2020-02-05 02:12:39,"President Trump’s #GOPTaxScam was rigged for millionaires, billionaires, and special interests. Meanwhile, working people are struggling to keep up with rising costs like healthcare, child care, and housing. #SOTU"
rosadelauro,1224806643331977217,2020-02-04 21:27:14,"People like Kristen are why I’m fighting to:
✅Lower Health Care &amp; Rx Drug Costs
✅Protect Ppl w/ Preexisting Conditions
✅Reverse Health Care Sabotage
#StateofHealthCare"
rosadelauro,1224806641398374402,2020-02-04 21:27:13,"Proud to welcome Kristen Whitney Daniels from Shelton, CT to join me at #SOTU and shine a light on our fight to improve the #StateOfHealthCare #ForThePeople https://t.co/nPYRtcTj58"
rosadelauro,1224408359153152000,2020-02-03 19:04:35,RT @jocelynmaminta: #WTNHHealth @WTNH @CTDPH @YNHH @rosadelauro - Increasing concerns of widespread #flu activity in Connecticut in wake of…
rosadelauro,1223325121043222529,2020-01-31 19:20:11,"RT @YNHH: Dr. Rick Martinello, Medical Director Infection Prevention @ynhhealth provides #flu updates and the impact it has on our communit…"
rosadelauro,1223325103716491264,2020-01-31 19:20:07,"RT @YNHH: Dr. Matt Cartter, State Epidemiologist, #Connecticut Department of Public Health, addresses concerns regarding the #coronavirus.…"
rosadelauro,1223325045465997312,2020-01-31 19:19:53,"RT @YNHH: .@rosadelauro tells us that at this time, the @CDCgov states the risk to the general public is low for #coronavirus. https://t.co…"
rosadelauro,1223325002843533318,2020-01-31 19:19:43,RT @YNHH: We welcome @rosadelauro for a press conference with health professionals and public health officials to give us an update on the…
rosadelauro,1222975562618220550,2020-01-30 20:11:10,"RT @RepBarragan: “Kickass Congresswomen Help Sick Migrant Six-Year-Old Girl,” @Wonkette 
 
It took village of Congress members to advocate…"
rosadelauro,1222298529240055808,2020-01-28 23:20:53,"Working people and middle-class families cannot afford more of the president’s giveaways to the wealthy and the well-connected. The single biggest economic challenge of our time is that people’s pay is not keeping rise with skyrocketing costs: health care, childcare, housing. https://t.co/d4J8BYHd9S"
rosadelauro,1221876702177046529,2020-01-27 19:24:41,"At the moment, prominent medical experts believe influenza poses a far greater risk to people across the United States than the coronavirus. In Connecticut, the Department of Public Health has already recorded 20 influenza-associated deaths this season."
rosadelauro,1221876701262753792,2020-01-27 19:24:41,"I will also be reintroducing the Public Health Emergency Fund Act, which would provide $5 billion to our woefully underfunded public health emergency fund."
rosadelauro,1221876700310654977,2020-01-27 19:24:41,"in real-time. The CDC has more than $100 million in a rapid response fund due to my Appropriations Subcommittee’s funding bill, and I am committed to working with our government’s public health officials to provide additional resources if necessary."
rosadelauro,1221876699152945153,2020-01-27 19:24:41,"The latest data on the spread of the Wuhan coronavirus in China and the United States is troubling. Given China’s disappointing record on food and medicine safety, our federal government must be proactive in combating this virus and transparent in providing available information"
rosadelauro,1220708657622659072,2020-01-24 14:03:18,Secretary DeVos could not be more wrong. Comparing a woman’s right to make their own healthcare decisions to slavery is reprehensible. DeVos has got to go. -Rosa https://t.co/gdyXStenhT
rosadelauro,1218303252783124480,2020-01-17 22:45:05,This is unacceptable. Kids need healthy lunches with more fruits and vegetables. This rule undermines our youngsters’ future and damages their health. https://t.co/TMgGqLZhQY
rosadelauro,1214989183581863937,2020-01-08 19:16:09,"REMINDER: There is still one week left to sign up or change your health insurance coverage for 2020. Visit https://t.co/DUWy7iqkfq to #GetCovered before January 15th. 

https://t.co/15dy1pT3Jv"
rosadelauro,1207075344882307072,2019-12-17 23:09:23,"RT @ConnHealthITeam: ""It's really unbelievable that women of color have no input into their schedules,"" Rep. @RosaDeLauro says.

""How do yo…"
rosadelauro,1207074600888262657,2019-12-17 23:06:25,"3 children have died from the flu in CBP’s custody, yet they have still not told Congress or the public if they will implement CDC’s health recommendations. That is unacceptable. https://t.co/D3G6kYNcPl"
rosadelauro,1206690350917664772,2019-12-16 21:39:33,"The funding for evidence-based research at @CDCgov &amp; @NIH will help us better understand the correlation between domestic violence and gun violence, how Americans can more safely store guns, and how we can intervene to reduce suicide by firearms."
rosadelauro,1206690350133383168,2019-12-16 21:39:33,"The epidemic of gun violence is a public health emergency. Yet, for more than two decades, Congress has failed to provide any meaningful reforms."
rosadelauro,1206689050318516226,2019-12-16 21:34:23,RT @NewtownAction: VICTORY for gun violence prevention today! The House and Senate negotiated $25 million for @CDCgov &amp; @NIH to study gun v…
rosadelauro,1205520817641205760,2019-12-13 16:12:15,REMINDER: The last day to sign up or change your health insurance coverage for 2020 is this Sunday. #GetCovered https://t.co/gnp7J3XlBt
rosadelauro,1199750465929515010,2019-11-27 18:02:56,"Diabetes impacts more than 350,000 people in Connecticut. That is why I fight every day as Chair of the Appropriations Subcommittee that funds efforts at @NIH &amp; @CDCgov to combat this chronic disease. #CountMeInADA"
rosadelauro,1199350702394499077,2019-11-26 15:34:24,"RT @BobMooreNews: After detained children started dying at the border last winter, CDC recommended that CBP give flu vaccines to migrants i…"
rosadelauro,1198279923036762113,2019-11-23 16:39:31,"Another romaine lettuce E. Coli outbreak—please check your fridges. This is unacceptable. @US_FDA and industry need to make serious reforms to prevent further foodborne illneess outbreaks, including through the long-delayed testing of agriculture irrigation water. https://t.co/Uk0h1HmgYd"
rosadelauro,1197574580010967042,2019-11-21 17:56:44,"RT @RepJoeCourtney: There is an urgent need for a federal response to this epidemic, and today the House will vote on #HR1309, my bill to r…"
rosadelauro,1194365034790629376,2019-11-12 21:23:09,"Although it has taken many years, this is a positive development. Gun manufacturers like Remington need to take responsibility for their role in the epidemic of gun violence plaguing our communities."
