rosadelauro,1192167780965109762,2019-11-06 19:52:03,People's health care should never be limited by another's beliefs. Glad to see this ruling against the Trump-Pence administration's refusal of care rule. #PutPatientsFirst https://t.co/zfe60Zw7R0
rosadelauro,1191437452319350784,2019-11-04 19:29:59,"Open enrollment has officially started. To buy or change your health coverage for next year, visit https://t.co/DUWy7iqkfq and get covered! https://t.co/LEGG9JgBV4"
rosadelauro,1188935322324930560,2019-10-28 21:47:24,"This bill is not a silver bullet to end the youth vaping epidemic—which is why I have called for a ban on all e-cigarette products and comprehensive legislation to address the issue—but it is a good start. Now that it passed the House, I urge the Senate to take it up immediately."
rosadelauro,1188935319913148416,2019-10-28 21:47:24,"Today, the House took an important first step toward addressing the youth vaping epidemic by passing @RepArmstrongND's and my bill, the Preventing Online Sales of E-Cigarettes to Children Act. https://t.co/QIdUSpMjk1"
rosadelauro,1187423360411754496,2019-10-24 17:39:25,"Thanks to America's leadership at the @CDC and @USAID,  two of the three types of polio virus have been eradicated from the world. This #WorldPolioDay, we renew our commitment to #EndPolio. Thank you @Rotary and @ShotAtLife! https://t.co/FqkWU8HuhS"
rosadelauro,1186671566203117569,2019-10-22 15:52:03,"Kicking off the #DemocraticWomensAgenda. All women deserve economic security, access to healthcare, and safety. https://t.co/3WtEJRgBac"
rosadelauro,1186362137104519173,2019-10-21 19:22:29,"LTSS is a critical part of healthcare in America, and Medicare for America takes the caregiving crisis head on by ensuring that no matter where you live, you will have the services and supports you need."
rosadelauro,1186362112307798024,2019-10-21 19:22:23,"Tara, I am so sorry for the loss of your grandfather. Your experience with long-term care is all too common in our country. That’s why my healthcare bill w/ @RepSchakowsky, Medicare for America, established the gold standard for long term services and supports. https://t.co/ee6ABoKKF4"
rosadelauro,1184467586475593729,2019-10-16 13:54:13,Congress must act with urgency to address this growing epidemic. https://t.co/alBKuTupKV
rosadelauro,1182289203851415552,2019-10-10 13:38:06,"On #WorldMentalHealthDay, we must continue the work to expand and guarantee access to affordable, quality mental healthcare, and Medicare for America will do just that."
rosadelauro,1182289203197034499,2019-10-10 13:38:06,"And second, #Med4America also bans private contracting, which exacerbates barriers to mental healthcare. Currently, we have a two-tiered system where only the wealthy can afford care. #Med4America fixes that."
rosadelauro,1182289202383409152,2019-10-10 13:38:06,"First, #Med4America gives mental health providers incentives to enter the pool. To increase care, we must increase the number of providers. Reimbursement rates are raised at least 30%, and our bill forgives 10% of student loan debt for each year the provider takes #Med4America."
rosadelauro,1182289201657724928,2019-10-10 13:38:06,"Medicare for America would help solve this by guaranteeing universal, affordable, quality healthcare, and tearing down barriers to mental healthcare in two key ways. #MentalHealthAwarenessDay"
rosadelauro,1182289200915402752,2019-10-10 13:38:06,"Why so few? Too often, it is nearly impossible to find a mental health provider who accepts insurance. In a @NAMICommunicate survey, 1/3 of those seeking mental healthcare reported they could not find a single provider who took their insurance."
rosadelauro,1182289200177123329,2019-10-10 13:38:05,"On #WorldMentalHealthDay, let's talk about how Congress can ensure that all Americans get the care and treatment they need. Right now, only around 40% of people suffering from a mental illness seek or get treatment. [thread]"
rosadelauro,1180110724124872709,2019-10-04 13:21:36,"As Chair of the Labor, Health and Human Services, and Education Appropriations Subcommittee, I will be holding a hearing on October 16, 2019 to examine the increasing risk of e-cigarette use on public health."
rosadelauro,1180110723340476417,2019-10-04 13:21:36,"For years, the @US_FDA has abdicated their regulatory responsibility by allowing dangerous e-cigarette products to remain on the market without any review of their health effects.Their job is to protect the public’s health, and there is no greater failure than this tragic news."
rosadelauro,1179867978185228289,2019-10-03 21:17:01,"If you are looking for help in navigating Medicare and making enrollment decisions, your local State Health Insurance Assistance Program can help https://t.co/8qjeW8AubW."
rosadelauro,1177340396915101696,2019-09-26 21:53:19,"1 in 3 families do not have enough diapers to keep their children clean, dry, and healthy. With @RepBarbaraLee I am proud to sponsor the National Diaper Need Awareness Week resolution in the House. https://t.co/aQ1mJLoO98"
rosadelauro,1174757066369622016,2019-09-19 18:48:05,"Youth vaping is reaching epidemic levels. The chemicals in e-cigarettes are dangerous, and they are causing people to fall ill and to die. That’s why I’m proud to be a founding Member of the Congrassional Caucus to #EndYouthVaping. https://t.co/OAWx1NrfH4"
rosadelauro,1174408885823844352,2019-09-18 19:44:32,Proud to kickoff the new Caucus to End the Youth Vaping Epidemic tomorrow w/ @CongressmanRaja &amp; @RepPeteKing. We cannot allow our youngsters to fall prey to dangerous products that should be taken off the market. #EndYouthVaping https://t.co/eVVItVtlNv
rosadelauro,1174387476095492098,2019-09-18 18:19:28,"RT @CNNPolitics: Democratic congresswoman during a House hearing on the mental health of detained migrant children: ""They suffered by our h…"
rosadelauro,1174323901301698560,2019-09-18 14:06:50,LIVE NOW: Holding a hearing on the mental health needs of unaccompanied children in our federal government's care. https://t.co/Ic5XaM8rA3
rosadelauro,1172508921820516357,2019-09-13 13:54:45,"RT @ynhhealth: Join us this morning, LIVE on @YNHH's Facebook page at 10:30 AM with Congresswoman @rosadelauro for a press conference discu…"
rosadelauro,1172267500916137987,2019-09-12 21:55:26,The @usedgov publicly shames Health Education Assistance Loan borrowers who default on their loans by posting their names in the Federal Register. This practice is disheartening and perpetuates a senseless stigma against borrowers struggling with thousands of dollars of debt. https://t.co/EFefL28Im3
rosadelauro,1171883094963625990,2019-09-11 20:27:57,"Today’s announcement from President Trump that the FDA may consider banning flavored products is long-overdue, but will not fully address the public health crisis. We need bold, decisive action to solve it. https://t.co/IdQptHYRkP"
rosadelauro,1171835140462579720,2019-09-11 17:17:23,"California's landmark bill to reclassify contract workers as employees is an enormous step in unrigging the system on behalf of all workers and their families. Employee status is about a living wage, and benefits like unemployment insurance, health care and paid time off."
rosadelauro,1171426138444509184,2019-09-10 14:12:10,"Research has shown that flavored e-cigarettes are causing youth vaping epidemic, and we are seeing the consequences every day. FDA failed to review them before allowing them to be sold. They need to be taken off the market. https://t.co/nbwCQl7CdP"
rosadelauro,1171182130556211200,2019-09-09 22:02:34,The FDA failed to conduct any review of e-cigarettes before allowing them on the market. We cannot allow this epidemic to continue unchecked. https://t.co/kDWwZs0ADp
