rosadelauro,1322183116912533505,2020-10-30 14:26:34,"With this new data, New Haven reverting back to Phase 2, &amp; with Ansonia, Middlefield, &amp; Waterbury being red spots, we are not at all in the clear. 

Wear a mask, wash your hands, stay home if you can, and if you can’t, please distance yourself from others."
rosadelauro,1322183115910111232,2020-10-30 14:26:34,"I'm deeply concerned by today’s 6.1% positivity rate, the highest since June 1 &amp; the new report from @YaleSPH showing #COVID19 concentrations in the New Haven area. 

In the past, this research accurately predicted a surge in hospitalizations 3-5 days out. https://t.co/vWflb5m4Si"
rosadelauro,1321914911916785665,2020-10-29 20:40:49,"I'm proud to see this #CARESAct funding reach CT’s small businesses. 

If you run a small business or non-profit with less than 20 employees, apply for this federally funded grant to help with COVID-19 recovery. 

More information can be found here⤵️ https://t.co/DDJMo9rqMj"
rosadelauro,1319686647383031810,2020-10-23 17:06:29,"Once again the President and Stephen Miller are trying to turn CDC into an immigration enforcement agency. It is a public health agency.

There is not a world in which putting children in unlicensed hotels with strangers is the safest course of action.

https://t.co/9TyfhKbx5i"
rosadelauro,1319632219200258048,2020-10-23 13:30:13,"Still waiting for that Republican health care plan the American people were promised. 
 
The attack on #ACA and coverage for preexisting conditions has gone on for four years with no new plan in sight. 

Because they don’t have one. https://t.co/K5pFOpqemm"
rosadelauro,1319355413800882178,2020-10-22 19:10:17,"Proud to use my leadership in the House to bring federal dollars back to CT. As the chair of the subcommittee that funds CDC, this $20M will improve our District’s ability to respond to #COVID19.

We must get this pandemic under control. 

https://t.co/6oITsr5kGg"
rosadelauro,1318236109890068480,2020-10-19 17:02:34,"As a lifelong advocate of our arts and culture industry, I am fighting hard to secure additional relief for the artists and artistic entities that are a foundation of Connecticut’s economy. 
 
COVID-19 is jeopardizing and gutting this industry.
 
https://t.co/71RTbSNPfv"
rosadelauro,1318232090752786432,2020-10-19 16:46:36,"The CDC order is not enough to stop the wave of evictions. Landlords can still claim that a tenant violated the terms of a lease or didn’t abide by the payment plan. This is unacceptable. 

https://t.co/zX58CYu0vA"
rosadelauro,1317194687044866050,2020-10-16 20:04:20,"Rolled up my sleeves today for a fast, easy, and more important than ever flu shot!

I got mine at the free, public @NHPublicHealth Flu Shot Clinic. What’s your plan to get a flu shot? 👇 https://t.co/dlAhfET4Oo"
rosadelauro,1317165307342053376,2020-10-16 18:07:35,"Always happy to team up with @RepKatiePorter for a fight 💪

This policy change is ridiculous. Telehealth has been a critical tool for Connecticut’s providers and patients during this pandemic. https://t.co/QUwOyqFeAP"
rosadelauro,1315716121878827010,2020-10-12 18:09:02,"Instead, we are witnessing a hearing today led by Republicans. Rather than fighting for the people and serving their constituents, they are rushing to confirm a Justice who shares their commitment to stripping health care from millions.
 
This is disgraceful and shameful."
rosadelauro,1315716119290957824,2020-10-12 18:09:02,"In the middle of a pandemic, as the death toll rises and millions are unemployed and without food or safe child care, Republicans continue to play games and refuse to work in good faith on a relief package."
rosadelauro,1314267690673090561,2020-10-08 18:13:30,"Connecticut has seen a 75% increase in COVID-19 cases over the last two weeks. We cannot let our guard down now–the impact is real. Get tested, wear a mask, social distance—people's lives depend on it. https://t.co/MNNBHxcmNS"
rosadelauro,1314233440565424129,2020-10-08 15:57:24,"This week I joined @ChrisMurphyCT &amp; local leaders to thank the front line workers &amp; doctors at Fairhaven Community Health Center in New Haven for the incredible work they have done &amp; continue to do to fight COVID-19. If you need a test, get a test—they offer free testing M-F, 9-5 https://t.co/Lj1G8YXCCR"
rosadelauro,1313626630821216256,2020-10-06 23:46:09,RT @ddiamond: New: Democrats are seeking to block taxpayer funds for a pre-election Trump ad campaign to “defeat despair” about coronavirus…
rosadelauro,1313178011311636480,2020-10-05 18:03:30,RT @RepJimmyGomez: The Families First #Coronavirus Response Act expanded #PaidSickLeave &amp; #PaidFamilyLeave for millions of Americans during…
rosadelauro,1311723528958488578,2020-10-01 17:43:54,RT @theappeal: The COVID-19 pandemic has exposed America’s ongoing crisis of inadequate childcare for working families. Today on #TheBriefi…
rosadelauro,1311435756989231105,2020-09-30 22:40:24,Thrilled to work with @RepAOC to protect tenants from predatory landlords. The last thing renters need during this pandemic is to wait weeks for the results of a FOIA request to know if their home will be hazardous to their health. https://t.co/04hxHrcDqW
rosadelauro,1311435069651910656,2020-09-30 22:37:40,"I wish the circumstances were different, but I'm thrilled to have helped lead the charge to include $8B for nutrition programs. #COVID19 continues to leave families struggling to keep food on the table.

It's now up to the President to sign this legislation without hesitation."
rosadelauro,1311342769391063040,2020-09-30 16:30:54,"RT @RepHaleyStevens: The CDC must collect and publish data tracking the spread of COVID-19 in our schools. 

Students, parents, teachers, s…"
rosadelauro,1310967115482976256,2020-09-29 15:38:11,"RT @LaborProject: The #HEROESAct will close gaps &amp; ensure all working people have emergency #paidsickdays &amp; #paidleave during the pandemic,…"
rosadelauro,1310948639683104768,2020-09-29 14:24:46,"With leadership from the onset, President Trump would not find himself coercing the CDC and risking lives to hide his completely failed response."
rosadelauro,1310743022032900096,2020-09-29 00:47:43,"➡️$7B for Child Care Development Block Grants
➡️$225B to support the educational needs of States, school districts, and institutions of higher education in response to coronavirus

We must pass this critical relief."
rosadelauro,1310743020094930945,2020-09-29 00:47:43,"The new #HeroesAct also includes critical relief to protect &amp; rebuild our communities. Some highlights:

➡️closes loopholes in paid leave to keep workers employed &amp; prevent them from having to choose between their health &amp; job security
➡️$50B for Child Care Stabilization Grants"
rosadelauro,1310732883632381953,2020-09-29 00:07:26,RT @NPWF: The #HEROESAct will close the gaps and ensure all working people have emergency #paidsickdays and #paidleave during the #coronavi…
rosadelauro,1309241949904306178,2020-09-24 21:23:00,"This year alone we have seen more than 12,000 deaths and more than 425 mass shootings all while McConnell has let #HR8 sit on his desk with no action for 575 days. Today we #WearOrangeMasks to keep up the pressure on the Senate to take action. https://t.co/n0gcRmxbE0"
rosadelauro,1308827529323704320,2020-09-23 17:56:14,"Senate inaction on spending bills &amp; the #HeroesAct is inexcusable, but we have not given up. Legislation passed yesterday to keep our government open includes critical investments like extending pandemic EBT benefits and Child Nutrition waivers."
rosadelauro,1308170808972308480,2020-09-21 22:26:40,"200,000 is hard to wrap my head around. We must not become desensitized to the great loss of human life.

Praying for the families and communities who have lost loved ones to this pandemic. It did not have to be this way. I will not stop fighting for you and those we have lost."
rosadelauro,1308146039065661447,2020-09-21 20:48:14,RT @RepDavidTrone: The #COVID19 pandemic is costing MD nearly $33 million in additional annual childcare costs. That's why I am a proud cos…
rosadelauro,1308098359895433218,2020-09-21 17:38:46,"Enough is enough. @CDCgov, this constant ping pong only erodes the public confidence at a time when you should be the most trusted public health voice. https://t.co/izDEugy7oV"
rosadelauro,1306992568752889856,2020-09-18 16:24:45,"We’re delivering #ForThePeople, but @senatemajldr and Republicans are standing in the way because of special interests. With #COVID19 threatening lives and livelihoods, the stakes are higher than ever. https://t.co/GbB08qNyas"
rosadelauro,1305662243380621312,2020-09-15 00:18:31,"It is not the mission of the Department of Health and Human Services to get the President reelected. Michael Caputo must resign immediately. If he does not, Secretary Azar must fire him."
rosadelauro,1305521715926237184,2020-09-14 15:00:07,I completely agree. Our community hospitals are struggling while multi-billion-dollar private equity firms are given interest-free loans. This is unacceptable. https://t.co/upcQY4XkSK
rosadelauro,1304826679379005449,2020-09-12 16:58:17,"I want to thank the CDC staff, that despite intimidation from Trump’s political communications hires, are fighting to ensure that the truth is out there. I have your back in Congress and my colleagues do too.
https://t.co/TsHDqxKR0b"
rosadelauro,1304826676858310656,2020-09-12 16:58:16,"This is disturbing but not shocking. It’s simply the latest addition to the list of atrocities this president and his administration have committed that have cost nearly 200,000 deaths.
 
My full statement on the Trump admin’s CDC report interference here: https://t.co/piL4ylsR6G"
rosadelauro,1304515338634227712,2020-09-11 20:21:08,"It’s all about the color! Who’s starting #MaskRater?

Thank you @ChrisMurphyCT for bringing us together. While CT is leading the way in the COVID response, there is more to be done to help towns like Wallingford to get back on its feet. https://t.co/vFLYtD50ER"
rosadelauro,1304148610221772801,2020-09-10 20:03:53,"RT @Ilhan: We are facing multiple crises: climate catastrophe, pandemic, economic depression, and systemic racism.
 
Today I co-lead the TH…"
rosadelauro,1304101645509447683,2020-09-10 16:57:15,"Today, on World Suicide Prevention Day, I’m proud to announce CT’s Department of Public Health will receive $3.5 million in federal funding for suicide prevention. 

This funding is part of $10 million in CDC funding for suicide prevention I included in the FY20 spending bill. https://t.co/p0ApBT6AhK"
rosadelauro,1301919243588562946,2020-09-04 16:25:10,"If you missed last night's Tele-Town Hall on #COVID19 with @ashishkjha hit my SoundCloud for the full discussion⤵️

https://t.co/VlxMSQjK1K"
rosadelauro,1301621593626599424,2020-09-03 20:42:25,I just sent a letter to HHS Secretary Azar asking for details on the taxpayer-funded $250 million communications campaign. The American People deserve to know if their money is going to a political campaign stunt over investments in their health. https://t.co/ZinLadc1P0
rosadelauro,1300918633992990721,2020-09-01 22:09:06,My statement on the U.S. Department of Health and Human Services $250 million ‘Defeat Despair’ taxpayer-funded public relations campaign⤵️ https://t.co/7zjbguGewz
rosadelauro,1299113862231277568,2020-08-27 22:37:35,"Changes to testing, made quietly by CDC, fly in the face of science. Countries that have controlled the spread of COVID-19 do not just test those with symptoms.

Funding was not provided for the purpose of minimizing the case count.

We need answers to these political changes. https://t.co/JGUpV2ngww"
rosadelauro,1296112746925301761,2020-08-19 15:52:14,".@JoaquinCastrotx and I have yet to receive a response to our July 15 letter. We, and our 70+ colleagues, need answers on this administration’s use of the pandemic to realize its longstanding aim of shutting out unaccompanied children and asylum seekers from the United States. https://t.co/lR0Sx9MlN9"
rosadelauro,1295845068201439232,2020-08-18 22:08:34,"Thank you @GriffinHospital CEO Patrick Charmel for joining me today to highlight the impact of the $8.7M I helped secure in #COVID19 relief for Griffin.

Our partnership and advocacy were key to securing this funding.

CT hospitals need more. The Senate must pass the #HeroesAct. https://t.co/S2Qyhly8wJ"
rosadelauro,1295054737835003904,2020-08-16 17:48:05,"This is incredible, promising news coming from Yale. I’m hopeful this less invasive, less expensive test means we are one step closer to stopping the spread of COVID-19 and ending this pandemic. https://t.co/42dRGGarlV"
rosadelauro,1293312935419404288,2020-08-11 22:26:47,"Findings in this report are another example of this administration's fumbled response to #COVID19 &amp; the continued sacrifice of working families. 

It is our duty to protect workers. The #FamiliesFirstAct must be implemented as passed and signed into law.

https://t.co/zELhhfytTF"
rosadelauro,1291372617421783040,2020-08-06 13:56:39,"RT @RepKatiePorter: While community hospitals struggle, @HHSGov and @CMSGov are giving interest-free loans to healthcare companies backed b…"
rosadelauro,1288872460159537153,2020-07-30 16:21:55,"Together, we are making investments for the nation: for health, for education, and for good-paying, safe and secure jobs, and to address the disparities that have been exposed by this virus. 
 
I was proud to speak this morning in support of this critical spending bill. https://t.co/jafCpSgv6q"
rosadelauro,1288186727224487936,2020-07-28 18:57:03,"If not, we will surely see a wave of mass evictions across the country, unlike anything we have seen in modern history, given the COVID-19 pandemic."
rosadelauro,1287452984486637569,2020-07-26 18:21:25,"30 years ago today The Americans with Disabilities Act became the law of the land—extending protections to some of our nation’s most vulnerable. The pandemic has shown that these protections are needed now more than ever.
https://t.co/TIbvvItpij"
rosadelauro,1286794593229516803,2020-07-24 22:45:13,Read this entire thread. It's important. CDC should be protecting our families. https://t.co/tMq60cRcD7
rosadelauro,1286721636243251200,2020-07-24 17:55:18,"RT @RepBarbaraLee: Racism is a public health crisis. 

We can't address this pandemic without addressing systems of racism and oppression."
rosadelauro,1286395022896705536,2020-07-23 20:17:28,The administration is using the pandemic as a pretext to realize its longstanding aim of shutting out unaccompanied children and asylum seekers from the United States.
rosadelauro,1286395021709791232,2020-07-23 20:17:27,"We need to be paying attention to the abuse and atrocities committed by this administration under the guise of stopping the spread of the coronavirus. 

I sent a letter on this to Secretary Azar and Director Redfield and requested a response by July 20—but I’ve heard nothing."
rosadelauro,1286032230423429120,2020-07-22 20:15:51,Wear a damn mask. #OnWednesdaysWeWearPink masks. https://t.co/9YI6WdhaP5
rosadelauro,1286001060704903180,2020-07-22 18:12:00,"The United States is the only high-income country in the world without universal #PaidSickLeave. RIGHT NOW millions of Americans are being forced to choose between a paycheck and protecting their health. 

Read more from @JECDems here: https://t.co/GB8IRA2aG1 https://t.co/CpfobMQQhj"
rosadelauro,1285670537080049671,2020-07-21 20:18:37,"We cannot pass a relief package that doesn’t expand emergency paid sick &amp; family leave benefits. 

~106 million workers—disproportionately lower-wage workers, women, Black &amp; Latinx workers—were left out of previous relief. This is simply unacceptable.

https://t.co/Xos1spSxNB"
rosadelauro,1283515309140451338,2020-07-15 21:34:30,"For decades, @USDA has enabled corporate meatpackers to exploit black and brown workers in America’s dangerous meat and poultry plants. COVID-19 has exposed these injustices and compounded the problem. https://t.co/IohQz5bPer"
rosadelauro,1283208143921651713,2020-07-15 01:13:57,"HHS has been operating as a dangerous, political apparatus and cannot be trusted to share accurate hospital information with Congress and the American public.
 
He can try to intentionally hide the exploding number of cases, but the people will not be fooled."
rosadelauro,1283208135591841794,2020-07-15 01:13:55,Reports that the administration ordered hospitals to bypass CDC and send coronavirus patient information to a central database in Washington are in direct violation with the law – this reporting is not optional.
rosadelauro,1283121542843584512,2020-07-14 19:29:49,I’ve been proud to introduce the Eviction Prevention Act that would provide low-income individuals with an attorney for eviction cases and create an evictions database. https://t.co/TCbIuYe9Va
rosadelauro,1282810789691371520,2020-07-13 22:55:00,"Programs in this spending bill are at the center of the country’s health crisis &amp; the economic crisis, both of which have exposed serious disparities. 

In the absence of leadership from the White House, Congress continues to step in. Watch my remarks from today's markup here: https://t.co/LfCLZJ10cc"
rosadelauro,1281953803730919424,2020-07-11 14:09:39,RT @RepMcEachin: Communities that have disproportionately suffered from environmental injustice &amp; are now hardest hit by the coronavirus cr…
rosadelauro,1281608716727582720,2020-07-10 15:18:23,"As co-chair of the Long Island Sound Caucus, I am proud to have secured record funding in the interior spending bill for the Long Island Sound program. This legislation prioritizes the long-term health of one of our greatest natural treasures. https://t.co/hTH1jYrdoR"
rosadelauro,1281012574755131397,2020-07-08 23:49:32,"For @CDCgov to be “credible,” it can’t be changing its guidelines to meet the president’s political needs. https://t.co/dweKI1sl6w"
rosadelauro,1281012571240357890,2020-07-08 23:49:31,"We’re talking about the safety of our children, a matter far too serious to be playing politics. @CDCgov it is your mission to protect the nation’s health based on science. @CDCDirector stop enabling him."
rosadelauro,1280877623426584577,2020-07-08 14:53:17,"The Supreme Court just issued a dangerous ruling that once again makes it more difficult for many to receive birth control through their health plans. Access to birth control should not depend on where you live, work, or go to school. #HandsOffMyBC https://t.co/He2pMMEMbv"
rosadelauro,1280316702438428675,2020-07-07 01:44:23,"RT @AppropsDems: 5 PM Tuesday: @rosadelauro will lead the Labor, Health and Human Services, Education Subcommittee as it markups its FY 202…"
rosadelauro,1280287887930654721,2020-07-06 23:49:53,"#COVID19 has pinpointed to us where our support system is not as strong as we believed it to be, as strong as our families, our farmers &amp; our food workers need it to be. I'm glad this bill is making short-term &amp; long-term investments. My remarks on the FY21 ag spending bill⤵️ https://t.co/J8Loyv8ykH"
rosadelauro,1279436235510071296,2020-07-04 15:25:43,"Wishing everyone a safe &amp; happy #4thofJuly 🇺🇸

As a nation, I hope that we can spend today reflecting on our history &amp; commitment to creating a more just &amp; fair society for all. 

Please remember to take necessary precautions to protect yourself &amp; your loved ones from COVID-19."
rosadelauro,1279183235906449415,2020-07-03 22:40:24,Wear a mask.
rosadelauro,1278028527569219584,2020-06-30 18:12:00,"Schools across the country are planning to reopen in a few months. Without adequate funding, millions of youngsters &amp; teachers are at risk for COVID-19. Congress must #FundOurPublicSchools to ensure our schools are properly equipped with the tools they need to safely reopen."
rosadelauro,1276572394681962497,2020-06-26 17:45:51,"#COVID19 continues to cause devastating health &amp; economic impacts for women &amp; their families, especially women of color. @HouseDemocrats passed a relief package weeks ago, yet @SenateMajLdr has left it sitting on his desk with no new plan. Senate GOP must pass the #HeroesAct now."
rosadelauro,1276533595151249409,2020-06-26 15:11:40,The Trump administration's attempt to take away affordable health coverage for millions of Americans is indefensible—especially during the COVID-19 pandemic. This administration’s cruelty knows no bounds. https://t.co/R61yPjrDDg
rosadelauro,1276230842889703428,2020-06-25 19:08:38,"The George Floyd Justice in Policing Act is a timely, critical, and transformative start to addressing the issues millions of Americans have been protesting about. I am proud to be an original cosponsor of this bold legislation. Watch my full remarks here⤵️ https://t.co/Z1L4vg9XRT"
rosadelauro,1275517748060307458,2020-06-23 19:55:03,RT @HouseBudgetDems: #COVID19 has exacerbated underlying health &amp; economic inequalities. That’s why right now @HouseBudgetDems are holding…
rosadelauro,1275166181574488065,2020-06-22 20:38:03,"Getting any sort of information from this administration has been virtually impossible during this pandemic, and taxpayers have a right to know how their dollars are being spent on COVID-19 drugs. https://t.co/Qe0Cy1v5EV"
rosadelauro,1275166180152684549,2020-06-22 20:38:03,"Today, I am proud to co-lead bipartisan legislation to prevent price gouging, prohibit monopolies, &amp; ensure transparency on taxpayer funded COVID-19 drugs. Big Pharma has taken advantage of government investment in biomedical research by price gouging customers. https://t.co/UCMcjnQ8mW"
rosadelauro,1273640244940857345,2020-06-18 15:34:32,"RT @RepKatiePorter: Surprise, surprise—@SecAzar has been giving relief funds to healthcare companies backed by private equity while communi…"
rosadelauro,1273640217203879936,2020-06-18 15:34:25,"RT @BillPascrell: While community hospitals are struggling to survive against covid, the trump administration is lavishing interest-free lo…"
rosadelauro,1272892315489783810,2020-06-16 14:02:31,"The Colorado Legislature yesterday ended their 2020 session by passing a permanent, statewide paid sick days law. No one should have to choose between their health or a paycheck—this is a step in the right direction. We need #PaidSickDays for all.
https://t.co/cr5KJkwJWT"
rosadelauro,1272580138367148040,2020-06-15 17:22:03,"Due to safety concerns, the FDA will withdraw emergency use authorization for hydroxychloroquine to treat COVID-19. 53 days ago, I asked @SecWilkie to stop prescribing our veterans the dangerous, ineffective drug &amp; still have not received a response. Our veterans deserve better."
rosadelauro,1271558078882775041,2020-06-12 21:40:45,"HHS just finalized a rule rolling back civil rights protections put in place by the Obama Admin. that prevents discrimination in health care and coverage. This attack is sickening, especially during #Pride &amp; on the 4th anniversary of the #Pulse shooting, but not surprising."
rosadelauro,1271493718147653633,2020-06-12 17:25:00,Today marks 50 days since I wrote @SecWilkie demanding answers on why our veterans continue to be prescribed hydroxychloroquine for COVID-19. 50 days and no answer.  The American people and our veterans deserve better. https://t.co/WMkMLdYgFq
rosadelauro,1270750660724764675,2020-06-10 16:12:21,"RT @jahimes: Morad Tahbaz, my constituent, has been unjustly held by Iran for years. He is vulnerable and in failing health. I have asked @…"
rosadelauro,1269407066810171395,2020-06-06 23:13:23,"Let’s end the virus of injustice. Proud to have joined the peaceful protest today in Washington, D.C. https://t.co/acYyFuXUHq"
rosadelauro,1269045277048045568,2020-06-05 23:15:46,"On #GunViolenceAwarenessDay I wear orange to honor those whose lives were taken due to gun violence. We can never make up for the loss of a loved one, but their families’ enduring strength is what keeps me going on the job to stop the gun violence epidemic. https://t.co/6wtjwkyQek"
rosadelauro,1268674301479223298,2020-06-04 22:41:38,"This moment exposes so may wrongs, deep inequality, and racial wrongs. And that as we fight the COVID-19 virus before us now, we must also fight the virus of injustice."
rosadelauro,1268674253597048833,2020-06-04 22:41:27,"This afternoon, there was a memorial service for George Floyd. For the last few months around the pandemic, we have been talking about how to get back to normal. However, what we can hear in the chants for justice and the cries for equality is that going back is not good enough. https://t.co/iepqml5WYw"
rosadelauro,1268608449547567105,2020-06-04 18:19:58,"Science and public health cannot be undermined or challenged by people who do not understand science or public health. The CDC is being undermined by the Administration, and we must hear directly from the scientists at the CDC. https://t.co/Q99fg3ClDp"
rosadelauro,1268599382636744705,2020-06-04 17:43:56,"This fall, we will face the flu &amp; the coronavirus at the same time—people must be vaccinated. With companies across the country racing towards a vaccine, &amp; the strain that it will put it will put on hospitals, &amp; infrastructure, we need a budget from the CDC—and we need it now. https://t.co/E4hZlNozgu"
rosadelauro,1268581990640599045,2020-06-04 16:34:50,"We are being told that it is safe to reopen. 20,000+ new cases, 1,000+ deaths. We do not have the resources we need to prevent more deaths. The Federal response to COVID-19 has been inconsistent and incoherent, and the President wants us to pretend like it is business as usual. https://t.co/JE9IMYmw3C"
