rosadelauro,1268579427748925442,2020-06-04 16:24:39,"We cannot stop the risk from this virus overnight, but in the months to come, we can spare the American people from unnecessary misery, illness, and death."
rosadelauro,1268579346551275525,2020-06-04 16:24:19,Our nation is in turmoil. The coronavirus is the biggest public health crisis we have experienced in at least a century and the Federal response has been inconsistent and incoherent. https://t.co/xXbReRqz0t
rosadelauro,1268558127890227201,2020-06-04 15:00:01,"HAPPENING NOW: Tune in live as @CDCDirector Dr. Robert Redfield provides an update on the CDC's response to COVID-19 before my House Appropriations subcommittee. The American people deserve answers.
https://t.co/QTPR38U5Mv"
rosadelauro,1268184207911772160,2020-06-03 14:14:11,"CT families can now use their SNAP benefits to purchase groceries online. COVID-19 has exacerbated the problem of hunger in our communities, and this is an important step in helping more people safely put food on the table at this critical time. https://t.co/vjDuOPMU72"
rosadelauro,1267836815555395587,2020-06-02 15:13:46,Welcomed news! @CTDOTOfficial will receive an additional $206M that will go directly to CTtransit &amp; the New Haven Line rail service as a result of the CARES Act. This funding will ensure that are able to maintain &amp; manage our public transportation system in response to COVID-19.
rosadelauro,1267464229398949889,2020-06-01 14:33:15,Day 39: Still no response from @SecWilkie to my letter on veterans being prescribed hydroxychloroquine for COVID-19. How many more days will it take for you stop putting their lives in jeopardy from this dangerous drug? Our veterans deserve an answer.
rosadelauro,1266020308047233027,2020-05-28 14:55:37,Day 35. Still no answers from VA Secretary Wilkie to my letter on our veterans being prescribed hydroxychloroquine for COVID-19. Will you address this issue at the hearing you’re testifying at today? The science is clear—this is dangerous to their health. https://t.co/CZ0rXu8r4j
rosadelauro,1265807316592537601,2020-05-28 00:49:16,"Tragic. And the White House still does not have a national plan for testing, contact tracing, isolation, and quarantining. That is unacceptable. https://t.co/Ux6ZQzmuIY"
rosadelauro,1265755315372535812,2020-05-27 21:22:38,Day 34 and still no response from @SecWilkie and the Trump administration on veterans being prescribed hydroxychloroquine for COVID-19. Their lives are at risk from this dangerous drug and Congress deserves answers.
rosadelauro,1265338360211668994,2020-05-26 17:45:48,33 days and counting since I sent a letter to @SecWilkie on veterans being prescribed hydroxychloroquine for COVID-19. Still no response. https://t.co/LkpnVkzrDM
rosadelauro,1263952271399948288,2020-05-22 21:57:59,New study confirms what we knew in April when I wrote to VA Secretary Wilkie: hydroxychloroquine increases COVID-19 patients' risk of death. It’s been a month and still no response. Why are veterans being prescribed this drug? We need answers. -Rosa https://t.co/DUZWpmU6bw
rosadelauro,1263574934149832704,2020-05-21 20:58:35,Online purchases for Connecticut families with SNAP benefits will help them keep food on their table while mitigating the spread of COVID-19. https://t.co/xH3YkmK5nO
rosadelauro,1263478845493121025,2020-05-21 14:36:45,"RT @Columbia: How is our current income support system responding to the COVID-19 crisis? On 5/21 at 12PM, @rosadelauro will join @nytimes'…"
rosadelauro,1263222700996268033,2020-05-20 21:38:56,"COVID-19 has exacerbated the problem of hunger in our communities, which makes helping families put food on their table is more critical than ever."
rosadelauro,1263222700220309505,2020-05-20 21:38:55,"The coronavirus pandemic has hit Connecticut particularly hard, so innovative solutions like this that help prevent the spread of this deadly disease are critical to defeating this public health and economic crisis."
rosadelauro,1263184834899435520,2020-05-20 19:08:28,"Last week, the House of Representatives passed the HEROES Act—a new coronavirus response package that greatly expands our nation's social safety net. The Heroes Act will help protect our workers, our families, our small businesses, and those who have fallen through the cracks. https://t.co/sg7lvW4LaJ"
rosadelauro,1263161866907459586,2020-05-20 17:37:12,Many essential workers will continue to be forced to work without paid sick leave unless the Senate acts upon the HEROES Act. Workers should never have to choose between their health and a paycheck—new polling data shows the American people agree: https://t.co/RI0yNCtzpr
rosadelauro,1262518219400773634,2020-05-18 22:59:34,Going live on @WTNH in a few minutes for a COVID-19 town hall. Tune in. https://t.co/LLioQLHmJE
rosadelauro,1261388491084054528,2020-05-15 20:10:26,"Paid sick days and paid family and medical leave is now available to all workers, including those working in warehouses, health care, grocery stores, pharmacies, and retail."
rosadelauro,1261049436706390017,2020-05-14 21:43:09,"Excellent testimony today from Dr. Rick Bright, who was removed from @BARDA for saying hydroxychloroquine does not help treat COVID-19—a finding backed by data. @SecWilkie: why are you still using this on our nation’s veterans? They are not test subjects. -Rosa"
rosadelauro,1260356576336130053,2020-05-12 23:49:58,"I support this legislation, I look forward to passing it quickly, and I urge my colleagues in the Senate and the White House to act with urgency to protect the health and economic security of all Americans."
rosadelauro,1260356574620647425,2020-05-12 23:49:58,"The issues I fought for on behalf of working people—a new national standard for paid sick days &amp; #PaidLeave, expanding the Child Tax Credit, increasing monthly SNAP benefits &amp; repealing much of the $135 billion giveaway to hedge fund managers—have become a reality in this bill."
rosadelauro,1260356573379072000,2020-05-12 23:49:58,"The Heroes Act is a comprehensive coronavirus response package to tackle the biggest public health and economic crisis our country has ever faced, and I am proud to have shaped it in key areas. 
https://t.co/jlFff5gmFO"
rosadelauro,1260271472188194817,2020-05-12 18:11:48,Tune in LIVE as we give an update of our COVID-19 response at the national and local levels. https://t.co/vSnhWRWA6C
rosadelauro,1258513110677118978,2020-05-07 21:44:42,"Children are especially at economic risk during the COVID-19 pandemic. We can help kids now by expanding &amp; improving the Child Tax Credit in the next COVID-19 response package. Read more about my plan w/ @RepDelBene, @SenSherrodBrown &amp; @SenatorBennet:
https://t.co/6ADgb7UKkM"
rosadelauro,1258467530139742208,2020-05-07 18:43:35,"It is crucial that we #FundFamilies by including an expanded and improved, fully refundable Child Tax Credit in the next coronavirus response package. That is why I wrote a letter with @RepDelBene and 58 of my colleagues today urging House and Senate leaders to do just that. https://t.co/FSkFSicD4f"
rosadelauro,1258444343175757830,2020-05-07 17:11:26,"COVID-19 puts our most vulnerable at risk, especially seniors. That’s I joined @RepJohnLarson on the Emergency Social Security Benefits Improvement Act to #ExpandSocialSecurity and protect our seniors. 
https://t.co/WAzQ0khSeF"
rosadelauro,1258131014808936449,2020-05-06 20:26:23,"We believe in doctors, and researchers, and scientists. We believe in data. That is the foundation on which we will need to build to regain control of this pandemic. https://t.co/8DGTow0ST6"
rosadelauro,1258066602349793282,2020-05-06 16:10:26,"The American people deserve the truth. We do not have a national testing plan. We do not have a national contact tracing plan. We do not have PPE. The American people are scared, and they want answers. https://t.co/kUw6CBHd9M"
rosadelauro,1258059874379931648,2020-05-06 15:43:42,"According to a range of projections, new daily cases of COVID-19 could surge this month. Some are projecting that deaths could rise to 3,000 people each day. It would be irresponsible to reopen the economy without proper testing capacity across the country. https://t.co/LU6UZ6yP6D"
rosadelauro,1258048590355877888,2020-05-06 14:58:52,"And in the long-term, as we make investments to enhance our nation’s public health and global health systems to better prepare for the next pandemic over the horizon."
rosadelauro,1258048589235920897,2020-05-06 14:58:51,"In the near term as we work to mitigate the spread of the coronavirus. In the medium-term, as we develop the therapeutics to treat the disease and a vaccine to inoculate millions of Americans against the coronavirus."
rosadelauro,1258048463650066432,2020-05-06 14:58:21,"Science and facts must drive our policy, &amp; that demands hearing from the doctors, scientists, researchers &amp; experts who command those facts &amp; drive science to public policy. The purpose of today’s hearing is to get a clear-eyed view of the path forward for responding to COVID-19: https://t.co/D7rTRAn6q3"
rosadelauro,1258028622004322304,2020-05-06 13:39:31,The people of this country deserve to know how our federal government is handling the COVID-19 pandemic and what the path forward looks like. Tune in live at 10am. https://t.co/F3gYpiUfN0
rosadelauro,1257485311111827459,2020-05-05 01:40:35,"It’s  #SmallBusinessWeek.  As we continue to battle COVID-19, I want to recognize small businesses like Sunset Technologies in Woodbridge who are using their expertise in 3-D printing to produce face shields for first responders. TY Sunset Technologies. https://t.co/JA2rQgcU3s"
rosadelauro,1257377694528024579,2020-05-04 18:32:57,Our frontline healthcare workers and first responders are risking their lives to keep us safe. We need #PaidLeaveForAll https://t.co/LIRQDhRtqw
rosadelauro,1256969308581826562,2020-05-03 15:30:11,"Senate Republicans snuck in a $135 billion tax giveaway for the wealthiest in the same coronavirus response law that gave working people in Connecticut and across the country $1,200 or less. That is unconscionable, and it needs to be repealed immediately. https://t.co/ZHKAkK1aBF"
rosadelauro,1256623459251228673,2020-05-02 16:35:54,The White House’s decision is letting politics overtake public health. Proud to stand with @NitaLowey in condemning the White House’s partisan games. https://t.co/iKpwUSebRw
rosadelauro,1256306275920629760,2020-05-01 19:35:31,"As Congress continues work on future coronavirus response legislation, Ag and food must be a key component. We must act on increasing the SNAP benefit, allowing those benefits to be used online, and finding innovative ways to move food from struggling farmers to people in need."
rosadelauro,1256306273819267072,2020-05-01 19:35:31,"Second, I’m calling for an intergovernmental task force to be accountable for the safety of food workers, including those at meat packing plants. Going forward, they need priority for testing and PPE, and we must mandate enforceable measures to protect their health."
rosadelauro,1256306271671783426,2020-05-01 19:35:30,"This morning, I joined @chefjoseandres and fmr Ag Secs Tom Vilsack and @DanRGlickman to announce a bold, multi-step plan to safeguard our nation’s food supply, the livelihoods of our farmers and ranchers, and the health of our frontline food workers. 
https://t.co/KUD8YGBJtG"
rosadelauro,1255866894369918976,2020-04-30 14:29:35,Today at 3PM I will host a live webinar with @Rosemary100 and @WallachLori to discuss COVID-19's impact on the medical supply chain and looming drug shortages. Watch here: https://t.co/DDIhLZkDzJ https://t.co/kQfkxxQPLb
rosadelauro,1255606320197140482,2020-04-29 21:14:09,"Proud to join my colleague and friend @RepLloydDoggett in this effort. Without an assured standard of accuracy or FDA validation to fulfill their critical public health mission, people may become reliant on the results of faulty serology tests. We cannot let that happen. https://t.co/5X1mUmX9Yc"
rosadelauro,1255541328768794659,2020-04-29 16:55:54,"RT @RepFilemonVela: Hey, @TheColinWoodall @BeltwayBeef 

Workers don't want gratitude. They want to be safe from Coronavirus.

They want im…"
rosadelauro,1254811109191831552,2020-04-27 16:34:16,"Women working on the frontlines are risking their lives to keep the rest of us safe and healthy. Now more than ever we need equal pay for equal work, paid sick days and #paidleave. We cannot rely on their support while denying them safety net programs. 
https://t.co/bP4QKtPdsk"
rosadelauro,1253379260317929472,2020-04-23 17:44:36,"This is not everything we wanted. Next we need relief for states and localities, SNAP benefits, paid family leave and paid sick days, and the expansion of the Child Tax Credit. Vote yes to continue working for people."
rosadelauro,1253378883409391616,2020-04-23 17:43:07,"$1 billion for the CDC, $1.8 billion for the NIH, $1 billion for BARDA, money for the Food and Drug Administration, and money for community health centers."
rosadelauro,1253378773430480897,2020-04-23 17:42:40,"This economic relief package is for small businesses, finally. I am proud that we also secured $25 billion to expand testing, with $11 billion to increase state and local testing capacity. https://t.co/dqYabnxUOu"
rosadelauro,1253339937870577664,2020-04-23 15:08:21,Tune in LIVE as I talk with @PaulJBass about Congress voting on the fourth coronavirus response package today and mental health issues people in our community are facing. https://t.co/nlZ5QzMpfE
rosadelauro,1252631998650298368,2020-04-21 16:15:15,"During these challenging times, I have been inspired by the selfless and brave work of our frontline healthcare workers and first responders across CT. Today, I want to thank Ben Mahoney, a critical care nurse in my district helping some our state's sickest patients. #CTHero https://t.co/XrwjrgzoHC"
rosadelauro,1251155006314569728,2020-04-17 14:26:13,"Child care is crucial to supporting frontline healthcare workers &amp; first responders during this uncertain time. Through the CARES Act, CT will receive $23 million+ to support child care providers through the Child Care and Development Block Grant Program.
https://t.co/fVZazeA0Zs"
rosadelauro,1250936638500483072,2020-04-16 23:58:30,No one should face the impossible choice of caring for their health &amp; the health of others or keeping their paycheck. Thank you @GavinNewsom for working to keep our brave frontline workers safe. https://t.co/O2uorVRBFZ
rosadelauro,1250806831745826819,2020-04-16 15:22:42,"Instead, Stephen Miller and other anti-immigrant zealots in the Trump administration are operating under the shadow of COVID-19 to keep kids from being placed with sponsors."
rosadelauro,1250806829862526978,2020-04-16 15:22:41,Even in the midst of the COVID-19 pandemic—which has killed tens of thousands of Americans and demands the undivided attention of our federal government—the Trump administration remains focused on inflicting trauma on unaccompanied children. https://t.co/yxq1Bs043c
rosadelauro,1250486837363331073,2020-04-15 18:11:09,"RT @AppropsDems: Need more proof that President Trump's illegal withholding of World Health Organization funding puts Americans at risk?

H…"
rosadelauro,1250223484002807811,2020-04-15 00:44:41,"The American people deserve the truth from their elected officials, and I am glad @SpeakerPelosi is willing to tell it. The truth will get us through this painful health and economic crisis, and it will save lives. -Rosa https://t.co/4coXqa1ej7"
rosadelauro,1248675952957313024,2020-04-10 18:15:21,Everyone has experienced the COVID-19 pandemic in different ways and has a unique story to tell. I want to hear from you directly. Let me know how you’ve been impacted on my website: https://t.co/s4D0iEFWcw https://t.co/Faz20HeyTw
rosadelauro,1247951182699659264,2020-04-08 18:15:22,"#Census2020 is underway! Given the current public health crisis, one of the safest ways to respond is online at https://t.co/sEstED21LU or by phone now:
English: 844-330-2020
Spanish: 844-468-2020
Additional phone lines can be found here ⬇️ #WeCount
https://t.co/dqMaHt3ASE"
rosadelauro,1247659401940537356,2020-04-07 22:55:56,"In response to COVID-19, Congress passed the first national standard for paid sick days &amp; #paidleave for all. There’s still more work to be done to make these benefits permanent and expand access, but I encourage you to take advantage of these provisions. https://t.co/EtMTaOc6MM"
rosadelauro,1247621973330493442,2020-04-07 20:27:12,"Removing the Acting Inspector General in charge of overseeing the implementation of the our largest ever governmental response bill is unwise. We need a centralized, trustworthy, rapid response to help healthcare workers, first responders, workers and families—and we need it now."
rosadelauro,1247224667120832523,2020-04-06 18:08:27,"To help student borrowers, Congress’s third coronavirus response package pauses monthly loan payments on Department of Education owned-loans through September 30th. And until that date, interest will not accrue on your loans."
rosadelauro,1247224458001223680,2020-04-06 18:07:37,"Over the last few weeks, I have heard from thousands of people in Connecticut who are struggling to make ends meet—including those who have lost their job or had to leave their college or university early due to the coronavirus. https://t.co/FjXueDQzAq"
rosadelauro,1247184858067107840,2020-04-06 15:30:16,"Today at 12 PM EST I will be holding a live telephone town hall meeting to provide a federal update on the coronavirus. To participate, dial 855-920-0553 or live stream the event on my website at https://t.co/lg3pkF0ySO. I look forward to hearing from you."
rosadelauro,1246864710181453825,2020-04-05 18:18:07,"TOMORROW: Join me for a live telephone town hall meeting where I will provide a federal update on the coronavirus. To participate, dial 855-920-0553 at 12 PM or sign up via the link below to be added to the call. I look forward to speaking with you. https://t.co/lg3pkF0ySO"
rosadelauro,1246468606570921990,2020-04-04 16:04:08,"RT @charles_gaba: With #COVID19 pandemic, the Universal Coverage debate is flaring up again. Many #M4All advocates think THIS will get ever…"
rosadelauro,1246168099541352449,2020-04-03 20:10:02,RT @RepBarragan: .@DHsgov finds million+ PPE masks critically needed by medical professionals but DHS is sending them to ICE instead of doc…
rosadelauro,1245836347614560256,2020-04-02 22:11:46,"Connecticut will receive nearly $500 million to cover operating expenses for state wide transportation services as a result of the CARES Act—ensuring that we will be able to maintain and manage our public transportation system in response to COVID-19.

https://t.co/KWaOOfcGcB"
rosadelauro,1245781214205825025,2020-04-02 18:32:41,"RT @AccessHealthCT: The Access Health CT New Special Enrollment Period has been extended thru Fri, Apr 17, 2020 for uninsured CT residents…"
rosadelauro,1245748127543549952,2020-04-02 16:21:13,"CT has taken strong measures to stop the spread of COVID-19, but small businesses are suffering. To help fill the gap Congress approved $10 billion in disaster relief grants &amp; $349 billion in loans for small &amp; tribal businesses, nonprofits, ind. contractors &amp; the self-employed. https://t.co/kWKJYgM3d8"
rosadelauro,1245747697669283841,2020-04-02 16:19:30,"Today, we finally have a national standard for paid sick days thanks to the Families First Coronavirus Response Act that Congress passed—17 years after I started working on the #HealthyFamiliesAct. Now we need a permanent solution &amp; #PaidLeaveForAll."
rosadelauro,1245707812195442688,2020-04-02 13:41:01,"RT @GovNedLamont: Beginning April 1 for a period of 60 days, no insurer in Connecticut – including health, property &amp; casualty – may termin…"
rosadelauro,1245461408298536961,2020-04-01 21:21:53,"By denying millions of uninsured Americans the opportunity to sign up for healthcare, President Trump is putting American lives at risk. During uncertain times, our federal government should help people get the care they need—not make it more difficult. https://t.co/rtmd24X4lM"
rosadelauro,1245385857546293250,2020-04-01 16:21:41,.@GovNedLamont announced that 60+ credit unions and banks have pledged to offer relief for those who have fallen behind on mortgage payments in wake of COVID-19. This includes a 90 day grace period for mortgages and no foreclosures for 60 days. https://t.co/jMfNGdHPUX
rosadelauro,1245080462244171776,2020-03-31 20:08:09,"Connecticut residents looking for federal, state, and local resources for your health and economic security throughout the coronavirus pandemic can find them here on my website. This page is updated regularly. Please stay safe: https://t.co/hZUXPjeadb"
rosadelauro,1244988887421849600,2020-03-31 14:04:16,"Women’s work needs to be valued the same as men’s—especially as we deal with COVID-19. Most low-wage workers are women. Their work is essential. They are on the frontline in healthcare, caregiving, food service &amp; grocery stores. They deserve equal pay for equal work. #EqualPayDay https://t.co/AKOGXqUAkO"
rosadelauro,1244731387602665472,2020-03-30 21:01:03,"If you lost your job recently due to the coronavirus, you could eligible for Connecticut unemployment benefits. If you are, you will also receive an additional $600 per week from the federal government through the end of July. To file a claim, visit: https://t.co/X5kpkeLbem https://t.co/XRZcozlhYs"
rosadelauro,1243613305303896064,2020-03-27 18:58:11,We can’t leave healthcare workers and first responders without the supplies they need to save lives. The Medical Supply Chain Emergency Act will force the President to federalize American manufacturing &amp; end the supply shortage. #DefenseProductionActNOW. https://t.co/dWuAoAFIYW
rosadelauro,1243535351244783617,2020-03-27 13:48:26,"COVID-19 is the biggest economic and health crisis our country has ever faced. Nurses and doctors are in ICUs trying to save our humanity against this awful pandemic. The hour is dark, but Congress is ready to help get families, workers, and the country to the dawn of recovery. https://t.co/PK7xVzyWl6"
rosadelauro,1243257497357398016,2020-03-26 19:24:20,RT @SXMProgress: “It is the most vulnerable who is at risk” Rep. @rosadelauro (D-CT) spoke about the #CoronavirusStimulusBill on The @MSign…
rosadelauro,1243182345575968769,2020-03-26 14:25:43,"Going LIVE at 11am with @PaulJBass @newhavenindy to talk about the latest coronavirus response bill in Congress, what’s happening in our community, and how we can all get through this. Watch here on Facebook and ask a question: https://t.co/5voDGsgNZU"
rosadelauro,1242959266467778562,2020-03-25 23:39:16,"Any one of us can contract the coronavirus, and we must do our best to prevent further illnesses and deaths—especially for vulnerable populations like our seniors and those with underlying health issues."
rosadelauro,1242959265607933952,2020-03-25 23:39:16,"I urge everyone to follow the CDC’s guidelines and Governor Lamont’s “Stay Safe, Stay Home” policy. Social distancing is not easy, and isolation’s effect on our mental health should not be minimized. But stopping the spread of this deadly disease must be our top priority."
rosadelauro,1242959264651661314,2020-03-25 23:39:16,"Every minute matters for our healthcare workers, first responders, and everyone at-risk across the country. In our own daily lives, we must continue following the advice of medical professionals."
rosadelauro,1242959263779164164,2020-03-25 23:39:16,"Congress needs to act urgently to continue addressing the health and economic crisis facing families. We swiftly passed two important coronavirus response bills thus far, but we must do much more to control the spread of this virus."
rosadelauro,1242959262772584450,2020-03-25 23:39:15,"My thoughts and prayers are with the families of the two individuals in our District who died from complications due to the coronavirus. This pandemic is on our doorstep, and we must do everything we can to stop it. 
https://t.co/XlIkA94TSr"
rosadelauro,1242923123843964931,2020-03-25 21:15:39,RT @SXMProgress: LIVE: Rep. @rosadelauro (D-CT) is speaking w/ @MSignorile all about the latest #CoronavirusPandemic news and what @HouseDe…
rosadelauro,1242841761682243585,2020-03-25 15:52:21,The most effective way to combat COVID-19 is to continue to practice social distancing. Your safety is my top priority. https://t.co/YOMByq9Nhl
rosadelauro,1242841760289734657,2020-03-25 15:52:21,"Please heed the advice of health agencies and medical professionals regarding medications or other treatments for the coronavirus. If you believe you have symptoms or have questions, please consult with your doctor and follow preventative guidelines issued by the @CDCgov. https://t.co/GRgQZjcNrj"
rosadelauro,1242468970998964224,2020-03-24 15:11:01,"While public health officials work to limit the spread of the coronavirus, @AABB &amp; the Red Cross are calling for blood donors to avoid disruptions to the blood supply. To volunteer, visit: https://t.co/ChDBhaIEPF https://t.co/KnH4fCnHw5"
rosadelauro,1242444811598270464,2020-03-24 13:35:01,"Thank you to our healthcare workers and first responders for your work as we deal with the coronavirus pandemic. Every day you are putting your lives on the line to keep us safe, and you have my endless gratitude for that. https://t.co/p29DvXApcX"
rosadelauro,1242164482832465925,2020-03-23 19:01:05,"Our health care workers and first responders need our help. Donations of Personal Pretective Equipment: CT has activated a framework for donations of PPEs. Those who wish to donate these vital materials, please go to https://t.co/qfCZGcwnKn"
