AustinScottGA08,1321523758998441986,2020-10-28 18:46:31,"Yesterday, @EPAAWheeler and @GaDeptAg signed a MOU in conjunction with @EPA's announcement to allow new dicamba registrations for cotton and soybeans. This move balances environmental concerns while giving farmers more certainty. You can read more here: https://t.co/MFEdL10umc https://t.co/91t7WzXHUO"
AustinScottGA08,1320889882215141379,2020-10-27 00:47:43,"Throughout the confirmation process, she showed her poise, thoughtfulness &amp; intelligence, &amp; I know she’ll bring those qualities to the bench &amp; continue the Court’s important work to protect the rights of every American &amp; uphold the Constitution. Congratulations, Justice Barrett. https://t.co/QHrOUNWc2F"
AustinScottGA08,1319012366273683460,2020-10-21 20:27:08,"The #PaycheckProtectionProgram has been a lifeline for millions of small businesses during the COVID-19 pandemic, but @SpeakerPelosi &amp; @HouseDemocrats are more concerned with not giving @realDonaldTrump a “win” before the election than supporting Americans in need. https://t.co/CKNuyBaqK5"
AustinScottGA08,1318274027077644289,2020-10-19 19:33:15,My district office staff is available to discuss Medicare Part D options. You can call our Tifton office at 229- 396-5175 or Warner Robins office at 478-971-1776 to schedule an appointment. We're happy to work with you to find the Part D plan that best suits your needs. #GA08 https://t.co/8Ky4jlest2
AustinScottGA08,1316828883694518274,2020-10-15 19:50:46,"India represents a largely untapped market for many American farm products, such as pecans. That's why I am pressing @USTradeRep to negotiate lowering India's disproportionately high tariff on pecans to help our American farmers gain more market access. https://t.co/nMSwl5aFvw"
AustinScottGA08,1316134326615052289,2020-10-13 21:50:50,"For 245 yrs, @USNavy has brought peace, security &amp; humanitarian relief to regions around the world w/ a tradition of honor, courage &amp; commitment. It's an honor to serve on @HASCRepublicans to support their important missions &amp; the brave Sailors who protect our nation. #Navy245 https://t.co/MNJUcOK8dT"
AustinScottGA08,1311780432405504000,2020-10-01 21:30:01,"Independent reporting has shown that the allegations against Irwin Co. Detention Center &amp; @ICEgov are at best, exaggerated. Dems should be embarrassed, spreading these allegations before the investigation is complete. They don't want the facts to come out. https://t.co/WZrwUAdPDH"
AustinScottGA08,1311683401397792769,2020-10-01 15:04:27,"Tomorrow (10/2) at 4PM ET, Paul Lawrence, Under Secretary For Benefits at @DeptVetAffairs, will host a call with Georgia veterans and their families to discuss COVID-19 resources, the Blue Water Navy Act, and the Solid Start program. You can join the call at 833-380-0417. #GA08 https://t.co/hG6DsVRia9"
AustinScottGA08,1311667041682681856,2020-10-01 13:59:26,"For years, GA farmers have been negatively impacted by unfair trading practices, especially our fruit &amp; veggie growers. @realDonaldTrump's Administration has been committed to supporting our farmers, &amp; I commend this move to request an investigation. https://t.co/kIMMEIkMqE"
AustinScottGA08,1311358235740385282,2020-09-30 17:32:21,"Had a great call this morning with @UnitedFresh to discus ways to help the industry weather impacts of COVID-19, remedies for unfair trade practices, &amp; encouraging retailers to buy American produce. I remain committed to our farmers &amp; helping them through these difficult times. https://t.co/8IaGxb8qvJ"
AustinScottGA08,1311296786477309952,2020-09-30 13:28:11,"House Democrats are more concerned with not giving @realDonaldTrump a ""win"" before the election than doing their job to support American small businesses during these unprecedented times. #FightForSmallBiz"
AustinScottGA08,1311296784220786690,2020-09-30 13:28:10,"Last night, I joined several of my colleagues in signing @HerreraBeutler's discharge petition to circumvent Speaker Pelosi's political games &amp; trigger automatic consideration of the #PaycheckProtectionProgram Extension Act, which the Speaker refuses to bring to the floor."
AustinScottGA08,1310562910352150528,2020-09-28 12:52:01,"I commend @realDonaldTrump for nominating Amy Coney Barrett to our nation’s highest court. She is an exemplary jurist committed to our Constitution and an extraordinary woman, mother, and American. She deserves a fair and swift confirmation process in the Senate."
AustinScottGA08,1309198343252439043,2020-09-24 18:29:43,"I appreciate @ConawayTX11 for his leadership on this legislation which will help us better understand emerging technologies like #blockchain, and for his continued focus to promote public policy that fosters, rather than inhibits, growth of #FinTech in the United States. https://t.co/Xqq2vPNaaI"
AustinScottGA08,1309196107663241221,2020-09-24 18:20:50,"Great to join @GAChamber again today for their agriculture, trade, &amp; rural initiatives panel. One of the most important things #RuralAmerica can do right now is complete the Census. The deadline is 9/30. It only takes a few minutes: https://t.co/3TEED0h4Kl or 844-330-2020. #GA08 https://t.co/vKytF365fC"
AustinScottGA08,1308817439346569216,2020-09-23 17:16:08,"I appreciate @GAChamber hosting &amp; LTG Smith joining me in an important discussion on GA's military installations, defense communities &amp; Active Duty, Guard, Reserve &amp; civilian workforce across the state. We covered economic development, services for mil families &amp; much more. https://t.co/JEznrU4m4x"
AustinScottGA08,1308447635909611522,2020-09-22 16:46:40,"RT @AustinScottGA08: Please share this post with your friends, family, employees, coworkers and neighbors, because your response to the #20…"
AustinScottGA08,1308145139467120642,2020-09-21 20:44:40,"In the @HouseDemocrats CR, @SpeakerPelosi shamefully excludes key resources for American farm families, including CCC funding that is used to fund Farm Bill programs. Now is not the time to play partisan games with our nation’s food security."
AustinScottGA08,1307307777786884103,2020-09-19 13:17:17,"Ruth Bader Ginsburg served our nation on its highest Court for nearly 30 years, and we remember Justice Ginsburg for her life of service to our country and pray for her family and friends who are grieving during this difficult time."
AustinScottGA08,1307011227852386305,2020-09-18 17:38:54,"For 73 yrs, the @usairforce has brought strength, power, &amp; protection to skies around the world. To our Airmen at Robins &amp; Moody Air Force Bases in #GA08 &amp; all U.S. Airmen here at home &amp; around the world: Thank you for your dedication &amp; service to our great nation. #AIRPOWER https://t.co/67WqLTlvXY"
AustinScottGA08,1306988245369131009,2020-09-18 16:07:35,"Thank you, @ConawayTX11, for your steadfast commitment to America's farmers, our nation's agriculture and ag research industries, and the members of @HouseAgGOP that you have led since 2015. Vivien and I wish you, Suzanne, and your family the best in your next chapter. https://t.co/OEkTsdQFx4"
AustinScottGA08,1306941953691525123,2020-09-18 13:03:38,"Today, on National POW/MIA Recognition Day, we pause to recognize and express our gratitude for the sacrifices of our nation's prisoners of war (POW) and missing in action (MIA). They are never forgotten. We will never forget. #POWMIARecognitionDay https://t.co/vhiue7AT4b"
AustinScottGA08,1306235252357189632,2020-09-16 14:15:27,RT @SBAsoutheast: Join @SBAgov Regional Administrator Ashley Bell &amp; Georgia leaders as they discuss recovery resources available for Georgi…
AustinScottGA08,1306028334195904517,2020-09-16 00:33:14,This historic achievement is decades in the making and could not have happened without the steadfast commitment of @realDonaldTrump and his Administration. I look forward to this agreement serving as the basis for wider peace and security negotiations throughout the region. (2/2)
AustinScottGA08,1306028332329439233,2020-09-16 00:33:13,"Today, I had the opportunity to join @realDonaldTrump at the @WhiteHouse for the signing of the historic Abraham Accords, which normalize the United Arab Emirates’ and Bahrain’s relations with Israel. (1/2) https://t.co/aPuTyGjlqx"
AustinScottGA08,1305970994377613314,2020-09-15 20:45:23,"We have reached out to DHS and ICE, and they have assured us that they take all allegations seriously and are firmly committed to the safety and welfare of all those in their custody. We will continue to be in contact with them as they investigate these claims. (2/2)"
AustinScottGA08,1305970993568120835,2020-09-15 20:45:23,My office is aware of the whistleblower complaint at the Irwin County Detention Center that was filed with the U.S. Department of Homeland Security Office of the Inspector General. (1/2)
AustinScottGA08,1305520328412721153,2020-09-14 14:54:36,"As your Representative in Congress, each year I have the privilege of nominating a limited number of students to 4 of the 5 U.S. Service Academies. Completed applications for my office are due 10/23 and can be requested through the link below. #GA08
https://t.co/1yKXyuu2bI"
AustinScottGA08,1304435283111350278,2020-09-11 15:03:01,"This image is of the Pentagon 9/11 Memorial, a moving tribute to the 184 people who died there. If you’re ever in DC, I’d encourage you to visit this place &amp; honor the nearly 3,000 people who perished on 9/11 in VA, NYC, &amp; PA. While they are gone, they are never forgotten. https://t.co/LyT08VTLPh"
AustinScottGA08,1304435281358139394,2020-09-11 15:03:00,"Nineteen years later, we continue to pray for those who lost their lives on 9/11 &amp; their loved ones who are forever changed by this national tragedy. We also recognize the countless first responders &amp; everyday people who rushed towards the devastation to help. #NeverForget https://t.co/WDKYTu1YUe"
AustinScottGA08,1301914824629276674,2020-09-04 16:07:37,"RT @CongressionalAC: 🍑Georgia Coders🍑
Did you know that
@RepBuddyCarter
@RepDrewFerguson
@RepHankJohnson
@repjohnlewis
@RepLucyMcBath
@Aust…"
AustinScottGA08,1301886002106118144,2020-09-04 14:13:05,"RT @GovKemp: All Georgians should respond to the #2020Census by the end of September. Take some time out of your day to participate online,…"
AustinScottGA08,1301588330451173381,2020-09-03 18:30:14,"Please share this post with your friends, family, employees, coworkers and neighbors, because your response to the #2020Census matters and shapes the future of our communities for years to come. #GA08 https://t.co/6sjP1QYQnR"
AustinScottGA08,1301588329503358979,2020-09-03 18:30:14,"I encourage every Georgian to take the #2020Census. Your responses are safe, secure, and only used to produce statistics. This data helps determine how much federal funding our communities receive for everything from schools to economic development. https://t.co/3TEED0h4Kl"
AustinScottGA08,1301231258324946951,2020-09-02 18:51:22,"Seventy-five years ago today, victory was declared over Japan, marking the end of World War II. We are forever grateful to those who fought for freedom and liberty around the world. God Bless the Greatest Generation. #VJDay https://t.co/GUvbDZjmtK"
AustinScottGA08,1301227050485899267,2020-09-02 18:34:39,"I also encourage Americans to purchase American-grown farm products whenever possible to support our growers, especially in these unprecedented times. (7/7)"
AustinScottGA08,1301227049034690560,2020-09-02 18:34:38,America’s grocery retailers are posting record profits while American farm revenues are at record lows. Retailers have the responsibility to stop stocking products from countries that engage in unfair trade practices against the American farm family. (6/7)
AustinScottGA08,1301227047977725952,2020-09-02 18:34:38,"While I look forward to seeing the positive impacts of this report &amp; working with the Administration to implement these new steps, there is also a burden on American retailers. (5/7)"
AustinScottGA08,1301227046723559426,2020-09-02 18:34:38,"For too long, countries like Mexico have taken advantage of loopholes in our trade agreements &amp; flooded our domestic markets with cheap government-subsidized produce at prices below the cost of production, causing serious financial injury to American growers. (4/7)"
AustinScottGA08,1301227045347786752,2020-09-02 18:34:37,"I thank @realDonaldTrump, @USTradeRep, @SecretarySonny, and @SecretaryRoss for their ongoing commitment to addressing our concerns &amp; creating a more level playing field for American producers. (3/7)"
AustinScottGA08,1301227043938598913,2020-09-02 18:34:37,This report comes after USTR hosted virtual hearings in August with fruit &amp; vegetable growers from GA &amp; FL which were the result of years of bipartisan work by members of our Congressional Delegations. You can read the full report here: https://t.co/EpQaVZtz6M (2/7)
AustinScottGA08,1301227042915180544,2020-09-02 18:34:37,"The Office of the @USTradeRep, @USDA, and @CommerceGov have released a report outlining the Trump Administration’s plan to address the threat posed by increased foreign imports to American producers of seasonal and perishable fruits and vegetables. (1/7)"
AustinScottGA08,1296393321657532425,2020-08-20 10:27:08,"Today at 9 AM, I will testify at a virtual hearing hosted by @USTradeRep to discuss the impacts of unfair trade practices on GA’s fruit &amp; vegetable growers &amp; the need to protect our domestic supply chain. You can click the link below to learn more &amp; watch. https://t.co/Yzsycqt2Jg"
AustinScottGA08,1293189253606907910,2020-08-11 14:15:19,"If you haven’t done so yet, I’d encourage you to take a few minutes to complete the #2020Census. It is vitally important that each Georgian is counted and heard. You can learn more or take the 2020 Census at https://t.co/o0l2pgxsAt. #GA08 https://t.co/C2KoyWRTzq"
AustinScottGA08,1292873183662673921,2020-08-10 17:19:22,"On August 1, Richey Seaton, longtime Executive Director of the Georgia Cotton Commission, retired after nearly 26 years of service. We wish him &amp; his family the best in their next chapter, &amp; we welcome Taylor Sills as the next GCC Executive Director. https://t.co/oAbMnKUL1i"
AustinScottGA08,1291792009833914368,2020-08-07 17:43:10,"For their sacrifices, I've been working to ensure combat wounded, total &amp; permanently disabled veterans have the opportunity to continue to excel in the workforce without forcing them to surrender their SSDI benefits. You can learn more on H.R. 2655 here: https://t.co/rOPhwbrhaH"
AustinScottGA08,1291792008223260673,2020-08-07 17:43:09,"Today is #PurpleHeartDay, a time to remember &amp; honor the sacrifices made by Purple Heart veterans &amp; all members of our armed forces. This award, given to those wounded in combat or who lost their lives in defense of our nation, represents courage, sacrifice, commitment, &amp; heart. https://t.co/NwurJ3oVev"
AustinScottGA08,1291513041805283335,2020-08-06 23:14:38,"I’d like to extend a special congratulations to Gen. CQ Brown, the new @usairforce Chief of Staff. Gen. Brown brings nearly 35 yrs of experience to the role, and I look forward to working with him in his new capacity. https://t.co/6dNZoJnriq"
AustinScottGA08,1291079610621464576,2020-08-05 18:32:20,"Supporting rural hospitals and health care facilities during the COVID-19 outbreak has been a key priority of mine. That's why I introduced the Assistance for Rural Health, Safety, and Educational Facilities Act (H.R. 7758). You can learn more here: https://t.co/FSgQ8DW04N"
AustinScottGA08,1291079609690263553,2020-08-05 18:32:20,"Earlier this week, @realDonaldTrump signed an executive order to enhance telehealth services in #RuralAmerica. This will not only improve care and treatment options for our rural communities now, but it'll also positively impact them for years to come. https://t.co/8Wa9I9D2Jc"
AustinScottGA08,1290678978391543811,2020-08-04 16:00:22,"For 230 years, the U.S. Coast Guard has performed the important mission of America's maritime first responder, protecting our country's vital economic, national, and border security. They embody the very best of ""Always Ready,"" and we celebrate them today. #SemperParatus https://t.co/BCPNSN35Av"
AustinScottGA08,1289197378407260162,2020-07-31 13:53:01,"Our prayers &amp; condolences are with the family &amp; friends of Herman Cain, who passed yesterday. Herman exemplified the American dream &amp; was a conservative voice in Georgia for decades. He will be greatly missed by many in our state &amp; across the country. https://t.co/RMvy8QP00V"
AustinScottGA08,1288965651827232768,2020-07-30 22:32:13,"Today, I had the honor of paying final respects to Rep. John Lewis at his funeral in Atlanta. It was a moving tribute to a great Georgian. John was a good and godly man. His legacy will live on and inspire generations to come. Our prayers remain with his family and loved ones. https://t.co/vR2QYViOP4"
AustinScottGA08,1288148674275692546,2020-07-28 16:25:51,"On August 4, the new Valdosta VA Community Based Outpatient Clinic will begin seeing patients. The opening of this new clinic has been a priority of mine for several years, and I'm very glad to see this facility finally come to life to better serve our veterans in South GA. #GA08 https://t.co/PJMxL8G7OQ"
AustinScottGA08,1284501551999066114,2020-07-18 14:53:29,"John Lewis spent his life promoting equal rights, fighting racism, &amp; working to make our country a better place for all Americans. He was a good man, &amp; he will be greatly missed. We extend to his family &amp; loved ones our condolences during this difficult time. Rest In Peace, John. https://t.co/JR0sHusWd7"
AustinScottGA08,1283171782124593152,2020-07-14 22:49:27,.@realDonaldTrump was right to reject Communist China’s illegal claims in the South China Sea. Another example of cleaning up after the previous Administration’s policy of appeasement towards China. https://t.co/E6hZOWLtoh
AustinScottGA08,1281219347332112385,2020-07-09 13:31:10,Big news for Middle GA: @Fritolay announced that they are planning a $200M expansion in Perry &amp; Kathleen that will create 120 new jobs. This expansion will also make the Perry facility one of the company’s largest plants in the world. #GA08 https://t.co/BhVvUUj7TG
AustinScottGA08,1281017493260247041,2020-07-09 00:09:05,"Today, the Supreme Court ruled that the Little Sisters of the Poor are exempt from Affordable Care Act mandates that went against their religious beliefs. This is a big win for faith-based institutions, religious liberty, and upholding the First Amendment. https://t.co/SQk3FGKQYy"
AustinScottGA08,1279433839232901122,2020-07-04 15:16:12,"Land of the free, because of the brave! Happy #July4th from our family to yours. https://t.co/XjBRXrhapV"
AustinScottGA08,1278690132946817028,2020-07-02 14:00:59,"Earlier this morning, I joined @FoxFriendsFirst to talk about the defense authorization bill which passed out of the House Armed Services committee late last night. You can watch the full interview here: https://t.co/7O7Qw8F6Y6"
AustinScottGA08,1278454803472015362,2020-07-01 22:25:52,"... Americans need comprehensive legislation that addresses the critical transportation and infrastructure needs our country faces, not more partisan wish-list programs from Speaker Pelosi."
AustinScottGA08,1278454802045943814,2020-07-01 22:25:52,"... America’s roads and bridges are crumbling and bipartisan solutions to address serious issues impacting our country, including my amendment to ease regulatory burdens on agricultural truckers, were not included...."
AustinScottGA08,1278454800837902338,2020-07-01 22:25:51,"... The bill’s prioritization of expensive green programs and stifling traditional infrastructure investment will leave countless communities behind, including many in rural America...."
AustinScottGA08,1278454798766034945,2020-07-01 22:25:51,The House just passed a $1.5 trillion infrastructure bill that reduces a state’s flexibility to invest in infrastructure and limits building new roads and bridges....
AustinScottGA08,1277994972625743873,2020-06-30 15:58:40,"RT @HouseGOP: 📢 Today is the 𝗟𝗔𝗦𝗧 𝗗𝗔𝗬 to apply for a #PaycheckProtectionProgram loan!
 
The #PPP has provided billions in relief to small b…"
AustinScottGA08,1276560767823892482,2020-06-26 16:59:39,"The deadline to apply for @SBAgov's Paycheck Protection Program is June 30. PPP has been a lifeline for millions of small businesses, keeping doors open &amp; Americans on payroll during the COVID-19 outbreak. 

Small businesses looking for info should visit https://t.co/QRlzPxi6ji. https://t.co/8v8PfTWbXB"
AustinScottGA08,1276553461375655938,2020-06-26 16:30:37,RT @HouseAgGOP: Mr. Coe misses the entire point of the #FarmersToFamilies Food Box Program- connecting farmers with crops that would otherw…
AustinScottGA08,1276542673021734913,2020-06-26 15:47:44,"I appreciate the @macon_chamber inviting me to join a virtual meeting with Middle GA business &amp; community leaders this morning. We discussed the congressional response to COVID-19, resources for businesses impacted, an outlook for GA Ag, the defense spending bill, &amp; more. #GA08 https://t.co/60rlZsIoB3"
AustinScottGA08,1276247229888638976,2020-06-25 20:13:45,"This afternoon, I joined @agripulse to discuss issues impacting our farm economy and rural America, including the congressional response to COVID-19, rural health care, and the case for writing a new Farm Bill. You can watch at the link below. https://t.co/npNeSfusGq"
AustinScottGA08,1274738787919200258,2020-06-21 16:19:45,"I’d like to extend a special “Happy Father’s Day” to all our #GA08 dads, especially my dad Jim. https://t.co/7MjBZaMpuD"
AustinScottGA08,1274002555228639234,2020-06-19 15:34:13,"On June 19, 1865, Union soldiers landed at Galveston, TX with news that the Civil War had ended and enslaved people were now free, two and a half years after the Emancipation Proclamation. Today, on Juneteenth, we celebrate freedom, dignity, and the end of slavery in America. https://t.co/KDikhcWXht"
AustinScottGA08,1273355342290792454,2020-06-17 20:42:26,"Our prayers are with Reps. Andy Barr and Jim Sensenbrenner whose wives both passed this week. We pray for comfort for them and their families, friends, and staffs during this very difficult time."
AustinScottGA08,1272903468903251968,2020-06-16 14:46:51,RT @SBAgov: UPDATE: The Economic Injury Disaster Loan (EIDL) and EIDL Advance application portal is now open to all eligible small business…
AustinScottGA08,1272209988480573440,2020-06-14 16:51:12,"RT @HouseGOP: Happy Birthday to America’s 45th President, @realdonaldtrump! 🎉 https://t.co/uxmbn9qSaF"
AustinScottGA08,1272159091637485568,2020-06-14 13:28:57,"For the past 245 years, countless men and women have answered the call to serve our nation and fight for the freedoms we enjoy today. Happy Birthday to the @USArmy and to all the Soldiers who have served our country with distinction. https://t.co/6GdiyuTrO2"
AustinScottGA08,1271498902101991424,2020-06-12 17:45:36,"RT @HouseVetAffairs: On this day in 1948, President Truman signed the Women's Armed Services Integration Act into law which granted women t…"
AustinScottGA08,1269267471137210368,2020-06-06 13:58:41,"76 years ago, Allied forces bravely stormed the beaches of Normandy to bring liberty and freedom to occupied Europe. Today, we remember those brave men who charged forward into darkness to liberate their fellow man from Nazi tyranny. God Bess the Greatest Generation. #DDay76 https://t.co/uxMRp3UNQE"
AustinScottGA08,1268994580541845506,2020-06-05 19:54:19,"Vivien and I want to extend a special congratulations to graduating #GA08 high school and college seniors. We are proud of you for the hard work it took to achieve this goal, and we look forward to seeing the continued successes of the Class of 2020. https://t.co/5mYRZHG3Fo"
AustinScottGA08,1268358790468063233,2020-06-04 01:47:55,"....Only a peaceful movement forces us to move forward. 

In the midst of it all, we must never forget that we are all God's children - equal in His sight &amp; endowed by Him with the same inalienable rights.

Any violence or destruction has nothing to do with George Floyd."
AustinScottGA08,1268358789381619715,2020-06-04 01:47:55,"....I hope that America will focus on the peaceful movement &amp; reflect upon the good we see in it, including law enforcement arm-in-arm with those who have come to march.

Only a peaceful movement allows us to celebrate the life &amp; protest the death of George Floyd &amp; others...."
AustinScottGA08,1268358788580507651,2020-06-04 01:47:54,The death of George Floyd has led to several peaceful demonstrations across Middle &amp; South Georgia that focus a spotlight on many of the challenges our nation faces....
AustinScottGA08,1266005804446072833,2020-05-28 13:57:59,"I am deeply saddened to hear of former Rep. Sam Johnson's passing. Sam was an American patriot &amp; Vietnam POW who served in the U.S. Air Force for 29 yrs &amp; House of Representatives for more than 20 yrs. He was a giant among men who inspired many, &amp; our prayers are with his family."
AustinScottGA08,1264930376906088449,2020-05-25 14:44:37,"While many are enjoying time with friends and family today, let us not forget the real reason for #MemorialDay. Please join me today in honoring those who have made the ultimate sacrifice for our freedoms. God Bless our fallen warfighters, and God Bless our great country. 🇺🇸 https://t.co/ZcnWqkSRo4"
AustinScottGA08,1263929807651377153,2020-05-22 20:28:43,...New #fintech like #blockchain is an excellent example. You can learn more about my bill to modernize @CFTC &amp; allow them to utilize and learn from blockchain to better support our commodity markets at the article below. https://t.co/Spndf3aaiG
