AustinScottGA08,1090710540773744640,2019-01-30 20:37:11,60+ Dems have claimed that physical barriers should be part of the solution to address security concerns at the border &amp; also agreed that it should be negotiated once the gov reopened. Will they keep their word? Or keep playing games? (2/2) https://t.co/hGI6S3ouWN
AustinScottGA08,1090710539943186432,2019-01-30 20:37:11,"Earlier today, the House voted on a resolution to blame Republicans for the gov shutdown (which is over) instead of trying to work on a solution to FIX the severe issues at our southern border, which they said they would do if @POTUS reopened the gov. (1/2)"
AustinScottGA08,1090345720668921858,2019-01-29 20:27:32,"Thank you again to @SecAFOfficial for taking the time to visit @RobinsAFB_GA to meet with our Airmen and see the critical missions at #RobinsAFB, including #TeamJSTARS, the WR-ALC &amp; @usairforce's new Advanced Technology &amp; Training Center in Warner Robins. #GA08 https://t.co/ykMzE9S0yU"
AustinScottGA08,1088206153580986368,2019-01-23 22:45:39,"Thank you @SecAFOfficial for visiting w/ the men, women &amp; missions of @RobinsAFB_GA who host our nation’s critical Air Battle Managers through #TeamJSTARS, as well as the WR-ALC &amp; the new ATTC facility. The Airmen at Robins AFB are top-notch. Thank you for your dedication to them https://t.co/r6BYl0PbQZ"
AustinScottGA08,1087442167063347205,2019-01-21 20:09:50,"Today, we celebrate the life &amp; legacy of Rev. Martin Luther King, Jr. &amp; reflect on his work to bring civil rights to every man &amp; woman. Please join me in reflecting on Dr. King’s life of service &amp; thinking of ways we can continue his legacy by serving others. #MLKDay https://t.co/PqLOHQkPfa"
AustinScottGA08,1086752192957243393,2019-01-19 22:28:08,"Unless @SpeakerPelosi &amp; @SenSchumer deny Congress a chance to vote on @POTUS proposal it will pass. The Schumer/Pelosi games are hurting fed workers, allowing criminal activity along our border &amp; holding up disaster assistance. They say they want to open the gov, then let’s vote."
AustinScottGA08,1086354547818283008,2019-01-18 20:08:02,RT @ugagr: The University of Georgia is proud of our Bulldog Alumni serving in the United States Congress. https://t.co/82NBEMz6GF
AustinScottGA08,1086350150988193795,2019-01-18 19:50:34,"Each year, thousands of Americans gather in D.C. and in communities around the country to march for the life and liberties of the unborn. I stand in solidarity with you today, and I will continue to be an advocate for the sanctity of human life. https://t.co/KpH1el1e4r"
AustinScottGA08,1085971647239196672,2019-01-17 18:46:31,"RT @FarmPolicy: .@SanfordBishop and @AustinScottGA08 Introduce Amendment to Aid #Farmers Impacted by Recent Natural Disasters 

Add'l Info:…"
AustinScottGA08,1084937996347105291,2019-01-14 22:19:10,"This afternoon, Brian Kemp (@GovKemp) was sworn-in as our 83rd Gov of GA. I know Brian well &amp; look forward to working with him to continue building a brighter future for our state &amp; for all Georgians. I also thank Gov Deal for his service, &amp; I wish him &amp; Sandra God's blessings."
AustinScottGA08,1083737224456404992,2019-01-11 14:47:43,".@Acosta was attacking @POTUS saying there is no ""imminent danger"" at the ""tranquil"" US/Mexico border. Meanwhile, real journalists at @CNN posted the following story from right down the road. https://t.co/D7aC61cq1f"
AustinScottGA08,1083465479832899584,2019-01-10 20:47:54,"Dems are bringing to the Floor spending bills that have no chance in the Senate. For all their talk on urgency of reopening the gov, they're wasting time w/ bills that fail to fulfill the priorities of millions of Americans &amp; address security, humanitarian crises at our border."
AustinScottGA08,1083446751506382854,2019-01-10 19:33:29,Stop drugs. Stop crime. Protect Americans. #SecureOurBorder. Border security is national security. https://t.co/rCdfJElw1i
AustinScottGA08,1083085960361984000,2019-01-09 19:39:50,"Please join me in thanking our law enforcement professionals who put themselves in harm’s way to keep our families &amp; communities safe. To our law enforcement agents: Your work is neither unappreciated nor forgotten, &amp; we thank you. #LawEnforcementAppreciationDay https://t.co/V3wpivVY8G"
AustinScottGA08,1082803296857927681,2019-01-09 00:56:38,I look forward to hearing @POTUS’s plan to confront the criminal activity along our border that endangers Americans &amp; undermines our immigration laws. I support @POTUS’s efforts to secure &amp; enhance our border &amp; extend my thx to law enforcement &amp; CBP agents who keep us all safe.
AustinScottGA08,1081260006689984513,2019-01-04 18:44:09,"Border security is national security, and Democrats in Congress need to come to the table to address this issue for the safety and security of every American. (4/4)"
AustinScottGA08,1081260005997899776,2019-01-04 18:44:08,"Border patrol agents, law enforcement officials, and millions of Americans across our nation have shown that enhancing security along our border is a priority to them, and up until @POTUS sought to fulfill this priority, Democrats wanted it too. (3/4)"
AustinScottGA08,1081260005364588544,2019-01-04 18:44:08,They have again shown that they are more concerned with opposing @POTUS than protecting Americans and supporting our law enforcement officials. (2/4)
AustinScottGA08,1081260004605419520,2019-01-04 18:44:08,"Yesterday, on the first day of the new Congress, my colleagues on the other side of the aisle chose to put forth a reckless spending bill to reopen the government that lacked the necessary funds to secure our border and protect the homeland. (1/4)"
AustinScottGA08,1081237517557481473,2019-01-04 17:14:47,"God Bless those who defend our freedoms and sacrifice so much for our country. Godspeed, Soldier, and thank you for your service. @GeorgiaGuard https://t.co/NSoWPDTgFp"
AustinScottGA08,1081217352103018497,2019-01-04 15:54:39,"The numbers are in: U.S. payrolls rose 312,000 in December; Average hourly earnings rose 3.2% from a year earlier; Jobless rate reflects more people are actively seeking work. #GOPTaxCuts create more opportunities and optimism. https://t.co/5kN91PO5Fz"
AustinScottGA08,1080953820467875846,2019-01-03 22:27:28,San Diego Border Patrol Agent: “We are being overwhelmed” https://t.co/L9qnpk4Ymp
AustinScottGA08,1080874161109651456,2019-01-03 17:10:56,"As we begin the 116th Congress, I would humbly ask if you would please pray for me &amp; my family &amp; also join me in praying for those in Congress that we all as a body continue to seek wisdom &amp; common sense in the coming session."
AustinScottGA08,1080874157007618048,2019-01-03 17:10:55,"Shortly, I will head to the House Floor to be sworn-in to represent the good people of Middle &amp; South Georgia in the 116th Congress. Serving the people of #GA08 has been one of the highest honors of my life, &amp; I look forward to what the next two years will bring. https://t.co/KHFcC4DANf"
AustinScottGA08,1080843879396581377,2019-01-03 15:10:36,"Congrats to the Middle Georgia region for being named to the 2019 Class of Great American Defense Communities. This is the 2nd yr in a row a community in #GA08 has been recognized for their commitment to our servicemembers, veterans, and military families. https://t.co/gFKeh3LHrs"
AustinScottGA08,1080583129000230915,2019-01-02 21:54:28,"On this day in 1788, Georgia became the 4th state to join the union upon ratifying the U.S. Constitution. You can find more info on Georgia’s birthday and facts about our state at the link below courtesy of the Library of Congress. #GA08 https://t.co/jbhl8o0e3q"
AustinScottGA08,1078131789451927558,2018-12-27 03:33:43,RT @GeorgiaGuard: Thank you @POTUS for the surprise holiday visit to our Georgia National Guardsmen of the 201st Regional Support Group who…
AustinScottGA08,1077584215632474117,2018-12-25 15:17:52,#MerryChristmas from our family to yours. https://t.co/EVMu6bQHrD
AustinScottGA08,1077352681709232129,2018-12-24 23:57:50,To our troops overseas and their families: Thank you for your service and sacrifice to our nation. Our thoughts are with you during the holiday season. #MerryChristmas https://t.co/x2QSc1vFYx
AustinScottGA08,1076917807936425990,2018-12-23 19:09:48,"Jim Mattis is one of the smartest men that I have ever had the privilege to meet. I have found listening to him to be a wise decision, and I will forever be grateful for his always faithful service to America."
AustinScottGA08,1076127861088681987,2018-12-21 14:50:50,Democrats are more concerned with denying the President than helping our country.
AustinScottGA08,1076127859918417921,2018-12-21 14:50:49,"What the mainstream media fails to report is that in addition to fulfilling Trump’s request on border security $, the House was also able to secure in the CR $8B in disaster assistance for GA, FL, AL, CA &amp; the Carolinas. This CR is a win-win. https://t.co/FWe4U3PKFR"
AustinScottGA08,1075953191408332800,2018-12-21 03:16:45,"I voted YES on the amended CR that included disaster assistance for GA farmers &amp; families &amp; @POTUS’s $5B request for border security. The CR now heads back to the Senate where I hope they’ll swiftly pass it to keep the gov open, secure our border &amp; deliver disaster assistance."
AustinScottGA08,1075851394341580800,2018-12-20 20:32:15,.@POTUS is about to sign into law the 2018 #FarmBill. You can watch LIVE here: https://t.co/fgKVNUbtrK
AustinScottGA08,1075745742046879744,2018-12-20 13:32:25,RT @HouseAgNews: The #2018FarmBill is officially headed to the president’s desk! Tune in tomorrow at 2:30pmET to watch the president sign t…
AustinScottGA08,1074135596166197249,2018-12-16 02:54:17,Congrats to the @valdostastatefb Blazers on their 🏆🏆🏆🏆 DII National Championship. You boys earned it! #BlazerNation #VState 🔥🔥🔥 https://t.co/Gy3qJkuGUa
AustinScottGA08,1073632110672527360,2018-12-14 17:33:36,Good luck to Coach Bell and the @valdostastatefb Blazers as they take on Ferris State in the @NCAADII National Championship this weekend. #GA08 is rooting for you! #BlazerNation #VState @BlazerAthletics @valdostastate https://t.co/sWXyTejsii
AustinScottGA08,1073245550345101312,2018-12-13 15:57:33,"I’d like to wish a very happy birthday to the @USNationalGuard &amp; @GeorgiaGuard. The Guard is a critical component of our national defense, and we are thankful for their commitment of service in our communities and abroad. #Guard382 https://t.co/JsjL3lsJSl"
AustinScottGA08,1073240193300381701,2018-12-13 15:36:16,RT @PositivelyBrie: Today the House voted to pass the #farmbill2018 which now heads to the President's desk. @AustinScottGA08 helped author…
AustinScottGA08,1072980306041425921,2018-12-12 22:23:34,I want to thank Chairman Mike Conaway &amp; RM Collin Peterson for their leadership during this process. I am confident that this bill delivers reforms our farmers and industry stakeholders desperately need to support our producers and rural communities. https://t.co/pgdpxdj7Qh
AustinScottGA08,1072965405591957505,2018-12-12 21:24:22,"RT @HouseAgNews: 🚨 PASSED: House approves #2018FarmBill. Next stop➡️ president’s desk. 

✅ Strengthens #FarmSafetyNet 
✅ Protects #CropInsu…"
AustinScottGA08,1072962791420690438,2018-12-12 21:13:58,"RT @RepRickCrawford: Like a good office neighbor, @AustinScottGA08 is there! Can we get an “amen” for this Farm Bill? #2018FarmBill @HouseA…"
AustinScottGA08,1072954357208023042,2018-12-12 20:40:27,I just spoke on the House Floor stressing the importance of our nation's ag industry and urging my colleagues to vote YES on the 2018 #FarmBill to keep our producers and rural communities growing and innovating for the 21st century. @HouseAgNews https://t.co/sW46jafq1m
AustinScottGA08,1072949765955043328,2018-12-12 20:22:13,"House Republicans are delivering on our promises to #ruralAmerica. The 2018 #FarmBill improves the #farmsafetynet, protects our natural resources, develops new trade agreements, prioritizes #ruralhealthcare, &amp; expands quality #ruralbroadband. @HouseAgNews @HouseGOP"
AustinScottGA08,1072926905689653249,2018-12-12 18:51:22,RT @HouseAgNews: The #FarmBill agreement prioritizes rural health and development and by strengthening @USDA’s capacity to combat the #opio…
AustinScottGA08,1072898700631003137,2018-12-12 16:59:18,"Today, the House will vote to pass the Conference Report to the 2018 #FarmBill. As a member of the Conference Committee and @HouseAgNews Subcommittee Chairman, I look forward to voting YES on this legislation to bring reform, relief, and stability to our nation's producers."
AustinScottGA08,1072880583078895616,2018-12-12 15:47:18,RT @HouseAgNews: The 2018 #FarmBill will strengthen the #farmsafetynet and provide certainty and flexibility to America’s farmers and ranch…
AustinScottGA08,1072595998860566528,2018-12-11 20:56:28,"The last Admin’s #WOTUS rule was overreaching &amp; detrimental to American farmers. I'm very glad to see @EPA's new “Waters of the U.S.” rule &amp; a roll back of burdensome regulations that stifled production &amp; did little to further protect our natural resources. Thank you, @POTUS!"
AustinScottGA08,1072564407555768321,2018-12-11 18:50:56,Wrote some cards to our troops who can’t make it home for the holidays this year. We are grateful for their and their families’ service and sacrifice not only during the holidays but throughout the year. #HolidayforHeroes #HolidayMailForHeroes https://t.co/gxVLapSKNA
AustinScottGA08,1072518126061973504,2018-12-11 15:47:02,It was a privilege to sign the Conference Report to the #FarmBill yesterday. I am confident that this bill delivers reforms our farmers desperately need to keep our producers &amp; rural communities growing &amp; innovating for the 21st century. I look forward to its swift passage. https://t.co/SzSERBqF6O
AustinScottGA08,1071506425929744384,2018-12-08 20:46:54,"RT @valdostastate: Your @valdostastatefb team is TEXAS BOUND!! 

The Blazers defeated the Falcons of Notre Dame (Ohio) 30-24 and are headed…"
AustinScottGA08,1071501626714800128,2018-12-08 20:27:50,Thank you to @POTUS for taking the time to participate in the great rivalry that is the #ArmyNavyGame.
AustinScottGA08,1071501623397138433,2018-12-08 20:27:49,Army/Navy is a special game showcasing the competition between each Academy going back 119 years. One of the greatest rivalries in American sports &amp; a true pleasure to watch players play for team &amp; country. Nothing like it anywhere else in the world. @NavyFB @ArmyWP_Football https://t.co/nWEqKzixUK
AustinScottGA08,1071138012241805313,2018-12-07 20:22:57,"Our recovery efforts will be a team effort, rest assured, and we will continue to work hard to deliver much-needed resources to get farmers and our rural communities back on track. https://t.co/NIVsdB8qyL"
AustinScottGA08,1071101650570485760,2018-12-07 17:58:28,"RT @USNavy: On this #PearlHarborDay – a ""date which will live in infamy,"" we remember and honor our fallen #USNavy #PearlHarbor77 shipmates…"
AustinScottGA08,1071096542877102080,2018-12-07 17:38:10,"Today, we remember those 2,403 Americans who were killed &amp; 1,143 others who were wounded at Pearl Harbor 77 years ago. Last year, I had the opportunity to pay my respects at the USS Arizona Memorial, a solemn and impactful experience. We will always remember. #HonorThem https://t.co/qjzq7R49G2"
AustinScottGA08,1070424197237747714,2018-12-05 21:06:30,Thank you U.S. Assistant Secretary of Defense for Sustainment Bob McMahon for speaking at the 3rd Annual Middle Georgia Congressional Breakfast in DC yesterday &amp; highlighting the positive impact of Robins AFB &amp; the special partnership between the base &amp; the local community. #GA08 https://t.co/emfawc56KB
AustinScottGA08,1070344973915168768,2018-12-05 15:51:42,"Today, we remember the life and legacy of President George H.W. Bush. #Remembering41 https://t.co/BoTu8zxTwm"
AustinScottGA08,1070323562685325317,2018-12-05 14:26:37,Thank you for meeting with me to discuss how we can ensure Georgians have the tools they need to recover from the devastation of Hurricane Michael. https://t.co/wdVjOPfuXe
AustinScottGA08,1070060761458839552,2018-12-04 21:02:20,"RT @USArmy: U.S. service members transfer the remains of former President George H.W. Bush at Joint Base Andrews, Maryland, Dec. 3, 2018.  …"
AustinScottGA08,1070052483467235328,2018-12-04 20:29:27,"RT @HASCRepublicans: Despite claims to the contrary, moving to withdraw from the INF Treaty is the latest in a 10-year effort to bring Russ…"
AustinScottGA08,1070006256423833600,2018-12-04 17:25:45,RT @hchsbeardown: Congratulations! @RizerBEARDOWN @HoustonCountySS #BearDown #ExpectExcellence https://t.co/y3hnVKXViL
AustinScottGA08,1069980432043773952,2018-12-04 15:43:08,Yesterday we held an awards ceremony for the winners of our 1st Annual #GA08 Congressional App Challenge. This challenge is a great way to showcase the innovation &amp; talents of our students. You can find information on our winners &amp; their apps here: https://t.co/rP27mBgsTr
AustinScottGA08,1069711095684874242,2018-12-03 21:52:54,"For those interested, you can find a live feed of the ceremony honoring the life of President George H.W. Bush in the U.S. Capitol Rotunda here: https://t.co/ztUmuW8B6x"
AustinScottGA08,1068974687974244352,2018-12-01 21:06:40,RT @SECNetwork: RT if ya got Georgia winning the #SECChampionship https://t.co/mIW3k23xpA
AustinScottGA08,1068974416925769730,2018-12-01 21:05:36,"RT @valdostastate: The Blazers zoomed past the Bears of Lenoir-Rhyne to VICTORY!
» FINAL SCORE: 61-21

It's a great day to be a #VState Bla…"
AustinScottGA08,1068926450475110400,2018-12-01 17:55:00,Good luck to the @valdostastatefb Blazers today as they take on Lenoir Rhyne in the quarterfinals of the playoffs. #GA08 is pulling for you! #BlazerNation 🔥🔥🔥 https://t.co/WCSFTaZ1H0
AustinScottGA08,1068874137559535616,2018-12-01 14:27:07,"“But our citizenship is in Heaven. And we eagerly await a Savior from there, the Lord Jesus Christ, who, by the power that enables him to bring everything under his control, will transform our lowly bodies so that they will be like his glorious body.” - Philippians 3:20-21 (2/2)"
AustinScottGA08,1068874134241898498,2018-12-01 14:27:06,"Our prayers are with the entire Bush family as we mourn the loss of an American hero and statesman. His impact on our country as a WWII vet, Congressman, CIA Director, VP, &amp; POTUS cannot be understated. During this time, the following verse comes to mind. (1/2)"
AustinScottGA08,1068547373759115266,2018-11-30 16:48:41,Medicare Part D open enrollment ends Dec. 7. Staff in our #Tifton &amp; #WarnerRobins offices are accepting appointment requests to speak w/ constituents on their options. We are happy to work w/ you individually to find the prescription drug plan that is best for your needs. #GA08 https://t.co/AMb9YuD9ea
AustinScottGA08,1068540968616509446,2018-11-30 16:23:14,RT @AlzGA: Thank you Representative @AustinScottGA08 for signing on as a co-sponsor of #BOLDAlzheimersAct yesterday! Together we can #ENDAL…
AustinScottGA08,1068532659746467840,2018-11-30 15:50:13,"Very happy for my friend and colleague @RepDougCollins on his selection to be the top Republican on the House Judiciary Committee for the 116th Congress. Doug is a good, honest, God-fearing Georgian who will uphold the integrity of the Committee, our party, and our country."
AustinScottGA08,1068235778084560896,2018-11-29 20:10:31,"Our offices are seeking interns in Washington, D.C., Tifton, and Warner Robins. For more information and to apply, please visit: https://t.co/VZFuTAB707"
AustinScottGA08,1067840270807363584,2018-11-28 17:58:54,"Congratulations on being named Chief Deputy Whip for the 116th Congress, @RepDrewFerguson. You are the right man for the job. https://t.co/yd4WXduOu2"
AustinScottGA08,1067151843925594115,2018-11-26 20:23:20,The GA House Delegation has sent a letter to House Leadership and House Appropriations requesting assistance to help GA's ag industry recover from #HurricaneMichael. @UGAExtension estimates Hurricane Michael caused $2.5B in damages. More here: https://t.co/hk4MXTioml #GA08 https://t.co/vUb2NsTAHi
AustinScottGA08,1065668355795927040,2018-11-22 18:08:29,RT @DeptofDefense: Happy #Thanksgiving to all who serve and those who keep the lights on for them at home. We thank you for your service an…
AustinScottGA08,1065658406269321216,2018-11-22 17:28:57,"Vivien, the kids, and I want to wish everyone a very #HappyThanksgiving. We thank God for the blessings we have and the opportunity to serve the people of #GA08. 🦃 https://t.co/gSOq5C9QZV"
AustinScottGA08,1065365668650995713,2018-11-21 22:05:43,"A few good #FoodSafety tips below from @USDAFoodSafety to help keep your Thanksgiving safe and delicious. For more information, visit https://t.co/y2iyYiSRPb. #Thanksgiving2018 @USDA https://t.co/GScJgAlwB3"
AustinScottGA08,1065000984353677312,2018-11-20 21:56:36,I am very saddened to hear of the passing of former Rep. Mac Collins. He was a great man and public servant who served Georgians well in Congress for over a decade. We send our condolences to his family during this time.
AustinScottGA08,1064963933415591936,2018-11-20 19:29:22,Was very pleased to be at the new ATTC’s opening. This center further solidifies the asset Warner Robins is to USAF. I look forward to seeing additive manufacturing capabilities it will allow for more efficient part replacement to ensure our aircraft remain safe &amp; in the fight. https://t.co/UJEK0ipUsR
AustinScottGA08,1063467765812682754,2018-11-16 16:24:08,"Thank you to members of the Lowndes County Board of Commissioners for meeting with me this past week. We had a good discussion on rural broadband, agriculture and health care, as well as issues pertinent to Moody Air Force Base. #GA08 https://t.co/7aAp0XujQp"
AustinScottGA08,1061635602804867073,2018-11-11 15:03:46,"I am committed to ensuring that our nation’s promises are kept to our veterans &amp; their families. My staff is always available to assist with @DeptVetAffairs disability claims or other federal issues. If you need assistance, please call any of our offices list below. #GA08 https://t.co/GhOejMYO29"
AustinScottGA08,1061635589999595520,2018-11-11 15:03:43,"As we celebrate #VeteransDay, I want to extend my thanks to our veterans &amp; the families who support them. It is an honor &amp; privilege to represent you in Congress. I’m honored to work to ensure that our veterans’ sacrifices are not forgotten. #HonorThem https://t.co/yWA3CANAlk"
AustinScottGA08,1056963865882361856,2018-10-29 17:39:57,"As we grieve together, let us remember that there is more that unites us than divides us as Americans, and that we are all called to love our neighbors as ourselves - no matter race, creed, or religion. (3/3)"
AustinScottGA08,1056963864275886080,2018-10-29 17:39:57,"We are also very thankful for the heroic work of law enforcement during the attack, and our thoughts are also with those wounded and their families. (2/3)"
AustinScottGA08,1056963861771886592,2018-10-29 17:39:56,"As details continue to emerge from the shooting that took place at Tree of Life Congregation over the weekend, our thoughts remain with the victims, their families and the city of Pittsburgh, as well as the Jewish community of Pittsburgh, during this tragic time. (1/3)"
AustinScottGA08,1055859118118977537,2018-10-26 16:30:05,Thank you to our men &amp; women in uniform &amp; their families for their sacrifices for our country. To all those who have deployed: Thank you for your service. To all those who are currently deployed: Our thoughts &amp; prayers are with you. #DayoftheDeployed #RememberEveryoneDeployed https://t.co/SIbWD1ht5Y
AustinScottGA08,1055229057896497152,2018-10-24 22:46:27,"I strongly condemn those involved in the act of mailing these explosive devices, &amp; thank the law enforcement officials for their swift work to neutralize them. There is absolutely no place for violence or threats of violence against public officials, their staffs, or the media."
AustinScottGA08,1055208279989600256,2018-10-24 21:23:53,RT @HouseGOP: BREAKING NEWS → @POTUS has signed the SUPPORT for Patients and Communities Act into law. #opioidcrisis https://t.co/HeRgyneA02
AustinScottGA08,1053364652732792832,2018-10-19 19:17:58,"RT @USDA: If you are a resident, farmer or rancher in need of relief &amp; recovery aid due to #HurricaneMichael, we can help! Our staff is act…"
AustinScottGA08,1053364155233828864,2018-10-19 19:15:59,"RT @ga_dps: It's been more than a week since #HurricaneMichael hit S Georgia.  DPS &amp; the @GeorgiaGuard have given out 54 pallets, totaling…"
AustinScottGA08,1053266724865351680,2018-10-19 12:48:50,RT @usairforce: #Airmen from @RobinsAFB_GA have restored RADAR capabilities to @TeamTyndall. #HurricaneMichael https://t.co/ggz9QfRWrv http…
AustinScottGA08,1053016584879558658,2018-10-18 20:14:52,RT @GeorgiaEMA: Survivors in the 13 counties eligible for individual assistance can now start applying for assistance through FEMA by visit…
AustinScottGA08,1052666011575611392,2018-10-17 21:01:49,"One of the biggest storms to ever hit Georgia, Hurricane Michael has had a profound impact on GA's ag industry. From downed 100-yr-old pecan trees to devastated cotton fields, the impacts of this storm will be felt for a generation. https://t.co/SCZ7VLrDAD"
AustinScottGA08,1052649492665774082,2018-10-17 19:56:10,"While there is certainly much more work to be done to keep our economy and job creation growing, this is great news and shows that our Republican policies are working for the American people. #BetterOffNow https://t.co/Qhp7K30KCh"
