AustinScottGA08,994213567325974528,2018-05-09 13:52:40,"Coming up at 10AM, @HASCRepublicans &amp; @HASCDemocrats will mark-up the #FY19NDAA to provide tools for our military to rebuild force structure, boost aviation readiness, strengthen cybersecurity, and much more. You can watch LIVE here: https://t.co/Ff7Ir5YseH"
AustinScottGA08,993914785002639361,2018-05-08 18:05:25,"On this day in 1945, Nazi Germany surrendered to Allied forces, ending WWII in Europe. Today, 73 years later, we remember and honor those of the Greatest Generation who paid the ultimate sacrifice fighting against tyranny for the freedoms we enjoy today. #VEDay https://t.co/7EL0I6pJhx"
AustinScottGA08,993908906228436994,2018-05-08 17:42:03,"This week is #TeacherAppreciationWeek a time to recognize our #GA08 educators &amp; educators across the country. I'd like to thank both current &amp; retired teachers, including my sister &amp; mother, for your hard work &amp; dedication helping our children to achieve their full potential. https://t.co/1lzw1cL8eu"
AustinScottGA08,993877774539599873,2018-05-08 15:38:21,"RT @NatResources: PASSED out of Committee → H.R. 2590, by @AustinScottGA08, amends the Pittman-Robertson Wildlife Restoration Act to modern…"
AustinScottGA08,993848682574475264,2018-05-08 13:42:45,This morning my bill to help get more sportsmen &amp; women back in the outdoors while generating more funds for wildlife conservation will be marked-up in @NatResources. More info on H.R. 2591 here: https://t.co/Pzc4Ge9zCv. Watch LIVE @ 10:15AM here: https://t.co/0oAKzxOfWA
AustinScottGA08,993627967111729152,2018-05-07 23:05:42,The House has just passed my legislation to close a gap in burial benefits for our veterans. You can read more here: https://t.co/kz8weGhHYF https://t.co/d1Gg7dfz6F
AustinScottGA08,993547987946270722,2018-05-07 17:47:54,"Later today, the House will consider legislation I sponsored which would close a gap in burial benefits for our veterans. You can find more information on the Veterans Cemetery Benefit Correction Act (H.R. 4910) here: https://t.co/9r7O86n5Tc https://t.co/B9QgpbwhnF"
AustinScottGA08,992414936029650947,2018-05-04 14:45:33,RT @WGXAnews: .@AustinScottGA08 honors eight Middle Georgia students heading to US Military Academies https://t.co/BIwkckWsqn
AustinScottGA08,992131406032752648,2018-05-03 19:58:54,"I'm very pleased to announce that 8 #GA08 students have received appointments to U.S. Military Service Academies. Being appointed to an academy is an honor, &amp; I congratulate these students for the hard work they have done to be appointed. More info here: https://t.co/byZu10TAsF https://t.co/mI0wZduaeK"
AustinScottGA08,992093779011158016,2018-05-03 17:29:23,RT @USArmy: Today is #NationalDayOfPrayer. Honor the day by praying or allowing a moment of silence to reflect on #USArmy Soldiers we've lo…
AustinScottGA08,992070802865573889,2018-05-03 15:58:05,"This #NationalDayOfPrayer, please join me in praying for our service men and women stationed around the world and their families, as well as the loved ones of the crew of a Puerto Rico Air National Guard C-130 which crashed near Savannah, Ga. yesterday. https://t.co/Q91O1HqeD7"
AustinScottGA08,991738502013386752,2018-05-02 17:57:39,"My office is following the crash of a Puerto Rico Air National Guard C-130 aircraft near Savannah, Ga., and our thoughts and prayers are with the crew and their loved ones during this time. https://t.co/6r1sJ8TzFn"
AustinScottGA08,991388692421009414,2018-05-01 18:47:38,I always enjoy visits to @UGATifton and getting to see the great ag research our universities put forth. Thanks for having me! https://t.co/awovtPFXMa
AustinScottGA08,991377787486441477,2018-05-01 18:04:18,"The reason we say ""small businesses are the backbone of our country"" is because it couldn't be more true. 99.9% of all businesses are #smallbiz, and the 29M of them in the U.S. employ 47% of all private sector employees. RT to celebrate #SmallBusinessWeek in our communities. https://t.co/WclS3yuIuB"
AustinScottGA08,991325237680721920,2018-05-01 14:35:29,RT @HouseAgNews: Farmers across the nation agree – #cropinsurance is essential. The #2018FarmBill maintains &amp; strengthens the farm safety n…
AustinScottGA08,991321820321198080,2018-05-01 14:21:54,"RT @GenDaveGoldfein: I'm often thanked for my service when people see me in uniform. But, our #MilKids &amp; families serve, too, often without…"
AustinScottGA08,989600516429762560,2018-04-26 20:22:03,"RT @ArcheryTrade_: Today, @mkormann, Dan Forster and representatives from @fishwildlife met with @AustinScottGA08 to discuss next steps for…"
AustinScottGA08,989589455307792387,2018-04-26 19:38:06,"Congratulations to Mike Pompeo on his confirmation by the Senate to be our next Secretary of State. I know he will serve our nation well, just as he did in the House and at the CIA. https://t.co/czxSeAWlmq"
AustinScottGA08,989581723456491520,2018-04-26 19:07:23,"This Saturday (April 28th) is National Prescription Drug Take Back Day, a time to safely dispose of unneeded and expired medication and help curb the public safety crisis that is opioid abuse. You can find a collection site near you here: https://t.co/z8gQoslp8w https://t.co/x7ha93iDMe"
AustinScottGA08,989536545022595072,2018-04-26 16:07:51,"There's an urgent need for @DeptofDefense,@usairforce to continue to ensure operational capability of BMC2/ISR platforms (like JSTARS) while also making future investments in space-based capabilities. I'll continue pushing for this as we get into #FY19NDAA https://t.co/6uCNT83QoL"
AustinScottGA08,989516869194350592,2018-04-26 14:49:40,"The @USCG, @USNavy &amp; @CBP play a key role in drug and human trafficking interdiction from transnational criminal organizations. This is tough and dangerous work, and we thank the joint forces who put their lives on the line every day to protect our country. https://t.co/6lTE8qFph6"
AustinScottGA08,989505880008941568,2018-04-26 14:06:00,RT @HASCRepublicans: LIVE: Emerging Threats &amp; Capabilities #FY19NDAA Mark kicks off - led by Chairwoman @RepStefanik - #ndaa watch here htt…
AustinScottGA08,989230366413254659,2018-04-25 19:51:13,"Great having students, parents, and educators from Dames Ferry Elementary School visiting the U.S. Capitol Building today. #GA08 https://t.co/aKBEw0SyFU"
AustinScottGA08,989152206090833920,2018-04-25 14:40:38,You can watch the Joint Meeting of Congress with the President of the French Republic @EmmanuelMacron live here: https://t.co/n7xTJu0z2t
AustinScottGA08,988839980406632448,2018-04-24 17:59:57,"I'm pleased to share that Ashley, a Perry HS student, is the winner of our 2018 Congressional Art Competition. In addition to scholarship eligibility, she will receive a trip to attend an awards reception in D.C. &amp; see her artwork hang in the @uscapitol. https://t.co/Q0U1oiuMxm https://t.co/1pvRG6T0Bn"
AustinScottGA08,988794005961011202,2018-04-24 14:57:16,"W/ a national decline in hunting &amp; recreational fishing, PR funds are shrinking &amp; our state/local habitats are suffering. I've put forth a bill which would help get more sportsmen &amp; women back in the outdoors while generating more PR funds for conservation https://t.co/VD7usEMMXo"
AustinScottGA08,988548113592934401,2018-04-23 22:40:11,RT @HouseAgNews: The #2018farmbill will continue putting people back to work by offering opportunities for #SNAP recipients to improve thei…
AustinScottGA08,988523081823027201,2018-04-23 21:00:43,"Today, the @USArmyReserve celebrates 110 years of dedicated service to our great nation. Reservists are a critical component of our national defense, and we thank them for their service and sacrifice to their country and fellow Americans. #SupportOurArmedForces https://t.co/4IElDCf3WC"
AustinScottGA08,987382669238505472,2018-04-20 17:29:07,"BIG NEWS: Atlanta has been chosen a finalist for the home to new @USArmy Futures Command. In March, the GA Delegation sent a letter to @SecArmy pressing for ATL to be considered. The largest hub for private sector/innovation in the SE, ATL just makes sense https://t.co/1lWQBhXIrx"
AustinScottGA08,987356927897333760,2018-04-20 15:46:50,"Putting the finishing touches on this week's e-newsletter. If you don't receive my email updates, you can sign up here: https://t.co/rDFQagbD8C https://t.co/z8wZnbj99o"
AustinScottGA08,986777834483052544,2018-04-19 01:25:43,"Today, House Ag passed a substantial policy framework acutely focused on our rural communities, American producers, &amp; those supported by our nation’s food nutrition programs. Included were 2 amendments I authored to bring broadband access to rural America. https://t.co/KBkNAGQDxL"
AustinScottGA08,986716447501144065,2018-04-18 21:21:48,"Today is Lineman Appreciation Day, honoring the men &amp; women who keep America powered. Thanks for the work you do. #ThankaLineman https://t.co/fsuFvn4CXt"
AustinScottGA08,986697280836243457,2018-04-18 20:05:38,Electromagnetic ops will only become more important as tech continues to advance at its current rapid pace. Glad to join my colleagues @RepDonBacon @RepCarbajal @RepJimmyPanetta on this bipartisan bill which is critical to the future defense of our nation. https://t.co/2vc1z9yvBN
AustinScottGA08,986644559911424000,2018-04-18 16:36:08,Some military families are not eligible for #SNAP because the current asset eligibility formula counts their housing voucher against their income. Modernizing SNAP exemptions in our #2018FarmBill supports our troops and their families. #SNAPmatters #FarmBill https://t.co/IdvqVYINqp
AustinScottGA08,986633592003538944,2018-04-18 15:52:33,"Smart farm technology requires modern, high-speed internet access. I am offering two amendments to #2018FarmBill to bring broadband services and broadband infrastructure investment to #ruralAmerica. @HouseAgNews"
AustinScottGA08,986628404706529280,2018-04-18 15:31:57,RT @HouseAgNews: CLAIM: $1B investment is not enough. #2018FarmBill TRIPLES the investment PER recipients. Maintaining the status quo does…
AustinScottGA08,986628078481920001,2018-04-18 15:30:39,"RT @HouseAgNews: CLAIM: New proposal takes #SNAP benefits away from children, elderly and disabled. FACT: This proposal doesn't touch those…"
AustinScottGA08,986627075326074882,2018-04-18 15:26:40,"Our #2018FarmBill improves #SNAP integrity by implementing a database that tracks duplicative enrollment across the nation, preventing dual SNAP benefits across state lines. #SNAPmatters #FarmBill https://t.co/Ohkces30tp"
AustinScottGA08,986611223226650630,2018-04-18 14:23:40,RT @HouseAgNews: FACT: Under #2018FarmBill NO ONE is kicked off of #SNAP due to work requirements. #SNAPmatters https://t.co/VPPBEfwpMV
AustinScottGA08,986599273251864576,2018-04-18 13:36:11,"#2018FarmBill modernizes #SNAP asset limits, some of which haven't been updated since the '70's. The more people work, the more they make &amp; sometimes the less they have. Our bill adjusts assets according to inflation so working households can work &amp; receive benefits when needed. https://t.co/Fu1ZtdncJT"
AustinScottGA08,986596272252604417,2018-04-18 13:24:16,"At 10AM ET, @HouseAgNews will mark-up H.R. 2, the #2018FarmBill. You can watch it LIVE below: https://t.co/Qnx6WdRY8G"
AustinScottGA08,986422225359302656,2018-04-18 01:52:40,"Vivien &amp; I are sad to hear of the passing of former First Lady Barbara Bush. Her strength &amp; kindness touched millions, &amp; her campaigns of volunteerism &amp; combating illiteracy &amp; homelessness will continue to impact generations. Our prayers are w/ the Bush family during this time."
AustinScottGA08,986288658352353282,2018-04-17 17:01:55,"RT @HouseAgNews: #RuralAmerica is hurting. Over the last five years, net farm income has been cut in half. Strong farm policy provides a sa…"
AustinScottGA08,986245734180818944,2018-04-17 14:11:21,"This #TaxDay marks the last time you’ll have to file taxes under our old, outdated system. Our #taxreform makes filing simpler, nearly doubles the standard deduction, &amp; keeps more of your money in your wallet. RT to say goodbye to this 32-year-old tax code. #TaxCutsandJobsAct https://t.co/36PTIyHMiQ"
AustinScottGA08,984883869039190021,2018-04-13 19:59:47,RT @HouseAgNews: House Members from Across the Country Praise #2018FarmBill @CongressmanGT @RepBobGibbs @RepAbraham @RepHartzler @RepRickCr…
AustinScottGA08,984854105708531713,2018-04-13 18:01:31,RT @AustinScottGA08: The 2018 Congressional Art Competition is here. Visit my Facebook page &amp; LIKE your favorite artwork. The picture with…
AustinScottGA08,984846839286587397,2018-04-13 17:32:38,"For the last 3 yrs, @HouseAgNews has been working around the clock to craft a #farmbill that meets the unique needs of our ag sector &amp; rural America. Thank you @ConawayTX11 for your leadership, &amp; I look forward to mark-up next week. My full statement here: https://t.co/GkTmPHlpOY https://t.co/Fh1VVnfK8v"
AustinScottGA08,984838365769093120,2018-04-13 16:58:58,RT @HouseAgNews: ICYMI: #HouseAg Members Highlight Nutrition on House Floor. https://t.co/vrpPTZ2TC7 #SNAPmatters @CongressmanGT @ConawayTX…
AustinScottGA08,984570699539992576,2018-04-12 23:15:21,"RT @HouseAgNews: .@AustinScottGA08: The question is—how do we help give people a path off gov't programs? The more people work, the more th…"
AustinScottGA08,984477966024544256,2018-04-12 17:06:52,"Today, on #HolocaustRemembranceDay #WeRemember the six million Jewish people who were murdered by the Nazi regime, reflect on the atrocities that took place, and we pledge #NeverAgain. https://t.co/zInGercont"
AustinScottGA08,984453149904850944,2018-04-12 15:28:15,The 2018 Congressional Art Competition is here. Visit my Facebook page &amp; LIKE your favorite artwork. The picture with the most “likes” will hang in my DC office for one year. All of these submissions are by talented high school students across #GA08. https://t.co/kN2lUJ4V5g https://t.co/ifNDgC1ujM
AustinScottGA08,984157275903361027,2018-04-11 19:52:33,"For the last two decades, Paul Ryan has selflessly served our country, and his character, integrity, and leadership will certainly be missed in the House of Representatives. My full statement here: https://t.co/JdJ8qphuj5"
AustinScottGA08,983733395393073153,2018-04-10 15:48:13,"RT @AustinScottGA08: If you or someone you know is interested in learning more about internships with my Washington, D.C., #Tifton, or #War…"
AustinScottGA08,983402139757277184,2018-04-09 17:51:55,"April is Month of the Military Child, a time to recognize the sacrifices our military families - and especially our military children - make for our country. To all our military families and children: Your strength and sacrifices are not forgotten. Thank you. https://t.co/w1HtyIHuFw"
AustinScottGA08,982367696804249600,2018-04-06 21:21:25,"RT @USMC: In memory of the Marines from HMH-465 with @3rdmaw who lost their lives in an aircraft mishap. 

Semper Fidelis, Marines https://…"
AustinScottGA08,982342194337116160,2018-04-06 19:40:04,"This bipartisan legislation would provide grant funding for evidence-based training to prevent school violence. Rest assured I'll continue to engage w/ local law enforcement, teachers &amp; superintendents on more possible solutions to ensure safe environments for our students. (2/2)"
AustinScottGA08,982342178910494720,2018-04-06 19:40:01,"This week I met with law enforcement &amp; training officials about possible solutions for improving school safety. As a father of 3, I believe our children shouldn't be worried that their schools are not safe, which is why I supported H.R. 4909 - the STOP School Violence Act. (1/2) https://t.co/n3fcDZXvyd"
AustinScottGA08,982313279023349761,2018-04-06 17:45:10,"If you or someone you know is interested in learning more about internships with my Washington, D.C., #Tifton, or #WarnerRobins offices, you can visit my website or call any of our offices. #GA08 https://t.co/VZFuTAB707"
AustinScottGA08,982308832465563649,2018-04-06 17:27:30,"Sadie, a student at @ABAC_College, has just completed a 12-week internship in my DC office. Young folks who intern in our office are an important part of our team &amp; Sadie is no exception. We thank her for her hard work &amp; we look forward to seeing her continued growth and success. https://t.co/8ntmeCVKMa"
AustinScottGA08,981942657319661569,2018-04-05 17:12:27,"I support @POTUS decision to work with governors of states along our southern border to strengthen security until more permanent measures are in place, just as past Presidents have done to ensure our border is secure. (2/2)
 https://t.co/04vjWqYcLN"
AustinScottGA08,981942656187224066,2018-04-05 17:12:27,"Approximately 5,000 Americans die every month to drug overdoses, &amp; transnational criminal organizations who smuggle drugs &amp; people into the U.S. are exploiting our border security weaknesses &amp; present a danger to the citizens of the United States of America. (1/2)"
AustinScottGA08,981916261335621632,2018-04-05 15:27:34,"I always look forward to attending the @FvsuAg Ham &amp; Eggs Legislative Breakfast, a time to celebrate the strength and success of Georgia's ag research and education programs. Georgia is leading the way in feeding not only our neighbors, but also the world. https://t.co/Eb2xi6lTYl"
AustinScottGA08,981619255803371521,2018-04-04 19:47:22,"Today we honor the life &amp; legacy of Dr. Martin Luther King, Jr. Rev. King remains a giant among men whose spirit &amp; legacy continues to inspire generations towards love, unity, peace, &amp; equality among all people. #MLK50 https://t.co/C4nRkxDBRZ"
AustinScottGA08,981186610455859201,2018-04-03 15:08:12,"RT @AustinScottGA08: The months between April &amp; August are some of the busiest for constituents visiting Washington, D.C. My office is able…"
AustinScottGA08,980551006667845632,2018-04-01 21:02:32,Gabriela did well at the Easter Egg Hunt this afternoon. #HappyEaster #HeIsRisen #EasterSunday https://t.co/IcS4W8a8rm
AustinScottGA08,980441884924567552,2018-04-01 13:48:55,"He is Risen! From our family to yours, have a happy and blessed Easter. #GA08 https://t.co/y7IiegwKHo"
AustinScottGA08,979011156940673025,2018-03-28 15:03:43,RT @DeptofDefense: It’s a necessity and an exact science that takes place thousands of feet in the air. Watch this #A10 refuel in the ⛅⛅⛅!…
AustinScottGA08,979000769591595009,2018-03-28 14:22:27,RT @USUNRome: We were thrilled to host students &amp; faculty from @ABAC_College last week for a discussion on how @USUNRome works w/ the Rome-…
AustinScottGA08,978996720519602176,2018-03-28 14:06:21,"Students at Valdosta Middle School are participating in @SIFMAFoundation's #CapitolHillChallenge, &amp; I stopped by to see their progress &amp; discuss the importance of savings &amp; investing. I applaud them for undertaking this challenge! #GA08 https://t.co/aEMOAuLJ4f"
AustinScottGA08,977271114824060934,2018-03-23 19:49:25,RT @FootballUGA: Happy #NationalPuppyDay to our favorite pup: Uga X! https://t.co/jE194Q2xCw
AustinScottGA08,977224608121278465,2018-03-23 16:44:37,"His legacy will be one of hope &amp; opportunity that many will aspire to replicate for generations to come. Our thoughts &amp; prayers are with his family &amp; friends during this time, &amp; we offer them our sincerest condolences."
AustinScottGA08,977224603796934662,2018-03-23 16:44:36,"Vivien &amp; I join all Georgians in mourning the loss of former Governor &amp; U.S. Senator Zell Miller. Zell's impact on GA cannot be understated. His work on public education, including his leadership in creating the HOPE Scholarship, changed the lives of millions of Georgians."
AustinScottGA08,976835767371739136,2018-03-22 14:59:30,"Students from @WRMiddleSchool weren't going to let a little snow put a damper on their trip to Washington, D.C. Thank you for coming to meet with me yesterday, and enjoy the rest of your time in our nation's capital! @HoustonCountySS #GA08 https://t.co/UrQSqOnxex"
AustinScottGA08,976491769633366017,2018-03-21 16:12:34,"It is my hope that by passing my Pittman-Robertson modernization bill (H.R. 2591), we can bring new generations into the sportsmen's community and ensure that our wildlife resources are protected for years to come. More on my bill here: https://t.co/Pzc4Ge9zCv"
AustinScottGA08,976491768182202368,2018-03-21 16:12:34,"Decades of population relocation to urban areas has made it more and more difficult for many Americans to regularly participate in sportsmen’s activities, negatively impacting our wildlife conservation funding. https://t.co/OUSbIE29tT"
AustinScottGA08,976457846312357888,2018-03-21 13:57:46,"FEDERAL OFFICES in D.C. are CLOSED today due to a winter storm. However, my D.C. office will be open and operating with limited staff. Here’s a live look at the snow storm from @SpeakerRyan’s office in the @uscapitol: https://t.co/ID9MWJAbju"
AustinScottGA08,976140515661041664,2018-03-20 16:56:49,"Happy #NationalAgDay to all our #GA08 and Georgia farmers, and thank you for the work you do in feeding our communities and the world. #AgDay #AgDay2018 https://t.co/w7X8tLFEdv"
AustinScottGA08,976101889283682304,2018-03-20 14:23:20,RT @HouseAgNews: Our U.S. agriculture industry is as wide and diverse as its people and plays a vital role in ensuring our nation continues…
AustinScottGA08,976099156652625920,2018-03-20 14:12:28,RT @VAoftheArts: WE ❤️ D.C. - @AustinScottGA08 stressed being “College and Career Ready” for the Future of PANDA 5th Graders! @BibbSchools…
AustinScottGA08,975800785442430977,2018-03-19 18:26:51,"Last week, Captain Mark Weber from the 38th Rescue Squadron at Moody AFB was killed when a HH-60G Pave Hawk crashed in Iraq. We are grateful for his courage &amp; service to our nation &amp; his family, friends &amp; Moody community are in our prayers during this time https://t.co/slpdf76Rax"
AustinScottGA08,975759860523520000,2018-03-19 15:44:14,"This week is #NationalAgWeek, a time to celebrate all that American agriculture contributes to our communities and the world. #ThankAFarmer https://t.co/iX6SwC62VS"
AustinScottGA08,974776452704079872,2018-03-16 22:36:31,RT @AustinScottGA08: My weekly email newsletter is a great way to stay updated on my work on behalf of #GA08. You can sign up for my email…
AustinScottGA08,974748550721605632,2018-03-16 20:45:39,"I believe in the #JSTARS mission, and I will continue pressing back against @usairforce plans to cancel this platform until an adequate replacement is presented. https://t.co/5NWUw8XLuH"
AustinScottGA08,974729871212544000,2018-03-16 19:31:25,"As our threats change, the US must maintain its soft power missions &amp; that starts w/ our humanitarian response via hospital ships #USNSMercy &amp; #USNSComfort. I'm a strong advocate of their missions &amp; am pressing @USNavy to keep both ships in active service. https://t.co/WTGxG1Leul"
AustinScottGA08,974697208535797761,2018-03-16 17:21:38,"Saddened to hear of the passing of Rep. Louise Slaughter. Rep. Slaughter had always shown kindness &amp; respect to her colleagues, no matter which side of the aisle, &amp; fought steadfastly for her constituents. Her family, friends &amp; people of NY-25 are in our prayers during this time"
AustinScottGA08,973642142387261443,2018-03-13 19:29:10,My weekly email newsletter is a great way to stay updated on my work on behalf of #GA08. You can sign up for my email updates here: https://t.co/rDFQagbD8C
AustinScottGA08,973630340165177344,2018-03-13 18:42:16,Each year #HabitatforHumanity provides new opportunities &amp; fresh starts for families throughout the US &amp; around the world. Thank you to the Valdosta Habitat &amp; their student volunteers from Massachusetts for your work in our community &amp; changing the lives of our neighbors in #GA08 https://t.co/p5UJ7cbR7D
AustinScottGA08,973567153659109377,2018-03-13 14:31:12,Our Airmen at #MoodyAFB &amp; their families are an invaluable part of South GA &amp; the local community's support of our Airmen &amp; their families is critical to morale &amp; mission success. It is truly an honor to represent you in Congress. #MoodyIsUs #GA08 https://t.co/TquWoc7yEf
AustinScottGA08,973224362986831872,2018-03-12 15:49:04,"The months between April &amp; August are some of the busiest for constituents visiting Washington, D.C. My office is able to assist in scheduling tours of the @uscapitol, @WhiteHouse, @librarycongress, the Pentagon, &amp; more. You can find more info here: https://t.co/GaUU4LXER4"
AustinScottGA08,973213781303152640,2018-03-12 15:07:01,RT @USNavy: #Paralympics #MondayMotivation #ICYMI https://t.co/Ng8WH5lW6L
AustinScottGA08,972112567119302657,2018-03-09 14:11:11,"75 yrs ago, residents of the Wellston community (later renamed #WarnerRobins) came together to purchase land for what would become #RobinsAFB. Today, the legacy of the founders of WR continues to be a community dedicated to the defense of our great nation. https://t.co/imnQM0n1Vp"
AustinScottGA08,972107131993362432,2018-03-09 13:49:35,"RT @AustinScottGA08: In case you missed it, we've kicked off the 2018 Congressional Art Competition for #GA08. If you have questions about…"
AustinScottGA08,971842750709723138,2018-03-08 20:19:02,"RT @AustinScottGA08: Have you been impacted by the #TaxCutsandJobsAct? Starting in February, your paycheck may have seen a boost thanks to…"
AustinScottGA08,971820895617642497,2018-03-08 18:52:11,I always enjoy getting to meet with @GaFarmBureau Young Farmers. Thanks for stopping by my D.C. office this week to speak on important issues that are impacting agriculture. https://t.co/xBWo1HcaBC
AustinScottGA08,971808822040948736,2018-03-08 18:04:13,"Today we celebrate #InternationalWomensDay. Thank you to all the inspiring women in my life, including my mother Becky, my wife Vivien, my daughter Gabriela, and the members of my dedicated staff who work hard every day for the people of #GA08. https://t.co/r17bHRPsQm"
