AustinScottGA08,1224718076463263746,2020-02-04 15:35:18,"This evening, @realDonaldTrump will deliver the #SOTU2020. I look forward to the President addressing our growing economy and continuing to bolster our national defense. You can watch it live on a local news station, a national news station, or at https://t.co/8IuxrUe0EM. https://t.co/dsigiKNk69"
AustinScottGA08,1222567436559536129,2020-01-29 17:09:25,"Great being at the @WhiteHouse for the signing of #USMCA. It is truly a new era for American businesses, &amp; I look forward to continuing to work with @realDonaldTrump &amp; my colleagues in Congress to open new markets &amp; opportunities for our economy to grow and thrive. https://t.co/m5cuVPkV8G"
AustinScottGA08,1222243760999936000,2020-01-28 19:43:15,".@realDonaldTrump was elected to tackle some of the biggest challenges our nation &amp; world face. It’s my hope that this plan will achieve peace, security, &amp; prosperity for Israel &amp; the Palestinian people. Thank you for your commitment to Israel &amp; securing peace in the Middle East. https://t.co/R5ZkbOlBbR"
AustinScottGA08,1221484831323848706,2020-01-26 17:27:32,"On Thursday, I joined local community leaders &amp; reps from @CocaColaUnited at the groundbreaking of a new $60M facility in Tifton, which will create 200 new jobs. For more than 100 yrs, @CocaCola has been a staple brand of our state, &amp; now it will be a staple employer in South GA. https://t.co/qsOr6KyDw4"
AustinScottGA08,1220733964945698816,2020-01-24 15:43:52,"If you’re a #GA08 constituent in town for the #MarchForLife, I hope you’ll stop by my office in the Rayburn Building today to warm up with a Coca-Cola product and some Georgia peanuts.

God Bless."
AustinScottGA08,1220733963821514752,2020-01-24 15:43:51,"Today, President Trump will become the first sitting U.S. president to speak at the #MarchForLife. You can watch his  remarks LIVE at noon ET here: https://t.co/iCdnITdEwN."
AustinScottGA08,1220733962848538625,2020-01-24 15:43:51,"Today, thousands from across our country will come together in DC to participate in the #MarchForLife. I want to say a special thank you to those participating in the march today &amp; to @nrlc &amp; other pro-life groups for your commitment to standing up for the lives of the unborn. https://t.co/jRfBYfLdsa"
AustinScottGA08,1220452204064264192,2020-01-23 21:04:15,We can protect our natural resources without infringing on the rights of millions of Americans. I look forward to seeing the positive economic and conservation impacts of this new #WOTUS rule. https://t.co/1wNgvKL0Uk
AustinScottGA08,1220363957938073601,2020-01-23 15:13:35,"4th graders at JT Reddick Elementary in Tifton are currently learning about the three branches of government. I joined them to talk about the federal government &amp; my role as their Congressman. Our #GA08 students are very sharp, &amp; I know the future of our state is bright. https://t.co/oohJuhbhj1"
AustinScottGA08,1220056915486674945,2020-01-22 18:53:30,"RT @HouseGOP: House Democrats’ hand-picked impeachment managers have 𝗻𝗼 𝗰𝗿𝗲𝗱𝗶𝗯𝗶𝗹𝗶𝘁𝘆.
 
Look no further than their lead impeachment manager…"
AustinScottGA08,1220054125758558208,2020-01-22 18:42:25,"I’m very proud to announce our winners of the 2019 Congressional App Challenge - Somtochukwu Nwagbata, Cheluchi Nwagbata, and Bayabya Joshi of Houston County High School. Their app, HCBE Alerts, is a school safety app for school staff to report and handle emergencies. #GA08 https://t.co/icecUU8gNU"
AustinScottGA08,1220019916922814465,2020-01-22 16:26:29,"This week, I’ve met with the Georgia Corn Growers Association &amp; Wilcox County farmers to discuss Hurricane Michael assistance, ongoing implementation of 2018 Farm Bill programs, &amp; the positive impact @realDonaldTrump’s new trade deals will have on GA’s robust ag sector. #GA08 https://t.co/yzphBAMb43"
AustinScottGA08,1219313190644977666,2020-01-20 17:38:13,"Today, we honor the life and legacy of Georgia native Dr. Martin Luther King, Jr. and his dedication to achieving equality and justice for all Americans. Rev. King remains a giant among men whose spirit and legacy continues to inspire generations. https://t.co/rFanQTTFdl"
AustinScottGA08,1218925247023538176,2020-01-19 15:56:40,"We are very saddened to hear that Bonnie Duvall, wife of American Farm Bureau President Zippy Duvall, has lost her battle with cancer. Please join Vivien and I in praying for the Duvall family during this difficult time."
AustinScottGA08,1217511950835470338,2020-01-15 18:20:44,"Congratulations, @realDonaldTrump, on this huge win for American farmers and businesses! 

China will purchase $200B of U.S. goods, most of which will be agricultural products. https://t.co/xqJAtZZkQP"
AustinScottGA08,1215423342632669187,2020-01-10 00:01:21,"I voted NO on the resolution to strip @realDonaldTrump of a critically necessary power to defend against increasing aggression against us and our partners in the region. He had complete authority to utilize an airstrike against General Soleimani, and he made the right call. (4/4)"
AustinScottGA08,1215423340875218944,2020-01-10 00:01:20,President Obama averaged six kills a week by air strikes according to his own DNI (https://t.co/XoTZDTkjpd). (3/4)
AustinScottGA08,1215423339151396864,2020-01-10 00:01:20,The only reason Iran is singled out in this resolution is to take a political jab at President Trump for utilizing an airstrike to take out General Soleimani – a terrorist who was responsible for killing thousands of American and partner troops. (2/4)
AustinScottGA08,1215423336492281861,2020-01-10 00:01:19,"If we want to have an honest debate about war powers, then we should have an honest debate about war powers. Why, then, did our colleagues on the other side of the aisle single out only Iran in this resolution? Why not Libya? Why not Syria? (1/4)"
AustinScottGA08,1215270458054053889,2020-01-09 13:53:50,"Today is Law Enforcement Appreciation Day, a time to recognize and thank the men and women who bravely protect and serve our communities. To all our Middle and South Georgia law enforcement officers: Thank you for the important work you do each and every day. #GA08 https://t.co/e5lT3Cp7ZO"
AustinScottGA08,1215005367853170688,2020-01-08 20:20:28,"Just spoke w/ @WGXAnews on Soleimani’s death &amp; last night’s attack. Soleimani was the leader of a designated terrorist org. @realDonaldTrump made the right call. If President Obama would have made the same call, @SpeakerPelosi &amp; @HouseDemocrats would be praising him for it. https://t.co/mZMR4sETxu"
AustinScottGA08,1214936472123576320,2020-01-08 15:46:42,"At 11:00 am, President Trump will address the nation. You can watch LIVE here: https://t.co/FYTJPMpsUR"
AustinScottGA08,1214711915953491969,2020-01-08 00:54:23,"Please keep our American and partner forces serving overseas and their families in your prayers tonight. It is 3:50 am in Iraq, and Iran has struck bases that house U.S. and partner forces with missiles."
AustinScottGA08,1214332852621451265,2020-01-06 23:48:07,"I'd like to welcome the newest member of the Georgia Congressional Delegation, Sen. Kelly Loeffler. I look forward to working with @SenatorLoeffler on issues important to Georgians, including our national defense, the economy, our ag sector, and supporting President Trump. https://t.co/n3YZhwL6i5"
AustinScottGA08,1213138153835520002,2020-01-03 16:40:49,"With his death, we must be prepared for any retaliatory actions and continue to work with partners to ensure stability in the region and any areas where Iran’s proxies are currently operating. (2/2)"
AustinScottGA08,1213138153135054851,2020-01-03 16:40:49,"For years, Iran has used proxies to attack and kill American soldiers and our partner forces. Qassem Soleimani was the head of the Islamic Revolutionary Guard Corps- Quds Force, a designated terrorist organization, and was responsible for these attacks. (1/2)"
AustinScottGA08,1212794852779462657,2020-01-02 17:56:40,"Today in 1788, GA became the 4th state admitted to the Union. For over 230 yrs, GA has played a key role in our nation’s economy, defense, culture, &amp; identity &amp; has produced musicians, presidents, astronauts, &amp; Olympians. I'm proud to be from GA &amp; proud to serve Georgians in DC. https://t.co/OoV1ITB4Xn"
AustinScottGA08,1209873864295157760,2019-12-25 16:29:42,"Vivien, the kids, and I wish you and your family a very #MerryChristmas and blessed holiday season. We remember those serving abroad today and say a special thank you to our troops and military families. God Bless. https://t.co/iWZqBf2kkf"
AustinScottGA08,1207783320878227456,2019-12-19 22:02:37,"Moments ago, the House passed #USMCA. I congratulate &amp; thank @realDonaldTrump on securing this important trade deal, which passed with my support. This new agreement with GA’s top export markets is critical to ensuring the success of our businesses, farmers, &amp; manufacturers. https://t.co/NxUcEY1FjS"
AustinScottGA08,1207380886309818371,2019-12-18 19:23:30,House Democrats have used sequencing &amp; patterns to manufacture a sham case for impeachment of @realDonaldTrump. Their hatred for the President of the United States blinds them to the truth. I’ll be voting NO on articles of impeachment. #ImpeachmentSham https://t.co/jRTBj87jjK
AustinScottGA08,1205892387832246279,2019-12-14 16:48:44,"RT @espn: Army and Navy may be rivals, but they are united with patches honoring the veterans who fought for their country before them 🙏

(…"
AustinScottGA08,1205310089248288768,2019-12-13 02:14:53,Wonderful night at the White House tonight with the President and First Lady. I extended to them Christmas wishes from the Eighth District and thanked @realDonaldTrump for his tireless work to keep America the greatest country in the world. https://t.co/bOeQfrRCyJ
AustinScottGA08,1204804109121064961,2019-12-11 16:44:18,"This afternoon, #HouseAg will hold a hearing on farm credit programs. You can tune in here at 2:00 pm ET: https://t.co/8StoPd0yHN https://t.co/3e7gIfV96Q"
AustinScottGA08,1204525058804387848,2019-12-10 22:15:27,Very special visitor in town this week. We had the chance to see the Christmas decorations at the White House. https://t.co/za7tsFIQ1q
AustinScottGA08,1204449852261883906,2019-12-10 17:16:37,"Yesterday, @RepAdamSchiff's Counsel admitted to @RepDougCollins to using sequencing &amp; patterns to build a circumstantial case. 

The facts are not on their side, but still they move forward w/ their partisan, baseless #ShamImpeachment. Their hatred of @realDonaldTrump has no end. https://t.co/8N83TZnd06"
AustinScottGA08,1203367220245647363,2019-12-07 17:34:37,"Today, we remember the 2,403 Americans who lost their lives defending our country in the attack on Pearl Harbor. Their sacrifices will never be forgotten. #HonorThem #PearlHarborRemembranceDay #PearlHarbor78 https://t.co/kVkM6FSjFn"
AustinScottGA08,1202976318863937536,2019-12-06 15:41:19,"RT @thanks4hunting: “I am pleased the Committee favorably passed my PR modernization bill, and I will keep pressing until our decades-old w…"
AustinScottGA08,1202648205487423488,2019-12-05 17:57:30,"It’s been an honor to serve our fellow Georgians alongside you, Tom. Vivien and I wish you, Julie, and your family all the best in your next chapter. Thank you for your decades of service to our great state both in the GA House and in Congress. https://t.co/iSwgzZrTBQ"
AustinScottGA08,1202613781047783424,2019-12-05 15:40:43,Profs without proof. Not a single one of yesterday’s legal professors had any personal knowledge of a single fact in Adam Schiff’s report. This has been a factless personal attack against President Trump from the start. #ShamImpeachment https://t.co/eg2gDksXnG
AustinScottGA08,1202305775890251776,2019-12-04 19:16:49,This new rule will provide a pathway off the program for many able-bodied adults without dependents while giving them tools to climb the economic ladder. I thank @POTUS &amp; @SecretarySonny for their commitment to creating opportunities for every American. https://t.co/UfJFMAl4I3
AustinScottGA08,1202252620116697088,2019-12-04 15:45:36,"I’d like to congratulate Kelly Loeffler on her appointment to the U.S. Senate. I look forward to working with her as a member of the Georgia Delegation to support our military installations, #GA farmers and rural communities, and especially President Trump."
AustinScottGA08,1202002499466649601,2019-12-03 23:11:42,"Powerful words today from my friend and colleague, @SenatorIsakson. His character and statesmanship will be greatly missed in Washington. Vivien and I wish him and Dianne the best as they enter into their next chapter together. You’re the best, Johnny. https://t.co/uJRc1eBkO1"
AustinScottGA08,1200059291782139904,2019-11-28 14:30:05,"Please join me in thanking our warfighters, first responders, &amp; their families for their service &amp; sacrifices. Our thoughts are with them &amp; those who are unable to spend the holidays with their loved ones. From our family to yours, we wish everyone a happy &amp; safe #Thanksgiving. https://t.co/KUODlmWB4J"
AustinScottGA08,1199356829245100032,2019-11-26 15:58:45,"Vivien &amp; I are saddened to hear of the passing of State Rep. &amp; former Mayor of Camilla, Jay Powell. Jay was a good friend &amp; fierce fighter for GA, &amp; his impact to our state &amp; rural communities cannot be understated. Our prayers are with his family during this difficult time. https://t.co/ERK89dnADr"
AustinScottGA08,1196944632107716608,2019-11-20 00:13:33,"I'd like to thank my colleagues who joined me on the House Floor this afternoon to pay tribute to the legislative legacy of @SenatorIsakson. Johnny is a giant among men, &amp; it has been an honor to work alongside him fighting for the good people of GA. https://t.co/VapY4MEaLV"
AustinScottGA08,1196813263113203712,2019-11-19 15:31:32,"RT @farmcredit: ""The importance of the #FarmCredit system is largely unknown to those outside the #ag community. So, I'm thankful we have a…"
AustinScottGA08,1196457482320850945,2019-11-18 15:57:47,"Guilty until proven innocent. That, my friends, is the way they do it in China, Venezuela, Cuba, and against @realDonaldTrump in the U.S. House of Representatives under @SpeakerPelosi. https://t.co/AELKYVf6tL"
AustinScottGA08,1195394206484840449,2019-11-15 17:32:42,"This call is the basis of Speaker Pelosi &amp; Adam Schiff’s impeachment inquiry, &amp; Ambassador Yovanovitch was recalled a month &amp; a half before it even took place. The facts don’t matter to our Dem colleagues. They’ve been trying to impeach @realDonaldTrump since he was sworn in. https://t.co/1MYcHngDcs"
AustinScottGA08,1194360166671618048,2019-11-12 21:03:48,Wishing @FarmBureau a very happy 100th birthday. I thank them and President @ZippyDuvall (a fellow Georgian) for their commitment to our nation's farmers and our ag industry. I look forward to seeing the positive impact of their work for many years to come. https://t.co/9a9N1je5ly
AustinScottGA08,1193931316875669504,2019-11-11 16:39:42,"If you're a #GA08 veteran experiencing issues with the VA or any other federal agency, my office may be able to help. Please do not hesitate to give us a call:
Tifton: 229-396-5175
Warner Robins: 478-971-1776
Washington, D.C.: 202-225-6531"
AustinScottGA08,1193931314191372289,2019-11-11 16:39:42,"On this #VeteransDay, let us come together to honor our nation's veterans and their families, thank them for their service and sacrifices, and remember those who lost their lives for our great nation. #HonorThem https://t.co/wMXLmGNnhW"
AustinScottGA08,1191401370894708736,2019-11-04 17:06:36,"This morning, I sent a letter to @SpeakerPelosi calling on her to release ALL transcripts of the depositions related to the impeachment inquiry. House Members need to be given the opportunity to review unredacted copies of the depositions in accordance with House Rules. https://t.co/cfs27ittUl"
AustinScottGA08,1189972528174968833,2019-10-31 18:28:53,"RT @HouseGOP: As the #DoNothingDemocrats continue their obsession with impeachment, House Democrats have issued more subpoenas than they ha…"
AustinScottGA08,1189945834324078592,2019-10-31 16:42:49,I just voted against @SpeakerPelosi’s resolution to continue her sham impeachment inquiry against @realDonaldTrump. Their hatred for him is not grounds for impeachment.
AustinScottGA08,1189600754077753349,2019-10-30 17:51:36,"RT @SBGC2C: ""Whether they have a crime or not, I expect @SpeakerPelosi Pelosi to lead an impeachment vote against the president of the Unit…"
AustinScottGA08,1189527453481480193,2019-10-30 13:00:19,"At 9:30 AM, #HouseAg will meet to discuss reauthorization of the @CFTC. You can watch live here: https://t.co/lRBYuveKM8 https://t.co/affv35OPRA"
AustinScottGA08,1188592386773045248,2019-10-27 23:04:42,The death of Abu Bakr al-Baghdadi should serve as a reminder to those who seek to promote extremism that the US remains committed to rooting out terrorism. I thank @realDonaldTrump for his leadership &amp; our brave warfighters who continue this dangerous mission each &amp; every day.
AustinScottGA08,1187473411733213187,2019-10-24 20:58:18,"Today, 34 of my colleagues joined me in sending a letter to @USTradeRep encouraging the Administration to prioritize reducing India’s tariffs on American pecans as trade negotiations continue. You can read the full letter here: https://t.co/BkyFNcSGJ4 https://t.co/jK2QWm0B70"
AustinScottGA08,1187407304712507392,2019-10-24 16:35:37,This Saturday (10/26) is National Prescription Drug Take Back Day sponsored by the Drug Enforcement Administration. DEA’s Take Back Day provides an opportunity to safely &amp; securely dispose of unused or expired medications. You can find more info here: https://t.co/z8gQoslp8w
AustinScottGA08,1187005366640480256,2019-10-23 13:58:27,"House Democrats and the Chairman of the House Intelligence Committee seem to think that impeachment is nothing but a game of if you can’t beat him, cheat him. #StopTheSchiffShow https://t.co/MpYI9muSDj"
AustinScottGA08,1186683660843520000,2019-10-22 16:40:06,"To say @RepAdamSchiff lied to the American people is an understatement. He deserves to be censured, and yesterday I joined 184 of my colleagues to do so. Unfortunately, @HouseDemocrats protected this scam artist by voting to table the resolution. (2/2)"
AustinScottGA08,1186683660143091713,2019-10-22 16:40:06,"Adam Schiff fabricated a call transcript between @POTUS &amp; Ukrainian President Zelensky and read it aloud and on-the-record during a @HouseIntel hearing. All the while, he has used his power as Chairman of this Committee to keep the actual transcript in a vault. (1/2)"
AustinScottGA08,1184852169079607296,2019-10-17 15:22:25,"Vivien and I send our condolences and prayers to Rep. Cummings’ wife, Maya, and their family, friends, staff, and constituents during this time."
AustinScottGA08,1184852167909359617,2019-10-17 15:22:24,"Rep. Elijah Cummings was a devoted father, husband, and public servant who represented Maryland's 7th Congressional District for over 20 years. Rep. Cummings was tough but fair and a gentle giant. He will be sorely missed by his family and in the halls of Congress."
AustinScottGA08,1184493673754570757,2019-10-16 15:37:53,"My district offices are accepting appointment requests to answer questions &amp; speak with #GA08 constituents to discuss their Medicare Part D options. Medicare Part D open enrollment runs through Dec. 7, &amp; this is the only time to make changes to your plan. https://t.co/ZnUtBb9uZf"
AustinScottGA08,1182726269357744128,2019-10-11 18:34:51,"Big news for #GA08: @CocaColaUnited to invest $60M to build a new facility in Tifton. It'll serve South GA &amp; the FL panhandle, distributing 4.5M @CocaCola products a yr &amp; creating 200 jobs. I look forward to seeing the positive impacts of this investment. https://t.co/OzHH67G8Pk"
AustinScottGA08,1181955386817036288,2019-10-09 15:31:38,"Congratulations to Bill Brim and Foster Rhodes for being inducted into the Georgia Agricultural Hall of Fame this year. These men are strong advocates for Georgia’s farmers and rural communities, and this honor is well deserved. https://t.co/t27mic1DsH https://t.co/70qMWvSqFf"
AustinScottGA08,1180166564299059200,2019-10-04 17:03:30,"Adam Schiff knew about the whistleblower complaint before it was filed. In fact, his staff secretly advised the whistleblower on how to proceed. While waging false collusion accusations against @POTUS, they themselves colluded to orchestrate his takedown. https://t.co/R0ypku58M7"
AustinScottGA08,1180126073658454024,2019-10-04 14:22:36,".@GovKemp, thank you for your continued commitment to our GA bases and our men and women in uniform.They play an integral role in both our communities and our national defense. 🇺🇸 #GA08 https://t.co/2OmJ9ZH51i"
AustinScottGA08,1180117362814734336,2019-10-04 13:47:59,"I appreciate @gacities inviting me to speak at their Rural Broadband Summit this week. Broadband is much more than streaming video &amp; sending emails, it’s crucial for everything from education to health care, &amp; I’m fighting for more investment to bridge the digital divide. #GA08 https://t.co/YPbRpmJ2oT"
AustinScottGA08,1179397155204861955,2019-10-02 14:06:08,Thank you to the @GAChamber for having me speak yesterday on the importance of our GA military installations. GA’s 9 installations spur economic activity and skilled workforce development in rural communities across our great state. #GA08 https://t.co/9sKicfDgOW
AustinScottGA08,1178756021344489473,2019-09-30 19:38:30,"For 25 yrs, Mac Thornberry has faithfully served Texans. As Chairman &amp; now RM of HASC, he has fought to ensure our military remains the most elite fighting force in the world. Mac's leadership will be missed both on the Committee &amp; in Congress. We wish him &amp; his family the best. https://t.co/8qRmtfC336"
AustinScottGA08,1178011902649217024,2019-09-28 18:21:38,RT @GeorgiaWild: Thanks Gov. @BrianKempGA for your support of National Hunting and Fishing Day! Celebrate today at a FREE event near you: h…
AustinScottGA08,1177337025608990721,2019-09-26 21:39:55,"RT @SBGC2C: .@AustinScottGA08 on gun control: ""If Democrats will engage in an open debate, I think we can find some common ground. I don’t…"
AustinScottGA08,1177260980759343104,2019-09-26 16:37:44,"Last night, I voted to bring forward the whistleblower complaint. There's no new info from what we already received. Bottom line: There was no quid pro quo. Democrats are so consumed with undoing the 2016 election that they continue to grasp at straws for crimes that don't exist."
AustinScottGA08,1177246945531879425,2019-09-26 15:41:58,"Yesterday, @POTUS &amp; PM @AbeShinzo signed a trade agreement that will increase &amp; improve market access for ag products such as pork, beef &amp; wheat. I look forward to continued negotiations w/ Japan &amp; other int'l partners to further expand market access for American producers. https://t.co/Oa0oPD6IgA"
AustinScottGA08,1176626090472878082,2019-09-24 22:34:55,"Unfortunately, Speaker Pelosi has succumbed to the belligerent left &amp; their media allies to move forward w/ an impeachment inquiry against @POTUS. Dems continue to waste time &amp; taxpayer dollars on endless investigations while refusing to address the challenges our nation faces."
AustinScottGA08,1175443908131770370,2019-09-21 16:17:21,"#GA08 sure is proud of our Warner Robins native, @GeorgiaFootball QB Jake Fromm. Looking forward to a great game today. #ATD #GoDawgs https://t.co/CU55T8hzsE"
AustinScottGA08,1175151460260167680,2019-09-20 20:55:16,"Yesterday, #HouseAg held a hearing on federal farm &amp; disaster programs. During the hearing, I had the chance to raise the issue of continued delays in assistance for GA farmers impacted by Hurricane Michael &amp; my fight for additional resources. Watch here: https://t.co/6MuO8GC2Rm"
AustinScottGA08,1174684263259811845,2019-09-19 13:58:47,RT @HouseAgGOP: TUNE IN @ 10amET Today for a joint General Farm Commodities &amp; Risk Management and Livestock &amp; Foreign Agriculture subcmte h…
AustinScottGA08,1174333200426000385,2019-09-18 14:43:47,"Please join me in wishing the @usairforce a happy 72nd birthday. To our Airmen at @RobinsAFB_GA, #MoodyAFB, and all U.S. Airmen here at home and around the world, thank you for your dedication and service to our great nation. #AIRPOWER #THISIS72 #HBDUSAF #GA08 https://t.co/XP7ShXEpLS"
AustinScottGA08,1173595035465605121,2019-09-16 13:50:35,I’d like to thank everyone who attended our #GA08 Military Service Academy Day at the @MOAatRAFB. Students who were unable to attend can contact my Tifton office at 229-396-5175 or visit my website (https://t.co/mAw1ZDpDQT) for more info on the application process. https://t.co/EHqOsIvutc
AustinScottGA08,1172681582022483969,2019-09-14 01:20:51,Good seeing my friend @VP Mike Pence this morning at the @HouseGOP Member Conference. I’m thankful for his steadfast dedication to keeping our county safe and expanding opportunities for all Americans. May God continue to bless him and his family. https://t.co/RqdUdZLwI7
AustinScottGA08,1172564914436804608,2019-09-13 17:37:15,Fellow @GeorgiaFootball fans: Be sure to #WearPinkForWendy this weekend and #GoDawgs! 🏈🔴⚫️ https://t.co/supw431aJH
AustinScottGA08,1172512561478213632,2019-09-13 14:09:13,We can protect our natural resources without infringing on the rights of millions of Americans. I thank @POTUS for this rollback. #WOTUS https://t.co/2ga9JAZcjW
