BettyMcCollum04,1303446113073205254,2020-09-08 21:32:24,"The RNC used our national parks &amp; monuments as political propaganda for a sitting president to try to help himself get reelected. Our public lands, public resources, and public servants should not be used to advance the Republican party’s political agenda. https://t.co/TosDRuDtww"
BettyMcCollum04,1303406836960366595,2020-09-08 18:56:20,"Proud to receive the 2020 Friend of Farm Credit Award from @AgriBank_FCB for my work on the @AppropsDems Agriculture Subcommittee. Especially during the pandemic, ensuring financing for rural communities to build critical infrastructure is so important to meeting people’s needs. https://t.co/qw7irVAfti"
BettyMcCollum04,1303370695259369475,2020-09-08 16:32:43,Thank you to the citizen soldiers working to rescue those trapped by wildfires in California. Their heroic actions demonstrate why training and equipping our National Guard is so critically important. https://t.co/MCor5GkHqf
BettyMcCollum04,1303363001060331521,2020-09-08 16:02:09,"As more Minnesota students head back to school today, whether it’s in person or virtually, I’m wishing all students, parents, teachers, and school staff a safe, healthy, and successful school year. https://t.co/h6DCpPidnM"
BettyMcCollum04,1303051912984645634,2020-09-07 19:26:00,"If you’re looking to support Black-owned businesses, this is a fantastic opportunity: On Saturday, Sept. 12, visit the Black Business is Beautiful Outdoor Market in St. Paul ⬇
https://t.co/GrBo25Z10j"
BettyMcCollum04,1302964335937953793,2020-09-07 13:38:00,"On #LaborDay, we honor the Labor movement's hard-fought success &amp; recognize that today, workers are in crisis. To those on the front lines &amp; those struggling: I stand with you to confront economic inequities &amp; advance the promise of opportunity for all. https://t.co/LbTBD3PzBd"
BettyMcCollum04,1302765022481973248,2020-09-07 00:26:00,"By weakening #NEPA &amp; rushing the environmental review process, the Trump admin is failing to ensure our environment &amp; local communities are taken into consideration in development projects. Without these protections, our environment &amp; public health suffer. https://t.co/G7MRb9zdXn"
BettyMcCollum04,1302701856251146241,2020-09-06 20:15:00,SBA’s Virtual Loan Outreach Center has extended its hours to assist those with businesses &amp; residences impacted by the May 27-June 8 civil unrest. The service is now available 7 days a week from 7am-7pm CT at (800) 659-2955. https://t.co/ulpjmKI8aG
BettyMcCollum04,1302638187240730626,2020-09-06 16:02:00,"September is #SuicidePreventionMonth. Especially right now, with a global pandemic, millions out of work, a lack of caregiver support, &amp; uncertainty about the future of our nation – don’t be afraid to get help if you need it. Text NAMI to 741-741 or call (888) 626-4435. #NotAlone"
BettyMcCollum04,1302401376404811777,2020-09-06 00:21:00,"Pres. Trump is cutting the #2020Census count short, meaning less time to count communities that are typically harder to reach. Ask your friends &amp; neighbors if they’ve filled out their Census form at https://t.co/2AUa3BZoGw. #WeCountMN https://t.co/kFif6Hb8Zs"
BettyMcCollum04,1302323865658339328,2020-09-05 19:13:00,"One piece of good news in the fight against #ClimateChange: For the first time ever, solar and wind made up the majority of the world’s new power generation last year. 
https://t.co/4zgDZhsYVK"
BettyMcCollum04,1302250129789870080,2020-09-05 14:20:00,"What a great opportunity for middle school students in White Bear Lake to engage in service learning, make a difference locally, and raise awareness about the global water crisis. #WaterGuardians https://t.co/NP0bhkYQks"
BettyMcCollum04,1301957645532827648,2020-09-04 18:57:46,Congratulations to Fourth District-based @EcoLab on being recognized for supporting National Guard and Reserve employees! Thank you for your commitment to our men &amp; women in uniform. https://t.co/9O2CSMapJG
BettyMcCollum04,1301621311148617728,2020-09-03 20:41:18,"In 2016, the Forest Service rejected a BLM request for a sulfide-ore copper mine that would harm the BWCA &amp; Superior National Forest. Now, the agency has willingly given up its power to reject these requests – and with it, the power to protect its assets. https://t.co/LuBfv8BPDs"
BettyMcCollum04,1301621310104252422,2020-09-03 20:41:17,"“These rule alterations will undercut its commitment to ‘Caring for the Land, Serving the People’ and undermine some of the nation’s most iconic landscapes, including...Minnesota’s #BWCAW, that the agency has protected for more than a century.” https://t.co/LuBfv8BPDs"
BettyMcCollum04,1301588690205016065,2020-09-03 18:31:40,"Yet another blatant abuse of power by the Trump admin. They think they are above the law &amp; above the American people. 

The law requires advance approval by House &amp; Senate Appropriations Committees prior to the implementation of any EPA reorganizations. https://t.co/mUN2GQuZoM https://t.co/VVNwTtsKNc"
BettyMcCollum04,1301545609854410758,2020-09-03 15:40:29,"My bill, #HR5598, would permanently protect 234,328 acres within the Boundary Waters watershed from risky sulfide-ore copper mining. @NatGeo highlights the importance of preserving this pristine wilderness for generations to come. #SaveTheseWaters #BWCA https://t.co/amxjFtE240"
BettyMcCollum04,1301279842827108353,2020-09-02 22:04:25,"You are hereby circled, Bert! https://t.co/JYexQp9Mf0"
BettyMcCollum04,1301247340825767937,2020-09-02 19:55:16,"RT @VetAffairsDems: 75 years ago, #WWII officially came to a close on the deck of the USS Missouri.

Today and everyday, we are grateful fo…"
BettyMcCollum04,1301229662589325314,2020-09-02 18:45:01,"I joined my colleagues expressing concerns about this @USAID policy. As Co-Chair of the Global Health Caucus, I know continuing to advance the prospects of women &amp; girls around the world means building on the last decade of progress with an inclusive &amp; comprehensive approach. https://t.co/ybQ8fAEsrp"
BettyMcCollum04,1301224421961666561,2020-09-02 18:24:12,RT @alalejandro: A vision of a world upholding the rights of children &amp; helping every child thrive starts w/ youth optimism+advocacy. @UNIC…
BettyMcCollum04,1301209019512692740,2020-09-02 17:23:00,"Beginning tonight, eastbound &amp; westbound traffic on I-94 will be reduced to one lane in each direction from 9 p.m. to 5 a.m. as work continues on the reconstruction of the Dale Street Bridge in St. Paul. https://t.co/HrtzoEke6m"
BettyMcCollum04,1301188936715427842,2020-09-02 16:03:12,"Lacking a federal response from the White House &amp; GOP Senate, kids will fall behind, teachers will be laid off, and COVID-19 outbreaks will continue. This is unacceptable. @HouseDemocrats will continue fighting to keep students, educators, &amp; families safe. https://t.co/axJyG71HC5"
BettyMcCollum04,1301188935805173761,2020-09-02 16:03:11,"Everyone wants to get students back into classrooms, but it must be done safely. Many schools just don’t have the resources. Democrats are seeking the $300 billion urgently needed to help stabilize the public education system and help state &amp; local agencies maintain services."
BettyMcCollum04,1301188934798577664,2020-09-02 16:03:11,"On May 15, the House passed the #HeroesAct which helps protect students and staff to allow schools to reopen safely. Now, more than 100 days later, Senate Republicans must put #FamiliesFirst."
BettyMcCollum04,1300878558739521543,2020-09-01 19:29:52,It is the job of Congress to ask questions of the administration – oversight is not letting the Trump admin dictate what Congress can and cannot know about the security of our elections &amp; our democracy. https://t.co/hzq3Ca2LtC
BettyMcCollum04,1300859214663827458,2020-09-01 18:13:00,The Trump admin continues to cater to big polluters. Once again they falsely claim that dismantling environmental protections like this one will somehow “reduce pollution” – but it will only cost taxpayers more to clean up their mess. We're not buying it. https://t.co/q6Fc9IULcj
BettyMcCollum04,1300841347239174144,2020-09-01 17:02:00,Our nation is experiencing a significant shortage of poll workers due to the COVID-19 pandemic. Poll workers have a critical role in ensuring every vote is counted. Visit https://t.co/lvUgGhdogD this #NationalPollWorkerRecruitmentDay to learn more &amp; sign up. https://t.co/CnLYGpowD4
BettyMcCollum04,1300824538117296130,2020-09-01 15:55:12,"These three courageous firefighters battled the flames on behalf of our community, and faced their own battles. My heart goes out to their families, loved ones, and the entire @StPaulFireDept. 
https://t.co/FKbHs6DxqA"
BettyMcCollum04,1300555714914660352,2020-08-31 22:07:00,Libraries provide much-needed services for our community. Some St. Paul libraries are reopening for quick visits with COVID-19 safety precautions in place. https://t.co/Oo0RXlPhFz
BettyMcCollum04,1300524615241011201,2020-08-31 20:03:25,"Bringing decades of service, experience, and leadership to the @MNNationalGuard, congratulations to Brigadier General Shawn Manke on his installation as the 32nd Adjutant General of the State of Minnesota today: https://t.co/P4GQyY92Xb"
BettyMcCollum04,1300501907048464391,2020-08-31 18:33:11,"Getting a flu vaccine is an essential part of protecting your health &amp; the health of your family. Amidst the COVID-19 pandemic, it’s important to make it a priority to get your flu shot. https://t.co/FvGGZsP9kF"
BettyMcCollum04,1300164637829332992,2020-08-30 20:13:00,"Congratulations to Marcie Rendon, the first Native American woman to receive the Distinguished Artist of the year award from the McKnight Foundation! Her work amplifies Native stories &amp; draws attention to the crisis of missing &amp; murdered Indigenous women. https://t.co/PfnadJiv76"
BettyMcCollum04,1300101472085053440,2020-08-30 16:02:00,"In June, the House passed the bipartisan #JusticeInPolicing Act: bold reforms to transform the culture of policing, end racial profiling, and increase transparency &amp; accountability to save lives. The GOP Senate continues to block this legislation. https://t.co/YYPvJPJlE9"
BettyMcCollum04,1299841508812746752,2020-08-29 22:49:00,"For non-filers with dependents who missed the deadline to receive a #CARESAct $500 economic impact payment per qualifying child, you can now enter information by Sept. 30. This applies to those receiving Social Security, SSI, RRB, or VA benefits. https://t.co/5gXpC3Uzrw"
BettyMcCollum04,1299777839294631937,2020-08-29 18:36:00,"The Mississippi River has transformed from the “working river” I grew up with to a vibrant waterway where people can recreate &amp; enjoy it, thanks to decades of federal, state, &amp; local investment. I shared my experiences for this @ParkConnection series. https://t.co/CiDZdz7scp https://t.co/YAvYv2setU"
BettyMcCollum04,1299720209603887104,2020-08-29 14:47:00,"The seed art display in the Agriculture building is always one of my favorite stops at the State Fair each year – I’m looking forward to seeing the results of the virtual competition! 
https://t.co/OSknFCN8N4"
BettyMcCollum04,1299432564134830081,2020-08-28 19:44:00,"I am committed, as a citizen and as a member of Congress, to help our country confront the legacy of racism. 
https://t.co/pgetNJNuXQ"
BettyMcCollum04,1299398131197632515,2020-08-28 17:27:10,"The Trump admin illegally bowed to political interference from Members of Congress to reinstate mining leases that were previously denied, according to a new lawsuit filed by groups working to protect #BWCA from toxic polluters &amp; politicians. https://t.co/hpfpz0pzAM"
BettyMcCollum04,1299393663173304324,2020-08-28 17:09:25,RT @Wilderness: Boundary Waters is in peril from a proposed toxic copper mine that could continually pollute the wilderness for over 500 ye…
BettyMcCollum04,1299129064146386945,2020-08-27 23:38:00,"My colleagues &amp; I sent a letter to Director Redfield demanding an explanation for why CDC is changing its testing recommendations. These decisions must be based on science &amp; in the interest of beating this virus, not because Pres. Trump wants to downplay the severity of COVID-19. https://t.co/2fdCpzc1T4"
BettyMcCollum04,1299125046594736129,2020-08-27 23:22:02,A curfew is in place from 8pm-6am tonight in St. Paul. https://t.co/SbRqUbit0Y https://t.co/cUuNws7ul1
BettyMcCollum04,1299112203254104065,2020-08-27 22:31:00,"While we can’t be at the @mnstatefair on what would have been opening day this year, here’s where you can get your fix of everything-on-a-stick ⬇
https://t.co/j2DDexiIzh"
BettyMcCollum04,1299096348524982272,2020-08-27 21:28:00,"I’m thinking of all those in the path of #HurricaneLaura, dealing with evacuation and flood damage on top of a global pandemic. Grateful to the first responders for their bravery. https://t.co/80k7JLIJWZ"
BettyMcCollum04,1299093214012608514,2020-08-27 21:15:32,"A good reminder: When you see something making the rounds on social media, verify it with other sources before sharing. In the Twin Cities, we can trust our local news outlets to report the facts. 
https://t.co/Z4LtZPRcPZ"
BettyMcCollum04,1299066836651311106,2020-08-27 19:30:44,"RT @ArdenHillsCity: The City of Arden Hills has launched a Small Business Emergency Assistance Grant Program that will provide $150,000 in…"
BettyMcCollum04,1299055889253621762,2020-08-27 18:47:13,"Americans should get a full accounting of the costs &amp; gov't employee time spent working on this political stunt. 
 
President Trump is exploiting his office &amp; violating ethical standards to make the Washington Monument (NPS property) into a campaign prop. https://t.co/VlSb7hI77f"
BettyMcCollum04,1299014405175287809,2020-08-27 16:02:23,"Higher air pollution in Black &amp; other communities of color➡️higher rates of asthma &amp; other risk factors➡️higher rates of COVID-19

Existing health disparities have led to these disproportionate impacts &amp; reflect the structural racism we must address. https://t.co/I5TahOOoYq"
BettyMcCollum04,1298712844981211136,2020-08-26 20:04:05,"$14 million of federal #CARESAct funds will be used to expand COVID-19 testing capacity across MN, including the potential use of at-home tests –  increasing the ability to reach underserved communities &amp; suppress potential outbreaks before they start. https://t.co/kBLDqm6y0S"
BettyMcCollum04,1298703166108729344,2020-08-26 19:25:38,"The CDC revised its recommendations for asymptomatic people to be tested for COVID-19. This is incredibly dangerous &amp; will hurt efforts to suppress outbreaks. Once again, the Trump admin is trying to slow down testing in order to downplay the virus. https://t.co/7USIzD9Uqi"
BettyMcCollum04,1298688913968492544,2020-08-26 18:29:00,Today I held an informal virtual session for Fourth District residents interested in learning more about U.S. Service Academy nomination opportunities. Thanks to everyone who joined! More information is available here: https://t.co/GQM1rTgcN5 https://t.co/EaAa523XS1
BettyMcCollum04,1298677074664751109,2020-08-26 17:41:57,"#WomensEqualityDay is an opportunity to learn the stories of the struggle for suffrage &amp; to recognize the work isn’t yet over. Voting rights remain under attack, especially in communities of color. Let's continue this fight until the promise of equality is fully realized for all. https://t.co/oZaNC3xWnT"
BettyMcCollum04,1298677073205133318,2020-08-26 17:41:57,"There are so many suffragist stories to be told – check out these virtual galleries ⬇
▫️@NMAAHC: https://t.co/Bb5MwMprhz
▫️@MNHS: https://t.co/G68l3jw11K 
▫️@Smithsonian: https://t.co/fh5ENhXb3d 

#WomensEqualityDay"
BettyMcCollum04,1298677072232173569,2020-08-26 17:41:56,"Over the last century, these inspiring Minnesota women and so many others have continued the fight not just for voting access, but also for representation in government, in leadership roles, and in the many other ways women are still fighting for equality. https://t.co/SuAeWmYgO2"
BettyMcCollum04,1298677071053496320,2020-08-26 17:41:56,"Today is #WomensEqualityDay – marking 100 years since the certification of the 19th Amendment. Last week, I joined @RepAngieCraig to honor the South St. Paul women who were the first to vote after the 19th Amendment was certified ⬇
https://t.co/WmFSQ5iXSG"
BettyMcCollum04,1298659700200939525,2020-08-26 16:32:55,"Our state has funds available from the federal #CARESAct to help eligible Minnesotans with past due rent/mortgage expenses. Learn more ⬇
https://t.co/PtaHG1p8Pg https://t.co/dT4rZpkS3o"
BettyMcCollum04,1298656291968233472,2020-08-26 16:19:22,"RT @MetCouncilNews: Habitat restoration at Vadnais-Snail Lakes Regional Park, converting an area covered by invasive species to native wild…"
BettyMcCollum04,1298642902571253761,2020-08-26 15:26:10,"After hearing reports about NPS staffing shortages during the #COVID19 pandemic, I wrote to Acting Sec. Evenson sharing my concerns &amp; asking for details. With so many seeking a change of scenery outdoors, it's paramount that people can stay safe &amp; our parks can stay protected. https://t.co/1viiM7hODr"
BettyMcCollum04,1298392152788148225,2020-08-25 22:49:46,"30 million Americans don’t have enough to eat, and that alone should inspire action. But without another coronavirus deal, our long-term economic recovery is also in peril – and the Republican Senate can’t even pretend to be bothered. 
https://t.co/rgVIKXGcVr"
BettyMcCollum04,1298314506704224258,2020-08-25 17:41:14,"I knew Billie Young as a strong advocate and partner on advancing women’s health &amp; equal pay, among many other causes. Her commitment to our community was inspiring, and she will be missed. Sending condolences to her loved ones today.
https://t.co/nPK8QfPA0B"
BettyMcCollum04,1298286989758869505,2020-08-25 15:51:54,"Thanks to U.S. investment &amp; global partnership to #EndPolio, the African region has officially been certified as wild poliovirus-free! Let’s protect this progress with continued investment, because every child everywhere deserves a @ShotAtLife! https://t.co/bQjY4zgL0r"
BettyMcCollum04,1298023701401698306,2020-08-24 22:25:41,"Halting the Pebble Mine is good news, but these decisions should be based on science and a comprehensive environmental review process – not on the whims of the Trump family. 

This goes for the Twin Metals mine adjacent to the #BWCA, too. 
https://t.co/joTNdhLzQY"
BettyMcCollum04,1297972694940622855,2020-08-24 19:03:00,"It has now been more than 100 days since the House approved the #HeroesAct to help families &amp; communities get through this crisis. The Republican Senate still refuses to act. 
https://t.co/NqmXW5d2Q6"
BettyMcCollum04,1297950045581369344,2020-08-24 17:33:00,"“It makes me hopeful that now we do have a time to shine and that there will be equality and equity.”-Hilary Lor of St. Paul 

I loved these reflections from young Minnesotans on the 19th amendment &amp; the power of women’s votes in 2020 and beyond. 
https://t.co/RV0neuayvy"
BettyMcCollum04,1297932567526735872,2020-08-24 16:23:33,"So far, 100,000+ voters in Ramsey County have requested absentee ballots for the Nov. 3 general election. If you’re wondering what happens next: Ballots will begin to be mailed to voters on Sept. 18. 
https://t.co/PQg6gqxKJI"
BettyMcCollum04,1297680771038064641,2020-08-23 23:43:00,"This is alarming news. Here’s where to find a COVID-19 testing location in MN: 
https://t.co/ytlE6o9P5k

https://t.co/GitPOVsLcs"
BettyMcCollum04,1297610307066572805,2020-08-23 19:03:00,"Remember, Minnesotans: If you’re indoors in a public place, make sure you’re wearing a mask. #MaskUpMN https://t.co/PLGJlBOYDi"
BettyMcCollum04,1297585392636637185,2020-08-23 17:24:00,"Resources are available to help Minnesotans put food on the table. Check out this list and tell a friend. No one should go hungry, and especially not during a pandemic. 
https://t.co/cWk3aDyJGu"
BettyMcCollum04,1297558213571694592,2020-08-23 15:36:00,"Starting tomorrow, Minnesotans can apply for housing assistance available through the $100 million in #CARESAct federal funding our state has received to help those behind on mortgage or rent payments due to COVID-19.  
https://t.co/Yew6SbxIHD"
BettyMcCollum04,1297323416467288065,2020-08-23 00:03:00,"Evacuations, damage, and lives at risk – all while the threat of #COVID19 persists. I hope all those evacuating stay safe, and am grateful to the firefighters &amp; first responders. These severe fires underscore the need for urgent action on climate change. https://t.co/hmYVAY2Xiq"
BettyMcCollum04,1297303455560806401,2020-08-22 22:43:41,"We can’t let President Trump dismantle the USPS in the run up to an election where mail-in ballots will be vital to ensuring Americans can safely exercise their right to vote. 

We are protecting the @USPS and the integrity of our elections. #DontMessWithUSPS"
BettyMcCollum04,1297303454877200390,2020-08-22 22:43:41,"Today, we voted to defend a fundamental pillar of American democracy: the Postal Service. Proud to stand with my colleagues in taking action to protect this essential service. #DontMessWithUSPS"
BettyMcCollum04,1297303452997976065,2020-08-22 22:43:40,"Americans count on the Postal Service to deliver so much more than letters. Social Security benefits, prescriptions, paychecks, tax returns, and ballots all make their way to Americans via @USPS. 

RT if you agree: #DontMessWithUSPS! https://t.co/8bSeaS1kqa"
BettyMcCollum04,1297240369340456960,2020-08-22 18:33:00,"As Chair of the Interior Appropriations Subcommittee, it’s my job to fund &amp; protect millions of acres of public lands throughout the U.S., including in NE Minnesota. Protecting the #BWCA requires stopping the Trump admin’s rush to approve a toxic sulfide-ore copper mine. https://t.co/aZoFKmURkd"
BettyMcCollum04,1297197164590968832,2020-08-22 15:41:19,"Making Election Day a digital learning day is a good move to keep students, teachers, and voters safe, as some schools will serve as polling locations. 
https://t.co/zPUcytfgpe"
BettyMcCollum04,1297174434755813376,2020-08-22 14:11:00,"Today I’m voting for the Delivering for America Act requiring Postmaster DeJoy to overturn the changes he made causing delivery delays. This bill ensures Americans can send &amp; receive prescriptions, necessities, and mail-in ballots in a timely manner. #DontMessWithUSPS https://t.co/FtqAwmwrqH"
BettyMcCollum04,1296886120131833857,2020-08-21 19:05:20,"The @WashingtonCoMN Small Business Relief Fund, provided by the federal #CARESAct, will provide grants of up to $15,000 to small businesses in need of support due to COVID-19. Apply by Monday (Aug. 24). https://t.co/lXO8jVu7eQ"
BettyMcCollum04,1296855761927143424,2020-08-21 17:04:42,"I heard from the Ramsey County Food &amp; Basic Needs Subcommittee this morning that families’ need for food assistance is growing. Thanks to this group for delivering food, supplies, and services to our vulnerable neighbors. 

More federal help is needed. Senate: #PassTheHeroesAct."
BettyMcCollum04,1296840012978421762,2020-08-21 16:02:07,"DeJoy admitted he has no plans to restore USPS blue boxes and sorting machines that have been removed across the country. This sabotage of the Postal Service threatens lives, livelihoods, and the life of our American democracy. https://t.co/lDRYvp9nrY"
BettyMcCollum04,1296537739576320000,2020-08-20 20:01:00,"The U.S. has long held in consensus the bipartisan position that illegal annexation is wrong – that is, until just recently, when Pres. Trump’s “peace plan” instead blatantly endorsed it.
 
#HR8050 should not be controversial. It should be the norm. 
https://t.co/FEDBz6weVx"
BettyMcCollum04,1296517298853949443,2020-08-20 18:39:46,The inclusion of Indigenous &amp; immigrant experiences in art displayed at the Ramsey County courthouse is an important step in celebrating our dynamic richness and diversity. https://t.co/MgY66GBIXL
BettyMcCollum04,1296163396115738626,2020-08-19 19:13:29,"Good news for people who need to file a 2019 amended federal tax return – you can now do so electronically, using regular tax-filing software. 

E-filing is faster and reduces errors. Learn more ⬇ https://t.co/sJoxySrolL"
BettyMcCollum04,1296147935714054149,2020-08-19 18:12:03,Postmaster DeJoy’s pause only halts some of the harmful changes he's made &amp; doesn't reverse the damage already done. The Delivering for America Act will put an end to the Trump admin's @USPS sabotage and ensure Americans aren't disenfranchised by this president in November. https://t.co/47aVONMuvM
BettyMcCollum04,1295863043616907265,2020-08-18 23:20:00,"The Senate released a nearly 1,000-page report documenting Russia’s efforts to sabotage the 2016 election to help elect Trump. 

A Russian intelligence agent worked with Trump campaign officials. 

Thanks to Putin, Trump is president. 
https://t.co/PKpv0sFkIo"
BettyMcCollum04,1295842736483041280,2020-08-18 21:59:18,"As we celebrate this moment in history, let’s also remember that this fight isn’t over. The right to vote was not afforded to all women on that day, and others are kept from using it now. We must restore the #VotingRightsAct &amp; ensure full &amp; equal access to the ballot box for all."
BettyMcCollum04,1295842735459577857,2020-08-18 21:59:18,"Just one day after the 19th Amendment was ratified, South St. Paul women lined up to cast their ballots on a bond measure to improve the municipal water system. (It passed, with women voting 3 to 1 in favor!) Our votes &amp; our voices matter. https://t.co/rhcMBy1rS1"
