BettyMcCollum04,1284616870545559557,2020-07-18 22:31:43,Rest in Peace. #GoodTrouble https://t.co/D5rpU00t6Y
BettyMcCollum04,1284332310108745734,2020-07-18 03:40:59,"It was an honor and privilege to serve with @RepJohnLewis, who will be remembered as one of our nation’s greatest civil rights leaders. He will be missed by all those who were touched by his kindness, and my thoughts are with his family during this time of great grief."
BettyMcCollum04,1284200823652851712,2020-07-17 18:58:30,"RT @MayorDanRoe: Such racist acts and threats of violence are unacceptable in our community - or for that matter anywhere, and I ask all to…"
BettyMcCollum04,1284174062705672192,2020-07-17 17:12:10,The flags and symbols we choose to display are a reflection of who we are and what we value – and that should never be hate and divisiveness. Treating all people with dignity &amp; respect is always the right decision. https://t.co/NEeMR8s4QN
BettyMcCollum04,1284147258838134784,2020-07-17 15:25:39,"“Science should not stand in the way of this.”
 
Rather, science MUST be the guiding principle for how and when to safely reopen schools. 
 
Children and educators are not political pawns. We have to get this right.
https://t.co/Tr91MGfQ1Y"
BettyMcCollum04,1284125451783294978,2020-07-17 13:59:00,"To celebrate #NationalForestWeek, I want to share this piece by a visitor to the #BWCA in the Superior National Forest – a reminder that the beauty &amp; peace our public lands offer are for everyone, and we must continue to protect them.
https://t.co/fxoq34UkRl"
BettyMcCollum04,1283824720559964160,2020-07-16 18:04:00,It’s been three weeks since @HouseDemocrats passed the #GeorgeFloyd #JusticeInPolicing Act. It’s time for the Senate to do their job and hold a vote. You can weigh in and urge action in the Senate at https://t.co/1KTrXbLhvt. https://t.co/ZvTlqOa3I3
BettyMcCollum04,1283806297343823872,2020-07-16 16:50:47,"Looking forward to this event tonight at 6pm CT with renowned author Colson Whitehead, who will speak to @LibnOfCongress Carla Hayden on Race in America. As we grapple with racial injustice, poetry &amp; literature have much to offer us as a nation. https://t.co/C9bssiHzPb"
BettyMcCollum04,1283742506744774656,2020-07-16 12:37:19,"While Minnesota has the leading self-response rate in the nation at 70%, that still means nearly 30% of households in our state haven't been counted. Visit https://t.co/2AUa3BZoGw or call 844-330-2020 to submit your #2020Census response today.
#WeCountMN https://t.co/2FEIN3vUS6"
BettyMcCollum04,1283474160203816960,2020-07-15 18:51:00,"Just before the House passed the #HeroesAct two months ago, Fed Chairman Jerome Powell said more action was needed. Why does the Republican Senate still refuse to take action to protect lives &amp; livelihoods? https://t.co/ZOJXutTQAG"
BettyMcCollum04,1283460258107584512,2020-07-15 17:55:45,Read my full statement here: https://t.co/V914ltS2ve
BettyMcCollum04,1283460257252081664,2020-07-15 17:55:45,These measures open the door in the next fiscal year to fund critical investments to help rebuild neighborhoods like ours that are confronting racial &amp; economic inequality. Thank you Chair @RepDavidEPrice &amp; Chair @RepMikeQuigley for working with us to address this critical need.
BettyMcCollum04,1283460256517980160,2020-07-15 17:55:45,I worked with my Appropriations Committee colleagues &amp; @ilhan on provisions that add new avenues to direct federal funding to help communities like ours recover &amp; rebuild in the long term. #CSBG #CDFI
BettyMcCollum04,1283460255842807809,2020-07-15 17:55:45,"This week, Pres. Trump denied federal emergency aid to the Twin Cities to help our communities rebuild after the civil unrest caused by the killing of Mr. George Floyd. This callous political decision by Pres. Trump hurts our neighborhoods."
BettyMcCollum04,1283441177316990983,2020-07-15 16:39:56,Weakening #NEPA puts our environment at risk &amp; silences community input – just so the Trump admin can cater to big polluters. NEPA requires a scientific &amp; transparent review for risky projects like the Twin Metals mine in Minnesota. #PeopleNotPolluters https://t.co/aNfQK9RfHu
BettyMcCollum04,1283429943318388741,2020-07-15 15:55:18,"This bill also includes my report language directing the IRS to develop a plan that will allow taxpayers to receive their tax notices in Spanish and other languages, including Somali and Hmong."
BettyMcCollum04,1283429674874544128,2020-07-15 15:54:14,"The bill contains $273.5 million for CDFIs, which help expand capital to underserved &amp; underbanked small businesses.

I'm proud that it also includes my amendment allowing #CDFI funding to help communities – like the Twin Cities – rebuild &amp; recover after civil unrest."
BettyMcCollum04,1283429196115714048,2020-07-15 15:52:19,"The FY21 @AppropsDems Financial Services &amp; General Government bill increases funding by $808M – for a total of $24.64B – to protect consumers, help small businesses, &amp; ensure the integrity of our federal elections. I’m proud to support this bill. https://t.co/rCDhqEx1oC"
BettyMcCollum04,1283414522791854080,2020-07-15 14:54:01,"RT @AppropsDems: WATCH: @AppropsDems Chairwoman @NitaLowey's farewell remarks on the final day of markups.

""It has been the honor of my li…"
BettyMcCollum04,1283403655463546880,2020-07-15 14:10:50,And the bill contains $385 million for @FEMA’s FIRE Grant Program &amp; $385 million for the SAFER Grant Program – funding requested by the @MNProFFs to ensure adequate staffing &amp; capacity to respond to fire emergencies.
BettyMcCollum04,1283400903144419328,2020-07-15 13:59:54,$190.5 million for @FEMA’s National Flood Insurance Program will help boost communities’ resilience to more severe and frequent flooding caused by climate change. The bill also includes a provision to help tribal communities strengthen resilience &amp; natural disaster response.
BettyMcCollum04,1283399629959241733,2020-07-15 13:54:50,"This bill includes my language encouraging @FEMA to coordinate with the @EPA on a Mississippi River Restoration &amp; Resilience Strategy to improve water quality, restore habitat, help communities build resilience to natural disasters, and more."
BettyMcCollum04,1283393915236818944,2020-07-15 13:32:08,"Instead, the bill makes smart, effective investments in defending our infrastructure from physical &amp; cyber threats. It also contains measures I requested to strengthen airport &amp; aviation safety for travelers &amp; workers."
BettyMcCollum04,1283393914431512576,2020-07-15 13:32:08,The Trump admin’s anti-immigrant agenda is cruel &amp; counterproductive. @AppropsDems' FY21 Homeland Security bill rejects more funding for Border Patrol &amp; ensures no funds can be diverted to Pres. Trump’s border wall. https://t.co/rCDhqEx1oC
BettyMcCollum04,1283156292740227072,2020-07-14 21:47:54,"This bill provides federal dollars where MN needs it most – including $10.4 million for surface transportation improvements, $64 million in Community Development Block Grants (#CDBG), $217.3 million to the HOME Investment Partnership Program, &amp; $338.6 million for public housing."
BettyMcCollum04,1283156291393904640,2020-07-14 21:47:54,"The FY 2021 @AppropsDems Transportation-HUD bill provides $158.3 billion to improve infrastructure &amp; transportation safety, protect vulnerable communities, &amp; expand access to safe housing. Watch the bill markup here: https://t.co/jj133f8wb2 https://t.co/T9bmYe5EKj"
BettyMcCollum04,1283134977337692166,2020-07-14 20:23:12,And this bill includes an $8 million increase for the Office on Violence Against Women’s STOP Grants to enhance local community capacity to develop effective strategies to combat violent crimes against women &amp; strengthen services for victims of domestic violence.
BettyMcCollum04,1283134976477794305,2020-07-14 20:23:12,The bill also includes my provision for @CommerceGov to develop strategies to strengthen regional &amp; local remanufacturing markets. Addressing the quality &amp; logistical challenges to make good products using existing materials is better for our environment &amp; just makes sense.
BettyMcCollum04,1283134975613771777,2020-07-14 20:23:12,"The bill also makes smart investments for our tribal partners, with funding for tribal youth justice programs, the NSF Foundation tribal colleges and universities program, and Native American business development programs."
BettyMcCollum04,1283128211027755011,2020-07-14 19:56:19,"Good. 

Thank you to the many students, advocates, and concerned Minnesotans who reached out to me and my staff about ICE’s shameful attempt to carry out Pres. Trump's anti-immigrant agenda. https://t.co/7MsiLFpFgl"
BettyMcCollum04,1283125013663682560,2020-07-14 19:43:37,"This bill includes my provision encouraging @NOAA to coordinate with @EPA on a Mississippi River Restoration &amp; Resilience Strategy to improve water quality, restore habitat, &amp; build local resilience to natural disasters. The Mississippi is vital for MN's economy &amp; water supply."
BettyMcCollum04,1283125012803850240,2020-07-14 19:43:37,"I’m proud to support the FY 2021 @AppropsDems Commerce-Justice-Science bill – it provides more than $71 billion for law enforcement reform, reducing gun violence, addressing climate change, and more. https://t.co/jj133f8wb2"
BettyMcCollum04,1283109507334201344,2020-07-14 18:42:00,"From a lack of PPE and inadequate facilities, to financial hardship for students and staff, there are many reasons to be concerned that the university health services on college campuses are not prepared to safely care for students during a pandemic. https://t.co/bAmbKDw0yL"
BettyMcCollum04,1283088737874915328,2020-07-14 17:19:28,"“When you begin to discredit scientists like Fauci, who are national treasures, you are in serious trouble.” Well said, Dr. Orlowski. @realDonaldTrump: We don't need finger pointing—we need leadership. Stop blaming others &amp; focus on protecting our country. https://t.co/JwekLHZYXe"
BettyMcCollum04,1283064564549070849,2020-07-14 15:43:25,Fact Check: The President of the United States lies to the American people an average of 23 times every single day. This is a shameful disgrace that is causing our country great harm. https://t.co/nic1a1sind
BettyMcCollum04,1283026666307104769,2020-07-14 13:12:49,"RT @wccoradio: ""It us a racial slur it is a hurtful name and it's time for it to go.""
@BettyMcCollum04 discussing the name change for Washi…"
BettyMcCollum04,1283004884149776384,2020-07-14 11:46:16,"RT @wccoradio: Today on @TMNwithDaveLee 

6:20 @morningtake 
6:50 Vinny Cerrato #RedskinsNameChange 
7:20 @drdavidhilden 
7:40 Mike Max
7:5…"
BettyMcCollum04,1282779943563333634,2020-07-13 20:52:26,State &amp; local governments face huge revenue shortages &amp; need additional federal assistance to help keep essential workers on the job – that’s why the House passed the #HeroesAct nearly 3 months ago. The Senate needs to take up this bill now to avoid inflicting even more hardship.
BettyMcCollum04,1282779942510628867,2020-07-13 20:52:25,"Glad to see federal #CARESAct dollars reach Stillwater to help with #COVID19 response – funds that can be spent on medical expenses like PPE, cleaning of city facilities, technology costs, public safety measures, paid leave for employees, and more. https://t.co/HSI6jV4h2W"
BettyMcCollum04,1282758730212401154,2020-07-13 19:28:08,"RT @HamlineMidway: Hello Midway Neighbors, we are in need of food, baby care, personal care, and household donations for our on-going Thurs…"
BettyMcCollum04,1282753935699324929,2020-07-13 19:09:05,"And the bill provides $750 million for Community Action Agencies that serve rural, urban, and suburban communities across America, providing vital &amp; accessible services to meet the immediate needs of American families, especially during #COVID19. #CSBG"
BettyMcCollum04,1282753934944358401,2020-07-13 19:09:05,This bill also expands apprenticeship opportunities at a time where millions of Americans are seeking employment. These provisions will help provide training for high-wage jobs and prepare our next generation of American workers.
BettyMcCollum04,1282751284014190593,2020-07-13 18:58:33,I worked on changes to how we regulate &amp; fund the Strategic National Stockpile – particularly how we maintain PPE supplies – and I’m pleased to see them included in this bill. This will ensure we are better equipped to combat #COVID19 as well as future public health emergencies.
BettyMcCollum04,1282751283254956044,2020-07-13 18:58:32,"The bill also makes smart investments for our tribal partners, from continuing the partnership between Head Start and tribal colleges, to investing in CDC’s Good Health and Wellness in Indian Country."
BettyMcCollum04,1282747930877853699,2020-07-13 18:45:13,"This bill contains my language encouraging @NIMHD to collaborate w/FDA to identify research gaps &amp; report to Congress on the health effects, particularly for women of color, of skin-lightening cosmetic products containing dangerous levels of mercury. https://t.co/oWMCWGqwxs"
BettyMcCollum04,1282747930022158337,2020-07-13 18:45:13,"The fiscal year 2021 Labor-HHS-Education @AppropsDems bill increases overall funding by $2.4 billion, investing in health care, public education, &amp; workforce training – investments that will help improve people’s lives. https://t.co/1r8kRpIlZu"
BettyMcCollum04,1282724913623846913,2020-07-13 17:13:45,"This bill also rejects the Trump admin’s short-sighted plan to restart nuclear weapons explosive testing – prohibiting funds from being spent on this dangerous plan &amp; instead making smart, responsible investments in our national security."
BettyMcCollum04,1282724912784912385,2020-07-13 17:13:45,"The FY21 Energy &amp; Water Development @AppropsDems bill invests $49.6 billion in programs that will spur renewable energy innovation, combat climate change, modernize our aging water infrastructure, &amp; more. Watch the committee markup: https://t.co/1r8kRpIlZu"
BettyMcCollum04,1282719834690785285,2020-07-13 16:53:35,"Tribal leaders have long called for the Washington NFL team to end its use of a racist mascot. 

We're now in a moment where society &amp; the marketplace will no longer tolerate blatant racism. Though this decision is long overdue, it is nonetheless welcome. 
https://t.co/ZMU0zXjW8p"
BettyMcCollum04,1282472812037279744,2020-07-13 00:32:00,"With so many Minnesotans out of work, this is an excellent resource offered through @mndeed: Free online courses are available on subjects aimed at training people for in-demand jobs and careers. The deadline to register is September 30. https://t.co/SCH47INe7n"
BettyMcCollum04,1282405870891159552,2020-07-12 20:06:00,"Let’s stay vigilant, Minnesotans.

Remember to:
-Stay 6 feet apart
-Wash your hands often
-Wear a mask
-If you have symptoms, find a testing location at https://t.co/y7iHQlPBIG https://t.co/qRuC0XqrGF"
BettyMcCollum04,1282352771187040260,2020-07-12 16:35:00,It’s exciting to see a new restaurant opening that is dedicated to the Rondo Neighborhood in what was formerly the first Black American Legion in St. Paul. https://t.co/M5XmhJYWDt
BettyMcCollum04,1282103629634297856,2020-07-12 00:05:00,"I’m working to protect international students from the bigoted, anti-immigrant cruelty of the Trump administration. I’ve signed on to a letter led by @RepPressley asking ICE &amp; DHS to reconsider its policy requiring these students to attend in-person classes or leave the country. https://t.co/dh9ha477yH"
BettyMcCollum04,1282030165795774465,2020-07-11 19:13:05,The Boundary Waters Canoe Area Wilderness is a national treasure. It is up to us to do everything we can to protect it for future generations. #SaveThisWilderness #BWCA
BettyMcCollum04,1282030058044116992,2020-07-11 19:12:39,"Finally, the FY21 State &amp; Foreign Operations bill includes my language ensuring the U.S. is able to uphold our end of the 1909 Boundary Waters Treaty with Canada by providing $1M for the International Joint Commission to monitor &amp; evaluate pollution in our shared boundary waters."
BettyMcCollum04,1282028274370187264,2020-07-11 19:05:34,I also secured language in the FY 21 Agriculture-Rural Development-FDA bill requiring the USDA/USFS to release the results of a taxpayer-funded study meant to determine the environmental impacts of sulfide-ore copper mining on the Rainy River Watershed. #ShareTheReport https://t.co/5xpb9zHTGj
BettyMcCollum04,1282027550416474114,2020-07-11 19:02:41,"The FY 21 Interior-Environment bill passed the Appropriations Committee &amp; now moves to the full House for approval. This bill prohibits funds from being used to review/approve the Twin Metals mine plan in the Rainy River Watershed. #BWCA

My statement: https://t.co/2WqEUqMmtP"
BettyMcCollum04,1281967482736128000,2020-07-11 15:04:00,"With so much demand for more diverse stories, perspectives, and opportunities to learn, it’s fantastic to see a young Saint Paul leader stepping in and working to fill this gap. The Fourth District will benefit from having a Black-owned bookstore! https://t.co/I4wlt2KpTW"
BettyMcCollum04,1281701421776240641,2020-07-10 21:26:46,RT @savethebwca: Thank you @BettyMcCollum04 for standing with 70% of Minnesotans who want to see the Boundary Waters protected. You are a r…
BettyMcCollum04,1281615961083334657,2020-07-10 15:47:11,"RT @alaskawild: .@BettyMcCollum04: ""For 3 years they [the GOP] have told us they will raise $1 billion [via Arctic Refuge oil leases]. This…"
BettyMcCollum04,1281604783187595270,2020-07-10 15:02:46,"RT @AppropsDems: NEW: The House Appropriations Committee has approved its FY2021 Interior-Environment funding bill, sending the legislation…"
BettyMcCollum04,1281603364854407168,2020-07-10 14:57:07,"I shaped this bill with input from advocates, agencies, state &amp; local stakeholders, tribes, fellow Members of Congress, &amp; many others. Thank you all for your shared commitment to our environment &amp; our communities."
BettyMcCollum04,1281599594321850374,2020-07-10 14:42:08,"RT @savethebwca: The $36.76 billion FY21 Interior-Environment bill, led by @BettyMcCollum04, will secure increased investments in wildlife…"
BettyMcCollum04,1281596342029160448,2020-07-10 14:29:13,RT @MonarchsJV: Happy to have worked with MN’s own Chair @BettyMcCollum04 as she wrote the FY 21 Interior-Environment bill to invest in cle…
BettyMcCollum04,1281591159085838341,2020-07-10 14:08:37,"As we collectively confront our nation’s legacy of racial injustice, this bill is taking action to remove Confederate symbols from our national parks. The oppression of Black Americans should not be condoned on our public lands, &amp; all should feel welcome in our collective spaces. https://t.co/PEg8O23cLn"
BettyMcCollum04,1281589379409104903,2020-07-10 14:01:33,"This bill also rejects the Trump admin’s proposed elimination of the @ForestService International Program, increasing funding for it &amp; for @USFWSIntl. This will help combat poaching &amp; wildlife trafficking &amp; help reduce global transmission of zoonotic diseases like #COVID19."
BettyMcCollum04,1281588511280422912,2020-07-10 13:58:06,"While there is much more work to do, this bill is another step towards upholding the federal government’s trust &amp; treaty responsibilities to Native American communities, with increased funding for BIA, BIE, &amp; IHS. https://t.co/9tRhzzj2Bo"
BettyMcCollum04,1281588256803610624,2020-07-10 13:57:05,This bill also rejects the Trump admin’s proposal to eliminate funding for @NEAarts &amp; @NEHgov and instead invests $170 million for each. The arts and humanities enrich lives and are critical drivers of MN’s culture and economy. https://t.co/eIh2qy1317
BettyMcCollum04,1281586467911991296,2020-07-10 13:49:59,RT @AppropsDems: WATCH: Chair @BettyMcCollum04’s impassioned opening statement at the full committee markup of the FY21 Interior-Environmen…
BettyMcCollum04,1281585142067343360,2020-07-10 13:44:43,"Our bill provides an increase of $45 million to EPA’s Geographic Programs, which help with restoration of the Great Lakes &amp; other nationally significant bodies of water. #GLRI is vital for MN’s economy, outdoor recreation, food supply, &amp; more. https://t.co/fG1g07hpRn"
BettyMcCollum04,1281580678195417089,2020-07-10 13:26:58,"This bill also prioritizes the health &amp; safety of our communities by increasing funding for clean air &amp; water programs. Especially during this global respiratory pandemic, everyone deserves clean air to breathe &amp; safe water to drink. https://t.co/0AHF5GGLHT"
BettyMcCollum04,1281580021610688512,2020-07-10 13:24:22,RT @AppropsDems: READ: @AppropsDems Subcommittee Chair @BettyMcCollum04’s opening statement at the full committee markup of the FY21 Interi…
BettyMcCollum04,1281578042918305792,2020-07-10 13:16:30,"RT @AppropsDems: Tune in to @AppropsDems FY2021 full committee markup. 

Today, the Committee is considering our FY2021 Interior-Environmen…"
BettyMcCollum04,1281577857052020738,2020-07-10 13:15:46,RT @cspan: House Appropriations Committee hearing on 2021 Interior and Environmental spending – LIVE on C-SPAN2 https://t.co/043xpCz9c9 htt…
BettyMcCollum04,1281577770166956033,2020-07-10 13:15:25,RT @wildlifeaction: Thank you @BettyMcCollum04 for leading the $36.76 billion FY21 Interior-Environment bill to secure increased investment…
BettyMcCollum04,1281576753694224385,2020-07-10 13:11:23,"In this bill, I’ve included a measure that prohibits any funds from being used to review or approve a mine plan in the Rainy River Watershed. Some places are simply too precious to mine – we shouldn’t put the Boundary Waters at risk. #SaveThisWilderness #BWCA https://t.co/EPZ9h0yVa4"
BettyMcCollum04,1281575379648630785,2020-07-10 13:05:55,RT @Americans4Arts: Happening now in DC: The FY 21 Interior-Environment bill led by @BettyMcCollum04 rejects the Trump admin’s proposal to…
BettyMcCollum04,1281572689539477504,2020-07-10 12:55:14,"Watch live as the Appropriations Committee marks up our FY21 $36.76B Interior-Environment funding bill, which increases funding for clean air &amp; clean water, addresses climate change, protects wildlife &amp; public lands, funds the arts &amp; humanities, &amp; more: https://t.co/MtKwnUigXj https://t.co/lpureqT3vn"
BettyMcCollum04,1281568220571488256,2020-07-10 12:37:28,RT @EnvAm: Our state group @EnvironmentMN applauds @BettyMcCollum04 for protecting our oceans and beaches from offshore drilling in the Hou…
BettyMcCollum04,1281568148957913094,2020-07-10 12:37:11,"RT @oceana: #GreatNews: Thank you @NitaLowey, @BettyMcCollum04, @chelliepingree and @RepDerekKilmer for your support of offshore oil drilli…"
BettyMcCollum04,1281327202844450817,2020-07-09 20:39:45,"Unbelievable hypocrisy from Adm. Wheeler suggesting we lack commitment to the environment after he defended the #TrumpBudget cutting EPA by 26%. If this admin was at all serious about environmental protection, Mr. Wheeler would be celebrating the $318M increase we're providing. https://t.co/TtfS8Rp1ki"
BettyMcCollum04,1281313925837942784,2020-07-09 19:47:00,".@HouseDemocrats passed the #HeroesAct to extend expanded unemployment benefits until January 2021. But the @SenateGOP has failed to act, &amp; now millions of Americans risk losing benefits on July 31. Pres. Trump &amp; the Senate must take action immediately. https://t.co/slMaiwp5tV"
BettyMcCollum04,1281308574342414337,2020-07-09 19:25:44,The FY21 Military Construction/Veterans Affairs @AppropsDems bill provides critical resources to care for our veterans &amp; invest in mental health. It also makes clear that @POTUS can’t take funds from our service members to pay for his wasteful border wall. https://t.co/jHQnjYeX6w
BettyMcCollum04,1281298652846268416,2020-07-09 18:46:18,"The bill includes robust funding for food &amp; nutrition programs like SNAP &amp; summer EBT. It also blocks two unconscionable Trump admin SNAP rules designed to restrict who qualifies for these programs. 

We should be making it easier, not harder, to obtain food during a pandemic."
BettyMcCollum04,1281298129032224769,2020-07-09 18:44:13,This bill also includes my report language strengthening cosmetic safety measures – providing $1 million for community-based organizations to help educate the public on dangers of skin-lightening products with high levels of mercury that can lead to serious health consequences.
BettyMcCollum04,1281297936253685766,2020-07-09 18:43:28,"As a member of this subcommittee, I worked to include language in this bill requiring the USDA/USFS to make public the results of a taxpayer-funded study to determine the environmental impacts of sulfide-ore copper mining on the watershed adjacent to the #BWCA. #SaveTheseWaters"
BettyMcCollum04,1281290988246441984,2020-07-09 18:15:51,"Our @AppropsDems FY 21 Agriculture-Rural Development-FDA bill provides $23.9 billion for food assistance, rural broadband, farmers, agricultural research, food and drug safety, and more. Watch the Appropriations Committee markup live ⬇ https://t.co/jHQnjYeX6w"
BettyMcCollum04,1281288257150517249,2020-07-09 18:05:00,"You marched to protest the crisis of systemic racism &amp; police brutality. Now send a message to @realdonaldtrump &amp; Senate Republicans that it’s time to pass the #GeorgeFloyd #JusticeinPolicing Act. Join @rihanna, @lizzo, &amp; others as a citizen cosponsor at https://t.co/uXlYzJO1o1."
BettyMcCollum04,1281278945283977222,2020-07-09 17:28:00,"Teachers, staff, and families want their students back in the classroom this fall, but they need a plan and assistance from the federal government to do it safely, not an order from the president to try to boost his reelection chances. https://t.co/f5B1HqAxkH"
