BettyMcCollum04,1276562342101336066,2020-06-26 17:05:54,"I’m voting in the House to override the president’s veto of H.J.Res. 76, a bipartisan resolution to protect students and taxpayers. Sec. DeVos &amp; Pres. Trump are more interested in protecting predatory for-profit colleges than the people defrauded by them. Students deserve better."
BettyMcCollum04,1276558879091044354,2020-06-26 16:52:08,"RT @LtGovFlanagan: #COVID19 has a disproportionate impact on Native communities. This Saturday, we are partnering with the Native American…"
BettyMcCollum04,1276550357569716224,2020-06-26 16:18:17,Today we celebrate five years of marriage equality – but this fight is far from over. The Senate should pass the #EqualityAct now. #LoveIsLove https://t.co/DmMuGFVaCU
BettyMcCollum04,1276248045500293120,2020-06-25 20:17:00,"The #JusticeInPolicing Act will limit military equipment on our streets, ban chokeholds and no-knock warrants, hold police accountable to the communities they serve, and support community-based programs to develop just &amp; equitable public safety systems. https://t.co/D4wnRTRz6m"
BettyMcCollum04,1276247793812660224,2020-06-25 20:16:00,Today I will vote for the George Floyd #JusticeInPolicing Act. Too many lives have been lost and communities devastated by police brutality. We need a comprehensive approach to save lives and build trust between law enforcement &amp; our communities. https://t.co/m6jAOHPKzI
BettyMcCollum04,1276227224795058176,2020-06-25 18:54:16,"A reminder that with everything going on right now, #COVID19 is still here. We are still battling this pandemic.

Please wear a mask, wash your hands, and practice social distancing. 
https://t.co/J4XRqcmcBr"
BettyMcCollum04,1276215329916686337,2020-06-25 18:07:00,I'm offering an amendment to the #MovingForward Act to apply Buy America requirements to the Community Development Block Grant program. CDBG represents billions in taxpayer funded community investments &amp; my amendment is a commonsense way to support American manufacturing.
BettyMcCollum04,1276199512281944067,2020-06-25 17:04:09,The House will vote today on the George Floyd #JusticeInPolicing Act. Join @HouseDemocrats in sending a message to Pres. Trump &amp; Senate Republicans that we need comprehensive police reform NOW. Sign up today to become a citizen co-sponsor at https://t.co/uXlYzJO1o1. https://t.co/D9vy75UBRd
BettyMcCollum04,1276188263859073026,2020-06-25 16:19:27,"Tonight, @LibraryCongress is hosting American Book Award winner Kimiko Hahn and award-winning poet Rajiv Mohabir for a discussion on how poetry serves as a connector and a model for our moment. Tune in at 7pm EDT/6pm CDT here: https://t.co/9yMMKbeuGH"
BettyMcCollum04,1275878244835831809,2020-06-24 19:47:32,"But in states without an ACA exchange, people who have lost employer-based health coverage are left without options because the Trump admin refuses to open federal enrollment. This will have devastating consequences as we continue to grapple with #COVID19. https://t.co/Lji1kv3iRu"
BettyMcCollum04,1275878244030590976,2020-06-24 19:47:32,"Nearly 100,000 Minnesotans signed up for health insurance during MN's special enrollment period. As millions of Americans lose employer-based coverage – in the midst of a public health crisis – allowing people to get covered is more important than ever. https://t.co/3T9V1Jzxdv"
BettyMcCollum04,1275859736924164097,2020-06-24 18:34:00,"It's #PollinatorWeek2020! ~1/3 of the world’s food crops rely on bees for pollination, making them absolutely essential for our food supply &amp; our future. But MN's state bee &amp; other species are at risk. Bee Kind and learn how you can help protect them: https://t.co/ELHf5t5B50"
BettyMcCollum04,1275849418839855109,2020-06-24 17:53:00,Encouraging that @doioig is looking into the June 1 incident where chemical irritants were used to clear peaceful protesters. Investigators should take into account the experience of the protesters &amp; reporters who were on the scene. https://t.co/w5lBIlZAkP
BettyMcCollum04,1275837764659863556,2020-06-24 17:06:41,"Food assistance resources: 
• @USDA summer food program: https://t.co/8GBUivBd8z
• @RamseyCounty food map: https://t.co/GqFtBbCIdK
• @2harvest: https://t.co/vf1l15cxef
• @HungerSolutions: https://t.co/CHp8TegRN6 
• @KeystoneMN mobile food delivery: https://t.co/yRsPx0x0wd"
BettyMcCollum04,1275837763653230592,2020-06-24 17:06:41,"Despite these challenging times, our community is coming together in big ways to support one another and address the needs of our neighbors through an outpouring of selfless generosity, and we know we have a lot more work to do – together."
BettyMcCollum04,1275837762449465344,2020-06-24 17:06:41,"A striking headline for the times.
 
The House passed the #HeroesAct more than a month ago, which includes vital funding to help families put food on the table. It’s time for the Senate &amp; White House to take action to save American lives and livelihoods.
https://t.co/xPX8zZQeVn"
BettyMcCollum04,1275837761501622272,2020-06-24 17:06:40,"Thank you to nonprofit and elected leaders for joining my discussion about food access in St. Paul’s Midway and throughout our community. We must be fully coordinated to overcome the historic challenges facing our community, especially the crisis of food insecurity."
BettyMcCollum04,1275819032483110912,2020-06-24 15:52:15,"Fireworks at Mount Rushmore also raise concerns about the potential for wildfires in the area. Has necessary prep work been done to mitigate this risk? If any conditions exist that could threaten public safety, whether from COVID-19 or wildfire, these events should be cancelled."
BettyMcCollum04,1275819030826438658,2020-06-24 15:52:15,"The COVID-19 pandemic continues to be a global health crisis, yet the Trump administration is moving forward with large-scale mass gatherings on the 4th of July. @SecBernhardt: What’s the plan to keep the public &amp; @NatlParkService employees safe? https://t.co/fHO0S7fd3y https://t.co/VkAdLifLTu"
BettyMcCollum04,1275493700513206276,2020-06-23 18:19:30,Scam alert: Some people applying for or receiving unemployment benefits are getting emails asking them to log in to a secondary website (such as Microsoft SharePoint). But no state requires you to use a secondary system – only use the official portal at https://t.co/wjGSZ2jvgk ⬇ https://t.co/TpdzfJV6Ew
BettyMcCollum04,1275441435760668673,2020-06-23 14:51:49,"My sincerest condolences to the family and friends of Cody Pollard, a St. Paul constituent, who was killed in the Uptown Minneapolis mass shooting Saturday night. The impact gun violence continues to have on our communities is a stain on our nation. https://t.co/VC8tpVm7mP"
BettyMcCollum04,1275133496420372481,2020-06-22 18:28:11,"In addition to the #HeroesAct, an important step will be the #MovingForward Act introduced by @HouseDemocrats this week. It is a plan to fix America's bridges, roads, &amp; schools, and an opportunity to create jobs for millions of unemployed Americans &amp; help rebuild our communities. https://t.co/23m4IGj3jb"
BettyMcCollum04,1275133495334100992,2020-06-22 18:28:10,"Great to join @SPACC &amp; @MidwayChamber for an update on the federal government’s ongoing response to #COVID19, economic fallout, &amp; civil unrest in our communities over the last month. I’m working hard in Congress to ensure MN-04 has the resources needed to chart a path forward. https://t.co/KRSgNFcSpD"
BettyMcCollum04,1275075297126178822,2020-06-22 14:36:55,"Dr. Albasha Hume of @OpenCitiesHC made a lasting impact on patients’ lives, and his passing from COVID-19 is a tremendous loss for our community. Sending my condolences to his loved ones &amp; the entire team at Open Cities Health Center. https://t.co/6ZijCJHPKi"
BettyMcCollum04,1274863170369327105,2020-06-22 00:34:00,"Don’t forget – #TaxDay is July 15! Qualifying taxpayers can prep &amp; file their taxes at no-cost, from the comfort &amp; safety of their own home, through the IRS #FreeFile program. Learn more at https://t.co/MzWj8wVFBL. https://t.co/hIocGloO9A"
BettyMcCollum04,1274795222707458049,2020-06-21 20:04:00,"Scammers may use the pandemic as an opportunity for identity theft &amp; Medicare fraud – offering coronavirus tests, masks, or other items in exchange for personal information. Be vigilant &amp; don’t give out your Medicare Number. Watch this video to learn more: https://t.co/ASPI0k1hfe"
BettyMcCollum04,1274739354322206720,2020-06-21 16:22:00,Great opportunity to read a variety of experiences &amp; perspectives by Minnesota writers of color for a statewide book club: https://t.co/fBoLB88G98
BettyMcCollum04,1274711284408352771,2020-06-21 14:30:27,"Wishing a Happy Father’s Day to all the dads, grandfathers, stepdads, and father figures in the Fourth District and across the country! https://t.co/6GfS35OyK6"
BettyMcCollum04,1274480397955424258,2020-06-20 23:13:00,"The Great Minnesota Get Together may be canceled this year, but you can still find some of your fair food favorites while supporting local businesses! https://t.co/SymQ1ALLZO"
BettyMcCollum04,1274423523226923009,2020-06-20 19:27:00,"A striking new CDC data visualization shows American Indians &amp; Alaska Natives are being hospitalized for #COVID19 at 5 times the rate of white people, and are experiencing the highest hospitalization rate by race in the nation. https://t.co/qPU0Ava48d"
BettyMcCollum04,1274356834258714624,2020-06-20 15:02:00,"Pregnant women exposed to high temps &amp; air pollution are more likely to have premature, underweight, or stillborn babies. Black mothers are harmed at much higher rates than the rest of the U.S. population. Climate justice &amp; racial justice are intertwined. https://t.co/0kr5NqjK4d"
BettyMcCollum04,1274085533413711875,2020-06-19 21:03:57,RT @servingrtroops: The calm before dinner and the deployment ceremony. Make sure you log in to https://t.co/ggeCOgh1wR at 4 to watch the c…
BettyMcCollum04,1274052092152422412,2020-06-19 18:51:04,Thank you to the dedicated staff at @SPPS_News who have distributed nearly 4 million meals since schools closed in March. Today I visited the team at Johnson High School. I’m so grateful for all those who are working hard to keep kids and families fed &amp; healthy. https://t.co/78jmO0Z8De
BettyMcCollum04,1274036152488669184,2020-06-19 17:47:43,Secretary Bernhardt should spend less time promoting thinly veiled campaign ads and instead focus on getting to the bottom of why force was used on peaceful protesters. I’m still waiting for answers. Who gave the order? https://t.co/UDMD2wyJdG
BettyMcCollum04,1274015624612765702,2020-06-19 16:26:09,"Fantastic set of resources courtesy of @stpaullibrary for kids, youth, and adults to learn more &amp; read stories celebrating #Juneteenth! 
https://t.co/RpnfXYcMCo"
BettyMcCollum04,1274008690111188992,2020-06-19 15:58:36,"Great to see Marvin Anderson and @3M volunteers this morning at the @RondoPlaza – taking a moment to reflect, learn, and commemorate the historic Rondo neighborhood on #Juneteenth. https://t.co/ln3zO2rVre"
BettyMcCollum04,1273973920169943040,2020-06-19 13:40:26,"Celebrate by attending St. Paul’s virtual #Juneteenth celebration, attending a rally, or taking time to learn more about the history of this holiday:  
https://t.co/JBiqVTslQG"
BettyMcCollum04,1273973918567718912,2020-06-19 13:40:26,"On this day in 1865, two years after the Emancipation Proclamation, the last forcibly enslaved Americans were freed. On #Juneteenth, we commemorate this moment in history &amp; remember the long fight for freedom &amp; justice – which endures today. https://t.co/huZVFNw9Nd"
BettyMcCollum04,1273730113906135040,2020-06-18 21:31:38,"East Side Food Drive!
 
Donate food: Friday, June 19, 10am to 2pm at 1380 Rose Ave E., St. Paul
 
Pick up food: Sunday June 21, 12:30 to 3 PM at 1380 Rose Ave E., St. Paul 
 
More details here: https://t.co/s0GAgpYrJv"
BettyMcCollum04,1273686858489364480,2020-06-18 18:39:45,"Funding for health care, education, housing, and more is distributed based on the Census – and Indian Country has been historically undercounted. Completing the #2020Census form means critical resources can reach your community. #NativeAmericanActionDay https://t.co/BF53NkQenV"
BettyMcCollum04,1273675275025473536,2020-06-18 17:53:43,"Today is a good day to reflect on the importance of protecting those fleeing violence &amp; persecution in pursuit of a better life. As we near #WorldRefugeeDay, I'm proud that MN has a long history of welcoming immigrants &amp; refugees, who make our communities stronger. #WRD2020"
BettyMcCollum04,1273624615504445444,2020-06-18 14:32:25,"Despite Pres. Trump’s attempt to end legal protections for Dreamers, SCOTUS rules that #DACA will remain in place! These young people contribute so much to our nation. Their #HomeIsHere and they are #HereToStay. 
https://t.co/Vge9iZVhbh"
BettyMcCollum04,1273382222867902467,2020-06-17 22:29:14,RT @WhipClyburn: It’s been 5 years since the shooting at Emanuel AME Church and well over a year since the House passed my bill to help clo…
BettyMcCollum04,1273360115111022601,2020-06-17 21:01:23,Fill out your Census. Be counted. Pass it on. #2020census https://t.co/DRUtDLwFhi https://t.co/cQVUUhofnQ
BettyMcCollum04,1273340145907970048,2020-06-17 19:42:02,"Thank you to all the volunteers and contributors for helping make this happen – @MancinisCharHou, @colossalcafe, Jerry’s Produce, @cossettas, and others!"
BettyMcCollum04,1273340144163139589,2020-06-17 19:42:02,"I was able to stop by @MancinisCharHou today where @servingrtroops volunteers were distributing grill packs to family members of deploying National Guard members, making it possible to have a statewide “virtual cookout” for soldiers &amp; their families! https://t.co/6XdSJcKJV3"
BettyMcCollum04,1273327978236305416,2020-06-17 18:53:41,Thanks for having me! The House has passed the #HeroesAct to support the critical services provided by the @USPS. The Senate must act now. https://t.co/TVEbMUOtzA
BettyMcCollum04,1273297352716095489,2020-06-17 16:52:00,"The #JusticeInPolicingAct ends the transfer of weapons of war to local police departments. We must demilitarize the police. Today's @HouseJudiciary markup is addressing the reforms needed to hold police accountable, fight systemic racism, &amp; save lives. https://t.co/XvaUHit9Y8"
BettyMcCollum04,1273288920395124737,2020-06-17 16:18:29,"This is terrible news. @RepAndyBarr and his family are in my thoughts and prayers today after the sudden passing of his wife, Carol Leavell Barr. https://t.co/dyRZGf5Klu"
BettyMcCollum04,1273272341557137410,2020-06-17 15:12:37,Fantastic story about @artstartscraps creating &amp; distributing 75 art kits &amp; an online program to keep teaching kids about the art &amp; science of birds of the Mississippi River Flyway (via the MN Valley National Wildlife Refuge) even as the pandemic hit. https://t.co/aCDLiLiTJI
BettyMcCollum04,1273010462389567488,2020-06-16 21:52:00,"Congratulations Lue Yang of Johnson Senior High School on accepting your appointment to the U.S. Naval Academy! Good luck Lue, and #GoNavy! https://t.co/nAWhApZG0U"
BettyMcCollum04,1273002912508194817,2020-06-16 21:22:00,Congratulations PFC Tristan Weaver (Tartan High School) on completing a year of academy prep school and accepting your appointment to the U.S. Military Academy! Wishing you all the best! #USMA https://t.co/ByYxp38wL6
BettyMcCollum04,1272995225468895233,2020-06-16 20:51:27,"It was good to visit the Midway again today. Thank you to @MidwayChamber and local businesses for the tour. It will be a long recovery, and I’m grateful for the many community partners on the ground who are stepping up to help. https://t.co/fpK2TOOlDp"
BettyMcCollum04,1272992342694342657,2020-06-16 20:40:00,Congratulations PO3 Xoua Thao (Washington Technology Magnet School) on completing a year of academy prep school and accepting your appointment to the U.S. Naval Academy! #GoNavy! https://t.co/R5PfW7Mn0g
BettyMcCollum04,1272984793094000641,2020-06-16 20:10:00,Congratulations Rachael McCleery of Mahtomedi High School on accepting your appointment to the U.S. Military Academy! Wishing you the best! #USMA https://t.co/MlNZgQfGRW
BettyMcCollum04,1272978249962803201,2020-06-16 19:44:00,"Congratulations Caroline Harding of Highland Park High School on accepting your appointment to the U.S. Naval Academy! Best wishes, Caroline! #USNA https://t.co/5JWoxHYBYN"
BettyMcCollum04,1272970700286910469,2020-06-16 19:14:00,Congratulations Emma Finch of Mounds Park Academy on accepting your appointment to the U.S. Air Force Academy! Wishing you all the best! #USAFA https://t.co/B4YmiKINTA
BettyMcCollum04,1272965163755270144,2020-06-16 18:52:00,Congratulations Brennan Featherstone of East Ridge High School on accepting your appointment to the U.S. Air Force Academy! Aim high! #USAFA https://t.co/xvFfvvcH8U
BettyMcCollum04,1272955097509699587,2020-06-16 18:12:00,"Congratulations William Domler of White Bear Lake Area High School on accepting your appointment to the U.S. Military Academy! Best wishes, William! #USMA https://t.co/vc2eyJrtHr"
BettyMcCollum04,1272947799194079232,2020-06-16 17:43:00,Congratulations Monte Collins of White Bear Lake Area High School on accepting your appointment to the U.S. Military Academy! Go Army! #USMA https://t.co/yhz3HxDj8B
BettyMcCollum04,1272937733229473792,2020-06-16 17:03:00,Congratulations Gabriella Baldwin of Hill-Murray School on accepting your appointment to the U.S. Naval Academy! Wishing you all the best! #USNA https://t.co/p3aUZAWufU
BettyMcCollum04,1272931189817511938,2020-06-16 16:37:00,Congratulations Daniella Baldwin of Hill-Murray School on accepting your appointment to the U.S. Naval Academy! Go Navy! #USNA https://t.co/ZWQIQs9kF7
BettyMcCollum04,1272928328819847169,2020-06-16 16:25:38,"Congratulations Grant Auleciems of Stillwater Area High School on accepting your appointment to the U.S. Military Academy! Best wishes, Grant! #USMA https://t.co/AaCeKKrA4j"
BettyMcCollum04,1272732008662343682,2020-06-16 03:25:31,So sorry to hear this news. Sending my deepest condolences to @ilhan and her family tonight. https://t.co/CMTGl5V3JQ
BettyMcCollum04,1272575588428058631,2020-06-15 17:03:58,"By responding to the #2020Census (at https://t.co/DRUtDLwFhi, by phone, or by mail!) you can help our community access resources for hospitals, schools, and infrastructure. 

Get language assistance here: https://t.co/7EjdK0hzzv #AAPI2020 https://t.co/OsElrXvmbX"
BettyMcCollum04,1272538434058543104,2020-06-15 14:36:19,No longer will LGBTQ+ individuals be at risk of getting fired simply for being who they are. #SCOTUS has ruled that federal law protects workers from discrimination based on sexual orientation or gender identity. #HappyPride #PrideMonth https://t.co/O6nwbsAyGI
BettyMcCollum04,1272318905428705285,2020-06-15 00:04:00,"Native Americans are disproportionately impacted by #COVID19 – not just in per capita cases, but economically as well. Yet resilience &amp; ingenuity run deep in Indian Country. It’s inspiring to see these Native artists push on despite adversity. https://t.co/jn6gNYJPY2"
BettyMcCollum04,1272309425727066112,2020-06-14 23:26:20,"Demanding justice and an end to state-sponsored violence must be a local, national and global priority. I appreciate this letter writer’s views on #HR2407, highlighting the importance of advancing justice, equality, and freedom for all. https://t.co/mP8gVqFEWl"
BettyMcCollum04,1272284265871523841,2020-06-14 21:46:21,"Thank you to Bubba Wallace for speaking up and taking a stand, and to NASCAR for listening to him and taking action. More sports organizations would do well to follow their lead. https://t.co/aCRmfvZThb"
BettyMcCollum04,1272284264927768577,2020-06-14 21:46:21,The team must stop using a racial slur and a racist mascot. #ChangeTheName #ChangeTheMascot https://t.co/FtKmnafZaV
BettyMcCollum04,1272284263854071809,2020-06-14 21:46:21,"The NFL issued a statement committing $250 million and additional action to combat systemic racism. This is great – but if they don’t also #ChangeTheName of the Washington football team, it is hypocritical. https://t.co/HoxR9wiLH5"
BettyMcCollum04,1272205155967082496,2020-06-14 16:32:00,"If your child receives free or reduced-price meals at school, you can apply to get up to $325 per child to spend on groceries this summer. Find more info &amp; apply here by June 30: https://t.co/MgBcYiwlES"
BettyMcCollum04,1271945947761659904,2020-06-13 23:22:00,"The #HeroesAct, passed by the House weeks ago, has $3.6 billion to help states prepare for the 2020 election in the face of #COVID19, &amp; $25 billion for the USPS – vitally important for mail-in voting. The Senate must act so all Americans can safely exercise their right to vote. https://t.co/B7qz9d11Nr"
BettyMcCollum04,1271836728186343425,2020-06-13 16:08:00,"Deliberately compromising health care protections for transgender folks, during a global pandemic, in the middle of Pride Month. The Trump administration’s cruelty knows no bounds. https://t.co/TkAUdzMBVA"
BettyMcCollum04,1271810304066846722,2020-06-13 14:23:00,"As families continue to juggle child care, education, and work responsibilities in the face of continued closures and cancellations, @PBSKIDS has excellent programming, resources &amp; virtual events to make fun educational activities available to all! https://t.co/acnlamuD4H https://t.co/Dt7xPfFYee"
BettyMcCollum04,1271550413985243137,2020-06-12 21:10:17,"As we face multiple crises – racial inequality, a pandemic, &amp; climate change – it’s clear Americans want climate action that is linked with social &amp; economic reforms. 
 
We can address all of these together using a comprehensive approach. In fact, we must. https://t.co/em4fK8KCJC"
BettyMcCollum04,1271536753271242753,2020-06-12 20:16:00,"Allison Benning of Stillwater Area High School is the 2019-2020 Gatorade Minnesota Softball Player of the Year – an award signifying athletic excellence, academic achievement, and exemplary character. Congratulations, Allison! https://t.co/Q9H0Cqnn3l"
BettyMcCollum04,1271520523906924546,2020-06-12 19:11:31,"I sent @SecBernhardt &amp; USPP two letters &amp; then directly asked Mr. Bernhardt who gave the order to use chemical irritants on peaceful protesters ½ hour before curfew on June 1. 
 
Someone gave the order – but I am still waiting for an answer to this simple question."
BettyMcCollum04,1271475858360930309,2020-06-12 16:14:02,Many questions remain about EPA’s decision to stop enforcing environmental safeguards during #COVID19. Undermining public health protections is likely to disproportionately impact communities of color – who are already being hit harder by the coronavirus. https://t.co/kKnmY5kFAF
BettyMcCollum04,1271459572813893633,2020-06-12 15:09:19,"Four years ago today, a gunman killed 49 people at #Pulse Night Club – a place that should have felt like a safe haven for LGBTQ+ people. We won’t forget, and we won’t stop fighting for equality, justice, and the right to be safe from gun violence. https://t.co/zO2czOPBKm"
BettyMcCollum04,1271181403602980866,2020-06-11 20:43:58,"And funds will also go to MPR’s production and distribution of The Slowdown, a weekday poetry audio show hosted by former U.S. Poet Laureate Tracy K. Smith.
 
These are just a few of the projects in MN-04 receiving grants – find the full list here:
https://t.co/urNxlhmKzI"
BettyMcCollum04,1271181402457939968,2020-06-11 20:43:58,"Schubert Club Mix, a music presenting &amp; community engagement project, and MPR’s Choral Stream, a 24-hour online channel that will emphasize HBCU choirs from around America, will entertain &amp; enrich our lives through the healing and restorative power of music."
BettyMcCollum04,1271181401287798786,2020-06-11 20:43:58,The Minnesota Jewish Theatre Company and In Progress (which provides media arts opportunities for Native youth) are receiving funds to expand learning &amp; understanding about diverse cultural traditions to younger audiences.
BettyMcCollum04,1271181397256962053,2020-06-11 20:43:57,"Good news from @NEAarts: $982,000 in grants have been awarded to cultural organizations in Minnesota's Fourth District! Especially during tough times, the arts can challenge us to learn, provide opportunities to let our imaginations run wild, and deliver comfort and solace."
BettyMcCollum04,1271143710252838913,2020-06-11 18:14:11,"All Midway-area residents are welcome to pick up food &amp; supplies from Hancock Recreation Center today from 3-6pm. This opportunity will continue every Thursday throughout the summer to help make sure our neighbors have what they need. More details here ⬇ 
https://t.co/jEKQ792gOe"
BettyMcCollum04,1271127599264210944,2020-06-11 17:10:10,"There is still time to change this narrative when it comes to COVID-19. Federal funds have been allocated to the IHS, &amp; we need those funds to be spent on testing, treatment, PPE, &amp; more to ensure tribal communities can recover &amp; we can continue to invest in meeting their needs."
BettyMcCollum04,1271127598551240706,2020-06-11 17:10:10,Our subcommittee has made sustained increases in tribal funding as we work to meet the federal government’s trust &amp; treaty obligations. The COVID-19 pandemic shines a bright light on the federal government’s historic neglect &amp; inability to meet tribes’ health care needs.
BettyMcCollum04,1271127597703979009,2020-06-11 17:10:10,"As of June 9, IHS reports an 8.5% positive testing rate – but we don’t yet know the full picture of the extent of the virus in Indian Country. Federal efforts must be improved to help our Native American brothers &amp; sisters fight this pandemic."
