MarkAmodeiNV2,958756864640143360,2018-01-31 17:40:24,I was not on board the Amtrak train that collided with a vehicle in Virginia this morning. I returned home to Nevada last night and will be working in CD-2 for the remainder of the week. Please take a moment to keep all those involved in this accident in your thoughts.
MarkAmodeiNV2,953383944170475520,2018-01-16 21:50:19,I’ll be speaking on the House Floor around 5:15 PM ET (2:15 PM PT) on my #PershingCounty public lands bill (H.R. 1107) which the House is voting on tonight. Tune in here to catch my full remarks:  https://t.co/ygGIwLf9ah
MarkAmodeiNV2,943939791577632778,2017-12-21 20:22:38,Sharing some highlights from my office's hard work on behalf of Nevadans in 2017. It’s a pleasure to serve the people of #NV02 &amp; I look forward to continuing to serve you in 2018. Have a happy &amp; healthy holiday season. https://t.co/6NZ2hjxms3
MarkAmodeiNV2,943913023344955392,2017-12-21 18:36:16,Happy first day of winter! If you or someone you know is planning a visit to Washington this winter - let us show you around! Schedule a personalized @uscapitol tour or request a tour of the White House through my website: https://t.co/2Tygp1KnWb. We’re happy to assist! https://t.co/v1zP0M8URX
MarkAmodeiNV2,943614932230332416,2017-12-20 22:51:46,"Big win for American taxpayers today. A few hours ago, the #TCJA was signed by the President. This landmark legislation will bring tax relief to Americans in every income bracket, meaning the average family of 4 in NV will save more than $1,300 next year: https://t.co/L4ZNXwIZUm"
MarkAmodeiNV2,943251170180681730,2017-12-19 22:46:18,Be sure to tune into @NewsTalk780KOH around 6:05 PM ET (3:05 PM PT). I’ll be on @theDanMasonShow discussing the #TaxCutsandJobsAct
MarkAmodeiNV2,931265432711057408,2017-11-16 20:59:15,Learn more about my vote on the #TaxCutsAndJobsAct and how it will affect #Nevadans should it be signed into law: https://t.co/OhfkiUzYQK
MarkAmodeiNV2,930563705330372608,2017-11-14 22:30:51,Just released another update on the #TaxCutsandJobsAct focusing on the medical expense deduction. Learn more here: https://t.co/WPdWGyvGrK
MarkAmodeiNV2,927629474165862401,2017-11-06 20:11:15,ICYMI: Here is a great example of the kind of assistance my #Reno office provides to #NV02 each day. Learn more here https://t.co/I2Grt9ri6y
MarkAmodeiNV2,925821140328701955,2017-11-01 20:25:35,Now seeking college students &amp; recent graduates for Spring 2018 internships in my Washington office. More info here: https://t.co/86DF1XbfyJ https://t.co/GUnmjGNoDP
MarkAmodeiNV2,921085419755798528,2017-10-19 18:47:31,Reminding interested students that the deadline to submit Service Academy applications is OCT 31. More info here: https://t.co/y64Z44wzEi https://t.co/B7ZrKwroLL
MarkAmodeiNV2,917892801328754688,2017-10-10 23:21:12,Joining @WayneRoot on @790TalkNOW at 7:30 PM ET (4:30 PM PT) to discuss my visit to NV following last week’s tragedy https://t.co/NO90yZYH57
MarkAmodeiNV2,915963304459333634,2017-10-05 15:34:04,Joined @FoxNews’s @BillHemmer today to discuss my trip to #LasVegas with @POTUS yesterday. Full interview here: https://t.co/9JYr112PCh
MarkAmodeiNV2,915697983567618050,2017-10-04 21:59:46,Full statement on the passing of Don Carano: https://t.co/jCXEdIA7Cw. My deepest condolences are with his family during this difficult time.
MarkAmodeiNV2,915695139716202496,2017-10-04 21:48:28,ICYMI – here are my full remarks from Tuesday on the tragedy in #LasVegas: https://t.co/EOQOvMwX77 #NevadaStrong
MarkAmodeiNV2,915690475394396160,2017-10-04 21:29:56,"Joined @POTUS in #LasVegas today to visit victims, first responders, &amp; #LVPD. Encouraged by the outpouring of support by the community. https://t.co/6sWbmf85yG"
MarkAmodeiNV2,914859062625542144,2017-10-02 14:26:12,Unfathomable evil. My heart goes out to the victims &amp; families of this terrible tragedy in #LasVegas: https://t.co/oz4dWQetxi
MarkAmodeiNV2,913162640205238272,2017-09-27 22:05:13,"Joining @WayneRoot live at 6:30 PM ET (3:30 PM PT) on @790TalkNOW to discuss #healthcare, #DACA, and #taxreform: https://t.co/NO90yZYH57"
MarkAmodeiNV2,907969664306872320,2017-09-13 14:10:11,"58 years ago on this week in #NevadaHistory, #Bonanza premiered on @NBC. Lasting 14 seasons, it’s the network’s longest-running #western. https://t.co/bAZFkuyAIr"
MarkAmodeiNV2,903362869613486081,2017-08-31 21:04:26,Sharing highlights from the August district work period today. Thx to those who took time to meet with my staff &amp; I https://t.co/hiK280D5w2 https://t.co/A0zDArO6Fj
MarkAmodeiNV2,903359754894024704,2017-08-31 20:52:03,"For those unable to attend Tuesday’s #veterans town hall meeting, and in need of assistance, contact my #Reno office. We’re happy to help. https://t.co/qT3RRRlZRk"
MarkAmodeiNV2,902574025427345408,2017-08-29 16:49:51,In #Minden for our vet town hall @ 10 AM PT at the Old Court House. Here until noon - encouraging all vets in the area to come join me.
MarkAmodeiNV2,900359981144219648,2017-08-23 14:12:02,Tune in live around 7:35 AM PT (10:35 AM ET) I'll be joining @MSNBC's @HallieJackson from #CD2 to discuss the issues important to Nevadans.
MarkAmodeiNV2,888065035926482948,2017-07-20 15:56:18,Currently seeking highly motivated college students to intern in my Washington office for Fall 2017. More info here: https://t.co/G67SBZkPsM https://t.co/VJJF1PknhV
MarkAmodeiNV2,887317941347385344,2017-07-18 14:27:37,Heading over to @HouseAppropsGOP full Committee markup of the FY18 #Homeland &amp; #Interior Bills. Tune in at 11 AM ET: https://t.co/OEqvWeD5s6
MarkAmodeiNV2,885504919859539968,2017-07-13 14:23:19,Currently at the @HouseAppropsGOP markup of the #CJS &amp; Financial Services funding bills. You can tune in here: https://t.co/2z0AOfHedO
MarkAmodeiNV2,880194317914165248,2017-06-28 22:40:53,More proof that the #healthcare status quo isn’t working – @AnthemInc just announced its leaving 6 counties in #CD2: https://t.co/kjUbC3vhoi
MarkAmodeiNV2,879815018195406849,2017-06-27 21:33:41,"As the #healthcare debate continues, be sure to check out my discussion with @AliVelshi today on @MSNBC: https://t.co/4JUbWkoy6C https://t.co/oZgKgwxNIf"
MarkAmodeiNV2,879771739978203136,2017-06-27 18:41:42,I’ll be live with @MSNBC's @AliVelshi at 3:10 PM ET (12:10 PM PT) to discuss #Healthcare. Be sure to tune in.
MarkAmodeiNV2,877956368430497792,2017-06-22 18:28:04,Joining @LizClaman &amp; @RepDerekKilmer on @FOXBusiness at 3:05 PM ET (12:05 PM PT) to discuss the #BipartisanWorkingGroup &amp; #Healthcare
MarkAmodeiNV2,874986442837065731,2017-06-14 13:46:39,Keeping my colleagues &amp; those injured in Alexandria this morning in my thoughts. As always - thankful for a swift response by Capitol Police
MarkAmodeiNV2,869980344694448128,2017-05-31 18:14:12,Honored to have spent #MemorialDayWeekend remembering those who made the ultimate sacrifice to keep us safe &amp; free https://t.co/lO7rOmhw91 https://t.co/iWeAP2bMco
MarkAmodeiNV2,864592750523691008,2017-05-16 21:25:49,"Thank you to all of our current, former, and fallen officers – our communities are extremely grateful for your service. #NationalPoliceWeek"
MarkAmodeiNV2,862036976203071489,2017-05-09 20:10:05,"On this day in #Nevada history, #Reno was officially founded in 1868: https://t.co/Lmjx7Ei9Kc https://t.co/kVQ65mMCYF"
MarkAmodeiNV2,860265176880340992,2017-05-04 22:49:35,"For my analysis on two important provisions of the #AHCA &amp; #HR2192, view my latest healthcare update: https://t.co/Zn0qTpp1Dd"
MarkAmodeiNV2,860212962656649216,2017-05-04 19:22:06,"For the record, I'm currently at work in my office inside the Cannon House Office Building - I'm not in the rose garden at the @WhiteHouse"
MarkAmodeiNV2,860170023561818114,2017-05-04 16:31:29,"For those w/ any interest in the factual foundation of my decision, please take a gander @ my statement on the #AHCA https://t.co/8ckhvim2qX"
MarkAmodeiNV2,859157442315386882,2017-05-01 21:27:51,Happy national #SmallBusinessWeek! Join me in recognizing our nation’s best job creators who are responsible for creating 63% of new jobs. https://t.co/VTpVnjW9AW
MarkAmodeiNV2,858065606314258432,2017-04-28 21:09:17,I’m still a no on the #AHCA in its current form. Learn why in my latest health care update: https://t.co/Zn0qTpp1Dd
MarkAmodeiNV2,857693145915588611,2017-04-27 20:29:15,Joining @MSNBC’s @SteveKornacki LIVE around 4:45 PM ET (1:45 PM PT) to discuss the #AHCA. Be sure to tune in.
MarkAmodeiNV2,857669397825060864,2017-04-27 18:54:53,"Spoke on the House Floor in Honor of Sparks native, CAPT. Joshua Todd Byers. Keeping his family in my thoughts: https://t.co/WUVTjr45rS https://t.co/0HVBKk3He6"
MarkAmodeiNV2,857237062109585408,2017-04-26 14:16:56,"Reminding all #NV02 high school students that the deadline for the Congressional Art Comp is next Wed, May 3: https://t.co/43L9EhErW2 https://t.co/0QwCcD6Rzh"
MarkAmodeiNV2,854805353858555910,2017-04-19 21:14:12,Western Nevada College named National Semifinalist in the 2017 @ACT College &amp; Career Readiness Campaign. Congrats! https://t.co/Rl02udDW4Y
MarkAmodeiNV2,854366674908262404,2017-04-18 16:11:03,Joining @KevinWallRadio today at 12:30 PM ET (9:30 AM PT) to discuss yesterday’s Reno town hall. Be sure to tune in: https://t.co/vdisNPdbOB
MarkAmodeiNV2,854067985501257731,2017-04-17 20:24:10,Highlights from week one of the April District Work Period: https://t.co/RAhQuFOZqI #NV02
MarkAmodeiNV2,852171413322686466,2017-04-12 14:47:52,"Encouraging interested students to attend Service Academy Info Day on Sat, Apr 22 at @UNevadaReno. More details: https://t.co/xbumilRXJh"
MarkAmodeiNV2,851794270445068288,2017-04-11 13:49:14,"Hosting a healthcare and immigration town hall w/ @SenDeanHeller in Reno on Mon, Apr 17th @ 9 AM. More info here: https://t.co/MVnxq0Apva"
MarkAmodeiNV2,845346530987008000,2017-03-24 18:48:13,Tune into @MSNBC at 3:10 PM ET (12:10 PM PT). I’ll be joining @tvKateSnow to talk about the #AHCA ahead of today’s vote.
MarkAmodeiNV2,845026522985648131,2017-03-23 21:36:37,I’ll be on @thedanmasonshow LIVE around 3:35 PM PT (6:35 PM ET) on @NewsTalk780KOH. Tune in here: https://t.co/yLUlmOJUjB
MarkAmodeiNV2,844977325775163392,2017-03-23 18:21:08,We’ve done our homework. We’ve closed on the issue in preparation for a vote tonight. I’m a no on the #AHCA
MarkAmodeiNV2,844921721748631552,2017-03-23 14:40:11,"Before tonight’s vote on the #AHCA, I’ll be talking health care with @MSNBC’s @AliVelshi at 11:07 AM ET (8:07 AM PT)"
MarkAmodeiNV2,844679300888645633,2017-03-22 22:36:53,"If you missed my discussion with @MSNBC’s @SteveKornacki on the #AHCA, you can catch our entire conversation here: https://t.co/G03NyZxTFy https://t.co/bN8zAjEED0"
MarkAmodeiNV2,844637133365264384,2017-03-22 19:49:19,Joining @MSNBC’s @SteveKornacki LIVE at 4:30 PM ET (1:30 PM PT) to discuss the #AHCA. Be sure to tune in.
MarkAmodeiNV2,842490411889377280,2017-03-16 21:39:01,Cheering on the @NevadaWolfPack from Washington tonight! #MarchMadness #BattleBorn #BackThePack https://t.co/a2S5lAOZhD
MarkAmodeiNV2,842427642452271104,2017-03-16 17:29:36,ICYMI: here's my full interview with @MSNBC’s @AliVelshi on the health care proposal: https://t.co/m2UYxqtGrE https://t.co/OBPINOKsVK
MarkAmodeiNV2,842383276908126208,2017-03-16 14:33:18,Joining @MSNBC’s @AliVelshi at 11:05 AM ET (8:05 AM PT) to discuss the recent health care proposal.
MarkAmodeiNV2,842138630235787266,2017-03-15 22:21:10,"More than 40 yrs later, I’m pleased to know a group of true American heroes will finally receive proper recognition: https://t.co/3aI6hskj12"
MarkAmodeiNV2,842131963297320960,2017-03-15 21:54:40,Addressed the #NVLeg in Carson Monday. Thx for having me &amp; thx to those who greeted me on the way in. Full remarks: https://t.co/mR2XgklHML https://t.co/99a8Dwn2oE
MarkAmodeiNV2,839984049699598340,2017-03-09 23:39:38,Just sent out a special edition newsletter regarding the health care proposal. Learn more here: https://t.co/Zn0qTpp1Dd
MarkAmodeiNV2,839607972997263363,2017-03-08 22:45:14,"Today in #NVHistory, Clara Crowell became Lander County’s 1st woman sheriff. Please join me in honoring women leaders worldwide. #IWD2017 https://t.co/4YauZrDtE4"
MarkAmodeiNV2,832353892444815360,2017-02-16 22:20:07,HR1106 will streamline small land transfers for local priorities that currently take more than a decade to complete https://t.co/43fFWoxeMC
MarkAmodeiNV2,832338788605128705,2017-02-16 21:20:05,Teamed up w/ @SenDeanHeller to intro a bill to spur economic development &amp; promote conservation in Pershing County: https://t.co/KCp4sv8JZA
MarkAmodeiNV2,829789606547689472,2017-02-09 20:30:33,Congrats to #Reno's @DavidsonGifted for winning 1st @ the regional science bowl. Good luck at nationals! https://t.co/E3gitzRElv @DOE_SC_NSB https://t.co/vK0X5Iktfk
MarkAmodeiNV2,829772352070307840,2017-02-09 19:21:59,REMINDER: Hosting a #veterans town hall tomorrow @ 10 AM in #Winnemucca. More details here: https://t.co/QkvR1o2v3O https://t.co/DnPdSc5gGA
MarkAmodeiNV2,828745458172440576,2017-02-06 23:21:29,Vietnam helicopter crewmembers account for nearly 10% of all Vietnam casualties – I'm proud to support these heroes: https://t.co/8bE30zkTva https://t.co/ox7YTNVccy
MarkAmodeiNV2,828631983085481985,2017-02-06 15:50:34,Gave this week’s @WesternCaucus Address. Watch &amp; learn more about some of the unique challenges facing #Nevada: https://t.co/9HjmwMqVRb
MarkAmodeiNV2,827530143480553472,2017-02-03 14:52:15,"Teamed up with @rep_SteveWomack and 12 other colleagues to intro #HJRes61, a bill to protect our country &amp; protect our flag. #ProtectOurFlag https://t.co/Xc6fYkdqxf"
MarkAmodeiNV2,826935845001318401,2017-02-01 23:30:43,Hosting a #Veterans town hall in #Winnemucca Feb 10 @ 10 AM. Come out &amp; learn more about how my office can help: https://t.co/QkvR1o2v3O
MarkAmodeiNV2,826553174425219073,2017-01-31 22:10:08,"Our office continues to focus on solutions to immigration and other issues, rather than opportunities for political pontification. (2/2)"
MarkAmodeiNV2,826552855112859653,2017-01-31 22:08:51,Just issued a comprehensive response to @POTUS's executive order on immigration. More info here: https://t.co/3zLUjKGobV (1/2)
MarkAmodeiNV2,825067007473233921,2017-01-27 19:44:38,Please join me this #HolocaustRemembrance day in honoring the millions of survivors and innocent lives that were lost. We will #NeverForget
MarkAmodeiNV2,821828202452676609,2017-01-18 21:14:46,ICYMI: joined @TheDanMasonShow on @NewsTalk780KOH yesterday. Find out my thoughts on the new Administration &amp; more: https://t.co/2Kxp9Tr6Oo https://t.co/RlOvW2Vn8e
MarkAmodeiNV2,821492229910958081,2017-01-17 22:59:44,I’ll be on @thedanmasonshow live @ 3 PM PT (6 PM ET) on @NewsTalk780KOH to discuss the #Inauguration. Tune in: https://t.co/yLUlmOJUjB
MarkAmodeiNV2,821479264759533569,2017-01-17 22:08:13,Partnered w/ @SenDeanHeller to intro a strategic &amp; critical minerals bill that will create good-paying jobs in NV: https://t.co/wIzYhiT2rN
MarkAmodeiNV2,818548767871864833,2017-01-09 20:03:28,"Head over to my website for #NVFlood17 information, updates, and basic safety tips: https://t.co/wRmtUQblXS https://t.co/RQwV4PMit9"
MarkAmodeiNV2,816384394973868032,2017-01-03 20:43:02,Back in Washington for #OpeningDay of the #115Congress. I’m honored to serve #NV02 &amp; ready to advance real change for the #American people. https://t.co/TNetFsDp2M
MarkAmodeiNV2,811721385508737024,2016-12-21 23:53:54,I’ll be on the @TheDanMasonShow at 4:05 PM PT (7:05 PM ET) on @NEwsTalk780KOH. Tune in live to hear our discussion: https://t.co/ChVdbZkjbu
MarkAmodeiNV2,811633880558170112,2016-12-21 18:06:11,Great turnout at yesterday’s #Immigration Town Hall in #Reno. Thank you to everyone who came to share their concerns &amp; receive an update. https://t.co/T6McGc646E
MarkAmodeiNV2,811016677446090754,2016-12-20 01:13:38,It was an honor to assist Mr. Jerry Reynolds of #Elko in recovering his grandfather's #MedalofHonor Learn more here: https://t.co/eW7w9vaw1g
MarkAmodeiNV2,808359676484218882,2016-12-12 17:15:40,Joining @KevinWallRadio at 12:30 PM ET (9:30 AM PT). LISTEN LIVE: https://t.co/vdisNPdbOB
MarkAmodeiNV2,807080067998318592,2016-12-09 04:30:57,Very proud to see Bob Gastonguay from Team Amodei help out the @SalvationArmyUS at Shopper's Square in Reno today. #RedKettle https://t.co/cSZ2BMou9Y
MarkAmodeiNV2,806663353292750848,2016-12-08 00:55:05,"RT @SteveScalise: Almost 5,000 helicopter pilots and crew members died in the Vietnam War. @MarkAmodeiNV2's bill will create a memorial for…"
MarkAmodeiNV2,806620504958390277,2016-12-07 22:04:49,WATCH:@cspan around 5:20PM ET/ 2:20PM PT – speaking on my bill to honor #Vietnam helicopter crew members &amp; pilots: https://t.co/iO8PVfGcZM
MarkAmodeiNV2,806556447559524352,2016-12-07 17:50:16,"Dec 7,1941: “a date which will live in infamy”. Please join me in remembering those who fought for our freedom 75 years ago in #PearlHarbor"
MarkAmodeiNV2,803604965189042176,2016-11-29 14:22:08,Congrats to @RepTomPrice on #HHS appointment. Great pick by Team Trump-Pence!
MarkAmodeiNV2,799660506294390785,2016-11-18 17:08:16,Joining @KevinWallRadio at 12:30 PM ET (9:30 AM PT) to discuss my hopes for the 115th #Congress. TUNE IN: https://t.co/vdisNPdbOB
MarkAmodeiNV2,796783446878195712,2016-11-10 18:35:51,#HappyBirthdayMarines – thankful for your 241 years of defending our freedom and this nation @USMC #SemperFi https://t.co/9eOxXLliSx
MarkAmodeiNV2,796487722605178880,2016-11-09 23:00:45,I’ll be on the @TheDanMasonShow at 4 PM PT (7 PM ET) on @NEwsTalk780KOH. Tune in live to hear our discussion: https://t.co/yLUlmOJUjB
MarkAmodeiNV2,793833764946268164,2016-11-02 15:14:52,My #Washington office is now hiring spring interns. Apply today! Application deadline Nov 21st: https://t.co/43L9EhmQxs https://t.co/X3l1qKGgOl
MarkAmodeiNV2,791745359462576128,2016-10-27 20:56:18,"Toured Flirtey this week, a Reno-based drone delivery co. that conducted the 1st FAA-approved drone deliveries in the US: https://t.co/RD5GCmCQPR"
MarkAmodeiNV2,791292160188506112,2016-10-26 14:55:27,Pleased to have Rep @MichaelcBurgess’s support for my bill to give #Vietnam helicopter pilots &amp; crew the recognition they deserve. #HR4298
MarkAmodeiNV2,791285510924820484,2016-10-26 14:29:01,REMINDER: I'm hosting a TRICARE town hall today @ 10 AM in Reno at the Washoe County Admin Complex. More info here: https://t.co/PTLvQX2rOW
MarkAmodeiNV2,791040322327412736,2016-10-25 22:14:44,I'll be joining @thedanmasonshow at 4 PM PT (7 PM ET) on @NewsTalk780KOH. Tune in live: https://t.co/2Kxp9Tr6Oo
MarkAmodeiNV2,789146044277878784,2016-10-20 16:47:33,Stopped by the old flour mill in #Minden last week – the future home of @BentlyHeritage. Check out my tour: https://t.co/7OcKbgUQvJ
MarkAmodeiNV2,787034837974650886,2016-10-14 20:58:22,Hosting a #TRICARE town hall on Oct 26 in #Reno. More info here: https://t.co/PTLvQX2rOW
MarkAmodeiNV2,786272376988143616,2016-10-12 18:28:37,Congrats to Karen &amp; Chef Charlie Abowd of Cafe at Adele's in Carson for being finalists in the @NvRA's running for restaurant of the year!
MarkAmodeiNV2,783354128529518597,2016-10-04 17:12:32,Thx to everyone who came out to #Carson on Saturday to join me in supporting our local law enforcement officials: https://t.co/OeAETkwUsR
MarkAmodeiNV2,782988353494978560,2016-10-03 16:59:05,I'll be joining @KevinWallRadio at 1 PM ET (10 AM PT). Tune in LIVE: https://t.co/MMclUlSd0O
MarkAmodeiNV2,781878453654126592,2016-09-30 15:28:44,Great News for NV! Another bipartisan lands transfer bill headed to the White House for signature. Learn more here: https://t.co/GHAudGyWAU
MarkAmodeiNV2,781225876042215424,2016-09-28 20:15:37,"Last week, I took @RollCall around for a behind the scenes tour of my Washington office – check it out: https://t.co/YJRaTwvgZ7"
MarkAmodeiNV2,779403092639047680,2016-09-23 19:32:32,Pleased to see Reno’s VARO Director appointed to Directors Advisory Cmte to provide support to @DeptVetAffairs &amp; improve care for our vets
MarkAmodeiNV2,779341926621409281,2016-09-23 15:29:29,"I extend condolences to my dear friend Dan Mason, host of @NewsTalk780KOH's @thedanmasonshow, after the recent passing of his father Donald."
MarkAmodeiNV2,778634081148014593,2016-09-21 16:36:45,Tune in at 1 PM ET (10 AM PT) to hear my interview with @KevinWallRadio on Live &amp; Local: https://t.co/MMclUlSd0O
MarkAmodeiNV2,776847427173310468,2016-09-16 18:17:14,Today we honor &amp; remember our #POWMIA who made the ultimate sacrifice to keep us safe &amp; free. You are not forgotten. https://t.co/tPup04xlyc
MarkAmodeiNV2,776501830402576384,2016-09-15 19:23:57,"In 2017 #Nevadans in 10 counties, 7 in #NV02, will have just 1 choice, it’s unfair for them pay a penalty bc of Obama's failed law (3/3)"
MarkAmodeiNV2,776501598616973312,2016-09-15 19:23:02,"Under our bill, residents in counties with 2 or fewer provider options will receive an exemption from the individual mandate penalty (2/3)"
MarkAmodeiNV2,776501486931116032,2016-09-15 19:22:35,Joined @RepJoeHeck &amp; @RepHardy today to introduce a bill to Spare #Nevadans from an Unfair Obamacare Tax https://t.co/c2GbKQdo8Q (1/3)
MarkAmodeiNV2,775817040808382464,2016-09-13 22:02:51,Met w/ #Nevada reps today from @ACSCAN to discuss cancer research &amp; prevention programs. Thanks for stopping by. https://t.co/qvBMHkFn5m
MarkAmodeiNV2,775148332750626816,2016-09-12 01:45:38,We will #NeverForget https://t.co/bLkaR5e0qP
MarkAmodeiNV2,774336950656438272,2016-09-09 20:01:30,Learn more about my bill to give #Vietnam helicopter pilots and crew casualties the recognition they deserve: https://t.co/A9PmE5yhGr
MarkAmodeiNV2,764249398352154625,2016-08-12 23:57:10,Thx to everyone who came out to the vet town hall in Sparks today. Also thx to Mayor Martini &amp; @cityofsparks for letting us use the Chamber.
MarkAmodeiNV2,761638195373170688,2016-08-05 19:01:10,Best of luck to NV’s 4 Olympians &amp; all of @TeamUSA as they compete @ the 2016 games! Opening ceremony: 730p ET/ 430p PT on @nbc @Jake_Dalton
MarkAmodeiNV2,761202216539660289,2016-08-04 14:08:45,"Recently met with the Elko BLM to discuss several issues, including: land conveyances, wild horses and wildfires. Thx for having me. @blmnv"
MarkAmodeiNV2,760970541889191936,2016-08-03 22:48:09,Had a great time touring @PacificRecycle yesterday. Big thanks to their wonderful staff for showing me around. https://t.co/33GhLMmQPa
MarkAmodeiNV2,758753970965872641,2016-07-28 20:00:18,"I’ll be hosting a #veterans town hall meeting on Fri, Aug 12 from 930 AM PT - 1130 AM PT in #Sparks. More info here: https://t.co/4evkv2L34l"
MarkAmodeiNV2,757636607386214401,2016-07-25 18:00:18,Proud day for Nevadans everywhere! https://t.co/UbqtkD1NTB
MarkAmodeiNV2,754069371983630336,2016-07-15 21:45:22,"As a coach and educator, Tom Andreasen is part of the fabric of the @CarsonSenators, I'm pleased to see him honored: https://t.co/HXR3apFah9"
MarkAmodeiNV2,753335409053208576,2016-07-13 21:08:52,This measure is a win-win for Nevada both in terms of economic prosperity and conservation https://t.co/piKRWrXdjp  2/2
MarkAmodeiNV2,753335347342442496,2016-07-13 21:08:37,"Just introduced the #Pershing Co Economic Development &amp; Conservation Act w/ support from the entire Nevada Del 
https://t.co/piKRWrXdjp 1/2"
MarkAmodeiNV2,753221374068555776,2016-07-13 13:35:44,"TUNE IN @ 10 AM ET (7 AM PT) to the @HouseAppropsGOP markup of the 2017 #Labor, #HHS &amp; #Education funding bill: https://t.co/tOMcYgtl7Z"
MarkAmodeiNV2,752872536833191936,2016-07-12 14:29:35,Headed to a @HouseAppropsGOP markup of the FY2017 State &amp; Foreign Ops Bill. Tune in LIVE @ 1030 AM ET (730 AM PT): https://t.co/6XGwRxP0hr
MarkAmodeiNV2,751468602008670208,2016-07-08 17:30:50,Joined the #Bipartisan Working Group this week in taking action to tackle our nation’s fiscal challenges. Learn more https://t.co/L0XDxbpojs
MarkAmodeiNV2,750061378824708097,2016-07-04 20:19:02,Happy #IndependenceDay and God bless #America. https://t.co/OtI5LqtZqC
MarkAmodeiNV2,748929850589777920,2016-07-01 17:22:45,"Today, the #Gernika Tree – an enduring symbol of the US-Basque connection – was planted on the @USCapitol grounds. https://t.co/jEVbLlFRvv"
MarkAmodeiNV2,747894438551298048,2016-06-28 20:48:24,Congrats to @jake_dalton of Spanish Springs on being named to the 2016 @USAGym team! Best of luck in Rio! https://t.co/jCuZEaxtqY @rgj #NV02
MarkAmodeiNV2,745296421633536000,2016-06-21 16:44:48,Proud to have a souvenir from my last visit at #Reno’s McKinley Arts Center present to greet #Washington visitors: https://t.co/qkqsab2BHZ
MarkAmodeiNV2,744974111617724416,2016-06-20 19:24:03,Now seeking #Fall interns in my #Washington office. More info here: https://t.co/LOIGoXrk5m #NV02 https://t.co/UDySgBttaQ
MarkAmodeiNV2,743065912954228741,2016-06-15 13:01:33,Headed to @HouseAppropsGOP full Committee mark-up of the FY17 Interior &amp; Environment bill. TUNE IN @ 9AM ET (6AM PT) https://t.co/DChx1eUnyD
MarkAmodeiNV2,742835184026980353,2016-06-14 21:44:43,Please join me today in celebrating 239 years of the #American flag – a symbol of our pride &amp; freedom. #FlagDay https://t.co/qMYjXb907U
MarkAmodeiNV2,742801861560926208,2016-06-14 19:32:19,Happy 241st birthday to the @USArmy. Thank you to our heroes who fight each day to keep us safe and free #ArmyStrong https://t.co/8ywHPtjfX7
MarkAmodeiNV2,741346589994848256,2016-06-10 19:09:35,Enjoyed visiting with students from the College of Southern #Nevada this week. Thanks for stopping by! @CSNCoyote https://t.co/A4f5ruazHR
MarkAmodeiNV2,741279000333590533,2016-06-10 14:41:00,Congrats to @AF_Academy students &amp; Amodei appointees on receiving their class rings: https://t.co/9INpQ0Tzge https://t.co/SoL5CK4Wvt
