MarkWarner,1306751327448576002,2020-09-18 00:26:09,RT @SenatorFischer: We must have transparency and control online regarding our personal data. I’m proud to help introduce the SAFE DATA Act…
MarkWarner,1306612944722108417,2020-09-17 15:16:16,"This report from @HSGAC confirms what we already knew, that Postmaster General DeJoy instituted changes that slowed down mail delivery for countless Virginians &amp; seriously hurt folks trying to make ends meet during a pandemic. https://t.co/qprQWudem6"
MarkWarner,1306331593624219650,2020-09-16 20:38:17,"Like the country it serves, our military is made stronger by the diversity of its people. That's why my amendment to the FY21 NDAA will have GAO do a diversity &amp; inclusion study at the Pentagon, aimed at getting more info on the lack of diversity &amp; coming up with recommendations. https://t.co/lCZ26bZgPE"
MarkWarner,1306277165403521024,2020-09-16 17:02:00,"I’m glad the House passed the IoT Cybersecurity Improvement Act. By establishing some baseline standards for the security of IoT devices, we will make our country and the data of American citizens more secure.
https://t.co/HHJrzfz2p1"
MarkWarner,1306271642214170624,2020-09-16 16:40:03,"RT @NDI: Thank you, Senator @MarkWarner, for a great discussion this morning with @NDI Chairman @madeleine &amp; President @AmbDMitchell  on th…"
MarkWarner,1306271217469534210,2020-09-16 16:38:22,"RT @prosperitynow: Thank you to @MarkWarner, @SenBooker, @SenKamalaHarris, @SenSchumer and @RepGregoryMeeks for introducing the Jobs and Ne…"
MarkWarner,1306245329709391877,2020-09-16 14:55:30,"The #HealthCareImprovementAct will reduce costs for working families &amp; increase access to care for uninsured Virginians while continuing to protect all Americans with preexisting conditions.
https://t.co/4hrU99YH66"
MarkWarner,1306245328744648706,2020-09-16 14:55:29,"Despite our progress, too many families still struggle to deal with spiraling health care costs &amp; a shortage of affordable options in their area. That's why I introduced the #HealthCareImprovementAct.
https://t.co/84SID9Rlcl"
MarkWarner,1306245083566682112,2020-09-16 14:54:31,"RT @GregMMathis: Over 15% of Americans are uninsured. Of the worlds wealthiest nations - only the U.S., Mexico &amp; Turkey have an uninsured r…"
MarkWarner,1306217382411677696,2020-09-16 13:04:26,RT @NDI: HAPPENING NOW! @NDI Chairman @madeleine &amp; President @AmbDMitchell's conversation with Senator @MarkWarner on the future of #democr…
MarkWarner,1306208013578055680,2020-09-16 12:27:13,"Early voting in person starts this Friday in Virginia, folks! 

Make sure you're registered to vote, then show up at your local registrar's office with an ID with your name and address on it.

Check your registration status today at @vaELECT or:
https://t.co/BkP4380iMK"
MarkWarner,1306013091235323905,2020-09-15 23:32:40,"Yesterday’s 9th Circuit decision to end TPS for over 300,000 immigrants further intensifies the need to provide stability for TPS recipients. TPS holders must be protected, and the Senate must act by adding an automatic extension for TPS holders’ in the next COVID relief bill."
MarkWarner,1306013089624711168,2020-09-15 23:32:39,"Today, Sen. @timkaine &amp; I called on both Leaders McConnell &amp; Schumer to protect thousands of Virginia's essential workforce members, including those w/ Temporary Protected Status (TPS). Our letter urges both leaders to add an extension of work authorizations for TPS recipients. https://t.co/vLlztVTZlE"
MarkWarner,1305979453240213504,2020-09-15 21:19:00,"Yesterday, I took to the Senate floor urging my colleagues to swiftly pass government funding bills by September 30 to prevent an unnecessary government shutdown as millions of Americans continue to struggle with the economic effects caused by the COVID-19 pandemic. 

Watch here: https://t.co/iwXfdyUcRe"
MarkWarner,1305945228101124096,2020-09-15 19:03:00,"Let’s all do our part to limit strain on our health care system while we continue to battle COVID.
https://t.co/CZFSM2owsD"
MarkWarner,1305900175068729346,2020-09-15 16:03:58,Looking forward to this conversation tomorrow with @NDI Chairman @madeleine and President Derek Mitchell on a topic central to the future of freedom in the 21st century. Hope to see you all there! https://t.co/RbSfpaTQNc
MarkWarner,1305884662124904448,2020-09-15 15:02:20,"Today marks the beginning of #HispanicHeritageMonth. A time to celebrate Latino and Hispanic Americans’ contributions to our nation. Amidst the #COVID pandemic, Latinos are proving themselves more essential than ever, and resilient in the face of adversity. #HHM https://t.co/qUph6i5CFt"
MarkWarner,1305644012439851008,2020-09-14 23:06:04,RT @ProgressIndex: House votes unanimously to put Curtis Harris' name on Hopewell post-office building. Bill was sponsored by Rep. @Donald_…
MarkWarner,1305612725305958401,2020-09-14 21:01:45,RT @povertynews: Senators @MarkWarner and @timkaine announced that localities across Virginia will receive $35 million in federal funding i…
MarkWarner,1305602781538115584,2020-09-14 20:22:14,"I’m on the Senate floor urging my colleagues to swiftly pass gov't funding bills by Sept. 30 to prevent an unnecessary government shutdown as millions of Americans continue to struggle with the economic effects caused by the COVID-19 pandemic.

Watch here:
https://t.co/bxr5vB6g3X"
MarkWarner,1305595144427786248,2020-09-14 19:51:53,I’m glad the House passed our bipartisan #InternetOfThings (IoT) Cybersecurity Improvement Act. This bill will ensure the federal government purchases secure devices and existing vulnerabilities are closed.
MarkWarner,1305595143328800769,2020-09-14 19:51:53,"Insecure IoT devices are one of the most critical emerging cyber threats to our national security. That's why I introduced the #InternetOfThings (IoT) Cybersecurity Improvement Act, which will require security standards for IoT devices used by the federal government."
MarkWarner,1305547401781010432,2020-09-14 16:42:11,"The clock is ticking for Congress to prevent another government shutdown by September 30th. That's why later today, I'll be heading to the Senate floor to reaffirm how crucial it is to avoid that &amp; to use our time to pass much-needed relief for millions of struggling Americans."
MarkWarner,1305520803308597253,2020-09-14 14:56:29,"The bill would prevent the President from using funds to withdraw from the Paris Climate Accord and direct the Trump Administration to develop a strategic plan for the country to meet its commitment under the 2015 Paris Climate Agreement.
https://t.co/aJyHTchFG1"
MarkWarner,1305520802352238592,2020-09-14 14:56:29,"This cannot become our new normal – the science surrounding climate change unequivocally supports the need for dramatic policy changes. That’s why I joined @SenatorShaheen and 43 other Senators to introduce the International Climate Accountability Act.
https://t.co/B7PTPNMHD2"
MarkWarner,1305200489353576448,2020-09-13 17:43:40,"From the U.S. Senate Select Committee on Intelligence’s (SSCI) bipartisan report, VOL 3, page 45: https://t.co/UADrEWGFlb https://t.co/8yW1PCHZjP"
MarkWarner,1305167100512739328,2020-09-13 15:31:00,"Americans need help NOW, and the Senate needs to respond in a way that meets the nation’s real and urgent needs by passing the #HeroesAct. It’s past time to give real relief to Americans!
https://t.co/B4effKQxyt"
MarkWarner,1304904872525848576,2020-09-12 22:09:00,"This leaves us vulnerable.
https://t.co/ZbEVyhIP6p"
MarkWarner,1304862514619002880,2020-09-12 19:20:41,"Let's help Governor’s School @ Innovation Park bring home the championship by voting for their team, Blinding Lights! 
https://t.co/S9ZnqKIYOO"
MarkWarner,1304862512958107649,2020-09-12 19:20:40,"I want to congratulate the students on the team Blinding Lights from the Governor’s School @ Innovation Park in Manassas, VA for being 1 of 10 finalists in the TI Codes Contest! Their module, which uses UV light to sanitize its surroundings, is impressive.
https://t.co/AdPwadl6Dt"
MarkWarner,1304840312632864768,2020-09-12 17:52:27,RT @RepSylviaGarcia: 1/ This report is yet another example of the Trump Administration’s utter disregard for the safety and well-being of h…
MarkWarner,1304789363100921860,2020-09-12 14:30:00,"Having a complete &amp; accurate Census is essential to ensuring our communities have the resources they need for the next 10 years. Undermining the Census will set our most underserved communities back. We must not let that happen.

Everyone must be counted.
https://t.co/PXhA8cYz3t"
MarkWarner,1304776168277782528,2020-09-12 13:37:34,"RT @amjoyshow: #AMJOY IS ALSO PLEASED TO WELCOME:

Sen. @MarkWarner
U.S. Senator from Virginia

#SATURDAYMORNING @AMJOYSHOW - 10 AM ET @MSN…"
MarkWarner,1304531663397904384,2020-09-11 21:26:00,"Yesterday I took to the Senate floor and spoke out against the despicable comments disparaging our service members who have sacrificed and given their lives to answer the call of duty and protect the rest of us. 

Watch here: https://t.co/8JlpuZy5Hw"
MarkWarner,1304507763586891779,2020-09-11 19:51:02,RT @BasilJohnNews: Virginia Senators Mark Warner and Tim Kaine want the FCC to expand the program that helps low-income Americans access th…
MarkWarner,1304495151918780416,2020-09-11 19:00:55,"RT @ffxfirerescue: FCFRD was honored to host Senators @KamalaHarris &amp; @MarkWarner at its annual 9/11 Remembrance Ceremony. Firefighters, po…"
MarkWarner,1304469928955850753,2020-09-11 17:20:41,I’m outraged and I’m immediately demanding answers from @DHSgov and @ICEgov about this report.
MarkWarner,1304469927215202307,2020-09-11 17:20:41,"And on July 29, Sen. Kaine and I urged this administration to work with the @CDCgov to create and deploy teams of public health professionals to Farmville Detention Center, where nearly every detainee had contracted COVID-19.
https://t.co/H0XN01coHE"
MarkWarner,1304469926254653440,2020-09-11 17:20:40,"On July 16, Sen. Kaine and I kept the pressure on @ICEgov to stop transferring detainees amid a surge of #COVID cases in detention centers.
https://t.co/nYrTItkreV"
MarkWarner,1304469925445218304,2020-09-11 17:20:40,"On June 26, Sen. Kaine and I called on @ICEgov to stop transferring detainees amid this pandemic.
https://t.co/i7lMSe74vV"
MarkWarner,1304469924363087875,2020-09-11 17:20:40,"Despite the constant surge in COVID cases, @ICEgov has endangered a staggering number of lives of detainees and Virginians because it decided to transfer detainees during this pandemic. Have they no shame? 

Sen. @timkaine and I have raised the alarm about these transfers before. https://t.co/lQkyG6X06E"
MarkWarner,1304425411259006978,2020-09-11 14:23:47,"While we can never repay the sacrifices of our first responders or their families, the 9/11 National Memorial Trail, which was unanimously passed in the Senate, provides an opportunity for every American to remember the courageous individuals who sacrificed so much that day."
MarkWarner,1304425410311135233,2020-09-11 14:23:47,"That’s why I'm joining Fairfax County Fire @ChiefJohnButler, Fairfax County Board of Supervisors, and first responders at the Fairfax County Fire and Rescue Department’s 9/11 remembrance ceremony to commemorate the lives lost 19 years ago today."
MarkWarner,1304425408629219329,2020-09-11 14:23:47,"Today we remember the 2,977 lives lost in the horrific attacks that took place on September 11th, 2001. While 19 years have passed, let us also remember the heroism and courage displayed by our first responders to save lives, rescue the injured, and help one another.
#NeverForget https://t.co/yttU4UGyso"
MarkWarner,1304206844324466690,2020-09-10 23:55:17,"RT @rcohen: Reminder that @MarkWarner @SenSanders @SenDougJones &amp; @SenBlumenthal have a bill to do this here. 

Nearly 30 mil Americans are…"
MarkWarner,1304176494814601217,2020-09-10 21:54:41,Climate change poses an immediate risk to the future of our planet. The proof is right in front of us; we have to take action that meets this moment's needs. https://t.co/3cSj362Px8
MarkWarner,1304146367636549634,2020-09-10 19:54:58,"We’ve said it all along: Russia will be back. We need to be prepared.
https://t.co/JxP15BfiCS"
MarkWarner,1304138985816633344,2020-09-10 19:25:38,"LIVE: I am on the Senate floor speaking out against the despicable comments disparaging our service members who have sacrificed and given their lives to answer the call of duty and protect the rest of us. 

Watch here:
https://t.co/ENuUldUorL"
MarkWarner,1304105497126207490,2020-09-10 17:12:34,"Our service members have sacrificed and given their lives to this country.

That's why later today, I'll be heading to the Senate floor to reaffirm that our veterans are heroes, not losers.

Thank you for your courage, @SenDuckworth. https://t.co/x6kyqGf1Gv"
MarkWarner,1304079627762180097,2020-09-10 15:29:46,"The President of the United States knowingly misled the American people to believe we were safer than we were, and nearly 200,000 Americans died. It should be unthinkable, but the reality is: it's not. This is a pattern of behavior we've seen from this President time and again. https://t.co/U8rxzVDScE"
MarkWarner,1303878088661643271,2020-09-10 02:08:55,Trump’s payroll tax deferral sets up the federal workforce members who can least afford it for a tax bill that many will not expect. Our men and women in uniform face many challenges and daily sacrifices while serving our country. Financial concerns shouldn’t be one of them.
MarkWarner,1303878087877296128,2020-09-10 02:08:55,"The payroll tax deferral could potentially hurt more Americans than it would help:

- Military members don't have the option to opt-out
- It doesn’t eliminate the responsibility to pay the tax
- The deferred taxes will be collected from wages between Jan 1 and Apr 30, 2021"
MarkWarner,1303878085843050496,2020-09-10 02:08:55,We need to get serious about real economic relief and refrain from mistreating our men and women in uniform and federal workers. That is why I joined Sen. @ChrisVanHollen and 23 of my fellow Senators in a bipartisan rebuke against this administration's payroll tax deferral. https://t.co/Zf8g5cVv67
MarkWarner,1303835052879609856,2020-09-09 23:17:55,"RT @SenatorBaldwin: This is what courage looks like. 
 
Thank you, Tammy. https://t.co/nLA2fYl0ff"
MarkWarner,1303771267401646080,2020-09-09 19:04:27,"This Senate GOP's emaciated bill doesn't meet the needs of the American people. Since May, we've been ready for the Senate to pass the #HeroesAct. Its past time the Senate took a vote.
https://t.co/AggWFihUkF"
MarkWarner,1303724511876046850,2020-09-09 15:58:40,RT @marciaargust: This oped is right to thank @MarkWarner for his work to #FixOurParks: https://t.co/o3NtL2OSv0. His commitment to raising…
MarkWarner,1303708085161205761,2020-09-09 14:53:23,"I’ve said this from day one: A.G. Bill Barr is unfit to lead @TheJusticeDept. He is acting as the President's personal lawyer instead of fulfilling his duty to work in the public's best interest.

He should resign. 
https://t.co/zBkkrtH3os"
MarkWarner,1303684508198350849,2020-09-09 13:19:42,"RT @jseldin: #Election2020 - ""The social media companies are doing a slightly better job"" @markwarner tells #BillingtonCyberSecurity ""They'…"
MarkWarner,1303454797887156233,2020-09-08 22:06:55,"The Raise the Wage Act will gradually raise the federal minimum wage for the first time in more than 10 years. We need to rebuild an economy that works for everyone, and with the ongoing crisis, Americans will need this legislation more than ever. I'm honored to be a cosponsor."
MarkWarner,1303426084101410816,2020-09-08 20:12:49,"Like Florida, Georgia, and South Carolina, Virginia has thousands of miles of beautiful coastline and a population that wants to keep it that way. Virginia is firmly opposed to any and all offshore drilling and should be included, too. https://t.co/wCogGQ73Aa"
MarkWarner,1303410389141594117,2020-09-08 19:10:27,"Postmaster General DeJoy is unfit to lead the @USPS.

He should resign. https://t.co/1UZenzDHrq"
MarkWarner,1303371331845709825,2020-09-08 16:35:15,"The Senate returned from its August recess today. We can’t waste a single day. We need to pass the #HeroesAct, which passed the House 116 days ago. Why are we still dithering around on it? Americans need relief now. https://t.co/tTyaR8dfbq"
MarkWarner,1303340894414872579,2020-09-08 14:34:18,"Wishing all the parents, teachers, and students going back to school today and tackling virtual learning the best! There will undoubtedly be some adjustments, but we've all got your back. You've got this!
https://t.co/nIFV2XBdDW"
MarkWarner,1302947646332645376,2020-09-07 12:31:41,"This #LaborDay, let's honor all workers by protecting them.
 
Let's avoid large gatherings, keep our interactions short and safe, and #MaskUp.

Do your part to slow the spread of #COVIDー19."
MarkWarner,1302622252136116224,2020-09-06 14:58:41,Always glad to be in the 757. @757Proud #MaskUp https://t.co/slAiS7jPSe
MarkWarner,1302605407127470080,2020-09-06 13:51:44,"RT @SenGillibrand: Millions of Americans have lost jobs, paychecks, and the ability to keep food on the table. Congress needs to extend des…"
MarkWarner,1302256898163519488,2020-09-05 14:46:53,"September is Suicide Prevention Month.

We can’t take our focus off the veteran suicide crisis even with all that’s going on right now."
MarkWarner,1302256897429471233,2020-09-05 14:46:53,"The bill also includes provisions of my legislation, the IMPROVE Well-Being for Veterans Act - which expands veterans’ access to mental health services to help the @DeptVetAffairs reduce veteran suicides."
MarkWarner,1302256896401866754,2020-09-05 14:46:53,"I want to thank the McBrides for telling me their story.

Our country loses nearly 20 veterans a day to suicide.

To combat this epidemic, the Senate unanimously passed the Veterans Mental Health Care Improvement Act, which will help get our vets the support they deserve. https://t.co/XqPA2TdISG"
MarkWarner,1301994857049796613,2020-09-04 21:25:38,"These are crucial times; Virginians rely on mail more than ever. That is why today, I went to Regency Post Office with Attorney General @MarkHerringVA to continue to push to reverse Postmaster General DeJoy’s directives to delay the delivery of life-saving mail. https://t.co/cTANT3cvD1"
MarkWarner,1301905281446744071,2020-09-04 15:29:41,This is despicable. Our heroes deserve a Commander-in-Chief who respects their sacrifice. https://t.co/a97xAx0BRG
MarkWarner,1301904792629981187,2020-09-04 15:27:45,"RT @ImBrendanKing: RIGHT NOW: @MarkWarner and @MarkHerringVA tour a Henrico post office this morning. 

Sen. Warner says he’s received 11,0…"
MarkWarner,1301886716232503298,2020-09-04 14:15:55,Today I’m in Chesterfield hosting a socially-distanced discussion with @RepSpanberger and members of the Chesterfield County School board ahead of the 2020-2021 school year. https://t.co/sat7JAqXpr
MarkWarner,1301721267427512327,2020-09-04 03:18:29,I’ve said it before; I’ve heard too many reports from constituents across Virginia who have encountered problems with their mail. Virginians deserve to get their mail on time by doing that; we must protect the @USPS. #DontMessWithUSPS https://t.co/LKqQ8GBFwe
MarkWarner,1301489585785012227,2020-09-03 11:57:52,RT @delegatebagby: Took a break today to volunteer at @FeedMoreInc w/ @MarkWarner &amp; @LevarStoney. Grateful for Feed More's commitment to pr…
MarkWarner,1301234314655477760,2020-09-02 19:03:31,"Food pantries and food banks across the country have seen an uptick in families seeking assistance due to COVID. That's why I'm joining Mayor @LevarStoney, @delegatebagby, volunteers, and employees at @FeedMoreInc to package groceries and supplies to those in need. https://t.co/TBASRuYlWN"
MarkWarner,1301167455461675009,2020-09-02 14:37:50,We have to make sure the American public is aware of the importance of getting their regular health check-ups
MarkWarner,1301167452479463425,2020-09-02 14:37:49,Today I’m hosting a socially distanced health care roundtable with local health providers to discuss my GET CARE Act. My bill will authorize a public awareness campaign to educate the public about the importance of getting routine procedures and screenings. https://t.co/icalrIF1vF
MarkWarner,1300888800646885376,2020-09-01 20:10:34,"The whole purpose of a briefing is the exchange of information. This is an attempt to limit congressional oversight. Americans need to know when foreign governments and their agents are trying to affect our elections.
https://t.co/1HWuMb6ysR"
MarkWarner,1300796945024389120,2020-09-01 14:05:33,"Rent is due today for millions of Americans. Millions of families are on the verge of homelessness. The House passed the #HeroesAct 3mos ago, authorizing an eviction moratorium, aid for renters, &amp; additional stimulus to families. The Senate must #GetBackToWork &amp; pass this relief. https://t.co/jWRWOpqDR8"
MarkWarner,1300767024944209920,2020-09-01 12:06:40,"RT @McFaul: Exactly @MarkWarner !  We, the American voters,  have a right to know about foreign attempts to influence our election. There i…"
MarkWarner,1300525012655452160,2020-08-31 20:05:00,"There is no more sacred right as an American than the right to vote. With 64 days before election day, we must do everything possible to protect our electoral process and ensure that the process of voting by mail during this pandemic runs as seamlessly as possible. https://t.co/i9V6dOEy3m"
MarkWarner,1300479804345589761,2020-08-31 17:05:21,"RT @Followfairfax: Following pressure by U.S. Sens. Mark R. Warner and Tim Kaine, Gerry Connolly, Don Beyer and Jennifer Wexton, USDA exten…"
MarkWarner,1300476056793755651,2020-08-31 16:50:28,"RT @mitchellreports: On DNI cutting in-person election briefings for Congress, @MarkWarner: ""My theory is that what Director Ratcliffe is t…"
MarkWarner,1300465364338434048,2020-08-31 16:07:58,"ICYMI
https://t.co/jdLNZQ44cO"
MarkWarner,1300441969563492354,2020-08-31 14:35:01,"Now isn't the time for divisiveness; the people of Kenosha and communities across Wisconsin are hurting and looking for leadership in this crisis. It's the President's job to lead by example and be a calming presence for the people we know are hurting.
https://t.co/OvWpn7ltSf"
MarkWarner,1300114732452663298,2020-08-30 16:54:41,ICYMI: Virginians rely on timely mail service &amp; I’ll keep fighting to protect the @USPS. #DontMessWithUSPS https://t.co/s2olfWPniY
MarkWarner,1299867550713622531,2020-08-30 00:32:29,The Senate Intelligence Committee does not and will not accept ODNI’s refusal to brief Congress in the 66 days ahead of the election.
MarkWarner,1299867549941796870,2020-08-30 00:32:28,Director Ratcliffe’s outrageous decision to stop providing briefings to Congress is an unprecedented attempt to politicize an issue – protecting our democracy from foreign intervention – that should be non-partisan.
MarkWarner,1299867548717117440,2020-08-30 00:32:28,The Office of the Director of National Intelligence has an obligation to brief Congress  — and specifically the intelligence oversight committees — on threats to our elections. https://t.co/WAUAYAsmBE
MarkWarner,1299774256398716928,2020-08-29 18:21:46,"Over 30 million children rely on school meals every day. As many as 17 million children did not get enough to eat this summer. I urge the @USDA to reverse its decision and extend all school meal flexibilities to keep our kids from going hungry.
https://t.co/UoRdDJVXkw"
MarkWarner,1299774255379423232,2020-08-29 18:21:45,"The @USDA denied our request to extend the waivers to assist in the delivery of food to Virginia’s children during the ongoing pandemic, claiming they don’t have the authority to provide universal free meals during the crisis despite broad authority granted by Congress."
MarkWarner,1299774252212727813,2020-08-29 18:21:45,"Earlier this month, my colleagues in Congress and I called on Secretary Sonny Perdue of the @USDA to extend several waiver requests made by the Commonwealth to ensure school districts have the certainty they need to continue providing students with healthy and nutritious meals. https://t.co/FHElIHw5am"
MarkWarner,1299440186280026113,2020-08-28 20:14:17,"It’s about time that the District’s 700,000 residents get proper representation in Congress. That’s why I’ve supported a bill to make D.C. the 51st state, and I’m going to keep pushing until Virginia’s neighbors receive the same level of representation as Virginia. https://t.co/KxZxa0Pae7"
MarkWarner,1299405619485650945,2020-08-28 17:56:56,"Today marks the 57th anniversary of the #MarchOnWashington for Jobs and Freedom. The struggle we're seeing play out, as Americans of all races and walks of life take to the streets, is about common decency and how we can finally live up to the promise of our founding documents. https://t.co/9bVBZFfqZ8"
MarkWarner,1299162568175620097,2020-08-28 01:51:08,"RT @tcs_na: Thank you, @MarkWarner, for your continued support of our @TCS Ignite Innovation Challenge, our winner and your leadership in #…"
MarkWarner,1299092763347222528,2020-08-27 21:13:45,"Yes, that means the federal government should pay employers to put workers back on the payroll. Recovery is going to take time and we should get the 30 million+ Americans who’ve lost their jobs back on the payroll until it's safe to go back to work."
MarkWarner,1299092762030153733,2020-08-27 21:13:45,"We need to create a Paycheck Security Program that puts paychecks in the hands of the millions of Americans who’ve gone from holding a steady job to relying on unemployment through no fault of their own.
https://t.co/x6yePDo6wR"
