MarkWarner,1283085443945451520,2020-07-14 17:06:23,RT @JCarrollFoy: Wear a mask. Pass it on.  https://t.co/dUpiHpVXzg
MarkWarner,1282759465507467264,2020-07-13 19:31:03,"The truth is, this country needs Dr. Anthony Fauci. These attacks are unfair; we should be listening to health experts and following the science.
https://t.co/vi7soK5qc6"
MarkWarner,1282710890463350784,2020-07-13 16:18:02,"Heck, he’s getting the message.
https://t.co/Gfyo2a51zx"
MarkWarner,1281996443021123585,2020-07-11 16:59:05,"This is unprecedented; we have an administration telling the American people not to follow CDC guidelines. Folks, the CDC should not have to backtrack or be sidelined from pivotal decisions, especially during a pandemic.

This is absolutely insane.
https://t.co/VutGWUS4Ys"
MarkWarner,1281744354202329090,2020-07-11 00:17:22,"The United States was founded on the rule of law. 

It seems our president has nothing but contempt for it. https://t.co/QlNNTgFoRQ"
MarkWarner,1281651088119066627,2020-07-10 18:06:45,"Wear a mask.
 
Pass it on. https://t.co/3j9CdG69I6"
MarkWarner,1281624794165805057,2020-07-10 16:22:17,"Eliminating this backlog has been a long time coming. Thanks to increased funding from Congress and leadership from @MarkHerringVA, we got this done.
 
These kits may hold crucial evidence in bringing a perpetrator to justice. 
https://t.co/TCuZPVbncm"
MarkWarner,1281622856888090625,2020-07-10 16:14:35,"RT @LoopEmma: Acting SSCI chair @marcorubio &amp; vice chair @MarkWarner: ""[T]his Committee’s approach to [intelligence community whistleblower…"
MarkWarner,1281358294884507649,2020-07-09 22:43:18,"Americans across the country are demanding action. We need to pass the #JusticeInPolicing Act.
 
Let's stop playing political games and get it done. https://t.co/uYThG1tS4r"
MarkWarner,1281332459674771456,2020-07-09 21:00:39,"With the number of coronavirus cases increasing across much of the country, we are calling on the Trump Administration to issue new guidance to better protect the federal workforce and surrounding communities from the increasing spread of COVID-19. https://t.co/QTI6sqaopg"
MarkWarner,1281320332033437696,2020-07-09 20:12:27,No President is above the law. https://t.co/qUJSfp621u
MarkWarner,1281277581854224385,2020-07-09 17:22:35,"I’ve said it before, and I’ve said it again: President Trump should invoke the Defense Production Act to boost the domestic protection of medical gear.

https://t.co/gXSfzaGO25"
MarkWarner,1280988981468049408,2020-07-08 22:15:47,"Lt. Col. Alexander Vindman has earned the respect of this Nation; we owe him a debt of gratitude. We salute and thank you for your service, LTC Vindman. https://t.co/VMCUpnjCtb"
MarkWarner,1280962269480968192,2020-07-08 20:29:38,"Cases are surging, and we still don’t have a national testing strategy.
https://t.co/T4ZrGdYE6N"
MarkWarner,1280893519184486401,2020-07-08 15:56:27,"Outrageous. If the White House spent as much time planning a strategy to combat coronavirus as they've spent misleading Americans about it, they could have saved lives.
https://t.co/1Smtd3rEDf"
MarkWarner,1280859473591107585,2020-07-08 13:41:10,"The President has utterly failed to contain the virus, and now he's asking the Supreme Court to make the consequences as painful as possible for millions of Americans.
 
This mixture of cruelty &amp; incompetence puts the lives of countless Americans at risk.
https://t.co/80kak2UtQd"
MarkWarner,1280683543832809478,2020-07-08 02:02:05,Our students deserve better. https://t.co/1JQK0kWC3V
MarkWarner,1280653471016980480,2020-07-08 00:02:35,"How can the Trump administration believe the risks of coronavirus are extremely low when this pandemic has killed more than 130,000 Americans?

This isn't a game; lives are on the line. https://t.co/GSNa9AqsiZ"
MarkWarner,1280638886788714497,2020-07-07 23:04:38,"Any meaningful response to the coronavirus requires us to acknowledge the significant racial disparities in our country's health care system. 
https://t.co/fpt8fUmyaF"
MarkWarner,1280615857304076290,2020-07-07 21:33:07,"I’ve said it before, we shouldn’t fool ourselves into thinking that the tens of millions of Americans who’ve lost their jobs will just go back to work overnight. We should get workers back on the payroll with federally guaranteed paychecks until it is safe to go back to work."
MarkWarner,1280615856159014912,2020-07-07 21:33:07,"If we are going to prevent a long, dragged out recovery, or even another economic depression, we need bold action now to help workers who are struggling."
MarkWarner,1280615854997213184,2020-07-07 21:33:07,"Tens of millions of Americans are on unemployment and panicking about their PUC benefits ending at the end of the month. The country doesn’t need “one last boost” – what we need is a government with a long term plan.
https://t.co/uLkELWYOu4"
MarkWarner,1280602302890508288,2020-07-07 20:39:16,"If the Trump administration believes it’s safe to mail stimulus checks, SS cards &amp; checks, passports, birth certificates, and the ID used to register to vote, then why not the ballot to cast your vote? 
 
Voting by mail should be implemented nationwide. 
https://t.co/XT0DI8MRXO"
MarkWarner,1280585415091720203,2020-07-07 19:32:09,"The Paycheck Security Act I introduced alongside @SenSanders, @SenDougJones, @SenBlumenthal would help keep the economy afloat while helping businesses and their employees weather this health and economic crisis.
https://t.co/sjwuNJgQoC"
MarkWarner,1280575813025488896,2020-07-07 18:54:00,"@tearoeprice @vaemploy @VaOSIG @MarkWarnerVA @timkaine @RepRiggleman Thank you for reaching out, no one should have to experience that. Please reach out to my office so we can make every effort to assist you.
https://t.co/qqBwHkN74w"
MarkWarner,1278750025695350790,2020-07-02 17:58:58,"RT @nowthisnews: Sen. @MarkWarner’s new bipartisan bill will clean up our national parks and create 100,000 jobs using $6 billion from the…"
MarkWarner,1278076679051784197,2020-06-30 21:23:20,"A President who cared about our troops would be demanding answers about these reports of Russian bounties.
 
Why is the President so afraid to stand up to Putin and find out the truth?"
MarkWarner,1278056521432281089,2020-06-30 20:03:14,"Facebook has a white supremacist problem on its platform. I want to know what they plan to do about it.
https://t.co/XiC7bsHNUv"
MarkWarner,1278051714759827459,2020-06-30 19:44:08,"RT @AlexMillerNews: The Intelligence Community still has not released its annual Worldwide Threat Assessment.  

Senate Intel Vice Chairman…"
MarkWarner,1278001458533851137,2020-06-30 16:24:26,"I am on the Senate floor offering the FIRE Act as an amendment to NDAA after GOP leadership members demanded it be stripped it out.
 
If we can’t trust the President to report offers of foreign election interference, we need to make it the law. https://t.co/uXAUupF65H"
MarkWarner,1277995441674768385,2020-06-30 16:00:31,"Unfortunately, Republican leadership demanded that my bipartisan anti–foreign election interference bill, the FIRE Act, be stripped out of the intel authorization bill.
 
I am heading to the Senate floor to offer it as an amendment. https://t.co/RK8k5t3TB0"
MarkWarner,1277651800418631681,2020-06-29 17:15:01,It is long past time to remove the Confederate statues from the U.S. Capitol. https://t.co/8LfOxN549G
MarkWarner,1277635323435061252,2020-06-29 16:09:33,"RT @ChrisMurphyCT: Just fantastic. 

The White House believes that it's Democrats fault that they are pursuing a court case that could, in…"
MarkWarner,1277631436309266433,2020-06-29 15:54:06,SCOTUS just struck down another cynical attempt to block access to women’s reproductive healthcare. The Court was right to uphold precedent and keep politicians out of women’s personal healthcare decisions. https://t.co/jZJ9xt9H5Z
MarkWarner,1276903301628469248,2020-06-27 15:40:45,RT @julibriskman: 💚This is close to my heart.💚 I worked for @NatlParkService as a college student &amp; summer hire @GrandCanyonNPS. One of the…
MarkWarner,1276600258366246912,2020-06-26 19:36:34,Virginians for #DCStatehood! https://t.co/owykfePPJG
MarkWarner,1276565251362820096,2020-06-26 17:17:28,"The President has completely failed to contain the virus, and now he is asking the Supreme Court to make the consequences as painful as possible for millions of Americans. https://t.co/N5QNSsn921"
MarkWarner,1276529657836449792,2020-06-26 14:56:01,"The Trump administration's lawsuit would kick millions of Americans off their insurance and end protections for pre-existing conditions in the middle of a pandemic. 

This deadly mixture of cruelty and Presidential incompetence puts the lives of countless Americans at risk. https://t.co/5kQRs0e1NR"
MarkWarner,1276309034757435404,2020-06-26 00:19:21,"I’ve got a bill to fix this, which we affectionately call the “Stop Paying Dead People Act.” The Senate should pass it! https://t.co/OIs1eWFZVc"
MarkWarner,1276270221679001600,2020-06-25 21:45:07,"Tens of thousands of new COVID cases per day
 
Millions of Americans out of work (and losing their insurance)
 
And the Trump administration is trying to dismantle the Affordable Care Act with no plan for a replacement. #DroptheLawsuit https://t.co/UYMzCdp7DZ"
MarkWarner,1276206623007150080,2020-06-25 17:32:24,"This is a fitting and well-deserved honor for a great Virginian. Mary Jackson’s work at @NASA_Langley was invaluable to the space program, and I’m glad she’s finally getting the recognition she’s so long deserved. https://t.co/tTARSg9Q9D"
MarkWarner,1276129042819952643,2020-06-25 12:24:07,"RT @gmfus: Beginning at 9:00 a.m. EDT, join our discussion, ""Transatlantic Digital Policy with Democratic Values,"" featuring Margrethe @ves…"
MarkWarner,1275953224957202434,2020-06-25 00:45:29,"RT @OutFrontCNN: ""I say once again that Mr. Trump has totally got it wrong.""

Sen. @MarkWarner on the President suggesting Dems. blocked th…"
MarkWarner,1275870935837560836,2020-06-24 19:18:30,RT @Wolf_Trap: Wolf Trap applauds Senator @MarkWarner on his work on the Great American Outdoors Act. #RestoreOurParks
MarkWarner,1275861548708311046,2020-06-24 18:41:12,Outrageous. These public servants should not face financial hardship because of circumstances beyond their control. https://t.co/hUBM8msDbI
MarkWarner,1275854127424311296,2020-06-24 18:11:42,"When the President said ""slow down the testing,"" he meant it.
 
We are in the middle of a pandemic that's killed more than 120,000 Americans. 

Almost 35,000 new cases yesterday. 

This is absolutely insane. https://t.co/LS6UWXz5PU"
MarkWarner,1275838583321083908,2020-06-24 17:09:56,"I strongly encourage my Republican colleagues not to wash their hands of this issue, but to work with Democrats on a substantive process, including debate and amendments, to strengthen this bill on a bipartisan basis and assure Americans that their calls for change are heard."
MarkWarner,1275838582381596672,2020-06-24 17:09:56,"I am a sponsor of just such a proposal, the Justice in Policing Act, which would provide real transparency and accountability at the federal level to address issues of police misconduct and racial profiling."
MarkWarner,1275838581588852736,2020-06-24 17:09:56,"While I believe Sen. Scott’s proposal is sincere in its efforts, we need more meaningful and far-reaching reforms if we are going to truly address the racial injustices too many Black Americans have experienced in their interactions with police."
MarkWarner,1275838579466371072,2020-06-24 17:09:55,"Millions of Americans are raising their voices in support of real policing reforms, and the Senate must listen to their calls for bold action. 

The narrow proposal that Leader McConnell brought to the floor today falls short of that bar, so I voted against it. https://t.co/uYX7ktqKZI"
MarkWarner,1275535666173140992,2020-06-23 21:06:15,"This is a civil rights issue that is at the core of our democracy. 

The right to vote belongs to the voters, not to politicians. It’s our job to make sure Americans can exercise their rights in a way that is safe and secure."
MarkWarner,1275535665405595648,2020-06-23 21:06:15,"Whatever steps that states and localities take, we need to combat the spread of election misinformation by publicizing any changes to voting procedures months in advance of the election, in a variety of languages and formats."
MarkWarner,1275535664625389569,2020-06-23 21:06:15,"In Virginia, we have what’s called “curbside voting,” where seniors and people with disabilities can vote from their car. This is another safe and secure way for people to cast their ballots without exposing themselves to coronavirus."
MarkWarner,1275535663874682894,2020-06-23 21:06:15,"Similarly, same-day absentee ballots are another way to accommodate and expand access for qualified voters who are trying to safely exercise their right to vote."
MarkWarner,1275535663040008194,2020-06-23 21:06:15,"Let’s start with no-excuse mail-in voting. No matter what misinformation the President spreads about mail-in voting, we know it is safe and secure. 

Registered voters who determine they cannot safely go to the polls should be able to vote by mail. Period."
MarkWarner,1275535662209536000,2020-06-23 21:06:14,"At a more basic level, we just need to make it easier to vote. This is not rocket science. We already know what works because many of these policies have been used in both red and blue states for years."
MarkWarner,1275535661395836929,2020-06-23 21:06:14,"And rather than closing polling places that don’t comply, we should make sure they are accessible, that poll workers are appropriately trained, and that reasonable accommodations are made."
MarkWarner,1275535660749918208,2020-06-23 21:06:14,"Also at particular risk are Americans with disabilities. For starters, any coronavirus-related voting policies should be ADA compliant."
MarkWarner,1275535659961405442,2020-06-23 21:06:14,"We know that in almost every state, evidence suggests that Black Americans have been disproportionately affected by the virus. We must prevent COVID-19 from being used as a pretext to suppress the vote in communities of color."
MarkWarner,1275535659055362048,2020-06-23 21:06:14,"If states and localities plan to make coronavirus screening part of the voting process, those policies need strong privacy, security, and civil rights protections in place well before election day."
MarkWarner,1275535656652025863,2020-06-23 21:06:13,"We are calling on the Justice Department’s Civil Rights Division, @NASSorg, and @NASEDorg to proactively defend the right to vote and prevent policies that could suppress vulnerable and historically disenfranchised voters.
 
Here’s what we need to do: https://t.co/kfXu8XUQqY"
MarkWarner,1275535655830016005,2020-06-23 21:06:13,"From Wisconsin to Georgia to Kentucky, we are already seeing a dangerous trend of making voters choose between their safety and their right to vote.
 
Today @SenateDems on the committee responsible for elections are calling for new protections to prevent voter suppression:"
MarkWarner,1275431854020202496,2020-06-23 14:13:45,"RT @VCNVAorg: Championed by @MarkWarner, the bipartisan Great American Outdoors Act is ""the most important piece of conservation or environ…"
MarkWarner,1275431673002426372,2020-06-23 14:13:01,RT @marciaargust: Appreciated @MarkWarner showing us examples of repair needs that his #GreatAmericanOutdoors Act will help address. The bi…
MarkWarner,1275165076270600194,2020-06-22 20:33:40,"Started the day at Belle Haven Park along the GW Parkway in Alexandria, one of many @NatlParkService properties in Virginia with overdue repairs. 

Now that the Senate has passed our Great American Outdoors Act, it's time for the House to do the same so we can #RestoreOurParks. https://t.co/awUEHrI900"
MarkWarner,1274513061945237504,2020-06-21 01:22:47,"119,000 people are dead, and the President doesn’t care how many more people get sick, as long he doesn’t have to take responsibility for it. https://t.co/V0oGEuQXbr"
MarkWarner,1274441909893816320,2020-06-20 20:40:03,RT @FaceTheNation: We'll get more on @MarkWarner's take on the latest revelations out of the @TheJusticeDept on tomorrow's @FaceTheNation
MarkWarner,1274398923449413638,2020-06-20 17:49:15,"I have said this from day one: Bill Barr was hired to personally protect the President.

His actions last night make clear he is unfit to lead the Justice Department. 

He should resign."
MarkWarner,1273979906993553408,2020-06-19 14:04:13,"155 years ago today, the last enslaved African-Americans were freed. It's fitting that this year #Juneteenth falls amid an overdue moment of national reckoning about racism and injustice. It’s a time to celebrate freedom and dignity, but also to continue the work towards justice."
MarkWarner,1273763740379418624,2020-06-18 23:45:15,RT @SenCortezMasto: So many of our communities are hurting right now as we respond to the #coronavirus pandemic. I’m proud to join @MarkWar…
MarkWarner,1273763695387164672,2020-06-18 23:45:05,"RT @FortHuntHerald: The U.S. Senate passed the Great American Outdoors Act, a bill championed by Sen. @MarkWarner that would address the $1…"
MarkWarner,1273683671220879361,2020-06-18 18:27:05,"RT @BarackObama: Eight years ago this week, we protected young people who were raised as part of our American family from deportation. Toda…"
MarkWarner,1273679483913080832,2020-06-18 18:10:27,RT @AFSCME: Thank you to the senators who are working to #FundMedicaid &amp; make health care more accessible during this public health &amp; econo…
MarkWarner,1273679416778985472,2020-06-18 18:10:11,"RT @AFSCME: As states face hundreds of billions in budget shortfalls, upwards of 18 million additional people will need Medicaid. @senatema…"
MarkWarner,1273679179251429376,2020-06-18 18:09:14,"RT @VAOrganizing: Thank you, Senator @MarkWarner for working to #FundMedicaid! https://t.co/5vXeTAITkM"
MarkWarner,1273678931468713985,2020-06-18 18:08:15,"Millions of Americans have lost their insurance at the worst possible time due to COVID-19.
 
The next coronavirus relief bill must expand access to healthcare coverage before it’s too late. #FundMedicaid https://t.co/6D6GCEWMZr"
MarkWarner,1273672355857027075,2020-06-18 17:42:07,RT @AmericanHiking: YOU DID IT! Your voice was heard &amp; the Senate passed the Great American Outdoors Act! Because of you millions across th…
MarkWarner,1273672168564555778,2020-06-18 17:41:23,RT @TheTRCP: Thank you @MarkWarner and @timkaine for championing the Great American Outdoors Act. This bill is great for Virginia’s outdoor…
MarkWarner,1273639504159617025,2020-06-18 15:31:35,"RT @EnergyDems: Thank you, @MarkWarner! The Great American Outdoors Act will help us to be good stewards of our public lands while at the s…"
MarkWarner,1273619671074340864,2020-06-18 14:12:46,"These young people have known no other home but the United States. 

Now it’s official. #DREAMers are #HereToStay. https://t.co/zwhySGOQ0X"
MarkWarner,1273314562054467585,2020-06-17 18:00:23,"With the passage today of the Great American Outdoors Act, we are carrying on an American tradition of conserving our National Parks and public lands for future generations. The House should pass this job-creating bill and send it to the President’s desk. https://t.co/i62wVGnBYB"
MarkWarner,1273314317291728906,2020-06-17 17:59:24,RT @GoParks: We’re grateful for the bipartisan leaders whose commitment to our parks led to the historic vote to pass the Great American Ou…
MarkWarner,1273314308630417415,2020-06-17 17:59:22,RT @NatureBridge: It passed! Thank you to Senator @MarkWarner for spearheading this legislation to provide much-needed relief to our nation…
MarkWarner,1273282338739412992,2020-06-17 15:52:20,"The Senate is voting on bipartisan legislation I co-authored, the Great American Outdoors Act, which will make the largest investment in our National Parks and public lands in a generation. This is a jobs bill and a conservation bill. Let’s get it done. https://t.co/nuVI4aBLtu"
MarkWarner,1273270655354580992,2020-06-17 15:05:55,"Big day for our National Parks and public lands as our bipartisan Great American Outdoors Act comes up for a vote this morning.
 
With this historic conservation and jobs bill, we’re going to finally #RestoreOurParks and #FundLWCF"
MarkWarner,1273270261832441856,2020-06-17 15:04:21,RT @RTDOpinions: Editorial: Funding the backlog at national parks https://t.co/1NBnoLqOtH via @RTDOpinions @MarkWarner @ShenandoahNPS @Rich…
MarkWarner,1273264403320881152,2020-06-17 14:41:04,"RT @AnthonyAdragna: Genuine big news, folks: The Senate is about to pass the biggest conservation bill in decades. Billions toward boosting…"
MarkWarner,1272972970806435842,2020-06-16 19:23:01,"Watching this developing story with concern.  The loss of life, including as many as 20 Indian soldiers, is tragic. I urge both China and India to exercise restraint and find ways to deescalate the situation. https://t.co/uRoPs9Az02"
MarkWarner,1272944659866714112,2020-06-16 17:30:31,"RT @VirginiaLCV: .@RTDOpinions  applauds @MarkWarner's efforts to #FixOurParks and #FundLWCF through the Great American Outdoors Act.

Ther…"
MarkWarner,1272650767560847360,2020-06-15 22:02:42,RT @FixOurParksUS: The #GreatAmericanOutdoorsAct up for Senate consideration soon would address infrastructure repairs at our national park…
MarkWarner,1272571668309909505,2020-06-15 16:48:23,"Tourism to the Blue Ridge Parkway brings in over $1.4 billion to local communities along the parkway. Unfortunately, the price tag for needed repairs is now more than $500 million. We need to pass the Great American Outdoors Act and #RestoreOurParks. https://t.co/zVpmWOFHT5"
MarkWarner,1272552024266223618,2020-06-15 15:30:20,It was *always* wrong to fire a person simply for being gay or transgender. I’m so glad the Supreme Court did the right thing today. https://t.co/PSZwT4cA2S
MarkWarner,1271538515944275968,2020-06-12 20:23:00,"RT @SenatorShaheen: Congress must help Americans access the health care they need to stay healthy during this crisis. @MarkWarner, @SenDoug…"
MarkWarner,1271538030902480897,2020-06-12 20:21:05,"Four years later we remember the victims of the tragic Pulse Nightclub shooting, an act of hate against the LGBTQ community. Congress has waited far too long to act to reduce gun violence. We must #HonorThemWithAction. https://t.co/GFEo26YaVK"
MarkWarner,1271524310876815362,2020-06-12 19:26:34,"RT @ProtectOurCare: .@MarkWarner: Quiet the storm brewing in health care

https://t.co/0e79R8KwdQ"
MarkWarner,1271521538257321985,2020-06-12 19:15:33,"Coronavirus has taught us a hard lesson about over-reliance on countries like China to produce products that are important to our national security. We need to make sure key semiconductor components are produced right here in America.
https://t.co/2UrBrSPypE"
MarkWarner,1271502761654435842,2020-06-12 18:00:56,"RT @JenniferWexton: Voting by mail should be implemented nationwide. 

Pass it on."
MarkWarner,1271495016758853638,2020-06-12 17:30:09,"Voting by mail should be implemented nationwide. 

Pass it on. https://t.co/141xCzDgMC"
MarkWarner,1271488667782184961,2020-06-12 17:04:56,"We love to remind people that Virginia is for Lovers, but #LovingDay is a reminder of the fight it took to get where we are. Today we honor Virginia’s Mildred and Richard Loving, who took the Commonwealth to court in Loving v. Virginia and won a victory for equality. https://t.co/Mja4JJKaq4"
MarkWarner,1271480395650027520,2020-06-12 16:32:03,"There is a storm brewing in our healthcare system. We need to get the millions of Americans who’ve lost insurance due to coronavirus and Trump administration sabotage of the Affordable Care Act covered before it’s too late.
https://t.co/84IS7v4pey"
MarkWarner,1271084363741102080,2020-06-11 14:18:22,"RT @Covid19WarRoom: ""It's stunning to me that we have just decided it's ok for tens of thousands of Americans to die...""

The U.S. now has…"
MarkWarner,1270419018722222082,2020-06-09 18:14:31,"RT @EnergyDems: Thank you, Senator @MarkWarner ! It is so important that Congress takes action to secure the future of America’s #PublicLan…"
MarkWarner,1270387709744480259,2020-06-09 16:10:07,The Senate is on the verge of making the biggest investment in our national parks and public lands in a generation. Let’s pass the bipartisan Great American Outdoors Act and put Americans to work repairing our parks and growing the outdoor economy. https://t.co/RI50YnZhxK
MarkWarner,1270027011063525378,2020-06-08 16:16:50,RT @SenBooker: This is a moral moment in the history of our country and we must answer it with action. There is an urgent need for comprehe…
MarkWarner,1270013506931298305,2020-06-08 15:23:10,"RT @SenKamalaHarris: We just announced the first ever comprehensive police accountability and reform bill to:

- Create a national standard…"
MarkWarner,1270012414776442883,2020-06-08 15:18:50,"We can and we must take action at the federal level to help end the violence, suspicion, and systemic racism Black Americans have faced for far too long.
 
Today I am joining @CoryBooker and @SenKamalaHarris as an original cosponsor of the #JusticeInPolicing Act. https://t.co/Kh5pfZKk98"
MarkWarner,1268988564714532865,2020-06-05 19:30:25,"RT @CNBCTheExchange: President Trump plans to ask congress for more stimulus money...but what kind of stimulus is warranted now, especially…"
MarkWarner,1268934362965442562,2020-06-05 15:55:02,Just stop. https://t.co/ycl6Z66oXu
MarkWarner,1268589386846830592,2020-06-04 17:04:13,"With NIST’s announcement, it’s more important than ever that we pass the bipartisan, bicameral Internet of Things Cybersecurity Improvement Act. @SenCoryGardner @SteveDaines @SenatorHassan @RepRobinKelly @HurdOnTheHill https://t.co/z7vUZ4cLKB"
