MarkWarner,1238280969137897473,2020-03-13 01:49:23,"RT @GeoffreyStarks: Couldn't agree more. More and more schools and businesses are announcing closures this afternoon, and the telecom secto…"
MarkWarner,1238277682359676928,2020-03-13 01:36:20,RT @matthewstoller: Good job Senator @MarkWarner for getting ISPs like Comcast and AT&amp;T to act.
MarkWarner,1238258947536142338,2020-03-13 00:21:53,I appreciate @ATT &amp; @Comcast taking the responsible step &amp; suspending restrictions that could interfere with the remote technologies we’ll rely on during the #coronavirus outbreak. I hope all ISPs will do so and look for other ways to help our country get through this challenge. https://t.co/GgZ3QbHfjN
MarkWarner,1238247797746475008,2020-03-12 23:37:35,RT @ktullymcmanus: Sen. @MarkWarner  @SenSherrodBrown &amp; @SenatorDurbin are urging Congress to protect contract workers who serve the Capito…
MarkWarner,1238247747024756740,2020-03-12 23:37:23,RT @SenatorMenendez: BREAKING: @SenateDems are calling on the EU to sanction “Putin’s Chef” Prigozhin ahead of the #2020Election. Prigozhin…
MarkWarner,1238211927882584072,2020-03-12 21:15:03,Congress also needs to step up and pass bipartisan legislation like I’ve proposed to improve transparency and accountability when it comes to social media.
MarkWarner,1238211926309691394,2020-03-12 21:15:02,"None of us – the executive branch, Congress, the platform companies, or individual Americans – should grow complacent about this threat."
MarkWarner,1238211924661284870,2020-03-12 21:15:02,I’ve said for years now that it would be foolish to believe there was only the one well-publicized IRA facility in St. Petersburg. This new reporting is a reminder of the continuing threat we face from Russia and its continuing efforts to divide and manipulate us on social media. https://t.co/WuzDedxNMc
MarkWarner,1238208457070784512,2020-03-12 21:01:15,"#COVID19 is already creating an unprecedented need for teleworking, telehealth, and online education technology.
 
ISPs should suspend data caps and overage fees that present a barrier to the telepresence services we’ll need to rely on during the #coronavirus outbreak. https://t.co/u6Zr0TP96K"
MarkWarner,1238190608893849601,2020-03-12 19:50:20,"It is so important that we all educate ourselves about #coronavirus. Take a few minutes to look at the @CDCgov’s https://t.co/1W6DNMbGoA page, give yourself a refresh on proper hand-washing, and make sure you know how to protect yourself and your family from #COVID19."
MarkWarner,1238165310546509824,2020-03-12 18:09:48,Proud to receive a 100% rating from @LCVoters and stand with @VirginiaLCV members in fighting to preserve our natural heritage for future generations. https://t.co/ycr3tk7BEX
MarkWarner,1238128817161584651,2020-03-12 15:44:47,Testing for #COVID19 should be free.
MarkWarner,1238125437592776704,2020-03-12 15:31:22,"RT @OpptyatWork: Senator @MarkWarner references the story of two janitors, and how our system is failing STARs like them from the @nytimes.…"
MarkWarner,1238119003077345280,2020-03-12 15:05:48,"We need to make sure our prisons are ready to protect staff, inmates, guards, and visitors from coronavirus. I sent a letter this week to the Bureau of Prisons to make sure Virginia’s correctional facilities are prepared.
https://t.co/58vfNP9lRa"
MarkWarner,1238118210337230849,2020-03-12 15:02:39,"RT @OpptyatWork: IN 20 MINUTES, at 11AM ET: Don't miss our ""Reach for the STARs"" launch with @Accenture! 

We will be joined by Sen. Mark W…"
MarkWarner,1237882005640994818,2020-03-11 23:24:03,Amen. Let’s get the bipartisan Great American Outdoors Act to the President's desk so we can #RestoreOurParks and #FundLWCF https://t.co/3FvrcaGOpa
MarkWarner,1237858432146747392,2020-03-11 21:50:23,"People need to be able to trust the information they’re receiving on the coronavirus. With mixed messages from the President compounding misinformation circulating online, we risk sowing confusion. 

I’m calling on @VP to correct the record and combat misinformation. https://t.co/mM9yYK1jxj"
MarkWarner,1237786131032412161,2020-03-11 17:03:05,"A one-size-fits-all stimulus is not what we need in the early stages of this outbreak.

Today I'm leading 34 @SenateDems in calling for *targeted* economic stimulus focused on helping the working Americans and their families most harmed by the coronavirus outbreak. https://t.co/kTjWjC3YvC"
MarkWarner,1237775593099460614,2020-03-11 16:21:12,"RT @VirginiaLCV: Big news in the effort to #FundLWCF and boost national parks with a huge, bipartisan bill gaining steam in the Senate. Tha…"
MarkWarner,1237450691913842691,2020-03-10 18:50:10,"This just makes no sense, and don’t get me started on the environmental impact.
 
I just sent a letter to @SecElaineChao &amp; @SecPompeo calling on the administration to work with our European allies to figure out an exemption while we deal with the coronavirus outbreak. https://t.co/49g0fPgA78"
MarkWarner,1237443084952240128,2020-03-10 18:19:56,RT @IBMpolicy: #IBM applauds @MarkWarner &amp; @SenatorBurr for introducing the USA Telecommunications Act that would put the US and internatio…
MarkWarner,1237429908244180993,2020-03-10 17:27:35,"I’m proud to help introduce the bipartisan Great American Outdoors Act, which combines my #RestoreOurParks Act with legislation to #FundLWCF.
 
Together we are going to make major overdue investments in conservation, public lands, and our national parks. https://t.co/uiCfoKmUOM"
MarkWarner,1237413950364495872,2020-03-10 16:24:10,RT @ProtectOurCare: MUST WATCH: President @BarackObama marks the tenth anniversary of the passage of the Affordable Care Act and calls on t…
MarkWarner,1237398268260253696,2020-03-10 15:21:51,"If we’re going to do coronavirus tax relief, it can’t just be about shoring up companies’ bottom line. We’ve got to help workers who’ve been furloughed, lost their jobs, or had their hours cut. We’ve got to look out for gig workers and others who don’t have paid leave. https://t.co/y4NYbQInjH"
MarkWarner,1237140370133323782,2020-03-09 22:17:03,"Coronavirus is underscoring how vulnerable some American workers are without access to a safety net. 

This crisis is demonstrating why we need a portable benefits system for gig workers, independent contractors, and other contingent workers. https://t.co/pO2zWjUkeZ"
MarkWarner,1237122281769500677,2020-03-09 21:05:11,"This morning I led @SenateDems on the Banking Committee in calling on bank regulators to prepare for the likely impacts of the coronavirus and take steps to protect consumers who may suffer financially as a result of a coronavirus outbreak.

I’m glad to see them taking action. https://t.co/Buglq8AS6l"
MarkWarner,1237118775482290178,2020-03-09 20:51:15,"Lots of industries are going to take a hit, so let’s be clear upfront: any coronavirus stimulus must be targeted to provide relief to working Americans.
 
Tax cuts aren’t enough unless we know the benefits will flow directly to the workers who need it most. https://t.co/2n6VybPw96"
MarkWarner,1237084910332055555,2020-03-09 18:36:41,RT @Zachary: .@MarkWarner and other Senate Dems sent letters to bank trade groups and regulators pressing them to help consumers impacted b…
MarkWarner,1237042023057809408,2020-03-09 15:46:16,"Over the weekend, @Lyft announced it would compensate drivers being quarantined or treated for coronavirus. I’m hopeful other gig worker platforms I wrote to on Friday will soon follow suit. https://t.co/KpMgCpxGDd"
MarkWarner,1236474047715737603,2020-03-08 02:09:20,.@timkaine and I are carefully monitoring the coronavirus case announced in Virginia today. We are committed to doing everything we can to make sure the Commonwealth is getting the federal support it needs to respond. Visit https://t.co/vueKoQN9zC for updates and information.
MarkWarner,1236366002105049088,2020-03-07 19:00:00,"RT @bradyqg: As more folks move to gig work it’s important to note that the “flexibility” comes at a price. No insurance, no paid days off.…"
MarkWarner,1236361934812975106,2020-03-07 18:43:50,I'm glad to see @Uber quickly making sure gig workers using its platform don't have to choose between their financial stability and following public health instructions related to coronavirus. I hope other platforms will do the same ASAP. https://t.co/BIW9h1iQGE
MarkWarner,1236086030010396672,2020-03-07 00:27:29,RT @JMBooyah: Full story: In response to a letter from Sen. @markwarner Uber says it’s exploring “compensation for drivers who have been qu…
MarkWarner,1236058321465024513,2020-03-06 22:37:23,"Military families at Fort Lee and around the country deserve to live in safe housing. Period. In order to fix this broken system, the Pentagon must fundamentally change the way it does business with private housing contractors.  

My @RTDNews op-ed: https://t.co/qkv6CSj2kq"
MarkWarner,1236014819469377541,2020-03-06 19:44:31,"RT @JMBooyah: Today Sen. @MarkWarner sent letters to @Uber, @Lyft, @Postmates, @Instacart, @Grubhub &amp; others asking them to consider creati…"
MarkWarner,1235972220054376449,2020-03-06 16:55:15,I appreciate @Microsoft’s leadership in ensuring that its hourly workers won’t face financial hardship because of steps to combat the spread of coronavirus. I hope more companies will follow their lead and make sure workers aren’t penalized for following public health directions. https://t.co/25Gp8Jkeft
MarkWarner,1235967492058763264,2020-03-06 16:36:27,RT @BrockVergakis: U.S. Senators @MarkWarner and @timkaine call on @VAChamber members not to punish employees for following @CDCgov guidanc…
MarkWarner,1235697780636565504,2020-03-05 22:44:43,"Congratulations to Alex, a young Virginian who was chosen among more than 28,000 other students to name the next Mars rover. Keep shooting for the stars! https://t.co/tMRjjVlG0v"
MarkWarner,1235687639069704197,2020-03-05 22:04:25,"Workers should not be penalized for following public health instructions during the coronavirus outbreak. 

My letter to business leaders: https://t.co/8FaKsvBYfH"
MarkWarner,1235675922277285888,2020-03-05 21:17:52,"Also huge kudos to the journalists and researchers who continue to detect these kinds of abuses through the political ad archive. While I’m glad Facebook created the archive in compliance with my #HonestAds Act, it has a lot more work to do on this front."
MarkWarner,1235675919945207808,2020-03-05 21:17:51,"The Trump campaign's bogus ""official census"" Facebook ads are deceptive and undermine public confidence in the census process. 

I’m glad Facebook heeded calls by @vanitaguptaCR and @juddlegum to take them down. https://t.co/eZ6cZdRrsS"
MarkWarner,1235672626204377089,2020-03-05 21:04:46,"RT @thesullivan: Another cool Q&amp;A, this time a lively chat with Senator @MarkWarner &gt;&gt; The 21st century’s wars will be fought with misinfor…"
MarkWarner,1235314685286723584,2020-03-04 21:22:26,"RT @GoParks: We appreciate @SenRobPortman, @SenAlexander, @SenAngusKing, and @MarkWarner, for their longtime leadership to move the Restore…"
MarkWarner,1235285568554250240,2020-03-04 19:26:44,"This $7.8 billion package will make sure the United States has the resources we need to respond to coronavirus. 

In the meantime, it’s on all of us to wash our hands, and follow @CDCgov directions to prevent the virus from spreading."
MarkWarner,1235285567094558725,2020-03-04 19:26:44,"I’m glad that we were able to reach a bipartisan deal that was significantly stronger than the original $1.25 billion package the Trump administration requested, and that the legislation preserves crucial CDC funding that the administration has repeatedly tried to slash."
MarkWarner,1235285565630828546,2020-03-04 19:26:43,"The legislation also includes additional funding for first responder training, additional beds, and another $100 million for community health centers."
MarkWarner,1235285564183785472,2020-03-04 19:26:43,"Fifth, the bill includes language based on my CONNECT for Health Act, which reduces restrictions on the use of telehealth for public health emergency response, as well as $500 million for implementation."
MarkWarner,1235285562728292352,2020-03-04 19:26:43,"Fourth, I made sure that the federal government will reimburse states like Virginia for the preparations they’ve already made for the virus."
MarkWarner,1235285561742589953,2020-03-04 19:26:43,"Third, I fought for an additional $500M to get the masks, equipment, medication, and other supplies our local hospitals need to be prepared. This will allow @HHSGov to buy these supplies in bulk and distribute them to local providers who need them."
MarkWarner,1235285560748658688,2020-03-04 19:26:42,"Second, I helped secure an additional $350 million fund for “hot spots.” We are fortunate that there has not been an outbreak in Virginia, but hot spot funding will let us apply for additional money if one does occur."
MarkWarner,1235285559276380160,2020-03-04 19:26:42,"That funding can be used for everything from infection control, lab testing, and surveillance for coronavirus, to contact tracing, mitigation in areas with person-to-person transmission, and other public health preparedness and response activities."
MarkWarner,1235285558303354881,2020-03-04 19:26:42,"First, I called for every state to get an immediate surge of cash – Virginia will get a total of $13.3 million. This money will come from @CDCgov and go directly to the Commonwealth’s COVID-19 response through a funding formula."
MarkWarner,1235285556835340290,2020-03-04 19:26:41,"With the threat of COVID-19 Coronavirus growing, I’m relieved the President has agreed to both increased federal funding that I fought for, as well as separate funding for state and local response. 

Here are the Virginia priorities I fought to include in this legislation: https://t.co/SQpAENJKb3"
MarkWarner,1235231317551390720,2020-03-04 15:51:10,"I just sent a letter with @TimKaine urging @VP, @GovernorVA, and state and federal health agencies to waive costs that may prevent Coronavirus patients from seeking diagnosis and treatment.
 
We can’t let healthcare costs get in the way of the medical care people need. https://t.co/c9ni54EiFd"
MarkWarner,1235211455118667779,2020-03-04 14:32:14,"RT @SenAlexander: Thank you, Senator @MarkWarner, for your leadership alongside @SenRobPortman and @SenAngusKing. 

Let’s get the #RestoreO…"
MarkWarner,1235008175616798720,2020-03-04 01:04:29,"If the President is talking about the #RestoreOurParks Act that I’ve been working on for years with @SenRobPortman, @SenAlexander, and @SenAngusKing, then let’s do it. Proud to have bipartisan support for rebuilding America’s national parks. https://t.co/vuwiZCnovY"
MarkWarner,1234614996383993856,2020-03-02 23:02:07,Thankful for every classroom that participated in #ReadAcrossAmerica today – especially those that invited my staff to come out and share a story with young Virginians. https://t.co/XeocPRZusm
MarkWarner,1234528133648408576,2020-03-02 17:16:58,"The President continues to claim he supports protecting people with preexisting conditions, yet he continues to pursue a lawsuit that will rip protections away from millions of Americans. 
https://t.co/EOGfA9m3N2"
MarkWarner,1233533983419437058,2020-02-28 23:26:34,"The last time this nomination was unsuccessfully put forward, serious bipartisan questions were raised about Rep. Ratcliffe’s background and qualifications. 

It’s hard for me to see how anything new has happened to change that. https://t.co/c576JHXcR8"
MarkWarner,1233498706252619778,2020-02-28 21:06:23,"Good conversation in Ashburn @Equinix with data center leaders from across Loudoun County. It’s a growing industry with tons of potential — not only in NoVa, but for local economies across Virginia. https://t.co/54XmH70gNO"
MarkWarner,1233167174665228288,2020-02-27 23:09:00,Looking forward to seeing friends from Virginia and around the country next week at the @AIPAC Policy Conference.
MarkWarner,1233156953305690114,2020-02-27 22:28:23,"For the first time in our history, Congress passed legislation to make lynching a federal hate crime. I applaud my colleagues @SenKamalaHarris, @SenatorTimScott &amp; @CoryBooker for seeing this bill through the Senate last year, and I look forward to seeing it get signed into law. https://t.co/4A6408pJfo"
MarkWarner,1233139029371244545,2020-02-27 21:17:09,"When it comes to the #Coronavirus, my priority is making sure that officials in Virginia have the resources they need to adequately respond to any potential cases in the Commonwealth. In the meantime, I encourage every Virginian to heed @CDCgov warnings and advisories. https://t.co/j44GRiZNWn"
MarkWarner,1233107531674705920,2020-02-27 19:12:00,"The truth is – an overwhelming majority of Americans support background checks for gun sales. And one full year after House passage of #HR8, it’s long past time to bring this commonsense bill up for a Senate vote. #BackgroundChecksSaveLives"
MarkWarner,1232796486972461056,2020-02-26 22:36:01,"Finally, some good news for military families facing mold and other dangerous conditions in on-base housing. I appreciate the Pentagon releasing a Tenant Bill of Rights and look forward to DoD implementing my Ensuring Safe Housing for our Military Act ASAP. https://t.co/r1mdpchyBJ"
MarkWarner,1232707464639975426,2020-02-26 16:42:16,"If the leaders of our nation's intelligence community are focused on personal loyalty to the President, not keeping Americans safe, we are heading into dangerous territory. https://t.co/j76TiJIr0c"
MarkWarner,1232439402783105024,2020-02-25 22:57:05,RT @bluevirginia: Video: Sen. @MarkWarner Urges Increased Federal Investment in WMATA https://t.co/FVjXy8AuyR via @bluevirginia
MarkWarner,1232396061991415810,2020-02-25 20:04:52,"RT @NAACP_LDF: The #FIREAct also sits in the Senate. Sponsored by @MarkWarner, this bill would create a compliance system that ensures all…"
MarkWarner,1232383395503759360,2020-02-25 19:14:32,Congratulations and welcome @geewash! I’m looking forward to working with you to support the great work happening at @GeorgeMasonU. https://t.co/W8vQGRlkOD
MarkWarner,1232091021875515392,2020-02-24 23:52:45,"The #AshantiAlert Act is already saving lives in Virginia.
 
It’s way past time for the Trump administration to follow the law and implement this life-saving alert system for missing adults nationwide. https://t.co/8hjctrusKQ"
MarkWarner,1232031107136282626,2020-02-24 19:54:40,"Remember when Senate Republicans voted down my resolution to stop junk plans?
 
Remember when the President said pre-existing conditions would be protected?
 
Tell that to the guy getting charged out the wazoo unless he can prove the flu isn’t a pre-existing condition. https://t.co/t3yevNPY5z"
MarkWarner,1231979351882727424,2020-02-24 16:29:01,"The @VirginianPilot &amp; @DailyPress editorial boards are right:
 
“Virginia’s Ashanti Alert system is working to help other adults in peril. The national system should be working too. There’s no excuse for further delay.”"
MarkWarner,1231979350377062401,2020-02-24 16:29:00,"The outrageous thing is not just that the DOJ is ignoring the law I helped get through the Senate *more than a year ago.*

They’re is also ignoring legislation I wrote and the President signed requiring this system to be implemented by next month."
MarkWarner,1231979348909084675,2020-02-24 16:29:00,"Every day the Trump Administration drags its feet and ignores the law we passed is a day without this life-saving alert system for missing adults.
 
No more delays or excuses, it’s time to implement the #AshantiAlert Act.
https://t.co/kHSs8FvEsp"
MarkWarner,1231953563334725632,2020-02-24 14:46:32,"I'm mourning the loss of Katherine Johnson, who passed away today at the age of 101. I'm so glad she lived to see the recognition that she and her fellow @NASA_Langley ""Hidden Figures"" so rightly deserved for their important work on the space program. https://t.co/69sL4UJqLP"
MarkWarner,1230990386757349382,2020-02-21 22:59:13,Really appreciate Mayor Parham welcoming me to @PetersburgV this afternoon. Great to see the courthouse and stop by @saucysbbq on the way to Fort Lee. https://t.co/GoOZ38J4OK
MarkWarner,1230981356454371328,2020-02-21 22:23:20,"It was great to be back at @Norfolkstate for a student town hall with @BobbyScott, talking college affordability, the fight to save crucial HBCU funding, and anything else students wanted to ask us about. https://t.co/BCCC16GSZe"
MarkWarner,1230926817156108288,2020-02-21 18:46:37,"RT @Alex8news: HAPPENING NOW: ""There’s still a lot of work to be done""

As the country struggles with poor conditions in military housing,…"
MarkWarner,1230895909120114689,2020-02-21 16:43:48,Political ads should be held to the same level of transparency whether they’re aired on live TV or through an online steaming service. We need to defend the integrity of our democracy and pass the bipartisan #HonestAds Act. https://t.co/HnpnwOj9p6
MarkWarner,1230888210194141184,2020-02-21 16:13:12,RT @PortofVirginia: We appreciate and are honored by your support which ensures that #VirginiaDeliversProsperity !
MarkWarner,1230866479274512385,2020-02-21 14:46:51,"RT @BobbyScott: Joined Sen. Warner, Dinner Co-Chairs Ashby Kilgore &amp; Joni Ivey, and @inclusiveva CEO Jonathan Zur (pic 1) in congratulating…"
MarkWarner,1230639370711060482,2020-02-20 23:44:24,RT @iava: UPDATE: VA Senator @MarkWarner introduces the Improve Well-being for Veterans Act that would provide money for local and state le…
MarkWarner,1230611386000199680,2020-02-20 21:53:12,"Started the day in Portsmouth at the @PortofVirginia. I'm working hard to get more federal funding to deepen the port, so it can support more jobs and economic growth across Virginia. https://t.co/bSUvqeKGpV"
MarkWarner,1230493004932186114,2020-02-20 14:02:48,RT @Norfolkstate: .@MarkWarner will be at Norfolk State University today for a town hall meeting. Join us in the Dorothy B. Brothers Audito…
MarkWarner,1230292835154452480,2020-02-20 00:47:24,"As Vice Chairman of the Senate Intel Committee, I remain committed to robust, bipartisan oversight of the intelligence community, up to and including the DNI, and ensuring that the work of our intelligence professionals is never interfered with or manipulated for political ends."
MarkWarner,1230292834139430914,2020-02-20 00:47:24,"And at a time when the integrity and independence of the DOJ has been called into grave question, our country needs a Senate-confirmed intelligence director who will provide the best intelligence and analysis, regardless of whether or not it’s expedient for the President."
MarkWarner,1230292832994328577,2020-02-20 00:47:23,The intelligence community deserves stability and an experienced individual to lead them in a time of massive national and global security challenges.
MarkWarner,1230292831752925185,2020-02-20 00:47:23,"This is the 2nd acting director the President has named since Dan Coats' resignation, apparently in an effort to sidestep the Senate’s constitutional authority to advise &amp; consent on such critical positions, and flouting the clear intent of Congress when it established the ODNI."
MarkWarner,1230292828816920577,2020-02-20 00:47:22,It appears the President has selected an individual *without any intelligence experience* to serve as the leader of the nation’s intelligence community in an acting capacity... https://t.co/Yvq5UVSPpA
MarkWarner,1228073120113872896,2020-02-13 21:47:02,"History being made on the DC Court of Appeals. Congratulations, Judge Srinivasan!
https://t.co/18KXOiWm1Z"
MarkWarner,1228066423722958875,2020-02-13 21:20:26,"The President recently signed my military housing reform legislation into law, but I’m keeping up the pressure and working with military family advocates until our service members get the safe housing they deserve. https://t.co/ZXvJAEtjvi"
MarkWarner,1228036263292416000,2020-02-13 19:20:35,.@TimKaine was not afraid to take on President Obama or President Trump to reassert Congress' constitutional role in deciding when we send our troops to war. I could not be prouder of him for leading the Senate in passing his bipartisan war powers resolution today.
MarkWarner,1227994311784062977,2020-02-13 16:33:53,"Earlier this year, @vademocrats made Virginia the final state needed to ratify the ERA – and today, the House voted to remove the ERA's arbitrary deadline. Now it's up to Senate to act.

Let's vote to guarantee full and equal protection for women under the Constitution. #ERANow"
MarkWarner,1227724241585483777,2020-02-12 22:40:43,".@stevenmnuchin1 and I don't always agree, but I'm proud of the bipartisan momentum building for the ILLICIT CASH Act, which will finally crack down on the anonymous shell companies used by human traffickers, terrorists, money launderers, and other criminals. https://t.co/ZiDzU2u0ZY"
MarkWarner,1227608547724103680,2020-02-12 15:01:00,"This #BlackHistoryMonth I’d like to highlight a few remarkable individuals who've been forces for good in Virginia. The first is Virginia Randolph, a Henrico County educator who championed industrial skills training in the early 1900's for students in segregated public schools. https://t.co/igksgapyb1"
MarkWarner,1227351304722419712,2020-02-11 21:58:48,"I can't believe I have to say this, but the President of the United States has no business interfering in the criminal trial of his own campaign adviser. 
 
The Justice Department owes the court and the American people an explanation of exactly what is happening here. https://t.co/z1RCeHiWrL"
MarkWarner,1227349329721032704,2020-02-11 21:50:57,"RT @iava: Virginia Senator @MarkWarner's bill aims to reduce high rates of veteran suicides. https://t.co/mAit5AOR5V

""His proposal aims to…"
