RepAdrianSmith,1234869518738100224,2020-03-03 15:53:30,"I am excited to relaunch the #GoodLifeShowcase and see the beauty of rural Nebraska as captured by Nebraskans. Please submit an original photo of #NE03 with your name, location and a brief description to TheGoodLifeShowcase@mail.house.gov. More info here: https://t.co/GVE1x5ammG https://t.co/ukZ6wBJUVN"
RepAdrianSmith,1234824627882528769,2020-03-03 12:55:07,"My staff will host Mobile Offices in Bassett, Harrisburg, Hastings, and Ainsworth today. Please stop by if you need help with FEMA, USDA, FSA, VA, Medicare, or other federal agencies, or have thoughts to share. #NE03 https://t.co/uelCSw8FF8"
RepAdrianSmith,1234501746719961090,2020-03-02 15:32:07,Because timeliness is key in fights against infectious diseases like #coronovirus we must come up with a bipartisan solution as soon as possible. I thank @realDonaldTrump for his quick action in this fight. My column here: https://t.co/vlIuuF04MN
RepAdrianSmith,1233434156786495493,2020-02-28 16:49:53,Today I recognized Gering-Scottsbluff for being named a Top Western Town by @TrueWestMag – an honor well deserved! Watch my remarks here: https://t.co/Yl7NcD4UKC
RepAdrianSmith,1233399302715777024,2020-02-28 14:31:23,Enjoyed meeting with Members of the Kenyan Parliament this week. #Kenya represents an opportunity for the United States to start building on AGOA by developing first-rate trade agreements with African nations. https://t.co/LMdKDnCsd6
RepAdrianSmith,1233166036255543296,2020-02-27 23:04:28,"At today’s @WaysandMeansGOP hearing, I asked @SecAzar about the administration’s response to the #coronavirus and discussed the key role @unmc plays in efforts to combat this virus. Watch my remarks here: https://t.co/M389gYeDsz"
RepAdrianSmith,1232661608310222848,2020-02-26 13:40:03,"My staff will host a Mobile Office in Brewster today. Please stop by if you need help with FEMA, USDA, FSA, VA, Medicare, or other federal agencies, or have thoughts to share. #NE03 https://t.co/43wC0fb2dD"
RepAdrianSmith,1232394634216824838,2020-02-25 19:59:12,My office provides opportunities for the youth in our community to gain valuable experience and skills for the future. My column here: https://t.co/XVoHg8DQo6
RepAdrianSmith,1232301182732972033,2020-02-25 13:47:51,"My staff will host Mobile Offices in Fullerton and Bridgeport today. Please stop by if you need help with FEMA, USDA, FSA, VA, Medicare, or other federal agencies, or have thoughts to share. #NE03 https://t.co/hFhSxasZCW"
RepAdrianSmith,1232010411081375745,2020-02-24 18:32:26,"My website, like most congressional websites, is currently down and we are currently looking into it. No timetable yet but hopefully will be back up and running soon – thank you for your patience!"
RepAdrianSmith,1231930603739787264,2020-02-24 13:15:18,"My staff will host Caseworker in your Community events in McCook and Franklin today. If you need help with the VA, Social Security, Medicare, USCIS, IRS, FEMA, other federal agencies, or just have thoughts to share, please stop by. #NE03 https://t.co/pskc91uSLE"
RepAdrianSmith,1230922115139821568,2020-02-21 18:27:56,Appreciated the opportunity to visit with @pawneeschool juniors and seniors yesterday. #NE03 https://t.co/BWRJ6hMyGe
RepAdrianSmith,1230853323248590850,2020-02-21 13:54:35,Thanks to Beatrice community leaders for the tour and update on the rehabilitation of the 100+ year old Beatrice Merchantile Building and the progress of the Stone Hollow Brewing Company. #NE03 https://t.co/AeIP9t5LPL
RepAdrianSmith,1230577641389993985,2020-02-20 19:39:07,Enjoyed discussing small business issues with Plymouth Custom Woodworking this morning. #NE03 https://t.co/nm92OvEKdx
RepAdrianSmith,1230554368358916096,2020-02-20 18:06:38,Great turnout and conversation coffee with the Crete Area Chamber of Commerece. #NE03 https://t.co/Nh11TH3X4W
RepAdrianSmith,1230499185687977984,2020-02-20 14:27:22,Best wishes to Jane Monnich who is retiring after 45 years from @KLINRadio ! It was great to work with Jane over the years and I wish her and her husband well in their next chapter.
RepAdrianSmith,1230237950257983488,2020-02-19 21:09:18,Great meeting with @LexSchools administrators and students yesterday. #NE03 https://t.co/F5YQQA8MUo
RepAdrianSmith,1230168600926916609,2020-02-19 16:33:44,Engaging conversation at the @CozadChamber coffee yesterday. Many thanks to those who attended. #NE03 https://t.co/GD4ntl2WBK
RepAdrianSmith,1229887933848662017,2020-02-18 21:58:28,"Agriculture is the number one U.S. trade constituency, and any trade deal with the EU and the UK must include it. My Op-Ed with @RodneyDavis here: https://t.co/gJ8HlAgmOp"
RepAdrianSmith,1229851643501408256,2020-02-18 19:34:16,Thanks to the leadership and staff of @GPHealthcare for an in-depth visit and tour this morning. #NE03 https://t.co/DSxEkUcJ6u
RepAdrianSmith,1229824106574512130,2020-02-18 17:44:50,"Great turnout and productive conversation at this morning’s Mobile Office at @MPCCedu, South Campus in North Platte. #NE03 https://t.co/Lp5jUTYT9p"
RepAdrianSmith,1229809072683143169,2020-02-18 16:45:06,"To maintain the integrity of our Constitution, we must be careful to adhere to it. My column here: https://t.co/8UchuKCKb3"
RepAdrianSmith,1229755510599098369,2020-02-18 13:12:16,I’ll be at @MPCCedu in North Platte this morning to meet constituents. Feel free to drop by from 10:00 AM – 11:00 AM CST. #NE03 https://t.co/Uuq48PhhAl
RepAdrianSmith,1228009504073187328,2020-02-13 17:34:15,"Yesterday, I met with Nebraskans from the @RuralHealth Association where we discussed the challenges facing rural hospitals. https://t.co/VxCfnwDXv8"
RepAdrianSmith,1227706134452146177,2020-02-12 21:28:46,"We want US companies to do business across as many countries as possible, not target profits solely into tax havens. TCJA was written to accomplish that goal, and Treasury regs got it right. My remarks from yesterday’s @WaysandMeansGOP hearing here: https://t.co/e5hS3lbeBV"
RepAdrianSmith,1227590970021044224,2020-02-12 13:51:09,"My staff will host Mobile Offices in Ogallala and Taylor today. Please stop by if you need help with FEMA, USDA, FSA, VA, Medicare, or other federal agencies, or have thoughts to share. #NE03 https://t.co/WCxYmZoOAi"
RepAdrianSmith,1227233770559987712,2020-02-11 14:11:46,"While we faced our share of challenges over the past year in Nebraska, I agree with the President’s assessment at the State of the Union that “America’s future is blazing bright.” My column here: https://t.co/afv3trZxkE"
RepAdrianSmith,1227224289302253570,2020-02-11 13:34:05,"My staff will host Mobile Offices in Valentine, Imperial, and Tryon today. Please stop by if you need help with FEMA, USDA, FSA, VA, Medicare, or other federal agencies, or have thoughts to share. #NE03 https://t.co/hygxK7WAcJ"
RepAdrianSmith,1226991170343055361,2020-02-10 22:07:46,This afternoon the House passed the Protecting America's Food &amp; Agriculture Act. I cosponsored this bill because the U.S. needs more ag customs inspectors to maintain our high standards by protecting our nation’s livestock from destructive diseases like African Swine Fever.
RepAdrianSmith,1226869000233078786,2020-02-10 14:02:18,"My staff will host a Mobile Office in North Platte today. Please stop by if you have thoughts to share or need help with federal agencies like FEMA, USDA, FSA, VA, or Medicare. #NE03 https://t.co/bKsVckjtop"
RepAdrianSmith,1226161298427215878,2020-02-08 15:10:09,I have to agree – great news for Scottsbluff/Gering! https://t.co/FpIi2LZIgu
RepAdrianSmith,1225407354079993856,2020-02-06 13:14:14,"My staff will host a Mobile Office in Mullen today. Please stop by if you have thoughts to share or need help with federal agencies like FEMA, USDA, FSA, VA, or Medicare. #NE03 https://t.co/Umq8HarxJf"
RepAdrianSmith,1225141650739154950,2020-02-05 19:38:26,Great turnout for the first #NebraskaBreakfast of the year! We are now in the 77th consecutive year of the oldest tradition of its kind on Capitol Hill. https://t.co/yOPGUknEwK
RepAdrianSmith,1224902991658016769,2020-02-05 03:50:05,In tonight’s #SOTU the President presented an optimistic agenda to continue growing economic opportunity for all Americans. My statement here: https://t.co/UDckBPAfBS
RepAdrianSmith,1224794715926794240,2020-02-04 20:39:50,Yesterday @RepGwenMoore and I introduced a bill to ensure guarantee insurance on municipal bonds remains available to states and localities while leaving intact strong anti-abuse language from TCJA which prevents foreign tax shelters from pretending to be insurance companies.
RepAdrianSmith,1224695385245061120,2020-02-04 14:05:08,"My staff will host a Mobile Office in Chappell today. Please stop by if you need help with FEMA, USDA, FSA, VA, Medicare, or other federal agencies or have thoughts to share. #NE03 https://t.co/dV6de5shqS"
RepAdrianSmith,1224423172335964160,2020-02-03 20:03:27,"Innovation is key to improving health care, but testing new care models without oversight or transparency can hurt patients and providers. To fix this Rep. Terri Sewell and I have introduced a bill providing commonsense guardrails for CMMI. Read more here: https://t.co/PCha74yNOo"
RepAdrianSmith,1224385458513334274,2020-02-03 17:33:35,"Even with revenue at record highs, the primary focus of the Ways and Means majority continues to be raising taxes to pay for even more spending. My column here: https://t.co/n9o3sg1tfR"
RepAdrianSmith,1224337936105250820,2020-02-03 14:24:45,"My staff will host a Mobile Office in Sidney today. Please stop by if you need help with FEMA, USDA, FSA, VA, Medicare, or other federal agencies, or have thoughts to share. #NE03 https://t.co/AlPctKnFv5"
RepAdrianSmith,1222996850556514304,2020-01-30 21:35:46,I joined my colleagues on the #BiofuelsCaucus in writing @SecretarySonny to support the new Higher Blends Infrastructure Incentive Program. Further investment in biofuels gives consumers more choices at the pump!
RepAdrianSmith,1222647444854517761,2020-01-29 22:27:21,"Yesterday I met with Col. John Hudson, U.S. Corps of Engineers Omaha District Commander. He provided an update on current repair and rehab efforts, and provided information which will be useful as I work with state and local officials to address our river management challenges. https://t.co/NteL3vQtDs"
RepAdrianSmith,1222582640060129284,2020-01-29 18:09:50,RT @SenatorFischer: So great to join @RepAdrianSmith and many others from Team Nebraska at the @WhiteHouse for the signing of the #USMCA!…
RepAdrianSmith,1222582321112649728,2020-01-29 18:08:34,The signing of #USMCA is a major win for the United States. Thank you @POTUS for the invitation to the White House for this momentous occasion and for all of your hard work. My statement here: https://t.co/XU3jIbZoDy
RepAdrianSmith,1222511432694145025,2020-01-29 13:26:53,"My staff will host a Mobile Office in Beatrice this morning. Please stop by If you need help with FEMA, USDA, FSA, VA, CMS, or other federal agencies, or have thoughts to share. #NE03 https://t.co/2OkkLu9Ok1"
RepAdrianSmith,1222227392330129409,2020-01-28 18:38:12,"RT @usdaRD: ❗️❗️❗️❗️

Mark Your Calendars, USDA to Open the Application Window for the Second Round of ReConnect Program Funding Friday: ht…"
RepAdrianSmith,1222143635396816896,2020-01-28 13:05:23,"My staff will host a Mobile Office in St. Paul and Rushville today. Please stop by If you need help with FEMA, USDA, FSA, VA, CMS, or other federal agencies, or have thoughts to share. #NE03 https://t.co/qU0CO8j2hY"
RepAdrianSmith,1221884816225980416,2020-01-27 19:56:56,"RT @NTVsGrow: We dive into trade as President Trump celebrates several wins. We have the president's remarks, and hear from @RepAdrianSmith…"
RepAdrianSmith,1221884186308595712,2020-01-27 19:54:26,"Every year on the anniversary of Roe v. Wade, people travel to Washington, D.C. from all over the United States to demonstrate peacefully on behalf of the unborn, showing the spirit to defend life has never diminished in our country. My column here: https://t.co/oe5pFmWgZE"
RepAdrianSmith,1220718914163892224,2020-01-24 14:44:03,"Today marks another great showing of solidarity in the #ProLife movement. For Nebraskans in DC showing their support for life, feel free to stop by my office at 502 Cannon!  #NE03"
RepAdrianSmith,1220432560964227078,2020-01-23 19:46:11,"RT @NE_REALTORS: Nebraska's 3rd District U.S. Congressman @RepAdrianSmith meets w/ NE REALTORS® Thank you Steve Coram, Darlene Fletcher, An…"
RepAdrianSmith,1220413700999467009,2020-01-23 18:31:15,"Replacing the onerous #WOTUS rule empowers states to regulate their non-navigable waters and is much more aligned with the original intent of the law. Once again, @realDonaldTrump fulfills his promise to rein in the federal government."
RepAdrianSmith,1220342906038509570,2020-01-23 13:49:56,Yesterday I toured the expanded facilities at Royal Engineered Composites of Minden.  Thank you! #NE03 https://t.co/XC3GJkDN2T
RepAdrianSmith,1220094822721163264,2020-01-22 21:24:08,"Thanks to Fortigen, Tetrad Corporation and @My_Farmers_Coop leadership for the opportunity to learn more about your Geneva-based Anhydrous Ammonia manufacturing facility. #NE03 https://t.co/rfn8RWXi8o"
RepAdrianSmith,1220033173842792450,2020-01-22 17:19:10,"I was proud to join the US Meat Animal Research Center and Nebraska ag partners to commend the dedicated scientists, researchers, and staff on their very successful APHIS inspection report. #NE03 https://t.co/QNsmwmQFUN"
RepAdrianSmith,1219999196276760581,2020-01-22 15:04:09,Thank you to those who braved the weather to participate in my Mobile Office in Minden this morning. #NE03 https://t.co/BvmFklOs11
RepAdrianSmith,1219967083934515202,2020-01-22 12:56:33,I’ll be at the Kearney County Courthouse in Minden this morning to meet with constituents. Feel free to drop by from 8:00 am – 9:00 am CST. #NE03 https://t.co/Nc5p9e2b9x
RepAdrianSmith,1219746540169957377,2020-01-21 22:20:11,"Last week I had the honor of attending @POTUS and Chinese Vice Premier signing the phase one trade agreement between our nations. While we know there is more to be done, we should celebrate what has been accomplished. My column here: https://t.co/Hf1plzLND5"
RepAdrianSmith,1219693355493396480,2020-01-21 18:48:51,"I enjoyed attending @KACCNebraska’s 101st Annual Meeting yesterday as they recognized a diverse array of community leaders. Congratulations to my staff member, Alex Straatmann, for being among those recognized! #NE03 https://t.co/XTEzTad60d"
RepAdrianSmith,1219653380177563648,2020-01-21 16:10:00,An incredible Kearney sunrise on a crisp Nebraska morning! https://t.co/zbseFiT7tb
RepAdrianSmith,1219625981322899456,2020-01-21 14:21:08,"I was honored to visit with residents of the Central Nebraska Veterans Home yesterday. I was thankful for the opportunity to join them in Freedom Hall, to share in viewing, “Reflections of Service,” the newest statue located near their fishing pond. #NE03 https://t.co/TqqSoJQIbw"
RepAdrianSmith,1217565052401786880,2020-01-15 21:51:44,RT @SenatorFischer: Nebraska and South Dakota represented at the @WhiteHouse for the signing of the China trade deal! https://t.co/PHJdyp80…
RepAdrianSmith,1217493179928383489,2020-01-15 17:06:08,Thank you @POTUS for the invitation to today’s China trade agreement signing at the White House. This agreement with China is a positive first step toward addressing one of our biggest trade challenges. My statement here: https://t.co/9k0w1eY5xh
RepAdrianSmith,1217189932898422784,2020-01-14 21:01:08,"Great meeting with @NebraskaWheat today where, we discussed the importance of #USMCA and the upcoming U.S.-China trade deal to Nebraska ag. https://t.co/zXl3uZ1WtW"
RepAdrianSmith,1217085418581172224,2020-01-14 14:05:50,This January marks the 75th anniversary of the Auschwitz liberation during the closing months of World War II in Europe. Now we must do our part in fighting anti-Semitism wherever it may be. My column here: https://t.co/BRMv7ZZtd1
RepAdrianSmith,1217075644024205312,2020-01-14 13:27:00,"My staff will host a Mobile Office in Chadron this afternoon. Please stop by If you have thoughts to share or need help with FEMA, USDA, FSA, VA, Medicare, or other federal agencies. #NE03 https://t.co/eJyiWlwIfz"
RepAdrianSmith,1216719627465588737,2020-01-13 13:52:19,"My staff will host a Mobile Office in Oshkosh this morning. If you have thoughts to share or if you need help with FEMA, USDA, FSA, VA, Medicare, or other federal agencies, please stop by. #NE03 https://t.co/TIgxtypWWQ"
RepAdrianSmith,1215646806585094147,2020-01-10 14:49:18,"Yesterday, I recognized Allen Beermann, who is retiring from his long-time position as the executive director of the Nebraska Press Association. Watch my remarks here: https://t.co/szxifXOHu7"
RepAdrianSmith,1214673177802133505,2020-01-07 22:20:27,"Unidentified drones can present many problems, and the inability to determine their source is unacceptable. I have been in contact with the FAA and other agencies. We deserve answers. My statement: https://t.co/iBtCCuLQSf"
RepAdrianSmith,1214270208371806211,2020-01-06 19:39:12,"In 2019, we faced many challenges, but we also founded solutions which will benefit Nebraska families, farmers, ranchers, and small businesses. My ‘Year in Review’ column here: https://t.co/4un6LFiweS"
RepAdrianSmith,1214259573516881921,2020-01-06 18:56:56,My office joined @GovRicketts this morning to recognize our state's commitment to fighting human trafficking crimes. In Congress I have been working to fight against human trafficking and end this scourge. https://t.co/1viZMykPmE
RepAdrianSmith,1214189332841541634,2020-01-06 14:17:50,"My staff will host a Mobile Office in Alliance this morning.  If you have thoughts to share or if you need help with FEMA, USDA, FSA, VA, CMS, or other a federal agencies, please stop by.  #NE03 https://t.co/hjtpB7ccrd"
RepAdrianSmith,1213180060502544384,2020-01-03 19:27:20,"The decision to eliminate the terrorist Soleimani yesterday sends the message while our goal must be peace, the United States will not tolerate Iranian provocations or further attacks on Americans. My statement here: https://t.co/VghOL9u0K0"
RepAdrianSmith,1212729993756893184,2020-01-02 13:38:56,"My staff will host a Mobile Office in Harrison this afternoon.  If you have thoughts to share or if you need help with FEMA, USDA, FSA, VA, CMS, or other federal agencies, please stop by.  #NE03 https://t.co/bj7KboPuQ3"
RepAdrianSmith,1209841257629016067,2019-12-25 14:20:08,Merry Christmas to all Nebraskans! Wishing you a safe and happy holiday season. https://t.co/Zxm3anidxJ
RepAdrianSmith,1209149552445607939,2019-12-23 16:31:32,"In 1987, President Ronald Reagan spoke about the “most wonderful time of year” and the beauty of treating all our neighbors with love and kindness. My column here: https://t.co/ra9ez9Ntwu"
RepAdrianSmith,1207738804129411072,2019-12-19 19:05:44,"While parts of the proposal look positive, the 2020 #RFS does not sufficiently address the continued abuse of small refinery exemptions. Once again, @EPAAWheeler left in place a significant loophole."
RepAdrianSmith,1207721185942949888,2019-12-19 17:55:43,"Once again federal courts have found Obamacare’s individual mandate unconstitutional. I remain committed to utilizing market-based solutions like association health plans to reduce costs for Nebraska’s families, farmers, ranchers, and small businesses. https://t.co/bnPtnvqz9z"
RepAdrianSmith,1207405300082511872,2019-12-18 21:00:30,Today’s attempt to remove our duly-elected President sets a terrible precedent for the future. My remarks: https://t.co/QNGb7czny0
RepAdrianSmith,1207338004098043909,2019-12-18 16:33:06,"Third District ag experts – @USDA and @USTradeRep are accepting applications to serve on Agricultural Trade Advisory Committees. If you would like to share your knowledge of agriculture, please fill out the application here: https://t.co/2iV0qK4ia9"
RepAdrianSmith,1206640953123115015,2019-12-16 18:23:16,Enjoyed my time at Camp David this weekend. We engaged in thoughtful discussions with the White House about the important issues facing our country. Thank you to @realDonaldTrump for the invitation to meet with your senior staff.
RepAdrianSmith,1206602854036910081,2019-12-16 15:51:52,Last week was a great week for trade in Nebraska. We made significant progress expanding trade opportunities with Nebraska’s top three export markets. My column here: https://t.co/9fK3h0Qpi0
RepAdrianSmith,1205605089853026306,2019-12-13 21:47:07,I joined a number of my colleagues in sending a letter to @EPAAWheeler stressing the need to follow the law on the #RFS in their upcoming rule. EPA must support our producers and abide by President Trump’s commitment to ethanol.
RepAdrianSmith,1205603293495472129,2019-12-13 21:39:58,RT @RepDonBacon: Today’s vote was a disgraceful act of partisanship and an abuse of power. The military aid was given a week before the law…
RepAdrianSmith,1205548199450218496,2019-12-13 18:01:03,A phase one trade agreement with China is a positive step forward. A great week for trade and I thank President Trump for his hard work. Let us continue to work toward a more comprehensive deal. https://t.co/6pjiXuDTAf @realDonaldTrump @USTradeRep
RepAdrianSmith,1205230545346670599,2019-12-12 20:58:48,Today I spoke on the floor to recognize the 100th anniversary of Scotts Bluff National Monument’s official designation. You can watch my remarks here: https://t.co/Ux6WTx4mPz
RepAdrianSmith,1205213039680724992,2019-12-12 19:49:15,"I voted against Speaker Pelosi’s socialist #HR3 today.  H.R. 19, which I support, contains bipartisan provisions to lower prescription drug prices and spur innovation. #MoreCures"
RepAdrianSmith,1205132883712606208,2019-12-12 14:30:44,"Join me in celebrating the 100th anniversary of Scotts Bluff National Monument! Having grown up in Gering, I am proud of the monument and the uniquely American story of its role in our westward migration. Thanks to the @NatlParkService for their work preserving this icon. https://t.co/FvUZTtFANA"
RepAdrianSmith,1204838245336526848,2019-12-11 18:59:57,Speaker Pelosi’s #FewerCures bill is an outright attempt to socialize American medicine. We have bipartisan solutions to lower prescription drug costs – this isn’t one of them.
RepAdrianSmith,1204527675261489158,2019-12-10 22:25:51,Speaker Pelosi’s attempt to socialize American medicine undoes bipartisan work on lowering drug pricing policies which was well under way. My full statement on #HR3 here: https://t.co/cjr23ZRvy4
RepAdrianSmith,1204482588557160448,2019-12-10 19:26:41,"The articles of impeachment introduced today offer no evidence of any crime, and I will vote against them. My full statement: https://t.co/7soPXs3qIP"
RepAdrianSmith,1204452149842849794,2019-12-10 17:25:44,"Coming to an agreement on USMCA is a tremendous step forward, and I applaud @POTUS and @USTradeRep for their diligent work in getting a beneficial trade deal for our nation. My statement here: https://t.co/UztWOzWYkr"
RepAdrianSmith,1204416661362638850,2019-12-10 15:04:43,"RT @ClimateGOP: .@RepAdrianSmith is absolutely right: “The United States, being the world leader in reducing carbon emissions, should be th…"
RepAdrianSmith,1204402792103845889,2019-12-10 14:09:37,"There is much work to be done in Washington, and in @WaysandMeansGOP I have been working on a number of commonsense tax initiatives. My column here: https://t.co/0UWvwpnnqi"
RepAdrianSmith,1204107290028204035,2019-12-09 18:35:23,Today I joined my colleagues in writing to Speaker Pelosi urging passage of #USMCA before the end of this year. We have the votes for this critical and beneficial trade deal - let’s seize this opportunity!
RepAdrianSmith,1203320894514434049,2019-12-07 14:30:32,"Today is the anniversary of Pearl Harbor, a date which truly lives in infamy. The United States was attacked but never wilted in the face of tyranny. We remember the courage of the #greatestgeneration who fought and won WWII. https://t.co/6Tr2sra7Pm"
RepAdrianSmith,1202627791352664064,2019-12-05 16:36:23,"In addition to signing holiday cards for #mailforheroes yesterday, I delivered to @redcross more than 3,000 cards sent in by Nebraskans! https://t.co/Iwts3y1hiq"
RepAdrianSmith,1202238476223164416,2019-12-04 14:49:23,"As co-chair of the U.S.-Japan Caucus, a bilateral trade agreement has been my top priority. Great news for Nebraska ag! https://t.co/mkEksxvtmO"
RepAdrianSmith,1201907459843121157,2019-12-03 16:54:03,"The U.S. leads the world in carbon emissions reduction, but we have seen numerous efforts to implement mandates which could hamstring existing efforts.  My column here: https://t.co/5y6OtY693c"
RepAdrianSmith,1201882291057901569,2019-12-03 15:14:02,Great speaking with @NAIFA last night about SECURE Act and the importance of policies which help Americans plan for retirement. https://t.co/7YEGqrTulj
RepAdrianSmith,1200115292187381761,2019-11-28 18:12:37,"During a tough year such as this, Thanksgiving is a great opportunity to reflect and show gratitude for all God has provided us. My column here: https://t.co/bUbUnhIVXn #HappyThanksgiving https://t.co/SE8dVgCEF9"
RepAdrianSmith,1197252093364637696,2019-11-20 20:35:17,"Today the House passed my bill to rename @HomesteadNM as Homestead National Historical Park, which would more clearly describes this living history site. The #HomesteadAct shaped the American West and made the American dream real for millions of Americans. https://t.co/NjofTsshLg https://t.co/gk17NAQjB5"
RepAdrianSmith,1197234916922155010,2019-11-20 19:27:02,#NE03 @HuskerFBNation fans travelling to the DC area for Saturday’s game vs. Maryland – please feel free to stop by my office on Friday! We are located at room 502 in the Cannon House Office Building. #GBR https://t.co/OkAayo8083
