RepAdrianSmith,1171034021368860672,2019-09-09 12:14:02,"My staff will host a Mobile Office Hour in Rushville this morning.  Stop by if you have thoughts to share, or need assistance with a federal agency. #NE03 https://t.co/U391mRz5Ej"
RepAdrianSmith,1169691496649560064,2019-09-05 19:19:19,"Great conversation with Hayes County residents on a variety of issues today.  Thank you to all who stopped by my Mobile Office.
#NE03 https://t.co/LgmW6qNWpa"
RepAdrianSmith,1169659558400339969,2019-09-05 17:12:24,"In August, my casework staff was able to close 31 cases with agencies such as the VA, USDA, Social Security, Medicare, and others. If you are in need of help with a federal agency, please reach out to my office or visit: https://t.co/ybY5Fu4Kc2 #NE03"
RepAdrianSmith,1169641145066016774,2019-09-05 15:59:14,"I presented a Young Entrepreneur Award Special Recognition certificate to North Platte Realtor Nelson Jett this morning.  According to his many nominations, his commitment to the real estate industry and customer service are valuable assets to his business. #NE03 https://t.co/zKWDxSZtoK"
RepAdrianSmith,1169602335284350977,2019-09-05 13:25:01,Thanks to the Hooker County constituents who stopped by my Mobile Office yesterday. I appreciated hearing your perspective on the issues facing the Sandhills region. #NE03 https://t.co/ZsO0qdN2r8
RepAdrianSmith,1169281179855532032,2019-09-04 16:08:52,"August was a busy month in Nebraska, and I am glad I was able to be a part of it. If Washington could be a bit more like Nebraska, we would see a lot less politicizing, and a lot more work getting done. Read my column here: https://t.co/r42dnwdncQ"
RepAdrianSmith,1169236822477684736,2019-09-04 13:12:36,I’m at the Hooker County Courthouse this afternoon to meet with constituents.  Feel free to drop by from 3:00 p.m. – 4:00 p.m. MT.  #NE03 https://t.co/oMG8Efw8RC
RepAdrianSmith,1168984628197232641,2019-09-03 20:30:28,Thanks to Pioneer Animal Clinic for a tour and update on the veterinary industry this morning.  #NE03 https://t.co/Psh0pdnn4e
RepAdrianSmith,1168969314587893760,2019-09-03 19:29:37,"RT @NETNewsNebraska: .@RepAdrianSmith surveys #flooding and flood damage in Peru, #Nebraska. 
https://t.co/q1DnXBA2Ic https://t.co/LpJvND43…"
RepAdrianSmith,1167458542963625985,2019-08-30 15:26:21,"RT @yorknewstimes: .@RepAdrianSmith holds ag update session in York

https://t.co/9232tNNqfk"
RepAdrianSmith,1167224086268928001,2019-08-29 23:54:42,Thanks to @SenatorSlama and leadership of Peru for a tour and update on the continued flooding concerns and long-term impact to the community and the @PeruState campus. #NE03 https://t.co/Xiluw94asQ
RepAdrianSmith,1167200085928808449,2019-08-29 22:19:20,"Thanks to @NeDeptAg Director Steve Wellman for joining my Ag Tour Stop In @AuburnNEB today.  I appreciate the feedback on many topics, including trade and disaster recovery. It was a great finish to a successful Ag Tour. #NE03 https://t.co/F1fuSwegeQ"
RepAdrianSmith,1167195453525569536,2019-08-29 22:00:56,"There are many things to work on when Congress reconvenes– I hope our focus will be trade. We have an opportunity to take action on trade with #USMCA and Japan, but the work must come first. We cannot afford to let these opportunities pass. My column here: https://t.co/kMPbg4w8tt"
RepAdrianSmith,1167101971146432513,2019-08-29 15:49:28,"Yesterday, I stopped by The Freckled Door of Friend to provide Special Recognition as part of the Young Entrepreneur Award program.  What began as a desire to stay home with her young children, has become a full-time passion.  #NE03 https://t.co/TIAZrEV5Jr"
RepAdrianSmith,1166842417213054976,2019-08-28 22:38:05,Productive discussion on many issues at the Ag Tour Stop in York today. I look forward to tomorrow’s conversation in Auburn.  #NE03 https://t.co/YPon8YyiSc
RepAdrianSmith,1166494282062209024,2019-08-27 23:34:43,"Thanks to @NebraskaDEE Director Jim Macy for joining my Ag Update Tour in Alliance today. I appreciated the thoughtful discussion on a wide-range of issues from all attendees.  I look forward to continuing the conversation on Wednesday in York, and Thursday in Auburn. #Ne03 https://t.co/IMzxbQhQF5"
RepAdrianSmith,1166470990328676357,2019-08-27 22:02:10,RT @sbstarherald: Brothers Ryan and Trevor Massey were honored by Congressman Adrian Smith Monday with the Young Entrepreneur Award. https:…
RepAdrianSmith,1166147968447275008,2019-08-27 00:38:36,This is a very positive step forward. I have been a strong advocate for an agreement with Japan which would treat our agricultural products equally with their competitors. I am hopeful this potential trade deal will be done soon. https://t.co/SuCqUvwvqZ
RepAdrianSmith,1166129076240814080,2019-08-26 23:23:32,"This morning, I witnessed firsthand the progress of repairs at the collapsed Gering-Fort Laramie Irrigation Canal and Tunnel.  Ensuring this system is operable is vital to the Wyo-Braska region.  Thank you to all involved for your commitment to restoring water access. #NE03 https://t.co/FOqOSEbiiW"
RepAdrianSmith,1166118093640409088,2019-08-26 22:39:53,"This afternoon I presented the Young Entrepreneur Award to Papa Moon Vineyards &amp; Winery of Scottsbluff.  What began as a viticulture hobby, has transitioned into a business involving their whole family. #NE03 https://t.co/Lfx2vetIyN"
RepAdrianSmith,1166020214582120448,2019-08-26 16:10:57,"I recently stopped by @StrivTV to present their Young Entrepreneur Award.  Their work is a good example of creating opportunities through problem solving.  After the presentation, @taylorsiebert hosted my Youth Advisory Council and me for our fall meeting. #NE03 https://t.co/rziMKA3Ny5"
RepAdrianSmith,1165258424130703361,2019-08-24 13:43:52,"Congratulations to Young Entrepreneur Award recipient, The Medina Street Vault Coffeehouse &amp; Bistro.  Their story is a good example of turning passion into a community-oriented business. #NE03 https://t.co/FbvlO3ral5"
RepAdrianSmith,1165233697492221952,2019-08-24 12:05:37,Thanks to @ntvnews for the chance to join your team live at your @nestatefair studio.  I always appreciate the conversation on issues important to #NE03. https://t.co/aoCBLPSqaf
RepAdrianSmith,1164970869380268033,2019-08-23 18:41:14,Appreciated the update on the work the @NESorghumBoard is doing on behalf of Nebraskans when I stopped by their @NEStateFair booth this morning.  #NE03 https://t.co/d0VJ6C162I
RepAdrianSmith,1164922638592069632,2019-08-23 15:29:34,"RT @RuralRadioNet: Packed house for disaster rountable with @SenatorFischer, @RepAdrianSmith, @GovRicketts as the 150th annual @NEStateFair…"
RepAdrianSmith,1164613102345904129,2019-08-22 18:59:35,I presented the first Young Entrepreneur Award this afternoon. The story of Game On is a quality example of what it takes to succeed as a business owner in a rural community. #NE03 https://t.co/a6bHoeD1Xi
RepAdrianSmith,1164612690758832129,2019-08-22 18:57:57,"RT @PCS_Pride: As a part of their Government class, @PCS_Pride seniors had the opportunity to visit with Nebraska’s @RepAdrianSmith at the…"
RepAdrianSmith,1164597686227668992,2019-08-22 17:58:20,"I hope you will be able to attend one of my Ag Update Tour sessions in Alliance, York, or Auburn next week. This tour provides NE03 constituents an opportunity to hear from special guests &amp; myself on the future of ag policy. For more info visit: https://t.co/fjW3gXjNH4"
RepAdrianSmith,1164524674761596928,2019-08-22 13:08:12,I’ll be at the Perkins County Courthouse this morning to meet with area constituents.  Feel free to drop by from 9:30 a.m. – 10:30 a.m. MT. #NE03 https://t.co/JStFNu7Pg2
RepAdrianSmith,1163476518837923840,2019-08-19 15:43:13,"From the transportation of ag commodities across highways, rail, &amp; rivers, to the movement of energy through the grid, infrastructure is the backbone of our NE economy. I will continue to work with @POTUS to address the unique needs of NE. My column here: https://t.co/thRagTiWuf"
RepAdrianSmith,1162096426496778240,2019-08-15 20:19:13,I participated in the 2019 Heartland Expressway Annual Meeting today. I continue to support transportation funding for rural areas and the re-authorization of the highway bill. Congress needs to take appropriate action to address our national infrastructure needs.#NE03 https://t.co/GAQDCyhkgh
RepAdrianSmith,1162076221947203584,2019-08-15 18:58:56,RT @PQHH: Thanks @RepAdrianSmith for supporting the Home Health Payment Innovation Act (H.R. 2573)! https://t.co/rRDPCnFxyz
RepAdrianSmith,1161620182412013568,2019-08-14 12:46:48,"I welcome @secretarysonny’s visit to Nebraska.  I am sure his visit to #NE03, home to the @nestatefair and the most productive ag district in Congress will be worth his time. https://t.co/aXVCnjBo1M"
RepAdrianSmith,1161031733866881024,2019-08-12 21:48:30,"I participated in the @UNLExtension hosted Gering/Ft Laramie Irrigation District public meeting on the canal and tunnel repairs today.  We must continue working together to ensure the repairs are completed, and those impacted by the disaster receive the help they need. https://t.co/N0mxOo8FpJ"
RepAdrianSmith,1161031725197209600,2019-08-12 21:48:28,"As part of the August district work period, I will be hosting an Ag Update Tour. Washington may have a thing or two to learn from the #1 ag district in the nation, and I am more than happy to take your ideas to Washington in September. My column here: https://t.co/qyDixlWM1p"
RepAdrianSmith,1159989604218544129,2019-08-10 00:47:27,Incredibly disappointing @EPA has undermined the President’s commitment to ethanol by issuing another 31 RFS waivers this afternoon. In May I lead a letter to @EPAAWheeler expressly opposing these waivers. https://t.co/5e41bdZZrt
RepAdrianSmith,1159572089034199046,2019-08-08 21:08:24,Appreciated the opportunity to participate in the @KACCNebraska ribbon cutting of USave Pharmacy yesterday.  Many thanks to @UNKearney for a tour of the Village Flats complex and a progress update on their early childhood and #STEM education facilities. https://t.co/7acvNhGquZ
RepAdrianSmith,1159541033706971142,2019-08-08 19:05:00,"I was honored to receive the @USChamber’s Spirit of Enterprise Award this morning, and am glad to be on Team Nebraska! https://t.co/nstzF3IgU4"
RepAdrianSmith,1159505910638809088,2019-08-08 16:45:26,Appreciated the opportunity to share my thoughts on the important issues facing our business community during the @NebraskaChamber Federal Legislative Summit this morning. https://t.co/WGtNNc3apM
RepAdrianSmith,1159484886715179008,2019-08-08 15:21:53,"RT @NTVsGrow: .@RepAdrianSmith applauds farmers, ranchers for endurance with floods https://t.co/xHXQqI6fkj"
RepAdrianSmith,1159194895363575811,2019-08-07 20:09:34,"Recorded an interview with @NTVNEWS this afternoon.  I appreciated the opportunity to share my perspective on important issues facing our country, including my thoughts on the direction of the #USMCA. #NE03 https://t.co/6IKipfF68Y"
RepAdrianSmith,1159181116710031360,2019-08-07 19:14:49,RT @JobmanAg: Thanks @RepAdrianSmith for spending time in the 3rd District and listening to concerns for agriculture #USMCANow #trade #agri…
RepAdrianSmith,1159158043961176064,2019-08-07 17:43:08,Thanks to the Lexington Area Chamber of Commerce for the meeting invitation. Hearing the perspective of area residents on our nation’s most pressing issues is an important part of the legislative process.  #NE03 https://t.co/fmbnUJxJe6
RepAdrianSmith,1159102773088129025,2019-08-07 14:03:30,Thanks to the staff of the Alliance Community Pharmacy for a tour of their facility yesterday. I appreciated learning more about how they educate their communities and encourage individuals to make good health care decisions. #NE03 https://t.co/BLjPqb8nq4
RepAdrianSmith,1158810305948000262,2019-08-06 18:41:21,"Strengthening U.S.-Israeli relations has been a priority for the current administration and it has begun a new chapter in our alliance. Our shared passion for democracy, stability in the region, and common values strengthen our bond. Read my column here: https://t.co/U6JLe2qDhS"
RepAdrianSmith,1158768933228503040,2019-08-06 15:56:57,"Last month, my casework staff was able to close 22 cases, helping NE03 constituents with the VA, USDA, State Department, USCIS, FEMA, Treasury, Social Security, IRS &amp; the Dept of Education. If you need help w/ a federal agency, visit https://t.co/ybY5Fu4Kc2"
RepAdrianSmith,1158727760485003265,2019-08-06 13:13:20,I’ll be at the Grant County Courthouse this morning to meet with constituents.  Feel free to drop by from 11:00 a.m. – 12:00 p.m. MT. #NE03 https://t.co/S3uLYCMw03
RepAdrianSmith,1157310727503470594,2019-08-02 15:22:33,"I appreciate @RealDonaldTrump signing an agreement with the EU on US beef exports today. This is one of many ag concerns we have with the EU, which is why agriculture must be included in any further trade discussions with them."
RepAdrianSmith,1156981268690739200,2019-08-01 17:33:24,Arbitrary ACA reporting mandates burden employers who provide health insurance. I co-introduced the bipartisan HR 4070 to create a more efficient reporting system and reduce the risk of surprise financial penalties for employers &amp; employees.
RepAdrianSmith,1156656385674944514,2019-07-31 20:02:26,I’m pleased to announce the winners of the inaugural Third District “Young Entrepreneur Awards.” Each nomination is a great example of young and rising leaders working to strengthen their community with their entrepreneurial spirit.  https://t.co/38pPdOjGqN
RepAdrianSmith,1156642811355287557,2019-07-31 19:08:30,For the past nine years Mayor Roger Foster served Crete with dignity and a helpful hand to those in his community.  Our hearts and prayers go out to his family and the city he served so proudly. He will be missed.
RepAdrianSmith,1156577940223774721,2019-07-31 14:50:43,"Great meeting with the Nebraska Soybean Association last week, where we discussed trade issues including the importance of enacting #USMCA. https://t.co/G6Lj2MXfbv"
RepAdrianSmith,1155852979133702144,2019-07-29 14:49:59,"We cannot spend our way out of our debt crisis. The more we spend, the deeper we get ourselves into debt. Without serious reforms, we will continue to find ourselves in this situation. Read my column here: https://t.co/CMCtrmvdKr"
RepAdrianSmith,1154121082670145536,2019-07-24 20:08:03,"The House just passed H.R. 3375, the Stopping Bad Robocalls Act, of which I am a cosponsor. Illegal #robocalls are a serious problem and this bill empowers the FCC and law enforcement to prevent spoofing and track down and prosecute these criminals."
RepAdrianSmith,1154046882735202305,2019-07-24 15:13:12,"At the #NebraskaBreakfast this morning, the delegation had the opportunity to introduce our summer interns. Thanks to Ellery, Robert, and Bryce their fantastic work this summer! https://t.co/3fHvqWSLQa"
RepAdrianSmith,1153807237942411266,2019-07-23 23:20:56,"The United States stands with our ally #Israel. Today, the House passed three bills (HRes 246, HR 1837, &amp; HR 1850) supporting Israel, &amp; opposing attempts to delegitimize their right to exist. I cosponsored all three bills, and am pleased at the bipartisan support they received."
RepAdrianSmith,1153763665868394503,2019-07-23 20:27:48,"Today, I met with @NebraskaFFA student leaders where we discussed their efforts promoting Nebraska ag. Always great to see the blue jackets in Washington! https://t.co/BAKQO0Ig71"
RepAdrianSmith,1153657586832543745,2019-07-23 13:26:17,"My casework staff are hosting Caseworker in your Community events at the libraries in Holdrege and Elwood today.  If you need help with flood recovery, or working with the IRS, USCIS, USDA, FEMA, or other federal agencies, stop by.  #NE03 https://t.co/sMAuKFFNy2"
RepAdrianSmith,1153644530274656257,2019-07-23 12:34:24,"My staff are in Imperial, Butte, and Benkleman hosting Mobile Office Hours today.  If you have thoughts to share, or need help with a federal agency, stop by.  #NE03 https://t.co/HOf8skxNZd"
RepAdrianSmith,1153331295558283266,2019-07-22 15:49:43,One of my top priorities is improving health care for rural Americans. Empowering providers to better meet the needs of patients and reducing burdensome regulations can go a long way to streamline and strengthen our health care system. Read my column here: https://t.co/itcwa8K4rk
RepAdrianSmith,1153287671210487810,2019-07-22 12:56:22,"My staff will host a Mobile Office Hour in Harrison this morning. Stop by if you have thoughts to share, or need assistance with a federal agency.  #NE03 https://t.co/PtHZEJi01j"
RepAdrianSmith,1152631613739679744,2019-07-20 17:29:26,50 years ago the United States achieved the impossible and put a man on the moon. Today we celebrate this great achievement! #MoonLanding https://t.co/i0MidFYwr3
RepAdrianSmith,1152268553397112833,2019-07-19 17:26:45,Thank you to @NEFarmBureau Young Farmers &amp; Ranchers for coming by this week. Always great to hear from the future of Nebraska Ag. https://t.co/ugvEiGhJ1m
RepAdrianSmith,1151951810694918144,2019-07-18 20:28:08,Tomorrow @RedCross and the Buffalo County Emergency Management will be hosting a Multi-Agency Resource Center for those impacted by the recent flood. It will be open from 12-7 PM at the @UNKearney Student Center. Stop by if you are in need of assistance.
RepAdrianSmith,1151926954066665473,2019-07-18 18:49:22,"As co-chair of the U.S.-Japan Congressional Caucus, my deepest condolences go out to the people of Japan after the terrible arson attack in Kyoto. The victims and their families are in our prayers. #PrayForKyoani"
RepAdrianSmith,1151529319090597888,2019-07-17 16:29:18,Great #NebraskaBreakfast this morning. I was able to meet with newly appointed Interim President Susan Fritz – the first woman to lead the @u_nebraska system! https://t.co/6osEN6IK1S
RepAdrianSmith,1151105550882660352,2019-07-16 12:25:24,"My staff will host Mobile Office Hours in Chappell, @ONeillNebraska, and Thedford today. Stop by if you need assistance with a federal issue or have thoughts to share. #NE03 https://t.co/37jFhac6Qa"
RepAdrianSmith,1150819244080320515,2019-07-15 17:27:43,Great to see Nebraska’s own T-L Irrigation at the Made in America Product Showcase at the White House this morning! https://t.co/bYpFwFfGY3
RepAdrianSmith,1150780235048263680,2019-07-15 14:52:43,So far 2019 has been marked by partisan divides which have stood in the way of results.  I urge my colleagues to find common ground and work on productive solutions. My column here: https://t.co/sCI49PFvmz
RepAdrianSmith,1150419759000956935,2019-07-14 15:00:18,"Thanks to @SenatorFischer for touring Lexington, Gibbon, @CityofKearney, Dawson and Buffalo counties with me yesterday, and hearing firsthand about the impact of the recent #NebraskaFlood. I will continue working with @GovRicketts &amp; our delegation to empower recovery efforts. https://t.co/vPO6WMxxSq"
RepAdrianSmith,1150161115722244099,2019-07-13 21:52:33,RT @SenatorFischer: Today @RepAdrianSmith and I joined Dawson County officials in Lexington to see the impact of the recent flooding and di…
RepAdrianSmith,1149405496673275905,2019-07-11 19:49:59,"I spoke on the floor to honor the life of Vera Dulaney who passed away last week. Vera was well known in the Scottsbluff &amp; Gering communities for her years of official service, humble demeanor, dedication to family, and her smile. You can watch here: https://t.co/nwmygRKeKR"
RepAdrianSmith,1149384976561004545,2019-07-11 18:28:27,"Wood River Fire and Rescue is asking residents to consider evacuating before the water level starts to rise. If you are in the area, please check with local authorities on how best to proceed. Stay safe! https://t.co/jamSZTVJjr"
RepAdrianSmith,1149325075008630784,2019-07-11 14:30:25,Flooding near Kearney caused devastation in the region. Now we must assess the damage to know the full impact on these communities. I appreciate the emergency workers on the ground for their diligence and quick response. https://t.co/RbbVcpjK7t
RepAdrianSmith,1149300414342471680,2019-07-11 12:52:26,My staff will host a Mobile Office Hour at the Hooker County Courthouse in Mullen today. Stop by if you need assistance with a federal issue or have thoughts to share. #NE03 https://t.co/dhpxhvS2wr
RepAdrianSmith,1149047721053097984,2019-07-10 20:08:19,Thanks to all who made it to the #NebraskaBreakfast this morning in spite of the heat today! https://t.co/XjoBmfSxXm
RepAdrianSmith,1149014587762778118,2019-07-10 17:56:40,"USMCA upgrades and modernizes NAFTA, will boost our economy, and is a win for farmers, producers, and consumers. We must pass #USMCAnow"
RepAdrianSmith,1148952240704671745,2019-07-10 13:48:55,Our prayers are with the people of Kearney after the terrible flooding. Updates on recovery to follow. #NebraskaStrong
RepAdrianSmith,1148939766978818048,2019-07-10 12:59:21,"My casework staff will be at the libraries in Crete and Fairbury today.  If you need assistance with flood recovery, IRS, USCIS, USDA, FEMA or other federal agencies, stop by.  #NE03 https://t.co/CWye8y8Z5S"
RepAdrianSmith,1148710524814802946,2019-07-09 21:48:25,RT @laubarrett: Thanks @RepAdrianSmith for meeting with the #NASES team today! #4SpecialEducation #SELS2019 https://t.co/n6GS2qb9dq
RepAdrianSmith,1148645494786314241,2019-07-09 17:30:01,Today I met with @RFNebraska. We discussed @EPA proposed 2020 RVOs rule. Arbitrary small refinery exemptions – which this rule allows – harm Nebraska’s ethanol industry and threaten the stability and effectiveness of the RFS.
RepAdrianSmith,1148577808333058054,2019-07-09 13:01:03,The ongoing abuse of small refinery exemptions is damaging RFS integrity. EPA’s proposed 2020 RVOs rule only encourages more of these exemptions. Read my statement here: https://t.co/9iOA8GiSQQ
RepAdrianSmith,1148558961873960960,2019-07-09 11:46:10,"Do you have thoughts to share or need assistance with a federal agency? If so, my staff are hosting Mobile Office Hours at the Grant and Greeley County Courthouses today. Stop by. https://t.co/vjIk1zlXnW"
RepAdrianSmith,1148283871185838086,2019-07-08 17:33:03,"There is a humanitarian crisis on our borders and it won’t go away by pretending it’s not there. We must acknowledge the problem, put politics aside, and fix it. My column: https://t.co/xQcSXU3E3I"
RepAdrianSmith,1146767734254067713,2019-07-04 13:08:28,Have a happy July 4th today! #USA https://t.co/alFZNo9baP
RepAdrianSmith,1146471885573697538,2019-07-03 17:32:52,"Each time I travel the district, I am grateful to see Nebraska agriculture in action. Through tremendous effort, our district does its part to feed the world. https://t.co/LJQJ1ZeR75"
RepAdrianSmith,1146418808980201473,2019-07-03 14:01:58,Enjoyed touring Schuler Red Angus near @cityofbport yesterday. They are committed to working with schools to encourage students to consider #RanchLife. #NE03 https://t.co/lmvecFDqKd
RepAdrianSmith,1146104854861012992,2019-07-02 17:14:25,RT @BrianNBCNEB: Congressman @RepAdrianSmith is at the Morrill County Courthouse this morning. He is here for a mobile office and it is ope…
RepAdrianSmith,1146053603116965888,2019-07-02 13:50:46,Appreciated the opportunity to visit with constituents in Chadron yesterday.  Hearing their perspective on important issues is a vital part of the legislative process. #NE03 https://t.co/xUiEnmxOiY
RepAdrianSmith,1146037647124697089,2019-07-02 12:47:22,I’ll be at the Morrill County Courthouse this morning to meet with constituents in the area.  Please feel free to drop by between 9:30 a.m. and 10:30 a.m. MT. #NE03 https://t.co/qXD6iHJLc6
RepAdrianSmith,1145795812368297985,2019-07-01 20:46:24,Congrats to Mitchell native @NateLashley on his first PGA Tour win! Wonderful to see Nebraskans doing great things. #NE03
RepAdrianSmith,1145693846258499584,2019-07-01 14:01:13,Have a happy 4th! On each Independence Day we celebrate our nation’s founding along with the freedom and opportunity afforded us. This is a day where we reflect on our country’s achievements and the hope for our bright future. You can read my column here: https://t.co/ddat4ITpL2
RepAdrianSmith,1145676143531569153,2019-07-01 12:50:52,"My casework staff will be at the libraries in St. Paul and @OrdNE today.  If you need assistance with flood recovery, IRS, USCIS, USDA, FEMA or other federal agencies, stop by.  #NE03 https://t.co/0Z5t4aBqBI"
RepAdrianSmith,1144613053306155008,2019-06-28 14:26:32,"Yesterday I spoke to honor the life of Nebraska State Trooper Jerry Smith, who was killed last week in a tragic accident while he was on duty. We thank Jerry to his service to our state and remember him for his work in the community. Watch my remarks here: https://t.co/MK1hBeWI7Q"
RepAdrianSmith,1144285897384497152,2019-06-27 16:46:32,Today on the floor I urged House Democrats to allow the House to vote on the bipartisan Senate-passed bill to address the crisis at the border. The refusal to do so hurts our country and prolongs this crisis. #LetUsVote
RepAdrianSmith,1143957982126006272,2019-06-26 19:03:31,"Once again, #NE03 has been ranked by @USDA as the number 1 district for agriculture in the entire nation! Thank you to our farmers and producers for your hard work to help feed the world."
RepAdrianSmith,1143939321831002113,2019-06-26 17:49:22,RT @WaysandMeansGOP: .@RepAdrianSmith and @RepLaHood are fighting for rural communities to have quality access to health care. Because of t…
RepAdrianSmith,1143885672572510210,2019-06-26 14:16:11,This morning at the Nebraska Breakfast we had 3rd District native @GitRDoneLarry in attendance. Thank you to all Nebraskans who made it! https://t.co/ubbDZBoCCz
