RepCuellar,1322266649869897730,2020-10-30 19:58:30,"🚨Attention Texas🚨

TODAY is the last day to #VoteEarly! 

Make a plan to ensure your voice is heard:
https://t.co/91RM6jOp4V"
RepCuellar,1322192821193969666,2020-10-30 15:05:08,"I couldn’t leave the Rio Grande Valley yesterday without visiting the City of La Joya’s pumpkin patch, located outside city hall. The weather was way too nice to pass up on an opportunity to get into the fall spirit! https://t.co/NNqwUUA5IF"
RepCuellar,1322170304475635713,2020-10-30 13:35:39,"Voting, like everything else this year, looks different, thanks to the coronavirus pandemic. Learn how to protect yourself while early voting or on November 3rd. 
https://t.co/I80Wu76wDw"
RepCuellar,1321958109682765824,2020-10-29 23:32:28,"On #NationalInternetDay, we celebrate the invention that connects us to people across the country. 

However, 20 million Americans don’t have access, leaving them unable to use online student or health services. 

Today, we must recommit ourselves to closing the digital divide."
RepCuellar,1321927030833860613,2020-10-29 21:28:59,"This expansion adds two operational inspection lanes, which will shorten wait times and improve border efficiency. https://t.co/BJEX1UJxFp"
RepCuellar,1321927013771452416,2020-10-29 21:28:54,"Earlier, I joined @CBP, Superintendent of Bridges Juan Olaguibel, Senator Cornyn’s office, Senator “Chuy” Hinojosa, State Rep. Sergio Muñoz Jr., and mayors from surrounding cities to celebrate the northbound lane expansion at the Anzalduas International Bridge. https://t.co/Ez2xrJbIb6"
RepCuellar,1321876599340486656,2020-10-29 18:08:35,Latinas still endure one of the widest pay gaps of any group. @HouseDemocrats already passed legislation to address this issue – the Senate must do its part to pass the #PaycheckFairnessAct! #LatinasAreEssential https://t.co/4M4Wny5UtT
RepCuellar,1321584947774279680,2020-10-28 22:49:40,"On #NationalFirstRespondersDay, I want to recognize the heroic men and women who put their lives on the line every day to protect our community during this pandemic. Thank you to all of our first responders! https://t.co/J2xvWkijHv"
RepCuellar,1321527515467403264,2020-10-28 19:01:27,"RT @AtlanticCouncil: LIVE NOW—Why Latin America and the Latino vote matter w/ @Vegalteno, @MariaESalinas, @edith_jorge, @RepRooney, @RepCue…"
RepCuellar,1321493990416486401,2020-10-28 16:48:14,Early voting in Texas is still underway! Make sure your voice is heard. Visit https://t.co/91RM6jOp4V to learn more about voting in Texas and make your plan to vote. https://t.co/TEtcszTQtG
RepCuellar,1321211198663237639,2020-10-27 22:04:31,"Hard-working families have been waiting for food assistance, small business aid, &amp; a second stimulus check.  
 
The House passed the #Heroes Act in May to crush this virus &amp; provide needed relief. 
 
Why are President Trump &amp; the Senate turning their backs on the American people?"
RepCuellar,1321140525777489922,2020-10-27 17:23:41,"RT @ACLatAm: TOMORROW at 3pm EDT: @politico’s @sabrod123 will moderate our discussion with @TerryMcAuliffe, @MariaESalinas, @RepRooney, @Re…"
RepCuellar,1320886368873177088,2020-10-27 00:33:45,"Open enrollment for #Medicare has begun!

You will have until Dec. 7 to decide whether you need to make any changes in your coverage.
Learn more with the Medicare Plan Finder tool, which will help you find a plan that works best for you:
https://t.co/ae6jsKzRoY https://t.co/tgtXoRFyAj"
RepCuellar,1320069229329174528,2020-10-24 18:26:44,Congrats on the successful opening of IDEA Converse! I look forward to seeing our students learn and our community grow. https://t.co/iJHei4wZos
RepCuellar,1319748573811085312,2020-10-23 21:12:34,"The deadline to submit your application for a service academy nomination is just around the corner! 

For more info on how to apply, visit: https://t.co/CfLmVNPjws https://t.co/9EKD8GBl6D"
RepCuellar,1319389831928098817,2020-10-22 21:27:03,"To keep up with my work in #TX28, you can sign up for my newsletter now 📬 https://t.co/4rLqqafvy2"
RepCuellar,1319389825133383680,2020-10-22 21:27:02,"In this week's newsletter, I talk about Acting DHS Secretary Wolf's announcement about extending 'non-essential' travel restrictions on the U.S.-Mexico border to Nov 21. Check it out ⬇️
 https://t.co/0qigtz1fdc"
RepCuellar,1319247741395062784,2020-10-22 12:02:26,RT @ASP: The Supreme Court will hear a case that challenges the Trump Administration's use of Pentagon funding to build a #BorderWall. Hear…
RepCuellar,1319002013343059971,2020-10-21 19:46:00,"545 children. That’s 545 too many.
 
We must do everything in our power to reunite these kids with their families and ensure this does not happen again. 
https://t.co/04NmxiDtV6"
RepCuellar,1318624790220099592,2020-10-20 18:47:03,RT @CityOfMissionTX: Grateful to @RepCuellar and the US Dept of Justice for an 18k grant awarded to @Mission_PD. It will be used to purchas…
RepCuellar,1318568461002473479,2020-10-20 15:03:13,"“Pain. Passion. Purpose.” We miss you, Mr. Chairman. https://t.co/Kcj2WhSjov"
RepCuellar,1318181205251063809,2020-10-19 13:24:24,"As our nations grapples with the pandemic, Head Start programs throughout the country continue to support and teach our children. 

The future success of the United States is at risk if we fail to support Head Start in the next COVID-19 relief package.
https://t.co/QiNIIme55a"
RepCuellar,1317563607970992129,2020-10-17 20:30:17,"ATTN: Sign up now for my weekly newsletter to make sure you don’t miss any of my updates.
https://t.co/4rLqqafvy2"
RepCuellar,1317563598781243392,2020-10-17 20:30:15,"This past week, I visited Mexico City with the @cityoflaredo and hosted a virtual event geared towards students interested in military academies. To read more about what my office and I are doing for South Texans, read my latest newsletter!
https://t.co/DS8LViVFWQ"
RepCuellar,1317214092189458432,2020-10-16 21:21:26,"On this #WorldFoodDay let’s thank our #FoodHeroes, including our farmers, food transporters, grocery workers and cooks, for their work in growing, nourishing and sustaining our communities during this pandemic. https://t.co/w5fluy3n8E"
RepCuellar,1317137527619411968,2020-10-16 16:17:12,"I voted for the #CARESAct, which kept 18 million people from slipping into poverty. The aid from this package is now spent &amp; 8 million people have fallen into poverty.

The House passed the Heroes Act to provide more relief &amp; to stimulate the economy. The Senate needs to act. https://t.co/JFpNsDpPCX"
RepCuellar,1316818314899980289,2020-10-15 19:08:46,"On the last day of Hispanic Heritage Month, we look back on our history of resilience. 

We look around, seeing that we are more essential than ever. And we look forward, knowing there are better days for Latinos in America coming, if we are willing to fight for them. #HHM https://t.co/iswHjZduQn"
RepCuellar,1316789071608508417,2020-10-15 17:12:34,"Complete your Census TODAY at https://t.co/H6eE3Nar0I  

Census data is critical to helping our communities thrive. It helps us obtain the healthcare, transportation, schools, affordable housing, &amp; higher education that our families need to get a good start &amp; succeed.
#BeCounted https://t.co/BOz67ITQtD"
RepCuellar,1316753321470894080,2020-10-15 14:50:30,"These major changes to USPS caused problems for rural Americans, including delays in delivery of medical prescriptions, payments, &amp; job applications, &amp; impeding many to vote by mail.

We won’t allow politics to get in the way of providing a public service to the American people. https://t.co/0KtrGWMIwu"
RepCuellar,1316478682765111297,2020-10-14 20:39:11,"You, your family, your neighbors, and your friends have less than 48 hours to be counted in the #2020Census before the Administration shuts it down after 11:59 p.m. Hawaii time on Oct. 15.

Shape your future. Go to https://t.co/H6eE3Nar0I https://t.co/DrxyQuU7Yw"
RepCuellar,1316454587998638080,2020-10-14 19:03:26,"REMINDER: People who don’t normally file a tax return now have more time to sign up &amp; receive their Economic Impact Payment. Use the #IRS Non-Filers’ tool by Nov. 21: https://t.co/Irx6ZDzMfb 

Share this with your family &amp; friends so they can get the relief they need too."
RepCuellar,1316150997178355712,2020-10-13 22:57:05,"This a major loss for our democracy. Cutting the Census early will harm vulnerable communities across the United States by denying them federal funding and the political representation they deserve.  
 
Fill out the Census now. Before it’s too late. https://t.co/ZuhZpzonux"
RepCuellar,1316024944803766273,2020-10-13 14:36:12,Happy 245th birthday to the @USNavy! Thank you to all the men and women who protect our nation every day with honor and bravery. https://t.co/oWw6w75PNe
RepCuellar,1315733885960028161,2020-10-12 19:19:38,"Happy #NationalFarmersDay! Today, I want to celebrate all the hardworking farmers and ranchers in Texas who dedicate their lives to feeding &amp; fueling our country. https://t.co/v3Mvdgkllz"
RepCuellar,1315418106332880896,2020-10-11 22:24:50,costing tax payers millions and millions of dollars. The American public deserve oversight and transparency from DHS on their decision to proceed with this contract. (2/2)
RepCuellar,1315418103417843713,2020-10-11 22:24:49,"This issue isn’t new. Last year, I worked with the City of Laredo to propose an alternative to erecting a tent for immigration hearings. However, @DHSgov didn’t listen &amp; decided to proceed with the contract to construct the soft-sided tent facility...(1/2)
https://t.co/yxtUhg6NqO"
RepCuellar,1315297685705043968,2020-10-11 14:26:19,"Restrictions on nonessential travel at LPOEs along the US-MX border have hurt border communities. My proposal balances the health of the individual &amp; the health of the economy. We can work with @DHSgov &amp; local officials to safely re-open our borders.
https://t.co/zwplbHhXQr"
RepCuellar,1315048966535483392,2020-10-10 21:58:00,"Earlier this week, I had the honor of receiving the 2020 ALFA Outstanding Commitment Award. Thank you for this recognition and I will continue to work hard in finding ways to develop and advance international trade within our communities. https://t.co/WaZb5nFQrG"
RepCuellar,1315015217479376896,2020-10-10 19:43:54,"Did you know that, according to @MentalHealthAm, 1 in 5 US adults experience mental health issues each year?
 
It’s time to #EndTheStigma and speak up for affordable mental health care and treatment.
 
#WorldMentalHealthDay https://t.co/inQJJF6s9D"
RepCuellar,1314991862407626753,2020-10-10 18:11:06,"This is a major victory for border communities, the environment and wildlife, and private property rights. 
The Constitution is on our side: the Administration cannot sidestep Congress and divert funding from our military and their families to fulfill his empty campaign promise. https://t.co/gRWtIZvaZu"
RepCuellar,1314664544837480449,2020-10-09 20:30:27,"REMINDER: If you would like to be nominated to one of our nation’s service academies, join us in 30 minutes for Military Service Academy Day! Register by contacting one of the offices in #TX28 https://t.co/EBFEbvkSxW"
RepCuellar,1314625961195966464,2020-10-09 17:57:08,"Read my letter to @DHS_Wolf below:
https://t.co/hU0huBNxcZ"
RepCuellar,1314625164362031105,2020-10-09 17:53:58,"We must come together to create a plan to reopen the border to 'non-essential' travel. I look forward to working with @DHSgov, border city officials &amp; businesses in developing a strategy that focuses on our shared interest of protecting the lives &amp; livelihoods of our communities. https://t.co/7A1PMGbgkO"
RepCuellar,1314622769066397696,2020-10-09 17:44:27,"RT @ASP: . @RepCuellar discusses one of the topics that wasn't covered in the #VicePresidentialDebate: immigration. In this #DailyPoint, he…"
RepCuellar,1314591787504336896,2020-10-09 15:41:20,"Our USPS &amp; the Universal Postal Union make it possible to write letters to anyone in the world ✍️
 
This would not be possible without our postal workers’ hard work and dedication. 

Today we celebrate #WorldPostDay 🎉 https://t.co/CLJbJKRJfo"
RepCuellar,1314561086830579712,2020-10-09 13:39:21,"The pandemic has exacerbated health care challenges that plague rural communities in the United States. We must work to protect and build on the Affordable Care Act to improve access to quality care in rural areas. 
https://t.co/pgkgxCa8YV"
RepCuellar,1314250096570175494,2020-10-08 17:03:35,"Subscribe to my newsletter now to make sure you don’t miss any of my updates.👇
https://t.co/4rLqqafvy2"
RepCuellar,1314250094900895746,2020-10-08 17:03:34,"ICYMI📬￼- Read my latest newsletter about my legislative work in Washington DC, events in Texas, and updates to the Census.
https://t.co/LJHhVR3PIq"
RepCuellar,1313910280280309765,2020-10-07 18:33:16,"The CARES Act—which included one-time cash payments of $1,200—bolstered incomes &amp; spurred spending. W/ the updated #HeroesAct, @HouseDemocrats are continuing to put money directly into families’ pockets through additional direct payments to cushion the economic blow of COVID-19. https://t.co/wmIrvhJQT9"
RepCuellar,1313882544706912259,2020-10-07 16:43:04,"RT @HispanicCaucus: Congrats to @UTRGV Professor, Dr. Alfonso Mercado!
 
@Dr_Mercado1 was named Psychologist of the Year by the @TXPsychAss…"
RepCuellar,1313853640910745601,2020-10-07 14:48:12,Thank you for this kind recognition from Pepe Carmona on behalf of @NarroJose. I am committed to strengthening our economic relationship with Mexico. https://t.co/ROlYskfwn3
RepCuellar,1313612269775880194,2020-10-06 22:49:05,"This afternoon, @MayorPeteSaenz, Dr. Marte Martinez &amp; I met with @m_ebrard to discuss the USMCA, border crossings, labor issues, compliance with the 1944 Water Treaty &amp; smuggling of firearms into Mexico. We must work together on these issues for the success of our two countries. https://t.co/y05qXTsDua"
RepCuellar,1313605484415508482,2020-10-06 22:22:07,"RT @m_ebrard: Sostuve productiva reunión de trabajo con el Rep. Henry Cuellar, el Alcalde de Laredo, Peter Sáenz y el City Manager Robert E…"
RepCuellar,1313597819303989257,2020-10-06 21:51:40,"RT @vmva1950: Con mucho gusto me reuní con el congresista de #EUA @RepCuellar, a quien a nombre del @GobiernoMX agradecí su apoyo para la c…"
RepCuellar,1313582552050028544,2020-10-06 20:51:00,"More than 210,000 Americans have died, over 7.5 million have been infected, and about 30 million are out of work.

We must put politics aside and come back to the negotiating table. 

The American people cannot wait much longer.
https://t.co/6pGybVy51d"
RepCuellar,1313569283436408833,2020-10-06 19:58:16,"Thank you @JesusSeade for meeting with me, @MayorPeteSaenz, City Manager Robert Eads and Dr. Marte Martinez to discuss how we can strengthen our partnership and economic cooperation. I look forward to having you visit Washington DC soon. https://t.co/yNuCYCex7B"
RepCuellar,1313556532785811457,2020-10-06 19:07:36,"During this pandemic, getting the flu vaccine is now more important than ever. 

Protect yourself, family members, friends and essential workers by rolling up your sleeve and getting your flu vaccine this fall. 

Learn more at:
https://t.co/4Tj5Xq6aI3 https://t.co/djHy1DAIfg"
RepCuellar,1313535616831950848,2020-10-06 17:44:30,RT @JesusSeade: Muy productiva reunión con mi buen amigo Henry @RepCuellar y @MayorPeteSaenz de #Laredo. Hablamos de la relación bilateral…
RepCuellar,1313277265111900161,2020-10-06 00:37:54,"As someone who has experienced the transformative power of education, I’m pleased to have helped secure this grant for local districts. I’ll continue to support school systems by providing the resources they need to give students a quality education.
https://t.co/hCx27Jh4UM"
RepCuellar,1313225829132972033,2020-10-05 21:13:30,"On this #WorldTeacherDay, I want to extend my gratitude to all those educating our students in these unprecedented times. But we also must put our appreciation into action. 

Last week, @HouseDemocrats passed an updated Heroes Act to make sure teachers are safe as schools reopen."
RepCuellar,1313192066567016448,2020-10-05 18:59:21,"As Laredo’s airport continues to grow - creating jobs and providing more opportunities to residents - I will continue to work hard in order to deliver federal funding, so we are able to meet the trade and leisure demands of our city. https://t.co/92GB5o5MZw"
RepCuellar,1313192054466449410,2020-10-05 18:59:18,"This morning, I joined the City of Laredo and Aeromar to celebrate the new direct flight between Laredo and Mexico City. The addition of nonstop flights will help generate economic prosperity for Laredo as well as attract tourism to the area. https://t.co/J1xgEB2EyM"
RepCuellar,1313191375219896322,2020-10-05 18:56:36,"🚨ATTENTION🚨The deadline to register to vote in Texas is TODAY.

Please check in with your family, friends, and neighbors to make sure they're registered.
 
For more information:
https://t.co/1nvVU64yuy"
RepCuellar,1312843819176648710,2020-10-04 19:55:32,"The effects of coronavirus on children and their education is deeply concerning.
 
That’s why I voted for the updated #HeroesAct to provide $225 billion for education nationwide, including $182 billion for K12 schools &amp; nearly $39 billion for postsecondary education. https://t.co/Xxq4UDa25I"
RepCuellar,1312439525000409094,2020-10-03 17:09:01,🚨 ATTENTION TX28 STUDENTS: Want to win a chance to have your very own app displayed at the U.S. Capitol? This year’s Congressional App Challenge ends on Oct. 19th! https://t.co/hwq69jkv1e
RepCuellar,1312089325333602304,2020-10-02 17:57:27,".@JohnCornyn &amp; I led a bipartisan letter w/ the TX border delegation to @DHSgov expressing concern w/ continued travel restrictions at southern POEs &amp; demanding a plan to restore normal operations. 

We can balance the health of the individual &amp; the health of the border economy. https://t.co/9b2uTNeyVj"
RepCuellar,1312008062052507649,2020-10-02 12:34:32,"My prayers go to the President and the First Lady, as well as Hope Hicks and all other WH staff during their recovery.
 https://t.co/F5ZKrePNjU"
RepCuellar,1311793810658201600,2020-10-01 22:23:11,"October is #BreastCancerAwarenessMonth! As we remember the lives we lost and continue to support those enduring the battle, let’s recommit ourselves to finding a cure. https://t.co/zt7Qo1iD2J"
RepCuellar,1311752727287001090,2020-10-01 19:39:56,"Happy Birthday to our longest living U.S. President, Jimmy Carter, who turns 96 today. Thank you for all your years of continued service to our country.
https://t.co/0tAvgayP8n"
RepCuellar,1311704159482195968,2020-10-01 16:26:56,"Coronavirus has exacerbated food insecurity, a challenge many faced even before the pandemic.
 
@HouseDemocrats’ updated #HeroesAct provides a critical 15% increase to the maximum SNAP benefit &amp; additional funding for nutrition programs that help families put food on the table. https://t.co/FCz6xEFFtN"
RepCuellar,1311311311222050818,2020-09-30 14:25:54,"Today would've been SPC Guillén’s 21st birthday. Her memory sparked a movement. It is our solemn responsibility to not merely remember her &amp; listen to the voices she inspired, but to fight for real change &amp; justice for survivors. I am honored to cosponsor legislation in her name. https://t.co/x975BCf3tI"
RepCuellar,1311033366154801153,2020-09-29 20:01:26,"Farmworkers feed America. Amidst COVID-19, they have been the backbone of America. 

There could be no one worth honoring more this Hispanic Heritage Month than farmworkers. #HHM 
https://t.co/qShU4cwLW8"
RepCuellar,1311003058952957952,2020-09-29 18:01:01,"Our updated Heroes Act reflects compromise, while continuing to meet the health and economic needs of the American people. 
 
We must come together to vote on this bill for our families, schools, small business and restaurants. 

Time is of the essence. https://t.co/wr9SyCXFdy"
RepCuellar,1310649134454640646,2020-09-28 18:34:38,"“My biggest concern is that we’re going to lose these kids,” one teacher said. “They might never come back.”
 
We must pass a new COVID-19 relief package to ensure our children have access to equitable education. https://t.co/Uyd13gP6ga"
RepCuellar,1310607677408636928,2020-09-28 15:49:54,"Prescription drug prices are too high. 

I have co-sponsored and passed bills to restore competitive pricing and speed generics to market. 

Every American deserves affordable medicine to have the best chance at healthy lives.
https://t.co/z9L3MacuC3"
RepCuellar,1310393336575004678,2020-09-28 01:38:12,"Retweet this if you paid more taxes than President Trump. 
https://t.co/DeXBGwYhNx"
RepCuellar,1310326091119243266,2020-09-27 21:10:59,"For those observing Yom Kippur this evening and tomorrow, I wish all who celebrate a meaningful and reflective fast. G’mar chatima tova. https://t.co/ZwyJHtLcNn"
RepCuellar,1309587812136689679,2020-09-25 20:17:20,We must restore Congress’ central role in funding decisions for the safety and health of Americans.
RepCuellar,1309587811239112705,2020-09-25 20:17:19,"This is a major victory for our democracy in defense of our Constitution.
 
The Trump Administration sidestepped our work in the Appropriations Committee and diverted funding from our military and their families to build an ineffective and wasteful border wall. https://t.co/kpBsMlQ3Yn"
RepCuellar,1309579217605210112,2020-09-25 19:43:10,"Every 10 years, the Census occurs to get a fair and accurate count of all people living in the U.S. 
 
These numbers are used to ensure that EVERY community is represented and resourced.
 
Complete the #2020Census today at https://t.co/H6eE3Nar0I https://t.co/xvb1w2oQOC"
RepCuellar,1309514708442062849,2020-09-25 15:26:50,"Latino communities have been disproportionately harmed by the COVID-19 pandemic. That’s why it’s crucial to ensure that clinical trials for a COVID-19 vaccine fully reflect America’s diversity and include the hardest-hit populations. #HHM 
https://t.co/hR6zvFdZ2f"
RepCuellar,1309188502903500800,2020-09-24 17:50:37,Communities of color are at risk of missing out on the funding and representation they deserve for the next decade if they are not fully counted in the #2020Census. Complete your Census today at https://t.co/H6eE3Nar0I. https://t.co/0WlxViYywe
RepCuellar,1309172906291793920,2020-09-24 16:48:38,"The peaceful transition of power from one Administration to the next is a core principle of our democracy.
 
All of our nation’s leaders have to swear an oath to defend the Constitution. 

We must—and will—protect that oath."
RepCuellar,1309123266678845444,2020-09-24 13:31:23,"As the executive director of @CCharitiesRGV, Sister @nspimentel does incredible work providing humanitarian services to migrant children &amp; families at our southern border. Her selfless &amp; compassionate work inspires us all to be better to our neighbors.
https://t.co/WBbMqIojzx"
RepCuellar,1308925663127183361,2020-09-24 00:26:11,"Today, I was able to see Justice Ruth Bader Ginsburg, a champion of equality and civil rights, lying in repose.

It was an honor to see her as she made her final trip to the Supreme Court. https://t.co/awGWWD1kvt"
RepCuellar,1308875404011339776,2020-09-23 21:06:28,"In this week’s Congressional Report, we honored the life of Justice Ginsburg and her dedication to justice &amp; equality. We also talked about events that my office &amp; I participated in. Check out the newsletter below to learn more 🔽
https://t.co/1Zc1XKdKYA"
RepCuellar,1308848419868487680,2020-09-23 19:19:15,"We have just one week left to ensure we get an accurate #Census2020 count. The stakes couldn’t be higher—fill out the census today!
https://t.co/XhID5CADik"
RepCuellar,1308823776205963264,2020-09-23 17:41:19,"House Democrats have passed bills to:
✔️ Lower health care costs
✔️ Raise wages by rebuilding America
✔️ Clean up corruption and strengthen our Democracy

These issues can’t wait &amp; need to be brought to the Senate floor NOW #ForThePeople. https://t.co/hSbpPK0zGH"
RepCuellar,1308508925751422981,2020-09-22 20:50:13,"Ethan Hernandez is a prime example of how heroes come in all shapes and sizes. Thank you Ethan, for your dedication in raising money for cancer patients through actions that will help preserve our environment! 
 
https://t.co/tpfD59vaTR"
RepCuellar,1308474716005568513,2020-09-22 18:34:17,"A devastating milestone: More than 200,000 Americans have died. 
 
Behind every COVID-19 death is the loss of a family member, friend, neighbor, classmate or coworker. 
 
We will continue to pray for those currently combating this virus and remember the loved ones we have lost."
RepCuellar,1308454634290372612,2020-09-22 17:14:29,"Programs implemented under the #CARESAct have been vital to helping small businesses stay afloat. 

But there is much more that needs to be done.

This #NationalSmallBusinessWeek, I’m recommitting myself to ensuring that small businesses have the resources they need to recover. https://t.co/xsU2ecRUIQ"
RepCuellar,1308424799941791751,2020-09-22 15:15:56,"Participating in our democracy is critically important! This #NationalVoterRegistrationDay, make sure you are registered and ready to vote.
https://t.co/91RM6jOp4V https://t.co/ClfLfxiX0f"
RepCuellar,1308046395526569986,2020-09-21 14:12:17,"I am joining @GoogleDoodles in celebrating Jovita Idár, a Laredo native &amp; a pioneer in the fight of civil rights for Mexican-Americans &amp; women. Idár organized the first Mexican Congress to address racism &amp; educational opportunities for Mexican-Americans.
https://t.co/9Cc2xvcfwK"
