RepCheri,1300124861512192001,2020-08-30 17:34:56,"The American people have a right to know about foreign threats to our election. Refusing to hold in-person briefings means withholding information from the people Congress serves.

Transparency must be our top priority this November. @DNI_Ratcliffe – resume the briefings. https://t.co/XEbPXNXAGO"
RepCheri,1300094174822379522,2020-08-30 15:33:00,Thank you to all of our essential workers for the work you have done throughout this public health crisis. Our communities are stronger with you. https://t.co/Jq0AyICiZ4
RepCheri,1299470637149425665,2020-08-28 22:15:17,"Though this year has been marked by profound moments of tragedy &amp; heartbreak, the leaders of today have built a moment of resolve &amp; tenacious spirit. As they march, we’re guided in our next steps as we were by Dr. King 57 years ago.

My statement honoring the March on Washington: https://t.co/mG7vxRkeBt"
RepCheri,1299433322079236096,2020-08-28 19:47:00,"COVID-19 has wreaked havoc on every state’s budget, but the admin is covering the costs of National Guard deployments for only some states as they combat this virus.

I introduced a bill to guarantee every state receives equal treatment &amp; the help they need for as long as needed. https://t.co/6p8HheTAxw"
RepCheri,1299103522387091456,2020-08-27 21:56:30,Don't forget! Tomorrow I'll host a Q&amp;A webinar on small business loan forgiveness. You can learn more below ⤵️ https://t.co/oKxpawx0td
RepCheri,1299082681632927744,2020-08-27 20:33:41,"Local health centers are on the frontlines of this public health crisis and have stepped up to serve our neighbors.

Today I announced more than $1.2 million in federal funding to support our health centers critical efforts to keep our community healthy.

https://t.co/HCdwkSp8Je"
RepCheri,1298741332270292992,2020-08-26 21:57:17,Register at the link: https://t.co/GqtdbcxsJN
RepCheri,1298741330793967616,2020-08-26 21:57:17,"Join me and expert guests for a live Q&amp;A webinar discussing small business loan forgiveness - August 28th at 9:45am. Professionals will be on hand to help answer your questions about the Paycheck Protection Program, Economic Injury Disaster Loans, and other related topics. https://t.co/nbaG6yrIOV"
RepCheri,1298724821073670144,2020-08-26 20:51:41,"On #WomensEqualityDay, we celebrate 100 years since the adoption of the #19thAmendment granting women the right to vote.

100 years...and we still have work to do.

Today, recommit yourself to the fight moving forward, so that all Americans can make their voices heard."
RepCheri,1298672588391145474,2020-08-26 17:24:07,"Last week, I traveled to Washington to help pass the Delivering for America Act to #SaveTheUSPS.
 
Our postal service delivers the American dream. We can't stand by and let it be dismantled. https://t.co/YwKM6s9NWs"
RepCheri,1298031578757640192,2020-08-24 22:56:59,"The Administration is forcing most cash-strapped states to cover the costs of National Guard #COVID19 response efforts, while picking up the tab for a select few.

Today, I introduced a bill with @RepMaxRose and @RepDebHaaland that requires everyone receives equal treatment. https://t.co/8JK8u5PVD1"
RepCheri,1297962712316682240,2020-08-24 18:23:20,"Our nation prays for Jacob Blake as he fights for his life. We must have an immediate &amp; thorough investigation into the facts.

Black people face systemic racism every day. Change won't come without leadership. @senatemajldr:Pass the Justice in Policing Act NOW. #BlackLivesMatter"
RepCheri,1297708960896737281,2020-08-24 01:35:01,"100 days since the House passed the #HeroesAct. 

4.2 million more infected. 

89,000 more Americans dead.

The Heroes Act would deliver the help this moment demands. @senatemajldr how long of a ""pause"" did you have in mind?"
RepCheri,1297580714125393921,2020-08-23 17:05:24,.@HouseSmallBiz Chairwoman @NydiaVelazquez will join me tomorrow for a Latino Small Business Webinar! Learn how to participate below ⤵️ https://t.co/aUULhHJtjR
RepCheri,1297576004806901762,2020-08-23 16:46:41,Don't miss it! I'll be joined by @WhipClyburn tomorrow for a Small Business Webinar for Black Business Owners. Register below ⬇️ https://t.co/q40YhmBH8P
RepCheri,1297309871478644737,2020-08-22 23:09:10,"NEW: I just helped pass the #DeliveringForAmericaAct to help #SaveTheUSPS and hold this Administration accountable for their recent attacks on this critical service.

The @USPS supports lives, livelihoods and our democracy. I’ll always fight for it. https://t.co/mdVghZyFhT"
RepCheri,1297298271216504833,2020-08-22 22:23:05,"Black-owned small businesses have been hit hard by #COVID19.

This week, join me and @WhipClyburn for a Small Business Webinar for Black Business Owners, to learn about available resources and support.

Register here: https://t.co/U9jLdjMIh3 https://t.co/PEqUUwrWIP"
RepCheri,1297296970831233025,2020-08-22 22:17:55,"Small businesses are the backbone of our communities and our economy, and they need our support.

Join me and @NydiaVelazquez this Monday for our Latino Small Business Roundtable.

Register here: https://t.co/o2uS67Qwfh https://t.co/jPpDqynclm"
RepCheri,1297265379690119168,2020-08-22 20:12:23,"The @USPS delivers the American dream:

📬Birth certificates
📬College acceptance letters
📬A mortgage paid off

It’s part of the fabric of American life. We cannot let it fail. #DontMessWithUSPS https://t.co/Qcw5UNqj36"
RepCheri,1297241715078844418,2020-08-22 18:38:21,"WATCH: I just joined @AlexWitt on @MSNBC to share what the @USPS means to hardworking folks across Northwest and Central Illinois.

They told me the Postal Service is just that—a service.

Our letter carriers work #ForThePeople. We must keep it that way. 📺 📬⬇️ https://t.co/3CzuV0h7rT"
RepCheri,1297227036172455942,2020-08-22 17:40:01,Tune in! 📺 I’ll be joining @AlexWitt on @MSNBC shortly to discuss @HouseDemocrats efforts to save the USPS. #DontMessWithUSPS https://t.co/e4Q2xhOg0A
RepCheri,1297187497164902400,2020-08-22 15:02:54,"The @USPS is an American institution enshrined in our Constitution.

I’m back in Washington today to help pass legislation to put an end to this Administration’s attacks on USPS and stand up for Illinoisans who rely on their service. #DontMessWithUSPS

https://t.co/SfUZXhm1Bw"
RepCheri,1296906840551428096,2020-08-21 20:27:40,".@USPS has always united us. I won’t stand by while the administration guts these critical services. 

This week, I spoke with local postal workers to get their insight on much-needed #COVID19 relief and more. https://t.co/7e1oODdEV1"
RepCheri,1296875079461154824,2020-08-21 18:21:28,"Thank you to Ralph Lauren for working with Natural Fiber Welding in Peoria, IL and creating 100 more jobs in our community! 

https://t.co/oLRgrswEl1"
RepCheri,1296811590940008449,2020-08-21 14:09:11,"We have heroes among us in the Rock Island Arsenal Fire Department.

Read more from @Dispatch_Argus ⬇️

https://t.co/xaPP3T0GjV"
RepCheri,1296588685966794752,2020-08-20 23:23:26,"It’s been more than three months since the House passed the #HeroesAct to get families, workers, schools and local communities the aid they desperately need in the wake of #COVID19. 

Enough is enough. @SenateGOP must act."
RepCheri,1296524567339569157,2020-08-20 19:08:39,"America is a land of opportunity, and I welcome our newest citizens with an open heart. 

Congratulations on your citizenship and path to the future!

https://t.co/N9UlItfRwa"
RepCheri,1296480754730446850,2020-08-20 16:14:34,"From now until August 30, you can get a free #COVID19 test at the TaxSlayer Center in Moline, IL. 

Stay safe everyone!

https://t.co/Bed4kGNZNk"
RepCheri,1296085246828584963,2020-08-19 14:02:57,"The most important service the @USPS provides is the one that helps you. And I want to hear your story.

Tell me what the USPS means to you and how you have been impacted by recent changes by taking my short survey below. #DontMessWithUSPS 

https://t.co/8tTmLOnDyz"
RepCheri,1295849481490096129,2020-08-18 22:26:06,"100 years ago, Congress ratified the #19thAmendment. 

Now, there are more than 100 women serving in Congress. 

We still have work to do, but we are stronger than ever before. https://t.co/K0FNCSGOvC"
RepCheri,1295814693236494337,2020-08-18 20:07:52,"Read my full statement here:

https://t.co/TOiVmjnS01"
RepCheri,1295814691739127808,2020-08-18 20:07:52,"This announcement fails to address the delays and loss in service our nation has already seen. The damage has already been done. Our nation’s postal service must be fully reinstated, immediately. #DontMessWithUSPS https://t.co/FiaEqXmMvI"
RepCheri,1295409090534035456,2020-08-17 17:16:09,"The American people cannot afford to wait for @SenateMajldr to play politics.

@SenateGOP needs to take up the #HeroesAct and get vital relief to countless people still suffering from #COVID19."
RepCheri,1295353701226471425,2020-08-17 13:36:03,"Want to keep up with the latest news coming out of Congress?

Sign up for my mailing list to learn more about the latest legislative actions. ⬇️

https://t.co/DHgrkqHhSL"
RepCheri,1295151508418433024,2020-08-17 00:12:37,"It’s essential we all work together to keep everyone safe and our #COVID19 rates low. 

I encourage everyone to continue to do their part to slow the spread. Wear a mask, watch your distance and wash your hands.

https://t.co/OzDMLpNuHG"
RepCheri,1295027721794465794,2020-08-16 16:00:43,"I’m pleased to announce this federal grant to help advance crucial research happening right here in Peoria!

We must continue to invest in groundbreaking research and technology.

https://t.co/EUZ2RWo6xH"
RepCheri,1294733703093145608,2020-08-15 20:32:24,"As public servants of this great State, may we all aspire to meet it. My thoughts are with his family today"
RepCheri,1294733700740022275,2020-08-15 20:32:23,"As the longest-serving Governor in our state’s history, Governor Thompson lived a historic life of public service. The legacy Big Jim leaves behind is one of dedication to all of the people of Illinois. https://t.co/mfZl7hPzh1"
RepCheri,1294665647658610690,2020-08-15 16:01:58,"Happy 815 Day, Rockford!

As we are #CelebratingOurResilience today, I hope everyone can safely participate in events around town and follow #COVID19 precautions. 

Take a look at what’s going ⬇️

https://t.co/QB54zvJ7bE"
RepCheri,1294627237174616065,2020-08-15 13:29:21,"Every student should get a fair shot at success. 

I’m pleased to announce these federal dollars that will help provide our students with the tools and support they need to complete their degree and pursue a career.

https://t.co/ekX7lxPOte"
RepCheri,1294367060814962690,2020-08-14 20:15:30,".@HouseDemocrats passed a $4,800 check for a family of four three months ago in the #HeroesAct, and we stand ready to deliver for American families. Tell Mitch McConnell it's time to get to work. https://t.co/6enQ2RwxGW"
RepCheri,1294360099717287938,2020-08-14 19:47:50,"Mail-in ballots aren’t the only critical deliveries the @USPS makes. 
 
I’m fighting to hold the Administration accountable so that @USPS can deliver medicine for seniors and veterans, checks for workers and more.

https://t.co/a53WAZCBpu"
RepCheri,1294305392873308160,2020-08-14 16:10:27,"For 85 years, #SocialSecurity has provided economic security for millions of Americans in retirement. 

I’ll always fight to protect this crucial program and stand up against this Administration’s attacks on its funding. https://t.co/hXIEmXq2pJ"
RepCheri,1294053826178293761,2020-08-13 23:30:49,"Did you know it takes 20 months for Black women to earn the same pay white men earn in 12 months?

It’s time to close the wage gap. #BlackWomenCantWait. #BlackWomensEqualPayDay https://t.co/QNHPFppJWD"
RepCheri,1294033621645393921,2020-08-13 22:10:32,"The #HeroesAct passed the House 90 days ago to support local governments, invest in contact tracing &amp; testing, extend unemployment assistance at a FULL $600/month, provide direct payments to Americans and more to help us get through this crisis.

@senatemajldr must act, now."
RepCheri,1294019810247024648,2020-08-13 21:15:39,"No matter where you live, @USPS delivers. Veterans get medicine. Seniors get prescriptions. Workers get checks.

I will not tolerate it. #SaveThePostOffice

Read my full statement: https://t.co/wNdqTnZZNB"
RepCheri,1294019808888074242,2020-08-13 21:15:38,"'Neither snow nor rain nor heat nor gloom of night stays these couriers,’ and on my watch, neither will the Trump Administration.

Today’s comments from the White House make it clear they will do everything they can to disenfranchise voters. https://t.co/aCYq4b8Uhe"
RepCheri,1293901105496293376,2020-08-13 13:23:57,"Our economy can't recover unless hard-hit state and local governments can replace lost revenue to support vital services provided by first responders and essential workers.

.@senatemajldr must take up the #HeroesAct now to deliver the relief we need.
https://t.co/ZMBReVsZMs"
RepCheri,1293681760988008449,2020-08-12 22:52:21,"“Our states are strapped for cash and the administration continues to play political games with our Guard members in uniform,” said @RepCheri.

Our servicemembers and governors deserve a clear plan of action.
https://t.co/pH5SaiyA3F"
RepCheri,1293619879174709251,2020-08-12 18:46:28,"My #RuralGreenPartnership seeks to utilize rural America’s potential to combat the climate crisis. 

Wind energy is a crucial component of this plan to invest in our rural economies because #WindBuildsTheFuture. #AmericanWindWeek https://t.co/m3GERorIt9"
RepCheri,1293568984235872257,2020-08-12 15:24:13,"Pleased to announce that the @CityofRockford will receive $700K in relief as a direct result of the #CARESAct. As communities across Illinois continue to respond to #COVID19, my top priority will remain supporting our families, small businesses and towns.

https://t.co/z2z49Czgks"
RepCheri,1293331620385239041,2020-08-11 23:41:01,"When #COVID19 hit, our neighbors in uniform were there.

But the Administration is playing political games with their service and sticking states like Illinois with the bill.

Last week, I led my colleagues in demanding answers. Read more here ⬇️

https://t.co/dsgGNKwQmK"
RepCheri,1293278226962358272,2020-08-11 20:08:51,"13 Counties in Illinois have reached warning levels for #COVID19. I encourage residents of Northwest and Central Illinois, including Winnebago and Tazewell counties, to stay safe and help prevent the spread of this virus.

https://t.co/YjuFKvv5iC"
RepCheri,1293250846499766273,2020-08-11 18:20:03,"Our veterans and seniors depend on the @USPS to deliver their medication, every day. Slowing down mail delivery means slowing down when our family members and neighbors get the medical supplies they need.
 
We need to fully restore our postal services.

https://t.co/0kWwiYScHa"
RepCheri,1293236208647245829,2020-08-11 17:21:53,"Across Illinois yesterday, strong storms created widespread damage and knocked out power. I hope everyone remains safe and follows the directions of local authorities.

https://t.co/bNf5EZKARj"
RepCheri,1292946274426257408,2020-08-10 22:09:48,"We need to extend FULL emergency unemployment aid as part of a comprehensive pandemic response, not cut aid at this time of need.

The Senate must pass the #HeroesAct."
RepCheri,1292946273381818370,2020-08-10 22:09:48,"It’s been 10 days since emergency unemployment expired, all while @Senatemajldr chose to slow-walk @HouseDemocrats' proposal instead of helping millions of Americans."
RepCheri,1292466938212421633,2020-08-09 14:25:05,"🚨 #HometownHero Alert! I applaud Jessica McGhee and Kshe Bernard for their big hearts and commitment to help those most in need. Your work to assist the homeless does not go unnoticed. Read more from the @pjstar:

https://t.co/cYu3MbvUt7"
RepCheri,1292262101860392961,2020-08-09 00:51:08,"Any action that takes money out of the pockets of struggling American families cannot be the way forward. 

Read my full statement on today's executive order below: https://t.co/AiCeNqKnxx"
RepCheri,1292163394066415618,2020-08-08 18:18:55,It’s been 85 days since @HouseDemocrats passed the #HeroesAct. @senatemajldr has failed to do anything to provide aid to those facing this health crisis on the ground. Americans can’t afford to keep waiting.
RepCheri,1291850342930550785,2020-08-07 21:34:57,It's been 84 days since the House passed the #HeroesAct with no action from @SenateGOP. https://t.co/kpoQg5JQQM
RepCheri,1291792587054034944,2020-08-07 17:45:27,"This week I was honored to have so many local heroes join me to share their insights on the impact #COVID19 is having on our communities. 

For information on everything I’m doing to help you and your family, join my mailing list.

https://t.co/DHgrkqHhSL"
RepCheri,1291728357340655616,2020-08-07 13:30:14,"Masks only work if you wear them.

Thank you @GovPritzker for working hard to protect Illinoisans. #AllinIllinois

https://t.co/KHDwdcR5zf"
RepCheri,1291469927782715393,2020-08-06 20:23:19,"As we fight this pandemic, we need to ensure that no community is left behind. But after @HouseDemocrats passed the #HeroesAct, @SenateGOP’s proposal failed to provide adequate support for those most at risk. 

RT if you think this is unacceptable. #NoOneLeftBehind https://t.co/pWLXNOO01F"
RepCheri,1291441560291352588,2020-08-06 18:30:36,"I led a call with @RepMaxRose, @RepDebHaaland &amp; 30+ of our colleagues for the Administration to stop playing political games with our governors and neighbors in uniform.

This pandemic is far from over. It's time for a consistent, conditions-based strategy for our National Guard. https://t.co/unblFMyC1g"
RepCheri,1291441557707661312,2020-08-06 18:30:35,"Members of our National Guard carry out vital #COVID19 response efforts like setting up testing sites or delivering PPE.

But, the Admin is slashing their funding and stringing along the activations of our servicemembers with last-minute decisions.
https://t.co/dsgGNKwQmK"
RepCheri,1291421669773455361,2020-08-06 17:11:34,"55 years ago, President Lyndon B Johnson signed the #VotingRightsAct into law.

Today, it is still essential that we protect everyone’s right to vote. That’s why I helped pass the John Lewis Voting Rights Act in the House. @SenateGOP needs to follow suit.

https://t.co/M0Opb0X2wu"
RepCheri,1291381418208231425,2020-08-06 14:31:37,"HAPPENING NOW: Join me LIVE as I talk to Peoria's Public Health Administrator about what they're seeing on the ground and how the #HeroesAct can help!

https://t.co/tHh4EtQTQt https://t.co/iT0FKGT07C"
RepCheri,1291377380620206080,2020-08-06 14:15:34,Emergency #COVID19 Unemployment ran out last week and @SenateGOP still hasn't passed the #HeroesAct to renew it. https://t.co/TPVbHZiRxF
RepCheri,1291088879689306113,2020-08-05 19:09:10,.@SenateGOP won’t extend SNAP benefits but tries to double ‘three-martini lunch’ deduction. https://t.co/PA5mUGdE8f
RepCheri,1291037621242789889,2020-08-05 15:45:29,Join me LIVE at 11:15 AM CDT as I talk with Chief Program Officer at Skip-A-Long Quad Cities Deb Brownson about how #COVID19 is impacting our child care and how the #HeroesAct can help make sure our child care providers get the resources they need. https://t.co/GOLmRRPl1w
RepCheri,1290807183651766276,2020-08-05 00:29:49,"Tune in NOW for my tele-town hall with Dr. Louis Katz from the Quad Cities COVID-19 Coalition and @IDPH! 

https://t.co/tHh4EtQTQt https://t.co/07DmhxGiQp"
RepCheri,1290789015113863169,2020-08-04 23:17:37,Join me LIVE for a tele-townhall tonight at 7:30pm CDT! I will be joined by Dr. Louis Katz from the Quad Cities COVID-19 Coalition and @IDPH to connect with you on #COVID19 impacts and what resources are available to you to stay healthy. https://t.co/FPzyIQLUM9
RepCheri,1290696182377963520,2020-08-04 17:08:44,"Today at 1:15pm CST I'll join Sarah Parker, Executive Director of Shelter Care Ministries in Rockford to discuss housing challenges during #COVID19 and how the #HeroesAct can help.

Tune in to my #VoicesOfOurHeroes chat this afternoon! https://t.co/G6aforchg7"
RepCheri,1290659349539545094,2020-08-04 14:42:22,"Happy Birthday, President @BarackObama! 

Bearing witness to your inspirational call to action this week was an honor, and every day I am thankful for your leadership. https://t.co/nuKH7Tc00I"
RepCheri,1290401020623847425,2020-08-03 21:35:52,".@GovPritzker is right, a mask only works if you wear it. 

Do your part to protect one another. #AllinIllinois https://t.co/UtL14Un27r"
RepCheri,1290370603019632640,2020-08-03 19:35:00,"Last week @GovPritzker came to Rock Island, IL to directly address the pandemic concerns in the area. 

His guidance and leadership continuously puts the safety and protection of Illinois residents at the forefront. #AllinIllinois

https://t.co/cj2gHIAEhb"
RepCheri,1290362780500008967,2020-08-03 19:03:55,"Hace un año, nuestro país fue testigo de una horrible tragedia a manos de un terrorista doméstico. 

El odio no tiene lugar en nuestra comunidad. Es hora de acabar con el racismo y la violencia aquí y ahora!  #ElPasoStrong"
RepCheri,1290331677437329408,2020-08-03 17:00:19,"One year ago we faced a horrific attack on the Latino community in El Paso, Texas at the hands of a domestic terrorist. 

Hate has no place here, we must end the violence and racism once and for all.  #ElPasoStrong https://t.co/pzgA7PoVoG"
RepCheri,1290317986662952968,2020-08-03 16:05:55,"Join me LIVE in 10 minutes as I talk with local hero and school nurse Jennifer Jacobs about how #COVID19 is impacting our children and how Congress and the #HeroesAct can help make sure our schools and communities get the resources they need.

https://t.co/tHh4EtQTQt https://t.co/jtChFwdCMf"
RepCheri,1290282799308521474,2020-08-03 13:46:06,"The House passed the #HeroesAct over two months ago to provide relief where it is needed most. @Senatemajldr needs to stop delaying and start help hardworking Americans, immediately."
RepCheri,1290282798377349121,2020-08-03 13:46:06,"The @SenateGOP bill lacks sufficient support for our states and local governments, who are trying to maintain vital city services."
RepCheri,1290020589080477696,2020-08-02 20:24:10,"Communication is key! Make sure to join my mailing list so you can stay up-to-date on everything happening in the House. ⬇️

https://t.co/DHgrkqYSKj"
RepCheri,1289950055739269122,2020-08-02 15:43:54,"Vaccines protect our communities from countless preventable and dangerous diseases. This #NationalImmunizationAwarenessMonth, remember you have the power to prevent and to protect each other. https://t.co/yXBGATsjEI"
RepCheri,1289660425173209089,2020-08-01 20:33:00,"Every dog deserves to find their fur-ever home.

Today on DOGust 1st, I wish a happy birthday to every shelter dog looking for love. #ilovedogs https://t.co/5a2rMsk8KM"
RepCheri,1289569189632462848,2020-08-01 14:30:28,"Navigating this pandemic means working together to promote safety &amp; sustainability. 

I thank the Greater Quad Cities Hispanic Chamber of Commerce for giving N95 masks to businesses across the Quad Cities today! See more information below from @kwqcnews:

https://t.co/4DUDIbQZf9"
RepCheri,1289356247871795201,2020-08-01 00:24:19,"According to the @FCC, 750,000 students are in schools that still lack meaningful broadband access.

I am committed to changing this so our students can reach their full potential. #RuralBroadbandDay https://t.co/lcaDKDx3t7"
RepCheri,1289345189367013376,2020-07-31 23:40:22,"Our servicemembers and their families deserve the best care and support possible. 

As a member of @AppropsDems, I’m proud to see the House pass a funding bill that includes over $33.3 billion to meet the needs of those serving our nation. https://t.co/tK1xdk8SXJ"
RepCheri,1289330270659842054,2020-07-31 22:41:05,"In the 1940s, electricity was life-changing for much of rural America. Quality #RuralBroadband is no different. 

Our rural communities deserve access to the communication, telehealth and education high-speed internet provides. https://t.co/HLEk9Dogtv"
RepCheri,1289318435881496576,2020-07-31 21:54:04,"Our minority communities have been disproportionately impacted by the pandemic.

The $9 billion in emergency funding toward public health and emergency responses included in the @AppropsDems bill passed today will help address this gap and support families nationwide. https://t.co/yhXVZbKqZx"
RepCheri,1289302304483504129,2020-07-31 20:49:58,"In 2017, only 50% of the rural residents in the district that I serve had broadband offered by 3+ providers. By 2019, we brought that number to 86%.

I'm proud of the progress we made, but we must continue until all of our rural residents have access to robust #RuralBroadBand. https://t.co/oPH6WKBU7G"
RepCheri,1289284225007603714,2020-07-31 19:38:07,"Congratulations to @bradleyu &amp; Jason Zaborowski for receiving a grant from @NEHGov! 

I applaud your goal to create a summer professional development program for college faculty and I look forward to seeing your plan in action.

https://t.co/E7e71Hiabf"
RepCheri,1289256238329593858,2020-07-31 17:46:55,"Today, unemployment will officially run out for millions of Americans. The @SenateGOP and @senatemajldr failed to take up the #HEROES Act after two months of slow-walking on this issue. 
 
It’s been 77 days. Americans can’t afford to keep waiting. https://t.co/UoZgun3ace"
RepCheri,1289200372821577729,2020-07-31 14:04:55,"We all need a little love right now. 

The Hug Time Shield, invented right in Rockford IL, is just what we needed to spread love safely. Read the full story from @rrstar: 

https://t.co/kcvn6DCjWR"
