RepCheri,1322210425975545864,2020-10-30 16:15:05,"""Zombie bases"" can be scary, but I'm working to build a smart real estate tool - like a Multiple Listing Service (MLS) - so our military can start using these spaces. https://t.co/7dBfS4bl27"
RepCheri,1322171553258393601,2020-10-30 13:40:37,"As we near the holiday season, I am calling on all Illinoisans to do their part to minimize the spread of #COVID19.

Protect our community and limit exposure as much as possible. #AllinIllinois

https://t.co/6MreEAFaU6"
RepCheri,1321943434400321536,2020-10-29 22:34:09,"Correction facilities like USP Thomson need direct hiring authority to fill their vital positions.

That is why I pushed to secure language to encourage the BOP to provide it in House-passed FY21 appropriations bills. https://t.co/eqdOLQIwSk"
RepCheri,1321883094815707137,2020-10-29 18:34:23,"The Navigation and Ecosystem Sustainability Program is a critically important program that helps support our farmers, waterways and economy. If we want to move toward the future, the Corps need to help them modernize.

https://t.co/FNPIG3d70e"
RepCheri,1321812369081831425,2020-10-29 13:53:21,"Voting is absolutely essential, and people like Pekin native Harriet Harris know it!

Don’t forget to get your vote in by November 3rd! 

https://t.co/pAL7YKh7Cm"
RepCheri,1321556999654563841,2020-10-28 20:58:36,"Our locks and dams are essential to our agricultural economy.
 
That's why I led a bipartisan, bicameral call urging @USACEHQ to include construction funding to modernize and expand 7 outdated locks on the Upper Mississippi River in the FY21 Work Plan.

https://t.co/SQQqKr2FDn"
RepCheri,1321518077931102212,2020-10-28 18:23:57,"RT @SafeRoadsNow: @SafeRoadsNow commends @SenatorDurbin, @SenDuckworth, @RepCheri &amp; @RepAndreCarson for sponsoring the Protecting Roadside…"
RepCheri,1321496589316272128,2020-10-28 16:58:33,"Our nation would not be where it is now without the hard work and dedication of the immigrants across our communities.

In Illinois alone, there are over 1.8 million immigrants.

I thank them for their contributions! #NationalImmigrantsDay https://t.co/PgVYgWDytZ"
RepCheri,1321485859229749249,2020-10-28 16:15:55,"RT @CornRefiners: Inland waterways are essential to ag, &amp; this bipartisan call for infrastructure improvements along the Upper Mississippi…"
RepCheri,1321471517448937473,2020-10-28 15:18:56,"Dr. Fauci has become our North Star when it comes to public health and #COVI19.

I’m calling on all Illinoisans to continue to practice social distancing, wear masks, &amp; model best practices to halt the spread of #COVID19 through our communities

https://t.co/32bfE7IisR"
RepCheri,1321259520010735617,2020-10-28 01:16:32,"Health care is more than our bodies – we need to take care of our mental health as well.

That is why I made sure to include $35 million in the Labor HHS FY 21 Appropriations bill to help states support mental illness prevention, treatment and rehabilitation services. https://t.co/penuN0jzf7"
RepCheri,1321184603802054659,2020-10-27 20:18:50,"Today the Northern Illinois Food Bank Pop-Up Market donated their 1 millionth pound of food since the start of #COVID19.

No one should ever have to worry about where their next meal will come from. Thank you for giving back to those most in need. https://t.co/rEqPvNdJ2f"
RepCheri,1321153080461840385,2020-10-27 18:13:34,"The infrastructure we build today is the foundation for our future!

Thank you @GovPritzker for your leadership on the Rebuild Illinois capital program. The critical upgrades to the Murray Baker Bridge mean it will be structurally sound for Peoria and the surrounding communities. https://t.co/ugEUMakITK"
RepCheri,1321124581193748488,2020-10-27 16:20:20,"#Covid19 has made it clearer than ever that everyone needs reliable high-speed broadband. 

Yet millions still don’t have the have access they need. Instead of abandoning #NetNeutrality, we need to restore it &amp; ensure everyone has reliable and affordable broadband. https://t.co/XcooQmozPb"
RepCheri,1321098322078322688,2020-10-27 14:35:59,"Pekin Prison is the site of a #COVID19 outbreak.  @SenatorDurbin, @SenDuckworth and I are calling on testing for every Pekin Prison staff member and inmate.

If we want to protect our community and promote the health and safety of all, immediate testing is absolutely crucial! https://t.co/AHu5SAOCWk"
RepCheri,1320861295059652609,2020-10-26 22:54:07,"I worked to secure $10 million for local Social Determinants of Health programs because you deserve the best chance at a full and healthy life!

Whether its food deserts or lack of access to quality providers, several factors play into your overall health. https://t.co/vVnjbJPjnl"
RepCheri,1320771974600269829,2020-10-26 16:59:12,"Tune in TODAY at 6pm for a Teletown Hall with me and @StateRepWEST hosted by @AlzILAdvocacy!

We will be discussing research funding, resources, and more!

Visit the link below to register: https://t.co/Y0we01QA93 https://t.co/iy88JJCnm0"
RepCheri,1320733573046030336,2020-10-26 14:26:36,"Voting is the #1 way to ensure your voice is heard!

Do you have vote plan ready? #DontBooVote https://t.co/l7ww5MSC5m"
RepCheri,1320547139525685250,2020-10-26 02:05:47,"Floods are no treat - they damage homes, harm crops and hurt our local economy.
 
When our rural communities were hit with historic flooding, I worked to make sure the U.S. Army Corps of Engineers stepped up for Illinoisans. https://t.co/dqrtOP4AZh"
RepCheri,1320536952987418624,2020-10-26 01:25:18,"Tune in tomorrow at 6pm CDT as I join @StateRepWEST and @AlzILAdvocacy for an important discussion on Alzheimer’s and the resources available to you and your loved ones.

Register here: https://t.co/AiYOIWIyna https://t.co/3KR2aJNtdL"
RepCheri,1320395568489861120,2020-10-25 16:03:29,"🚨 #HometownHero Alert🚨

When #COVID19 impacted trick-or-treat plans, Freeport mom Daniella Rogers organized a safe candy delivery for the kids unable to go out this year! #NoTricksAllTreats

Read more from @journalstandard ⬇️

https://t.co/2yBzBUCVqo"
RepCheri,1320146560404119554,2020-10-24 23:34:01,"Ag research like the work at the Peoria Ag Lab can produce some real treats, like combating antimicrobial resistance.

It's why I pushed for more funding for ag research. This year, the House passed $3.3 billion – that’s a 3.2% increase from FY20! #13DaysOfHalloween https://t.co/UFGVPiMVwL"
RepCheri,1320093257389531139,2020-10-24 20:02:13,"As the weather gets colder, please make sure you are doing your part to stay safe and slow the spread of #COVID19.

Together we can overcome this pandemic! 

https://t.co/5b8RFRtEiV"
RepCheri,1319988379673645059,2020-10-24 13:05:28,"🚨 HAPPENING TODAY 🚨 
 
USP Thomson will be hosting a job fair from 9am – 4pm at the USP Thomson Training Center
 
They have several positions to be filled, if you are interested do not hesitate to stop in!

Contact (815)259-1000 or TOM/Recruitment@bop.gov for more information https://t.co/JMK5BTRu6T"
RepCheri,1319801768713310208,2020-10-24 00:43:57,"Using spaces our military already has, like those at the Rock Island Arsenal, saves 💰 &amp; creates jobs- much better than gathering dust🕸 
 
I proposed a pilot program to help our military make the most of these resources &amp; secured $3 million in funding for this innovative system. https://t.co/jA1cl7N4uW"
RepCheri,1319765127701331969,2020-10-23 22:18:21,"I am thrilled to receive the support of these homegrown leaders today and look forward to working with them to take this next step toward a brighter tomorrow for our corn farmers and the biofuels industry.

https://t.co/RimUqB7hYl"
RepCheri,1319697640070778880,2020-10-23 17:50:10,"Los trabajadores de primera línea MERECEN protección durante esta PANDEMIA.
 
#ConozcaSusDerechos

Si está enfermo con #COVID19 puede calificar para licencia por enfermedad y/o familiar pagada.

Viste https://t.co/w9vqI0MUIv para más información https://t.co/UnU93SxRSn"
RepCheri,1319697635733835776,2020-10-23 17:50:09,"I helped pass the #FamiliesFirstAct to protect American workers and their families amid #COVID19.

Learn more to see if you qualify for #PaidSickLeave 👉https://t.co/El4xpVIeCS

#KnowYourRights! https://t.co/QdmFNLXssS"
RepCheri,1319643095085056001,2020-10-23 14:13:26,"Make sure you have your plan to vote ready!
You know what’s scary? Not voting.

Find more information about early voting here: https://t.co/hHRBXj58EZ. https://t.co/sTXEPVBik0"
RepCheri,1319438102792970241,2020-10-23 00:38:52,"I hear about teacher shortages everywhere I go in our district - that's why I secured measures in the Labor HHS FY 21 Appropriations bill to ensure TEACH grants are being used to help place teachers where they are needed most! 
#DoubleBubbleToilAndTrouble #13DaysofHalloween https://t.co/7TjO88of1U"
RepCheri,1319419287258497027,2020-10-22 23:24:06,"When I saw the need for housing support in our communities, I included funding to homeowners &amp; developers for community revitalization of distressed or abandoned housing in the House-passed HUD appropriations bill.

Instead of gathering 🕸🕷 these homes can start anew! https://t.co/HVF8UzukKv"
RepCheri,1319385127609356289,2020-10-22 21:08:22,"Picking &amp; choosing favorites with disaster relief funding is a dangerous game that puts American lives at risk. 

Each state deserves to be supported in its #COVID response. Read my full statement:

https://t.co/Wwp63rkHyj"
RepCheri,1319336991809556490,2020-10-22 17:57:05,https://t.co/iciurntp1u
RepCheri,1319336863467962368,2020-10-22 17:56:35,"Our school nurses are truly #HometownHeroes for all their hard work and dedication to our student’s safety.

I applaud them for their strength and hope we can all take away compassion, determination and resilience from their example. #AllinIllinois 

https://t.co/GTKD79jT2T"
RepCheri,1319291327389917188,2020-10-22 14:55:38,"Nadie debería enfrentar el desalojo durante una PANDEMIA.

Si tiene problemas para pagar el alquiler, puede calificar para la protección contra el desalojo.

Visite https://t.co/w9vqI0vjjV para obtener más información.

#ConozcaSusDerechos"
RepCheri,1319291202731008007,2020-10-22 14:55:08,"No one should face eviction during a PANDEMIC. 

If you’re having trouble paying rent, you may qualify for eviction protection.

Visit https://t.co/El4xpVZPuq for more information.

#KnowYourRights https://t.co/P1VVQoMBsC"
RepCheri,1318986809804836865,2020-10-21 18:45:35,"At today’s Stand Down for Homeless Veterans event in Peoria, IL, we were all able to come together to help provide vets with necessities such as winter boots, coats, gift cards and socks.

Proud to be part of a community that gives back to those who have given us so much. https://t.co/rmWO153KrG"
RepCheri,1318906372231172097,2020-10-21 13:25:57,"How are YOU voting this year? By mail? Early at the polls? On Election Day?

Visit https://t.co/hHRBXj58EZ to learn more about voting in IL and make sure you have a plan to make your voice HEARD. https://t.co/FMz7lcnuSo"
RepCheri,1318641306575511552,2020-10-20 19:52:41,"The funding for NESP would modernize &amp; expand 7 outdated locks on the Upper Mississippi &amp; Illinois Rivers!

After securing funding in Appropriations &amp; pushing the Corps to prioritize this project, we’ve finally seen dollars flowing for this critical program.
#13daysofhalloween https://t.co/vzBsHipLES"
RepCheri,1318600202987704321,2020-10-20 17:09:21,"Mercyhealth was provided $21 million in #COVID19 relief funding by Congress. Their decision to refuse some Medicaid patients’ insurance amid a global pandemic is unconscionable.

I joined @tmcrkfd and @StateRepWEST to hold Mercyhealth accountable.

https://t.co/QnmFB1ks8L"
RepCheri,1318545512660959232,2020-10-20 13:32:02,"If everyone living with Alzheimer's in Illinois lived in one city, it would be the second-largest city in Illinois.

That is why I am joining @StateRepWEST and @alzIllinois to discuss research, available resources, healthy living and more.
Don’t hesitate to register! https://t.co/mGwf7PxeLd"
RepCheri,1318335562479185921,2020-10-19 23:37:46,"This Halloween season it's all treats, no tricks from me!
 
Pioneered by a Rock Island small business, soft recoil artillery systems make it possible to mount large artillery systems onboard lightweight vehicles!

Our soldiers deserve to be better equipped &amp; protected. https://t.co/y3RaxrxlXN"
RepCheri,1318304094277279744,2020-10-19 21:32:43,"This Saturday, Oct 24, USP Thomson will be hosting a job fair from 9am – 4pm at the USP Thomson Training Center

If you are interested in a career in corrections, do not hesitate to participate!

Contact (815)259-1000 or TOM/Recruitment@bop.gov for more information https://t.co/LPtbZOriUo"
RepCheri,1318235577289003008,2020-10-19 17:00:27,"“40% of [US] corn... goes through an ethanol plant. We have to have that industry...Cheri gets it."" ~ Galesburg farmer Jim Purlee

I do get it. That's why I introduced the Next Generations Fuels Act to support the ethanol industry &amp; keep us moving forward!
https://t.co/Nq5gl4R1yQ"
RepCheri,1317928883094736899,2020-10-18 20:41:46,"Did you know TODAY is the LAST DAY to register to vote online?

You can help decide if you get a trick or treat this election 🎃 https://t.co/z0pwbdxva1"
RepCheri,1317874270849142784,2020-10-18 17:04:45,"Proud to have received a 100% score for my record fighting for clean water!

Working to reduce pollution and ensure everyone has access to clean drinking water is critical. Thank you to @cleanh2oaction.

https://t.co/L1obzkbuyX"
RepCheri,1317552598396915713,2020-10-17 19:46:33,"In Rockford, 8,000 more Medicaid patients will not have their insurance accepted at MercyHealth after October 22nd.

Today, I joined @tmcrkfd and @StateRepWEST to call on MercyHealth to put people over profit and continue to accept Medicaid coverage in a pandemic. https://t.co/RVqJuJqWsR"
RepCheri,1317491209129132038,2020-10-17 15:42:36,"I love our local farmer's markets both for their delicious products and the chance to speak directly to our local farmers and community members on the issues that are important to them. 

Thank you to everyone at the Sterling Farmers Market for all your hard work and honesty. https://t.co/SFzg8mgERe"
RepCheri,1317148867037663238,2020-10-16 17:02:16,"Illinoisans are still struggling &amp; unemployment is at its highest since August. We need another round of stimulus checks &amp; extensions for unemployment benefits. 

I helped pass the updated #HeroesAct because we need to deliver support to help our communities navigate #COVID19."
RepCheri,1316880221178630149,2020-10-15 23:14:45,"Proud to work with @RepFinkenauer to get these ports the designation they deserve. (2/2)

https://t.co/e3WQdgGbEF"
RepCheri,1316880219958091776,2020-10-15 23:14:45,"The port designations for portions of the Mississippi and Illinois Rivers will make clear the importance of our regional economy to the nation. 

Federal recognition opens up doors to funding and will raise the profile of our area, spurring collaboration and investment. (1/2)"
RepCheri,1316808040092495872,2020-10-15 18:27:56,"In the past 100 years, Kaare Nevdal served in WWII, traveled across the world &amp; gave back to his community in so many ways.

I was honored to present him with our office flag &amp; preserve his memory in the Congressional Record as a small token of gratitude.

Happy 100th Birthday! https://t.co/ypgoHQKQ7Y"
RepCheri,1316090592275894273,2020-10-13 18:57:03,"Today at 2pm CST I will be joining #HometownHeroes Liz and Lucy Lareau. This mother-daughter team wrote “Food Fight for Fiona” to address student hunger.

I'm excited to discuss this important topic with this dynamic duo! 

https://t.co/CsMlOZy5al"
RepCheri,1316027961791848449,2020-10-13 14:48:11,"ATTN: On October 24, from 9am – 4pm USP Thomson is hosting a job fair.

They have a number of openings they are eager to fill! https://t.co/JHMALoNxAo"
RepCheri,1315332570519949315,2020-10-11 16:44:57,"One of the greatest honors of my life is being a grandmother to three beautiful children.
 
They inspire me to leave the world better than I found it and fight for a better tomorrow.
 
Happy #GrandmothersDay to everyone caring for the grandchildren in their life! https://t.co/yQvsQaBcbs"
RepCheri,1315050490162565127,2020-10-10 22:04:03,"Thanks to Intellihot, individuals and families struggling with homelessness will have access to clean, hot water. This is great news for the Galesburg community and those in need.
 
https://t.co/q8gMc3JRu4"
RepCheri,1314928360427008000,2020-10-10 13:58:45,"Your mental health is a critical part of your overall health. 
 
On this #WorldMentalHealthDay, remember that there are people ready to support you when you need it.

Visit https://t.co/kouvCG4rV5 for more information and resources available to you. https://t.co/IZUiAzt3wC"
RepCheri,1314668144473108482,2020-10-09 20:44:45,"Research has shown that personal letters can reduce the rate of suicide and suicidal behaviors.

Our veterans deserve our support and I am heartened to see @DeptVetAffairs launch their caring letter program to ensure they receive the care they need.

https://t.co/7TJ4qS7rBT"
RepCheri,1314651730680975361,2020-10-09 19:39:32,"Equality is the foundation of living a life with dignity. I’m honored to receive a perfect score from @HRC on their Congressional Scorecard &amp; will continue championing LGBTQ+ rights. #HRCscorecard

Link: https://t.co/VdJUvu7tCX https://t.co/6k41opMsUP"
RepCheri,1314602405405904897,2020-10-09 16:23:32,"Exactly eight years ago, 14-year-old Malala Yousafzai was nearly killed because she was a young woman who wanted an education.

She survived &amp; as a testament to her courage, continued her activism, later becoming the youngest Nobel Peace Prize winner.

https://t.co/cSKvd11LFD"
RepCheri,1314330184242409472,2020-10-08 22:21:49,"Investing in clean, renewable energy is a huge step in our efforts to address climate change.

I’m proud that Rock Falls is a local leader in the fight for clean energy and a bright future for us all. https://t.co/xSsJ7ujKM2"
RepCheri,1314289105942065152,2020-10-08 19:38:35,"Our veterans have sacrificed for us, so we must stand up for them.

This week, I was honored to visit the Peoria War Memorial, and will continue to fight for the men and women who have served our nation. https://t.co/JNWNzMoUrU"
RepCheri,1314232582620549120,2020-10-08 15:53:59,"October is #BreastCancerAwarenessMonth.

Don’t let this disease win! Make sure you are getting yourself checked and going to the doctor when needed. https://t.co/AMBJDeWSX0"
RepCheri,1313830986128527361,2020-10-07 13:18:11,"Registering online takes only a few minutes!

Visit https://t.co/Hga5qKdHLm to get started #VoterRegistration https://t.co/Hr7IdvRZQt"
RepCheri,1313676156349173761,2020-10-07 03:02:57,"The President's decision today discards the sacrifices made by millions of Americans over the past eight months and throws any hard-fought progress toward recovery out the window.

The American people deserve a leader who will show up, not give up.

https://t.co/58zTmmuau9"
RepCheri,1313588894051508224,2020-10-06 21:16:12,What we do now impacts the health of our people and the health of our nation. The President should join House Democrats and pass much-needed relief. (3/3)
RepCheri,1313588893166469122,2020-10-06 21:16:12,"Refusing to negotiate in good faith is refusing to take action to heal a country in pain. We must persist for those who we have lost, those who are sick, those unemployed and those struggling to feed their families. (2/3)"
RepCheri,1313588891941830664,2020-10-06 21:16:11,"I’m grateful President Trump received the highest-quality medical care &amp; treatment after his COVID-19 diagnosis.

The millions of Americans who have tested positive for COVID–and hundreds of thousands who have died–deserve an effort from him worthy of their loss and sacrifice. https://t.co/AtBV0IEZwY"
RepCheri,1313546496361496576,2020-10-06 18:27:43,"You have until Oct 18th to register to vote in Illinois online. 

Don’t miss your chance to determine your future!

https://t.co/Hga5qKdHLm https://t.co/WfJmQp0hvJ"
RepCheri,1313476118591213576,2020-10-06 13:48:04,"Are you interested in a career in corrections? 

On October 24, from 9am – 4pm, USP Thomson is hosting a job fair. They have a number of positions they need to fill! 

Contact TOM/Recruitment@bop.gov for more information. https://t.co/5WSUcsGKPT"
RepCheri,1313163030012854274,2020-10-05 17:03:58,"Teachers are the foundation of our education system. They deserve our support.

That is why I introduced the RETAIN Act, to make sure our teachers are given the tools they need to educate our students #WorldTeacherDay https://t.co/AMGa9H77TG"
RepCheri,1313110095904071682,2020-10-05 13:33:37,"The @FBI has warned against false claims of hacked voter information. 

For decades, mail-in-voting has been a safe way for thousands of people to use their voice in our elections.
 
Make sure to always check your sources &amp; don’t get spooked too soon 👻 https://t.co/kHiVZDwiBJ"
RepCheri,1312842310162550784,2020-10-04 19:49:32,"Today kicks off #MentalHealthAwarenessWeek.
 
Mental health is important for each of us. If you are struggling, know you are NOT alone. 

Visit https://t.co/QGMS0qQql7 for more information. https://t.co/orKXS8vf9I"
RepCheri,1312779017834168321,2020-10-04 15:38:02,"If you know me, you know I love dogs! 

On today’s #WorldAnimalDay, I’m proud to celebrate the furry friends who give us so much love, every day. #ilovedogs https://t.co/irDubbRlyL"
RepCheri,1312540609324949505,2020-10-03 23:50:41,"No one should ever face discrimination due to pregnancy or be denied basic accommodations.

I will continue my commitment to supporting pregnant women in and out of the workplace.

https://t.co/qigSwpyzC4"
RepCheri,1312007464456462336,2020-10-02 12:32:10,"I’m wishing @POTUS, @FLOTUS and all those at the White House or elsewhere who contracted the #coronavirus a fast recovery.

This pandemic is serious and it can affect anyone. We must all do our part to stop it."
RepCheri,1311856236262981633,2020-10-02 02:31:14,"Justice Ginsburg spent a life refusing to ever be told that her gender should, or could, hold her back.

Many of the rights we now take for granted, she painstakingly carved into American legal history.
 
The duty to carry her torch forward now lies with us. https://t.co/EVPD3jLxYm"
RepCheri,1311845454439735297,2020-10-02 01:48:23,"Today, I cast my vote for Heroes 2.0, which would finally deliver much-needed relief for hardworking Americans.

It is my sincere hope that the actions today will help us finally get the assistance our local communities truly need.

https://t.co/mhTO1hWNwn"
RepCheri,1311762816471363584,2020-10-01 20:20:01,"October is #NationalBullyingPreventionMonth.

Together, we can create a kinder world for all students. 
Learn what you can do at https://t.co/ZMa26A9te6 https://t.co/KyBQPeIocz"
RepCheri,1311697247193755648,2020-10-01 15:59:28,"Today kicks off #DomesticViolenceAwareness Month.
 
Together, we can break the silence.  If you or someone you know needs help, call the National Domestic Violence Hotline at 1−800−799−7233 https://t.co/gXNTklImJl"
RepCheri,1311453615815643136,2020-09-30 23:51:22,"This week, I am helping pass legislation to ensure our families will be fed and our farmers supported.

Join my mailing list to connect with me and stay updated on my legislative actions on and off the floor.

https://t.co/DHgrkqHhSL"
RepCheri,1311344723655897088,2020-09-30 16:38:40,"Did you know the #2020Census is the FIRST census available online?

Do not miss out on your chance to #BeCounted.

It only takes a few minutes. https://t.co/y6DpkhJQr9"
RepCheri,1311294671289815044,2020-09-30 13:19:46,"Are you interested in applying for a military academy? 

My office can help. Visit the link below to learn about the military academy nomination process. 

https://t.co/GwJFPy787R"
RepCheri,1311049938403500033,2020-09-29 21:07:18,"No one wants a broken heart.

Make sure you are taking care of yours and doing what you can to lower your risk of heart disease. #WorldHeartDay https://t.co/vcd83PDQVR"
RepCheri,1311025109130510338,2020-09-29 19:28:38,".@HouseDemocrats have passed over 600 bills #ForThePeople.
 
This includes bills to protect our workers, help rebuild our economy &amp; improve our infrastructure. 
 
@senatemajldr, the people should be your priority. https://t.co/atzBG7Y1Ag"
RepCheri,1310692225681154048,2020-09-28 21:25:52,"The Chicago Rockford International Airport is a backbone for our regional economy and provides jobs for the Rockford community.

This funding is essential in supporting Rockford. 

https://t.co/j3G4tpXFOp"
RepCheri,1310624268946944001,2020-09-28 16:55:50,"#COVID19 has hit us all hard, but Latinos have higher rates of infection, hospitalization and death from the pandemic compared to the average population.

During #HispanicHeritageMonth, let’s redouble our efforts to address these inequities and keep ALL our communities safe. https://t.co/VailPzkI0A"
RepCheri,1310574299544203264,2020-09-28 13:37:16,"Our students deserve a good education. This year, it will take all of us working together to make sure they stay safe as well.

https://t.co/zCcABkRpqw"
RepCheri,1310397353598255104,2020-09-28 01:54:09,"To everyone who observes, wishing you a peaceful and meaningful #YomKippur. 

Gmar Chatima Tova"
RepCheri,1310247371696209927,2020-09-27 15:58:11,"A global health crisis is not a game.

202,000 people have died. Wear a mask.

https://t.co/uy0v51M7kJ"
