RepCheri,1247255094342623232,2020-04-06 20:09:22,Thank you to all of the retail workers who continue to keep the shelves stocked when we need to make a trip to the store! https://t.co/n1Y4fLkb3w
RepCheri,1247238764793118720,2020-04-06 19:04:28,ICYMI: @IRSnews recently warned taxpayers of coronavirus-related scams. I encourage Illinoisans to remain vigilant and follow tips on how to handle potential scams here ⤵️ https://t.co/0zgI145nPM
RepCheri,1246825110079787010,2020-04-05 15:40:45,Are you a small business located in #IL17? Join me for a small business webinar on #coronavirus information ⤵️ https://t.co/EKMice7tMc
RepCheri,1246465086274908166,2020-04-04 15:50:09,"This is welcome news. Social Security beneficiaries should not have to complete their tax returns to see relief. Learn more here:
 
https://t.co/eluqHlYBx3"
RepCheri,1246171228370620422,2020-04-03 20:22:28,"Even as we stay home, Illinoisans have been going above and beyond for one another. If you’ve seen a neighbor respond to the coronavirus outbreak in an extraordinary way, submit them to be a #HometownHero ⤵️
 
https://t.co/W75DMtNJOU"
RepCheri,1246155851880181760,2020-04-03 19:21:22,"If you are a local business interested in participating, please fill out the form here:

https://t.co/FWytlr5OUW"
RepCheri,1246155850475098113,2020-04-03 19:21:21,"These webinars will focus on providing information to questions on how small businesses can apply for access relief programs in the wake of the coronavirus and will be separated into the Northern, Western and Southern parts of the region."
RepCheri,1246155848797347848,2020-04-03 19:21:21,"Next week, my office will host three regional small business webinars on Monday, Tuesday, and Wednesday at 10:00 a.m. CST. Learn how to participate in this thread ⬇️"
RepCheri,1246064983332487168,2020-04-03 13:20:17,An important update for Social Security beneficiaries from the @WaysMeansCmte ⬇️ https://t.co/lCYc7X5cPo
RepCheri,1245874892215640064,2020-04-03 00:44:56,"“More than 50 farmers and their tractors lined the streets, making sure they stood to support a man despite the threat of the coronavirus.”

Read the full story from @wqad about how neighbors came together in Reynolds, IL ⤵️ #HometownHeroes

https://t.co/28Ql0jdVSc"
RepCheri,1245857965355094019,2020-04-02 23:37:40,"If you have seen a neighbor go above and beyond like this, I want to hear about it. Share stories of #HometownHeroes below!

https://t.co/iA82bmMGLr"
RepCheri,1245857963350175744,2020-04-02 23:37:40,"During this time of need, Illinoisans are stepping up to help their neighbors. In Galesburg, one family started a movement by placing hearts in the windows, and in Peoria a distillery has shifted to making hand sanitizer before officially opening."
RepCheri,1245857676560461825,2020-04-02 23:36:31,"RT @congressfdn: For excellence in Constituent Service, we recognize @RepKendraHorn, Rep. @RobWittman, @MikeKellyPA, @RepShalala, @RepCheri…"
RepCheri,1245701775321112580,2020-04-02 13:17:01,"As always, my office stands ready to help. If you are in need of assistance, please don’t hesitate to reach out:

https://t.co/41E1MH2B7u"
RepCheri,1245701773689577478,2020-04-02 13:17:01,"I’m honored to have our team recognized in this critical service and proud of what our office is able to accomplish for Illinoisans every day.

https://t.co/f7zpz2LbrK"
RepCheri,1245701770749382660,2020-04-02 13:17:00,"As our country faces the impact of COVID-19, our team is focused on helping the people of Northwest and Central Illinois navigate the vital resources they need, from unemployment benefits to small business grants and loans."
RepCheri,1245701769394520064,2020-04-02 13:17:00,"Every morning, my staff and I show up to work motivated by the belief that government should work #ForThePeople. It’s this mentality that drives every aspect of our operation, especially constituent services."
RepCheri,1245701767674953728,2020-04-02 13:17:00,"Today, I’m incredibly proud to announce that my office was named a finalist in @congressfdn's #DemocracyAwards for exceptional constituent services. This recognition puts our office among the top eight in Congress for the way we interact with, assist and serve residents of #IL17. https://t.co/SmgOw0qeMG"
RepCheri,1245482365935398916,2020-04-01 22:45:10,"Even though Black Band Distillery in Peoria has yet to open, they have already shifted their operation to produce hand sanitizer amid the #coronavirus outbreak. I applaud this #HometownHero for their efforts in our community! @WCBURadio has the story ⬇️

https://t.co/Bk50tqGbMQ"
RepCheri,1245432099349434368,2020-04-01 19:25:26,Thank you to all of our child care providers who continue to take care of our children during this critical time! https://t.co/xA5Y05uj1y
RepCheri,1245413475024805891,2020-04-01 18:11:25,Today is #CensusDay! Did you know you can #ShapeYourFuture and complete the 2020 Census safely from home? Go to https://t.co/GJymKzZ21g to be counted.
RepCheri,1245391384351301632,2020-04-01 16:43:38,The Arsenal’s top-notch manufacturing capabilities can help make much-needed equipment like masks &amp; ventilators.
RepCheri,1245391382635843594,2020-04-01 16:43:38,".@SenatorDurbin, @SenDuckworth &amp; I spoke with the @USArmy about how we can utilize the talent at the Rock Island Arsenal to respond to the #coronavirus.

https://t.co/GntthbbbzG"
RepCheri,1245363639089012737,2020-04-01 14:53:23,"If you, or a loved one, are in need of assistance, please don't hesitate to contact my office here:

https://t.co/41E1MH2B7u"
RepCheri,1245363637843300352,2020-04-01 14:53:23,"As many in our community face an uncertain future, it is my hope that we can help those who have been stuck far away from their loved ones navigate these challenges just a bit more easily."
RepCheri,1245363636568231942,2020-04-01 14:53:23,"Welcome back, Charlie, Jeremy and Michael! 

No American should be unable to return in our country’s time of need."
RepCheri,1245363635045662721,2020-04-01 14:53:22,"""Cheri Bustos herself called me this afternoon [to check that we made it home safely],"" said Barchett, a Peoria resident. ""Her office was the most beneficial from interacting with people as far as what we can do for next steps to get home."" @25NewsWEEK ⬇️

https://t.co/VQmL8M9Mty"
RepCheri,1245150078727225344,2020-04-01 00:44:47,"Today is another dark day. But our communities are strong, our people are resilient and, together, we will weather this storm."
RepCheri,1245150077557059586,2020-04-01 00:44:46,"We must stay focused on practicing the preventive measures recommended by the @CDCgov and @IDPH, as well as continue taking the proper steps to prevent the continued spread of this virus."
RepCheri,1245150076462419971,2020-04-01 00:44:46,"We face challenging times, but even as our hearts break for what we have lost, we must all continue to move forward together."
RepCheri,1245150075153780741,2020-04-01 00:44:46,"This afternoon, the first coronavirus-related deaths in Northwest Illinois were reported. My prayers are with these individuals’ families and friends, whose loved ones were taken from them too soon. Today, our entire community holds you in our thoughts as we grieve together."
RepCheri,1244967847534694401,2020-03-31 12:40:39,Thank you to all of our farmers and producers who play such a critical role in our food supply during this time! https://t.co/l5fbUEc98N
RepCheri,1244765228820299777,2020-03-30 23:15:31,"To all of our health care workers who are on the front lines of this battle against #coronavirus, we thank you for your tireless work! https://t.co/1h6C9hKsqn"
RepCheri,1244714991149776896,2020-03-30 19:55:54,"Throughout this time, it’s important we all continue to follow updates from @CDCgov and @IDPH to lookout for the health and safety of our communities. For the latest information, Illinoisans can look here:
 
https://t.co/wgEb08tSW5"
RepCheri,1244669169037127681,2020-03-30 16:53:49,"On Friday, we came together to pass the third bipartisan bill to combat the #coronaivurs – the CARES Act. This significant legislation works to bring relief to America’s workers and families during this difficult time. Learn more about it in the @qctimes:  https://t.co/2ytnGSVJum"
RepCheri,1244050403718828032,2020-03-28 23:55:04,"Our state has seen dark days before and today is no exception. But our communities are strong, our people are resilient, and together we can weather this storm."
RepCheri,1244050401562894336,2020-03-28 23:55:03,"Today, the first known infant death from COVID-19 was reported in Illinois. My heart breaks for this family as they face an unimaginable loss and tonight my prayers are with them."
RepCheri,1243948696749957121,2020-03-28 17:10:55,"RT @GovPritzker: We're expecting severe weather across the state today, especially in central and northern Illinois.
 
While you’re staying…"
RepCheri,1243947577474777090,2020-03-28 17:06:28,"Many communities throughout the Quad Cities region are currently under flood warnings or flood advisory. For the latest information, please visit @NWS here:

https://t.co/RKwnQquxCF"
RepCheri,1243605520159776768,2020-03-27 18:27:15,"""No bill is ever perfect, but this bipartisan agreement is a significant step forward in delivering relief.”

You can learn more details about this legislation here: 

https://t.co/BVwjuijKfj"
RepCheri,1243605518788120576,2020-03-27 18:27:15,"""This bold legislative package will support workers who have lost their jobs, help feed children whose families face uncertain financial futures and build a stronger foundation for the farmers who feed the world, as our nation weathers this storm."""
RepCheri,1243605517173473281,2020-03-27 18:27:15,"My full statement ⤵️

""Today, Congress and the President have the opportunity to come together – even as we must stand apart – to strengthen our communities, face this viral threat head-on, and stand as one for the American people."""
RepCheri,1243605515936108545,2020-03-27 18:27:14,"NEWS: The House just passed the bipartisan CARES Act, the most significant relief package in American history. I supported this legislation because it puts America’s workers and families first, while strongly bolstering the federal government’s response to the coronavirus crisis."
RepCheri,1243552112166010893,2020-03-27 14:55:02,WATCH: I’m back in Washington as the House votes to pass the most significant relief package in American history. I just spoke on the House Floor about how this crucial #coronavirus bill impacts #IL17. #CARESActStatement https://t.co/tQZefBN6q7
RepCheri,1243516056364371969,2020-03-27 12:31:45,"To find resources about how the #coronavirus impacts our region, I encourage Illinoisans to visit the FAQ page located on my website. If you were wondering about small business loans, student loans, utility payments and more – check it out here ⤵️

https://t.co/4JSM6oQVg9"
RepCheri,1243309948441899010,2020-03-26 22:52:45,"Laura was dedicated to delivering the news and serving our community – she will be missed dearly. My thoughts are with her loved ones and everyone in the newsrooms at the @Dispatch_Argus and @qctimes today.
 
https://t.co/VwT2VrieW4"
RepCheri,1243235618131451904,2020-03-26 17:57:24,"RT @GovPritzker: As Illinois families face unprecedented economic challenges during the #COVID19 pandemic, I’m proud to announce that Illin…"
RepCheri,1243183519339294724,2020-03-26 14:30:22,You can learn more here:  https://t.co/DBvkKkW1Ez
RepCheri,1243183517967609857,2020-03-26 14:30:22,"These funds are in direct response to the Coronavirus Preparedness and Response Supplemental Appropriations Act, which we passed into law earlier this month. As the number of cases in our country rises, I’ll continue to fight for Illinoisans and families."
RepCheri,1243183516424253441,2020-03-26 14:30:22,"During this critical time, it’s essential health centers have access to the resources they need to combat the #coronavirus and serve our communities. Today, I announced more than $330K in grants from @HHSGov for community health centers across our region."
RepCheri,1242924942901030912,2020-03-25 21:22:53,The @NationalGuard has unique capabilities to serve our country during times of crisis. That’s why I led a letter with the entire Illinois Congressional Delegation calling on the federal government to provide Illinois' National Guard with additional support. Read more here ⬇️ https://t.co/W4zPhBhqPd
RepCheri,1242873591454224384,2020-03-25 17:58:50,"ICYMI: Earlier this week, I joined @WKEIRegionalDN to talk about how our region and Congress is responding to the #coronavirus. Listen here to learn about the actions we’ve taken and what’s to come: https://t.co/1levgWTVrt"
RepCheri,1242586170556628992,2020-03-24 22:56:43,Taking this step would empower @GovPritzker to further utilize the unique capabilities offered by the National Guard and alleviate any financial consequences placed on the State during this critical time.
RepCheri,1242586169348689927,2020-03-24 22:56:43,".@GovPritzker has requested this additional support from the federal government, as members of the National Guard in the State of Illinois mobilize to assist with testing, distribute supplies and deliver food."
RepCheri,1242586167243165696,2020-03-24 22:56:43,"THREAD: Today, I led the entire Illinois Congressional Delegation in a letter calling on the @DeptofDefense to federally fund #coronavirus response efforts delivered by the @NationalGuard. ⤵️ https://t.co/hLbUktgLAs"
RepCheri,1242575493930659843,2020-03-24 22:14:18,"This #NationalAgDay, I’m thinking of the farmers and producers across Illinois who play a such crucial role in our food supply. I’m grateful for their work to put food on plates around the world – especially during a time like this."
RepCheri,1242550901916786693,2020-03-24 20:36:35,.@ServeIllinois is stepping up to offer volunteer opportunities for Illinoisans who would like to help their neighbors amid the #coronavirus crisis. All listings follow public health guidance and give us all a chance to come together as a community. https://t.co/Ysk8X2llPU
RepCheri,1242532766438363136,2020-03-24 19:24:31,"RT @AlzILAdvocacy: Thank you, @RepCheri, for your leadership to protect Illinois’s most vulnerable populations, including those affected by…"
RepCheri,1242515923208200192,2020-03-24 18:17:35,"In response to the #coronavirus pandemic, @GovPritzker issued a Stay at Home order for the State of Illinois which remains in effect. Here are some helpful details in the @CantonLedger on what that means for you and your family ⤵️

https://t.co/KxiDURklP7"
RepCheri,1242250529104973824,2020-03-24 00:43:00,"Our communities are strong and our people are resilient.
 
This simple act of unity reminds us that we must continue to work together to put the health and safety of our neighbors first. https://t.co/0kW6zsywpg"
RepCheri,1242250436968615936,2020-03-24 00:42:38,"As you can see, the message has spread far and wide. Feeling inspired by our fellow Illinoisans, my staff and I decided to join in and post hearts in our windows from Illinois to Washington, D.C. ❤️ https://t.co/QvGXEMApTm"
RepCheri,1242250168017334272,2020-03-24 00:41:34,"An act of hope and support that began in @Galesburg, IL has made its way to nearly all 50 states and countries around the world. Krista and her family crafted handmade hearts to place in the window to promote social distancing and spread kindness. ⬇️
 
https://t.co/OKyQbMeo1o"
RepCheri,1242229465083715584,2020-03-23 23:19:18,"""Local lawmakers are working double-time to pass legislation to help families and businesses reeling from the impact of #coronavirus. Congresswoman Cheri Bustos says she is in full-on listening mode, hearing from dozens of her constituents.”
 
WATCH @23WIFR’s story here 📺⤵️ https://t.co/nnZwlS2uS3"
RepCheri,1241793302162268160,2020-03-22 18:26:09,"We all must work together to put the health and safety of our families, and of each other, first. For the latest information on how we can do that, Illinoisans should continue to follow updates from @IDPH. https://t.co/lbNbV7ziWV"
RepCheri,1241567558521806850,2020-03-22 03:29:07,My thoughts are with @RepDeSaulnier and his family. Hoping for his speedy recovery. https://t.co/uXGXaodCkX
RepCheri,1241142445779357696,2020-03-20 23:19:53,"For up-to-date information and resources, please visit https://t.co/YaaNYXunjx or call 217-782-0244."
RepCheri,1241142444634275841,2020-03-20 23:19:52,"I want to thank @GovPritzker for his leadership. Our state has faced dark days before, but our communities are strong, our people are resilient and, together, we will weather this crisis."
RepCheri,1241142443426398210,2020-03-20 23:19:52,"We must all continue to stay focused on practicing the preventive measures recommended by @CDCgov and @IDPH, as well as continue taking the proper steps to prevent the continued spread of this virus."
RepCheri,1241142442293854211,2020-03-20 23:19:52,"It is important that Illinoisans and Americans work together to put the health and safety of our families, and of each other, first."
RepCheri,1241142440871985152,2020-03-20 23:19:51,"Today, @GovPritzker announced that Illinois will join other jurisdictions in taking significant steps to reduce the rapid spread of the coronavirus throughout our communities."
RepCheri,1241059905727016964,2020-03-20 17:51:53,"The @DeptVetAffairs' website outlines the actions they are taking in response to the #coronavirus. I encourage our local veterans across #IL17 to visit it to learn more information:
 
https://t.co/qJPwVlY3Hu"
RepCheri,1240751081140953089,2020-03-19 21:24:44,"RT @IDPH: How can you keep yourself and others safe?
✅Staying home as much as possible
✅Washing hands frequently 
✅Checking-in on loved one…"
RepCheri,1240726451411914754,2020-03-19 19:46:52,"ICYMI: Individuals who owe up to $1M now have 90 extra days to pay your federal income taxes. You still have to file with @IRSnews by Wednesday, April 15, 2020 and can learn more here:

https://t.co/MJTIvllrfV"
RepCheri,1240690004541628416,2020-03-19 17:22:02,Thank you to Dr. Aiyer and Wynn with @Illinois_Alma rural health for meeting with me yesterday to discuss how we can work together to meet the needs of our rural providers during the Coronavirus outbreak. It’s crucial everyone has access to the resources they need. https://t.co/oI8hR6mVUz
RepCheri,1240417453362077697,2020-03-18 23:19:01,This bipartisan bill is a strong next step that will bring relief to many Americans facing the health and economic impacts of the Coronavirus.
RepCheri,1240417451487133708,2020-03-18 23:19:00,"From affordability of testing to meals for kids whose schools are closed, and from paid sick days for those who may be ill to unemployment insurance for those who lose work because of the virus, this package puts our families first."
RepCheri,1240417448383385600,2020-03-18 23:19:00,"Today, I was pleased to see the Senate pass the House's Families First Coronavirus Response Act and I look forward to it being signed into law swiftly, as we look to take additional legislative measures moving forward."
RepCheri,1240392951295102978,2020-03-18 21:41:39,"RT @CDCgov: Practice social distancing by putting space between yourself and others. Continue to practice healthy habits, like washing your…"
RepCheri,1240344943572516864,2020-03-18 18:30:53,I thank them for allowing me to view their facility as I continue to work to provide our region with the most accurate and helpful information regarding public health.
RepCheri,1240344940799983617,2020-03-18 18:30:53,"This morning, I toured @OSFHealthCare’s Digital Pandemic Response Hub to learn more about how they are responding to the Coronavirus and the progress they are making on the frontlines of diagnosing and treating patients. https://t.co/T9zAzFCp0e"
RepCheri,1240286472848191489,2020-03-18 14:38:33,"I encourage everyone to visit @CDCgov for the latest updates:

https://t.co/1LaaLF6BRK"
RepCheri,1240286471057219584,2020-03-18 14:38:32,"As Dr. Katz and Dr. Hershow discussed, there are preventative measures that we all can take and it’s crucial we follow the most up-to-date and accurate information from our public health officials."
RepCheri,1240286468876177410,2020-03-18 14:38:32,Thank you to everyone across #IL17 who joined last night’s telephone town hall regarding the Coronavirus (COVID-19).
RepCheri,1240044536354811908,2020-03-17 22:37:11,Our telephone town hall is starting now! Join me by dialing (855) 962-0998 or visiting the link below: https://t.co/sNboU66q7R
RepCheri,1240027943843368963,2020-03-17 21:31:15,"☎️ Join me in one hour for our telephone town hall to learn the latest information regarding the Coronavirus. Learn how to join the call here! ⬇️

https://t.co/x90o3wMehj"
RepCheri,1239978465027338241,2020-03-17 18:14:38,Access to supplies and resources is crucial for our health care professionals. Thank you for leading this effort @RepColinAllred – glad to support it. https://t.co/vdU8LbJfGW
RepCheri,1239918564951363586,2020-03-17 14:16:37,"Don't forget! Tonight, I'll be hosting a telephone town hall on the Coronavirus. Dial-in at 5:30 p.m. CST at (855) 962-0998 ☎️ 

https://t.co/x90o3wMehj"
RepCheri,1239892440162668545,2020-03-17 12:32:48,"TUNE IN: I’ll be joining the Dan &amp; Greg Show live on the air on @1470WMBD shortly! You can listen to our discussion on the Coronavirus here 📻⬇️

https://t.co/hg4ogc3SKW"
RepCheri,1239706360377376770,2020-03-17 00:13:23,"Tomorrow night, join me for a telephone town hall on the latest regarding the Coronavirus starting at 5:30 p.m. CST. Illinoisans who would like to submit a question may visit my website below ⤵️

https://t.co/x90o3wMehj"
RepCheri,1239680152734445572,2020-03-16 22:29:15,"We will continue to monitor the situation, and work together to keep our community prepared and safe.”"
RepCheri,1239680151450984456,2020-03-16 22:29:14,"We are Americans and Illinoisans first, and this moment calls for us to look out for each other and remain united. It’s imperative we all practice the preventative measures recommended by @CDCgov and @IDPH."
RepCheri,1239680150335361027,2020-03-16 22:29:14,"“Today, we learned of the first confirmed case of Coronavirus in Peoria County. As your Representatives, we want to urge all Central Illinoisans to follow the guidance outlined by our health professionals to flatten the curve and prevent the spread of COVID-19."
RepCheri,1239680148665962501,2020-03-16 22:29:14,"This afternoon, @RepLaHood and I released the following joint statement in response to the first confirmed case of Coronavirus (COVID-19) in Peoria County ⬇️"
RepCheri,1239663656369037316,2020-03-16 21:23:42,"On Tuesday evening, I encourage Illinoisans to join me for a telephone town hall on the latest information regarding the #coronavirus (COVID-19). Follow the information below to submit a question: https://t.co/7bRmgdPOtc"
RepCheri,1239620845003251723,2020-03-16 18:33:35,A moment like this calls for unity and vigilance. We must all practice the preventive measures outlined by @CDCgov and @IDPH.”
RepCheri,1239620843287859203,2020-03-16 18:33:34,This is a serious public health issue and should be treated as such. We will continue to monitor the recovery of this first confirmed case and wish them well.
RepCheri,1239620841576554498,2020-03-16 18:33:34,"“As we learn of the first confirmed Coronavirus case in Winnebago County, we urge Illinoisans throughout the region and across the state to follow the guidance provided by public health officials to prevent the spread of this virus."
RepCheri,1239620839114452998,2020-03-16 18:33:33,"Today, @RepKinzinger and I released the following joint statement in response to the first confirmed case of Coronavirus (COVID-19) in Winnebago County ⬇️"
RepCheri,1239545689790652417,2020-03-16 13:34:56,"📺 At 9:15 CST this morning, I’ll be taking to the airwaves at WRAM Radio in Monmouth where I’ll be interviewing local health officials about their response to the Coronavirus - my 100th Cheri on Shift! Listen here! ⬇️
 
https://t.co/tGBnpbRdaa"
RepCheri,1239244566047457283,2020-03-15 17:38:23,"My office has been in contact with @GovPritzker and we have both relayed our concerns to the @WhiteHouse to implement a smoother, safer process."
RepCheri,1239244564688441344,2020-03-15 17:38:22,"As I’ve said, health and safety must be our top priority. We must put our resources toward conducting this process in a manner consistent with the guidelines of @CDCgov."
RepCheri,1239244562692005889,2020-03-15 17:38:22,"The long delays and close proximity of travelers returning home from abroad, including constituents returning to #IL17 through @fly2ohare, is concerning."
RepCheri,1238973826492502021,2020-03-14 23:42:33,"✅🗳 This morning, I voted early in Rock Island! I encourage Illinoisans to take advantage of early voting to cast their ballots (and continue social distancing). https://t.co/nvZZbInpHF"
RepCheri,1238943934849703936,2020-03-14 21:43:47,"As Illinoisans continue to learn more details, it's important that we put health &amp; safety first. We must all continue to stay focused on practicing preventive measures through the guidelines issued by @CDCgov &amp; @IDPH and take the proper steps to prevent the spread of this virus."
RepCheri,1238943932618354695,2020-03-14 21:43:46,"Today, the first case of Coronavirus was confirmed in downstate Illinois. Public health officials have informed us that we should expect the number of people diagnosed with the virus to rise."
