RepCuellar,1205134330693062656,2019-12-12 14:36:29,"The USMCA is an important step for American workers. This trade agreement includes worker protections, labor fairness, creates jobs in the manufacturing sector, and boosts wages. It is time to pass #USMCA 
https://t.co/FjSKp9uOeW"
RepCuellar,1204894319968235526,2019-12-11 22:42:46,"I am committed to supporting our military and their families as they defend our great nation. That's why I am voting yes on the #NDAA to give them a 3.1% pay raise, combat sexual assault, and improve the housing system. https://t.co/sqp5tAt9Tu"
RepCuellar,1204892275995742210,2019-12-11 22:34:39,"I voted for the Coastal and Great Lakes Communities Enhancement Act for a cleaner, safer, and more sustainable future for our country.   This bill will help coastal communities plan for and prosper in a resilient future. https://t.co/cGuKl2xnBU"
RepCuellar,1204831277389664259,2019-12-11 18:32:15,Nearly 58 million people in America have been unable to pay for prescription medicines at least once in the last 12 months. Congress must #LowerDrugCosts by passing H.R. 3! https://t.co/fjr0reokA2
RepCuellar,1204416065054203906,2019-12-10 15:02:21,"We have a final agreement on the #USMCA, a much-needed update to NAFTA! This trade agreement is projected to raise GDP by nearly $70 billion and create upwards of 200,000 jobs. The USMCA is good for my district, for the state of Texas, and for our country as a whole. https://t.co/gHelQ3zGvw"
RepCuellar,1204158784253419520,2019-12-09 22:00:01,Congratulations to @laredopalominos for being ranked #1 as the best school in Texas for Registered Nursing (ADN/ASN) Programs 2020. I will continue working to secure resources and funding for nursing programs at our local colleges and universities.  https://t.co/1TALuXVJHD
RepCuellar,1204098140518920193,2019-12-09 17:59:02,Stopping the flow of illegal drugs across our border &amp; at ports of entry is critical to addressing the opioid epidemic. I am voting for DHS Opioid Detection Resilience Act to ensure CBP has the necessary equipment to detect synthetic opioids &amp; to improve detection capabilities. https://t.co/ufkJBRpHlR
RepCuellar,1203743062964527106,2019-12-08 18:28:05,Thank you @mylaredopd for hosting this great event and for protecting our community. https://t.co/2l0OOeN0ag
RepCuellar,1203043075095977993,2019-12-06 20:06:35,"The right to vote is the cornerstone of our democracy. That’s why I voted for the Voting Rights Advancement Act, which will restore the promises of the Voting Rights Act of 1965, uphold the integrity of our democracy, and increase transparency in our elections. https://t.co/wlq2KoGP1u"
RepCuellar,1202594085883789313,2019-12-05 14:22:27,"So much is at stake for South Texas in the 2020 Census, from our representation in Congress to the distribution of billions of taxpayer dollars into our communities. We need to make sure everyone is participating &amp; encouraging their family, friends &amp; neighbors to take part too! https://t.co/DV34S0DR4F"
RepCuellar,1202361442550394880,2019-12-04 22:58:01,Great news! I just voted and helped pass bipartisan legislation to get rid of those pesky robocalls. https://t.co/UJZgAdkYmM
RepCuellar,1202328851763912710,2019-12-04 20:48:31,"Thanks to the Affordable Care Act, millions of Americans, have gained quality, affordable, and accessible health coverage and care. We must build on this progress and ensure these gains are not reversed. Enroll today at https://t.co/CyeYQNOdGu! #GetCovered #OpenEnrollment https://t.co/xHLDscysGQ"
RepCuellar,1202303356800249862,2019-12-04 19:07:12,"SNAP is a lifeline for millions of Americans, including more than 48,000 households in my district. This new ruling will directly hurt hard working families. We must protect this vital program so millions of Americans can afford a meal. https://t.co/o0fZJpZwsN"
RepCuellar,1202271727763501057,2019-12-04 17:01:31,I am committed to creating an environment where the baking industry can thrive so they can continue to grow our economy and feed our nation.
RepCuellar,1202271723317612544,2019-12-04 17:01:30,"Thank you @AmericanBakers for the ABA Bakers’ Dozen Congressional Award. In my district, the baking industry produces over $220 million in economic output yearly &amp; employs 1,525 workers. https://t.co/tx1GpbGuM8"
RepCuellar,1201989232304279554,2019-12-03 22:18:59,"I am determined to strengthen our existing gun laws following the shooting in Sutherland Springs. Legislation @JohnCornyn &amp; I created after this tragedy strengthens our background check system &amp; keeps firearms out of the hands of dangerous individuals. 
https://t.co/EEjal0kLWE"
RepCuellar,1201969260584689671,2019-12-03 20:59:37,Congratulations to Laredo Medical Center CEO Jorge Leal for being recognized with this week’s Hometown Aggie Spotlight. Your effort and contribution to the City of Laredo help provide thousands with outstanding medical attention. https://t.co/YXbfFsAnxM
RepCuellar,1201945563337560070,2019-12-03 19:25:28,"It was great to meet living legend Bob Schieffer. Bob hosted CBS' Face the Nation for 24 years, interviewed every President since Nixon, and won almost every award in broadcast journalism. His service and leadership in journalism has inspired millions of reporters. https://t.co/LEUjoW9r6T"
RepCuellar,1201630453792415746,2019-12-02 22:33:20,"Check out the interview with @GrayDCnews about the importance of passing USMCA for Texas farmers, manufacturers, workers, and consumers. https://t.co/rvGYDbhAJA"
RepCuellar,1200790748100276224,2019-11-30 14:56:38,"When we pick up a coffee at the café or grab lunch at the local sandwich shop, we are making an impact in our community. I encourage everyone to join me by visiting a small business to holiday shop and supporting the great work these small businesses do for our community. https://t.co/fc8oHk3OqJ"
RepCuellar,1200099543922171904,2019-11-28 17:10:02,Congratulations to Reagan HS for being the only marching band to represent the entire Lone Star State in the Macy’s Thanksgiving Day parade! Way to make the City of San Antonio proud! https://t.co/YW5rNrIrEA
RepCuellar,1200071487866253313,2019-11-28 15:18:33,"Each and every Thanksgiving I am, first, thankful for my wife and daughters, and I'm thankful for the privilege of representing you and your family in Congress. I hope you have a great holiday with your family! https://t.co/Yi4YvwVUFn"
RepCuellar,1199848788959125504,2019-11-28 00:33:38,"It’s official: The PACT Act, bipartisan legislation that makes animal cruelty a federal crime, is now law. As the Co-Chair of the Humane Caucus, I am committed to protecting animals from cruelty and creating a more humane world for man’s best friend.
https://t.co/3jC4XaiPhl"
RepCuellar,1199423099755749376,2019-11-26 20:22:05,"One of my top priorities is to honor our service men and women who have sacrificed so much to keep our country safe. That's why I am co-sponsoring the National Medal of Honor Monument Act, which will create a national monument for our nation's Medal of Honor recipients in D.C. https://t.co/oodaumN3RH"
RepCuellar,1199332746897825792,2019-11-26 14:23:04,"As our deficit reaches $1 trillion, it is critical that the House prioritizes fiscal responsibility. That's why my colleagues in @HouseBlueDogs &amp; I wrote a letter that urges Congress to abide by PAYGO, which requires all new priorities be fully paid for.
https://t.co/lrRKj69Ajl"
RepCuellar,1199037031994802183,2019-11-25 18:48:00,"Everyone deserves to live free from violence. That’s why I am co-sponsoring the International Violence Against Women Act, which will enhance U.S. efforts to eradicate gender-based violence worldwide. https://t.co/MT3fTXmK1h"
RepCuellar,1198621878484656133,2019-11-24 15:18:19,"My family and I had a great time volunteering at the Return of the 100 Acre Woods beautification project at North Central Park in Laredo. Together, we can change our community and our nation. Thank you all for your great work! https://t.co/v557hUsY6g"
RepCuellar,1198011058004406272,2019-11-22 22:51:08,"I recently had the chance to reconnect with a former Texas Grant recipient, current TAMIU Grad School Director Guillermo Gonzalez. It was great hearing about the positive impacts this grant has had on his life."
RepCuellar,1198011055575883776,2019-11-22 22:51:08,"#FlashBackFriday to the time I was recognized by the Texas Association of School Financial Aid Administrators for my work on authoring the #TexasGrant, a financial aid grant that has helped thousands of students pay for college. https://t.co/AlgviyH5sZ"
RepCuellar,1197994335217889280,2019-11-22 21:44:41,"These funds will provide resources for 72 students to serve &amp; impact over 604,800 patients in our communities every year. As a member of the Approps Committee, I will continue to fund programs that will make education more accessible &amp; improve our community’s health care system."
RepCuellar,1197994332185407488,2019-11-22 21:44:41,"Today, I announced $2,330,291 for @txamiu's Online Family Nurse Practitioner Program to ensure there are more opportunities for Hispanic students to study medicine and increase the number of nurses in underserved populations in the region. https://t.co/6UO3rRIWja"
RepCuellar,1197278779535773697,2019-11-20 22:21:20,"As a member of the Appropriations Committee, I will continue to work to enact responsible legislation that provides funding for departments, agencies and programs that benefit my constituents. https://t.co/kFlrw1eA1H"
RepCuellar,1197278771583148032,2019-11-20 22:21:18,This continuing resolution does not include funding for the border wall and also allows for a 3.1% the pay raise for our armed forces and ensures an accurate and thorough Census in 2020.
RepCuellar,1197278770681581568,2019-11-20 22:21:17,"I voted for a continuing resolution to ensure American families, businesses, &amp; communities have the budget certainty they need at the end of this fiscal year — avoiding a harmful government shutdown &amp; ensuring key health programs don’t expire."
RepCuellar,1197261741769539589,2019-11-20 21:13:37,"Yesterday, I met with former Congressman Jack Fields and 
@CEMEX_USA Vice President Joel Galassin @jgalassini to discuss CEMEX's ready-mix concrete plant in my district. I am committed to reducing our carbon footprint by investing in carbon capture technology. https://t.co/9qDLJFAgaU"
RepCuellar,1197239792561479682,2019-11-20 19:46:24,"Yesterday, my Constituent Service Representative for Bexar County, Kendall Hayes, attended the grand opening of the Mi Familia de Mi Tierra Restaurant in #SanAntonio. She presented the Cortez family with a Congressional Certificate of Recognition for the opening of their business https://t.co/apGcw15gWa"
RepCuellar,1197230647078793216,2019-11-20 19:10:04,"Latinas on average make 54 cents on the dollar compared to white, non-Hispanic men. Latinas deserve to be paid the same as their colleagues. That’s why I co-sponsored the Paycheck Fairness Act, which will work to eliminate the wage gap for Latinas &amp; all women in the U.S. https://t.co/9NLDKFRANY"
RepCuellar,1197184506995847168,2019-11-20 16:06:43,"The elementary schools recognized include Emma Vera  Elementary from Roma ISD, Joseph C. Martin, Henry B. Zachry, Anita T. Dovalina &amp; Michael S. Ryan from Laredo ISD, Senator Judith Zaffirini Elementary from Laredo UISD and Hilda C Escobar/Alicia C Rios Elementary Mission CISD."
RepCuellar,1197184500582768642,2019-11-20 16:06:42,"Last week, my office presented certificates of Congressional Recognition to schools from my district during their National Blue Ribbon School Awards Ceremony in Washington, DC. This national distinction from the Dpt of Ed is an honor not only for the school, but for our district. https://t.co/bbv2868XGb"
RepCuellar,1197172067822641152,2019-11-20 15:17:18,"This weekend, I attended the San Antonio River Authority’s 5th Annual Pecan Jubilee in #Floresville. During the event, I met with members of the community, city officials &amp; the contestants. Congratulations to all the small businesses &amp; individual participants. https://t.co/tRpW6uyFhl"
RepCuellar,1196847901584056322,2019-11-19 17:49:10,Every person deserves to be treated equally under the Constitution. That’s why I am co-sponsoring a resolution that will help advance the Equal Rights Amendment. It is important that we guarantee equal legal rights for Americans regardless of sex.  #ERANow https://t.co/NBL4VV6jxf
RepCuellar,1196802955741204481,2019-11-19 14:50:34,"We live in a time of technological growth and this advancement is transforming every industry, including transportation. Check out my conversation with @rollcall about the future of automation below: https://t.co/pnBMUdcOJu"
RepCuellar,1196572124841947137,2019-11-18 23:33:20,"As the Vice Chair of the Homeland Security Subcommittee on Appropriations, I will do everything in my power to protect our community, our land, and our rights from the border wall.
https://t.co/z3agi08SEt"
RepCuellar,1196572124082790400,2019-11-18 23:33:20,"This year, I have worked hard to secure language, prohibiting any new Southwest border wall construction in four separate House passed funding bills."
RepCuellar,1196572117816500225,2019-11-18 23:33:18,"@RepRoybalAllard and I met with Melissa Cigarroa, Board President of The Rio Grande International Study Center, as well as Carlos Flores, an attorney in Laredo to discuss ways we can protect cherished landmarks from the Administration’s ineffective and inefficient border wall. https://t.co/w9HsQDsKAa"
RepCuellar,1195495353371549696,2019-11-16 00:14:38,Currently monitoring the situation in #SanAntonio. Praying for everyone’s safety. I thank all the first responders who are currently at the scene. https://t.co/gAOPt17Kmw
RepCuellar,1195478989084778497,2019-11-15 23:09:36,"Yesterday, my Outreach Coordinator, Gilbert Lafuente, met with Atascosa County officials and stakeholders during the Atascosa Citizens in Action meeting in Pleasanton. During the meeting, he discussed federal resources, grant opportunities and support services from my office. https://t.co/zbqtEUuyHJ"
RepCuellar,1195462529176211456,2019-11-15 22:04:12,ATTENTION LAREDO AREA VETERANS: The Houston Regional Office VBA &amp; the Webb County Veterans Service Office will be hosting a VBA Benefits Fair in Laredo on Nov 16. We invite all veterans in the area to take advantage of this opportunity &amp; learn more about VA benefits and services. https://t.co/0THNXjiuGz
RepCuellar,1195347044946382854,2019-11-15 14:25:18,"Farmers face incredible stress due to low crop prices, unpredictable weather, &amp; unstable markets. To help address the mental health crisis in rural communities, I am co-sponsoring the Seeding Rural Resilience Act, which will improve mental health resources for farmers &amp; ranchers. https://t.co/xboKKchdoR"
RepCuellar,1195056677718020096,2019-11-14 19:11:29,"I applaud @SpeakerPelosi for her dedication to negotiating an agreement that protects American jobs, raises wages &amp; spurs economic growth. It is crucial that we move beyond rhetoric &amp; partisanship to move this country forward as we enter the next decade.
https://t.co/VmyIe8ytwK"
RepCuellar,1194969210860064768,2019-11-14 13:23:55,"Supporting our men &amp; women in uniform means investing in reliable &amp; safe military family housing for the loved ones of our armed forces. As we celebrate #MilitaryFamilyMonth, @AppropsDems and I have worked hard to fund critical improvements to military family housing. https://t.co/fDOS1GYdSB"
RepCuellar,1194784390980755458,2019-11-14 01:09:31,"It was a pleasure to talk with my constituents during my teletown about the importance of enrolling for Medicare or health insurance through the ACA’s individual market.
#GetCovered on https://t.co/aGNO4GfTi1 before the deadline on December 15! https://t.co/HmN06rJaGB"
RepCuellar,1194748805889036288,2019-11-13 22:48:07,The Land and Water Conservation Fund makes critical investments in Texas’ public lands and outdoor economy. I urge my colleagues in the House to permanently fund #LWCF to preserve our country’s land for future generations. https://t.co/ijHStp07KM
RepCuellar,1194355520972345349,2019-11-12 20:45:20,"Our veteran mothers &amp; families deserve the best post-natal care we can offer. That's why I'm cosponsoring the Newborn Care Improvement Act, which will double the amount of time veteran mothers have access to care. We must continue to work towards improving care for all veterans. https://t.co/4gHsESXVBu"
RepCuellar,1194332273929334784,2019-11-12 19:12:58,"The Supreme Court decision will have life-changing consequences for the 12,800 DACA recipients in my district. As the Supreme Court listens to arguments that will decide the future of these individuals, I will stand with them &amp; their families who have made this nation their home. https://t.co/UyxzOJ9nMD"
RepCuellar,1193877933594685440,2019-11-11 13:07:35,"On Veterans Day, we salute all who have bravely served our country &amp; remember those who made the ultimate sacrifice in the name of freedom. I want to thank every veteran in South Texas and across our country for their service and wish them and their families a happy Veterans Day. https://t.co/ErO7ortoi4"
RepCuellar,1193664256681615362,2019-11-10 22:58:30,"For 244 years, the United States Marine Corps has defended our nation and our way of life. Today we celebrate the great men and women of @USMC who serve our country at home and abroad. https://t.co/Pd1ujlsdny"
RepCuellar,1193318905806237697,2019-11-10 00:06:12,Yesterday I stopped by the @MakeAWishCSTX to discuss their incredible work in creating life-changing wishes for children with critical illnesses. Thank you for serving these children and their families. https://t.co/LjMvf6DiTn
RepCuellar,1193277815426342913,2019-11-09 21:22:55,"First responders deserve our gratitude and support for keeping our communities safe. That’s why I'm cosponsoring the Expanding Healthcare Options for Early Retirees Act, which will provide retired police, fire, and EMS workers with an early option to join Medicare at age 50. https://t.co/aV9Mc4GCiM"
RepCuellar,1192944357701292032,2019-11-08 23:17:53,"These funds will be used to support &amp; treat individuals living with HIV/AIDS and help improve their quality of life. As a member on the Approps Committee, I will continue to fund programs that support people living with HIV/AIDS and encourage their engagement in treatment &amp;  care"
RepCuellar,1192944353293017090,2019-11-08 23:17:52,"Today, I announced $2,500,000 in federal funding over the next five years for Serving Children and Adults in Need (SCAN) Inc. The funds will be used for SCAN’s Healthy Border Initiative Project, which will provide behavioral care to 500 individuals in Webb County. https://t.co/yrQLk9Urjy"
RepCuellar,1192580496133443584,2019-11-07 23:12:02,I will continue working to secure funds for our law enforcement and for our border communities to remain safe.
RepCuellar,1192580488650731526,2019-11-07 23:12:00,"Today, I announced $3,800,000 in federal funds for Webb County through the DHS Operation Stonegarden Grant Program (OPSG). These funds will provide much-needed support for our law enforcement who are working tirelessly to keep our border communities safe. https://t.co/iuvpcOUtJx"
RepCuellar,1192441115259146242,2019-11-07 13:58:11,"I am cosponsoring the Home Visiting to Reduce Maternal Mortality and Morbidity Act, because I believe that we need to do more to prevent pregnancy related deaths in the U.S. This bill will increase home visitations for new mothers and provide them with resources they deserve. https://t.co/fOogRUU5r6"
RepCuellar,1192221418055983105,2019-11-06 23:25:11,I will continue to work to ensure all the constituents from the 28th district have access to basic utilities including reliable potable water.
RepCuellar,1192221414876573696,2019-11-06 23:25:10,"Today, I announced a $2,465,000 loan award to the City of Floresville through the USDA Rural Development Water and Waste Disposal program. This Rural Development investment will be used to replace the existing Plaza Well and rehabilitate other water treatment installations. https://t.co/jGKu5aBOqj"
RepCuellar,1192180986353721345,2019-11-06 20:44:31,RT @CharterGov: We’re proud to serve our valued customers in the Rio Grande Valley by providing faster and more broadband in the town of Pe…
RepCuellar,1191873502393057280,2019-11-06 00:22:41,#149fw #txang #airguard #txmilitary #texasang
RepCuellar,1191873082513907718,2019-11-06 00:21:01,"It takes courage, discipline, and countless hours of training to perform at the high level these service men and women do. A special thank you to all those service members who helped make this day so memorable!"
RepCuellar,1191873078147592192,2019-11-06 00:21:00,"Today, I visited with the 149 Fighter Wing &amp; the members of the Texas Air National Guard to learn about their mission at @JBSA_Official. They also took me on a flight in an F-16. I commend the members of the @149FW for their dedication and commitment to keeping our country safe. https://t.co/hFVHBDiKA0"
RepCuellar,1191489944608542722,2019-11-04 22:58:34,"Today, I met with officials and stakeholders from Palmview to provide a legislative update and talk about federal resources for educational programs, economic development and infrastructure for the city. https://t.co/5sMj2BjeN1"
RepCuellar,1191468239089471489,2019-11-04 21:32:19,"These new businesses will help create more than 500 new jobs and infuse millions of tax revenue into the community. I’m glad we were able to help with millions of dollars from CBI, EDA and FEMA."
RepCuellar,1191468232437325825,2019-11-04 21:32:17,"Today, we announced the groundbreaking of the upcoming Rio Grande Village. The 90 acres of land in Rio Grande City will spur economic development and soon serve as property for retail, lodging, and more. https://t.co/3VWQFTwZYi"
RepCuellar,1191416500072177664,2019-11-04 18:06:43,"This Just In: Trump’s $10 billion border wall can be infiltrated by a $100 power saw. Instead of an ineffective and expensive border wall, we need to invest in advanced, digital technologies as well as additional personnel for strong border security.
https://t.co/0kA4ZwZhBx"
RepCuellar,1191040729579229184,2019-11-03 17:13:33,"Yesterday, I spent time with some of the firefighters of Laredo and their families. I want to thank all firefighters for putting their life on line every day for the safety of our community. https://t.co/AR2w7sC5JT"
RepCuellar,1190344617536958464,2019-11-01 19:07:27,Sesame Street has provided benefits of early learning to children across the United States for years. I am co-sponsoring House Resolution 540 to celebrate the 50th Anniversary of Sesame Street and commemorate its work in helping kids everywhere. https://t.co/XkWGHSj2Fp
RepCuellar,1189918633432158208,2019-10-31 14:54:44,"Open enrollment begins this Friday, November 1. Texans looking to purchase health insurance can sign up for a new plan or update their existing plan at https://t.co/CyeYQNOdGu. I encourage everyone to review their options and #GetCovered. https://t.co/BzPdkZiNNY"
RepCuellar,1189674019232063491,2019-10-30 22:42:43,For more information on constituent services visit https://t.co/55VrPsHcsJ
RepCuellar,1189674017806045192,2019-10-30 22:42:43,"My Outreach Coordinator and my Constituent Service Representative from my Laredo office attended the Webb County Sheriff’s Department Fall Elderly Crime Prevention Fair and Dance event in Laredo. At the event, they spoke with constituents about the services provided by my office. https://t.co/hqDKJTYEHc"
RepCuellar,1189606330904002565,2019-10-30 18:13:45,"Public servants across the U.S. don't receive their full Social Security benefits because of the Windfall Elimination Provision. That’s why I'm supporting the Public Servants Protection and Fairness Act, giving workers the benefits they earned and peace of mind in retirement. https://t.co/ljeLxRwwnY"
RepCuellar,1189277368139091972,2019-10-29 20:26:34,I hosted a call with local governments and nonprofits to discuss the reimbursement application process for providing humanitarian aid to migrants at our border. I will continue to work with our communities to ensure they are properly compensated for their selfless work. https://t.co/x5LUEVzmJO
RepCuellar,1188944200840163328,2019-10-28 22:22:41,"In honor of First Responders Day, I want to thank all of the first responders who help those in need and keep our communities safe every day. As a Member of Congress, I will continue to help our first responders get the support they deserve. https://t.co/95JgszPX7M"
RepCuellar,1188931061037842432,2019-10-28 21:30:28,"The Healthy Start Reauthorization Act provides for the early delivery of services to women and families before, during, and after pregnancy. As cosponsor, I support $675 million in additional funding to these critical programs, addressing maternal and infant health issues. https://t.co/OWPicDu414"
RepCuellar,1188884174536663040,2019-10-28 18:24:10,"From supporting the Cancer Moonshot initiative to funding defense health research programs for breast cancer &amp; other cancers, I am committed to improving cancer care &amp; finding a cure. #NationalBreastCancerAwarenessMonth https://t.co/jUcwCiaEzq"
RepCuellar,1188851187405197313,2019-10-28 16:13:05,"The passage of the 19th Amendment was a significant milestone in American history. To celebrate the 100th Anniversary, I am honored to co-sponsor the Women’s Suffrage Centennial Commemorative Coin Act. https://t.co/uf0AdBDMAZ"
