RepCuellar,1242897574396342273,2020-03-25 19:34:08,"Today, Texas has been granted a Major Disaster Declaration, triggering the release of Federal funds for both individual and public assistance programs, to help our state recover from #COVID-19."
RepCuellar,1242859145281314819,2020-03-25 17:01:26,"It is critical that the public &amp; private sector work together to fight the coronavirus pandemic. Businesses that are interested in importing or manufacturing medical products to aid our country’s response to COVID-19 should check out @fema’s website:
https://t.co/gTdc9ypnLt."
RepCuellar,1242831249078706183,2020-03-25 15:10:35,"I continue to fight for the return of our citizens by working with the @StateDept and Peruvian Government to clear bureaucratic hurdles that prevent U.S. citizens from returning home. If you have already contacted Embassy Lima with details, you are on the Embassy list. https://t.co/5aC77w1IOS"
RepCuellar,1242809201740701696,2020-03-25 13:42:58,"Thank you @Ford, @3M, @GEHealthcare and @UAW for teaming up to build critical medical equipment that will keep our healthcare workers safe and help save lives. Together, we will make our communities healthy and safe. https://t.co/dfM2AkrkXM"
RepCuellar,1242801615289057281,2020-03-25 13:12:49,"While #coronavirus has resulted in many of us staying home, let’s not forget about all the retail workers, who are ensuring we have access to food and essential goods. #ThankYou https://t.co/Aq8M2TU1hP"
RepCuellar,1242559354961833984,2020-03-24 21:10:10,"@notttelise Hi @notttelise, thank you for reaching out! I am going to direct message you to get more information about your brother's girlfriend."
RepCuellar,1242540066041446407,2020-03-24 19:53:31,"To properly detect &amp; contain outbreaks, we need to strengthen our testing capacity. @RepGonzalez, @RepFilemonVela &amp; I sent a letter to @FEMA, @CDCgov &amp; @HHSGov, emphasizing the need for medical supplies, including testing kits, reagents &amp; PPE, to combat #COVID19 in South Texas. https://t.co/WDytjWwkOU"
RepCuellar,1242496786759127041,2020-03-24 17:01:33,"The Defense Production Act needs to be invoked now so our medical personnel have protective supplies and lifesaving equipment to fight this pandemic. Our heroes need help.  
https://t.co/Bqu0LWb3Vh"
RepCuellar,1242474097101111296,2020-03-24 15:31:23,"To all the police, firefighters, and emergency medical personnel who continue to keep our communities safe during this time of crisis, #ThankYou. https://t.co/tzh5j2BR6H"
RepCuellar,1242233653742186498,2020-03-23 23:35:57,Travelers who register through the Smart Traveler Enrollment Program at https://t.co/uhNvHy2DIX will receive urgent country-specific updates via e-mail.
RepCuellar,1242233652731404288,2020-03-23 23:35:57,"Constituents abroad who need help getting home: 
@StateDept's emergency phone line is available from 8 AM to 8 PM EST and is toll-free in the U.S. &amp; Canada: 1-888-407-4747.
From other countries, citizens may call: 1-202-501-4444"
RepCuellar,1242233651720486912,2020-03-23 23:35:56,My staff and I are working hard to help constituents who are stranded abroad and unable to secure transportation back home due to #COVID19 travel restrictions. Contact my office using https://t.co/BT4TFLJkxa and let us know how we can help.
RepCuellar,1242201732828016640,2020-03-23 21:29:06,"During the #COVID19 pandemic, it is critical we all have information &amp; resources. For the latest updates, including guidance on small business loans, constituents stuck abroad, &amp; what Congress is doing, check out the new page on my website:
https://t.co/2pcTJvxnMW"
RepCuellar,1242184938956509184,2020-03-23 20:22:22,"Today, I had a call with the @CDCgov to talk about ways we can protect rural Americans during the #coronavirus pandemic. As a senior Appropriator, I am committed to fighting for the necessary resources, including medical equipment and broadband, for all our communities. https://t.co/cGy1AOdG2u"
RepCuellar,1242147316527779847,2020-03-23 17:52:52,"Now that you’re staying home practicing social distancing, why not fill out the census? ✅ 
You can complete the census from home via Online 💻 https://t.co/uxhCPd6XJk 
By phone 📲 1-844-330-2020 
Or by mail, if you received the paper form. 📩"
RepCuellar,1242097682631528449,2020-03-23 14:35:39,"Quality, affordable health care is a right.

Today, the #AffordableCareAct covers over 20 million Americans and protects over 133 million Americans with pre-existing conditions.

I have and always will fight to #ProtectOurCare. Full stop. https://t.co/iSStUfVR0X"
RepCuellar,1241863560332029952,2020-03-22 23:05:20,RT @CDCgov: Feeling stressed or anxious about #COVID19? Make time to do activities that you enjoy and can help you relax. https://t.co/2AfH…
RepCuellar,1241826259061084160,2020-03-22 20:37:06,"As we all take precaution to protect ourselves from the coronavirus, we cannot forget hungry kids in our community. @teainfo created a MealFinder Map that will allow parents to locate education facilities that are serving meals to their communities. You can use this tool here ⬇️ https://t.co/ezBqMpm6hj"
RepCuellar,1241504083229511681,2020-03-21 23:16:54,"I am actively working on solutions for my constituents stranded in different countries, including Peru. If you or a loved one is stranded, please check out this information:
https://t.co/wckd2UbPWz"
RepCuellar,1241464061277147137,2020-03-21 20:37:52,We must help the small businesses across Texas that have taken a hard hit from the #Coronavirus. The @SBAgov is now accepting loan applications for TX small businesses needing assistance during this pandemic. Apply ⬇️ https://t.co/h8n4yhmsEK
RepCuellar,1241437469670879234,2020-03-21 18:52:12,"Hospitals need blood donations to ensure cancer patients, accident victims and more can still receive lifesaving care during the coronavirus pandemic. If you are healthy, you’re encouraged to donate! Go to https://t.co/r5sLaHyGh2 to find out how to donate safely."
RepCuellar,1241120463759212547,2020-03-20 21:52:32,"Our small businesses are the backbone to our state &amp; they need our help now more than ever. After working hard with State leaders &amp; the TX congressional delegation, @SBAgov approved our request to make loans available to TX small businesses. Apply below:
https://t.co/aAO4dv5oKB"
RepCuellar,1241081299911299078,2020-03-20 19:16:54,"I will continue to work with @CBP and Mexico, our economic partner, friend, and neighbor, to ensure our economies are strong and our people are safe."
RepCuellar,1241081299198193667,2020-03-20 19:16:54,I have been working closely with both @CBPMarkMorgan and Mexican officials to ensure that any disruption to trade at the U.S.-Mexico border will be minimized during efforts to prevent the spread of Coronavirus and maintain public health of our citizens.
RepCuellar,1241081298296483853,2020-03-20 19:16:54,It is critical that we preserve trade and commerce between the United States and Mexico while also helping  protect the health and safety of our citizens. https://t.co/SW6P0514uC
RepCuellar,1241033981635821575,2020-03-20 16:08:53,"RT @HEB: As we continue to find ways to support Texans and our most vulnerable populations, H-E-B and @Favor are piloting today our Senior…"
RepCuellar,1240820904222998529,2020-03-20 02:02:11,"Together, we will continue to work to ensure our community obtains the resources to properly respond and contain this virus."
RepCuellar,1240820900045434880,2020-03-20 02:02:10,"Thank you @TDEM Chief Kidd and Texas officials for taking the time to talk with @RepGonzalez, @RepFilemonVela, @RepCloudTX and I to discuss when coronavirus testing kits &amp; drive thru tests will be available in South Texas."
RepCuellar,1240738199061889028,2020-03-19 20:33:33,"UPDATE:  Americans now have 90 extra days to pay federal income taxes, if you owe less than $1M. Tax returns must still be filed with the IRS by April 15, however, no payment is due at that time. Learn more here:
https://t.co/Fjva1K0f4D"
RepCuellar,1240704163131973633,2020-03-19 18:18:18,"No student veteran or their family should be worried about losing their GI benefits during this public health emergency. As campuses close and transition to online classes, we will ensure that veterans have access to quality education, while remaining financially secure. https://t.co/3gKpScbSgO"
RepCuellar,1240683166987362304,2020-03-19 16:54:52,"The health and well-being of South Texas is my number one priority. Rest assured, there is plenty of food that will continue to reach our grocery stores on a regular basis.
Together, we need to be safe and be kind. 
https://t.co/jS4fah7Lky"
RepCuellar,1240654532100730881,2020-03-19 15:01:05,"There is no time to waste, we need to protect Americans now."
RepCuellar,1240654530179739648,2020-03-19 15:01:04,Health care workers and first responders are in desperate need of critical medical and personal protective equipment. I urge the President to immediately use the powers of the Defense Production Act in order to meet the demands and avert the shortages that would be devastating.
RepCuellar,1240613748559183873,2020-03-19 12:19:01,"#Census2020 is underway! Given the current public health crisis, one of the safest ways to respond is by phone now:
English: 844-330-2020
Spanish: 844-468-2020
Additional phone lines can be found here ⬇️ #WeCount
https://t.co/rtGVlMtzlF"
RepCuellar,1240410452066263040,2020-03-18 22:51:12,Thank you to everyone who joined our telephone town hall this afternoon! Our experts discussed preventing the spread of COVID-19 &amp; how to acquire loans from the SBA. I urge everyone in South Texas to stay informed. Please feel free to call our office if you have any questions. https://t.co/mCVlpfFIEp
RepCuellar,1240370474288386049,2020-03-18 20:12:20,"All @SocialSecurity field offices are closed, however they will still offer service by phone and online.  

If you need help with your SSA case, please contact us: 
https://t.co/oaruLxzEIw"
RepCuellar,1240316022487486464,2020-03-18 16:35:58,Our small businesses are the backbone to our country and they need our help now more than ever. I will continue to work with @SBAgov and Texas state officials to ensure small businesses in our state qualify for these loans. https://t.co/8iVLHhx1Rb
RepCuellar,1240291131990183937,2020-03-18 14:57:04,"Medicare has expanded its telehealth services to benefit patients who cannot travel to their physician’s office. I am committed to ensuring the most vulnerable Americans, including our seniors, can continue to receive care during the #coronavirus pandemic. https://t.co/lmDLb9ymZT"
RepCuellar,1240055803270303745,2020-03-17 23:21:57,"This #StPatricksDay, let us remember to cherish our loved ones, remain joyful and celebrate life—even during difficult times. https://t.co/oHMs4N4K7q"
RepCuellar,1239966763917258755,2020-03-17 17:28:08,"While many of us are teleworking, millions of healthcare workers are on the front lines to blunt the spread of this pandemic &amp; to ensure we stay healthy. As a senior Appropriator, I am committed to providing the necessary funding so they can continue to do their incredible work. https://t.co/55AmW02PyP"
RepCuellar,1239915462563160064,2020-03-17 14:04:17,"Today, our country lost former Congressman Richard Hanna, a leader who would put partisanship and politics aside in order to get results for the people of New York and our nation. I send my condolences to the Hanna family during this difficult time."
RepCuellar,1239674289051312130,2020-03-16 22:05:57,"If you or someone you know is a veteran, the VA has the latest information on how to stay safe during the Coronavirus pandemic. Check it out ⬇️ and share with people who would need to know.
https://t.co/5LLVQCeCKL"
RepCuellar,1239633108997214213,2020-03-16 19:22:19,"As we work diligently to address the spreading of #coronavirus, it’s important for all of us to take proper precautions as we go about our daily routines. 
Please don’t forget to wash your hands, isolate yourself if you're sick, and practice social distancing. https://t.co/psuG7wpkmL"
RepCuellar,1239586212165419010,2020-03-16 16:15:58,RT @lmtnews: Seven women who stand out due to their contributions to the city of Laredo were inducted into the Laredo Commission for Women…
RepCuellar,1238842813321707520,2020-03-14 15:01:57,"I may have gotten home at 1:18 a.m. last night, but HouseDemocrats’ #FamiliesFirst #Coronavirus Response Act delivers:

💉 Guarantees free testing
👪 Provides paid leave
💵 Supports strong unemployment benefits
🍲 Expands food assistance

The Senate must pass this #ForThePeople"
RepCuellar,1238558409147985920,2020-03-13 20:11:50,"As a senior Appropriator, I will work to ensure that all necessary resources &amp; funding are delivered to our communities to swiftly &amp; effectively combat this pandemic. We must work together to prevent infections, minimize social &amp; economic impact, and most importantly, save lives. https://t.co/kHnvp7Mwy8"
RepCuellar,1238181870313132038,2020-03-12 19:15:36,"The #Census2020 starts today!

Just a friendly reminder that:

-You can respond on your 📱 or 💻
-Responses are confidential and can’t be shared with anyone
-It is required by law 
-Political representation, resources and funding depend on it"
RepCuellar,1237817946405289996,2020-03-11 19:09:30,"Coronavirus is a public health emergency &amp; a serious threat to our families and communities. That’s why I voted for #coronavirus emergency response supplemental, which includes $2.2 billion in public health funding for prevention, preparedness, &amp; response to keep Americans safe. https://t.co/KpwoZNevvg"
RepCuellar,1237801971152760832,2020-03-11 18:06:01,"I had the honor of meeting with @BishopSeitz of El Paso to discuss ways we can work together to compassionately meet the needs of migrants. As a senior Appropriator, I will continue to provide the necessary funding to help children, families &amp; communities at the southern border. https://t.co/ffVeVvp0NW"
RepCuellar,1237764683349794816,2020-03-11 15:37:51,"Be ready when #Census2020 comes to your community! #WeCount 📆
3/12-3/20 Mailers delivered to all households
3/30-4/1 Bureau counts homeless communities
4/1 #CensusDay!
5/13-7/31 Census takers will visit communities to count those who have not responded
https://t.co/207CNIyivF"
RepCuellar,1237447713458962441,2020-03-10 18:38:20,"As a senior Appropriator, I will continue to expand SNAP so students can work toward a better future without going hungry. (2/2)"
RepCuellar,1237447711248519170,2020-03-10 18:38:19,"Students shouldn’t be forced to choose between paying for food or textbooks. At the Agricultural Appropriations hearing this morning, I asked @SecretarySonny what the Department is doing to ensure eligible college students have access to SNAP. (1/2) https://t.co/pDHIZNsdOu"
RepCuellar,1237396144470339584,2020-03-10 15:13:25,"It is critical that our state and local health agencies are properly funded and prepared to handle the #coronavirus outbreak. 
 
This is why our package included nearly $1 billion to help these agencies continue the fight and be an effective resource for their communities. https://t.co/UkJPhpMDBf"
RepCuellar,1237073291979960327,2020-03-09 17:50:31,"According to @CDCgov, it’s important to wash your hands often with soap &amp; water for at least 20 seconds, especially after going to the bathroom, before eating, and after blowing your nose, coughing, or sneezing. Check ⬇️ for more info: https://t.co/eRXakyxEgz"
RepCuellar,1237037620846374914,2020-03-09 15:28:46,"Back to work on this beautiful Monday morning! Every week I travel back and forth between my home in Laredo and D.C., so I can spend time in the district and with my family. The flights might be early, but they get me to where I need to be, and that’s working for TX-28! https://t.co/DNCZ6vvf8F"
RepCuellar,1236998805943472128,2020-03-09 12:54:32,"Small businesses are at the backbone of our economy. For this reason, I helped ensure the emergency coronavirus response package bill included $7 billion in low-interest loans to small businesses impacted by the epidemic. https://t.co/Pic6h46tqh"
RepCuellar,1236711056413798401,2020-03-08 17:51:07,"Happy #InternationalWomensDay to all the women who continue to inspire us every day. To the women in my life, thank you for showing me what true strength, and compassion looks like on a daily basis. https://t.co/h3ppZRtWxR"
RepCuellar,1236338458471337986,2020-03-07 17:10:33,"It is the sacrifice of those before us that allows us to move forward as a nation.
 
Today and every day, we recommit ourselves to the fight for equality.
 
#BloodySunday #Selma55 https://t.co/In8Pq9Am8f"
RepCuellar,1236049761343549440,2020-03-06 22:03:22,"I met with @SecArmy to discuss the Army’s readiness and modernization priorities for the next year. As a senior Appropriator on the Defense Subcommittee, I am committed to fully funding our Army so we can remain the best ground fighting force in the world today and in the future. https://t.co/ehWfWjhBAk"
RepCuellar,1235634931449180162,2020-03-05 18:34:59,"Americans need a fully-funded, coordinated, government-wide response to stay safe against the coronavirus.
That’s why I voted for the $8.3 billion emergency response package that will deliver the resources needed to address this public health crisis &amp; protect the American people. https://t.co/4vdWBWH6L6"
RepCuellar,1235551005028179970,2020-03-05 13:01:29,"Everyone should know – filling out #Census2020 is:
☑️Safe
☑️Confidential
☑️Private
Make sure your voice is heard in our democracy by filling out your census this year because #WeCount!
https://t.co/m1JyLBPAlF"
RepCuellar,1235341084332634115,2020-03-04 23:07:20,"@HouseDemocrats will move quickly to enact a strong, strategic funding package that fully addresses the scale and seriousness of the Coronavirus epidemic. But we need your help too! Please make sure to take proper precautions in preventing the spread of #COVID19 https://t.co/iCCpLw0ZR6"
RepCuellar,1234615860725088256,2020-03-02 23:05:33,https://t.co/yB8gO6bvVS
RepCuellar,1234615855150923776,2020-03-02 23:05:32,I’m deeply concerned that the @CDCgov did not take proper precautions to prevent this emergency. I’m working with the City of San Antonio to include an amendment in the Emergency Supplemental Package that will ensure our City has the resources to combat this public health crisis.
RepCuellar,1234592796100657152,2020-03-02 21:33:54,Happy Texas Independence Day! Don’t mess with Texas! https://t.co/2bfW01ueKZ
RepCuellar,1233910986907713536,2020-03-01 00:24:38,"This morning I was in Pleasanton with Mayor Travis Hall Jr., City Council, and Col. Mark Robinson to discuss the usage agreement between the U.S. Air Force and the City of Pleasanton’s municipal airport. This agreement supports training and operations for future Air Force pilots. https://t.co/DO0p2knk4R"
RepCuellar,1233065496288911365,2020-02-27 16:24:58,"#Census2020 is so important for every American community because #WeCount. It will determine:
📚School funding
🚗Roads, public transportation, &amp; infrastructure
👨‍👩‍👧‍👦Community Resources
…for the next 🔟 years!
https://t.co/btBhEhGFre"
RepCuellar,1232837348091625473,2020-02-27 01:18:23,"It’s been nearly 100 years since the 19th amendment was ratified. Today, I voted to commemorate women’s suffrage with an outdoor monument that will celebrate and honor the pioneers that led the way to inspire future generations. https://t.co/7zNFdAKd2S"
RepCuellar,1232756104037380096,2020-02-26 19:55:33,"As a senior Appropriator on the U.S.-Mexico border, I have a responsibility to make sure the concerns of our communities are heard. In today’s Homeland Security Appropriations hearing, I asked @DHS_Wolf about @DHS efforts to implement our community’s input on border security. https://t.co/05nccnkcC2"
RepCuellar,1232696793890279424,2020-02-26 15:59:52,"The history of lynchings in America serves as a dark reminder of our nation’s past, but the arc of the moral universe is long and always bends towards justice. Today, we bring a long overdue justice to over 4,000 victims of lynching by passing the #EmmettTill AntiLynching Act. https://t.co/tKsaSrkCpD"
RepCuellar,1232412054935523332,2020-02-25 21:08:25,RT @rd_texas: It was a great day to break ground with @RepCuellar in the City of Roma on a paving and drainage project to prevent severe ar…
RepCuellar,1231358648082993152,2020-02-22 23:22:33,It was great seeing everyone at the WBCA parade this morning. The beautiful floats and great performances made it a Texas-sized celebration! https://t.co/Eh8k1PayBG
RepCuellar,1230498331497025538,2020-02-20 14:23:58,I am co-sponsoring the WWII Commemorative Coin Act to help repair and manage the memorial in Washington D.C. It is critical that we ensure our veterans from the Greatest Generation are honored for their sacrifices and remembered for generations to come. https://t.co/ZsYntebNzT
RepCuellar,1230234012117061638,2020-02-19 20:53:39,"Help make sure everyone is counted during the #Census2020 in our community by getting a job with the @USCensusBureau. They need people that reflect OUR community - people who know our neighborhoods and our values.
Apply to serve in our community ⬇️
https://t.co/aNx7TlUU1P"
RepCuellar,1229558627117170689,2020-02-18 00:09:55,"Happy Presidents’ Day! Today, we remember our leaders who shaped our nation's history and worked tirelessly to create a great, diverse country. https://t.co/MZ38jGGH7v"
RepCuellar,1228723050235015169,2020-02-15 16:49:38,"At yesterday’s press conference in San Antonio, we discussed the Mission Reach Project and how the $26 million I helped secure in federal funding was the final addition to fully reimbursing Bexar County for it’s loan to the United States Army Corp of Engineers. https://t.co/EcZOndwPiC"
RepCuellar,1228448566559084544,2020-02-14 22:38:56,"For 25 years, the @HouseBlueDogs have been the pinnacle of bipartisanship in Congress, working to pass meaningful legislation for all Americans. I'm proud to work with these Democrats to reach across the aisle and continue to get things done. https://t.co/S62BuAlGyZ"
RepCuellar,1228364331169001475,2020-02-14 17:04:13,I voted on legislation to facilitate ratification of the Equal Rights Amendment. We won’t rest until the ERA is ratified to our Constitution and women and men are finally equal under the eyes of the law! #ERANow https://t.co/3l93X6rUgg
RepCuellar,1228066163365642242,2020-02-13 21:19:24,"As a member of the Defense Appropriations subcommittee, I helped build a budget that ensures our families are safe &amp; our military is ready. Our national security will continued to be threatened until we stop the White House from taking funds for an ineffective border wall. https://t.co/RzkGe7FLcb"
RepCuellar,1228057670428635143,2020-02-13 20:45:39,An individual has been diagnosed with coronavirus at San Antonio Lackland Air Force Base. This individual has been quarantined &amp; every precaution to protect the public is being taken. I will continue to monitor the situation &amp; ensure the City has the necessary federal resources. https://t.co/xHEkx37bGa
RepCuellar,1227674536348471298,2020-02-12 19:23:13,"The #TrumpBudget cuts…
$500 billion from Medicare
$900 billion from Medicaid
That’s a recipe for a health care disaster. I am committed to protecting these vital programs and seeing that the federal government honors our obligation to Americans. https://t.co/wAnllHOZ7r"
RepCuellar,1227589486990778368,2020-02-12 13:45:15,"During yesterday’s Appropriations hearing, I asked the @USDA what they are doing to ensure eligible college students have access to SNAP. As a senior Appropriator, I am committed to fighting food insecurity on college campuses. https://t.co/kZSbIps7vz"
RepCuellar,1227390537394683905,2020-02-12 00:34:42,"Women have made extraordinary contributions and achievements throughout the history of the United States. Today, I voted to establish the Smithsonian's American Museum of Women's History, which will recognize women's contributions to our nation.
https://t.co/hpFoHfABtT"
RepCuellar,1227333717900832768,2020-02-11 20:48:55,"America’s public lands are critical in providing clean air &amp; water, outdoor recreation, habitats for wildlife &amp; economic opportunities. That’s why I voted for the Protecting America’s Wilderness Act so we can work to expand &amp; preserve our beautiful lands for future generations. https://t.co/V3yM3DFtoR"
RepCuellar,1227278819138162688,2020-02-11 17:10:46,Today I had the honor of meeting with Mitch Landry and Mike Gomez Jr. of the @TexasFOP to discuss how Congress can best serve our police officers. I am committed to supporting our law enforcement who work hard every day to protect our communities. https://t.co/nabpn823hP
RepCuellar,1227248912903364609,2020-02-11 15:11:56,"This Friday my office, @sachamber, @AlamoAreaCOG &amp; @Menendez4Texas will be hosting an information fair for senior citizens! I encourage my constituents to visit, collect information, participate in health &amp; wellness classes, and enjoy some music &amp; dancing for Valentine’s day. https://t.co/Sw1BjDmhlm"
RepCuellar,1227011184336998400,2020-02-10 23:27:17,"As a senior Appropriator, I remain committed to continuing to reimburse our local government for their investment in this restoration project."
RepCuellar,1227011183485607936,2020-02-10 23:27:17,"For this reason, @HurdOnTheHill and I worked hard to secure $26 million in reimbursement funding for the Mission Reach Project so the City of San Antonio and Bexar County can reinvest these funds into other important projects that would benefit our citizens."
