RepCheri,1272629890379063298,2020-06-15 20:39:44,"Today’s landmark Supreme Court decision recognizing federal employment protections for gay, lesbian and transgender Americans is a major step towards equality for all and recognizes that no one should ever fear for their livelihood because of their sexual orientation or identity. https://t.co/WDMkehrsBC"
RepCheri,1272606713963843585,2020-06-15 19:07:39,"Farmers drive our economy, and their hard work puts food on the table in millions of American homes. As we continue to navigate #COVID19, supporting our family farms will continue to remain among my top priorities. 

https://t.co/hogqz5eb3y"
RepCheri,1272592605252067328,2020-06-15 18:11:35,The #2020Census will determine billions of dollars in federal and state funding – make sure you are counted. Make your voice heard at https://t.co/GJymKzZ21g. #WhyCensusMatters https://t.co/M8NjjYQ7Ea
RepCheri,1272278236672729088,2020-06-14 21:22:24,"On this #WorldBloodDonorDay, I thank everyone who has aided in saving millions of lives worldwide through their donations. Your gift saves those most in need. https://t.co/tucfkfRkn1"
RepCheri,1272249096447971333,2020-06-14 19:26:36,"Over 200 years ago, we adopted our star-spangled banner as our national flag, and it has been a resilient symbol of our country’s strength ever since. Happy #FlagDay to all as we continue to grow as a nation and work to embody the values and freedom our flag represents. https://t.co/lybtHifwvu"
RepCheri,1271965299185799168,2020-06-14 00:38:53,"Interested in up-to-date information on our #COVID19 response, resources available to you and other legislative actions? 
Sign up for my newsletter here! 

https://t.co/DHgrkqHhSL"
RepCheri,1271881816237051906,2020-06-13 19:07:10,"Over 13 million Americans currently live with Posttraumatic Stress Disorder; it is not a sign of weakness and no one is alone. If you or anyone you know is in need of aid, please visit https://t.co/h8iglwgXQt or call 1-800-273-8255. (2/2)"
RepCheri,1271881814903263232,2020-06-13 19:07:09,"June is #PTSDAwareness month, and my heart goes out to everyone suffering from this condition. (1/2)"
RepCheri,1271862139129606145,2020-06-13 17:48:58,"Libraries provide a tremendous amount of resources to our communities; we must help them get through these difficult times. I thank @libnofcongress for meeting with our librarians in #IL17 to share resources available to them through the @librarycongress. 
https://t.co/oEIqTRp3R2"
RepCheri,1271607187006205952,2020-06-13 00:55:53,"As this pandemic continues, my priority is the health and safety of Illinoisans. For regular updates on our #COVID19 response, resources available to you and ways to connect with my office, sign up for my newsletter. 
https://t.co/DHgrkqHhSL"
RepCheri,1271573647648587777,2020-06-12 22:42:36,"Today, on #WomenVeteransDay I thank them for their service as we recommit ourselves to making sure America's 2 million living women veterans are treated with dignity &amp; respect. (2/2)"
RepCheri,1271573646469890054,2020-06-12 22:42:36,"Throughout our nation’s history, women have fought bravely to protect our freedoms and values. I am grateful to every woman who has dedicated her life for our country. (1/2) https://t.co/MUY93iTkSk"
RepCheri,1271565426623950851,2020-06-12 22:09:56,"It’s essential that we support working families and provide our child care providers with the resources they need.
The $270 million in funding from the CARES Act is a step in the right direction as we continue working together to get through this pandemic.
https://t.co/YyfPMTFxAA"
RepCheri,1271552770441609219,2020-06-12 21:19:39,"53 years ago, the Supreme Court struck down all laws banning interracial marriages. This #LovingDay, I wish everyone a lifetime of happiness and love.

https://t.co/cJOOKib3cx"
RepCheri,1271240624184930305,2020-06-12 00:39:17,"I was proud to recognize #HometownHero Kelli Martin for her selfless effort to help her community during this health crisis. I applaud her front porch pantry and the impact she has made on her neighborhood and beyond. 

https://t.co/dyQcEmfOtf"
RepCheri,1271224992089411589,2020-06-11 23:37:10,"The past few months have impacted us all differently. My newsletter provides up-to-date information on resources available to you, our #COVID19 response, the work I am doing to combat racial injustice and more. Visit the site below to sign up ⬇️

https://t.co/DHgrkqHhSL"
RepCheri,1271207724253089792,2020-06-11 22:28:34,"Earlier this week, the Justice in Policing Act was introduced by @HouseDemocrats  and @SenateDems. I’m proud to join them in this effort as a co-sponsor of the legislation. You can learn more about it by checking out the clip below ⬇️ https://t.co/J3T839Oq3s"
RepCheri,1271104036842987520,2020-06-11 15:36:33,"Today, I’m pleased to announce that nearly $2 million in funding from @HUDGov will be going to Rockford and Peoria to support access to reliable housing – a crucial component of our fight against #COVID19.

https://t.co/fvkYegADMm"
RepCheri,1270880117141766145,2020-06-11 00:46:46,"Today, @GovPritzker and I visited the @YMCA’s Learning Center in Rockford because #COVID19 has made the need for affordable child care clear. Providers offer vital support to essential workers during #COVID19 so parents can go to work and we can rebuild our economy. https://t.co/TyyC64zvxD"
RepCheri,1270871930086834178,2020-06-11 00:14:14,I was a journalist for nearly two decades. I applaud @CNN for standing up for free speech. Our fundamental rights should never be in question. https://t.co/Dk7Gg8NNHL
RepCheri,1270850431200178176,2020-06-10 22:48:48,"Child care is essential. That’s why @GovPritzker and I toured Skip-a-Long in Moline today, where they are working around the clock to care for the children of those on the frontlines of #COVID19. We must work to keep providers’ doors open and support working families in Illinois. https://t.co/0GUeVxL2n5"
RepCheri,1270840727027822598,2020-06-10 22:10:15,"You can read more about it here ⬇️

https://t.co/IYYdB4PqYh"
RepCheri,1270840725685534725,2020-06-10 22:10:14,"I’d also like to thank @APAPsychiatric, @APA, @NationalCouncil, @nasmhpd, @afspnational, @EDCoalition and many more for supporting this legislation."
RepCheri,1270840724528025600,2020-06-10 22:10:14,"The #COVID19 pandemic has significantly disrupted our way of life, created additional stress and made us all concerned for our physical health. But as we adapt, we cannot neglect the underlying opioid crisis and the importance of our mental health."
RepCheri,1270840723261263873,2020-06-10 22:10:14,"The Crisis Care Improvement and Suicide Prevention Act of 2020 would provide funding for crisis care services like: 

✅Crisis Call Centers 
✅Mobile Crisis Services 
✅Crisis Stabilization Programs"
RepCheri,1270840721944297473,2020-06-10 22:10:13,"We have a mental health crisis in our country, and #COVID19 has laid bare a desperate need for access to mental health resources and support. That's why @RepSusanWild and I introduced legislation today to bolster the services available to those facing a time of crisis quickly."
RepCheri,1270826080987942915,2020-06-10 21:12:03,"57 years ago, President Kennedy signed the #EqualPayAct into law. This bill prohibited wage discrimination on the basis of sex, but we still have work to do. I am committed to continuing this mission to ensure equal pay for equal work."
RepCheri,1270738324580335618,2020-06-10 15:23:20,"Our nation has witnessed how police brutality has harmed Black communities, and it is every person’s responsibility to work toward change. We must be united in our resolve to eliminate systemic racism in all of its forms, and I stand with those calling for equal justice."
RepCheri,1270738323242393600,2020-06-10 15:23:20,"My colleagues in the House and Senate proposed the Justice in Policing Act, a comprehensive approach to shifting law enforcement practices to better protect all Americans, and I’m proud to be a co-sponsor. https://t.co/zaUG6UIemT"
RepCheri,1270729467846168578,2020-06-10 14:48:08,"When there was a need for protective equipment in her neighborhood, #HometownHero Leslie Williams rose to the challenge &amp; started sewing thousands of masks for frontline workers, health care workers &amp; anyone in need. Thank you for your commitment to protecting others, Leslie. https://t.co/ViA6fmZsBi"
RepCheri,1270517206502330369,2020-06-10 00:44:41,"Illinois has completed more than 1 million #COVID19 tests in our fight against the pandemic. We must continue working to keep tests readily available across the state, and I thank @GovPritzker for all he has done. #AllinIllinois

https://t.co/g0j71Ej1wI"
RepCheri,1270496601975504903,2020-06-09 23:22:49,"Libraries provide a tremendous amount of resources to our communities and I was thrilled Dr. Hayden could join us this morning.

https://t.co/YIoedoldXH"
RepCheri,1270496601182797824,2020-06-09 23:22:49,"Today, I hosted a teleconference with @libnofcongress to provide digital resources to libraries impacted by #COVID19. Libraries are vital to our community, as a longtime supporter of libraries I’ve donated over 2,900 books through the @librarycongress Surplus Book program."
RepCheri,1270435109804683265,2020-06-09 19:18:28,We have work to do so America can be truly equal and free for all. (4/4)
RepCheri,1270435108235984902,2020-06-09 19:18:28,"I will continue to listen to the needs of Black communities across our nation and in the Congressional district that I serve, work with Black leaders at the national and local levels, and lift up Black voices as they call for justice. (3/4)"
RepCheri,1270435106952544258,2020-06-09 19:18:27,"Over the past weeks, we have seen a long-overdue shift in our national conversation about police brutality and systemic racism; we must make sure that this is just the beginning of this conversation and that we remain committed to taking necessary action. (2/4)"
RepCheri,1270435105379627011,2020-06-09 19:18:27,My heart is with George Floyd’s family and loved ones as they lay him to rest today. Our nation mourns the loss of his life. (1/4)
RepCheri,1270158169944264709,2020-06-09 00:58:00,"When #COVID19 impacted Galena, IL, #HometownHeroes Matt and Mike Blaum, from Blaum Bros' Distillery Company, went above and beyond to help their community. Using their distillery, they made gallons of hand sanitizer to give to hospitals and others in need across the country. https://t.co/QmKb4JycaN"
RepCheri,1270142574913781760,2020-06-08 23:56:02,"Our small businesses are still struggling. That’s why I helped pass the Paycheck Protection Program Flexibility Act, to improve this critical program and provide small business owners increased flexibility to retain employees, meet overhead costs &amp; more.

https://t.co/pef7kHqPiv"
RepCheri,1270125410563633152,2020-06-08 22:47:50,"Last week, I was pleased to announce that MetroLINK will receive nearly $9 million in federal funding. These federal dollars will help MetroLINK get through this public health crisis and support riders in Rock Island County. 

https://t.co/IVESVPOoyS"
RepCheri,1270114427984101379,2020-06-08 22:04:11,"Last week in @AppropsDems, I questioned @CDCdirector about how their own guidelines have led to the transfer of inmates with #COVID19. It’s crucial everyone is tested prior to transfers to protect inmates, staff and the community. https://t.co/l0rqvNFxLx"
RepCheri,1269407654851551232,2020-06-06 23:15:44,"We know that fresh food, affordable health care and safe housing can all have a profound effect on quality of life. In @AppropsDems this week, I asked @CDCDirector how these factors impact our communities during the #COVID19 crisis. 

https://t.co/vFOvihoNiJ"
RepCheri,1269305846091186176,2020-06-06 16:31:10,WATCH: Our communities of color are disparately impacted by social factors – like food deserts and a lack of access to health care – that can negatively affect their health. We must address these systemic issues if we want to improve health in all of our communities. https://t.co/nsO8Mc49GD
RepCheri,1269020948268802050,2020-06-05 21:39:05,"For more information on testing locations and hours of operation, check out this link: https://t.co/Ce97RnURn4"
RepCheri,1269020945429204993,2020-06-05 21:39:05,Adequate testing capacity is essential in our fight against the #COVID19 pandemic and we must ensure that anyone who needs a test has access to one. That's why @GovPritzker and I visited the drive-thru testing site located at the Peoria Civic Center today. https://t.co/I2qR1cKW24
RepCheri,1269002588013449217,2020-06-05 20:26:08,RT @GovPritzker: I’m spending the day in Peoria with @RepJGB and @RepCheri to hear from this community as we continue to fight for justice…
RepCheri,1269002548024877065,2020-06-05 20:25:59,"RT @LtGovStratton: “It can’t just be words, it has to be meaningful action. And I want to be a part of the solution.”—@RepCheri 

Thank you…"
RepCheri,1268993734525554688,2020-06-05 19:50:57,"In Peoria, @GovPritzker, @RepJGB and I joined @tcpulpeoria for a tour of the MacArthur Corridor and a visit to Rumberger's — a local Black-owned restaurant. I thank them for welcoming us this afternoon and for sharing their experiences with us during these difficult times. https://t.co/GbruuLdDkh"
RepCheri,1268629353518243843,2020-06-04 19:43:02,"Today, at 2:45PM CST, I will join the @NAACP and others in observing our National Day of Mourning to honor the life of #GeorgeFloyd. I encourage everyone to stop what they are doing and observe a moment of silence for #8minutesand46seconds."
RepCheri,1268604797692903425,2020-06-04 18:05:27,"I will continue to work with Black leaders on the national and local scale towards that change, for an America that is truly equal and free for all. (4/4)"
RepCheri,1268604796296192000,2020-06-04 18:05:27,"We must make sure that their calls for justice are heard, and I stand with those marching and speaking out for change. As we move forward, we must all commit to more than words - we must offer action. (3/4)"
RepCheri,1268604795096567809,2020-06-04 18:05:27,"While his family celebrates his life this afternoon, millions of Americans continue to call for an end to police violence and the systemic racism that afflicts our nation. (2/4)"
RepCheri,1268604793670504448,2020-06-04 18:05:27,"As the world comes together to mourn the loss of #GeorgeFloyd, today my prayers are with his family, loved ones, and all those who join in remembering his life. (1/4)"
RepCheri,1268575237400076289,2020-06-04 16:08:00,"This #PrideMonth, I'm proud of @clockincLGBT - a community center in Rock Island that provides resources, workshops and support for #LGBTQ+ individuals and allies here in #IL17. To keep the #HousePrideChallenge going, I nominate @RepGwenMoore! #PRIDE2020 https://t.co/OmKOoCT5HD"
RepCheri,1268321697809100800,2020-06-03 23:20:31,It’s supposed to be the People’s House. https://t.co/2UG1Ydky3d
RepCheri,1268269276156305415,2020-06-03 19:52:13,"While the pandemic has slowed almost everything, it hasn’t stopped systemic racial injustice – it has revealed it. That’s why I support @RepWilson’s legislation to establish a comprehensive study of the societal conditions that disproportionately affect black men in America."
RepCheri,1267819288099868673,2020-06-02 14:04:07,"for #GeorgeFloyd and too many other victims of systemic racial injustice.

Let us come together in compassion, understanding and resolve for real change. Through unity — not division — we will step forward, together. 

(3/3)"
RepCheri,1267819286451482631,2020-06-02 14:04:07,"This is not who we are.

America needs to hear words of healing and compassion. Instead, our President fanned flames of anguish and division.

Many, understandably, fear for their safety. But we cannot let fear stop us from making our voices heard to demand justice

(2/3)"
RepCheri,1267819284597620741,2020-06-02 14:04:07,"Last night, President Trump declared himself to be a man of law and order, but he acted like a dictator. His administration gassed and shot peaceful protestors with rubber bullets for a photo opportunity and threatened to “dominate” American citizens with military force.

(1/3)"
RepCheri,1267473909479243776,2020-06-01 15:11:43,"Let me be clear - police brutality is never acceptable. Our first steps must be in acknowledging the harm caused to our communities and working to deliver justice for #GeorgeFloyd, #BreonnaTaylor and so many others."
RepCheri,1267473908577550337,2020-06-01 15:11:42,"The past week and weekend show a nation in pain. We must find the strength to move forward together, but we can only do that when we all work to address systemic racism, together. No one can sit this fight out - it impacts us all and demands the attention of every one of us."
RepCheri,1266852422758150146,2020-05-30 22:02:09,"we all hear and heed the words of the leaders of our communities of color. 

We must deliver justice for #GeorgeFloyd and others who have been harmed and find the strength to move forward, together, as one nation. (2/2)"
RepCheri,1266852419734056963,2020-05-30 22:02:08,"America is struggling and our fellow countrymen and women are in pain. An injustice against one is an injustice to all, and it is every American's responsibility to work together to make a better, brighter future for all of us. 

It is my hope that in this moment of crisis,(1/2)"
RepCheri,1266453292567203841,2020-05-29 19:36:09,"As a journalist for nearly two decades, I stand with @NewDay reporter @OmarJimenez, who was arrested for doing his job this morning.
 
While I'm glad to see him back delivering the news, these actions are harmful to our democracy and must be called out. https://t.co/3AcSQ77bKc"
RepCheri,1266431149972377606,2020-05-29 18:08:09,"As the pandemic continues, our medical supply needs to increase as well. I’m proud to see Rockford employees at Global Displays Solutions rise to the challenge &amp; work to create ventilator displays for our hospitals. We must stand together against #COVID19.
https://t.co/gVGf67QYne"
RepCheri,1266400981933318150,2020-05-29 16:08:17,"Tune in NOW to see my chat with Mayor Lain over Facebook Live about what support our small towns need to navigate this pandemic.
https://t.co/paAya7udfK"
RepCheri,1266391263143768065,2020-05-29 15:29:40,"Join me today at 11am CDT as I meet with Savanna Mayor Chris Lain over Facebook Live to discuss the impact of #COVID19 on our small towns and businesses.

https://t.co/paAya7udfK"
RepCheri,1266117045671821312,2020-05-28 21:20:01,"That's why I helped pass legislation today to improve the program and provide owners more flexibility to retain employees, meet overhead costs and keep Main Street strong. Learn more about it here ⬇️

https://t.co/V4rBkzWLID"
RepCheri,1266117043906101249,2020-05-28 21:20:01,"Small businesses are the backbone of our local economy, but the #COVID19 pandemic has left them particularly vulnerable. With livelihoods on the line, the Paycheck Protection Program has been a critical resource for many businesses – but it hasn’t been perfect."
RepCheri,1266096016580894725,2020-05-28 19:56:27,"Our towns &amp; cities are facing unprecedented budget shortfalls and that could mean layoffs of critical first responders, like firefighters. That’s why @RepLaHood &amp; I are urging @fema to take action to help keep experienced fire men and women on the job.
 
https://t.co/r0OYXxTVN7"
RepCheri,1266078766431862786,2020-05-28 18:47:55,"On behalf of more than 70 of my colleagues who spoke out, I look forward to receiving an explanation for the original deadline and will continue to monitor this situation closely, for our Guardsmen, and for our nation."
RepCheri,1266078765333057536,2020-05-28 18:47:54,"This pandemic has no end date, which is why we need these servicemen and women.

They are vital to our response to #COVID19 and should be activated for the duration of the President’s emergency and disaster declarations."
RepCheri,1266078681979650048,2020-05-28 18:47:35,"Our Soldiers and Airmen have selflessly served our nation in its time of need, and the benefits they earned should never have been left hanging in the balance."
RepCheri,1266078680784220160,2020-05-28 18:47:34,"While today’s decision to extend the service of our men and women in the National Guard is a step in the right direction, it shouldn’t have taken this long or required public pressure. Leadership means doing the right thing—even when no one is looking. https://t.co/UWqpvQV0Z1"
RepCheri,1266047942328287233,2020-05-28 16:45:26,"While we all want to get back to normal, we’re not in the clear yet, and I am committed to continuing this fight. Each life lost is a testament to how critical it is for us to continue to work together."
RepCheri,1266047941053218818,2020-05-28 16:45:25,"Yesterday, our country surpassed 100,000 #COVID19 related deaths. My heart goes out to those who have lost a loved one and those who have lost their lives.

https://t.co/vRa5DiHKtw"
RepCheri,1266010646124146688,2020-05-28 14:17:14,"I’m back in Washington and look forward to today’s @AppropsDems hearing with @SecWilkie on the @DeptVetAffairs’ #COVID19 response. WATCH here ⤵️
 
https://t.co/Hv8m7qvbTI"
RepCheri,1265829491118673920,2020-05-28 02:17:23,"This week, our nation has experienced outrage and heartbreak and many are currently grappling with the injustice communities of color have experienced throughout history. Recent events are no exception. Today, I stand with those calling for justice to be served for #GeorgeFloyd."
RepCheri,1265750996308934658,2020-05-27 21:05:28,Thank you #HometownHero Kelli Martin for turning your front porch into a food pantry. I am touched by your big heart and dedication to feeding our neighbors. https://t.co/icCc0tK0hi
RepCheri,1265713990614867969,2020-05-27 18:38:25,"The @NationalGuard has been crucial to our response to #COVID19. That’s why I have called for an extension of their service and demand an answer for why their service would end just short of many qualifying for benefits.
 
https://t.co/D21OzapER8"
RepCheri,1265689151606870018,2020-05-27 16:59:43,"There are #HometownHeroes all across our district, that’s why yesterday I announced our “Thank You to Hometown Heroes” program! 
To digitally send a thank you note to a local hero, or for more information, visit the link below!
 
https://t.co/fe7a7doWTy"
RepCheri,1265453967531741185,2020-05-27 01:25:11,Heading back to Washington tonight. Our nation is still in its time of need and @HouseDemocrats are working #ForThePeople. https://t.co/R3AQF5xpC2
RepCheri,1265327033682444296,2020-05-26 17:00:48,"Yesterday, I spoke with Brenda Bland, Gold Star mother to Benjamin Desilets, to honor Memorial Day. I thank this family for their sacrifice to our country. https://t.co/DJFVCir9J9"
RepCheri,1265296435345534976,2020-05-26 14:59:12,"Congratulations to @Augustana_IL’s Class of 2020. This may not be the graduation you were expecting, but you should be proud of this amazing accomplishment! I cannot wait to see what this class will do in the future. https://t.co/Ipk1CdZs7j"
RepCheri,1264997941237997573,2020-05-25 19:13:06,"Our fallen veterans and serviceman deserve our care and respect for all they’ve done for our country. Even in the changing times of #COVID19, it is important we take a moment to remember their service to our country. #MemorialDay
 
https://t.co/Rm99E1rkqP"
RepCheri,1264963758771798016,2020-05-25 16:57:16,"On this #MemorialDay, my heart goes out to every service member who dedicated their lives to our country. Thank you for your service, we are grateful to you. https://t.co/IZWCYAJfjv"
RepCheri,1264942584218222599,2020-05-25 15:33:08,"This morning I spoke with Brenda Bland, a Gold Star mother, in honor of #MemorialDay. 

Today and every day, thank you to all those who have served our nation and those who made the ultimate sacrifice in their service.

https://t.co/oTXw58Koxc"
RepCheri,1264757638962741250,2020-05-25 03:18:13,"WATCH: Our state and local governments don’t have time to waste. That’s why @HouseDemocrats passed the #HeroesAct to help replace lost revenues and support vital services like those provided by our first responders. Will @senatemajldr join us?

More from @KasieDC tonight ⬇️ https://t.co/tkHf8YMgUw"
RepCheri,1264694413097422850,2020-05-24 23:06:59,"TUNE IN: I’ll be joining @kasie on @KasieDC tonight to discuss the call I led with @RepMaxRose, @RepDebHaaland and more than 70 members urging @NationalGuard activations to be extended and ask why their service is set to expire just before qualifying for benefits. 📺⤵️ https://t.co/oXwehwdnlp"
RepCheri,1264625812688515072,2020-05-24 18:34:24,"Congratulations to Margarita Mojica for being named the first Latina Golden Apple award winner from the Quad Cities! Thank you for all of your hard work in the classroom to educate our students.
 
https://t.co/aar1bg73x3"
RepCheri,1264261115736965127,2020-05-23 18:25:13,"RT @KasieDC: “We asked our neighbors in uniform to serve our nation in its time of need, and we hope the Department has not—and will not—ni…"
RepCheri,1264259851108208645,2020-05-23 18:20:11,"One of my top priorities is providing as much information as possible to the district I serve. Sign up for my newsletter for updates on our #COVID19 response and other legislative actions. 

https://t.co/DHgrkqHhSL"
RepCheri,1264211413960208384,2020-05-23 15:07:43,Our local news outlets are working hard to keep our communities informed during this global pandemic. I am grateful for their hard work and dedication to accountability and truth. https://t.co/1PZ6sfJ2Gg
RepCheri,1263948311301627904,2020-05-22 21:42:15,"Our communities need us, right now. The House has stepped up. Will @senatemajldr and his colleagues join us? https://t.co/EFF2G2PdPt"
