RepPaulTonko,1321870702597865472,2020-10-29 17:45:09,"Our @EnergyCommerce report details the onslaught of attacks by the Trump Administration against science, clean air &amp; water standards and environmental justice. I am fighting against these rollbacks that endanger our environment and our communities. https://t.co/SNZju8zNTV"
RepPaulTonko,1321831605535735808,2020-10-29 15:09:47,"As a representative, I have the great privilege of nominating young men &amp; women to our Military Service Academies. My office is accepting applications until Friday, 10/30 at 5PM. Visit my website below &amp; call my office at (518) 465-0700 with any questions.
https://t.co/tDyUX4ufXA"
RepPaulTonko,1321441990580592650,2020-10-28 13:21:36,"The updated #HeroesAct makes critical additions to address needs that have arisen since the House first acted in May while maintaining key priorities from the original bill.
  
The House has taken action. The Senate must take up this bill without delay."
RepPaulTonko,1321150526269067265,2020-10-27 18:03:25,I sent a letter today to @WHOSTP to demand answers on its failure to uphold scientific integrity and call for immediate action to ensure these standards are protected to prevent further deadly harm to our nation from #COVID19. https://t.co/STQdRTmMmr
RepPaulTonko,1321150475991949313,2020-10-27 18:03:13,"The Trump Administration is claiming “mission accomplished” on a pandemic that has killed nearly a quarter of a million Americans, infected more than 8.6 million and caused millions more to fall into poverty. https://t.co/3Oc1wEOdBr"
RepPaulTonko,1321118671553613827,2020-10-27 15:56:51,"🚨🚨ATTENTION!!🚨🚨 Today is the last day for New Yorkers to request a mail-in ballot! You can request a ballot online, or by phone, mail, email or fax from your local Board of Elections. Make sure your voice is heard!"
RepPaulTonko,1321070799273529344,2020-10-27 12:46:37,"My latest newsletter shows how our $2 trillion CARES Act passed in March delivered vital support to the American people. With #COVID19 cases again on the rise, it's more clear than ever that we need another rescue for families, workers &amp; small businesses.

https://t.co/dexsRFjm4A"
RepPaulTonko,1320807408629854218,2020-10-26 19:20:00,"#COVID19 cases across the nation are once again on the rise. 

Rather than acting immediately to support American families in the midst of this crisis, the Senate continues to drag its feet. 

Our communities need a rescue. We need the #HeroesAct."
RepPaulTonko,1320782970521866241,2020-10-26 17:42:53,"Early voting in New York is underway!! Learn more about how to vote early in your county by visiting the link below &amp; whether you chose to vote early, by mail, or in person on election day, make sure you have a plan to ensure that your voice is heard!

https://t.co/gZ47gDpCir"
RepPaulTonko,1319635756646862848,2020-10-23 13:44:16,"Dismantling the #CleanWaterAct threatens the health of Americans—particularly low-income &amp; communities of color—in the middle of a public health crisis. We can't let this Administration undo 48 years of progress. We must fight to #ProtectCleanWater. #CWA48
https://t.co/LNRXNfAcA3"
RepPaulTonko,1319360935195299840,2020-10-22 19:32:14,"Had the privilege of speaking with 7th graders and faculty from @MapleHill_HS while delivering items through the @librarycongress Surplus Books Program!

This visit marks the 56th in the Capital Region &amp; nearly $40,000 in total donated items since I began this wonderful program. https://t.co/0thExCKNmD"
RepPaulTonko,1319312550538989573,2020-10-22 16:19:58,This week marks the 48th anniversary of the Clean Water Act. Now more than ever we need to work to protect the safety of our water systems and health of all families. I will not stop fighting in Congress to #ProtectCleanWater. #CWA48
RepPaulTonko,1319260210196873217,2020-10-22 12:51:59,"3 weeks ago, the House passed the updated #HeroesAct to help Americans get back on their feet by:

- Funding testing, tracing &amp; treatment
- Sending another round of stimulus checks
- Restoring $600/week expanded unemployment

It's past time the Senate pass this #COVID19 rescue."
RepPaulTonko,1319003270518607875,2020-10-21 19:51:00,"#COVID19 has impacted communities of color at an alarming rate and shown the clear inequities of our public health system, and now @EPA is gutting regulations that are meant to #ProtectCleanWater and keep families healthy. These dangerous cuts must end. #CWA48"
RepPaulTonko,1318968793360576514,2020-10-21 17:34:00,"We know that our health is deeply tied to our access to clean water, yet the Trump Administration has attacked the #CleanWaterAct at every step. We must fight back these attacks so that every community has access to safe, clean water. #CWA48 #ProtectCleanWater"
RepPaulTonko,1318933752307920896,2020-10-21 15:14:45,"For 48 years, the #CleanWaterAct has protected communities from coast to coast. But the fight to #ProtectCleanWater is far from over. 

#CWA48 reminds us how far we've come to protect public health &amp; how much more must be done to ensure every American has access to clean water."
RepPaulTonko,1318907075603345410,2020-10-21 13:28:45,"Nearly 3 weeks ago, the House passed an updated #HeroesAct that meets the needs of our families, workers &amp; small businesses. The American people cannot wait any longer. The Senate must act without delay to pass a plan that helps our communities weather this storm."
RepPaulTonko,1318585603425030153,2020-10-20 16:11:20,"Our job as members of Congress is to deliver meaningful, lasting legislation for the American people. That job has never been more critical.

In my latest newsletter, I highlight some of the 28 bills I've introduced to better our Capital Region &amp; beyond:

https://t.co/kr5jUTTVxi"
RepPaulTonko,1318538486958460929,2020-10-20 13:04:07,"With each passing week that the Senate fails to advance a #COVID19 rescue, more Americans are forced to file for unemployment. I urge Senate Republicans to at last come to the negotiating table to pass a plan that truly delivers for those who need it most.
https://t.co/hdoVguEpMn"
RepPaulTonko,1318281114339954688,2020-10-19 20:01:24,"Do you know how you’ll be voting this year? 

Whether you choose to vote early, vote-by-mail or vote in person, make a plan today and ensure your voice is heard. Learn more about voting in New York by visiting https://t.co/hq5u8vdBms"
RepPaulTonko,1317847655955931136,2020-10-18 15:19:00,"My latest newsletter highlights some of the 28 bills—25 of which were bipartisan—that I introduced in Congress #ForthePeople. 

I will not stop working to pass meaningful, lasting legislation that delivers for our Capital Region &amp; beyond.

https://t.co/kr5jUUbwoQ"
RepPaulTonko,1317809242670288896,2020-10-18 12:46:21,"This is simple. Americans are getting sick &amp; dying. Businesses are closing. People need help. No more obstruction and partisan games.

The Senate must vote right now to pass the House compromise rescue or propose a REAL alternative."
RepPaulTonko,1317493824680300544,2020-10-17 15:53:00,"How are you planning to vote this year: from home, early at the polls, or on Election Day? Make a plan today by visiting https://t.co/hq5u8vdBms to learn more about voting in New York."
RepPaulTonko,1317455824026017794,2020-10-17 13:22:00,"Millions of Americans have fallen into poverty through no fault of their own. 

The House passed multiple #COVID19 rescue plans. Meanwhile, Republicans are racing to confirm Trump’s Supreme Court nominee. The Senate has a duty to serve, not play politics.

https://t.co/eW6DmlDF19"
RepPaulTonko,1317176129237733380,2020-10-16 18:50:35,"Inspired by my visit with students &amp; faculty of @mariacollege while delivering medical books through @LibraryCongress surplus books program.

This visit marked the 56th book delivery across our Capital Region &amp; a total value of nearly $40,000 in donated items! https://t.co/IknIKz0j8r"
RepPaulTonko,1316727041690042373,2020-10-15 13:06:05,"🚨🚨ATTENTION!🚨🚨 The #2020Census closes TODAY! This is your final chance to be counted. Your response will help determine funding for our Capital Region for the next 10 years.

Complete the Census at https://t.co/A36cU04X3c &amp; encourage others to do the same."
RepPaulTonko,1316435349980286981,2020-10-14 17:47:00,"The #2020Census ENDS TOMORROW! If you or anyone you know has not yet done so, fill out the quick, simple form at https://t.co/A36cU04X3c. It’s not too late to ensure your voice is heard and our Capital Region is counted!"
RepPaulTonko,1316417815570767873,2020-10-14 16:37:19,"The House passed our updated #HeroesAct to: 

🧑🏽‍⚕‍ Honor our heroes 
🏥 Support testing, tracing &amp; treatment
🏘️ Strengthen housing assistance &amp; food security
🗳️ Safeguard our democracy 

The Senate continues to delay this vital rescue for the American people."
RepPaulTonko,1316178854772441093,2020-10-14 00:47:47,"Given current efforts by the U.S. Senate to ram through the President’s Supreme Court nominee, this threatens to be the first of many politicized rulings, with consequences that echo for decades.

/end"
RepPaulTonko,1316178852822032387,2020-10-14 00:47:46,"After many months of tireless community-based efforts to ensure a complete count in the Capital Region, I am disappointed and angered at this eleventh-hour decision that strips the American people of their voice, fair representation and entitled resources."
RepPaulTonko,1316178850972340224,2020-10-14 00:47:46,The pandemic as well as attempts to scare certain communities has made an accurate count more difficult.
RepPaulTonko,1316178848334131200,2020-10-14 00:47:45,"This ruling undermines this Constitutional duty, guarantees an inaccurate reflection of our nation’s composition and denies our communities their fair share of federal funding for health care, education, infrastructure and many more vital services for the next ten years."
RepPaulTonko,1316178845855252480,2020-10-14 00:47:44,"The announcement today by the U.S. Supreme Court to allow this Administration to cut the Census short is a direct assault on our communities and our democracy. Article I, Section 2 of our Constitution mandates a complete count of every person living in the United States.

1/ https://t.co/xSCRFnEnsN"
RepPaulTonko,1316074374940823557,2020-10-13 17:52:37,"Since day one, @HouseDemocrats have been fighting to protect every American’s fundamental right to vote. #ICYMI my latest e-newsletter highlights our legislation to improve and expand voter access and ensure secure elections: https://t.co/5YiOtGKKB6"
RepPaulTonko,1316004356123226120,2020-10-13 13:14:23,"While the Senate has walked away from delivering needed relief for the American people, I have not stopped fighting alongside my colleagues to advance a #COVID19 rescue. Countless families, workers &amp; businesses depend on federal support to weather this storm. We must not fail."
RepPaulTonko,1315644546957668352,2020-10-12 13:24:38,"The House has passed critical legislation to:

- Restore the full protections of the Voting Rights Act
- Remove dark money in politics
- Prevent foreign interference in elections
- Strengthen election security

The Senate must stop this delay &amp; take up these bills #ForthePeople."
RepPaulTonko,1315323020416868353,2020-10-11 16:07:00,"Elections are at the heart of our nation’s democracy. Read my latest newsletter below on how @HouseDemocrats are fighting to ensure safe and secure elections for the American people: 
https://t.co/5YiOtGKKB6"
RepPaulTonko,1315287788497956865,2020-10-11 13:47:00,"Today marks #NationalComingOutDay, a time to recognize and celebrate the strength of our LGBTQ+ community and recommit to building a better, more inclusive world where none of us are judged or mistreated for who we are or who we love."
RepPaulTonko,1314958367601823746,2020-10-10 15:58:00,"The updated #HeroesAct—passed out of the House last month—protects lives and livelihoods as well as the life of our democracy.  

Our rescue plan includes new, vital resources to ensure safe elections, an accurate Census &amp; preserve the Postal Service."
RepPaulTonko,1314914831204380675,2020-10-10 13:05:00,"Today is #WorldMentalHealthDay. If you are struggling right now, know that you are not alone. Help is available. Text NAMI to 741741 and the @CrisisTextLine will respond with free mental health support, 24/7. #MIAW"
RepPaulTonko,1314633225168445443,2020-10-09 18:26:00,"Had the pleasure of speaking with my friends from @CapRegionBOCES today. As always, they imparted helpful insights, including how schools across our region have adjusted operations in the wake of #COVID19 and the serious need for federal funding for education. https://t.co/XfrCb6p7G8"
RepPaulTonko,1314612779677036545,2020-10-09 17:04:45,"🚨🚨ATTENTION!!🚨🚨 The deadline for New York State Voter Registration is TODAY, Friday, October 9th.

Make sure you are registered at https://t.co/YrITunPUXX. Whether you choose to vote-by-mail or in person, I encourage you to have a plan to ensure your voice is heard!"
RepPaulTonko,1314590091524927488,2020-10-09 15:34:36,"I am honored to receive a 100% from @HRC in their Congressional Scorecard. LGBTQ rights are human rights &amp; I will not stop fighting until every person across this nation is treated with justice, equality and dignity. #HRCscorecard  
https://t.co/rMWyeCRTah"
RepPaulTonko,1314553449611169792,2020-10-09 13:09:00,"There is no health without mental health. Join me in honoring this #MentalIllnessAwarenessWeek by providing compassion &amp; support to those who need it.

If you're feeling overwhelmingly sad, anxious or stressed, know that you are not alone. We stand with you, now and always. #MIAW https://t.co/F5u4Yma2a2"
RepPaulTonko,1314290152110542848,2020-10-08 19:42:45,"The updated #HeroesAct makes critical additions to address needs that have arisen since the House first acted &amp; maintains key priorities from our original bill.
  
The House has taken action—now the Senate must at long last advance a COVID-19 rescue for the American people."
RepPaulTonko,1314216901065740290,2020-10-08 14:51:40,"Across our Capital Region, more than 160,000 residents lost power last night &amp; crews are continuing to work around the clock to restore power and clear streets. You can report downed lines to National Grid at 1-800-867-5222 or by visiting the link below:
https://t.co/76Qmm0cTsi"
RepPaulTonko,1314186957841477633,2020-10-08 12:52:41,"TONIGHT: My office will join with the offices of @SenGillibrand and @repdelgado as well as representatives from our service academies to share information about this year’s military academy nominations process. If you're interested, I encourage you to RSVP. Hope to see you there! https://t.co/uSYoEoitUX"
RepPaulTonko,1313946198198284288,2020-10-07 20:56:00,"Weatherization saves energy &amp; lowers utility costs for Americans. My bill to strengthen the weatherization program—passed out of the House this year—makes needed investments to establish a smart, cost-effective way to reduce energy costs for low-income households. #EEDay2020"
RepPaulTonko,1313927575543205888,2020-10-07 19:42:00,"Efficiency employs more Americans than any other single energy sector, but more than 400,000 jobs have been lost in this field due to the #COVID19 crisis. We need to make smart investments in #EnergyEfficiency to save money, cut pollution &amp; create jobs! #EEDay2020"
RepPaulTonko,1313912211665027072,2020-10-07 18:40:57,"Investing in energy efficiency can #savemoney, #cutpollution and #createjobs. That's why I authored H.R. 2041, legislation that passed in the House this year, to advance our national weatherization program and help low-income families keep more money in their pockets. #EEDay2020 https://t.co/KmmXXGze0Y"
RepPaulTonko,1313824704260603904,2020-10-07 12:53:13,The House has passed two versions of the #HeroesAct to deliver urgently-needed #COVID19 rescue. Republicans must stop playing politics &amp; enact the updated Heroes Act immediately or come forth with their own plan that delivers for American families.
RepPaulTonko,1313520413134196736,2020-10-06 16:44:05,"2 years ago, our community suffered an unspeakable tragedy as 20 souls lost their lives in the crash of a limo that should never have been on the road. Thinking of their loved ones &amp; forever grateful for their resolve that continues to move us forward to enact life-saving reform."
RepPaulTonko,1313194456385024000,2020-10-05 19:08:51,"The reports of ICE forcing unwanted medical procedures on migrant women are horrifying. I stand with @RepJayapal &amp; our colleagues to pass H.Res. 1153 condemning this brutality. These women deserve justice, &amp; we must ensure this type of atrocity is never allowed to happen again. https://t.co/SLKBHOjRhl"
RepPaulTonko,1312778435190759424,2020-10-04 15:35:43,"Our updated #HeroesAct delivers for the American people with assistance for frontline heroes, funding for testing, tracing &amp; treatment, support for our elections and much more. Read more about our vital rescue plan in my latest newsletter here👇
https://t.co/HlvQJLmZDo"
RepPaulTonko,1312744530140037120,2020-10-04 13:21:00,"House Democrats have passed more than 340 bipartisan bills #ForThePeople that are stuck in the Senate—bills to lower health care costs, raise wages by rebuilding America, and clean up corruption &amp; strengthen our democracy—all sitting on @senatemajldr McConnell’s desk. https://t.co/PUvYvNeVQk"
RepPaulTonko,1312419890964377600,2020-10-03 15:51:00,"With House passage of our bipartisan Horseracing Integrity &amp; Safety Act this week, we are at long last rounding the final turn toward achieving needed reforms for our sport of kings. I urge the Senate to advance our bipartisan bill at once. https://t.co/DLUAvWE5Ae"
RepPaulTonko,1312378116136984576,2020-10-03 13:05:00,"Our updated #HeroesAct makes good on @HouseDemocrats’ push to compromise to address the health &amp; economic crisis gripping our nation. After months of delay, the Senate must meet us at the negotiating table at long last &amp; pass a bill that rescues families, workers &amp; businesses."
RepPaulTonko,1312153731262107650,2020-10-02 22:13:22,"In this segment of ‘Ask Paul Tonko a Question’ I share how we can all do our part to help our community by completing the #2020Census &amp; encouraging others to do the same. Time is running out, so make sure you count by going to https://t.co/nWjvgdcoX8 today! https://t.co/IKDFnsbwaB"
RepPaulTonko,1312096581362081793,2020-10-02 18:26:17,"The past several months have shown how crucial our manufacturers are in addressing the #COVID19 pandemic and helping strengthen our economy. Thank you to the makers of PPE, medical equipment, and everyone with homemade masks! 👏#MFGDay20"
RepPaulTonko,1312063956413022208,2020-10-02 16:16:38,The manufacturing industry is the backbone of our American economy. Glad to join with a number of Capital Region manufacturers for #MFGDay20 to discuss the challenges they're facing with COVID-19 and develop solutions to help the industry thrive today &amp; in the future. https://t.co/Eup8ZFYQKl
RepPaulTonko,1312047554704572418,2020-10-02 15:11:28,I’m troubled by news this morning that the President &amp; First Lady have tested positive for COVID-19—a stark reminder of how easily this virus can be spread. I’m keeping them and all who are struggling with this disease in my thoughts and hope they make a swift &amp; complete recovery
RepPaulTonko,1311414749272461313,2020-09-30 21:16:55,"Our updated COVID-19 rescue delivers:

$225B in education funding
$436B in state &amp; local assistance
$75B for COVID-19 testing &amp; tracing
$15B in funding for @USPS
&amp; much more

It's long past time the Senate work with @HouseDemocrats to provide the support Americans need."
RepPaulTonko,1311414747934470144,2020-09-30 21:16:55,"After months waiting for Senate Republicans to meet us at the negotiating table, we have unveiled an updated #HeroesAct that delivers for the American people.
https://t.co/FViee2PPti"
RepPaulTonko,1311014018681798656,2020-09-29 18:44:34,".@NTSB’s report reaffirms the need to advance national limo reforms. Our limo safety package—passed out of the House—ensures no family has to suffer the pain &amp; loss of another senseless tragedy. I urge the Senate to take up this life-saving bill at once.
https://t.co/2IZBqYf32h"
RepPaulTonko,1311000429849907200,2020-09-29 17:50:34,Our Horseracing Integrity &amp; Safety Act has just passed out of the House! I thank my friend @RepAndyBarr for leading with me in this effort to restore integrity to this sport of kings &amp; urge the Senate to advance their companion bill without delay. https://t.co/JdUXS3LhOz
RepPaulTonko,1310294802353860610,2020-09-27 19:06:39,"Through her words and actions, Justice Ginsburg epitomized her famous quote, “Fight for the things that you care about. But do it in a way that will lead others to join you.” 

My latest newsletter reflects on the legacy of this American icon and hero.
https://t.co/oH4YvbcYqR"
RepPaulTonko,1310206053452308481,2020-09-27 13:14:00,"On #GoldStarMothers Day, we remember the strength of our military families who have lost loved ones while serving in our U.S. Armed forces.

We hold them close in our hearts—this day and every day—and honor their bravery and sacrifice in service of our nation."
RepPaulTonko,1309854486966366208,2020-09-26 13:57:00,"Our energy package will not solve the #ClimateCrisis, but it's an important down payment for our clean energy future. Proud to advance this bold bipartisan legislation supporting independent science, environmental justice, climate mitigation &amp; much more.

https://t.co/ZHe5zMel2n"
RepPaulTonko,1309569552779538434,2020-09-25 19:04:46,"A complete Census count helps us maintain a democracy where every voice matters and is valued.

Make sure your voice is heard!

Complete the #2020Census today by phone, by mail or online at https://t.co/A36cU04X3c and encourage others to do the same."
RepPaulTonko,1309569550996905986,2020-09-25 19:04:46,"This Administration’s effort to cut the #2020Census short a month puts all our communities—particularly low income &amp; communities of color—under serious threat of an undercount. This victory helps ensure a full and accurate count, as is mandated by our Constitution. https://t.co/j6IQyV0s8S"
RepPaulTonko,1309231036530921473,2020-09-24 20:39:38,"575 days ago, the House took a historic step forward to advance #HR8, the Bipartisan Background Checks Act to help put an end to gun violence &amp; protect our communities. Today we #WearOrangeMasks to keep the pressure on the Senate to finally vote on this life-saving legislation. https://t.co/CYof7HatZi"
RepPaulTonko,1309190176682446849,2020-09-24 17:57:16,"No more waiting. No more excuses.

It's time for the Senate to pass our comprehensive rescue package or offer a real alternative of their own.

The Republican’s so-called ‘skinny’ bill doesn’t get the job done for our communities. The Heroes Act does.
/end"
RepPaulTonko,1309190175097057281,2020-09-24 17:57:15,"In the four months since the House passed the Heroes Act, more than 110,000 Americans have died of COVID-19.

This is the equivalent of losing every soul living in Albany, New York. We have reached the breaking point, plain and simple."
RepPaulTonko,1309190173578665984,2020-09-24 17:57:15,"Let’s deliver the financial support our essential workers, unemployed workers, and financially strained Americans need to weather this storm. 

The Heroes Act gets it done."
RepPaulTonko,1309190172114923520,2020-09-24 17:57:15,"Let’s save lives and turn the corner on this crisis with a coordinated national plan for testing and tracing. 

The Heroes Act gets it done."
RepPaulTonko,1309190170311352321,2020-09-24 17:57:14,"Let’s deliver emergency funding to sustain local essential services and the salaries of first responders, nurses, teachers, infrastructure maintenance workers, and many more. 

The Heroes Act gets that done too."
RepPaulTonko,1309190168822321154,2020-09-24 17:57:14,"We have a plan. Join us.

Let’s invest heavily in research and follow science and public health guidance. They are the fastest route to get us to the other side of this crisis.

Our Heroes Act gets it done."
RepPaulTonko,1309190166427426817,2020-09-24 17:57:13,"For the lives and livelihood of every one of my constituents, I beg my colleagues on the other side of the Capitol to seize this moment to follow a new guide.

Let that guide be science. Let it be truth. Because politics has brought America low in the face of this crisis."
RepPaulTonko,1309188973428903936,2020-09-24 17:52:29,"We’ve been fighting for months to advance a COVID-19 rescue for our Capital Region &amp; beyond. Senate Republicans won’t take up our bill and they won’t offer an alternative that is up to the job.

Now, our nation has passed the terrifying milestone of 200,000 deaths.
1/ https://t.co/ji6chrp7gZ"
RepPaulTonko,1308829784315768835,2020-09-23 18:05:12,Our American spirit is embodied by our spectacular national parks. I was proud to be awarded a 100% score by @ActForParks for supporting our parks and I pledge to continue working so that these national treasures are protected for generations to come. #VoteForParks
RepPaulTonko,1308487250372702208,2020-09-22 19:24:05,"Today I introduced the NY-NJ Watershed Protection Act, legislation that would create a cleaner, more accessible &amp; healthier waterfront. I'll continue working to protect these precious resources that bring environmental &amp; economic value for our communities.
https://t.co/bwmKGJdCoQ"
