RepPaulTonko,1288917625003810821,2020-07-30 19:21:23,"5 weeks ago, the House advanced the #JusticeinPolicing Act, legislation that would deliver meaningful, common sense reforms that advance the cause of justice and make all of us safer in our communities. The Senate must pass this bill! https://t.co/CqAOLBuird"
RepPaulTonko,1288857885850701828,2020-07-30 15:24:00,"After 2 months of refusing to meet @HouseDemocrats on our Heroes Act, the Senate alternative does little to help. Americans are demanding action &amp; our communities need a rescue plan now. I'll keep pushing to ensure our bill becomes law to help our nation weather this storm. https://t.co/wCmaYmaUtx"
RepPaulTonko,1288849176432959489,2020-07-30 14:49:23,"Our Constitution gives this power to Congress, not the President. Widespread voter fraud is a myth. Voting by mail is proven, secure and safe. Our Heroes Act gives states the funding they need to maintain our republic. No delays, no excuses. https://t.co/ELEwgsV966"
RepPaulTonko,1288824068578447360,2020-07-30 13:09:37,"Workers cannot return to their jobs—and the U.S. economy cannot rebuild stronger—if families are unable to access safe, affordable child care. Our Child Care for Economic Recovery Act provides meaningful, robust child care relief to support a fully engaged workforce. https://t.co/Gg8MXfAsix"
RepPaulTonko,1288463025083682817,2020-07-29 13:14:58,"We passed #HeroesAct in May. Senate had 2 months to respond. In that time 60,000 Americans have died of COVID-19. Millions have lost jobs. Local communities are on the brink &amp; facing whether to lay off teachers or firefighters first.

#HeroesAct is the rescue plan America needs. https://t.co/YLwnWdw8Ho"
RepPaulTonko,1288175485038493703,2020-07-28 18:12:23,"My thanks to @MaeNRDC, @AMWA_CEO &amp; @OklahomaDEQ Water Quality Division Director Shellie Chard for sharing their expertise. I look forward to continuing to work together to make sure every U.S. community has access to safe and clean drinking water. https://t.co/XSv4oQYOIa"
RepPaulTonko,1288175316217876483,2020-07-28 18:11:43,"Far too many communities have learned the hard way that federal drinking water standards can often fail to safeguard public health. Today, my @EnergyCommerce subcommittee considered ways we can reform how we set these standards to better protect drinking water for all Americans. https://t.co/X4HaozoLgl"
RepPaulTonko,1287833858864553986,2020-07-27 19:34:53,"Rest In Peace, John. May your light always fill the halls of our Capitol and spread across this nation in the name of liberty and justice for all. And let us be worthy and humble enough to follow it. #goodtrouble https://t.co/VRsIbdFXLW"
RepPaulTonko,1287799947031707650,2020-07-27 17:20:08,"Thank you @RepWilson for your tireless efforts advancing the bipartisan Commission on the Social Status of Black Men and Boys Act, which will examine how racism and social injustices create undue mental and emotional burdens for black men and boys. #BlackMenAndBoysAct https://t.co/LdLKF3AIS2"
RepPaulTonko,1287783807727345671,2020-07-27 16:16:00,"We are falling behind in the 2020 CENSUS! So far in July, our NY-20 self-response rate has risen by less than 1%. We all need to be counted so our schools, hospitals &amp; essential services get the funding they need for the next decade. Complete the Census at https://t.co/2JyJulfvWw"
RepPaulTonko,1287764178086891522,2020-07-27 14:58:00,"Outdoor recreation helps our communities thrive, contributing $41.8 billion in consumer spending annually &amp; directly employing 313,000 New Yorkers! I was proud to vote for the Great American Outdoors Act to protect our #PublicLands and help our economy grow. https://t.co/srzRS6TTD9"
RepPaulTonko,1287741042339598336,2020-07-27 13:26:04,"NY had a birthday this weekend! We became the 11th state to join the Union on July 26, 1788. Learn more about the rich history of our great state, courtesy of @librarycongress, including historic maps, teacher resources, veterans’ stories, photos &amp; more: https://t.co/JsWiKbKE2t"
RepPaulTonko,1286783881656651777,2020-07-24 22:02:39,"Everyone deserves to breathe clean air. Amidst a public health crisis, this truth is more important than ever.

Thanks to @RepLBR, @RepMcEachin, @RepBobbyRush &amp; all our colleagues who voted to protect human health &amp; ensure EPA upholds science &amp; strong standards against pollution. https://t.co/BUqkbdOPcx"
RepPaulTonko,1286764590915825664,2020-07-24 20:46:00,"- Limit federal agents’ crowd control activities to federal property and its immediate vicinity, unless their presence is specifically requested by both the mayor and governor; and

- Make arrests in violation of these rules unlawful."
RepPaulTonko,1286764589808586764,2020-07-24 20:45:59,"This bill would: 

- Require individual &amp; agency identification on uniforms of officers &amp; prevent unmarked vehicles from being used in arrests;

- Require disclosure on an agency website within 24 hours of deployments–specifying the number of personnel &amp; purpose of deployment;..."
RepPaulTonko,1286764588038488064,2020-07-24 20:45:59,"Federal agents are being weaponized in Portland, tear-gassing &amp; brutally beating peaceful protesters, media, legal observers &amp; others. Proud to cosponsor the Preventing Authoritarian Policing Tactics on America’s Streets Act to block deployment of these forces against Americans. https://t.co/tNE3SGLRux"
RepPaulTonko,1286382456741007361,2020-07-23 19:27:32,"The House of Representatives passed our Heroes Act in May that would extend the $600/week in federal unemployment coverage, among other things. The Senate has been very busy doing _____, and now we're at the cliff. So let me ask those of you who have received it:

Has it helped?"
RepPaulTonko,1286368087277817856,2020-07-23 18:30:26,"This Administration is pressuring schools to reopen against their own CDC guidelines. This endangers students, teachers, staff &amp; families. Schools need help in order to #ReopenSafely. The House passed a rescue plan with the Heroes Act months ago. It's time this bill becomes law. https://t.co/IgfEW0cLr4"
RepPaulTonko,1286291124794130435,2020-07-23 13:24:36,"The loss of John Lewis has left us with a deep unanswerable sadness and a resolve that will echo in this chamber and within our hearts forever. Rest in Peace, John. #RIP https://t.co/PLKiglyHg1"
RepPaulTonko,1285659620686651392,2020-07-21 19:35:14,"I called for the Administration to invoke the Defense Production Act in April. Months later, Americans are still struggling to get the protective equipment they need to weather this crisis. Enough waiting. It's long past time for the President to act to keep our communities safe. https://t.co/bL0NIRCtXG"
RepPaulTonko,1285624902603755526,2020-07-21 17:17:17,"Basic medical supplies such as vials &amp; syringes will be critical to running a successful COVID-19 vaccine program. Thanks @MenePangalos, @John_Young &amp; Dr. Stephen Hoge for their work ensuring adequate supply for providers &amp; supporting efforts to develop a safe, effective vaccine. https://t.co/gPdxK0WC8d"
RepPaulTonko,1285290278270709761,2020-07-20 19:07:36,RT @troyrecord: Tonko announces $397K science grant to RPI https://t.co/l1KdBJMLy5
RepPaulTonko,1285223180513300480,2020-07-20 14:40:59,"RT @AGU_Eos: Vannevar Bush and The Endless Frontier are inspirations for the sort of science policy the U.S. needs today, argues @RepPaulTo…"
RepPaulTonko,1284467041987178499,2020-07-18 12:36:21,"My thoughts, prayers &amp; heart go out to his family, his community and all who knew &amp; loved him. May his light always fill the halls of our Capitol, his hope guide our hands and his vision for a more perfect Union carry us in faith &amp; purpose. Rest In Peace my dear and noble friend."
RepPaulTonko,1284465848497864704,2020-07-18 12:31:37,"In our years of service together, he time and again offered me the gifts of his courage, his warmth, and his friendship. History is etched with the markings of his fierce and humble courage and generous spirit, forged in an iron crucible that seemed to glow from within him."
RepPaulTonko,1284465750044966913,2020-07-18 12:31:13,"We knew this day would come but that does not make it any easier. 

Brother John, as he was affectionately known to so many of us, was a timeless beacon of moral light who guided our nation through some of its darkest days. https://t.co/4xpFDlyrj4"
RepPaulTonko,1283865934101446657,2020-07-16 20:47:46,Dr. Fauci has consistently delivered key guidance to the Trump Administration and American people based on the latest science &amp; public health conditions. Our scientists &amp; experts should never be treated as political scapegoats to be blamed for the failures of others. #TrustFauci https://t.co/q9zBfIB2xQ
RepPaulTonko,1283860563722940421,2020-07-16 20:26:26,"Federal unemployment benefits fall off a cliff at the end of July if Congress doesn't act, cutting a financial lifeline for our hardest hit neighbors &amp; destabilizing our economy. The House passed the Heroes Act in May to get the job done. Senate needs to step up and do the same. https://t.co/mUEsyi6sKm"
RepPaulTonko,1283512885495373824,2020-07-15 21:24:53,"Hunger has no political affiliation. Neither should food assistance. So why, in the midst of a worsening pandemic, are some of our neediest neighbors being left out?

https://t.co/JwisVMKRXI"
RepPaulTonko,1283476941727817728,2020-07-15 19:02:03,Politicizing science &amp; benching our public health experts has led to countless deaths during this pandemic already. Doubling down on those mistakes will weaken our pandemic response at the worst moment yet in this crisis. https://t.co/zi2JfzwMGJ
RepPaulTonko,1283143880704233472,2020-07-14 20:58:35,"This @ICEgov policy served no purpose beyond cruelty &amp; fear. Congress and the American people demanded it be withdrawn, and it was. Thanks to everyone who reached out to my office and raised your voices in other ways to stop this https://t.co/Z19km3HECK"
RepPaulTonko,1283049930190458880,2020-07-14 14:45:15,RT @repdelgado: Our family farmers &amp; most vulnerable populations have experienced dire consequences from #COVID19. It is essential that the…
RepPaulTonko,1282717558710456320,2020-07-13 16:44:32,Today @repdelgado &amp; I led more than a dozen fellow NY delegation members calling on @USDA to explain its ongoing mismanagement of the Food Box Program. They've shut out local food banks &amp; instead awarded contracts out of state at the expense of our neediest neighbors &amp; families. https://t.co/DNHOqiGq9K
RepPaulTonko,1282315777148964865,2020-07-12 14:08:00,"Last week, the House advanced the #MovingForward Act, legislation that would invest in our nation’s infrastructure, produce millions of good-paying jobs &amp; create a more just, more resilient economy for every American. I urge the Senate act and take up this bill at once."
RepPaulTonko,1281976793692610560,2020-07-11 15:41:00,"Widespread testing &amp; tracing have been the key to getting control of this crisis around the world, yet Americans continue to suffer without the resources they need. The Senate must act to protect our communities by finally voting to advance our Heroes Act.
https://t.co/OJreysIETh"
RepPaulTonko,1281941561492766720,2020-07-11 13:21:00,"As of this week, Colonie has the highest Census response rate across NY-20 at 76.9%. The lowest rate is Fonda at 36.1%.

Check out this response map below to see how your community compares. Everyone counts, so make sure you &amp; your family are counted!

https://t.co/vfkplXOtbA"
RepPaulTonko,1281750045193371648,2020-07-11 00:39:59,"Lying to Congress is a crime. President Trump thinks he and his associates are above the law. 

This decision is regrettable, but the ultimate judgment in this case will be in the hands of the American people. 

On Election Day, President Trump must answer to all of us. https://t.co/xIMs27HoML"
RepPaulTonko,1281672623232102404,2020-07-10 19:32:20,"Proud to join several letters with my colleagues in the House and Senate calling @DHSgov and @ICEgov to reverse this cruel and illogical decision. 

Our international students deserve to remain in this country and receive the education they worked for."
RepPaulTonko,1281672621835399170,2020-07-10 19:32:20,"ICE's visa ruling to force international students who take entirely online courses out of the U.S. not only harms their education, it impedes universities &amp; colleges from effectively addressing #COVID19 and threatens the health of all students &amp; faculty.
https://t.co/q05Yr0qTP0"
RepPaulTonko,1281353436106092544,2020-07-09 22:24:00,"West Glenville Fire District #6 will receive $2,300 COVID-19 federal funding for PPE. Our firefighters put their lives on the line to keep us safe. We need to ensure they have the tools they need to protect themselves while they fight to protect all of us.
https://t.co/OgCB0rECLH"
RepPaulTonko,1281341868899532800,2020-07-09 21:38:02,"Congrats @SCAPNY, just awarded $849,892 in federal funding to assist incarcerated individuals transition &amp; find employment. SCAP's vital work gives people the opportunity to rebuild stronger &amp; be a positive force for our communities &amp; our regional economy.
https://t.co/nEqzK32tjv"
RepPaulTonko,1281301128521662473,2020-07-09 18:56:09,My colleagues and I passed the George Floyd #JusticeInPolicing Act weeks ago in the House. The Senate needs to take it up and advance these urgent commonsense reforms NOW. Sign up to become a citizen cosponsor at https://t.co/CKzGfgLhsn.
RepPaulTonko,1281298454170472449,2020-07-09 18:45:31,It has been weeks since my fellow @HouseDemocrats and I passed the George Floyd #JusiticeInPolicing Act to safeguard the rights and safety of our community members. Time for the Senate to do their job and hold a vote! https://t.co/LvTNx0DEB4
RepPaulTonko,1281290160542547968,2020-07-09 18:12:34,Millions of Americans are living with a rare disease &amp; available treatments are few &amp; far between. @RepMcKinley &amp; I are introducing a bill today to improve and expedite development of treatments by ensuring rare disease experts have a seat at the table &amp; patients are represented.
RepPaulTonko,1280599085620310016,2020-07-07 20:26:29,"Senate needs to act now. Our state &amp; local leaders have done much but more is clearly needed. Leaders at all levels must continue to step up and deliver reforms to make our communities safer for all.

/end"
RepPaulTonko,1280599084253020166,2020-07-07 20:26:28,This is exactly why we passed the Justice in Policing Act in the House to ban chokeholds and raise the bar of accountability.
RepPaulTonko,1280599082743054337,2020-07-07 20:26:28,"It is impossible to build trust with this kind of violence ongoing, especially for those peace officers who do serve and protect with integrity. We need answers, those responsible need to be held accountable."
RepPaulTonko,1280599079387619328,2020-07-07 20:26:27,"I am enraged and heartbroken to see this violence from a Schenectady police officer. I have been told that police departments across our region do not teach or use these tactics, so HOW DOES THIS HAPPEN? 

1/
https://t.co/0zH1EGXd0J"
RepPaulTonko,1280223156272332801,2020-07-06 19:32:40,"We—and the communities we serve—have been saying this for months. That's why we wrote &amp; passed the Heroes Act in the House, a bill to ensure workers, families &amp; small businesses get the help they need to weather this storm. The Senate must act &amp; advance this critical legislation. https://t.co/0yGNJZjhQH"
RepPaulTonko,1280202459567329281,2020-07-06 18:10:26,"Americans across our nation are living in communities with failing water systems, denying their basic right to clean drinking water. The passage of our #MovingForward Act out of the House delivers critical investments that will raise the bar for America’s clean water. https://t.co/VZXhMHB7H8"
RepPaulTonko,1279777804205375489,2020-07-05 14:03:00,"Supporting energy efficiency is key to reducing carbon pollution and combating the #ClimateCrisis. 

Our #MovingForward Act, now approved by the House, makes vital energy efficiency investments that create good-paying jobs and better our communities. Senate needs to act! https://t.co/l5g7aqwJk9"
RepPaulTonko,1279457881050447872,2020-07-04 16:51:44,"On this Independence Day, may our celebrations lift the heaviest of hearts, herald the bright dawns of our nation, and renew faith that—in service of one another and a true spirit of freedom—we can weather any storm.

E Pluribus Unum 🇺🇸

https://t.co/saWRnGG6wm"
RepPaulTonko,1279094300102533121,2020-07-03 16:47:00,"The #JusticeInPolicing Act will:

- curb police brutality
- end racial profiling
- eliminate qualified immunity for law enforcement

Our nation needs this bold step forward to make a more just nation for every American. Time for the Senate to act!"
RepPaulTonko,1279041703626764294,2020-07-03 13:18:00,Millions of Americans across the nation are struggling without broadband internet access. Proud to help to advance our #MovingForward Act including my ACCESS BROADBAND Act &amp; $100 billion invested toward expanding broadband access. https://t.co/loGJC6sbGb
RepPaulTonko,1278810045589983232,2020-07-02 21:57:28,"NY-20 has a Census self-response rate of 61.4% but there are areas in Albany, Montgomery and Schenectady counties with a response rate of less than 30%! 

Make sure you, your family and your community are counted by completing the #2020Census today at https://t.co/Mn9dudMR7e"
RepPaulTonko,1278761951645007872,2020-07-02 18:46:22,"House Democrats passed the George Floyd #JusticeInPolicing Act to end police brutality, hold police accountable, improve transparency and create structural change that safeguards every American’s right to safety and justice. 

It's time the Senate act! https://t.co/DpnLhDERgb"
RepPaulTonko,1278715406438608900,2020-07-02 15:41:24,"56 years ago, our nation banned discrimination &amp; segregation based on race, religion, sex or national origin.

Still, our fight for justice must continue until EVERY AMERICAN has full and equal access to life, liberty &amp; the pursuit of happiness.

#CivilRightsAct #BlackLivesMatter https://t.co/rTCVfQPufA"
RepPaulTonko,1278442967498395649,2020-07-01 21:38:50,"Our nation has long needed a strong, transformative investment in our infrastructure. Our #MovingForward Act speaks to that need, delivering limo safety reforms, broadband access, climate action, safe drinking water systems and more to create a better future for every American."
RepPaulTonko,1278088605085425664,2020-06-30 22:10:43,"“Wasn’t briefed” isn’t an excuse. If a foreign adversary offered a bounty that got our American military members killed, that adversary must be held accountable. Our service members deserve a Commander in Chief that has their back, not Putin’s. https://t.co/6J49iWelQh"
RepPaulTonko,1278045877517668353,2020-06-30 19:20:56,"Investing in energy efficiency is key to reducing carbon pollution and combating the #ClimateCrisis. That’s why #MovingForward expands energy efficiency investments for homes, schools and local governments!"
RepPaulTonko,1278018547982180353,2020-06-30 17:32:20,"Important work from @JTFund, @BGAlliance &amp; all the partners that developed this essential platform. To achieve a clean energy transition we must adopt a framework &amp; make the investments that will enable communities facing disruptions to realize new opportunities. #JustTransition https://t.co/eaQi2lm6CF"
RepPaulTonko,1278004776198975490,2020-06-30 16:37:37,"Excellent and thoughtful work by @ClimateCrisis that will inform our efforts on @EnergyCommerce and serve as a blueprint to build a cleaner, more just economy for all. I look forward to continuing this work together to make this plan a legislative reality.
https://t.co/FSgG20zX8M"
RepPaulTonko,1277714175293300736,2020-06-29 21:22:52,"Had the honor of questioning Bishop @Mebudde, who ministers at the nearby church and Kishon McDonald, one of the peaceful demonstrators at our @NRDems hearing today. 

2/2"
RepPaulTonko,1277713949878861825,2020-06-29 21:21:59,"The Trump Administration’s attack on nonviolent demonstrators in Lafayette Square was a direct assault on our First Amendment freedoms and right to demonstrate peacefully in the name of justice.

1/2 https://t.co/5KBOmWSKkk"
RepPaulTonko,1277678527224168454,2020-06-29 19:01:13,RT @NAMIAdvocacy: Medicare limits people to just 190 days of inpatient psychiatric hospital care in their lifetime. This is discrimination…
RepPaulTonko,1277374266997116929,2020-06-28 22:52:12,"In the middle of this deadly pandemic, with 125,000 American lives already lost and counting, the Trump Administration is renewing its push for the Supreme Court to end the Affordable Care Act. 

Mr. President, shame on you. https://t.co/ml4wHPsQLk"
RepPaulTonko,1276876436134125568,2020-06-27 13:54:00,Police officers must be accountable to the communities they serve &amp; there must be transparency in our law enforcement. That’s exactly what the #JusticeInPolicing Act delivers. We all play a role in changing our nation for the better. Our legislation is a vital step on that path.
RepPaulTonko,1276637630004891652,2020-06-26 22:05:04,"We're falling behind! NY-20 has a #2020Census response rate of 61.3%. The national rate is 61.7%. 

We need everyone to be counted if we’re going to get the federal funds &amp; support our community needs. Make sure your voice is heard &amp; complete the Census at https://t.co/2JyJulfvWw"
RepPaulTonko,1276589423203946502,2020-06-26 18:53:31,"Today we celebrate 5 years since SCOTUS ruled that every American has the right to marry who you love. There's still far more work to be done to end prejudice &amp; discrimination, but we will continue fighting for a better, more just future for us all. #PRIDE https://t.co/vvMU8F6hJr"
RepPaulTonko,1276503384124686338,2020-06-26 13:11:37,"No single law can heal the wounds of 400 years of violence and injustice. But our #JusticeInPolicing Act is a vital step toward creating a better nation that truly upholds the deeply American principles of liberty and justice for all.

https://t.co/96HQqvmv4x"
RepPaulTonko,1276325037801443334,2020-06-26 01:22:56,We have seen too many lives taken and communities devastated by police brutality and racial profiling. Action is long overdue. Proud to cast my vote in support of the George Floyd #JusticeInPolicing Act to answer the calls for justice being made by Americans across the nation. https://t.co/i04rTl8q9P
RepPaulTonko,1276322759027687424,2020-06-26 01:13:53,"RT @HouseJudiciary: NEW: Gwen Carr, mother of Eric Garner; Samaria Rice, mother of Tamir Rice; and John Crawford, Jr., father of John Crawf…"
RepPaulTonko,1276192615738859520,2020-06-25 16:36:44,"Proud to stand with my colleagues today in the gaze of history to advance the George Floyd #JusticeinPolicing Act. Americans across the nation continue to raise our voices to make clear that Black lives matter &amp; to call for justice for our communities. Today, we answer that call."
RepPaulTonko,1275904783837286410,2020-06-24 21:33:00,"Now more than ever we must ensure our neighbors, friends and loved ones can get the mental health services they need.

@RepHuizenga and I introduced legislation to remove the Medicare 190 day inpatient treatment cap that private insurers ended long ago.

https://t.co/cqP7KK9rPR"
RepPaulTonko,1275896258423595014,2020-06-24 20:59:07,"Our House infrastructure package delivers more than $23 billion in drinking water support to ensure our communities are protected from harmful pollutants.

2/2
https://t.co/woISJoqq5Z"
RepPaulTonko,1275896255936430080,2020-06-24 20:59:07,"Access to safe drinking water is a right, not a privilege. Unfortunately that right is denied to millions of Americans whose water is contaminated or lost to failing water systems.

1/2
https://t.co/uNoPu5l3Fc"
RepPaulTonko,1275884799459307520,2020-06-24 20:13:35,Too many communities have been left behind without access to broadband internet. Our #MovingForward Act invests $100 billion in our nation's broadband infrastructure and includes my ACCESS BROADBAND Act to help bridge that digital divide &amp; make our economy more competitive. https://t.co/C4oitsMd73
RepPaulTonko,1275527798506098688,2020-06-23 20:34:59,"Dr. Fauci’s answer at today’s @EnergyCommerce hearing when I asked about Pres. Trump refusing to wear a face mask:

“Certainly I wear a mask in public all the time, not only because I want to protect others &amp; to protect myself but also to set an example.”
https://t.co/66Rgvhscax https://t.co/hEE2Vt1rTy"
RepPaulTonko,1275152791653269506,2020-06-22 19:44:51,"I still hear from constituents daily who have yet to receive stimulus checks Congress provided for in the CARES Act. I’m calling on the IRS to provide additional transparency &amp; updates on the status of this program, with checks delivered to all Americans no later than July 15. https://t.co/brrhuEVEzF"
RepPaulTonko,1275091544777916417,2020-06-22 15:41:28,"BIG NEWS--Our full set of limousine safety reforms is advancing to the House Floor for a vote as part of a major new national infrastructure bill. Thanks to the families of victims who have helped create and drive this legislation forward.

WHAT'S IN IT: https://t.co/S3Xdylkr73"
RepPaulTonko,1275084382747926531,2020-06-22 15:13:01,"A remarkable, talented, 

*newly award-winning* 

young artist right here in our Capital Region! https://t.co/EeFdm84JgZ"
RepPaulTonko,1274056116251525120,2020-06-19 19:07:03,RT @EnergyCommerce: Watch: @RepPaulTonko and @ACORE’s Gregory Wetstone make the case for why clean energy can help our economy out of this…
