,Tweet
0,Thank you to all the brave men and women who put their lives on the line to protect and serve. Happy #NationalFirstRespondersDay
1,In the last month in the US we experienced double the amount of daily COVID infections but half as many daily deaths or a 75% reduction in death rate. Great news but don’t expect left wing media to tell you this truth. https://t.co/qVQaFYQ7BD
2,"""Researchers once feared that school reopenings might spread the virus through communities. But so far there is little evidence that it’s happening."" https://t.co/EMyPGicgPq"
3,New COVID infections up 33% in Spain but mortality down 82%!  The Leftwing media reports the new cases but refuses to let anyone hear the good news — mortality rates are plummeting! https://t.co/z55JGBjSsV
4,"Hello 911 I’d like to report a murder: @realDonaldTrump is absolutely killing @JoeBiden on lockdowns, schools and the petty tyrants trying to ruin our economy and harm our children."
5,"RT @mattgaetz: Trump is the candidate of opening up.

Biden is the candidate of lockdowns."
6,Right now @realDonaldTrump going STRONG on lockdowns and the damage being done. This is what he needs to keep saying. VP Biden is auditioning for petty tyrant in Chief. NO!!
7,"Just now: @JoeBiden will not rule out more lockdowns. 

This should be disqualifying.  

We have had enough petty tyrants like @NYGovCuomo hurting our economy and hurting our children."
8,“...recent data are shifting the discussion on school safety and infection rates of Covid-19. They argue strongly for opening K-12 schools.” https://t.co/KgkuWfFHT1
9,"To the scolds blaming ⁦@realDonaldTrump⁩ infection on not wearing mask: the only published randomized clinical study of cloth masks shows 97% penetration of particles &amp; higher infection rate than control.  But never mind, it’s all about submission... https://t.co/tONCm8swFw"
10,"Democrats seem to think all justices are politicians, and so they want a politician that’ll vote for their cases instead of a justice that will adhere to the law. https://t.co/iF32r0b83m"
11,RT @SenMikeLee: Many of you have expressed concern about my health status. Please do read this letter from the Attending Physician. https:/…
12,Science illiterates at twitter censor ⁦@realDonaldTrump⁩ for saying he’s immune.  Even the ever-cautious Dr. Fauci concedes that he feels “really confident”&amp;”willing to bet anything that people who recover are really protected against re-infection.” https://t.co/JJt11Lr95R
13,"Biden/Harris will raise your taxes. Fact Check: True.  

VP Biden said so last week when he said he would repeal the Trump tax cuts. Their $3T tax hike is the wrong medicine for our economy anytime, but especially harmful during this pandemic."
14,"RT @adam_brandon: Joe Biden and Kamala Harris not only support the unconstitutional lockdowns, but they don’t think they went far enough. A…"
15,"Over 2300 Health scientists and over 2500 MDs sign Great Barrington Declaration proclaiming that low-risk individuals should be freed from COVID restrictions immediately. 

Great Barrington Declaration https://t.co/PPABJQkmB6"
16,"If you’re more worried about @realDonaldTrump unmasking on a balcony with no one close to him than you were by the Obama/Biden administration unmasking (aka illegally spying on) their political opponents, my diagnosis is you have TDS, &amp; my prescription is to put down your phone."
17,RT @RepThomasMassie: I just realized that not only will there be people who receive the vaccine and still wear a mask. There will people wh…
18,"Prof. Buggert further makes a point, that Dr. Fauci closes his mind to -“our findings most likely reflect widespread exposure to seasonal coronaviruses...”
https://t.co/pL6q11imK1"
19,"To the left wing media, diversity is admirable unless it means a diversity of scientific thought.

Dr. Scott Atlas: White House Coronavirus Adviser’s Critics Ignore Science | National Review https://t.co/nXsiwzB3bg"
20,"Justice requires the maximum the law allows for violent criminals who attempt to assassinate a police officer. 

Man charged in shooting of 2 Los Angeles County deputies https://t.co/T3kloPpd8I"
21,"Dr. Fauci. Paging Dr. Fauci...pls read this article that shows 30% of control group has T cell immunity to COVID. “results indicate that roughly twice as many people have developed T cell immunity compared with those who we can detect antibodies in.”
https://t.co/bx18wkccO3"
22,"Dr. Scott Atlas and Dr. Bhattacharya are truth tellers in a sea of government misinformation.  

The CDCs own website confirms children very rarely suffer severe illness from COVID 19. 

End the lockdowns, protect the vulnerable!

Lockdown Failures | https://t.co/MTGry5gQRN"
23,RT @KelleyAshbyPaul: Thank you to everyone who has been praying and sending support for our beloved Grandaddy Ron!  He is doing better and…
24,"Professor at Niels Bohr Institute, an expert in the spread of coronavirus says Sweden may have achieved herd immunity.
https://t.co/MKAL1P3tO2"
25,Watch the full video today where I take Dr. Fauci to task for lockdowns and his praise of Gov cuomo whose state has the highest death rate. https://t.co/e8rD0Ks3MV
26,The purely political blocking of this afternoon’s committee hearings prevented my Fed Spending Oversight subcommittee from holding a hearing on cybersecurity threats that have accelerated during the pandemic. https://t.co/i6AH21hZk3
27,Today we honor all those lost on 9/11 and the heroes who put their lives on the line in service to others. May our remembrance lead to a renewed desire for unity and peace.
28,The US now slightly exceeds Sweden in per capita deaths from COVID. The difference — govt dictates destroyed the US economy with lockdown. Sweden did not suffer the economic depression from lockdown. Will nanny staters learn from their terrible mistake? https://t.co/qaLw6s7Mtc
29,Restaurants may survive fear of COVID but will they survive fear of mob violence? https://t.co/YdTalPgQud
30,"Matt is right. This is important. @Snowden exposed illegal and unconstitutional actions by the Deep State, including Clapper and others who went after @realDonaldTrump and lied about it. https://t.co/Qb95PWypxm"
31,CDC does not have the authority to do this. It’s dangerous precedent and bad policy. https://t.co/Gcz0ZmUtZh
32,"One of the brave DC cops who likely saved Kelley and me was assaulted by one of the violent mob. The attacker was arrested and charged with assault, then released. (If you’re looking for him, maybe try Kenosha)

Florida Man Charged with attacking officer https://t.co/bssZDdNOnu"
33,”We regard those who do not see the world in the same way as our enemies. This allows us to dehumanize each other.” https://t.co/XUR6LoXTmz
34,"In this video, @SteveScalise , who was almost killed by a violent left-wing shooter, shows what we are up against now.  Enough violence.  Enough mob rule. https://t.co/EGnhNx5ONQ"
35,RT @KelleyAshbyPaul: Thanks to all who have  expressed their concern to me and @RandPaul.  I wrote this account of our experience.  https:/…
36,Those of you who want to stand up and fight the socialists poisoning our schools and burning our cities — join me in supporting President Trump.
37,"So to our soldiers and their families – join me in supporting President Trump. 

Those of you who want lower taxes and better, less expensive healthcare, join me in supporting President Trump."
38,"I'm proud to see a President who agrees with that finally. 

 Compare President Trump with the disastrous record of Hillary Clinton or Joe Biden, who consistently called for more war."
39,I flew with him to Dover Air Force Base to honor two soldiers whose remains were coming home from Afghanistan. I will never forget that night. I can tell you the President not only felt the pain of these families but is committed to ending this war.
40,"I brought President Trump an idea for better, cheaper health insurance called Association Health Plans. Donald Trump overturned years of red tape and bureaucrats and made it happen."
41,"Cities are burning. The economy is in shambles due to lockdowns. Kids can’t go to school because of petty tyrants not following science. But don’t worry! Joe Biden is running to sue nuns who take care of the poor. 
https://t.co/M63IHDs1ja"
42,"This is why I've introduced the Tax Relief for Families Suffering from Government-Mandated Shutdowns Act to help put Americans during this pandemic. You can learn more here: https://t.co/v2PGIXUk5S 

https://t.co/sUi6NqLfJ0"
43,"When Americans look at Congress, they all too often have to think of what it takes from them for too little results. Let's pass this bill to help put Americans on the strongest financial footing during this pandemic. Learn more here: https://t.co/vyoF5CvJhZ https://t.co/JVMZWV9cSg"
44,pls do NOT read this article! Twitter must ban it! This does not conform with the accepted lockdown hypothesis! Warning this article may contain inconvenient truth about immunity to COVID-19.  40% of ppl w/ COVID-19 have no symptoms. Might they be the key? https://t.co/EP4AU8FocA
45,"An inconvenient truth: every city that is on fire has been run by a Democrat’s for decades. An idea to spray paint on the sidewalk of Chicago: Vote out the Democrats who are letting your cities burn!
https://t.co/6O5Z9uvbLQ"
46,"RT @brad_polumbo: New @RandPaul Plan Would Empower Struggling Families Amid COVID-19 School Closures

New from me via @feeonline:

https://…"
47,"Author argues that course of this viral pandemic is independent of man’s attempts to control it (short of a vaccine). Worth a read. 

https://t.co/5kxvvhOTqO"
48,"Note to neocons (you know who you are) “Many still to this day will not admit that the devastation witnessed in Venezuela is a problem inherent to Socialism. They claim that Venezuela is not a model of “true socialism”, but of autocracy...”

https://t.co/M5gcdK9gns"
49,"Had a great time with @mkibbe discussing police reform, bailouts, and COVID! https://t.co/3sZJPGruYq"
50,Before congratulating Comrade Cuomo read this article which details how NY government red tape and cronyism prevented newly created hospitals from taking care of patients. https://t.co/S7Q56ohBNB
51,"As Americans’ health care costs continue to rise, my plan puts more power in the people’s hands, getting rid of unnecessary restrictions, expanding access, and trusting Americans to make the decisions that are best for their families... https://t.co/uGtOLQmSKy"
52,FL and NY have an identical number of per capita coronavirus infections but FL has 5X less per capita deaths. Will Dr. Fauci be praising @GovRonDeSantis’ response to the pandemic?  Will he point out that @NYGovCuomo’s response allowed a fivefold greater per capita death rate?
53,"As Americans’ health care costs continue to rise, my plan puts more power in the people’s hands, getting rid of unnecessary restrictions, expanding access, and trusting Americans to make the decisions that are best for their families... https://t.co/3UmJkp3bbE"
54,"Borrowing $5 trillion might temporarily mask the pain of the government shutdown of the economy, but at what cost?  The destruction of the currency?
https://t.co/WsHSWAM0RG"
55,RT @gatewaypundit: 'WE'VE CRIPPLED THE ECONOMY': Rand Paul Says Lockdowns Were A ‘Big Mistake' https://t.co/5BMT9xf1dA via @gatewaypundit…
56,ICYMI today I joined @AmericaNewsroom to talk about the COVID response. Cuomo's response is NOT to be emulated. https://t.co/hSuoztgQSb
57,"Sending federal troops to try to quell violence in our cities, allows the Democrats who are allowing this mayhem to shift the blame game to the President."
58,"The frightening details of the Homeland Security bill, which authorizes an unprecedented level of warrant less spying on American citizens, are still emerging. Those who still care about the Bill of Rights, particularly the 4th amendment, have every reason to be alarmed."""
59,"RT @foxnewsradio: Senator @RandPaul is calling out Republicans on their big spending plan for coronavirus relief. 

Listen to his full inte…"
60,"Just came from Progressive Democrat, whoops, I’m mean Republican caucus:  
They’re going to spend $105b more on education, more than we spend every year on the Dept of Education. Anyone remember when Reagan conservatives were for eliminating the Federal Dept. of Education?"
61,"Statistician Nic Lewis makes the compelling case that incorporating real life, non-random behavior into Herd Immunity Models predicts community immunity can block COVID 19 at much lower rates than predicted...

https://t.co/ovQvYaxedi"
62,The federal gov has made it far too easy for gov agencies to profit from the property of those who have not been convicted of a crime. The FAIR Act will uphold the 5th amendment &amp; ensure gov agencies no longer profit from taking property w/out due process. https://t.co/QBedMT63vR
63,"Hey Andrew, that mountain in your poster represents 30,000 dead people, including over 10K dead as a result of your decision to send COVID + patients back to nursing homes - hardly seems worthy of a celebration. https://t.co/VyIEqXemQh"
64,Congress could make significant progress by repealing conspiracy laws that result in easier convictions and cruel prison sentences that either do not fit the crime or apply when no crime has been committed at all.  https://t.co/aCrZMKe2rP
65,"Whether our eyes are focused on returning kids to school or stimulating renewed economic growth, such humility will be essential. If we hope to weather this storm and preserve public health, we need more diversity in approach and action, not less. https://t.co/MsPyo2frjC"
66,"It has been almost 20 years since our country went to war in Afghanistan. After 9/11, the American population rightfully demanded our forces take action against those who attacked us. Had I been in Congress I would have voted for that action. https://t.co/TvUXWJtStX"
67,“Paul’s proposal also would have rescinded the 18-year old Authorization for Use of Military Force whose statutory interpretation has stretched to such farcical heights that virtually any kinetic action against a terrorist group is considered covered...” https://t.co/Q92NHgEaLh
68,Today I introduced a bipartisan amendment to the NDAA to end America’s longest war and provide bonuses to those who've deployed. Unfortunately a bipartisan majority eventually voted 60-33 to kill it. Thank you to those who support ending this war. https://t.co/03rsByZqOr https://t.co/J9gmq2evy8
69,"The senate is about to vote on my bill to end the Afghan War and pass bonuses for those who served. I’ll be speaking soon. The vote will be at 5:30. Watch here: https://t.co/9GEF7frVHp A lot of folks say it’s long past time to end this war, now is their chance to vote that way."
70,".@KatrinaJack_Sen is a pro-life democrat who authored the Louisiana legislation that passed by a supermajority in both chambers and was just overruled by SCOTUS. We have to keep fighting! @KentuckyRTL is commemorating 50 years in that fight July 16th. 

https://t.co/TTb5MsUBRe"
71,"The Fatal Conceit is believing that any group of experts can acquire knowledge that equates with the dispersed knowledge of millions of individual interactions in an economy or in public health.
https://t.co/DsGylYIuIN"
72,"A must read — finally an ‘expert’ with a healthy dose of common sense willing to publicly say that children rarely transmit COVID 19 to adults and that kids should go back to school.

https://t.co/Op9PfEpYPy"
73,"RT @nypost: Rand Paul rips Fauci's coronavirus response, says schools should be reopened https://t.co/FGq4B5q2rd https://t.co/H6AMZrYtYP"
74,Today in the HELP hearing on COVID-19 with Dr. Fauci I forced him to admit that we MUST get kids back to school. https://t.co/gDFWRjKz2y
75,The federal government has made it far too easy for government agencies to take and profit from the property of those who have not been convicted of a crime. https://t.co/yImxpkfbDV
76,I liked your dad’s original mask better! https://t.co/fPLMc4Vwce https://t.co/tZ0b0F90Rq
77,Current version of anti-lynching bill could allow vandals who defaced church near WH to be arrested for ‘lynching.’  Graffiti on a church is/should be a crime - it is not lynching &amp; doesn’t merit ten years in jail. cc: @kamalaharris @corybooker https://t.co/cD08f89Zhq
78,RT @KelleyAshbyPaul: Sick of @jack and his cultural revolution censorship.  Support free market competition! Follow me and @RandPaul on @pa…
79,"One lesson from the COVID 19 pandemic, the FDA needs to allow more freedom to diagnostic labs to develop testing

Congress should rein in the FDA | TheHill https://t.co/iBL80Xi2Nc"
80,"I know good news doesn’t sell and will never make the evening news, but good news: coronavirus deaths continue to fall.  

Daily COVID-19 Deaths in the U.S. Have Fallen Dramatically Since April – https://t.co/1OcLJizCrt https://t.co/GTb5a02Feu"
81,RT @KelleyAshbyPaul: Wonderful news!   @RandPaul and I are so happy to hear that Dr. Shadowen is recovering from Covid19.  https://t.co/tT8…
82,"“... science does tell us that risks from COVID-19 are too minimal to sacrifice the educational, social, emotional and physical well-being – to say nothing of the very health – of our young people.” https://t.co/l1xQUI9wN2"
83,"RT @dcexaminer: .@RandPaul: Veto fake reform of the Patriot Act, after all ""those who trade their liberty for security may well wind up wit…"
84,Even the most ardent supporters of the heavy regulatory burdens imposed by Washington bureaucrats have come to realize that over-regulation hindered our country’s response to the pandemic. Read more: https://t.co/9NFNk3HnxU
85,"Today, give credit where credit is due. Trump, the disrupter, is right to bring the troops home. And I say don’t stop until we once again have a military whose primary job is to defend America. https://t.co/E97ug31b7S"
86,.@GovAndyBeshear — look at the hundreds of thousands of Kentuckians who’ve lost their jobs because of your economic dictates. You’re killing the patient!  Kentucky deserves better. https://t.co/4CoMXvAyZW
87,"Interesting article that suggests a way to discover, in advance, who already has antibodies or T cells responsive to antigens common to all coronoviruses.  Having had a coronovirus cold variant in may explain why some people’s immune systems respond better https://t.co/Q1fQBxvXbe"
88,There is a sickness among us that crosses racial boundaries and threatens to consume us.
89,"Before you say whose this white guy coming to my neighborhood talking about crime let me say it happens in my neighborhood too.

A while back a white woman in my town stole a woman's baby by cutting the baby out of her mother and leaving the mother to bleed to death."
90,"But when I hear people say black lives matter, I also think of Jacele Johnson who is four years old who was shot in the head on the south side of Chicago."
91,"When I hear people say black lives matter, I think of Freddie Gray whose neck was broken and died in government custody."
92,"When I hear people say black lives matter, I think of Eric Garner who was choked to death for selling untaxed cigarettes."
93,"Good News!  People who catch coronovirus but have no symptoms rarely spread the disease.  Translation:  sending kids back to school does not require millions of test kits. 

Asymptomatic spread of coronavirus is 'very rare,' WHO says https://t.co/reIyrFb0Au"
94,"RT @kelseyc00per: Among Republicans, there is probably no one who has been more concerned about the over-incarceration of young black men t…"
95,"Hey @CoryBooker and @KamalaHarris lynching is already illegal but slapping someone is not lynching, We shouldn't conflate someone who has an altercation with minor injuries, with lynching, That's my opposition to this without my amendment to fix it. https://t.co/vmyuk55Dcc"
96,On #MemorialDay we honor the brave men and women who made the ultimate sacrifice for our country. Always remember the cost of war and cherish their lives.
97,"“Below 25 years old the fatality rate of COVID-19 is 0.00008%, or roughly one in 1.25 million . . .”  Open our schools now!
https://t.co/Md3zGjDmVV"
98,Unmasking essentially is an end-run around the Constitution. The lesson that we should all be taking away from this is not “My political opponents should not be able to spy on me without a warrant.” The lesson should be “NO ONE should be allowed to spy without a warrant.” https://t.co/ZfV4sZpsZn
99,"Lives that will be lost to the government-mandated economic shutdown need to be acknowledged by Governor Beshear and other politicians still insisting on a lockdown.  

Cancer screenings dramatically declined due to COVID-19 - Washington Times https://t.co/3LLHo6UEmf"
100,"Paging Dr. Fauci:  scientific evidence shows mortality rate for coronavirus approximates the annual flu for people under 60
#freeourpeople #openeconomynow

Horowitz: One chart exposes the lie behind universal lockdowns - Conservative Review https://t.co/1FrFWiVBPA"
101,"Let’s get the federal government out of the way and allow our farmers to safely deliver wholesome, local farm-to-consumer meats.  Congress needs to get back to work and pass the PRIME Act. https://t.co/0rRBHFt0g0"
102,The spies who run these surveillance programs then lied to us about their extent. One of the most notorious of these liars is James Clapper. When cross-examined by Senator Wyden under oath James Clapper denied that the gov't was collecting personal data on millions of Americans.
103,RT @AVoiceNews: War Room: Pandemic EP 175 https://t.co/uMNrzKgaBp
104,"RT @SergioGor: On point @RandPaul: “I fear some people who don’t want to investigate Obama are the same people, @LindseyGrahamSC, who don’t…"
105,Just spoke with @foxandfriends about Biden’s involvement in unmasking! Unmasking for political purposes is unlawful and needs to be investigated! ⁦@realDonaldTrump⁩ ⁦@LindseyGrahamSC⁩ ⁦@RonJohnsonWI⁩ ⁦@ChuckGrassley⁩  https://t.co/hxiYg1uKpf
106,"Declassified documents reveal V.P. Biden ordered the unmasking of General Flynn’s private conversation.
Anyone think that Biden might have abused his power to go after a political opponent..."
107,Yesterday I wrote to DNI @RichardGrenell requesting the names of those who were involved in Gen Flynn’s unmasking. Today I received the shocking reply that @JoeBiden and many others knew! What did President Obama know? I am inviting DNI Grenell to testify next week in the Senate https://t.co/IHpGjeVWwM
108,"During today’s U.S. Senate Health, Education, Labor and Pensions Committee hearing I reiterated my call for power to be disbursed as much as possible among states instead of instituting a “one-size-fits-all,” national plan on reopening America: https://t.co/0vjlYb1nqz"
109,"Only the government could cause 1 million unemployed health care workers during a pandemic. 

Hospitals Lose Money During Pandemic; Healthcare Workers Face Layoffs, Cut Hours : NPR https://t.co/OzIKGBjs2S"
110,"6th Circuit unanimously rules DWP (drunk-with-power) Beshear ban on church services unconstitutional!

Kentucky coronavirus: Judge rules churches can hold in-person services https://t.co/WBpCFV73hW"
111,"I agree with Jared, time to safely reopen and start rebuilding the economy! America is resilient, let’s make it great agin! 🇺🇸 Kushner sees a comeback from coronavirus lockdown crisis | Fox Business https://t.co/lKirjAKg3p"
112,Coronavirus elective surgery bans are too sweeping. Let doctors decide. https://t.co/cfUS9CnfQd
113,"RT @KelleyAshbyPaul: In Covid1984, you get free drugs and booze delivered to your hotel to keep you in, but get jailed for working! https:/…"
114,"On Hayek’s birthday, today’s government planners &amp; pandemic modelers might do well to remember Hayek’s admonition: It is a “pretense of knowledge"" to believe that any AI model or group of busybodies knows enough to engineer our economy, particularly during a crisis. https://t.co/YJANSPOBIf"
115,Economic damage of shutdowns far outweighs COVID-19 health concerns in flyover country https://t.co/sM8nPbn5lc via @washtimes
116,"My office has been in touch with prison officials and public health officials in Lexington and across the state this week, connecting them for information and resources. We must work together to stop the spread through our prisons. https://t.co/r7RcDhTQMR"
117,Hospitals and doctors need to be allowed to open fully and practice. Our economy needs to open.  We are in danger of losing health care system capacity due to government rules.  A good rundown by a leading voice running a large hospital system.   https://t.co/nptj2pgg8r
118,"To those who want to continue this lockdown, even Dr. Fauci agrees if you’ve recovered you will have immunity!"
119,Fauci said he's 'willing to bet anything' that people who recover from the new coronavirus are 'really protected from reinfection' https://t.co/JJt11Lr95R
120,"Remember what CS Lewis said: “those who torment us for our own good will torment us without end, for they do so with the approval of their  own conscience."""
121,"To the approximately 2 million New Yorkers and others who got coronavirus and survived, don’t let these busybodies tell you that you don’t have immunity. They want you to be lemmings and do as THEY see fit. RESIST!"
122,"“To be clear, most experts do think an initial infection from the coronavirus, called SARS-CoV-2, will grant people immunity to the virus for some amount of time. That is the case with acute infections from other viruses, including other coronaviruses.”
(https://t.co/aQzLGVrjXE)"
