,Tweet
123,"Dr. Fauci: “We know with infections like this, that at least for a reasonable period, you're gonna have antibodies that are protective...if we get infected in February/March and recover, next September, October, that person who's infected — I believe — is going to be protected."""
124,Modern medicine shows us that immunity is based on having antibodies. Why do they think medicine is trying so hard to get a coronavirus vaccine? Immunity. I have taken an antibody test and am positive for long term Covid-19 antibodies.
125,The fake news can’t stand that some people might not need to submit to the new authoritarianism of the left because they are immune to coronavirus. Modern science disagrees.
126,"America’s war in Somalia makes us weaker not stronger.  Time to come home.

U.S. Airstrikes Hit All-Time High as Coronavirus Spreads in Somalia https://t.co/4GytSiT84K"
127,"RT @Comm4Prosperity: ***REPORT: Arthur Laffer and Steve Moore on how states will recover from the coronavirus.***
https://t.co/nhIFk7tuFK"
128,"Beware the self-righteous and the growing pandemic of busybody/wannabe authoritarians.

A Kentucky Family of 7 Didn’t Practice Social Distancing. Now Child Services Is Investigating the Parents for Abuse. – https://t.co/1OcLJizCrt https://t.co/j3XYBQZ4Gj"
129,RT @jackhunter74: .⁦@RandPaul⁩: “The virus is still dangerous...we shouldn't ignore the risks... (but) no amount of bailout dollars will st…
130,"Usually in a totalitarian state they first shut down dissent, then they shut down religion. Gov. Beshear did it backwards, but still the same result.  

Kentuckians plan COVID-19 restrictions protest at the Capitol https://t.co/juAF3DvlLn"
131,ICYMI I joined @OANN to discuss volunteering during the COVID-19 pandemic. https://t.co/yoP6tgE9Ch
132,"The constitution doesn’t allow the federal gov’t to become the ultimate regulator of our lives because they wave a doctor’s note. Powers not delegated are RESERVED to states &amp; the PEOPLE. If we dispense with constitutional restraints, we will have more to worry about than a virus"
133,"The impulse to authoritarianism is strong — #resisttyranny 

The Coronavirus Is Exposing Little Tyrants All Over The Country https://t.co/AKVXHtD3fr"
134,"ICYMI today I joined @foxnews to discuss the coronavirus recovery. As we have united when tested in the past, Americans are working together to fight coronavirus. https://t.co/t4O9Svl85g"
135,Thrilled to hear that @BorisJohnson has gotten out from hospital. Wishing him a continued speedy recovery! Get well soon. 🇺🇸 🇬🇧
136,"Thank God for a judge who understands the First Amendment prevents the government from prohibiting the free government exercise of religion. 

COVID-19 in Kentucky: Judge grants church's request to hold services https://t.co/FMPfOe9GB0"
137,"RT @FreedomWorks: 👉 NEW @RandPaul: As we have united when tested in the past, Americans are working together to fight #coronavirus! 🇺🇸 #amp…"
138,"Though the task before us still seems daunting, and the virus’ effects break our hearts, may we be encouraged by how Americans are looking out for one another and pulling together to face this latest challenge. In this dark time, light still shines. https://t.co/fCit1o6NI8"
139,"RT @CBNNews: Sen. @RandPaul Recovers from Coronavirus, Now Volunteering at Hospital https://t.co/HfKL8QP1mT"
140,RT @KYGOP: Congratulations Dr. @RandPaul! We’re happy that you’re health has returned and are proud that you’ve returned as a volunteer at…
141,"“The Kentucky Republican, who was placed into quarantine after testing positive for the virus on March 22, said he is rested and ready to offer his services as a healthcare worker in his hometown of Bowling Green during the crisis.” Read more here: https://t.co/ekjp0CNI3G https://t.co/Iosd3Ea9rM"
142,"I appreciate all the best wishes I have received. I have been retested and I am negative. I have started volunteering at a local hospital to assist those in my community who are in need of medical help, including Coronavirus patients. Together we will overcome this! https://t.co/9SeypT7rL6"
143,"""Former Kentucky basketball star Rex Chapman announced Monday the first recipients of grants from his COVID-19 Relief Fund."" https://t.co/sfDAc6nP9f"
144,"Rest In Peace Tom. Kelley and I are praying for the entire family. A Republican, who believed that deficits, do indeed matter.  https://t.co/hxYz8XvNnc"
145,Our office is ready to provide assistance to all Kentuckians in need of help navigating the federal response and ongoing community needs related to COVID-19. View our full coronavirus resource guide here: https://t.co/YOMGMYR9oq
146,Senator Rand Paul has tested positive for COVID-19. He is feeling fine and is in quarantine. He is asymptomatic and was tested out of an abundance of caution due to his extensive travel and events. He was not aware of any direct contact with any infected person.
147,"We absolutely must, must, resist government run amok taking advantage of a crisis.  This is how your liberty dies. Stand up America and resist. 

DOJ seeks new emergency powers amid coronavirus pandemic - POLITICO https://t.co/kN6twMTR4f"
148,My prescription for combating the coronavirus crisis. https://t.co/V5MHbuvdlJ
149,"RT @RandPaul: For everyone who's looking for Coronavirus resources:
· Coronavirus Guidelines for America: https://t.co/2ttY7E0opK
· The fed…"
150,"American ingenuity steps up to fight Coronavirus:

Novartis, Mylan and Teva to supply tens of millions of chloroquine tablets to fight COVID-19 | FiercePharma https://t.co/1VK8j40akd"
151,"For everyone who's looking for Coronavirus resources:
· Coronavirus Guidelines for America: https://t.co/2ttY7E0opK
· The federal government’s Coronavirus response and resource page: https://t.co/TSSi552TEH
· KY’s Coronavirus response and resource page: https://t.co/G6I0wIxv1g"
152,"Thanks to ⁦@realDonaldTrump⁩ Administration for cutting red tape and quickly making this potential treatment available. 

What to know about potential coronavirus treatment | Fox News https://t.co/MdsqzoShCL"
153,"We should work together on these and other similar plans to slash regulations, return money to those who need it, help those who are struggling, and win both the battle against this pandemic, and also the battle to save our economy. https://t.co/7uKRLh5rOM"
154,RT @CDCgov: Older adults &amp; persons with severe chronic conditions: Talk to your doctor about getting extra necessary medications or conside…
155,"As a physician, I understand the need for an “all hands on deck” response from our medical community to the Novel Coronavirus pandemic. That means speedy access to diagnostic testing and medical supplies, and, most importantly, it means preparedness... https://t.co/n60aIzelfv"
156,"We must win the battle against virus, but also save our economy | Editorials | https://t.co/5mI9ByZaB2 https://t.co/7uKRLh5rOM"
157,"Government rules stopping anyone or anything from helping must be repealed now. 

Small Regulatory Reforms That Can Help People During the Pandemic | R Street https://t.co/Vk1fxPbSdR"
158,50 Ways Companies Are Giving Back During The Coronavirus Pandemic https://t.co/MB7d6hSbEC
159,"I do worry though that as we go further into debt we may reach a point where our debt is so large we are unable to manage the next pandemic.
 
We should never forget fiscal responsibility, even in a crisis."
160,"In addition, I have introduced legislation to allow our University Labs and Advanced Private Labs to be able to develop additional testing for coronavirus and possible cures by removing the red tape at the FDA."
161,The public should know that Congress has already enacted reforms that will free up millions of industrial masks to be used by our doctors and nurses.
162,"We will survive this pandemic.  What government does to mitigate the calamity should be short-lived, temporary, and cause as little distortion to our free market economy as possible."
163,"To my fellow Americans, remain hopeful.  Remain kind. Remain faithful and above all remain resilient.
 
In the World’s history, pandemics are the norm not the exception.  It is only recently, in the modern era of antibiotics and vaccines, that pandemics have become less frequent."
164,"I will speak on the Senate floor shortly and I will call on my colleagues to prioritize spending. We SHOULD be focused on the Coronavirus response, but, at the same time, we can’t be funding endless wars in the Middle East or paying for frivolous programs overseas."
165,"When we face a health emergency, government should trust academic, community, and public health labs to do what they are already trained and certified to do...https://t.co/O2XwNQmpH9"
166,"Today I’m calling on the IRS to move our tax filing deadline from April 15 to July 15, and to waive any interest and fees for late payment. This will allow those who owe money not to have to send it during our current situation."
167,"Good news: FDA approves Roche coronavirus test that is 10 times faster than current test. 

We should push hard for further and continued removal of government barriers while fighting this crisis.  https://t.co/X3otO3BKIF"
168,We can and should practice social distancing and use prudence. Follow the guidelines health officials are recommending. We can help stop the spread of our current virus foe if we work together. But let us not surrender to fear or forget our ability to conquer foes like this.
169,The Health Care Workforce Protection Act of 2020 makes a small but common-sense and critical change to existing law to protect more Americans and aid our medical professionals in fighting the coronavirus. https://t.co/g7qauSGWvD
170,"Proud cosponsor of the Health Care Workforce Protection Act, which would help maximize this order's impact and get more masks to our medical professionals fighting the coronavirus.

https://t.co/U31cHsl1wo"
171,"The Health Care Workforce Protection Act makes a small but common-sense and critical change to existing law. As a physician, I am proud to support legislation that encourages an increased supply of respirators to protect more Americans...read more here: https://t.co/4j2ZyOJ9gG"
172,"RT @dcexaminer: ""I think really we ought to concentrate on our country, instead of borrowing more money from China. 

The virus came from t…"
173,RT @WDRBNews: .@RandPaul said $8 billion in emergency funds for the coronavirus should be coming from foreign aid: https://t.co/3TPqaxb14w…
174,When I asked James comey after the Pulse mass shooting if in retrospect the FBI concluded too soon that Mateen was not a threat. The arrogant Comey refused to admit any mistake &amp; maintained the opinion that Mateen was not a threat. Comey: tell that to the 49 people who died. https://t.co/JSyduiUTjm
175,Earlier today I said that while I support an all-hands-on-deck response to the coronavirus we should cut out waste and take money from less urgent spending like what we waste overseas to put into that response effort. We have to start setting our own priorities. https://t.co/6YuUwqK4Qg
176,I'm headed to speak on the floor about my amendment to the nearly $8 billion coronavirus supplemental that would pay for the legislation. My amendment responsibly uses taxpayer resources by reducing waste to pay for this new spending. Watch here: https://t.co/9GEF7frVHp
177,I support our gov’s efforts to fight the coronavirus. We also owe it to the American ppl to do it in a way that avoids piling billions more in debt on their backs. My amendment responsibly uses taxpayer resources by reducing waste to pay for this spending. https://t.co/bzqrxMRG7E
178,"RT @sgurman: The meeting is set to include, among others, @RandPaul  and @SenMikeLee, who are privacy hawks, and William Barr, who opposes…"
179,RT @jackhunter74: .@RandPaul: “When we went to war in 2001...it said we're going after those who attacked us on 9/11...Now we go anywhere i…
180,Looking forward to working with @RichardGrenell! He’ll do a great job as DNI. @realDonaldTrump should appoint those who agree with his policies including less government. Ric will deliver!
181,"RT @KelleyAshbyPaul: As someone who worked as a freelance writer while raising my kids, I see how this law kills flexible, well-paying work…"
182,My question today is about whether or not individuals who were holdovers from the Obama National Security Council and Democrat partisans conspired with Schiff staffers to plot impeaching the President before there were formal House impeachment proceedings.
183,I’ve fought to stop gov overreach of regulating every puddle and ditch in America and just like my Defense of Environment and Property Act this rule implements reforms to get the gov off the backs of our farmers and everyone else who owns land. Read more: https://t.co/Si1o7BZkTw
184,"With so many billionaires about, why not a private prize of $10 million for the scientist who genetically creates an O2 producing organism that will thrive in the frigid, methane lakes of Titan?"
185,"RT @thehill: ""As much as anybody will be pretending to be judicious about this, I don’t think that there’s one senator who hasn’t decided h…"
186,"Paul says if four or more of his GOP colleagues join with Democrats to entertain new witness testimony, he’ll make the Sen vote on subpoenaing the president’s preferred witnesses, including Hunter Biden &amp; the whistleblower who revealed the Ukraine scandal! https://t.co/3OjFTSWz1x"
187,Michael Beschloss’ Presidents of War paints a vivid picture of a feckless LBJ who knows Vietnam is unwinnable but keeps sending thousands of troops to their deaths because he fears “appearing weak.”  A must read for the neocon warmonger swamp. https://t.co/RSEDSBvT3p
188,"""Both parties are at fault here,"" concluded Paul. ""It isn't just Republicans. President Obama usurped the war powers. Bush did it. Truman, LBJ, you name it. It's hard to find a president who hasn't done it, but Congress has abdicated that role."" https://t.co/R61xijl40X"
189,"Today on #NationalLawEnforcementAppreciationDay  I’d like to thank the brave men and women in Kentucky’s police force and the officers who serve across the country, for their dedication and the bravery they exhibit everyday."
190,RT @dcexaminer: Many of the same Senate Democrats who voted to pass NDAA last summer are blasting @realDonaldTrump’s airstrike right now.…
191,"President Trump viscerally understands that the toppling of Saddam Hussein made Iran stronger. Soleimani, like Hussein, was an evil man who ordered the killing of Americans. Yet, the question remains, whether his death will lead to more instability in the Middle East or less."
192,RT @JackPosobiec: Who is going to give money to this turncoat’s Bombs-Away PAC? Weird how not much of that money actually ends up with cand…
193,"Back to POTUS for a minute. I get teary eyed on Festivus when I think that it was created by Frank Costanza, and that Trump is President. It just shows you that a loud mouth from Queens who airs his grievances constantly can do or be ANYTHING in this world! You can do it too kids"
194,"We will be back later to talk about golfing with the President, some of my congressional friends, and don’t miss our FEATS of strength later where Chuck Schumer and Mitch McConnell will arm wrestle to see who gets witnesses at the impeachment trial!"
195,I’m kidding if course. Kim Jung Un is in great health. In fact his doctor put out a letter saying he was the healthiest dictator ever to kill his uncle and half brother.
196,At least Joe is younger and more with it than Bernie Sanders. Bernie looks like the guy who chose the wrong cup in Indiana Jones. https://t.co/6hgvkQaWPT
197,Joe Biden is doing well. I feel like if the Democrats nominate him we are all going to discuss whether or not we should hand over the nuclear codes to someone who hasn’t been able to find his keys for a while now.
198,"It’s his second best hire behind that guy...what's his name, the guy who kept trying to start all the wars but then got fired on twitter."
199,"You do have to wonder how he was the best the President could think of for a lawyer - “hey, get me that guy who spills his guts on CNN and butt dials everyone in Washington. He can keep a secret!”"
200,"We have seen sham hearings, selected witnesses, and Dems who have contorted the facts to fit a fictional narrative. Shameful that from the first day of this duly elected presidency, Dems have wanted to impeach @POTUS. Unnecessary &amp; counterproductive. Senate will end this charade!"
201,"I have great respect and honor for those in uniform who serve.  In fact, I recently introduced a bill to give each soldier who served in the War on Terror a $2500 bonus and at the same time officially end the Afghan War.  Ending the Afghan War would save us about $50 billion/yr."
202,"RT @STEPHMHAMILL: “@Comey will go down in history, one, as being a sanctimonious partisan, but two, as being the guy who really did more to…"
203,"So in remembrance of the 11th hour of the 11th day of the 11th month when the guns fell silent and of all those who served our nation on land,  sea, in the skies, or the outer reaches of space, let us as a country thank them all by giving their sacrifice meaning."
204,"Today is #VeteransDay, the day where our Nation honors the women and men who have stepped forward and answered when our nation has called."
205,"If you want to stop the endless wars, you actually have to leave. The U.S. guarding oil in Syria will only prolong the war &amp; bring Kurds into conflict with Assad.  Mr. President: don't listen to Lindsey Graham and Chuck Schumer and others who’ve been wrong for so long."
206,We don’t let kids drink alcohol til 21. People want to move smoking age to 21. But we will allow a 7 year old to have his life and body altered like this? This is child abuse and the state should side with the father who is trying to protect the child.”    https://t.co/fNXF50qQEY
207,This was one of ⁦@realDonaldTrump’s best foreign policy speeches! America is grateful for a president who puts America First!⁩ Remarks by President Trump on the Situation in Northern Syria | The White House https://t.co/35ce4zmLjH
208,Good article - including highlighting Association Health Plans and Opportunity zones that I’ve championed for years. ⁦@davidwebbshow⁩ : My tribe is American | TheHill https://t.co/ju59lnn7s9
209,"Looking forward to joining @TuckerCarlson on @FoxNews tonight at 8pm ET. We’ll discuss why the Senate needs to step up and do more against the deep state, big government and those who dwell in murky swamp waters! Tune in"
210,The left blames incivility on @realDonaldTrump. Watch this video and decide who the rude ones are... https://t.co/qtEx0wLH2A
211,Who wants to keep us in endless wars? Why are liberals being hypocrites? Why are republicans against the president? Tune in to @FoxNews as I join @IngrahamAngle right now!
212,The Cheney/Graham neocon War Caucus wants to come back to DC and declare a war. My question for them is - who will you declare it on?
213,RT @SergioGor: It’s expected that some in the GOP who took us into these endless quagmires in the Middle East are unhappy about ending wars…
