,Tweet
103,"This is a great move by Dakota County to help protect folks in our long-term care facilities. I’m glad that funds I voted for in the CARES Act will help support testing here in our community. 
https://t.co/XSK91OZErE"
104,Thank you to the #MN02 Chambers of Commerce for joining me for a conversation about how we work together to rebuild our economy post-COVID-19. I’ll keep fighting for an economy that works for Minnesota’s working and middle-class families. https://t.co/LUeEdAho80
105,"As COVID-19 cases rise across the US, please take precautions to keep your friends and family safe this weekend. 
☀️  spend time outside
😷  wear a mask 
👋  say hi to loved ones virtually 
↔️  physically distance. https://t.co/d7QDQAkbeH"
106,"Yesterday, I checked in with Open Door Health Center in Jordan, MN. I’m committed to ensuring they have stable long-term funding for the vital services they provide to folks in our community."
107,Today is a great day to wear a mask. #SaveLives https://t.co/8FKxj67CM6
108,"This is a terrible move by some airlines. We are in the middle of a global pandemic with rising numbers across the nation.   
https://t.co/5qex81nHKF"
109,I’m joining @RepCindyAxne to push for support for fire departments and Emergency Medical Service agencies on the front lines of the COVID-19 pandemic. These first-responders provide lifesaving treatment to those in crisis and must receive adequate reimbursements from @CMSGov. https://t.co/YRIvk9gUHO
110,This landmark legislation will help make sure everyone in #MN02 has access to affordable health care and prescription drugs.
111,"Today, I voted for my Patient Protection and Affordable Care Enhancement Act which includes my bipartisan bill to lower health insurance premiums for folks in the individual marketplace. https://t.co/RmX7SjLReQ"
112,"I've introduced legislation to allow small business owners to obtain a second, forgivable PPP loan if their revenue declined at least 50% due to COVID-19. Congress needs to step up and pass this bill to meet the needs of small businesses in our community. https://t.co/wr297BgY1j"
113,"It’s clear that if health care isn’t affordable it isn’t accessible. That’s why I authored the State Health Care Premium Reduction Act. Today, the House will vote on my legislation in the Patient Protection and Affordable Care Enhancement Act."
114,"The #1 issue I talk about with hardworking families across #MN02 is the skyrocketing cost of health care. Right now, too many families are paying too much for their health insurance or have been priced out of the market. https://t.co/RNFEvNVSac"
115,I’ve been working to make sure the Paycheck Protection Program has the funds needed to help our small businesses through the COVID-19 pandemic. The deadline to apply for PPP loans through @SBAgov is June 30th. Learn more here: https://t.co/e9ntxKPqKt
116,"RT @CityOfLakeville: MasksRcool. No matter how you rock it, thank you. Your mask helps me. My mask helps you. Wash yer paws. We can do this…"
117,"I applaud @GovTimWalz in his work to help our #MN02 local governments deal with the effects of COVID-19. We now need the U.S. Senate to step up and provide additional support to our cities, towns and counties that are stretched too thin. https://t.co/IempjkuHIE"
118,I grew up for a portion of my childhood without health insurance. I came to Congress to make sure that folks in #MN02 have access to affordable health care and prescription drugs. The Patient Protection and Affordable Care Enhancement Act does just that. https://t.co/imsMN9PuNW
119,"I also joined @ProtectOurCare, @MattKleinSD52 and Leah Midgarten from Cannon Falls to talk about my work to reduce the cost of health care and prescription drugs and the importance of health care access in #MN02. https://t.co/K3U1purAKr"
120,ATTENTION #MN02 SMALL BUSINESSES: @mndeed will be awarding grants to Minnesotan-owned and operated businesses that can demonstrate financial hardship as a result of the COVID-19 outbreak. Learn more about eligibility and how to apply here: https://t.co/GbmPNvVhQc
121,"Thank you to Lisa Brodsky, Jessica Davis and everyone who tuned in for our virtual town hall this evening! If you missed it, you can watch the full video here: https://t.co/dylfwOXlh9."
122,#IRS changes to health care spending rules may help some that are using at-home services during the COVID-19 pandemic. Learn more at https://t.co/ZHgSAiFtnw. #COVIDreliefIRS https://t.co/eDUKNBhU6p
123,"Join me tomorrow evening for a virtual town hall! While I wish it could be in-person, I’m looking forward to answering your questions about COVID-19 and my work serving you in Congress. You can watch live on my Facebook page at: https://t.co/X4bgjyPIIm. https://t.co/COYsfkBCNN"
124,"This past week, I introduced legislation to help Main Street small businesses impacted by COVID-19 the opportunity to secure additional PPP forgivable loans. https://t.co/OkVrLzoFfv"
125,"Economic Impact Payments belong to their recipients, not nursing homes or care facilities. #IRS urges you to warn your loved ones: https://t.co/bsJeao1fVu #COVIDreliefIRS"
126,BREAKING: COVID-19 has had devastating impacts on the small businesses that keep our Main Streets thriving. That’s why I’m introducing a bill that gives small businesses an opportunity to secure additional PPP forgivable loans. https://t.co/OkVrLzoFfv
127,"COVID19 has affected all of us, but it’s not stopping my work for folks in #MN02. Today, I’m fighting for infrastructure investments at one of the first-ever virtual U.S. House Committee markups. Follow along here as we consider the #INVESTAct: https://t.co/4NuFlgaW7W"
128,We’ve got to make sure relief reaches our family farmers who have been hit hard by a trade war and a global pandemic.
129,"“Wealthy farmers and those who aren’t really engaged in farming get a big check while my farmers, who have dirt under their fingernails, get small checks or nothing.” https://t.co/SYgcuOiUtS"
130,"This week, I joined 137 colleagues in a bipartisan push for emergency funds for @USPS. Due to COVID-19, USPS is facing significant revenue losses. We must preserve this critical institution. https://t.co/v59YXLM25x"
131,Thank you to the state legislators from across #MN02 who joined me today to talk about the important work being done at the state and federal level to help our community. I remain committed to working alongside state and local leaders on the important issues facing our country. https://t.co/xbrs1Qu0CW
132,"The COVID-19 pandemic has affected frontline workers across our country, with significant impacts on transportation workers specifically. Yesterday, I joined my colleagues on @TransportDems to discuss the impacts of the pandemic on transportation workers and how we can help."
133,"Today, I convened stakeholders to discuss the issues supply chains are currently facing due to COVID-19, including those in agriculture. I’m committed to working across the aisle to ensure our supply chains keep moving. https://t.co/Fxg7Eytahf"
134,"This week, I’m introducing ‘Ask Angie.’ Do you have a question about COVID-19? Submit your question below and I’ll answer as many as I can in an upcoming video. https://t.co/MdPUBlf5ob https://t.co/nKJSiRNs2G"
135,"I came to Congress to work on issues facing everyday Americans, like fixing our crumbling infrastructure. As a member of @TransportDems, I’m hopeful that we can help our economy recover from COVID-19 by passing the INVEST in America Act and rebuild our nation’s infrastructure."
136,"As many face unemployment, we cannot allow families to go hungry. @MinnesotaDHS is providing additional assistance to Minnesota school children and their families through new Pandemic EBT benefits. Learn more below! https://t.co/gnGVSWYXHk"
137,"Today, I was honored to be a part of the groundbreaking for the new Safety and Mental Health Alternative Response Training (SMART) Center in Inver Grove Heights. This facility will provide crisis intervention training for first responders in Dakota County and #MN02. https://t.co/BtymTYn3oH"
138,Thank you to @mnhealth for putting together this helpful video about COVID-19 testing in Minnesota. Learn more here: https://t.co/5IzaIth3nT https://t.co/3NWhbarNuZ
139,I’m glad I got to greet the Eagan High School class of 2020 this afternoon in a safe and socially distanced way. I’m so grateful for everyone in our community who has come together to support our 2020 graduates. Congratulations Seniors! https://t.co/9ilxYZVapp
140,"Today, we honor the brave Allied servicemembers who stormed the beaches of Normandy 76 years ago. Their bravery, courage and sacrifices paved the way to victory in #WWII."
141,"This week, I visited cooks, paraprofessionals and administrators at Shakopee High School to talk about how they’re continuing nutrition services amid the COVID-19 pandemic. We’re lucky to have these great folks dedicated to supporting our students. https://t.co/kAitJ1ijGu"
142,"We’re so lucky to have folks in #MN02 like Mary Lee Olson and Linda Erickson from Hastings who have made and donated over 3,500 masks, and they’re still sewing! Thank you for all of your hard work. https://t.co/pxjiGBVrrZ"
143,I’m staying in touch with local leaders across #MN02 regarding COVID-19 response and the events in Minneapolis over the last week.
144,"As we process the recent events in Minnesota and mourn those lost to COVID-19, I will be taking a moment of silence at noon to remember the over 100,000 lives that have been lost in this country and the over 1,000 lost here in Minnesota due to COVID-19. https://t.co/YRG2nbJ3ba"
145,"The community trauma of the last several days combined with our public health crisis and social distancing can have serious mental health impacts. If you or a loved one needs to speak with a mental health professional, please don’t wait to get help. https://t.co/v8yO6oCY28"
146,Thank you to everyone who showed up to help our neighbors this morning. I stand beside you as we push for justice and work for peace. @LynxCoachReeve https://t.co/iPjr3MOJH9
147,"Today, I voted for the Payroll Protection Program Flexibility Act, which would increase flexibility for small business loan programs to help struggling businesses, especially restaurants and retail outlets hit hardest by the COVID-19 pandemic. https://t.co/zZjwhKcRoo"
148,We cannot let the #COVID19 pandemic jeopardize children’s health. Parents should not delay their children’s vaccines and immunizations. Health care providers throughout MN have procedures in place to ensure patient safety. https://t.co/ilZhSApDX3
149,Thank you to @EaganRotary for giving me the opportunity to talk with you today about Congress' work to help our community through the COVID-19 public health crisis. I'm proud to be a member of the Eagan Noon Club and support rotarians across #MN02. https://t.co/Mum8izvWx1
150,"Screenings for cancers &amp; other illnesses are essential. Patients don't have to miss their mammograms, colonoscopies or other procedures due to #COVID19. If you are at risk and need a routine screening, call your health care provider. https://t.co/FfVLFSgayL"
151,"Thank you to Nina Arneson and Vicki Iocco from Goodhue County HHS, Zumbrota Mayor Brad Drenckhahn and everyone who tuned in for our May Town Hall last night. I always want to hear from you. Please share your views at: https://t.co/cB3MGGSbP1 https://t.co/B3njnAvOfH"
152,"If you are at increased risk of heart attack or stroke, please do not avoid essential check-ups due to #COVID19 concerns. Call your doctor or care facility to discuss how you can safely receive the care you need. These routine visits save lives. https://t.co/wW8XLhEqOs"
153,"As we continue to take the necessary precautions to overcome #COVID19, we must not forgo the routine care we need to stay healthy. MN health care facilities are taking great caution to ensure patients seeking care can do so safely. https://t.co/Iz3V7CZDfu"
154,"Each Memorial Day, we pay tribute to the brave Americans who have lost their lives in service to our country. Thank you to the folks across #MN02 placing flags to honor our fallen servicemembers. https://t.co/Cgac8Iqs6s"
155,"“I don’t know what planet Mitch McConnell is living on if he’s not talking to mayors and county commissioners who are describing the additional cost and reduced revenue as a result of COVID-19.” We've got to provide resources for our local communities. 
https://t.co/DtA7ZU4CCG"
156,"As Minnesota’s Muslim community celebrates Eid-al-Fitr, I wish everyone joy, peace and good health. Eid Mubarak!"
157,"We still need a federal testing strategy.
https://t.co/N5P0zLoVJf"
158,Thank you to @mayortodd for talking with me this morning about the needs of our Farmington community. I’ve been staying in touch with mayors across #MN02 as we respond to the COVID-19 pandemic.
159,"I'm working every day to make sure our communities have the resources they need to fight COVID-19. Today, I spoke with @FEMA &amp; @HHSGov officials about my concerns with transparency in the PPE supply chain."
160,Thank you to Mayor @myron_bailey for talking with me about the needs of the Cottage Grove community as we respond to COVID-19.
161,"This morning, I talked with the President of the Minneapolis Federal Reserve, @neelkashkari, about how we can help local lenders better serve low-income and underserved communities with the PPP and the federal policies needed to support economic recovery post-COVID-19."
162,"I joined @HouseSmallBiz to advocate for small businesses here in #MN02. Today, we held a virtual forum about the impact of COVID-19 on rural small businesses. I'll keep pushing to make sure Main Street businesses in our communities have the resources needed to weather this storm. https://t.co/myCbmFljWz"
163,Thank you to the Wabasha County Administrator for joining me today to talk about the impacts of COVID-19 in our cities and counties. I’m honored to be working with local officials across #MN02.
164,"Today, I had the opportunity to speak with Dr. Anthony Fauci about the state of COVID-19 in Minnesota and across the country. I am so grateful for his dedication to keeping all Americans safe and healthy as we face the COVID-19 pandemic. https://t.co/kpoMdqa86O"
165,"During times like this, true heroes emerge. From health care professionals to delivery drivers, grocery store employees to caretakers, first responders to sanitation workers—thank you for keeping our nation going. #ThankEssentialWorkers"
166,"Join me next week for my monthly Town Hall! Zumbrota Mayor Brad Drenckhahn will serve as the moderator, and I’ll be joined by Nina Arneson from Goodhue County Public Health. Looking forward to answering your questions. https://t.co/vWkisMtM4z"
167,"There’s nothing more important to me than staying connected with the people of our district. To share your views with me about COVID-19 or other issues, you can contact me here: https://t.co/cB3MGGSbP1"
168,Proud to join @SenKlobuchar and the MN delegation to encourage folks to donate plasma if you’ve recovered from COVID-19. https://t.co/sXJ5HFtTAT
169,"It also stands with our family farmers by supporting biofuels, increasing farm stress program support and provides direct payments to farmers impacted by COVID-19 and funding for animal disease prevention."
170,"Here’s why I support it: It includes my bipartisan bill, allowing all families who claim dependents to finally get the economic relief payments that they deserve. The CARES Act needlessly left out millions of struggling families with older children and disabled dependents."
171,"Today, I joined public health officials from all 6 counties in #MN02 to talk about the current state of COVID-19 spread in Minnesota. Thank you to all of the public health officials working tirelessly to keep us safe and healthy. https://t.co/BixtNGArV6"
172,Thank you to @NfldMN Mayor Pownell for talking with me this morning about the needs of our Northfield community as we combat COVID-19.
173,"This morning, I checked in with the mayors of Plainview, Elko New Market and South St. Paul about the local impacts of COVID-19 and funds proposed in the HEROES Act for states, localities and tribes."
174,The @MNNationalGuard will be flying over hospitals across #MN02 today to honor frontline health care workers. Thank you for all you do! You can view the flight schedule and cities below. https://t.co/pMD3p6aDe3 https://t.co/Tq7FjFXmhn
175,"For updates on COVID-19 legislation and my work serving you in Congress, stay in touch by signing up for my weekly newsletter here: https://t.co/h4cuCAZnl3"
176,Right now our tribal communities in #MN02 are faced with harsh economic impacts from COVID-19. We've got to get the full relief funding to them that was promised in the CARES Act as soon as possible – I’m fighting to make sure this money gets distributed as soon as possible.
177,"UPDATE: I’m excited to announce that the most recent COVID-19 package includes my All Dependent Children Count Act and will expand the definition of an eligible dependent under the CARES Act to those younger than 19, students below age 24 and adult dependents."
178,"May is National Foster Care Month, and I want to thank everyone who plays a part in enhancing the lives of children and youth in foster care. Learn more about #NFCM here: https://t.co/n1K1PVUPNW"
179,It is ridiculous that we don’t have a federal strategy to test and protect the meatpacking workers who keep our food supply chain running. Workers deserve to be kept safe on the job. https://t.co/LDlZ3yVhzB
180,"She was a little thrown off by the cameras and face masks, but she’s looking extra pretty! https://t.co/7AuFTEBxwI"
181,Happy Mother’s Day and thank you to all of the moms working on the front lines as we fight COVID-19. I’m so lucky to be a mom to these four great young men. https://t.co/uYa51IWYeP
182,"Yesterday, I joined local businesses in Hastings to talk about the issues facing them due to COVID-19. I’m committed to making sure small businesses have access to the resources necessary to weather this pandemic."
183,"Our early education and child care sector has been particularly hard hit by the COVID-19 pandemic and is in dire need of emergency relief funds. This week, I joined 84 of my colleagues to call for additional child care COVID-19 relief funding. https://t.co/a29R31QhFd"
184,"COVID-19 has caused economic damage to nearly every sector of our country, and the U.S. Postal Service has been hit particularly hard. I’m pushing for additional support to be given to the @USPS in the next response package. https://t.co/m9AiWMduBp"
185,"Today, I spoke with owners of restaurants and breweries and others who have been hit devastatingly hard by the impacts of COVID-19. I’m pushing for flexibility for restaurant owners in the Paycheck Protection Program. https://t.co/1AYGmxVDkL"
186,"This week, we recognize all of the public servants who are stepping up in response to the COVID-19 pandemic. Thank you to the firefighters, police officers, teachers and postal workers taking extra precautions and adapting as they continue to serve. #PSRW2020"
187,We’re blessed to have the Geller Foundation for Patient Safety here in #MN02 as we fight COVID-19. Thank you for all you’re doing to keep patients connected to their loved ones. https://t.co/rYWyEa81Jx
188,"We’ve got to make sure that all residents and staff have the resources they need. For resources and guidance about COVID-19 and long term care facilities in Minnesota, click here: https://t.co/Fd6xN0WaX1"
189,"It’s National Nursing Home Week, and I want to thank all of the staff at our long-term care facilities, assisted living facilities and nursing homes who are doing important work to keep our loved ones safe and healthy."
190,Thank you to everyone who joined me today for my Kids Town Hall. We have such bright students here in #MN02 and it’s an honor to represent you in Congress. https://t.co/H4sGdNLDAb
191,I’m honored to work with these folks on my Farmer Advisory Council. Thank you for joining me today to talk about the issues facing family farmers and rural communities as we face COVID-19. https://t.co/tAeGVCtwC1
192,Health care workers are making sacrifices every day to defeat COVID-19. I joined my colleagues to push for access to the mental health resources health care workers need to endure the taxing months ahead and to recover in the outbreak’s aftermath. https://t.co/0YuG8DUX9f
193,I’m proud to be joined by 46 local elected officials across #MN02 in my push for direct investments into local communities as they face unprecedented challenges from COVID-19. We’ve got to include cities and towns in the next legislative package. https://t.co/MGfCFPLLfO
194,"During this uncertain time, nurses have stepped up to help keep us all healthy and safe. On this #NationalNursesDay, I thank all of the nurses in our communities for their dedication, compassion and hard work. https://t.co/yhSlw3y0oi"
195,"COVID-19 has devastated our country’s nursing homes and long-term care facilities. Yesterday, I met with @aarpmn to talk about how we can make sure seniors have the protection and support needed to keep them healthy and safe."
196,"Last week, I joined a letter urging leadership to explicitly define home health care aides and caregivers as essential workers in the next COVID-19 relief bill and ensure these workers have access to PPE, hazard pay, affordable health care and child care options. https://t.co/mmPkvg61pl"
197,"I support @goiupat and construction workers across the country by demanding that congress ensure health coverage, retirement and a bold investment in infrastructure. We need a FULL RECOVERY BILL that puts #workersfirst. https://t.co/EYehIXHB6Z"
198,"The livestock sector is seeing unprecedented losses, irreparably impacting families and producers in Minnesota. Today, I led the MN delegation in a push for turkey growers to have access to any COVID-19 relief resources available to agriculture producers. https://t.co/hbCgmEJyZ7"
199,DEADLINE TODAY: Veterans &amp; SSI recipients with dependents who DO NOT file taxes must fill out the non-filers tool on the IRS site to receive an additional $500 per dependent. This form can be accessed at: https://t.co/JD73PSAAi7
200,ATTENTION: Veterans with children dependents who did not file taxes in 2018 or 2019 must fill out the IRS' online form to ensure they get their $500 dependent payment: https://t.co/pSE0JDMCUW
201,"May is #MentalHealthMonth, and during this time of crisis, it’s essential that folks have access to quality mental health resources regardless of where they live. That’s why I’m fighting to expand mental health resources in Greater Minnesota. https://t.co/BRQyL68kB7"
202,"Today is #WorldPressFreedomDay. Reliable information and objective reporting is more important than ever. Last week, I joined 100 colleagues from both parties in pushing to protect local news publishers and broadcasters in the next COVID-19 relief package."
203,"Thanks to everyone who has participated in our digital Thank You For Local Heroes program for first responders. If you’d like to participate, click here: https://t.co/I0RvyoqSJo"
204,"Now more than ever we need to expand rural broadband access so our health care professionals have access to virtual visits, students are able to connect with teachers and all of us can use digital tools to stay connected with our loved ones. https://t.co/05beTXFutm"
205,"Proud to join @RepDonBeyer to push for improvements in testing, monitoring, and contact tracing to help contain COVID-19 while treatments and vaccines are being developed. https://t.co/M43nq2UK0F"
206,🚨Deadline May 5: Veterans &amp; SSI recipients with dependents who DO NOT file taxes must fill out the non-filers tool on the IRS site to receive an additional $500 per dependent. This form can be accessed at: https://t.co/zZuYgnNXYD
207,"This afternoon, I stopped by @MHealthFairview to drop off lunches to our heroic health care workers on the front lines. We're so blessed to have these dedicated folks working bravely and tirelessly to keep us all healthy. Thank you for all you're doing. https://t.co/gQ2IQYz3ny"
208,"Who said the Census couldn’t be fun? Right now, Washington County MN is just behind Los Alamos County NM. I think #MN02 can take that #1 spot from @repbenraylujan. Fill out the census here: https://t.co/LNM3cSFqBn https://t.co/cO9ekDjvbd"
209,"Thank you to @SenTinaSmith, Brian McDonald from @SBAgov, Steve Grove from @mndeed and everyone who joined our telephone briefing last night. If you need assistance navigating unemployment benefits or information on small business programs call my office at 651-846-2120. https://t.co/tty5KSM7Yy"
210,"Communities in #MN02 need assistance for first responders.

Small businesses need reliable access to relief.

Hospitals need PPE and testing.

I'm working on this now, but there are votes we need to take in DC. It's time for us go back – lives are at stake."
211,"Thank you for your support. Proud to be working alongside you to extend COVID-19 relief to include 17 and 18-year-olds, students younger than 24 and disabled dependent adult children. https://t.co/O8ubKTKKoW"
212,"COVID-19 has changed a lot about our daily lives, but my staff and I are here to serve you. If you need help accessing benefits or have questions about assistance you may be eligible for, please reach out to my Burnsville office at 651-846-2120 https://t.co/cB3MGGSbP1."
213,We need a national strategy to ensure that workers in our processing facilities have temperature checks and access to testing so that we can keep workers safe and our food supply chains running. https://t.co/bJssbYiuW8
