,Tweet
0,"I’m so proud to have a casework team dedicated to serving #MN02 constituents. Since coming to Congress, we’ve resolved more than 1,000 cases and returned more than $675,000 owed to folks in our community by the federal government. https://t.co/em7uquvj70 https://t.co/Ovqe5B7nCi"
1,"Thank you to Colleen Coleman, Dr. Carrie Henning-Smith and everyone who joined us tonight for my 22nd town hall. If we weren't able to get to your question tonight, share your views with me on my website here: https://t.co/cB3MGGSbP1 https://t.co/kBgImSJSd5"
2,"Yesterday, @IGHpdMN kicked off their partnership with @thevitalsapp to help our police officers and folks with mental health concerns communicate more effectively. I’m glad my staffer Morris was able to attend! https://t.co/LqajPFWX69"
3,"From health care and agriculture to infrastructure and education, I’ve worked hard to find bipartisan approaches to the most pressing issues facing our community. I’m proud that since coming to Congress, 80% of my 31 bills introduced and 533 bills cosponsored are bipartisan. https://t.co/wO5U9Nnvfw"
4,"I’m honored to receive a perfect score from @HRC on their Congressional Scorecard for my work to advance equal rights, protections and opportunities for our community. Everyone deserves to be who they are and live without fear. #HRCscorecard https://t.co/TRZ6VW3jmo"
5,I want to recognize the great folks at the @DakotaCFC who have been providing free COVID-19 testing. I’m so glad that funds I voted for in the CARES Act have supported their work serving as a lifeline to folks in our community. https://t.co/ol0rhoDJ9n
6,"Kim’s story is precisely why I’ve focused on reducing the cost of health care and prescription drugs, and supported bold funding for cancer research and treatment development during my first term in Congress."
7,"Without the protections provided by the Affordable Care Act, folks like Kim have to worry about lifetime limits on health coverage or even being denied coverage due to a preexisting condition."
8,"As we recognize #BreastCancerAwarenessMonth, I want to highlight Kim, a brave friend of mine who joined me in January for the State of the Union. Kim was diagnosed with metastatic breast cancer at the age of 33, learning of her disease when her daughter was only eight months old. https://t.co/lIi6nunA2e"
9,"Congratulations to the cities, counties and advocacy groups in #MN02 who worked with our legislature to pass a bonding bill that will bring funding to projects in our community. https://t.co/Cmc9n2yelr"
10,"October is #LGBTQHistoryMonth, a chance for us to reflect on the brave folks who have stood up and fought for equal rights, protections and acceptance for our community. I’m proud to recognize Edie Windsor, who helped pave the way for our right to marry. https://t.co/wyHR1S2J63"
11,"Here in the land of 10,000 lakes, we know how vital clean water is to the health and beauty of our state. I’m proud to recognize the anniversary of the Clean Water Act and the benefits it has had on our communities since 1972. https://t.co/UBCApG49Tw"
12,"As our states, counties, cities and towns continue to face the unexpected costs brought on by the COVID-19 pandemic, we’ve got to provide federal support. I’m pushing for direct flexible aid to support our teachers and first responders. #FundtheFrontLines https://t.co/7CV6S1kPLK"
13,Rice County has announced the availability of grants for small businesses facing serious financial loss due to the COVID-19 pandemic. I’m glad that funds I voted for in the CARES Act are helping our community. Learn more here: https://t.co/GTZHPU7Qn0.
14,"On this day in 1775, a resolution of the Continental Congress established what is now the @USNavy. Thank you to the American Sailors who have stood the watch with honor, courage, and commitment for 245 years. #245NavyBirthday https://t.co/D7zOtejKn7"
15,"We’ve got to hammer out a bipartisan solution as quickly as possible. Our schools need additional federal support as they face the unexpected costs brought on by this pandemic.
https://t.co/yDqDl68PU3"
16,"Today is #NationalComingOutDay, a chance to recognize the challenges LGBTQ folks face and the bravery it takes to be who you are. To everyone struggling to live their truth, Cheryl and I support you and we’re proud of you. https://t.co/lq0JOCQryN"
17,"Shoutout to my staffers, Morris and Elise, for joining @DCTC and @InverHillsCC for their annual day of service. Thanks to everyone who pitched in to support our community this week. https://t.co/Y8LcQut6yc"
18,"Today is #WorldMentalHealthDay. The COVID-19 pandemic has impacted all of us, but it has been a particularly challenging time for folks with mental health conditions. Learn more about resources available to Minnesotans here: https://t.co/LfZZbPWsAO."
19,".@SCDCAP delivers 10,000 meals per month to seniors in our community. Thank you to all of their volunteers who help make this possible! Learn more about the Scott Carver Dakota Community Action Partnership at https://t.co/X1snt0W7pU."
20,"I'm disappointed in the President's decision to end relief talks until after the election. This isn't about politics, it's about helping small businesses, aiding localities &amp; funding testing, tracing and treatment efforts. We must find a bipartisan solution for folks in #MN02. https://t.co/NMuNWIgHLO"
21,"I am saddened to hear that Fairview will be closing clinics and hospitals in our community. As COVID-19 continues to impact lives and careers, I will continue to work hard to address health inequities and to ensure that federal relief dollars are directed to #MN02."
22,"Tonight, we passed critical legislation to protect lives and livelihoods as we continue to face the health and economic challenges of COVID-19. https://t.co/RzckNfeSJV"
23,"Earlier this year, I requested a report from @USCBO comparing multiple policy approaches to achieving universal health coverage. Today, this report was released and I’m hopeful that it will help us work on a bipartisan basis toward the goal of health care for every American."
24,"I’ve joined @StaceyPlaskett on bipartisan legislation to support our aviation workers by extending the Payroll Support Program through March of 2021. We’ve got to stand by our pilots, flight attendants and mechanics as COVID-19 continues to disrupt the aviation industry. https://t.co/DhqQcvzQvC"
25,"Today I spoke to @HouseSmallBiz about the impacts restaurants continue to face due to COVID-19. The RESTAURANTS Act is critical to the survival of small businesses, local economies and our food supply chain, and I'll continue to fight for its inclusion in the next relief bill. https://t.co/VglZxcdYH7"
26,"I’ve met with families whose loved ones were among the 346 victims of the Boeing 737 MAX crashes and committed to do all I can to improve safety. Today, we passed bipartisan legislation in @TransportDems to strengthen FAA’s certification process for #SaferPlanes2020. https://t.co/EWKqbA3pWn"
27,"I’m back in Washington for votes this week, and I’ve asked that we stay until we vote on an updated COVID-19 relief bill. Minnesotans are hurting. We’ve got to come together and get this done immediately. https://t.co/TWb0AFlaRF"
28,"It was great to join folks in South St. Paul last month to celebrate the first women in the U.S. to vote following the ratification of the 19th amendment. Thanks again to everyone who participated!   
https://t.co/z9jQKt2VkI"
29,I’m urging leadership to keep Congress in session until we have a bipartisan COVID-19 relief package. Proud to join my colleagues in pushing for an end to this stalemate. https://t.co/wVE7pEjRrY
30,"As we approach flu season, it's more important than ever to be sure to get your flu shot. To prevent concurrent respiratory illnesses as COVID-19 continues to spread, I encourage everyone to follow the @CDCgov guidelines and get vaccinated if you can. https://t.co/slpm9by2AO"
31,"Today marks 575 days since my House colleagues and I voted to pass H.R.8 - the Bipartisan Background Check Act, but the Senate has not taken it up. I’m wearing orange to reiterate my support for common sense solutions to gun violence. #WearOrangeMasks https://t.co/j4gbLYNaFn"
32,"Congratulations to David and James, on AMMI Risk Solutions, Inc in Eagan being named “Exporter of the Year” by @sba_minnesota. 

As we celebrate #NationalSmallBusinessWeek, I’m grateful to the small business owners who’ve adapted to keep customers &amp; employees safe."
33,"Thank you to the @beerinstitute for meeting with me today to talk about supporting our Nation’s brewers, beer importers and the thousands of Minnesotans who work in the beer industry. https://t.co/2faMt0RlKK"
34,"It was great to join @VFWHQ for their Virtual Fall Conference today. I’m proud to be working alongside them to improve and expand health care for our veterans, especially for those in our rural communities. https://t.co/TbVnAwvFlX"
35,"Yesterday, the House passed the bipartisan Maternal Health Quality Improvement Act. I was proud to cosponsor this critical step in our efforts to end preventable maternal mortality and eliminate racial inequities in maternal health outcomes. https://t.co/8EVQLfC7JI"
36,"I was proud to advocate for Minnesota’s turkey growers earlier this year, and I’m pleased that they will now be included in the next round of the USDA’s Coronavirus Food Assistance Program. https://t.co/4jCsjDYgN0"
37,"Today begins National Farm Safety and Health Week. As fall harvest season kicks into gear, consider joining webinars from @NECASAG for safety tips. Additionally, @PAFSafetyDays will be holding virtual events for our future farmers! #NFSHW20"
38,It was great to meet with the @MN_Chamber this week to talk about the needs of small businesses in our community. I’m proud to serve on @HouseSmallBiz where I’m working to continue and improve the programs so many small businesses are relying on to make it through the pandemic. https://t.co/u00XMRafEC
39,"I want to thank everyone who joined me to donate blood today. The Red Cross is taking extra precautions to ensure the health of everyone involved, and I encourage healthy individuals to please donate blood if they can. https://t.co/hWWI1VKa2b"
40,"Today is #POWMIARecognitionDay, a chance for us to honor and remember the brave Americans who were prisoners of war and those who never returned home. https://t.co/xDid7qafRx"
41,"Earlier this year, I introduced bipartisan legislation to fund testing and contact tracing efforts that allow us to contain and suppress COVID-19. I’m joining @SenTinaSmith and @SenBillCassidy in urging our colleagues to come together and get it done. https://t.co/bkwvEM5QZN"
42,No one should have to choose between job security and a healthy pregnancy. I’m proud to join colleagues on both sides of the aisle to pass the Pregnant Workers Fairness Act to secure strong and clear protections for all pregnant workers in our country. https://t.co/oEfPbHWKln
43,"Yesterday, I met with folks from @ACSCANMN who shared their stories. I’m proud to be working alongside them to fight for cancer research funding and the development of new treatments. https://t.co/WBuBW1P8IP"
44,"You are not alone. If you or a loved one is struggling with a mental health or substance use disorder, know that treatment and recovery is possible. Find the resources you need: https://t.co/kbSDx5QOgB"
45,Thank you to @MinnesotaPork for meeting with me today. I’m proud to be working alongside you to make sure that MN farmers have the resources and support they need as we combat COVID-19 and the impacts it’s had on the ag economy. https://t.co/9UCclhy4pi
46,"Today, I’m masked up as I head back to Washington to work on continued legislation to help our small businesses through these difficult times. https://t.co/QHz8HEsAJ6"
47,"Today, we remember each of the lives lost on Sept. 11, 2001, and honor the brave first responders who put their lives and health on the line to rescue their neighbors. #NeverForget"
48,"Thank you to Wabasha Mayor Durand, Dr. Searle and Dr. Demmer from @PublicHealthUMN and everyone who tuned in for my 21st town hall. It’s an honor to take your voices to Washington as I fight for #MN02. If you missed it, you can watch the full video here: https://t.co/WA6VDyymBB"
49,"We must fully fund our public schools. I’m fighting to ensure that the federal government meets its obligation to schools, especially as they face unexpected costs due to COVID-19. Thank you to everyone who joined me today to discuss this important issue. https://t.co/eOYWQFYUlt"
50,"Today is #InternationalLiteracyDay. This year, we recognize the educators and students adapting to new ways of learning as we face COVID-19."
51,I had a great time visiting Main Street businesses in downtown Northfield today! COVID-19 has hit small businesses particularly hard. It’s great to see how these folks are adapting to continue serving our community and I’m determined to do all I can to support them. https://t.co/dUYtobZSOj
52,"Thank you to the students in the Belle Plaine 4-H Club for working to make sure all of your peers stay safe and healthy. #MaskUpMN 
https://t.co/CBXGcxqFsV"
53,"I recently reached the milestone of 100 health care bills introduced or cosponsored since joining Congress. Yesterday, @RepDeanPhillips and I met with @MedicalAlley to discuss the work we’re doing to reduce the cost of health care and expand access for Minnesotans. https://t.co/qImT7WmKjr"
54,"75 years ago, #WWII officially came to an end.
  
We are forever grateful for our servicemembers – and our allies - who fought alongside them in Europe and the Pacific – for their bravery and sacrifice. 
  
#WWII75 https://t.co/JolXvDAJK0"
55,"As schools reopen, the health and safety of students and teachers must be our top priority. I’m joining @AFTunion to #DemandSafeSchools."
56,Thank you to everyone who joined me today to talk about the barriers seniors face in housing and home ownership. I’m committed to making sure all of our seniors have access to affordable housing and the resources necessary to maintain independence. https://t.co/WmPT4sBhCa
57,I’m proud to advocate for infrastructure projects like the Sturgeon Lake Road Rail-Grade Separation Project that will make our communities safer. Thank you to local leaders from Red Wing and the Prairie Island Indian Community who participated in today’s meeting! https://t.co/xHylbLJ9hY
58,"A reliable and efficient @USPS is critical to ensuring patient access to care, especially for Americans who have pre-existing conditions or experience disabilities. I joined @RepChrisPappas to push back on the slowdown in prescription deliveries. https://t.co/ToTyZ7GbrV"
59,The COVID-19 Housing Assistance Program provides housing assistance payments to help prevent eviction and homelessness as well as maintain housing stability for eligible renters and homeowners. Learn more at https://t.co/5JGF5UcPuc. https://t.co/zVsErvcCxh
60,"On Friday, I visited Main Street businesses in Red Wing and Lake City to hear directly from them about how COVID-19 has impacted their businesses and how I can continue to support them during this pandemic. 
https://t.co/O3zF786Tue"
61,"This past spring, I voted for the CARES Act to help our community in response to the COVID-19 pandemic. I’m proud to see Scott County allocating CARES Act funds to support small businesses, housing, rural broadband and other great initiatives. https://t.co/JYAS0odla4"
62,"I’m so grateful to the small businesses in Lake City and Red Wing who participated in our Main Street visits today. I’m proud to serve on @HouseSmallBiz to fight for these historic, family-owned businesses that sustain our communities, as they face the challenges of COVID-19. https://t.co/D4lXPz5muD"
63,"As all of our local economies are impacted by COVID-19 we’ve got to make sure hardworking families, including their children, are supported. I am proud to work with my fellow MN colleagues to correct a problematic disparity for our high school students. https://t.co/n6DxHIjlH5"
64,Thank you to everyone who joined me today for a conversation on racial disparities in our schools and how we can better support our students and teachers of color. We’ve got to root out systemic inequities and ensure that every student has the tools to succeed. https://t.co/iEFQjasGoJ
65,"I’m proud to announce that VA grants to end veteran homelessness include $2.8M for Minnesota. We owe a debt to all those who served that can never be repaid, and I won’t stop fighting until every single veteran in MN has safe, accessible and affordable housing."
66,We need a cohesive testing strategy that allows us to get results back quickly and contact trace. @SenTinaSmith and I are leading a bipartisan effort to help states contain and suppress COVID-19. Listen to learn more from @MPRnews. https://t.co/KLiN0LTiNm
67,"75 years ago, Emperor Hirohito announced to the world that Japan would surrender, bringing #WWII to an end. 
 
Today and every day, we honor the brave servicemembers who fought for and alongside the United States in the Pacific Theater. 
 
#VJDay75 https://t.co/TaexBSFuJb"
68,"Thank you to everyone who joined me for last night’s town hall. Listening to folks in #MN02 remains one of the most important parts of my job, and I won’t stop fighting until your concerns are addressed in the halls of Congress. https://t.co/7wPrWsgBJO"
69,Biofuels benefit our rural communities with jobs and the environment with reduced emissions. That’s why I joined a bipartisan letter to House and Senate leadership calling for much needed direct aid in the next COVID-19 relief package. https://t.co/sf7H00WVEs
70,Today I joined @SenTinaSmith and @ASlavitt to talk about the bipartisan and bicameral Suppress COVID-19 Act that I introduced in the House to increase support for COVID-19 testing. We’ve got to do all we can to contain and suppress this global pandemic. https://t.co/wXPpAwlPjq
71,It was great to meet with families who have experienced @GilletteChildrn yesterday to hear about the important work they do for children with complex medical conditions. We’re lucky to have such a fantastic institution here in Minnesota. https://t.co/tsZayKSuoi
72,Responsible businesses want to do everything possible to protect workers &amp; customers from COVID-19. That’s why I cosponsored bipartisan legislation to give tax credits to businesses for the extra costs of professional cleaning or training staff on safe disinfecting procedures.
73,"School busses and the essential workers who operate them are critical to public education. That’s why I cosponsored the CERTS Act to give $10B to transportation providers, including school bus operators, so they can maintain payroll through the end of 2020."
74,"Live music venues:
📈 Are good for the economy
🎶 Support local artists
👨‍👩‍👧‍👦 Provide community space for families

That’s why I co-sponsored the #SaveOurStages Act to provide $10B through @SBAgov to keep our local cultural institutions from going under during this pandemic. https://t.co/WUk7XHJgKx"
75,We cannot let the COVID-19 pandemic jeopardize children’s health by delaying vaccines and immunizations. Health care providers throughout MN have procedures in place to ensure patient safety. #ImmunizationAwarenessMonth https://t.co/ilZhSApDX3
76,"I’m focused on expanding access to affordable, high-quality health care for folks in #MN02. In our recent House appropriations bill, I’m proud to have secured investments in medical research, school-based health centers and public health. https://t.co/98dBa7jxqD"
77,"Today, we honor the brave folks who earned a Purple Heart in service to our country. We also pay tribute to the Purple Heart families whose loved ones made the ultimate sacrifice. #PurpleHeartDay https://t.co/e42yKqcgSS"
78,"It’s time to put politics aside and work together to lower health care costs. Minnesotans deserve #LowerCostsForCare:
- Lower drug prices
- Lower premiums
- Expanded coverage
- Equity in health care"
79,"If you have a fever, chills, cough, difficulty breathing OR you have been in close contact with someone who has tested positive for COVID-19, you can find 200 free testing sites in Minnesota, and dozens in #MN02. Find one near you:
https://t.co/KsamNb4tB1"
80,I'm grateful to the local police and fire departments who took swift action to keep our constituents and staff safe today. Threats like this are abhorrent. https://t.co/kDuMha37qc
81,Happy National #FarmersMarketWeek! We’re lucky to have many great farmers markets across #MN02 that are open with safety procedures in place to help us stay connected to the farmers who help feed our families. https://t.co/2TfE2Wtgvh
82,"Thank you to @dcrchamber for distributing free masks to local businesses. By wearing masks in public, maintaining social distancing, and washing our hands, we can all do our part to keep businesses open and protect our friends and neighbors.
https://t.co/UMXAI9vbhV"
83,Have questions about the new mask requirements? Here’s some helpful information on how to comply with the new standards. #MaskUpMN https://t.co/hi68r2eGAC
84,"I will not stand for @TheJusticeDept’s threats to the Affordable Care Act. 35,000 of my constituents are insured because of the ACA, and I’ll keep fighting attempts like this to take away health care from Minnesotans. https://t.co/bIMiDrVf6I"
85,"We cannot talk about reopening our economy without recognizing the important role child care providers play in our COVID-19 response. Today, I voted for $682 million in support for Minnesota's child care providers to help them safely reopen. https://t.co/52XMWObhOo"
86,"I joined a roundtable today with Chief Agricultural Negotiator Gregg Doud from @USTradeRep to advocate for family farmers in #MN02 who have been hit hard by a trade war and a global pandemic. Thank you for your willingness to work together, Mr. Doud!"
87,"Masks work. We can help keep our friends and neighbors healthy and our businesses open with a simple face covering. Learn more about #MaskUpMN below. 
https://t.co/q0IHcLJfXO"
88,I met with @DakotaCountyMN Commissioners this week to hear their plans for the $52 million I helped secure for the County in the CARES Act. I look forward to working with them as I continue to ensure #MN02 receives the help necessary to fight COVID-19.
89,"We owe our veterans a debt that can never be repaid. Today, I passed an amendment to add $1.5 million to the Veterans Rural Health Resource Centers program, whose research and pilot projects improve health care for veterans in rural communities. https://t.co/6oZL2ZtcYq"
90,My second amendment passed helps our farmers in crisis by expanding crucial mental health resources in our rural communities. https://t.co/99wCRtM3D9
91,"Whether I’m here in the halls of Congress or visiting communities across #MN02, I’m committed to fighting for you each and every day and working with anyone who has a good idea to make progress for our communities. https://t.co/o8Aog2B9XG"
92,"Last week, The @TrevorProject released the largest ever study of LGBTQ youth mental health. It sheds a light on the challenges LGBTQ kids face, and emphasizes the protective power expanding support services could have. Read the full results here: https://t.co/OicP0ws6LV."
93,We’ve seen an alarming rise in scams related to COVID-19. I joined my friend and colleague @RepPeteStauber to introduce the bipartisan Stop Coronavirus Scams Act to curb this predatory practice. https://t.co/x52vhkkmmj
94,"Until we work together, we cannot make any progress toward lowering the cost of health care for our constituents. I’m proud that both of these bills passed the House with bipartisan support. I’ll continue to reach across the aisle to help folks in #MN02. https://t.co/RhXLzCDsuc"
95,"Thank you to @ASlavitt and everyone who logged on and participated in our town hall. Listening to you continues to be one of the most important parts of my job, and I’ll never stop fighting for Minnesotans. https://t.co/RYsPsWjrcU"
96,I was proud to bring folks together today to discuss how jobs in the trades can rebuild our country and our economy as we recover from the impacts of COVID-19. I’ve introduced legislation to give additional support to our community colleges and Registered Apprenticeship Programs. https://t.co/iiKiXwMb4s
97,Parks and recreation professionals provide essential services to our community – especially as we face COVID-19. Join me in recognizing Parks and Recreation Month with @NRPA_news! #WeAreParksAndRec
98,"If health care isn't affordable, it's not accessible. This week, I spoke at #TheHillHealth about my work to:

⬇️  Lower out of pocket costs

💊  Boost competition to lower prescription drug prices

💻  Expand telehealth in rural communities"
99,Protect others. Wear a mask. https://t.co/tf80Ottlyd
100,COVID-19 has shown just how important it is for us to protect and improve access to health care in this country. I was honored to speak at @thehill’s summit today to talk about my legislation to lower out of pocket and prescription drug costs for Minnesotans. https://t.co/TGe8bLWarE
101,I’m fighting to make sure small businesses have access to the help they need as COVID-19 affects their bottom-lines. I was glad to have my bill which extends the deadline to apply for a Paycheck Protection Program loan signed into law this past weekend. https://t.co/FuQGWnv9Q8
102,The COVID-19 pandemic has laid bare the persistent inequities in our health care system. I convened health experts today to talk about these challenges and how we can work to ensure all Minnesotans have the health care they deserve. https://t.co/acLdLqc4Q8
