,Tweet
107,"The only way to defeat #COVID19 is to guarantee that every American has access to the full range of treatments &amp; that they are proven to be safe &amp; effective.


That’s why I wrote a letter to the @NIH urging vaccine trials in racially diverse communities.
https://t.co/5OBTLy4dgo"
108,"Providing a legislative update &amp; lunch to healthcare workers here at St. Francis Medical Ctr &amp; community clinics in Lynwood today.

A small way to say THANK YOU to our #frontline healthcare workers fighting #COVID19 &amp; caring for our loved ones. We appreciate you! #WearAMask #CA44 https://t.co/ryJC5IsQwh"
109,"In March, @realDonaldTrump &amp; @EPAAWheeler allowed polluters to bypass environmental rules. They've had 5 mos without regulation on leaks, spills, emissions or hazardous waste.
 
Nearly every state is feeling the environmental &amp; public health consequences. https://t.co/z48vNah46c"
110,"Farmworkers are #EssentialWorkers helping our nation make it through #COVID19. 
 
We must keep them safe. https://t.co/vRArGdEv4w"
111,"Despite the recent #SCOTUS ruling upholding #DACA, USCIS is slowly pulling the rug out from under DACA recipients. 
 
Withholding the opportunity to work and get access to healthcare from young people during #COVID19 is cruel.
 
New applications must be accepted now. #DefendDACA https://t.co/gSKXhXMHM2"
112,Remember when Republicans said cornovirus was a hoax? 170K Americans have died. Now they say @USPS delays are a political hoax. My constituents who are getting their medication delivered 12 days late don’t think so.  We don’t need more deaths. Just delivery.  #SaveThePostOffice
113,"Great to have #TeamBarragan in South Gate for a food &amp; backpack giveaway and #2020Census outreach event. Make sure you’ve completed your #Census ➡️ https://t.co/CcT5CfhIPF.

Thanks to @SouthGateCAGov, @SoGateChamber1, @NorthgateGlzMrk, &amp; all who made this event happen. #CA44 https://t.co/oj8dwrDw2D"
114,"Thinking of all of the #Latinas who are working hard, spreading joy, and paving the way to a better future. 

We’re strong, we’re proud, and we’re not going anywhere. #NationalLatinaDay 

Thanks, @RepDMP for sharing this great memory. https://t.co/HqmzgWRLau"
115,"Entrepreneurs have told me their small businesses are suffering due to #USPS delay.
 
It’s already a tough time for small businesses; we’re in a pandemic. The extra problems w/ USPS should have been avoidable.

Congress must act immediately to #SaveTheUSPS https://t.co/b1ALoZfQpX"
116,"Thanks to the amazing performers at my Online Briefing &amp; Health Fair for Older Adults, including the amazing Willowbrook Line Dancers that got me up and dancing. Watch the full video here:  
https://t.co/e8czssbDYp

Next year, in person! #CA44 #LosAngeles #TownHall https://t.co/pWJCbCgppD"
117,"Pres. Trump is trying to sabotage the #USPS for his own political gain. It's disgraceful.
 
He doesn't care about the people who need the mail for their medicines, SSI, or paychecks. He only cares about himself. We must pass the #DeliveringforAmericaAct. #DontMessWithTheUSPS https://t.co/9eXiFWOFMX"
118,"Music🎶, dancers💃, health resources⚕️, Congressional updates📰. All of this &amp; more @ 10AM PDT at my Older Adults Briefing &amp; Health Fair. #CA44

Register: https://t.co/T5xUns4qQc, or call toll-free: (669)900-6833, ID: 812 2565 3305. Para Español: (669)900-6833, ID: 835 1803 2564 https://t.co/etmp37nNGy"
119,"Tomorrow @ 10AM PDT is my annual Briefing &amp; Health Fair for Older Adults! While I wish we could be together like in the past (pictured here), this event will be full of entertainment &amp; helpful resources by 💻 or 📞! 

Register: https://t.co/T5xUns4qQc, or call (310)831-1799 #CA44 https://t.co/MeLOX8C7hc"
120,"We should never have to choose between a healthy environment and good jobs. 

I'm joining @byhumankind to discuss my #ClimateSmartPortsAct on Instagram Live at 2PM PST today. Tune in ➡️https://t.co/MvaHgq8ym2"
121,"#EssentialWorkers are making food, stocking shelves &amp; making sure all of us are able to get what we need during this pandemic. They deserve workplace protections and #PPE to safely do their jobs. Instead, some are being retaliated against for speaking up. 
https://t.co/jQKaKQNmL3"
122,"Join me Tuesday at 10AM PDT for a morning of entertainment and information at my annual Briefing &amp; Health Fair for older adults, virtual edition! Tune in for performances by local artists, updates from DC &amp; presentations on health resources Register: https://t.co/T5xUns4qQc #CA44 https://t.co/EOO70BsTey"
123,"RT @RepBarragan: It’s time for my annual Briefing &amp; Health Fair for older adults – virtual edition! Join me Tues 8/18, at 10-12pm PDT for a…"
124,RT @CountyofLA: ¿Tienes problemas para pagar el alquiler? ¡El subsidio de alquileres por el COVID-19 del condado de Los Ángeles se encuentr…
125,"#SocialSecurity turns 85 today, amidst Trump's attempts to defund it during a pandemic.
 
This year, we must recommit to enhancing and protecting this critical safety net for seniors, especially during #COVID19. #SocSec85 #ForThePeople https://t.co/ziEUBCX5os"
126,Stay safe and remember: #YourActionsSaveLives. #MaskUp https://t.co/rWMAUBnmU2
127,"It’s time for my annual Briefing &amp; Health Fair for older adults – virtual edition! Join me Tues 8/18, at 10-12pm PDT for a morning of performances from local artists, updates from D.C. &amp; presentations on health resources #CA44
 
Register: https://t.co/T5xUns4qQc or (310)831-1799 https://t.co/yLMBFz4wOE"
128,"Amid #COVID, 55% of Black women have less than $200 in savings and half can't afford basic needs like food or housing. 
 
This #BlackWomensEqualPay Day, we must value Black women and work toward justice with equal pay for equal work. #BlackWomenCantWait https://t.co/RQHZsJ3F3X"
129,"Trump cares about one thing. 

Himself. 

Not the millions who rely upon the @USPS for delivery of their medicine, their mail, their paycheck, military care packages, veterans who the Postal Service employs &amp; more. 

He will do anything to stay in office. Lie. Cheat. Sabotage. https://t.co/9M81JTwws8"
130,"A huge thank you to all of the health centers and their hardworking staff in #CA44. Thank you for fighting for us on the #frontline against #COVID19.

We must ensure #CHCs have the resources they need to keep their patients, and themselves, healthy and safe. #ValueCHCS #NHCW20 https://t.co/jkkW4E69yS"
131,"Joined @City_of_HP City Council &amp; @SELACollab today to encourage Latinos to #BeCounted in the #2020Census. 
 
Following #COVID precautions, Census takers are now going door to door to assist.

It takes just a few mins &amp; has a huge community impact. Submit: https://t.co/CcT5CfhIPF https://t.co/iP8HRo4rz4"
132,"Latina #EssentialWorkers are doing their jobs, putting themselves at risk to keep America going. 
 
Women of Color are most likely to work in low-wage jobs, &amp; are being shortchanged by both gender and racial wage gaps.
 
We need #HealthEquity + #HazardPay. Pass the #HeroesActNow. https://t.co/BWpfHNel7E"
133,"As a daughter of immigrants &amp; Congresswoman of a majority Latino district, the cruelty of the US toward immigrants &amp; asylum seekers is personal.
 
#ImmigrationNation showcases this dark &amp; broken system.
 
My border trip &amp; Sec Nielsen questioning is in Ep5. https://t.co/RoBT64m76j"
134,"Heartbreaking to hear LB Mayor Garcia’s stepfather has died from #COVID19 complications, just 1 day after the memorial for his wife of 27 yrs — Mayor Garcia’s mother. So sorry for your loss.

This virus tears families apart. We must do all we can to stop the spread. #WearAMask https://t.co/S97wCem3Cs"
135,"#COVID19 exposes the dark truths of our nation, like drastic racial health disparities and gaps in our social safety net.
 
Thanks @RepChuyGarcia for leading the fight to eliminate health inequalities in our communities &amp; build a stronger health system of tomorrow. #HEAA2020 https://t.co/M5LPw3nl0D"
136,"Taking a break from golf, the President announced:

Cuts to fed #unemployment benefits

Cuts and potential elimination of funding to SSI &amp; Medicare.

NOTHING to combat #COVID19, open schools, or feed hungry Americans.

@HouseDemocrats are fighting for relief that’s #ForThePeople."
137,"With personnel shakeups late on a Friday night, President Trump is threatening #VoteByMail and slowing down mail delivery for people who depend on it for medicine, food and bills.

We need answers. #fridaynightmassacre https://t.co/ZaAVH9Wc8p"
138,"The House passed the #HeroesAct nearly 3 months ago which would give critical #COVID19 relief to families.
 
While the crisis continues, Pres. Trump and his party would rather buy a new fighter jet than help those struggling.
 
#FamiliesNotFighterJets #FamiliesFirst #ForThePeople"
139,RT @MayorOfLA: Your face mask isn’t effective if you’re making these common mistakes. Wear it right — every time. https://t.co/kZXYGl3kI3
140,".@RepRoybalAllard is right, we must push back on @senatemajldr’s attempt to use this national crisis to forward an anti-immigrant agenda. 
 
#COVID19 relief needs to be focused on helping everyone in our communities make it through this crisis. #FamiliesFirst #ForThePeople https://t.co/uzxb2oEAwA"
141,"The Trump Admin is not protecting meatpacking workers from #COVID19. There have been over 33,000 cases and 132 worker deaths.
 
These primarily Latino, Black and immigrant workers are the people feeding our nation. We must act quickly to protect these workers and their families. https://t.co/xlEgVLVf4K"
142,"Latino communities in SE LA are the epicenter of #COVID19
 
Years of pollution, poverty &amp; now @realdonaldtrump's awful pandemic response has led to this.
 
To end this crisis, we need access to testing, healthcare &amp; lasting economic + #EnvironmentalJustice https://t.co/q8ZYyYc4Ah"
143,"Rent is due &amp; many don't know how they're going to pay during #COVID19. 
 
The Republican Senate's failure to act means that millions could soon lose the roofs over their heads. We must extend the #EvictionMoratorium &amp; provide urgently needed rent relief. #ForThePeople https://t.co/uuL8Y8qXUo"
144,"During #COVID19 it’s imperative that we both help kids learn AND keep them safe. 

Thanks, @SenCortezMasto for pushing the Senate to support resources for broadband and education. #ForThePeople https://t.co/iftBHg9VYA"
145,"Thanks for joining my Tele #TownHall yesterday with @SupJaniceHahn. We took constituent Q’s &amp; discussed #COVID19 relief &amp; other top issues. #CA44
 
With every conversation it’s more clear: our communities need support. That’s why I’m fighting for the #HeroesActNow #ForThePeople https://t.co/8MYf1i3siS"
146,"Telephone #TownHall Tonight at 6:45 Pacific with @SupJaniceHahn on #COVID19 response at the federal and local level.

Get the latest and ask your questions directly. Register at https://t.co/xNSVikHK3w #CA44 https://t.co/vnRqfbfFxV"
147,#COVID19 can happen to anyone. Please #WearAMask and stay safe. #YourActionsSaveLives https://t.co/YoOLMYhGHl
148,"One year ago, #ElPaso was attacked by a homegrown terrorist. Today we remember the victims who were targeted because they were Latino.
 
The El Paso community responded to this tragedy with love &amp; resilience.
 
We must continue the work to end hate &amp; #gunviolence. #RememberElPaso https://t.co/t4xeF1c7Yt"
149,Caring for a loved one with #dementia is tough. Add #COVID and it’s harder. I experienced it firsthand with my mom who has #Alzheimers. Read this blog about the instersection of 3 pandemics.  We must address &amp; invest to eliminate the disparities among people of color. https://t.co/uQZY0BxrBJ
150,"Need help with the #Census? Have a question? #2020Census Parade coming your way tomorrow!  #WearAMask and #BeCounted. #HagaseContar
 
➡️@SouthGateCAgov around 12:20pm - 4635 Firestone Blvd
➡️@MyLynwoodCA around 12:45pm - 11330 Bullis Rd https://t.co/OfOFwadseB"
151,"Our Latino communities have been hit hard by #COVID19. Every day of inaction has life or death consequences.

10 weeks ago @HouseDemocrats voted for $$ for #testing, tracing, treatment, to continue $600 #unemployment benefits, and another $1,200 payment. https://t.co/nOcVlfjpbE"
152,"Dr. Fauci addresses Congress today, saying there's no end in sight to the pandemic.

US #COVID19 cases are rising, including in my community. Each million-case mark has arrived faster than the last. We need a Ntl Strategy to reverse this deadly trend. #ForThePeople #FauciHearing https://t.co/xgxssSMQcT"
153,"Things are happening fast in D.C. and I want to keep you informed.
 
Join my Telephone #TownHall this Tuesday 8/4 at 6:45PM PDT to get the latest updates on #COVID19 relief and much more.
 
Register at: https://t.co/xNSVikHK3w #CA44 https://t.co/gfGTmShlCj"
154,"Honored to preside over the House today. Wore my butterfly mask to celebrate &amp; show support for #DREAMERS and our #immigrant communities.
 
Today we advanced several important amendments, including mine to increase access to #SolarEnergy for underserved communities. #ForThePeople https://t.co/Uf52eEqTvz"
155,"150,000 dead is a travesty.
 
President Trump’s #COVID19 response is as much a disaster as the pandemic.
https://t.co/LEuMvlw7Zl"
156,"In the Capitol and in all public spaces I always #WearAMask. I hope you will too.

#OnWednesdaysWeWearPinkMasks https://t.co/IN81vwJA2f"
157,"This bill will make it easier for disadvantaged communities to address flooding in a way that improves our environment and our public health. 
 
Our communities will be stronger, built to last, and better prepared for the future.
 
Proud to speak in support of #WRDA today. https://t.co/d9EmYAgmp7"
158,"Knowledge is power. Acting on the data from the Public Health Air Quality Act, we can – and must – fight for #EnvironmentalJustice in #frontline communities.

Proud to join @RepLBR, @SenDuckworth and other EJ leaders on this legislation.
https://t.co/ZMwGqKSZuh"
159,"#PublicHealth is influenced by the social determinants of health: things like healthy food, safe housing or exposure to environmental toxins.
 
Spoke with @blkwomenshealth’s @lindagblount on how investing in social determinants can boost public health in underserved communities. https://t.co/4rKDLR1ER7"
160,"Everyone deserves to be safe at work.

This MUST be true in the halls of Congress, especially during a pandemic.

I am outraged to hear that some Republican members are forcing their staff to work without masks. These actions puts the lives of their staff, &amp; many others, at risk."
161,"Latino communities have been hit hard by #COVID19. That’s why I’m glad there's a new, FREE drive-thru test site in South Gate. Appts at https://t.co/tBbnnhAIzd

We need more testing, tracing and treatment.

The Senate must pass the #HeroesAct to ⬆️ testing &amp; tracing #ForthePeople https://t.co/HOCZi2HP99"
162,"To keep our communities safe and healthy, we need equitable investments in our nation’s ports, waterways, flood protection, ecosystem restoration &amp; green infrastructure. 

That’s why I’m speaking on the floor today in support of #WRDA. #ForThePeople
 
🎥 https://t.co/ZefVYSAB6h"
163,"As our economy &amp; communities grapple with #COVID19, #SNAP is a critical tool to fight food insecurity. Especially for communities of color
 
The Republican plan supports fancy lunches &amp; dinners for big business but abandons working people as they struggle to put food on the table https://t.co/Y3ZXi6TEue"
164,"@JakeSherman @mkraju I wish @RepLouieGohmert a speedy recovery.

I also wish that he had been wearing a mask to protect everyone around him.

I #WearAMask to be a role model, #StopTheSpread and because I know my actions save lives.

Wearing a mask should be mandatory on Capitol Hill. End of story."
165,"No matter your zipcode, we all deserve clean, safe drinking water.
 
Spoke with @MaeNRDC of the @NRDC about the way we can make and fix policy to put people and #publichealth first, not polluters and profit.
 
@EnergyCommerce #PeopleNotPolluters #ForThePeople https://t.co/35yDfOAZfO"
166,"Extreme heat is a #climatejustice issue.

In a warming world, Black, Latino &amp; Indigenous communities in the US will suffer disproportionately.
 
We must cut emissions, use green infrastructure, &amp; invest in public health.
 
#ActOnClimate #ForThePeople https://t.co/vvty8GzrUC"
167,"Today is National #VoteByMail Day &amp; AG Barr is testifying before @HouseJudiciary.

He and the President are spreading disinformation to discourage mail-in ballots during #COVID19

The American public needs to know why they're playing fast &amp; loose with facts and our right to vote. https://t.co/7tDTD029Id"
168,"#COVID19 has hit our community hard. Today, sadly, it hits home once again.
 
My thoughts are with Mayor @RobertGarciaLB and family on the loss of your beautiful mom Gaby, a dedicated healthcare worker.
 
We can honor her by protecting our #frontlineworkers and eachother. #MaskUp https://t.co/LL8PZCA8V4"
169,Wear a mask. https://t.co/xB825mX068
170,"In the midst of #COVID19, climate crisis &amp; a call for #RacialJustice, @realdonaldtrump is prioritizing polluters over people.

Proud to join Rep. @Ilhan &amp; @SenSanders to introduce the #EndPolluterWelfareAct to refocus the work of gvmt back to the people. #ReWINDAct #ClimateFriday https://t.co/zs0tWmi0Gj"
171,"As we celebrate #ADA30, we must keep working the major challenges people with disabilities still face in our communities. 
 
From eliminating barriers to employment to #affordable healthcare, we must keep fighting for the true, inclusive vision of the #ADA. #ForThePeople https://t.co/KJG4PtCRYk"
172,"#COVID19 testing sites in @LongBeachCity have changed their hours to boost capacity.

#WearAMask #StaySafe https://t.co/u2Jzj9p62e"
173,"Jobless rates are up. #COVID19 cases are up. In #CA44, about 1 in 4 people are unemployed. 

Yet the GOP has blocked critical relief funds &amp; enhanced #Unemployment for months. 

The duty of Gvmt is to help the people. GOP Senators seem to have forgotten.
https://t.co/bYegZZyRfM"
174,"@2UrbanGirls @AOC .@senatemajldr could fix this today, but he's stalling on the #HeroesAct, which passed the House weeks ago &amp; extends/expands #unemployment. I've heard from many constituents who depend on the Fed UI funds to make it through this tough time. I'm pushing for additional support ASAP"
175,"No Congressional Baseball Game this year, but grateful it’s #OpeningDay for my home team the @Dodgers. @MLB #BaseballisBack

Pictured here pre #COVID19 with fellow #Dodgers fan @RepGilCisneros and @Twins fan @RepDeanPhillips. https://t.co/ro9AI8TuyS"
176,"California is #1 in a lot of things. We don’t want to be #1 in #COVID19 cases.
 
Even though the virus has been a part of our lives for a few months, it’s more important than ever to #WearAMask, #StayHome and #SlowTheSpread.
 
#YourActionsSaveLives
https://t.co/4qlrfFK8HF"
177,".@MLB #BaseballIsBack (with #COVID19 protocols and protections)!
 
Even as we’re apart and #SocialDistancing, sports bring our community together.
 
It’s time for @Dodgers Baseball, let’s play ball! https://t.co/xQoYddsAit"
178,"RT @RepBarragan: The @HomelandDems Committee meets today for a hearing on the worsening #COVID19 pandemic. 

I’ll be asking the @FEMA admin…"
179,"No one should have to choose between their jobs and their health. 

Many Latinos and immigrants are working on the #frontlines to keep our country running. 

We owe stronger protections to #frontlineworkers. https://t.co/miVzBxwjq8"
180,"The @HomelandDems Committee meets today for a hearing on the worsening #COVID19 pandemic. 

I’ll be asking the @FEMA administrator about safety procedures, PPE and testing in case of a natural disaster.

Watch live: https://t.co/C8GTpWCtvc"
181,"#VoteByMail is safe and secure. 
 
@realDonaldTrump’s attempts to mislead the American public on this are not based on facts. They are dangerous and misguided.
 
It is #VoterSuppression during the #COVID19 pandemic. https://t.co/Xn5iD0tQxl"
182,@BresPolitico Maybe they haven’t seen the President’s tweet today calling masks patriotic? 🤔
183,"Young or old, ANYONE can contract #COVID19.
 
The majority of @CountyofLA’s #COVID19 surge is fueled by cases of infected people under age 41.
 
Everyone needs to #WearAMask &amp; practice #SocialDistancing. This is how we protect our community and #SaveLives.
https://t.co/An5MfQUidP"
184,"#TeamBarragan at the Dignity Health Sports Park food drive in Carson. 

Thank you to @LAFoodBank and all the volunteers who made this event happen. #CA44 https://t.co/CTA6if9RjX"
185,"ICYMI yesterday's #WellnessWebinar, you can now watch it online. 

Thank you to @LACDMH, NAMI – Los Angeles South Central Affiliate &amp; Niruby’s Positive Energy for your presentations. 

#MentalHealthMatters #CA44 https://t.co/9aQFH0qqOb"
186,"Mental health disparities are rising as many communities of color face greater uncertainty over health, money &amp; their futures during #COVID19
 
We can address these inequalities &amp; strengthen our #mentalhealth systems. We can pass #HEAA2020 @HispanicCaucus
https://t.co/nxJkHDUFYu"
187,"#RBG has been a fighter for decades and she won’t stop now. 

Wishing Justice Ginsberg good health and a speedy recovery. #NotoriousRBG https://t.co/SakuHIXjKd"
188,Everyone deserves to be safe from #COVID19 in the workplace. https://t.co/QVBYabHzKc
189,Starting now! Watch live: https://t.co/UUkv1hYaQ1 #WellnessWebinar #MentalHealthMatters #EndTheStigma https://t.co/RDJ7pI623Z
190,"@washingtonpost Thanks but we’ll stick with scientists and health experts who actually know what they’re talking about. 

Glad @LASchools doesn’t take their cues from @PressSec and took science and health and safety of kids and teachers into account."
191,Free grab 'n go lunches in #Wilmington this week! #WearAMask #CA44 https://t.co/etSD05ctTJ
192,".@realdonaldtrump: this is what autocracy looks like.
 
Hiding, politicizing and potentially manipulating data during a public health crisis is extremely disturbing.
 
We need data #transparency, now more than ever.
https://t.co/KPZh4ldfaj"
193,"#NEPA is a critical #CivilRights tool.
 
We need the government to lift us up, not make us an afterthought in decisions that affect our neighborhoods &amp; the health of our families.
 
The Trump Admin is trying to rob us of our voice, but we won’t be silenced. #EnvironmentalJustice https://t.co/NUDUhxiZ4K"
194,Thank you to constituents like Cassidy and Professor Bostick who called my office to share their concerns on this issue. Keep calling – it’s working! #CA44
195,"Who’s at risk for #COVID19?

Everyone. https://t.co/CGviEacnF6"
196,"Mr. @SecBrouillette, instead of focusing on bailing out the fossil fuel industry, how about helping our communities of color? #EnvironmentalRacism is real. It's killing our black and brown communities, and moreso now with #Covid19. Watch this video. #environmentalracism explained https://t.co/CyouHsqw5m"
197,"#Ozone pollution is a health hazard, especially for the 24.8m Americans with #asthma.
 
@EPAAWheeler is ignoring the evidence that stronger standards would save lives &amp; improve public health, especially in Black &amp; Latino communities. #EnvironmentalJustice https://t.co/rLaqMTZWgF"
198,"When you look at the facts, it is crystal clear that the Trump Administration has failed in the response to #COVID19.
 
The GOP and the President’s staff can defend him all day, but facts are facts: 135,000+ Americans are dead, worst in the world. @HomelandDems https://t.co/1N8lDtKPuj"
199,"Department of @Energy @SecBrouillette doesn’t know what Environmental Racism is.
 
Asked about #EnvironmentalJustice or injustices, he started talking about consumer pricing. 

No mention of pollution or harmful health effects for communities of color or #frontline communities.🤦 https://t.co/KKPAd8CUzv"
200,RT @RepBarragan: Today @EnergyCommerce will hear from Department of Energy’s @SecBrouillette on oversight of the department during #COVID19…
201,"RT @RepBarragan: #COVID19 is an emergency.
 
And yet, in a time of crisis for Americans the Trump Admin response has been incompetent, inco…"
202,"Fed’l courts &amp; DHS have found @ICEgov’s private detention centers often fail to provide detainees with basic protections &amp; care, increasing risk of #COVID19.
 
Yet GEO detention contractor CEO claims his facilities are exceeding expectations. Does he not know? Or is he in denial? https://t.co/3xIBeLTONe"
203,"#COVID19 is an emergency.
 
And yet, in a time of crisis for Americans the Trump Admin response has been incompetent, incoherent, uncoordinated, and ineffective.
 
Watch @HomelandDems live to hear the committee’s discussion on #COVID19 preparedness &amp; response. https://t.co/wR8RbBoiZD"
204,"Today @EnergyCommerce will hear from Department of Energy’s @SecBrouillette on oversight of the department during #COVID19.
 
We’ll discuss, jobs, the #ClimateCrisis, #PublicHealth, #EnvironmentalJustice and more.

Tune in:⤵️ https://t.co/6S9R5PQznk"
205,"No one should have to choose between paying rent and putting food on the table, especially during #COVID19.
 
Apply between now and Friday, 7/17 at 11:59PM for up to $2,000 in #RentalAssistance.
 
➡️https://t.co/iZ7pn8Zjrp 
📞(844) 944-1868 https://t.co/HQZnjNhCs8"
206,"RT @GavinNewsom: NEW: #COVID19 cases continue to spread at alarming rates.
 
CA is now closing indoor operations STATEWIDE for:

-Restauran…"
207,"The @HispanicCaucus has requested to meet with the two largest operators of @ICEgov's private detention facilities.

Both have had #COVID19 outbreaks in their facilities.

Today, we'll hear from them in @HomelandDems. We need answers. 

Watch 2pm EST/11 AM PST: https://t.co/Xq8O8f5iUw"
