,Tweet
199,Joined my colleagues today in introducing the bipartisan SMART Act to provide funding to states &amp; small communities facing severe revenue shortages because of COVID-19. Michigan and other states need support to help keep front line workers &amp; essential services going. #MI06 https://t.co/2ZooWbOJm1
200,"Starting the week off on @1077RKR for our weekly radio interview to discuss the coronavirus and what the Congress needs to do next to help workers and families.

Tune in at 7 AM ➡️ https://t.co/YxThxGePMU #MI06 #InItTogether https://t.co/ms9FVKoZhM"
201,May is Military Appreciation Month &amp; we honor those who have answered the call to serve our nation at home &amp; abroad. Many have made the ultimate sacrifice so that we can enjoy the freedoms we hold so dear as Americans. Lest we never forget them &amp; their families. 🇺🇸 #MI06 https://t.co/2MVTXFrIat
202,Lots of feedback on my experience yesterday on @AmericanAir where flight attendant and passengers were not wearing masks. We can't go back to business as usual while many are still getting and dying from this virus. Be safe or stay home. Masks help. https://t.co/Lpl9hCHWYr
203,".@CDCgov has some great info on how to wear, clean, &amp; make face coverings to protect your health and those around you. Wearing a mask can be a matter of life or death for some folks, so be sure to check out these step-by-step instructions here: https://t.co/uyfkdYdK4g #MI06"
204,"Waiting to board my flight to DC, &amp; unfortunately, several folks are not wearing masks on the plane. Flight attendant was not either. While we're all eager to get back to 'normal,' we must continue to remain vigilant. Please. Let's all do our part to protect ourselves &amp; others. https://t.co/uE8jBCg2pb"
205,"During National Police Week, we salute the brave men &amp; women who put their lives on the line every day to protect our communities &amp; honor those who have made the ultimate sacrifice. Thank you for all that you do to keep us safe at home in SW MI &amp; across the country. #MI06 https://t.co/LQMEbCOzE0"
206,RT @MICHauto: Thank you to Michigan's congressional leadership for their proactive support of the state's signature industry amid #COVID19.…
207,"Important news ➡️ through its COVID-19 Telehealth Program, the @FCC has allocated $37K for Community Healing Centers of Kzoo to conduct substance abuse &amp; mental health treatment via video call while folks are home during the coronavirus crisis. #MI06 #InItTogether"
208,"This week is National Hospital Week - a heartfelt thank you to our hospitals, health systems, &amp; health care workers on the front lines of this crisis. We're so grateful for all you're doing to save lives &amp; defeat this vicious virus. We're behind you 100%! #InItTogether #MI06 https://t.co/ee84LOD0Z1"
209,"Last week, @ProbSolveCaucus zoomed w/ @SpeakerPelosi on future COVID relief &amp; I told her that w/ divided govt, any proposal must be bipartisan if it is expected to become law. That does not appear to have happened. We need to come together on solutions! #MI06"
210,"Joined a bipartisan group of lawmakers in urging leadership to support the auto industry in future COVID relief packages. Michigan is the auto state &amp; it's critical that we protect jobs, preserve supply chains, and support manufacturing in the USA. #MI06 https://t.co/gPiykU6ysA https://t.co/3LGxw6JEeC"
211,"🚨🚨Coming up at 8 AM 🚨🚨

@RepDebDingell &amp; I will be on @SquawkCNBC 📺 to discuss our bipartisan efforts to support Michigan’s auto industry during the coronavirus crisis. Hope you can watch! 🇺🇸 #MI06 #InItTogether https://t.co/XXK3brv1Xe"
212,"Tuesday conversation with @gstevensholland on @1450whtc coming up at 7:15. Will be talking with him about the latest on #MI06’s health and economic recovery efforts, support for Michigan’s auto industry, + more. Hope you can listen ➡️ https://t.co/kXvRSla4Fi 🇺🇸📻🎙 https://t.co/9Nj5zAa0A7"
213,Full day. Joined an E&amp;C meeting w/ @FTC Commissioner on price gouging laws and scams consumers should be aware of. Also had discussions on telehealth initiatives in 21st Century Cures &amp; spoke w/ colleagues about phase IV relief package. Back at it tomorrow! #MI06
214,I'll be on @SquawkCNBC tomorrow at 8 AM w/ my colleague @RepDebDingell to discuss the bipartisan auto letter we're sending to House Leadership tomorrow urging Congress to support the auto industry in future coronavirus relief packages. Be sure to tune in tomorrow at 8 AM! #MI06 https://t.co/sCmFdNjqFg
215,"ICYMI: 4 community health centers in #MI06 will receive $1.7M in funding for COVID testing. We know more robust testing is the key to safely reopening our country, &amp; I want to thank all the front line workers who are doing so much to keep us healthy. https://t.co/ChtmKraFgT"
216,"Starting the week off with my weekly interview on @1077RKR coming up at 7 AM. Will discuss the latest on the coronavirus crisis and what’s next as we continue to work to keep folks safe.

Listen live ➡️ https://t.co/YxThxGePMU #MI06 📻🎙🇺🇸 https://t.co/Z1JvJI7RPF"
217,"May is Mental Health Awareness Month &amp; now more than ever, we all need to monitor our mental health &amp; reach out to the most vulnerable in our communities. I know that as long as we have each other's backs &amp; check in often, we are going to overcome this crisis. #InItTogether #MI06 https://t.co/Gapqwkujq1"
218,"Full day. Joined @RepDebDingell in sending a letter to @HHS about the distribution of remdesivir. Also spoke w/ @ProbSolveCaucus about state &amp; local aid for COVID expenditures in a Phase 4 relief bill. With divided govt, this legislation MUST be bipartisan to become law. #MI06 https://t.co/z7IW4baBwf"
219,"Welcome news to report! @FEMA is shipping 90,000 gloves, masks, &amp; other PPE to nursing homes in SW MI to aid w/ their coronavirus response. These resources will help protect the most vulnerable, &amp; I will continue to work to secure more PPE for #MI06. https://t.co/MfPUGmdgHD"
220,"Busy day today. Spoke w/ @ahcancal about the coronavirus response in nursing homes, zoomed w/ an 8th grade class from Paw Paw to answer a number of their great questions, &amp; spoke on the “virtual” House floor w/ @ProbSolveCaucus about the Phase 4 relief bill. More tomorrow! #MI06 https://t.co/7YV2WGAeos"
221,"Joined @WKARnews to discuss a number of issues. We talked about our Cures 2.0 effort, the importance of the #PPP, and how we balance reopening our economy while protecting folks' health. You can find the entire interview here: https://t.co/thgksT8awA"
222,".@HHSGov will provide an additional $1.7M to 4 community health centers in SW MI to expand COVID-19 testing. We know we need to test more folks to better protect public health, &amp; community health centers are on the front lines to help us do just that.#MI06 https://t.co/wvmWVUBBQI"
223,This week is Nurses Appreciation Week - our nation's nurses are on the front lines day and night fighting this invisible enemy &amp; we're so grateful for all their hard work. A heartfelt thank you for all that you do to keep us safe &amp; healthy during this time. #InItTogether #MI06 https://t.co/2zALB7cP7s
224,"RT @HouseCommerce: The #COVID19 pandemic may be causing extra stress for you or a loved one #MentalHealthAwarenessMonth
 
You are not alone…"
225,China up to this point has stonewalled investigations looking at what may be the origins of this pandemic. We’re going to need these answers. Hear more of today’s interview with @1450WHTC: https://t.co/8oBtcCh9Zd https://t.co/jJlB1D1Ut1
226,Yesterday we announced that @FEMA was providing more than $323K from the CARES Act to support orgs that are helping the homeless and hungry in #MI06 during the coronavirus crisis. Learn more here: https://t.co/XHZX7kHnFd #InItTogether @WSBT https://t.co/T6L05HnB2V
227,"Coming up at 8:15 ➡️ my weekly chat with @gstevensholland on @1450whtc. Lots to discuss, including the latest on COVID-19 and what’s next as we look to safely reopen the nation. Hope you can tune in: https://t.co/kXvRSla4Fi #MI06 #InItTogether 📻🎙🇺🇸 https://t.co/HeIfD2R9O8"
228,Full day. Joined @ProbSolveCaucus on a call w/ former Treasury Secretary Paulson about the economic road to recovery. Also shared my sorrow w/ @RepDanKildee upon hearing a Dollar Store employee was killed in Flint after asking a patron to wear a mask. This breaks our hearts.
229,".@fema announced today it will allocate more than $323K to orgs in #MI06 that are helping the homeless &amp; hungry during COVID-19. Our hungry &amp; homeless populations are facing real challenges, &amp; I'm glad to see this funding from the CARES Act go to those most in need. #InItTogether"
230,"During this difficult time, several charities &amp; organizations in St. Joe County are hosting food drives for families in need across #MI06. Here is a list of events provided by the St. Joseph County Human Services Commission to assist with the coronavirus response. #InItTogether https://t.co/gnpatQqxf0"
231,"Live at 7 AM ➡️ my weekly radio interview with @1077RKR. Will be discussing the latest on the coronavirus crisis and where do we go from here. Health &amp; safety remain #1 priority as we look at safely reopening our state.

Tune in: https://t.co/YxThxGePMU #MI06 🇺🇸📻🎙 https://t.co/qNRwQlbi1R"
232,"Our nation's doctors, nurses, health care workers, first responders, &amp; public safety officers are real heroes. They put their lives on the line every day to save countless more &amp; we're all so grateful for everything they're doing to keep us safe &amp; healthy. #InItTogether #MI06 https://t.co/mRrsjJika2"
233,"Our small biz have been hit hard by this vicious virus. If you can, be sure to support your local businesses &amp; restaurants by ordering takeout, shopping online, &amp; buying gift cards. Small biz is the heart &amp; soul of our communities so let's have their backs. #InItTogether #MI06 https://t.co/jLpQzsBy50"
234,"Another busy day! Joined a call w/ @UMich Dr. Marcia Eisenberg on ""flattening the curve,"" attended a virtual @EnergyCommerce hearing w/ the CDC Dep. Dir., spoke w/ @AHLA &amp; @WeRRestaurants about the #PPP, &amp; discussed state &amp; local funding w/ @ProbSolveCaucus. More tomorrow! #MI06 https://t.co/2o2lys0JFl"
235,"So glad Congress passed additional funding for small biz, hospitals, &amp; coronavirus testing. I've made it clear from the beginning - the #PPP should never have been allowed to run dry &amp; I will fight to make sure it never does again so long as small biz needs this relief. #MI06 https://t.co/dBl7AVnMiy"
236,"Some PPE numbers for MI - @fema &amp; @HHSGov have delivered 2.1M N95 masks, 740K surgical masks, 309K face shields, 121K surgical gowns, 3.9K coveralls, &amp; 719K gloves to our state. We must continue to get PPE to health care &amp; all front line workers. #MI06 #InItTogether"
237,Lots of calls yesterday! Joined the MI congressional delegation on separate calls w/ @Ford's CEO &amp; then the @MIHospitalAssoc. Then I joined community leaders on a @swmfirst call. Also a # of calls on the status of the development of a vaccine. A busy morning again today! #MI06 https://t.co/aHAegnM8mI
238,"RT @CDCgov: Everyone can help prevent spread of #COVID19. Clara, the #Coronavirus Self-Checker, can help you decide when to call your docto…"
239,Joined #TheHillVirtuallyLive with @SCClemons to discuss how the coronavirus crisis is impacting seniors. We also discussed the bipartisan 21st Century Cures 2.0 effort and what the next steps are for our nation as we battle the coronavirus crisis. #MI06 https://t.co/yWV795YKJU
240,".@RepDianaDeGette &amp; I led a bipartisan letter to leadership urging Congress to include $26B in the next relief package for scientific &amp; medical researchers - who are essential to help protect public health, nat'l security, econ growth, &amp; int'l competitiveness. 🇺🇸 #MI06 https://t.co/xH69ynZrJ8"
241,"RT @SocialSecurity: Act by May 5, 2020! @IRSnews issues new guidance about #COVID19 Economic Impact Payments for Supplemental Security Inco…"
242,Veterans w/ dependents who do not file tax returns or Student Veterans who use the GI Bill have until May 5 to provide their info to the IRS to receive their $500 per dependent. Visit the IRS' non-filers portal to do so https://t.co/tclnVFHU2f #MI06
243,Today is #NationalSuperheroDay &amp; this year we salute the real heroes around us - our health care workers &amp; all those on the front lines of this crisis. These folks deserve our utmost appreciation &amp; we’re all so grateful for their hard work during this time. #InItTogether #MI06 https://t.co/islHTFvtMY
244,"Highlighted @RepDianaDeGette's and my Cures 2.0 effort during my weekly radio show on @1450whtc. Our world today faces the worst public health crisis in more than a century, and Cures 2.0 offers hope for today’s pandemic and tomorrow’s challenges. #MI06 #InItTogether https://t.co/jnnc0lLhJZ"
245,Good news → 9 public housing agencies across SW MI will receive nearly $550K to assist in responding to the coronavirus crisis. These funds will directly help folks in need &amp; help better protect our families &amp; communities. #InItTogether #MI06 https://t.co/6kMDOrr3rv
246,RT @HouseVetAffairs: 🚨🚨🚨 ATTENTION #Veterans: The @IRSnews just announced that the deadline for eligible veterans and/or students who use t…
247,"Talked w/ @RickAlbinWoodTV about the value of working together with both parties to get things done - especially during the worst public health crisis in more than a century. If we're going to get through this, we need to come together. #MI06 #InItTogether https://t.co/xfBWIksnTP"
248,"Weekly interview with @1077RKR coming up at 7 AM. Together we will get past the coronavirus crisis, but we need to continue to limit person to person contact. Will also discuss ideas for starting to safely reopen our state &amp; nation. Tune in: https://t.co/YxThxGePMU #MI06 https://t.co/dxMpCcB1ws"
249,"RT @CDCgov: If you have symptoms of #COVID19 and want to get tested, call your doctor first. Also check with your state or local health dep…"
250,"RT @CDCgov: Wearing a cloth face covering CORRECTLY can help prevent the spread of #COVID19 to others. When you go out on essential trips,…"
251,"Tune in now to @WOODTV to watch ""To the Point"" - chatting with @RickAlbinWoodTV about #PPP funding, @GovWhitmer's exec order, &amp; @RepDianaDeGette's &amp; my ""Cures 2.0"" legislation &amp; how it can help w/ today's pandemic. Will be announcing more about it tomorow. #MI06 #InItTogether https://t.co/WcVhvrmhHj"
252,We're the Great Lakes State &amp; boating is a way of life for so many. Glad to see @GovWhitmer was on board w/ our suggestion to relax restrictions on motorized boating - while folks still follow CDC social distancing guidelines &amp; stay safe. Full steam ahead for MI boaters! #MI06 https://t.co/HrGjz1qX3n
253,"Cast my YES vote for more funding for the #PPP, our hospitals, &amp; coronavirus testing, providing additional support for our small businesses &amp; health care heroes across SW MI and around the country. We cannot allow PPP funding to expire again. 🇺🇸 #MI06"
254,I’ve sent a letter to @GovWhitmer urging her to relax her restrictions on motorized boating in MI. It can be done safely and responsibly while following social distancing &amp; the CDC’s guidelines. We can enjoy the outdoors with minimal risk. #MI06 https://t.co/FaWxA0wqN1
255,Headed to the House floor now to vote NO on the Select Subcommittee on the Coronavirus Crisis. We already have plenty of committees with relevant jurisdiction to provide proper oversight over our coronavirus response. Let’s get on with the people’s business. #MI06 https://t.co/LtsVBWb5aA
256,"Getting ready to board my flight from Detroit to D.C. to vote in support of much-needed relief for small businesses, hospitals, &amp; expanded coronavirus testing. Folks are counting on this bipartisan legislation to get across the finish line - let’s make it happen. 🇺🇸 #MI06 https://t.co/NW36WDfsr0"
257,I'm glad that Congress has reached an agreement to replenish #PPP loans &amp; provide funding for hospitals &amp; testing. The #PPP is a vital lifeline for small biz &amp; we can’t risk letting it run dry again. Headed to DC tomorrow to get it across the finish line #InItTogether #MI06 🇺🇸
258,ICYMI: I spoke w/ Gary Stevens this morning on @1450whtc to discuss a number of issues in our fight to defeat the coronavirus. Be sure to tune in every Tuesday morning to keep up with what I'm doing in Congress. #MI06 https://t.co/nbbxbrKTIE
259,Folks who are social security beneficiaries w/ dependents &amp; do not file tax returns have until TOMORROW to provide their info to the IRS to receive $500 child payments. Visit the IRS’ non-filers portal to do so https://t.co/tclnVFqiDF
260,"Today, I joined my @ProbSolveCaucus colleagues in releasing our Reopening &amp; Recovery “Back to Work” Checklist. This is a bipartisan, science-based approach to protect folks’ health, reignite our economy, &amp; reopen America. Let's get it done.https://t.co/frcT0HEqnn"
261,"ON LIVE at 7 AM -&gt; joining @1077RKR for our weekly interview on the coronavirus crisis. Will discuss the latest on PPP, efforts to get PPE to health care workers, &amp; next steps to protect jobs &amp; public health.

Tune in: https://t.co/YxThxGePMU

#MI06 #InItTogether 🇺🇸🎙📻 https://t.co/rZhjvgLYJp"
262,ICYMI: Folks at @SHLakeland and all our health care workers are the real heroes. The spirit of our community has always been about working together for the common good of all. #MI06 #InItTogether https://t.co/GW3cl3bpG6
263,"The coronavirus crisis has opened our eyes to the real heroes among us, &amp; the @USPS is no exception. These folks are braving the elements and delivering mail across the country, &amp; I want to sincerely thank them for all that they’re doing to keep us connected. #InItTogether #MI06"
264,"This critical shipment of med supplies contained tens of thousands of medical masks, gloves, thermometers, and hospital gowns. These supplies will greatly help protect both patients &amp; health care providers &amp; help fight the spread of COVID-19 in SW MI. #InItTogether #MI06 https://t.co/OD17RfCCkO"
265,Pleased to work with @WhirlpoolCorp to help acquire a large shipment of medical supplies for @SHLakeland and their health care staff in St. Joe. The spirit of our community has always been about working together for the common good of all! #InItTogether #MI06 https://t.co/MCM2QxfnMS
266,"Yesterday was a busy one. I joined a bipartisan MI delegation call w/ @GovWhitmer, spoke w/ a number of community health centers in SW MI, &amp; discussed an update to 21st Century Cures w/ @ScottGottliebMD &amp; @RepDianaDeGette. Still much to do! #MI06 https://t.co/AH17AbR9mo"
267,"We all need to come together during this time. I’m reminded of a quote by Henry Ford: “Coming together is a beginning; keeping together is progress; working together is success.”

We’re all looking for the lighthouse &amp; the safe harbor from this pandemic. #InItTogether #MI06 https://t.co/edP7414q2B"
268,"Joined a large bipartisan group of members in sending a letter to @SecretarySonny requesting coronavirus relief funding for specialty crop growers. These folks are facing real hardship, and I will continue to support our farmers &amp; growers in SW MI #MI06 https://t.co/oqDF1RZZiP"
269,"Joining State Rep. Beth Griffin's teletown hall tonight for a little bit to provide an update on our continued efforts to keep folks safe and to get relief for workers, families, &amp; small businesses during the coronavirus crisis. Hope you can join us. #MI06 https://t.co/NxtpJqqPT1"
270,"ICYMI: Sent a letter to Governor Whitmer along with my other colleagues from Michigan, expressing our concerns with her most recent executive order. We wanted to suggest some alternatives while still protecting public health &amp; safety. We're all #InItTogether! #MI06 https://t.co/ueonLbK3pJ"
271,Joined my colleagues in sending a letter to @GovWhitmer to express our concerns w/ her most recent executive order. We believe amending this order can achieve our shared goal of protecting public health while also beginning the slow process of resuscitating our economy. #MI06 https://t.co/nAEzd2AWqZ
272,"RT @CDCgov: Protect yourself from #COVID19: call-in prescriptions ahead of time and use drive-thru windows, curbside services, mail-order o…"
273,RT @CDCgov: Growing evidence suggests #COVID19 can spread before people show symptoms (pre-symptomatic) and from people who have #coronavir…
274,"RT @RepPaulMitchell: Gov. Whitmer’s expanded “Stay Home, Stay Safe” order is more restrictive than CDC guidance. We can still prioritize pu…"
275,"For those individuals or families struggling with feelings of loneliness or isolation during the coronavirus crisis, several resources are available to help. One is the @SalvationArmyUS hotline: 844-458-HOPE (4673)

https://t.co/pkgmqjA7Jz #MI06 #InItTogether"
276,"LIVE at 7 AM -&gt; joining @1077RKR for our weekly convo to discuss the latest on the coronavirus crisis and what I'll be working on this week to help protect the well-being of workers, families, and businesses in SW MI.

Tune in: https://t.co/YxThxGePMU

#MI06 #InItTogether 🇺🇸🎙📻 https://t.co/BW0qIKZrCn"
277,RT @WSBT: BREAKING: PLEASE PASS THIS ON! A new drive-thru coronavirus testing site will open this week in Benton Harbor. At InterCare Commu…
278,RT @MIHospitalAssoc: Michigan Congressional Delegation Urges Support for Hospitals; MHA Applauds Michigan House Members for Leadership #COV…
279,"Heard that coronavirus tests headed to Bronson Hospital in Kzoo were being held up, so our office made a few phone calls to track them down. Just now, 1,000 Cepheid tests were delivered! So important as our community continues responding to this health crisis #MI06 #InItTogether"
280,"Up next - calling in to talk with @BMontgomeryWSBT LIVE on @WSBT about the latest on the coronavirus. 

Hope you can watch: https://t.co/Y0aK9iqYx9 #MI06 #InItTogether https://t.co/jTa1atncZ3"
281,"Chatting with @LoraPainterWWMT this morning at 6:05 AM LIVE on @wwmtnews. Updating her on our efforts to get more PPE to health care workers &amp; those on the front lines, and what's next with the #PaycheckProtectionProgram. 

Watch live: https://t.co/kYXU4cPN26 #MI06 #InItTogether https://t.co/7RW2sidDZC"
282,"Chatting with @wwmtnews and @WSBT tomorrow live during the 6 AM morning news about the coronavirus, getting health care workers and those on the front lines PPE, and helping small businesses. Hope you can tune in! 📺🇺🇸 #MI06 #InItTogether"
283,RT @Surgeon_General: .@CDCgov issued new guidance for essential critical workers. Do you fall into this category? Find out what you need to…
284,RT @CDCgov: NEW: There have been numerous #COVID19 outbreaks on recent cruise ship voyages. @CDCDirector has extended the previous No Sail…
285,RT @CDCgov: Do you have friends or family who need #COVID19 information in a different language? CDC’s COVID-19 website has options in Span…
286,RT @RepSlotkin: Another big Michigan contribution to the fight against #COVID19: @michiganstateu is seeking FDA approval for a process to h…
287,"RT @LSJNews: Slotkin, Upton urge FDA to review MSU decontamination of N95 masks during coronavirus pandemic https://t.co/zLFOqrCBcW"
288,RT @CDCgov: It’s National Public Health Week. There has never been a more fitting time to acknowledge the work of public health and healthc…
289,"Spoke on a conference call w/ @VP, @stevenmnuchin1, @SeemaCMS, Dr. Fauci + more about small biz PPP &amp; PPE for health care workers. 

Speaking tomorrow w/ the @US_FDA about @RepSlotkin &amp; @michiganstateu's proposal to cleanse PPE for health care workers - very promising! #MI06 https://t.co/G6NKarmbAD"
290,"If you missed our teletown hall on the coronavirus w/ @BerrienCountyMI Sheriff Paul Bailey &amp; Health Officer Nicki Britten, you can listen to the recording here: https://t.co/UNfcgzzqcd 

If you have any questions or need assistance, please contact my office. #MI06 #InItTogether"
291,"RT @MichiganHHS: Have a hand in the health of Michigan ✋. Stay home. Stay safe. And if you must go out, wear a mask. #MiMaskChallenge https…"
292,RT @DetroitChamber: Join today at 1 p.m. @RepFredUpton will discuss the federal response to #COVID19 and more. Register now: https://t.co/y…
293,"BIG -&gt; The CARES Act is providing nearly $4 million to local health centers in #MI06. 

Community Health Centers serve the most vulnerable &amp; these funds will literally help keep the doors open &amp; staff working during the coronavirus crisis.  #InItTogether https://t.co/a8HLPDsiHl"
294,"My office put together a helpful resource guide for families, workers, and small businesses impacted by the coronavirus crisis. 

If you need assistance, you can always call or email us too. We are all #InItTogether! 

https://t.co/zcZ6qlugZt #MI06"
295,"We're getting ready for this afternoon's teletown hall on the coronavirus. 

If you'd like to join, you can dial 877-228-2184 and then enter 119136#

#MI06 #InItTogether https://t.co/qdr8sbOFtl"
296,"Talked with @1450whtc this morning about the need to get more personal protective equipment to our health care workers and everyone on the front lines.

This is an urgent priority for everyone in the Michigan Congressional Delegation. #MI06 #InItTogether https://t.co/6F6YX1u4aG"
297,"If you'd like to call in to today's teletown hall meeting at 2:50 PM focused on the coronavirus, you can dial 877-228-2184 and then enter 119136#

Hope to chat with you then. Thanks to @1450whtc for helping to get the word out. #MI06 #InItTogether https://t.co/cstsBzDkqS"
