,Tweet
0,"RT @WSJ: Breaking: The economy grew at a record pace in the third quarter, recovering a good chunk of pandemic losses but still below where…"
1,"Chatting with Gary on @1450whtc this morning at 8:15 for our weekly Tuesday interview. Will be talking about expanding high-speed broadband in #MI06, the latest on the COVID-19 crisis, and more. Tune in at https://t.co/zXzxbYiWzz! https://t.co/u0aYs2utpI"
2,"A COVID-19 relief deal is still possible and is still needed. Families, small businesses, and schools - they all need help. Let’s get it done. #MI06 https://t.co/iYcWSXvpS4"
3,"We are 14 days away from the election, after which the prospect of moving COVID-19 relief is very dim until February. Every day that passes is a missed opportunity to deliver relief for those in need. The @ProbSolveCaucus &amp; I are encouraging negotiators to STAY AT THE TABLE. https://t.co/UMtibMLBJZ"
4,We have to pass another COVID-19 relief deal. Folks are struggling. We cannot wait. #MI06 https://t.co/FE9QWkWknc
5,"COVID-19 cases are on the rise in Michigan &amp; across the country. We need to remain vigilant!

Listen to more from this morning's @1450whtc interview. #MI06 https://t.co/HyH1i6pY50"
6,Looking forward to chatting with @gstevensholland on @1450whtc about the latest on COVID-19. Hope you can tune in at 8:15 ➡️ https://t.co/kXvRSla4Fi #MI06 🇺🇸📻🎙 https://t.co/QmXh49iTz1
7,"While the D.C. scene is dominated by the Senate Judiciary Committee SCOTUS hearings, the discussions continued on a COVID relief package that have been stalled for months. Get the latest updates from my Kitchen Table report: https://t.co/XP20IUH4rB #MI06"
8,Much to discuss in my #KitchenTable update tonight. COVID relief negotiations have thankfully received a 2nd wind &amp; I hope to see a bipartisan deal soon. Also talked about my visit to Cassopolis @ Midwest Energy to brings jobs to #MI06. Read the full KT at https://t.co/l6HwKLwyOU
9,I have requested the @CDCgov to deploy a CDC One Health field team to support Michigan’s public health and animal health partners with an on-farm investigation. https://t.co/lJLgPSq4fi #MI06 https://t.co/EsaiLxzPIO
10,"RT @WildAid: #PreventingFuturePandemicsActOf2020, takes steps towards preventing future zoonotic pandemics, like closing U.S. borders to th…"
11,Tonight's #KitchenTable update is wholly different from what I would have started writing this morning. This morning I was “hopeful” that we were beginning to close in on a bipartisan COVID-19 relief deal: https://t.co/gxzMuWjPOu #MI06
12,RT @detroitnews: Pfizer preps Kalamazoo plant for COVID-19 vaccine approval; Drugmaker expects to complete clinical trials by late October…
13,"On @1450whtc earlier, I shared an update on COVID-19 relief talks -- we're making progress. Families, small businesses, schools - they all need help. I am hopeful we can get something done. #MI06 https://t.co/NTBKat2f8y"
14,"Small businesses, individuals who need help, people that are being threatened with evictions, bills not being paid -- so many are still struggling. We can get a bipartisan COVID-19 relief deal done if we don't let politics get in the way. https://t.co/IOb8UdseXq #MI06"
15,Joining @MPShiels this morning at 7:30 on @mibigshow to give an update on COVID-19 relief negotiations. We need a bipartisan deal that delivers help to the American people - let’s get it done! #MI06 ➡️ https://t.co/icLQHGllZy 🇺🇸🎙📻 https://t.co/QS05XFve1e
16,We just voted on a partisan deal that won’t even be considered by the Senate or signed by the President. It’s no secret a large majority of Americans think our country is on the wrong track – we can’t even agree to deliver help in the worst public health crisis in a century...
17,"This week the House passed my bipartisan legislation to reauthorize the School-Based Health Centers program, which is so important -- especially in rural counties like in #MI06. 

Learn more: https://t.co/eHiSjwTIzh"
18,"Yesterday the U.S. House unainmously passed my legislation to reauthorize the School-Based Health Centers program. SBHCs serve an important role in underserved communities in MI &amp; around the U.S, offering primary care services as well as mental health services &amp; dental care #MI06"
19,"RT @WCSNewsroom: Wildlife Conservation Society Statement in Support of Preventing Future Pandemics Act of 2020, Introduced by 
@JohnCornyn…"
20,"Just landed in Washington. One key issue we’ll be discussing this week is COVID-19 relief. Let’s get a bipartisan deal done that provides real relief to families, workers, and small biz across the country. #MI06"
21,"While many have thrown in the towel on a COVID relief package, I know we can get it done if we work together. Check out my #KitchenTable update today to read more about these relief discussions on Capitol Hill, developments on a vaccine, &amp; much more. #MI06
https://t.co/DFZPQrzHMh"
22,"Today, I joined my colleagues in sending a bipartisan letter to House leadership urging Congress stay in Washington until a COVID relief deal is reached &amp; passed. Leaving D.C. w/ the nation’s work undone is unacceptable, &amp; I'm ready to roll up my sleeves for EVERY American. #MI06 https://t.co/XDqgkG5ela"
23,"It was a privilege to be in SH to honor the life of U.S. Army Corporal Earl Janosky, who died at the age of 20 serving our country in Korea. His name is now inscribed on the Korean War memorial outside city hall, forever commemorating his sacrifice #MI06 
https://t.co/3nWyFTqHVN"
24,"We all wanted COVID-19 over by Easter. It wasn't. It's still hurting so many folks in #MI06 &amp; across the nation. 

We have to act now so folks won’t still be hurting at Thanksgiving or Christmas. 

The House must pass a COVID relief package. https://t.co/eRSj464deM"
25,Up next - at 7:30 I’m talking with @MPShiels on @mibigshow about the bipartisan plan I’m working on to deliver COVID-19 relief to families in #M06 &amp; across the country. Hope you can tune in: https://t.co/icLQHGllZy https://t.co/qSXncZgSAS
26,"Coming up at 7:10 ➡️ Chatting with @WKZONews’ @kenlanphear about our bipartisan COVID-19 relief framework.

Folks still need help. We’ve got a plan to deliver. Listen live: https://t.co/atMeiSz3NW #MI06 https://t.co/8JvnFYZM7Q"
27,"Justice Ginsburg helped break the glass ceiling for so many that otherwise would not have achieved their true worth in their chosen field. She was a thoughtful, gentle woman who, with real precision, could disarm any argument with respect from all sides. Rest in peace."
28,"Millions of Americans are still facing enormous challenges from the COVID-19 crisis, but too many on Capitol Hill are more worried about winning their elections than governing. Politics are the only thing standing in the way of a COVID-19 relief package. 

https://t.co/3hCtUfBVWZ"
29,"For 73 years, the @USAirForce has protected &amp; defended our country at home &amp; abroad. Today, we honor those who bravely serve the American people &amp; the heroes who have made the ultimate sacrifice in defense of freedom. We owe them ALL a great debt of gratitude now &amp; forever. 🇺🇸 https://t.co/RtSPJ8yppN"
30,"As much as we all wanted COVID-19 over by Easter, we have to act now so folks won’t still be hurting at Thanksgiving or Christmas. Leaving D.C. with the nation’s work undone is simply not acceptable.

The House must pass a COVID relief package. 

https://t.co/1hBw5MgWS5 #MI06"
31,"The COVID-19 pandemic has had a significant impact on all of us. And people experiencing homelessness are especially vulnerable. 

At the federal level, we approved funding to help them - it's now at the state level and needs to be released, ASAP.  https://t.co/bRSLbvR7Ct #MI06 https://t.co/lCzMioKlie"
32,Great news! @HHSGov has awarded $377K to support immunology &amp; infectious disease research at the Homer Stryker School of Medicine. I'm glad to see Broncos lead the charge as we look to advance our understanding of the immune system &amp; cure illnesses like COVID-19. #GoBroncos #MI06
33,"On Sept.16, 1919, @AmericanLegion was chartered by Congress to support our veterans &amp; their families after WWI. To this day, it is one of the nation's largest veterans orgs &amp; continues to serve those who've sacrificed so much in defense of our freedoms. THANK YOU for all you do!"
34,We've got to get both sides back to the table. Our bipartisan COVID-19 relief framework includes policies REPUBLICANS and DEMOCRATS can support that would deliver immediate help to families across #MI06. https://t.co/haPNeszNNY
35,"We need more resources to help our families, our small businesses, our schools, our states, our health care providers, and our first responders.

And we have a plan to do just that. Learn more about the @ProbSolveCaucus' bipartisan framework here: https://t.co/niuwPA2IQ6 #MI06"
36,"Today we introduced our bipartisan framework to deliver help to millions of Americans in need because of the COVID-19 pandemic.

This can get done. We need it to. Learn more here: https://t.co/niuwPA2IQ6 https://t.co/BZZEp4bz1g"
37,RT @ProbSolveCaucus: Today @probsolvecaucus unveiled the “March to Common Ground” COVID Stimulus Framework to help get negotiators back to…
38,"Proud to be part of the @ProbSolveCaucus as we fight to get COVID-19 relief through the Congress.

It’s possible. It’s doable. And it has to be done. Too many Americans are really struggling. They need help, and our plan delivers for them. #MI06 https://t.co/Yh6TFy0o5i"
39,WATCH: This morning the @ProbSolveCaucus is announcing a COVID-19 relief framework supported by DEMOCRATS and REPUBLICANS that will help Americans the most in need ➡️  https://t.co/FUAWCsxQ2U #MI06 https://t.co/fpO6wmUF1p
40,This morning the @ProbSolveCaucus and I are introducing our bipartisan framework to try and reignite COVID-relief talks. The American people need help -- we need to deliver. Learn more here: https://t.co/6AlTgz09fq #MI06
41,"Thanks to the CARES Act, @HUDgov is providing more than $1M to assist households in SW MI that face a higher risk of eviction due to COVID-19. I’m glad to see these funds will truly help keep folks housed as we continue to battle this vicious virus #MI06 https://t.co/Kj4hba3Mn2"
42,"In today’s #KitchenTable update, I touch on a number of issues facing our nation and our state. From COVID relief to developments on the vaccine front, be sure to check out my full report ⬇️ #MI06

https://t.co/l2UaKauo0M"
43,"The same small biz that were hardest hit by COVID lockdowns earlier this year now face the highest reopening costs. The Healthy Workplace Tax Credit, which I've cosponsored, will help reduce these costs, keep customers safe, &amp; protect employees. #MI06
 
https://t.co/77gsr2XjT9"
44,"America has long been a leader in cutting-edge research to solve our world's toughest problems, but sadly, COVID-19 has hindered our progress. The #RISEAct is a must-pass bill that will help us protect our innovation pipeline, global competitiveness, &amp; national security. #MI06 https://t.co/DcU6TciXir"
45,"So many small biz in SW MI have made real sacrifices to stay afloat during this crisis. As these places reopen, our top priority MUST be the health &amp; safety of customers &amp; employees alike. Our new legislation will truly help keep everyone safe. #MI06
 
https://t.co/05uxqsqWFz"
46,"As businesses in SW MI reopen their doors &amp; welcome back customers &amp; employees, it's critical they have the resources to do so safely. That's why I'm proud to support the Healthy Workplaces Tax Credit to help biz invest in efforts to keep folks safe. #MI06
https://t.co/4PL8va44rn"
47,"While COVID stimulus talks have stalled in DC, my @ProbSolveCaucus colleagues &amp; I are working hard to get a deal across the finish line that truly supports American workers, families, small biz &amp; students. Folks still need help &amp; Congress must act. #MI06
 
https://t.co/Nv2j8CxGwX"
48,"Great Lakes fisheries power our local economies in SW MI, but the COVID-19 pandemic has severely harmed this critical industry. Today, I joined my Great Lakes Basin colleagues to request that future COVID relief packages support our fisheries &amp; sustain our way of life. #MI06 https://t.co/ugz1qVUxb7"
49,So many organizations have stepped up to the plate to produce critical PPE for our brave frontline workers during the COVID-19 crisis. Yesterday we honored them with special congressional recognition. Thank you for your service to our communities! #MI06 https://t.co/c22ABO9gt9
50,"Honored to be with a number of SW MI organizations - which I'm calling ""Made in Michigan Heroes!"" - that transformed their work to create PPE, hand santizier, and other medical supplies for our communities during the COVID-19 crisis. We are all in this together! #MI06 https://t.co/UCmXkEfEvu"
51,"Our healthcare workers have been real heroes in our fight against COVID-19. Day in &amp; day out, they have put their lives on the line to serve others &amp; save lives. Our promise to them is that we will always have their backs. THANK YOU for all you do! #MI06
 
https://t.co/6teKjkgFIr"
52,"🚨On @1450whtc this morning at 8:15!

Will be chatting with @gstevensholland about our successful efforts to get the @USDA to approve waivers to provide healthy, nutritious meals to students in need.

Listen in here: https://t.co/kXvRSla4Fi #MI06 🎙📻🇺🇸 https://t.co/kBnqheVXVd"
53,"Our health care heroes have been on the front lines from day one fighting COVID tooth &amp; nail. They’re facing unbelievable stress &amp; pressures. Our bipartisan bill aims to protect the mental health &amp; overall wellbeing of our health care workers. #MI06 
 
https://t.co/Bjkz6Omhnl"
54,"Just sent a letter to @USDA @SecretarySonny asking him to extend the waivers needed to help feed students who participate in school meal programs. Students must be able to focus on their education, whatever the format, without worrying about when their next meal will come. #MI06 https://t.co/Ln4fijih2U"
55,"RT @RiponAdvance: As high levels of stress and burnout continue to rise among healthcare workers, @RepFredUpton has introduced a #bipartisa…"
56,.@RepDebDingell &amp; I heard directly from MI hospitals that are facing barriers in using convalescent plasma to treat COVID-19 after a change in FDA regulations. @SteveFDA needs to act quickly to ensure these requirements do not inhibit patient access to convalescent plasma #MI06 https://t.co/I6TFtfGFd4
57,"Great night at the VB Farm Bureau Dinner where I gave an update on a number of important ag issues, including the PPP &amp; food security in SW MI. Also thanked ALL our local farmers for their hard work as they continue to quite literally feed the world amid the COVID crisis. #MI06 https://t.co/vQNFxBZIpS"
58,"While we all wanted this virus gone by Easter, folks &amp; their families still need help. That's why Congress must get to work on a truly bipartisan COVID relief bill that supports our families, small biz, &amp; local communities. America is counting on us. #MI06
https://t.co/zQVT0vlygK"
59,"🚨On @1450whtc this morning at 8:15 to chat with @gstevensholland about legislative efforts to support healthcare professionals’ mental heath, our visit with @USDA @SecretarySonny last Friday, and the latest on the @USPS.

Tune in here ➡️ https://t.co/kXvRSla4Fi #MI06 🎙📻🇺🇸 https://t.co/BHjKQkOs24"
60,".@RepDebDingell: “I think Fred &amp; I are an example of how you reach across the aisle every single day. During the pandemic, there are times I've talked to Fred 10 times a day. As soon as a problem would develop...we brainstorm together.”

GOPs &amp; Dems can still work together! #MI06 https://t.co/uNLSaJ8o4W"
61,"Our front-line heroes are working overtime to take care of us. That's why I helped intro bipartisan legislation that promotes mental wellness for our health care professionals, who are under even greater stress during the COVID-19 crisis. #MI06
 
https://t.co/k2KWh0eMP3"
62,"While we all want to see a COVID vaccine available ASAP, we can't compromise safety for speed. My friend @NIHDirector reassures us that all vaccine candidates are being strongly vetted - exactly what we envisioned in our historic 21st Century Cures bill.

https://t.co/JRmRhBirsM"
63,"Great to have @SecretarySonny in SW MI to tour @KzoLoavesFishes &amp; meet a number of local farmers who quite literally feed the world. Food security is a top priority as we battle COVID, &amp; our community has come together to support the most vulnerable among us. #MI06 https://t.co/uqWT9iezAQ"
64,"Looking forward to welcoming @USDA @SecretarySonny to Kalamazoo to highlight the importance of USDA’s Farmers to Families Food Box Program, which has distributed nearly 65 million food boxes in support of American farmers and families affected by the COVID-19 crisis #MI06"
65,"Great to catch up w/ Dan, our local postman, today in my St. Joe office &amp; discuss the importance of the USPS for so many folks here in SW MI &amp; across the country. To the 21K+ Michigan postal workers who keep us all connected, we thank you &amp; will always have your back. #MI06 https://t.co/YIndqKlpGu"
66,"Our conversation on bipartisan problem solving continues w/ a discussion on COVID-19.

Folks are working &amp; taking classes from home.

That's why it's critical we expand access to broadband. And @WhipClyburn &amp; I have a bipartisan bill to do just that: https://t.co/rYNoVtlMNi #MI06 https://t.co/VhzQ8lTCra"
67,One of the first questions @RepDebDingell &amp; I got today was about a future COVID relief package. We know we need to move another bipartisan COVID relief package through the Congress ASAP. Folks are really hurting &amp; our families need support NOW. #MI06 https://t.co/ql6AW8wf8k
68,"RT @SecretaryCarson: .@KZooGospel Ministries was able to provide critical services during #COVID19 due to $460,000 in PPP funds thanks to t…"
69,"Our immigration system is broken &amp; partisan bickering only delays our progress. It's past time GOPs &amp; Dems get serious on bipartisan reforms that offer real solutions &amp; I'm ready to work w/ anyone who wants to roll up their sleeves &amp; get the job done #MI06
https://t.co/sFKa398IS1"
70,... all of us stay connected. I have been fighting for USPS emergency funding for the past several months &amp; will continue to do so. Yet another reason Congress should be back in session working TOGETHER on a bipartisan legislative COVID-19 relief package. #MI06
71,ICYMI: I joined the MI delegation in urging the president to fully fund the Natl Guard. These folks have truly been a lifeline for our state as we fight COVID &amp; we must ensure they have the resources they need to help us defeat this vicious virus. #MI06 https://t.co/rUpE0o320Z
72,"If you've recovered from COVID-19, there's a chance that your plasma contains antibodies that may help others fight off this vicious virus. Your donation could make a real difference so be sure to visit @RedCross and sign up below! #MI06
 
https://t.co/Wvx87woDv7"
73,"There are a number of things I think we can do - together - to pass a bipartisan package to help those who have been hurt the most by the COVID-19 crisis.

More from my interview on @1450whtc ⤵️#MI06 https://t.co/gH5RRCeaGT"
74,"🚨Joining @mibigshow this morning at 7:30 to discuss our bipartisan effort to protect funding for COVID-19 National Guard efforts.

Tune in ➡️ https://t.co/icLQHGllZy #MI06 https://t.co/dsgGU8JJUd"
75,"Operation Warp Speed represents a major investment in developing and distributing a safe, effective COVID vaccine for every American family. In collaboration w/ companies like @pfizer, we will be able to deliver 300M doses nationwide quicker than ever imagined. #MI06 https://t.co/d89A4iAEGJ"
76,"The COVID-19 pandemic has had a significant impact on the state of Michigan. Michigan relies on the National Guard for vital assistance, from coordinating PPE deliveries to enhancing testing capabilities, and we need the fed gov't's continued support to fund those efforts. #MI06 https://t.co/nrnIbYO7ol"
77,"The Natl Guard has truly helped our state navigate this crisis by performing COVID tests, distributing PPE &amp; cleaning public spaces. That's why the MI delegation is urging the Administration to completely fund the Natl Guard thru 2020. We need help! #MI06
https://t.co/Mn9D2ntFZn https://t.co/AAG12SI9lt"
78,"🚨On @1450whtc at 8:15 AM🚨

We’ll be talking about the latest on COVID-19 relief efforts, our bipartisan call for the federal gov’t to fully fund National Guard efforts in Michigan, and the latest on schools reopening. Tune in ➡️ https://t.co/kXvRSla4Fi #MI06 🎙📻🇺🇸 https://t.co/04JFYYeZb6"
79,"If you’ve contracted and recovered from COVID-19, donating your plasma is one the easiest things you can do to save a life. Your plasma may have powerful antibodies that can help folks fight off COVID. If we all do our small part to protect others, we will beat this virus. #MI06 https://t.co/AyrvDTy8ph"
80,"🚨Michigan small businesses: tomorrow is the LAST day to apply for a #PaycheckProtectionProgram loan. If your business has been impacted by COVID-19, be sure to apply to keep your doors open and your employees on the payroll. Apply ⬇️

https://t.co/TjGKF5JRsT"
81,Great to be in Kalamazoo today to stop by the U.S. Army Recruiting Office and talk to the brave men and women who serve our country. All wearing our masks to protect ourselves and each other. THANK YOU to all of you and your families! #MI06 🇺🇸 https://t.co/YpfqRGYJml
82,"SW MI is home to a # of colleges &amp; universities that lead the nation in cutting-edge research, but COVID has hurt their budgets. That's why I helped intro the RISE Act to maintain our innovation pipeline &amp; help continue cutting-edge research.

https://t.co/ClLninRMZ0"
83,"If you've been following my #KitchenTable updates, you'll know we’ve been sharing constituent photos of folks social distancing &amp; wearing their masks. If you’d like to submit a pic of your favorite mask to be featured in a future KT, send it our way! #MI06 https://t.co/iO4i7dng8O"
84,"In the fight against COVID, hospitals &amp; first responders must have the PPE they need to protect themselves &amp; others. The bipartisan Strengthening America’s Strategic National Stockpile Act will help us do just that, &amp; I’m proud to support it. #MI06
 
https://t.co/kWfUTLYQDQ"
85,"On this day in 1790, the @USCG was born. For 230 years, these brave men &amp; women have patrolled &amp; defended our nation’s shores to keep America safe &amp; secure. Today, &amp; every day, we honor their sacrifice &amp; remember those who made the ultimate sacrifice in defense of freedom. https://t.co/da7UY7n2pW"
86,"Looking forward to this morning’s interview on @1450whtc - will be discussing the latest COVID-19 relief negotiations, the importance of wearing a mask, &amp; our bill to cut red tape for small business loan forgiveness. 

Tune in! https://t.co/kXvRSla4Fi #MI06 🇺🇸📻🎙 https://t.co/VHZeDWRnWW"
87,"In today's #KitchenTable update, I touch on a number of issues including the latest on COVID relief negotiations, my bipartisan broadband bill w/ @WhipClyburn, and encouraging developments on the vaccine front. Check out my entire report here:
 
https://t.co/SShOpCQgwf"
88,"While local school districts across the nation look to chart a path forward, a # of important questions remain unanswered about COVID &amp; the upcoming school year. My friend @NIHDirector sits down w/ @DianaBianchiMD to discuss what the fall might look like.
https://t.co/PplPiYR7LE"
89,"My PPP Forgiveness bill would help countless small businesses that have been ravaged by COVID-19. These folks should be focused on keeping their doors open &amp; rehiring worker - not sifting through bureaucratic red tape. #MI06 
 
https://t.co/1kRZzjAIOl"
90,"RT @ProbSolveCaucus: As the impact of the coronavirus continues to rise, Congress must come together on a bipartisan deal that  provides su…"
91,States &amp; local govts need additional resources after fighting COVID. MI alone faces a $6B budget deficit. That’s why I’ve worked to advance the bipartisan SMART Act to help fund essential services at the state &amp; local level. More: https://t.co/7SybBkJrOx
92,"This virus is no joke. Every one of us needs to do our part to stop the spread of COVID, and wearing a mask is a must. If we don’t ALL commit to protecting ourselves and others now, we risk prolonging this nightmare further. Wear your mask. Please. https://t.co/rzJcBqAfxK"
93,"RT @HouseCommerce: Today the E&amp;C Health Subcommittee is examining bills to reauthorize public health programs

📺WATCH live at 10 a.m. ET an…"
94,"In today's #KitchenTable update, I discuss some of my priorities for the next relief package, bipartisan legislation I intro'd to expedite the PPP loan forgiveness process for small biz, &amp; progress on a COVID vaccine. Check out my full report ⬇️
 
https://t.co/uTYVm5km20"
95,"While research on COVID-19 is in overdrive, other research has been slowed because of the pandemic. That’s why we’ve introduced the bipartisan #RISEAct, which will help keep America #1 in cutting-edge research. #MI06
 
https://t.co/ygipcfvKyO"
96,"🚨LIVE at 8:15 on @1450whtc 🚨

Starting this morning with my weekly interview on @1450 to discuss the latest on the COVID-19 relief package.

Hope you can tune in ➡️ https://t.co/kXvRSla4Fi #MI06 🎙📻🇺🇸 https://t.co/Qer3G9AytQ"
97,"Our healthcare heroes have been working overtime to defeat COVID-19. Over the past several months, we’ve helped secure thousands of med supplies for local hospitals &amp; health centers &amp; we must always ensure they have the right equipment to protect themselves &amp; save lives! #MI06"
