,Tweet
0,"Please, wear your masks. Stay home when you can. When you can't, practice safe social distancing. 

Despite Donald Trump's rhetoric, we must remain vigilant."
1,"Nearly 90,000 new COVID-19 cases were reported in the US yesterday. We have not ""rounded the corner."" This reckless and blatantly false claim by Donald Trump is dangerous to our public health and further proof of his continued mishandling of this pandemic.https://t.co/33rSCX6z6r"
2,"Congratulations to Long Construction on the opening of their showroom! It is heartening to see small businesses persevere amid the COVID-19 pandemic, and reinforces why we must continue fighting to ensure they have support and resources they need to succeed. https://t.co/X4KoAjfTjI"
3,No family should ever be forced to make the devastating choice between their own safety or leaving behind a child. My office has been working tirelessly to prevent family separations and support those who have served with our Armed Forces. Read more here: https://t.co/ihqkjevmpN
4,"This #NationalFirstRespondersDay is a special one, because these hardworking men and women—who put their lives on the line for us every day—have truly gone above and beyond to protect our communities during this pandemic.

On behalf of a grateful nation: thank you. https://t.co/mSZ5Jb18qN"
5,"This should serve as a call to action for all of us. 

Do your part to keep your community safe and save innocent lives: wear a mask. https://t.co/YbQa1TnOto"
6,"#Covid19 has made it clearer than ever that everyone needs access to reliable, high-speed internet. We need to restore #NetNeutrality and ensure a free and open internet is a right for every American, not a privilege. https://t.co/f4tSZZoYd3"
7,"Today, the Senate and the Trump Administration made their priorities clear: overturning the Affordable Care Act, dismantling protections for people with pre-existing health conditions, and rolling back women’s’ fundamental right to choose."
8,"On this #DayoftheDeployed, let us take a moment to honor and thank the brave men and women of our Armed Forces who are stationed around the world. Your service and sacrifice in defense of our country will never be forgotten. https://t.co/mRr0YrJGIP"
9,"🚨Open Enrollment begins in one week!🚨

New York's enrollment period runs from Nov 1 to January 31. And now more than ever, it is critical that everyone has the healthcare they need. Head to https://t.co/Rjh5JqdhX6, find a plan that works for you, and #GetCovered."
10,"Our community has worked so hard to slow the spread of COVID-19—we can't let up now.

Remember: Wear a mask. Stay home if you can. If you can't, remain 6 feet from others. Wash your hands often.

It takes all of us to keep Monroe County safe. Do your part.https://t.co/fs3KFmgpux"
11,"Proud to have helped secure the funding for this important program. Small businesses are the backbone of our local economy—and right now, they need our help. If you're a business owner struggling with the impacts of COVID-19, apply for a grant today at https://t.co/aKPQxHS2pu."
12,"Proud to have helped secure funding for #FastForwardMonroe, a grant program to help small businesses in our community get through the COVID-19 crisis. Thanks to @CountyExecBello for his leadership to support our local economy! 

Apply for the program here: https://t.co/aKPQxHS2pu https://t.co/rj05PrVlbS"
13,"Combatting COVID-19 means staying home more than usual—but for too many Americans, home isn't always a safe space. Rates of domestic violence are rising.

If you or a loved one feel unsafe at home, know there is help available. Call or text today. #DomesticViolenceAwarenessMonth https://t.co/J7RiPPdVCs"
14,"If the Trump Administration has their way and the Affordable Care Act is struck down, 3.2 million New Yorkers—and millions more across the country—will lose their healthcare.

We need to expand access to healthcare for American families—not cut it. #ProtectOurCare https://t.co/cXXlTUbroS"
15,"That's why I'm calling on the IRS to address and explain their mishandling of these payments immediately—and more importantly, to make it right for the many families who have been impacted here in Monroe County and across the country."
16,"My office has heard from hundreds of constituents who were erroneously denied their $1,200 stimulus payments by the IRS due to no fault of their own—causing further undue harm in the middle of a global pandemic. 

It's unacceptable."
17,"Programs like Farmers to Families Food Box are essential to helping those in need obtain healthy and reliable meals, especially during this public health crisis. I'm fighting to ensure it remains accessible to all. https://t.co/pFxGYBRSJ0"
18,"Too many children and families across our country go hungry every day—and COVID-19 has only made this dire situation worse.

This #WorldFoodDay, we recognize and thank the many food banks, distribution centers, and community organizations dedicated to ending the hunger crisis. https://t.co/ZJMotaLfVh"
19,Striking down the ACA would be detrimental to millions of New Yorkers and millions more Americans across our country—especially those with pre-existing conditions. Families should never have to fear losing the essential healthcare they need to survive.https://t.co/q90si7Zcio
20,"That's why I'm calling on Secretary Perdue to address these changes immediately and ensure families don't go hungry.

We are in the middle of a global pandemic. Now is not the time to be selling American families short."
21,"The Farmers to Food Box program filled critical gaps in services as the COVID-19 exacerbated our nation's hunger crisis. And recent, unexplained decisions by the USDA risk harming the good this program has served. https://t.co/0RWJUXs7Ad"
22,"We are not out of the woods yet. COVID-19 continues to impact our daily lives, and we can all play a role in defeating this virus. Sign up for this quick, daily survey to help our community. I take it every day! https://t.co/iJNIUcRLAD"
23,"Donald Trump's repeated attempts to sabotage the #2020Census could leave our communities undercounted and leave our schools, roads, and hospitals underfunded. You have just one day left – head to https://t.co/TjCVqNuwUI today!
https://t.co/VUUOuQREJa"
24,"No matter who you love or where you are on your journey, your story belongs to you. Not only on #NationalComingOutDay but every day, I am proud to stand as an ally to the LGBTQ+ community and fight for a world that is equitable, inclusive, and filled with love. https://t.co/BP6KdRJRLO"
25,ICYMI: Burn pits are exposing an entire generation of veterans to toxins that pose serious and chronic health risks. I'm partnering with @SenGillibrand on legislation to ensure these servicemembers have access to health and disability services they need. https://t.co/fUkOZ17EuS
26,"It can be easy to forget about testing your smoke detectors – but the few minutes you take to do so can save your life. As we wrap up #FirePreventionWeek, let's ensure we're taking the necessary precautions all year round to keep our families safe.
https://t.co/6AKHQFJxu3"
27,It was a beautiful Fall day in Fairport yesterday! Thanks to Mayor @JulieDomaratz and Village Manager Bryan White for spending the afternoon with me and for your continued partnership as we work to uplift the lives of Fairport residents and everyone who calls Monroe County home. https://t.co/NGto8hykNR
28,I'm proud to join @SenGillibrand in co-sponsoring legislation to ensure veterans like Rob Ziegler who were exposed to harmful toxins have access to the health and disability services they need without the struggle of unnecessary red tape.
29,"An exciting and long-awaited day for our community! La Marketa is not only a transformative economic development initiative, but a celebration of the rich Latinx culture of the North Clinton neighborhood. Congratulations to all whose dedication made this a reality! https://t.co/tOoYmuQb7g"
30,We need bold investments in workforce development to recover from COVID-19 which is why I’m proud to have helped secure CARES Act funding to make this program a reality. Thank you to @CountyExecBello for your leadership and work ensuring a bright future for Monroe County. https://t.co/TnXAHraHwj
31,"This is outrageous. Americans should not be forced to rely on an underground healthcare market because the cost of medicine they need to survive is so grossly and unnecessarily inflated.

https://t.co/NCDYHBeNI5"
32,"This is egregiously irresponsible.

Yet again, Donald Trump is prioritizing politics over the American people. This reckless attitude has led to 200,000 people dead and millions more sick, out of work, and struggling to pay the bills. 

Our families deserve better. https://t.co/WJgHyUkThX"
33,"To truly understand where COVID-19 is in our community and how to combat it, we need accessible, widely-available, and free tests.

Find the closest location to you and sign up!
https://t.co/jazAqJbVDR"
34,"Across America, teachers are working incredibly hard to find creative ways to ensure our children learn and grow, even under the most difficult circumstances. To all of the educators out there who work tirelessly for our students: we thank you. #WorldTeachersDay https://t.co/beXu3rrDhU"
35,"The Trump administration continues to stall on passing stimulus relief for working families. Meanwhile they are fast-tracking a Supreme Court nominee who will:

-Gut the #ACA
-Eliminate protections for people with pre-existing conditions
-Roll back women's reproductive rights"
36,"Dr. Lerner was a dear friend and dedicated ophthalmologist who served Rochester residents for over 65 years. His presence in our community will be sorely missed. My heart goes out to his devoted wife Ellie and the entire Lerner family.
https://t.co/pNzWgDaxmg"
37,"I am proud to cast my vote for another important funding package to deliver the much-needed relief our families, workers, and small businesses need as we continue to face the long-lasting and devastating impacts of the COVID-19 pandemic."
38,"This year's observance of Domestic Violence Awareness Month is particularly imperative. With more people staying home as a result of COVID-19, calls to our local domestic violence crisis line are up 50%.

We must use this month as a call to action. https://t.co/lna9YVg3Ld"
39,"Months ago, I called on Donald Trump to rectify the disserve his administration was doing to the millions of Americans in our deaf and hard of hearing community. Especially in the middle of a pandemic, we must ensure essential health information is accessible for ALL Americans. https://t.co/TpscGttDAm"
40,"It should come as no surprise that Donald Trump has gamed the system for his own personal benefit – a benefit that comes at the expense of hard-working, everyday Americans who pay more in taxes every year than he has in decades. https://t.co/kVLvlQIwKu"
41,"Donald Trump is working at record speed to roll back centuries of progress advancing women's rights and gut healthcare for 135 million Americans – during a global pandemic, no less.

His priorities are clear – and they are unequivocally not the priorities of the American people. https://t.co/GcadiWWstU"
42,Got mine last week! Doing my part to help keep our community safe and healthy. #FightFlu https://t.co/RJZPlH9A4D https://t.co/e2MZgYi12m
43,"To help our 🏥Hospitals, 🎒Schools, 🚧Roads, and 🌼Community...complete your #2020Census!

It takes just a few minutes! Head to https://t.co/TjCVqNuwUI today!"
44,"This is a tragic milestone for our nation. We join together to grieve their loss, and we commit to honoring their legacy by remaining vigilant in our efforts to combat this deadly virus.

Wear a mask. Stay 6 feet from others. Save lives.https://t.co/hXSdQABlEu"
45,"This is reckless.

Our democracy is rooted in the fundamental premise of a peaceful transfer of power between elected leaders, regardless of party. Who wins our election is not a personal choice Donald Trump, or anyone else, can defy – it's the choice of the American people. https://t.co/wc902HsSVY"
46,"I‘m pleased that we have reached a bipartisan agreement to fund the government through December, preventing another shutdown and delivering much-needed relief for families still struggling with the ongoing, long-term impacts of COVID-19. https://t.co/Kcxg1lUAHE"
47,"Our nation is facing an unprecedented convergence of economic, public health, and racial crises that have further underscored what we already know: we desperately need bold, sweeping reform to move our nation forward.

That's why I'm co-sponsoring the THRIVE Agenda. #TimeToThrive"
48,"This is backwards. With #COVID19 forcing millions out of work, we should be LOWERING the cost of prescription drugs like Insulin.

It's unacceptable that drug companies continue to take advantage of vulnerable Americans who need this medicine to survive.
https://t.co/O4EwhpK5Nl"
49,"#COVID19 has exacerbated our housing crisis, leaving families with nowhere to turn. We're taking action to fix that.

I'm partnering with community leaders on a new program to support residents facing eviction.

If you're in need of housing assistance, call 211 and apply today. https://t.co/NCWAtyC9EZ"
50,"From healthcare centers to school lunch programs to infrastructure projects, so many of our community resources rely on full and accurate data from the #Census. That's why it's so important that you #GetCounted before the end of this month! Visit https://t.co/cNvPA7EmBJ today."
51,"A profoundly sad day for America. Justice Ruth Bader Ginsburg was an icon — a passionate champion of women’s rights, a bold defender of justice, and a tireless fighter for equality.

My heart goes out to the entire Ginsburg family. Her legacy will live on forever. https://t.co/WHoIzExcYt"
52,Wishing peace and joy to all those celebrating Rosh Hashanah. May the new year be filled with happiness and good health. Shanah Tovah! https://t.co/7uFADIqx4C
53,Proud to partner with @RepLoriTrahan on new legislation to expand access to apprenticeships and grow our workforce – which is more critical now than ever as we grapple with the economic impacts of #COVID19. Read more here: https://t.co/PStfGmQ9EP
54,"Today we honor the courageous members of our Armed Services who have been kept as Prisoners of War, and remember the extraordinary sacrifice of the many heroes who never made it home. You are not forgotten. #NationalPOWMIArecognitionDay #POWMIA https://t.co/TWqgeEAzf7"
55,"I am proud to have helped secure funding through the CARES Act to make this program possible, and I’m grateful to @CountyExecBello and our many government partners whose collaboration is helping to uplift families in our community."
56,"Everyone deserves a safe, stable place to call home—especially during a pandemic. That's why our community is coming together to take action that will help prevent families from being evicted during these challenging times, causing them to slip further into crisis. https://t.co/m053FXoE4g"
57,"Time is running out!

Be sure to #GetCounted in the #2020Census: a full count of everyone who lives in America that happens only once every decade.

Make sure you and your family are represented! Visit https://t.co/cNvPA7EmBJ or call 844-330-2020 before counting ends on Sept. 30."
58,"As we begin #HispanicHeritageMonth, let us take time to recognize and honor Hispanic and Latinx Americans, past and present, whose immeasurable contributions are an essential part of our vibrant community fabric. #HHM https://t.co/tR07ldI8pc"
59,"That means strengthening food assistance programs like SNAP, ensuring robust free school lunch initiatives, and streamlining services for vulnerable families. 

Especially now, as Americans struggle to get through this pandemic, we must ensure no one is left behind."
60,"COVID-19 has left families jobless and struggling, causing a significant rise in food insecurity that affects over 40,000 children in our community alone. This #HungerActionMonth is a call to action: we need meaningful reform to address the hunger crisis, and we need it now. https://t.co/8TjSb1qfzc"
61,"If you are one of the thousands of Monroe County residents struggling with access to food because of COVID-19, please call 2-1-1. @FoodlinkNY is continuing its work to offer contactless distributions to support families in need. https://t.co/PhEY4TOwqx"
62,"When someone in our community is in crisis, we need to make sure our response is prompt, appropriate, and effective. Thank you to @CountyExecBello for this important step to expand mental health services and help keep Monroe County residents safe. https://t.co/iTM56CeElV"
63,"Brighton’s Field of Honor is a moving tribute to the thousands of lives lost in the September 11 attacks - and this year, it also honors those who have served our community throughout the COVID-19 pandemic. 

We will #NeverForget their courage, their sacrifice, or their heroism. https://t.co/35obpShQgE"
64,"COVID-19 has severely exacerbated the hunger crisis that millions of Americans face every day. Today, on #HungerActionDay, we recommit to working alongside organizations like @FoodlinkNY to reduce food insecurity, strengthen SNAP benefits, bolster school lunch programs, and more. https://t.co/klg2O8zX8A"
65,Together we have shown that social distancing works; that wearing a mask works. But we must remain vigilant. We must all continue doing our part to combat #COVID19 and protect our community. https://t.co/QWyHPqvzCC
66,"This #LaborDay, we honor the men and women whose hard work and sacrifice built our nation—and all of the essential workers who have faced immense challenges and risked everything to keep our communities safe during this pandemic. 

To workers everywhere: thank you for all you do. https://t.co/ngXFruKYwk"
67,"What happened to Daniel Prude is sickening. It’s inhumane. And it’s just plain wrong.

His family deserves justice—and our community demands answers."
68,"The #COVID19 pandemic has severely exacerbated our nation's hunger crisis and shined a stark light on just how fragile food accessibility is. As we begin #HungerActionMonth, it's more important than ever that we take action to support vulnerable families across America. https://t.co/owUtmmdrZh"
69,"There are only 30 days left to #GetCounted in the #2020Census! Every ten years, the U.S. counts its population - and these responses help determine funding for community health clinics, schools, infrastructure, and more. Head to https://t.co/TjCVqNuwUI or call 844-330-2020 today! https://t.co/bH1ZPiG1Cs"
70,RT @EdLaborCmte: NEW: Workers are being retaliated against for discussing COVID-19 hazards on social media or with other employees. To stop…
71,"Today, in a hospital bed in Wisconsin, lies Jacob Blake. Six weeks ago, we buried George Floyd. Six months ago, we buried Breanna Taylor. A month before that, Ahmaud Arbery.

And for every name that we know, there are tens of thousands of people whose names we will never know."
72,"Resilience and innovation. 

That's what I think when I think about our community. I'm so grateful to @rocRMSC &amp; @museumofplay, who have found a creative way to make a difficult situation easier for our students. https://t.co/RZB3MC02Jv"
73,"We're not out of the woods yet. That's why every day, I take this survey to help our community better fight #COVID19. It takes less than a minute to complete — sign up today and help out! https://t.co/iJNIUcRLAD"
74,"Grateful to the @NewYorkStateAG for taking charge to hold the Trump Administration accountable and protect the millions of Americans who rely on @USPS to deliver Social Security checks, prescription medication, and more. We won't stand for Donald Trump's political games. https://t.co/Tz2jAbiheU"
75,"This is intentionally cruel. 

More children than ever are going hungry during this pandemic. Feeding them should not be a partisan issue. https://t.co/UrLspXOSE5"
76,"I’m praying for Jacob Blake. For his family. For the countless Black Americans who live in fear that their lives will be cut short by the very people sworn to protect them.
 
Change starts with us. Racism and hatred have no place in our streets, our police force, or our hearts."
77,"#ICYMI: This week, I renewed my call for meaningful legislative action to help state and local governments cope with the impacts of #COVID19.   We need this funding to protect critical services families need to survive. 
https://t.co/coUDgLzCYJ"
78,Millions of Americans are counting on the USPS to survive. I was proud to cast my vote to protect the @USPS from Donald Trump and anyone else who would seek to sabotage it. #DontMesswithUSPS https://t.co/m9Px5plQ6Q
79,"Today, I'm voting for the Delivery for America Act to #SaveThePostOffice. 

Americans rely on #USPS for their medications, paychecks,  election ballots, and more—we cannot allow the Trump Administration to jeopardize this critical service, especially in the middle of a pandemic. https://t.co/6cNzYxWr1z"
80,"For many Americans who rely on prescription medication deliveries, saving the USPS is literally a matter of life and death. I'm on my way to Washington to cast my vote for the Delivering for America Act because of constituents like this: https://t.co/ngrHAiowez"
81,"Protect your friends. Protect your family. Protect your community.

Please, wear a mask."
82,"Millions of Americans rely on the Postal Service to deliver prescription medication they need to survive. 

Donald Trump is literally jeopardizing the health and well-being of the American people for his own political gain.

We won't stand for it. #DontMessWithUSPS https://t.co/hDQN7Xlaei"
83,"World Mask Day may have come and gone, but that doesn't mean we're going to stop now. 

Treat every day like World Mask Day. Wear your mask. Social distance. Keep yourself and our community safe. https://t.co/eGgPds6ytx"
84,"This year, we’re facing a pandemic, a Census &amp; an election—it’s unconscionable that the Trump Administration is working to undermine the dependability of USPS when Americans need it most. I'm cosponsoring the #DeliveringForAmericaAct to ensure they can't. https://t.co/3EbX2mg9cx"
85,"📱Phone
🔑Keys
💵Wallet
...

😷MASK!

This is our new normal — make it a habit. Protect yourself, protect others.

Wear a mask."
86,"We can conduct a safe and fair election amidst the #COVID19 pandemic. But Donald Trump has made clear he prioritizes his own political interests over the rights of Americans – he said so himself.

Protecting the post office means protecting our democracy. Let's #SaveTheUSPS. https://t.co/R1CuLV955L"
87,"In the middle of a pandemic, while families are already struggling, the President wants to introduce policies that would gut Social Security and Medicare.

These are critical programs that millions of aging Americans rely on, and I will fight to protect them at all costs. https://t.co/u32A6FeaRc"
88,"Checking out a book may look different these days, but libraries are still a wonderful way to explore, grow, and learn -- and many are now re-open to the public. Remember to be safe, keep your distance, and wear a mask!  https://t.co/XF5jJs0VxJ"
89,"Staying home is important to prevent the spread of #COVID19, but sadly, home is not always a safe space for everyone. Please, if you feel unsafe at home, please reach out.

These resources are available 24/7.
Call: 585-222-7233
Text: 585-348-7233 https://t.co/hPZDnvjoXO"
90,"If you lost your health insurance because of job loss due to the COVID-19 pandemic, you still have until August 15th to enroll in coverage. Head to https://t.co/Rjh5JqdhX6 now!"
91,"The #COVID19 pandemic has severely exacerbated the hunger crisis across America, especially in vulnerable communities. My colleagues and I are fighting to expand SNAP benefits and ease the burden on struggling families. https://t.co/ATFzbAUuOF"
92,"Today is a good day to:

✅Wear a mask.
✅Fill out your census form.

👇👇
💻https://t.co/TjCVqNuwUI
 📞844-330-2020"
93,"Putting #FamiliesFirst means making sure they have access to the testing, PPE, and resources they need to stay safe.

Enough waiting — Donald Trump needs to take real action to fight #COVID19 by fully employing the Defense Production Act immediately."
94,"No child in our country should ever go hungry. I'm proud to be an original cosponsor of the Pandemic Child Hunger Prevention Act, to provide free school meals for every student. https://t.co/s4j6h29J3P"
95,"Today on National Purple Heart Day, we honor the men and women who have risked everything to protect our freedoms, and whose unwavering courage earned them this honor.

We are forever grateful for your sacrifice. https://t.co/LH30hnVthR"
96,"Rabbi Kilimick’s impact and contributions to both the Jewish and greater Rochester community will be felt for many years to come. My prayers are with the entire Kilimnick family, the Congregation Beth Sholom, and all who knew him well. https://t.co/vq5DbMW17a"
97,"If you lost healthcare coverage because of unemployment due to #COVID19, you have until August 15 to #getcovered through New York State's open enrollment.

Visit https://t.co/Rjh5JqdhX6 for more info today!"
98,Proud to join @SenGillibrand &amp; @SenSchumer to announce that 9.2 million from the CARES Act will go to the @enjoyRTS. It's imperative that we ensure RGRTA can continue offering essential public transportation during the COVID-19 outbreak. https://t.co/VFT4ftMnUz
99,"Wearing a mask saves lives. You don't need to take my word for it, though. Take it from the Science Guy himself, @BillNye.

https://t.co/YEVrqV8B2b"
100,"The Census happens every 10 years and is a critical tool to determine how funding is allocated in our community for health services, school lunch programs, emergency response, and more. But we need your participation! Fill out your form at https://t.co/TjCVqNuwUI and #GetCounted."
