,Tweet
101,"The House passed the Heroes Act to extend pandemic unemployment benefits TWO MONTHS ago. 

It's unconscionable that it's being allowed to run out today, while millions of Americans are facing mounting bills with no relief. The Senate must join us in taking action immediately."
102,Eid Mubarak to everyone celebrating Eid al-Adha! Wishing peace and prosperity to our Muslim neighbors and all those who observe this blessed holiday. https://t.co/MHXsMi21OO
103,"150,000 lives. An insurmountable tragedy. 

We need better, more affordable testing. We need more relief for families. We need clear guidance and leadership. And we need to listen to the experts. https://t.co/pZ3yOXYQAL"
104,"Things that receive funding based on the Census:

🖍️Schools
🏥Hospitals
🍼 Daycares
🍎Food banks
🚗Roads and Bridges

And so much more. 

If you haven't already, take a few minutes and fill out your census form today!

https://t.co/cNvPA7EmBJ"
105,"America was already facing a hunger crisis-and COVID-19 has only made it worse, especially for vulnerable families and children. 

I sponsored the Pandemic Child Hunger Prevention Act to ensure all children have access to free meals during this upcoming school year. https://t.co/Pai4y8b8Ur"
106,#COVID19 has shined a stark light on the inefficiencies of government services and exacerbated the already significant barriers struggling families face. I introduced the HOPE Act to cut through the red tape and help vulnerable Americans better access the benefits they deserve. https://t.co/NW7rtQi3fK
107,"New York: you know what to do! 

Please. For the sake of our neighbors. For the sake of our state. For the sake of our lives. 

Wear. A. Mask. 

https://t.co/HncDxhInWa"
108,"I was proud to co-sponsor and vote for legislation to #RaiseTheWage - and during a global pandemic, when families are already struggling, that raise couldn't be more necessary. Workers across America need our support now more than ever. 
https://t.co/UW2z1AG4eA"
109,"Today I was proud to help pass the first @AppropsDems FY21 spending package. This package: 

✅Prioritizes public health
✅Strengthens SNAP &amp; food security programs 
✅Helps our climate
✅Supports our nation's veterans https://t.co/ZmStOrOmM9"
110,"To respond to a crisis of this scale we need to think big, act big, and go big. 

My friend @RepMarkTakano and I introduced the Jobs to Fight COVID Act to create over a million jobs to combat this pandemic in communities across our country. https://t.co/hmUXRGTnMJ"
111,"Finding affordable, high-quality childcare is a challenge for families even in the best of times—and #COVID19 has only made it harder. That's why @SenGillibrand &amp; I are calling on @CDCgov to support childcare providers &amp; ensure parents have safe, reliable care for their children. https://t.co/2ATq9nnZSf"
112,"COVID-19 is not only a public health crisis — it is an economic crisis. Millions of Americans still have bills to pay and we cannot leave them behind.

https://t.co/7JRNN2rO14"
113,"We know how to fix this. Make sure testing is widespread, affordable, and fast. 

Donald Trump needs to utilize the Defense Protection Act now. https://t.co/YmWKm52UWE"
114,"NY’s lakes and rivers are foundational to our state’s character and our economy, and the #LWCF ensures the health and vitality of our beautiful public lands. I'm proud to cast my vote for the Great American Outdoors Act today to preserve these resources for generations to come. https://t.co/zbwCoiplMq"
115,"The Trump administration continues to wage war on the most vulnerable, even in the middle of a pandemic. We cannot expect children to focus in school if they're worried about finding their next meal.

We need these critical programs - and I'll keep fighting to protect them. https://t.co/WLwiExGbGD"
116,"Proud to vote in support of the 2021 #NDAA, which makes key investments to strengthen America’s safety and security. I’m particularly pleased that this legislation created a new $1 Billion fund to help take preventative steps to prepare for and protect against future pandemics."
117,"For your family, for your friends, and for yourselves – wear a mask. https://t.co/izYgrYCJYP"
118,"Our community continues to amaze me. Thank you, @UofR and @RITtigers, for showing how partnership and collaboration can help ensure #Roc not only gets through this global health crisis, but that we come out of it stronger than before. 💪

https://t.co/Bv9GJW3nsT"
119,"Donald Trump has failed to respond to the #COVID19 pandemic with the urgency or gravity this public health crisis demands. We need quick, affordable testing—and we need it now. I’m calling on the President to utilize the Defense Production Act to ramp up testing immediately. https://t.co/VrDEwfkFX4"
120,"Not many can say they’ve had the chance to work alongside an American legend. John was more than that, though: he was a kind, passionate man who fought for his vision of a better country and a better world. America will miss him dearly. https://t.co/BiDLCMzomT"
121,"✅Phone
✅Keys
✅Wallet
...
✅MASK!

This is our new normal - make it a habit. Protect yourself, protect others.

Wear a mask. https://t.co/mIn4Cre8EL"
122,"Developing a three-digit suicide prevention hotline is an important step towards  addressing the mental health struggles too many Americans face. I applaud this effort – and in the meantime, don't hesitate to call 1-800-273-8255 if you need help. https://t.co/Ncmdo5QwKG"
123,"Despite his fame, he was a gentle and humble soul who cared deeply about the public he served.

My thoughts and prayers are with his family. May he rest in peace."
124,"We have lost a true American patriot. John Lewis was a hero—a champion of civil rights who put his life on the line for equality and justice. He has fought the good fight, and our nation is a better place because of him. https://t.co/UDegj9rgpy"
125,"#COVID19 has fundamentally changed our economy and our society as we know it, leaving millions of Americans unemployed. 

My bill would help get people back to work, strengthen our economy, and protect the safety of our community. https://t.co/onaTkIBvTh"
126,"Here in #ROC, we take incredible pride in knowing Frederick Douglass was part of our community and rich history. His ideals and resolve remain ingrained here to this day. 

No act of hate can change that, I am so grateful to everyone who worked swiftly to replace this statue. https://t.co/cFPQpkj7we"
127,"This is deeply disturbing.

Scientists need this data to learn from and respond to COVID-19 -- and to guide their ongoing, heroic efforts to keep Americans safe. Pulling the rug out from under them is short-sighted, dangerous, and wrong.

https://t.co/sqkgLRo9cc"
128,"This unprecedented moment in history calls for unprecedented action. Today, I introduced legislation to create a more than a million jobs that will combat COVID-19 and help families and communities across our country. https://t.co/KCLDoN92zQ"
129,Frederick Douglass is an iconic part of Rochester's history - and the ideals he championed remain an essential part of our community fabric.  Renaming the airport in his honor would be a fitting tribute and clear statement of our values to all who visit #Roc. https://t.co/5Ix9OGehcW
130,"This is a big victory, though I wish it weren't a necessary one. 

Now, it's on us to continue to ensure this Administration can't use a pandemic to advance cruel and unwarranted directives. https://t.co/ncvc6qo34s"
131,"🚨Remember to file your taxes by tomorrow!🚨

Because of the #COVID19 pandemic, the deadline to file federal taxes was extended to July 15.

Head to https://t.co/if7TfuoBfN to learn more and determine how to file your taxes in time."
132,Wear your mask. https://t.co/OpdbyJfvAw
133,"If we want our lives and our country to get back to normal, it's imperative that we cut down #COVID19 testing response times and ensure every American who needs one has access to a fast and affordable test.

We need real leadership from the White House. https://t.co/8COBa9vv6j"
134,"COVID-19 has exacerbated significant challenges for families that rely on childcare. That's why this week, my colleagues and I voted for a $10B federal investment to ensure childcare facilities are open, up-to-date, and safe for our children. https://t.co/Y7QQDh31Rw"
135,".@FoodlinkNY is continuing to distribute emergency food supply boxes to families impacted by #COVID19. Visit the link below for their July food distribution schedule. 

https://t.co/dzsGsOEPBc"
136,"#ICYMI Last week I condemned drug makers who continue to raise prices of prescription medicine, taking advantage of our most vulnerable citizens during a global pandemic.

We cannot allow this egregious behavior to continue.
https://t.co/lGjjPXL9Wl"
137,"Today, we say goodbye to a giant in our community - my colleague and longtime partner in government, David Gantt.

David leaves behind an enduring legacy of passionate advocacy that has uplifted so many who call Rochester home. He will be dearly missed. https://t.co/ia0cpMT6Fv"
138,It’s despicable that the President commuted the sentence of a criminal who is in league with...wait for it...the President who commuted his sentence. https://t.co/Ic8bjadM6H
139,"A year ago I introduced a bill to help close the achievement gap &amp; reduce food insecurity. #COVID19 has only intensified the need to provide support for children who are struggling. I'll continue fighting until every student has the resources they need.
https://t.co/e4zIy1RgjE"
140,"We're lucky to be home to the @UofR, whose scientists &amp; clinicians are at the forefront of the national response to this pandemic. It's critical that Congress continues to invest in federal research, so institutions across our country can lead the way in the fight against COVID. https://t.co/GZQbFynuqa"
141,"Drug costs in America are already egregiously high—and to raise them further during a global health crisis when families are already struggling is simply criminal. 

I'll continue working with @HouseDemocrats to stop price gouging and make prescription drugs affordable for all. https://t.co/CC1n8oUN7R"
142,"You can protect yourself and your loved ones from #COVID19. 

Wear a mask. 

For your parents, your neighbor, your community. We're counting on you. https://t.co/6PDZJZ6fVf"
143,"Today's #SCOTUS ruling could result in up to 126,000 women losing contraceptive coverage that their health insurance has already paid for. Not only is this wrong, it's dangerous. Contraceptive care is health care, and I'll continue to fight to ensure every woman has access to it. https://t.co/e747KQ08v8"
144,"Our community knows all too well how devastating flooding can be to local businesses—many of which are already struggling with the severe financial impacts of #COVID19. I'm proud to introduce the PREPARE Act, which will help small businesses prepare for future disasters. https://t.co/PuUaQRMJBX"
145,"We have the most #COVID19 deaths of any country.

This is not leadership. This is short-sighted, dangerous, and irresponsible. https://t.co/55RNpku302"
146,"It's exciting to see our community re-opening – but remember: COVID-19 hasn't gone away. 

It's up to us to remain vigilant and continue doing our part to stop the spread.

Wear a mask. https://t.co/OCrdZynN9L"
147,"The @HouseDemocrats are working to expand access to healthcare, protect people with pre-existing conditions, and lower the cost of prescription drugs.

The President is working to dismantle our healthcare system and deny coverage to those most in need.  https://t.co/JHfsiep6ec"
148,"Grateful to join @SenGillibrand this morning as we fight to provide the stability families need now more than ever by preventing cuts to our education system, critical health and social services, public safety resources, and so much more."
149,Communities across our nation will continue to feel the effects of COVID-19 for months to come – that’s why we must take action to ensure local governments have the resources they need to respond to this unprecedented challenge and preserve essential programs and services. https://t.co/WqGjro1KtH
150,"#COVID19 testing is now available to anyone in NYS!

If you are interested in getting tested, at no cost to you, head to https://t.co/jMOWobURkP to schedule an appointment today."
151,"Stay up to to date with the important work we're doing in Congress to combat #COVID19 and support families in our community. 

Subscribe to my newsletter here! https://t.co/bxmtTWFs28"
152,"I join the entire Rochester community in mourning the loss of my colleague and longtime partner in government, Assemblyman David Gantt. 

Assemblyman Gantt was a dedicated public servant and fierce advocate for Rochester whose passion and tenacity will be dearly missed."
153,"Always a pleasure to join Good Day Rochester and chat with @Mattmolloy! Grateful for the opportunity to discuss the important work we're doing in Congress and our continued efforts to help families cope with the impacts of COVID19. 

Missed it? Watch here: https://t.co/B3umbNK0An"
154,"Today is the last day to apply for the Paycheck Protection Program -- a critical resource to help small businesses stay on their feet through the #COVID19 crisis. 

Click below to learn how to apply! #PPP https://t.co/uhUyRrPB4q"
155,"Just last week, the White House asked the Supreme Court to deny health insurance to millions of Americans and individuals with pre-existing conditions.

Today, @HouseDemocrats are voting to ensure health care is accessible and affordable for everyone."
156,"The #COVID19 pandemic has exacerbated the significant #digitaldivide in our country. As we further rely on the internet to work and educate from home, we must ensure everyone has access to the tools and technology necessary to survive in our connected world. https://t.co/mDfYOTNUIA"
157,"In the middle of a historic global health crisis, Donald Trump is moving to deny health insurance to millions of Americans and individuals with pre-existing conditions.

It's unconscionable. 

https://t.co/rascS3CVJB"
158,"Today, I called on @ATFHQ for answers and action to help address this serious threat to public health. https://t.co/jOupBvhJR4"
159,"Every person in our community, regardless of who they love or how they identify, should feel welcomed and accepted. Thank you to @CountyExecBello for this important showing of support and recognition that #LoveIsLove. Proud to call Monroe County home! https://t.co/aFHEiRFZti"
160,"Now more than ever, we must ensure healthcare is accessible and affordable for everyone - which is why I’m proud to support @HouseDemocrats' Patient Protection &amp; Affordable Care Enhancement Act. 

Together, we're taking action to #LowerCostsForCare for American families. https://t.co/tCGzjGzcV1"
161,RT @FoodlinkNY: Pandemic EBT is a newly approved food assistance benefit set to impact thousands of families in our region. Learn more at:…
162,"#COVID19 has shined a stark spotlight on just how deep the racial inequalities in our nation go. As we rebuild our communities, we must also address the underlying social determinants of health and education that have unjustly plagued communities of color for decades. https://t.co/19196KF2L9"
163,"RT @EdLaborCmte: #COVID19 has exacerbated existing racial inequities in our education, labor, and health care systems.
 
STARTING NOW:
Toda…"
164,"Last month, my colleagues and I sent a letter to Treasury Sec. Mnuchin demanding transparency &amp; accountability around #COVID19 loans. This agreement is a critical step towards ensuring much-needed relief is going to families who need it most- not corporations &amp; special interests. https://t.co/XZoHO54AVo"
165,"For more than a century, Juneteenth has signified many things: a celebration of the accomplishments Black Americans have made; an acknowledgment of the dark past we must continue to work to overcome; and a call to action to ensure equality for ALL who call our nation home."
166,#COVID19 has disrupted every facet of our daily lives—especially our community's small businesses. I’m proud to have helped secure critical relief that will ensure @irondequoit_ny businesses have the resources they need to get through this crisis and emerge stronger than ever. https://t.co/ke9CFaqgw8
167,"During this ongoing public health crisis, reliable healthcare is more important than ever. I'm grateful that NY is extending open enrollment even further to help ensure every family has access to the coverage they need.

Head to https://t.co/Rjh5JqdhX6 and #GetCovered today!"
168,"#COVID19 has caused unprecedented challenges for our communities and placed financial burdens on localities that could severely harm critical educational services. Today, I joined @EdLaborCmte to discuss how we can support our public schools and students through this crisis. https://t.co/swqEpSfObw"
169,"No matter who you are or who you love, every American should have the same fundamental human rights.

This landmark #SCOTUS decision is a critical step forward in achieving the full dignity and equality our LGBTQ+ community deserves. 🏳️‍🌈 https://t.co/yhzNZeBTEo"
170,"There's still time to #GetCounted in the #2020Census. Take a moment this weekend to ensure our community has access to vital resources that will help us recover from #COVID19, and allow us to continue to grow. It only takes a few minutes - visit https://t.co/TjCVqNuwUI! https://t.co/dvrGof7bMV"
171,"As our community continues to reopen, safety remains the top priority. If you own a qualified restaurant, consider attending one of the County's mask distributions to help keep customers and workers safe. https://t.co/xxFafmETQo"
172,"Breonna Taylor was supposed to turn 27 years old today.
 
She is one of countless black women who has been killed without cause or accountability.

Enough is enough."
173,"Today we #WearOrange for the victims, the survivors, and all the families who have suffered from senseless gun violence. 
 
We #WearOrange because gun violence disproportionately impacts communities of color.
 
We #WearOrange to demand action to #EndGunViolence. https://t.co/yEVKzEsR7h"
174,"Grateful to participate in a critical conversation with @HouseBudgetDems to address the social and economic inequalities exacerbated by this global health crisis.

Watch the discussion here: https://t.co/eLqRQf96jh"
175,"As so many across America march for equality, let us not forget that it's our communities of color who have also been disproportionately harmed by #COVID19. It is imperative that our government works to support ALL Americans during this crisis. https://t.co/D4snDP6YTV"
176,"Across our community, families are struggling in so many different ways - including food insecurity. I’m grateful to @FoodlinkNY and @irondequoit_ny for stepping up once again to help support those in need and ensure everyone has access to a healthy, reliable meal. https://t.co/ZtALrItUqH"
177,"I’m grateful to the many who spoke out against injustice yesterday. Indeed, from Frederick Douglass to Susan B. Anthony, it is what our community was founded upon. 

It’s our responsibility to uphold their legacy by turning our anguish into action. We can, and we must, be better."
178,"I share the pain our community feels: for George Floyd, for the many before him, for the hatred and racism that poison our society.

The way we respond to tragedy speaks volumes about who we are and the world we wish to create. Let that be one of peace and unity - not violence."
179,"While this weekend signals the end of #MentalHealthAwarenessMonth, our work to ensure everyone has the support and resources they need is far from over. If you or a loved one needs help, reach out. Find resources at https://t.co/zFT3r3Inx6. https://t.co/lNhWSCV1O0"
180,"Since the beginning of the #COVID19 pandemic, AA meetings and other support groups have implemented creative, virtual ways to come together. If you or a loved one is looking for a meeting, you can find more information below.  https://t.co/xyoRX08ChQ"
181,"From navigating Social Security and Medicare to filling prescriptions, #COVID19 has only exacerbated the unique challenges older Americans face. 

This #OlderAmericansMonth, let's recommit to ensuring everyone has the resources to age with the dignity and respect they deserve. https://t.co/acA9P1vE8Y"
182,"With so much uncertainty in our future, families shouldn’t have to worry about the state of their health care. I've been fighting alongside my colleagues here in the House to find innovative and timely solutions to the problems that #COVID19 continues to exacerbate. https://t.co/Z08guvdCeX"
183,"George Floyd was a father. A friend. 
A perpetual optimist. 

And this week, he was murdered by the very people sworn to protect us.

This hatred is not who we are as Americans. 

We must stop structural racism—now. It is destroying us.

We need #JusticeForGeorgeFloyd. https://t.co/y4ToZBjR3C"
184,We want to keep you up to date with what we’re doing to protect our community and country during the #COVID19 pandemic. Sign up for my newsletter to receive a weekly Coronavirus update here: https://t.co/JxIFrvYOXI https://t.co/D9T6jBdU7S
185,"Si tiene preguntas sobre #COVID19 y su impacto de los servicios, o si quiere saber dónde se puede buscar los recursos como la asistencia alimentaria, ¡le podemos ayudar! Visite https://t.co/L39l2bsbrT para más información. https://t.co/DpCjV8w4xu"
186,Proud to vote to provide continued support and relief for America's small businesses. They're the backbone of our economy and we need to make sure they come out of this pandemic stronger than ever. https://t.co/lWxlhsxDDb
187,Wonderful to see my dear friend Ted O'Brien leaving the hospital after a long battle against #COVID19. Our entire community will be thinking of the O'Brien family as Ted continues to recover. https://t.co/IC5FAjxqHD
188,We need to provide relief to the American people -- not major corporations and special interests. That is why I am calling for strict corporate oversight and accountability measures to be included in any and all #COVID19 relief aid. Read more below: https://t.co/r5Lukmqp6H
189,The @RedCrossWNY is facing a critical shortage due to #COVID19 and is holding a blood drive from 11am-4pm today at the @irondequoit_ny library. Go to https://t.co/FarKSt1N4M to schedule an appointment and help save lives in our community.
190,"The @RedCrossWNY is experiencing an urgent donation shortage because of #COVID19. If you're able, head to the @IronLibrary before 6pm today to give blood or schedule an appointment for between 11am-4pm tomorrow.

Every donation you make saves three lives.

https://t.co/FogndLlZGc"
191,"Spotted on the Genesee Riverway Trail over the weekend. It's a joy to see our community continue to uplift and support all of our essential workers on the frontlines of the fight against #COVID19.

Have you seen other bright spots around town? Be sure to share them with us! https://t.co/KocRrTGwAY"
192,"Today, we come together as a community and a country to honor the brave men and women who made the ultimate sacrifice defending the freedoms we hold dear. On #MemorialDay, let us express our enduring gratitude to these brave patriots and their families. https://t.co/o8tlPhW0Ur"
193,"We are all affected by the #COVID19 pandemic in different ways -- and it's important that we focus on our collective mental health. 

New York State has partnered with @Headspace to provide resources to help during this time of uncertainty. Visit https://t.co/8HTXOg8IBL for more."
194,"It's important to have the full picture of how this pandemic is affecting Monroe County families. Take part in this quick, daily survey about #COVID19 (even if you have no symptoms!) and help ensure we recover stronger than ever. https://t.co/iJNIUcRLAD"
195,Make sure you have the resources to protect yourself. My office has put together a #COVID19 Consumer Protection Guide. Stay up to date and alert by visiting it now. https://t.co/hs4NCLchGy
196,"Even in times of crisis, there is so much to be thankful for - especially our dedicated frontline workers who risk their own health and well-being every day to keep us safe. Their sacrifice does not go unnoticed. 

Read messages of gratitude from across our community: ⬇️ https://t.co/t6pJyTndSE"
197,"New York is still facing a critical blood shortage due to #COVID19. To honor the 139th anniversary of its founding, visit the @RedCross and consider donating blood, if you can. https://t.co/OjiX89AjAh"
198,"It is unconscionable that the Trump administration would act to strip millions of Americans of the coverage they need -- especially now, when access to healthcare is more important than ever. 

We need to protect and expand the #ACA - not gut it of the protections families need. https://t.co/ka6BUjlxuu"
199,"101 years ago today, the House of Representatives passed the 19th Amendment. In honor of Rochester's own Susan B. Anthony-who played an integral role in it's passage-we must continue our tireless fight to ensure every woman has an equal seat at the table. https://t.co/9ie0aYl8Q6"
200,"RT @DrMikeMendoza: The forecast for the long weekend couldn’t be better. Let’s enjoy it responsibly.

When outside please wear a mask, “...…"
201,"This week, I joined a bipartisan group of my colleagues for a virtual Town Hall to talk about the continued federal response to #COVID19 and what's next for our communities. 

If you missed it, you can check out the full video here: https://t.co/QvqmsykhNk"
202,"Though we have developed new normals because of #COVID19, it is still critical to have accurate information as the situation evolves. Sign up for my newsletter to receive updates on the pandemic and what I'm doing to help everyday Americans get through it. https://t.co/bxmtTWFs28 https://t.co/q0Wh1byuz5"
