,Tweet
0,"This weekend, let's enjoy a safe #Halloween &amp; #DiadelosMuertos that keeps us, our families, &amp; our communities healthy. Learn more from these @IDPH guidelines to have a safe weekend: https://t.co/y2gjomuLgK"
1,"I commend my former DC intern Meredith who drove ~1,400 miles to make sure her #vote got counted. #IL03 residents can find information at https://t.co/1WSNyvdnvb to locate an early voting location, find a ballot drop box, find your polling place &amp; access other Voter Services. https://t.co/80HxDUuqye"
2,"Suburban Cook County residents with financial challenges due to #COVID19 may now apply for a one-time $600 cash assistance payment. Applications are open through Nov. 6th, but funds are limited. To learn more &amp; apply, visit https://t.co/Ji9SkJjJYK."
3,Today we celebrate the Sailors who bravely defend our nation. Thank you to all the past and present Sailors for your sacrifice and courage. #NavyDay 🇺🇸⚓️ https://t.co/HOmqFPeWVc
4,"Today on the #DayoftheDeployed, we honor and recognize all of our brave service members who are deployed and their families. Thank you for your sacrifices and dedication to a grateful nation. 🇺🇸"
5,#IL03 residents 65 &amp; over: @MedicareGov #OpenEnrollment is now open through December 7th.  This is the time of the year to review your coverage and make any changes to your 2021 Medicare health and drug plans. Learn more &amp; explore your options at:  https://t.co/oqlIncwbQ9
6,"@CDCgov recommends that everyone 6 months and older should get a #flu vaccine every season. Flu vaccine can reduce flu illnesses, doctors’ visits, hospitalizations and has been shown to be life-saving. #FightFlu and get vaccinated today! Learn more at: https://t.co/K3XAoFWAj0 https://t.co/WkKvLMrAp1"
7,Great to see this $15M CARES Act investment to fund Chicago's @MXDInnovates as they support American #manufacturers in the fight against #COVID-19 by helping to strengthen #supplychains and expediting deployment of medical devices. https://t.co/cLnbL2vivc
8,"Americans continue to struggle with the pandemic crisis, but too many politicians only care about the election. This is a recurring problem in DC which is hurting our nation. @ProbSolveCaucus has shown the bipartisan way forward to provide COVID relief NOW https://t.co/0HiJxZs0b8"
9,"#COVID__19 has been an important reminder of a small, simple practice that can save lives. #HandwashingDay is a chance to remind yourself of the importance of hand washing, when to wash, and best practices for preventing the spread of germs https://t.co/Gz2sWwST8E https://t.co/ysTqv45meb"
10,Happy Columbus Day! Let’s remember that FDR first made Columbus Day a federal holiday at the request of the Knights of Columbus and others to celebrate the contributions to America by Italian-Americans and all Catholics who were facing discrimination and violence. https://t.co/CDKSCglo7m
11,"Nearly 1/5 U.S. adults live with a #mentalillness. This #MentalIllnessAwarenessWeek helps raise awareness about mental health conditions &amp; reminds us @samhsagov &amp; @ILHumanServices have resources to help: https://t.co/9taRG9Kpwy
https://t.co/SrrGHKTNNH https://t.co/IlI0B17Svo"
12,"If you missed the free flu shots at my #SeniorFair this past Tuesday, I encourage you to still get vaccinated to prepare for this flu season. @CDCgov has a helpful tool to find a location to get a flu shot at:  https://t.co/rb9pDBc9HZ."
13,I'm proud to represent @Argonne researchers in the #IL03 congressional district. Thank you for your continued work to fight #coronavirus including this effort towards reusable N95 masks to help keep us safe. #NatLabsInTheFight https://t.co/LKowqG9teJ
14,"We had a great outdoor #SeniorFair yesterday in Burbank where we helped seniors connect with resources across #IL03, get free flu shots, and honored the 2020 Senior of the Year recipients who were recognized for their efforts for going above and beyond in our communities. https://t.co/JRn33oq9Kf"
15,"Tomorrow, I'm hosting an outdoor #SeniorFair &amp; 2020 #SenioroftheYear ceremony. Free flu shots &amp; resources for seniors will be available. Social distancing &amp; masks are required &amp; attendance is staggered by the first letter of your last name. Learn more at https://t.co/kG8qBFBaEx https://t.co/4dRCOOyx4K"
16,RT @ProbSolveCaucus: Statement from Problem Solvers Caucus Co-Chairs Tom Reed (NY-23) &amp; Josh Gottheimer (NJ-5) on Ongoing COVID-19 Relief N…
17,"On Tuesday, I am holding my #SenioroftheYear ceremony &amp; a #SeniorFair providing free flu shots and information for seniors. Attendance is staggered by last name. Social distancing and masks are required to attend this outdoor event. Learn more at https://t.co/tFtuJDouLU. https://t.co/q2AHBvpfDu"
18,"Wishing the President and First Lady a smooth and speedy recovery as they battle COVID-19. My prayers are with them, their family, and the White House medical team as they work to address the virus and prevent further spread."
19,"We need a #COVID19 relief bill that can become law, not another one that is going nowhere, so I voted no on today’s House bill. Americans need relief from the health &amp; economic crises. I helped the @ProbSolveCaucus put forth a bipartisan bill that could get signed into law. [1/2]"
20,"October 1st is the founding anniversary of the PRC. Today, we unite for #GlobalDayofAction as we stand up for freedom for Tibetans, Uyghurs, Hong Kongers, Southern Mongolians, Taiwanese, Chinese, and all who have been suppressed by the CCP and reject CCP tyranny. #ResistCCP"
21,I'm working to push for more COVID-19 relief including funds for K-12 but am disappointed ~6M students who attend private schools were left out of today's bill.  This is a terrible mistake that should be rectified before a final relief package advances. https://t.co/UVdJRCUIMA
22,"Today, the House passed the Mental Health Services for Students Act. I am proud to cosponsor this important legislation that will bolster mental health services in our schools and ensure students have access to critical #mentalhealth resources during #COVID19"
23,"October is two days early in Chicago! With the North Siders and the South Siders in the playoffs, who are you rooting for to win it all? https://t.co/BKZu1WeQcC"
24,"With our fantastic #IL03 @NatlBlueRibbon grammar schools, it's great to see @CPSHancock recognized with this incredible honor. Congratulations to Hancock College Prep's incredible educators and administrators who work hard to educate our students and deserve this recognition."
25,"Fantastic news that @HodgkinsSchool, St. John of the Cross, &amp; @sfxlg_school are 2020 @NatlBlueRibbon recipients. I’m proud to represent these fantastic #IL03 schools. I applaud the educators and administrators who helped earn this incredible honor. Congratulations!"
26,"In honor of #NationalSmallBusinessWeek,  I want to recognize IL's 1.2M small businesses. These businesses are vital to our communities &amp; it's important we support them. Many are struggling right now, which is why I am advocating to get a new #COVID19 deal done. https://t.co/JyLvMMxkIg"
27,"It was great to meet with @JDRFIllinois advocates today. As someone who has lived with #Type1Diabetes for almost 31 years, I enjoyed our dialogue on the importance of fair pricing for #insulin &amp; renewing our commitment to medical research through @NIH’s Special #Diabetes Program. https://t.co/Xwai4DqniM"
28,"This year during Truck Driver Appreciation Week, we especially recognize the importance of those #truckdrivers who have helped keep our economy moving during the #COVID19 pandemic. Thank you truck drivers! #TruckDriverAppreciationWeek #ThankaTrucker #NTDAW2020 🚛 https://t.co/ifA6t8xuP9"
29,Justice Ruth Bader Ginsburg was a trailblazer and a giant of the Supreme Court who had a tremendous impact on our country. https://t.co/WiE9oCBtul
30,"Today on National #POWMIADay, our nation honors and remembers all American Prisoners of War, both those who were held captive and returned and those who remain Missing in Action. Thank you for your service and selfless sacrifices to a grateful nation. #POWMIARecognitionDay 🇺🇸"
31,Wishing all of the Jewish faith and all who celebrate a happy and blessed #RoshHahanah this year. Shana tovah! https://t.co/jeHqqwDiQ9
32,My website has information for #IL03 residents looking to get tested for COVID-19. You can find a #testing location and learn more about testing protocols at: https://t.co/Bkmz0u1zPG
33,"Great to hear from @UofILSystem students today to discuss how they are impacted by #COVID19. I am proud to lead bipartisan calls for additional #HigherEd relief. Supporting our students, educators &amp; innovators is essential to ensure a strong economic recovery from this pandemic. https://t.co/QLBdY9s6BU"
34,Hispanic Americans contribute a great deal to #IL03 and our country. I’m glad to join in celebrating #HispanicHeritageMonth to honor Hispanic and Latino/Latina Americans who have done so much to enrich our community. https://t.co/xJJZfh4eQe
35,I’m disappointed the Speaker seems to have walked back a commitment to get a COVID-19 relief bill deal done. It’s time to follow the PSC lead &amp; negotiate a compromise.
36,"Last week, I chaired @TransportDems #Rail subcommittee hearing on @Amtrak response to #COVID19 to examine how to best address budgetary concerns, while protecting workers &amp; long-distance service in order to provide the foundation for Amtrak's recovery when the pandemic is over. https://t.co/Csdt1V7lMK"
37,Congressman Lipinski Statement on the Bipartisan Problem Solvers Caucus’ “March to Common Ground” COVID-19 Relief Framework: https://t.co/mEi9ssvnkU https://t.co/KT1lCRIYXG
38,"They support us, guide us, and love us. Wishing all #grandparents in #IL03 a happy #GrandparentsDay. Stay safe and healthy. https://t.co/U6rDy23Ws0"
39,#WorldSuicidePreventionDay is a time to raise awareness &amp; break the stigma surrounding #mentalhealth. Take a moment to #BeThere for the people in your life. Learn more about how to prevent suicide at https://t.co/uVE4Ile3B7. #SPM20 #WSPD https://t.co/la9QpQcEOJ
40,"Rep. Lipinski Chicago Tribune op-ed: Private, Catholic and other faith-based schools need help through pandemic too. https://t.co/FcdQQ4bdzT"
41,Today @HouseScience discussed the impact of #coronavirus on university research. Discoveries on college campuses lay the foundation for new technologies &amp; train our future workforce. We must support universities &amp; researchers throughout this #pandemic to help rebuild our economy.
42,"Many colleges &amp; universities are facing #COVID19 related challenges. 100 bipartisan colleagues joined me in May to request higher ed relief. Congress must work together to support students, educators &amp; innovators, to aid economic recovery &amp; avoid further harm to public health."
43,Happy #NationalDogDay from #IL03 Team Lipinski staff dogs! I am proud to have a 100% score from the @HumaneSociety to protect our furry friends who do so much for their owners nationwide. https://t.co/pO9d2aKZdi
44,"By supporting SGOs, Congress can help families who are now facing the gut-wrenching task of having to take a child out of their school because they can no longer pay tuition. [4/6]"
45,"We must help all students, including the 6 million attending private schools, many of which are run by Catholic institutions in urban areas like Chicago &amp; serve low-income and minority communities particularly hard hit by COVID. [2/6]"
46,"As a former teacher, I know how critical it is that students continue their education despite the pandemic. I was proud to support emergency federal funding for K-12 students earlier this year,  but more is now needed. [1/6]"
47,"Today the IHDA Emergency Mortgage Assistance Program in Illinois application period has opened for those unable to pay mortgages due to #COVID19. Funds are limited, so be sure to complete your application ASAP. Learn more at https://t.co/7HVvNunK9D"
48,"Tomorrow the @ILHousing Emergency Mortgage Assistance Program launches to help #renters unable to pay their rent due to #COVID19. Funds are limited, so complete your application ASAP before applications close on August 30th. Visit https://t.co/0xvisoBMTj to apply."
49,"On International Day Commemorating Victims of Acts of Violence Based on Religion or Belief, we remember all who have been persecuted for their beliefs. As co-chair of the International #ReligiousFreedom Caucus, I'm proud to fight for the right to worship freely around the world."
50,"This National Immunization Awareness Month, I thank our researchers working tirelessly to develop a vaccine that will protect against #COVID19. Possible vaccine candidates are beginning large phase 3 trials, including one currently enrolling participants at #UIC in Chicago."
51,Too many Americans are suffering for us to let partisan politics stand in the way of a COVID relief package. I’m proud to join with my fellow @HouseBlueDogs in calling on leadership in both parties to come back to the negotiating table and find solutions for those in need. https://t.co/CO2zrI3XRa
52,"Bernard is a veteran who came to my #IL03 office for help getting his WWII service medals. We worked w/him to obtain 2 Distinguished Flying Crosses &amp; an Air Medal, awarded last year at the Pentagon. Hear his story from my #ConstituentSuccessStories series &amp; learn how we can help! https://t.co/jLLDbRzszb"
53,".@US_FDA granted an emergency use authorization to @Illinois_Alma to begin their new rapid, affordable saliva-based COVID-19 testing on campus. Thanks to our researchers for developing this critical tool to monitor infections and respond to #COVID19 in IL https://t.co/JDcjM4nECX"
54,"As a member of @TransportDems #Aviation subcommittee, #NationalAviationDay is an important day to recognize aviators, flight crews &amp; ground workers connecting us through flight. I'm proud to represent @fly2midway in #IL03 &amp; fight for aviation workers in Congress during #COVID19. https://t.co/24Mbh1lyp2"
55,"Proud to be selected as a #FiscalHero by @FixtheDebt for showing leadership on issues of fiscal responsibility &amp; addressing our #nationaldebt. As we work to provide further relief to end the #COVID19 pandemic, we must also continue to get serious about long-term debt solutions. https://t.co/f9TYkQ9ys3"
56,"RT @ChiPublicHealth: This week, CDPH and @CoreResponse are offering free #COVID19 testing (oral cheek swab) in:
📍Clearing
📍Galewood
📍Calume…"
57,#IL03 residents w/children: the deadline to apply for #pandemic EBT to help buy food for your school-aged children is August 31st. Learn more &amp; apply online @ILHumanServices: https://t.co/kXLOdqJoMo.
58,#IL03 families w/children: @IRSnews is reopening the registration period for fed beneficiaries who didn't receive $500 per child #economicimpactpayments. The period to use the non-filers tool is Aug. 15th to September 30th. Learn more at https://t.co/xpZICr8pTE.
59,"Today is a great day in #IL03 to take a walk and enjoy summer. Be sure to plan ahead, bring a mask, &amp; see what’s open in your county:
🌲Cook County: https://t.co/D6LHffbSKj
🌲Will County: https://t.co/977qQJsguE
🌲DuPage County: https://t.co/4N0Ukw0zMb"
60,"Now more than ever, we are aware of the tremendous sacrifice &amp; care our #healthcenters provide for our communities in #IL03 &amp; across the nation. Wishing all of our doctors, nurses, &amp; #healthcareheroes a happy end to #NationalHealthCenterWeek. Thank you for your service."
61,"My statement on the passing of former Illinois Governor Jim Thompson, a steadfast leader who brought people together to make Illinois a better place for everyone. https://t.co/bgdyxrbLZ0"
62,"Today, we remember the brave service members who responded to the call of duty, proudly served America &amp; helped end #WWII 75 years ago. Thank you to our #WWII #veterans &amp; all #IL03 vets for your service. #VJDay https://t.co/if5TrKcCYg"
63,"85 years ago Pres. Roosevelt signed the Social Security Act into law. Today, 64 million Americans depend on #SocialSecurity. As we face the uncertainty of a public health and economic crisis, we must protect this critical lifeline for older Americans and for future generations. https://t.co/mmW3V5EURn"
64,"In #IL03, I'm glad to help #seniors &amp; Medicare recipients navigate resources &amp; stay safe during this time. #Medicare has helpful info about #COVID19, slowing the spread of #coronavirus, telehealth, Medicare coverage &amp; coping with stress. Learn more at: https://t.co/9fbJBoIjcI."
65,"Today, @ILHousing launched its emergency rental assistance program for renters who are behind on rent due to #COVID19. Funds are limited, so prompt application is encouraged. To learn more, check your eligibility, and apply for rental assistance, visit https://t.co/ZdUQScjdWF."
66,The #HongKong arrests of Jimmy Lai &amp; others is the latest in a series of anti-Democracy actions by Communist China as they try to silence the will of the people &amp; intimidate any who may speak out against them. We must stand united against injustice &amp; demand freedom for Hong Kong.
67,Our nation is served and protected by the brave men &amp; women in the military. Those who are honored with the #PurpleHeart are deserving of our sincere gratitude for what they have sacrificed to defend liberty. Thank you for your service. #PurpleHeartDay https://t.co/GxMOJzvU0I
68,"Today I was joined by 29 other members of Congress in sending a letter to House Leadership requesting inclusion of important considerations for colleges &amp; universities, &amp; their #students in the next #COVID19 relief package. Read our #HigherEd letter here: https://t.co/tDxQrLDy0Z"
69,"#COVID19 impacts Americans every day in every way.
🔬 Research to Find a Cure
✔️ W️ork Safety
☁️ Extreme Weather
✈️ Travel
These are just a few of the topics my colleagues &amp; I on @HouseScience covered in 21 Committee Hearings &amp; Briefings since working from home to #SlowTheSpread https://t.co/PLXDhKMddS"
70,This week I was proud to join with members of the Illinois Congressional delegation asking for an extension of title 32 authorization for @IL_Natl_Guard. During the initial outbreak the National Guard provided testing and other critical support for the COVID-19 response.
71,"Postponing #HongKong legislative elections under the pretext of health concern is another ploy by #CCP to curtail democracy and silence the voices of the people. We must continue to #StandWithHongKong and democracy.
https://t.co/KDv1EL3H7B"
72,"A year ago today, Judy and I were at the Gilroy Garlic Fest when a gunman opened fire, killing three and injuring 17 others, before killing himself. We are eternally grateful to the 3 police officers who stopped the killer. We pray for the souls of those killed &amp; their families."
73,#ViralHepatitis impacts over 325 million people worldwide and deaths from hepatitis are increasing. #WorldHepatitisDay is an opportunity to learn more about these viruses and @CDCgov treatment and prevention efforts. Learn more about #hepatitis viruses at https://t.co/cfV1zuf4zi https://t.co/i3uYRVr0Zm
74,"I am excited that photo competition  submissions are already coming in from constituents across #IL03. Submissions are due September 14th. With youth, adult, and senior categories, the whole family can participate. https://t.co/riqf26EWAe https://t.co/QJD0NkJABY"
75,"RT @BudgetHawks: NEW: The next COVID relief bill could incorporate the bipartisan TRUST Act, a bill which would establish bipartisan bicame…"
76,RT @ClarktheCub: We are all one team. #TeamUpMaskUp https://t.co/NXvnaNkxEx
77,RT @Southpaw: WE ARE ALL ONE HOME TEAM @chicagosmayor  #TeamUpMaskUp https://t.co/v89icCjeFY
78,Yesterday I joined a bipartisan group of over 100 members of Congress in asking the IRS to find solutions for constituents still waiting for their economic impact payments. I continue to hear from #IL03 residents who have not received their payments. They need answers and action.
79,"Illinois residents seeking support for stress or mental health issues related to #COVID19: #Call4Calm is a free, anonymous support text line that connects residents w/counselors within 24hrs.
English: Text TALK to 552020
Spanish: Text HABLAR to 552020"
80,"I applaud the policy reversal on international student visas. It would have been detrimental to our country. During these unprecedented times, universities need flexibility to protect the health and safety of all students while continuing to offer high quality instruction."
81,Tomorrow is the deadline to apply for P-EBT benefits in Illinois. This resource can help families who are struggling to make ends meet buy food for their school-aged children. Learn more &amp; see if you are eligible at: https://t.co/kXLOdqJoMo
82,#IL03 residents: #TaxDay is tomorrow! @IRSnews recommends electronic payment options to make any required tax payments. @IRSnews also offers payment plans and payment agreements for those facing financial hardships who cannot afford pay in full now but file before the deadline.
83,"If you think you have #COVID19 &amp; aren’t sure what to do next, @CDCgov has a #Coronavirus Self Checker tool that asks you a series of questions to help you make an informed decision about seeking appropriate medical care. Click “Self Checker” at this link: https://t.co/kOjdXiSvNr"
84,Do you think you may have #COVID19? Call ahead to consult your doctor and protect others before leaving home. Most people who get sick can take care of themselves at home. Others may need to seek medical care.  Learn more at: https://t.co/FjgFJmMZEj https://t.co/IlFFbBZjfS
85,"Congress has approved over $3 trillion in federal spending to combat the #coronavirus pandemic. Help us ensure that your tax dollars are being spent properly. Report any fraud, waste, or abuse of relief funds by visiting https://t.co/XPMaONOyYX or calling 202-225-4400"
86,"#IL03 residents, @ILSecofState is extending renewals for driver's licenses, ID cards, &amp; more until November 1st. Please make sure to practice #socialdistancing, remember your mask &amp; prepare to wait outside when visiting to renew. Online services are also available. https://t.co/xenVLmZgfN"
87,The MLB schedule was finally released and the Cubs &amp; Sox will be seeing a lot more of each other. Who do you think walks away with the Crosstown Cup? https://t.co/mzSgrYY8rL
88,"As we experience another hot day in #IL03, please utilize or share these resources to stay safe &amp; check for #COVID19 restrictions:
Cook County: https://t.co/l99QbwP3OK
Will County: https://t.co/gufO8ZNbbT
DuPage County: https://t.co/exJYf5pVI5
@NWS Info: https://t.co/2RlEiwB0vV https://t.co/xS8R6nNec2"
89,Colleges need flexibility as they continue to evaluate online options to ensure the safety of all students.  We must continue to welcome international students who make intellectual and cultural contributions and bring $41 billion into the U.S. economy. https://t.co/zy1FtM2MRP
90,Thank you to everyone who attended my Facebook Live information session for seniors on #COVID19 resources and prevention. I have complied all of the contact information from that call and listed it on my website for your conscience. https://t.co/4juwLhE4qk
91,"Had a great conversation today with @ILREALTOR as part of their Let’s Talk Real Estate @ Home series. I appreciated hearing their outlook on the IL housing market, and what we can do to help small businesses, renters, landlords, homeowners and others during #COVID19. https://t.co/ygJUttBQuS"
92,Today I #StandWithStudents by voting to overturn a rule that denies relief to student borrowers who were defrauded by predatory institutions.  We must protect college students and hold sham schools accountable for their deceptive practices.
93,"I'm proud to represent @fly2midway in #IL03. Yesterday, I participated in @HouseScience Space and Aeronautics Subcommittee hearing on #COVID19 &amp; aviation. As air travel continues, it is imperative that we work to protect travelers, employees, and their families. https://t.co/bd3K16Bjrr"
94,"As we highlighted in my #senior FB Live event earlier this week, #coronavirus testing is incredibly important in keeping our communities safe. I have compiled some important information to help #IL03 residents looking to get tested for #COVID19: https://t.co/Bkmz0u1zPG"
95,"We had a great panel this week to discuss #COVID19 response for #seniors. Thank you to panelists from @IL_DoA, @WillCoHealth, @ILSecofState, @UChicagoMed, &amp; @CookCtyHealth for taking the time to share your knowledge w/#IL03 seniors https://t.co/jJrwSFGXRj"
96,Today I participated in @HouseScience Space Subcommittee hearing on #COVID19 &amp; aviation. I asked how we can ensure @FAANews research coordination w/@NIH to keep air travelers safe &amp; how to protect airport employees &amp; travelers @fly2midway in #IL03 &amp; airports around the country. https://t.co/rNJKDRL9xK
97,"I'm hosting a Facebook Live event for Seniors on #COVID19 TOMORROW at 10am. Tune in on my Facebook page to hear from representatives from the Illinois Department on Aging, @ILSecofState, @UChicago, @CookCtyHealth, &amp; more. https://t.co/R9kakxQHqO"
98,"As co-chair of the International Religious Freedom Caucus, #WorldRefugeeDay is an important reminder of all those who have been forced from their homes because of their beliefs. We must do more to end the persecution of religious minorities around the globe."
99,"155 years after the last enslaved Americans were freed, let us take time to remember the victims and to celebrate the brave men and women who fought to end the barbaric practice of slavery. Let us also continue our efforts to root out racism in all its forms this Juneteenth."
