,Tweet
200,"What matters to you? Schools? Transportation? Hospitals? Data from the @uscensusbureau helps inform planning efforts for all these important community resources. To learn how census data impacts you and your community, visit https://t.co/JggTlfL3V0. #2020Census https://t.co/mpDGSdj38p"
201,This week Congress took an important step in the fight against the #coronavirusus by putting significant funding behind vaccine and treatment efforts. Americans should remain diligent in their efforts to protect themselves &amp; stop the spread of the disease. #COVIDー19 https://t.co/h0ree2z3xE
202,Today the House passed an emergency #Covid19 spending package that provides $8.3 billion in response to the #coronavirus public health emergency. The package also includes $950M to support state &amp; local health agencies &amp; $7B in low-interest loans to help affected small businesses
203,"Hopeful news from #Chicago: We are closer to finding a cure for #coronavirus based off of previous research to treat the previous #SARS outbreak. Researchers from @argonne, @UChicago, &amp; @NorthwesternU are working hard to defend public health. #COVID19 https://t.co/wzCF8B7NkC"
204,Yesterday I met with @VFWHQ members to discuss veterans’ health care and easing transitions to civilian careers. I am blessed to be able to meet with so many men and women who have worn their country’s uniform and those who work tirelessly to support them. https://t.co/G8T5R0IUFE
205,"Sending my prayers to the people of Nashville as they work to assess and rebuild the damage from the devastating tornadoes yesterday. My deepest sympathies to those who lost loved ones.
 https://t.co/ddsulcWCwC"
206,"Our first responders must be protected as they care for #coronavirus patients. Mayors, civic leaders &amp; residents of #IL03 all share this priority. I contacted House Appropriations Committee leadership to urge dedicated funding to make sure first responders are protected #COVID19 https://t.co/HxCWHQl2Dw"
207,A complex health system means bad actors can charge huge bills &amp; halt efforts to cut costs. That’s why I introduced the Transparency &amp; Accountability in #HealthCare Costs &amp; Prices Act to bring to light hidden data needed for price transparency &amp; other health reform tools #IL03 🩺
208,.@HouseDemocrats are committed to protecting Americans from the #coronavirus epidemic. We will quickly move forward with an emergency spending package that fully addresses this global emergency and protects crucial health care funding. https://t.co/vHzbTUIHYZ
209,The Centers for Disease Control considers the #coronavirus to be a serious public health threat. It is important that you are aware of the disease and the efforts necessary to prevent its spread. @CDCgov is providing updates. Details ⬇️ #COVIDー19 https://t.co/ZcNgRaDW0U
210,I‘ve been active in the fight against #climatechange since I’ve been in Congress &amp; am hopeful we’ll see action soon. We need to allocate adequate federal funding to protect our #environment &amp; reduce #emissions to ensure the health and safety of future generations. @HouseScience https://t.co/eA07hfZpSv
211,(5/6) Veterans who rely on the VA should have access to the same information as any member of Congress. H.R. 4613 would require the VA to create a website that would allow #Veterans to get all legislatively requested reports.
212,THREAD. Over the past two days the House has passed five pieces of legislation to support #Veterans and their families. I am proud that the People’s House can come together in a bipartisan way to support the individuals who have given so much to our country. https://t.co/WPVXd9yYrm
213,"Today I had the honor of joining #IL03 WWII vets at VFW Post 8821 in Archer Heights to commemorate the 75th anniversary of U.S. forces raising a flag on Iwo Jima, home to one of the war’s bloodiest battles. Thx to the brave Marines who fought &amp; all veterans who defend our country https://t.co/tvhE9xtDIA"
214,"Proud to have a 100% rating from the NETWORK Lobby for Catholic Social Justice. I will continue fighting for policies to protect the environment, improve access to affordable healthcare, raise wages, protect jobs, &amp; other priorities.  @networklobby #IL03 https://t.co/ZwRO1mjsPN"
215,"Great news for today, @VillageofLemont air quality is improving! The village has met fed air quality standards for sulfur dioxide, meaning cleaner, healthier air for Lemont citizens. In Congress, I’m committed to preserving #cleanair for #IL03 &amp; our nation https://t.co/ykN2GN1H2N"
216,The All American Boy &amp; Girl Competition is an opportunity to recognize an impressive group of 7th &amp; 8th grade boys &amp; girls in #IL03 who are already doing great things in their communities. I was honored to acknowledge these future leaders at our ceremony at @morainevalley. https://t.co/uS5Sr4jlPE
217,31 #IL03 students recently participated in @brookfield_zoo #sciencefair &amp; 5 took home awards! Science fairs are a great opportunity for students to demonstrate their #STEM skills. Congratulations to all winners &amp; shout-out to 3 students from Hale Elementary who took home prizes! https://t.co/UYm4l2cMp3
218,"Congrats to St. Patricia science teacher Renee Bartley-Bogard who was named the school’s first-ever finalist for the prestigious #GoldenApple Award for Excellence in Teaching. Only 30 teachers out of 732 nominees were selected as finalists @goldenapple_il 
https://t.co/A8wBXdwbkE"
219,I've formally requested the @epa to assist @ILEPA in conducting a thorough investigation of hazards on the Tinley Park Mental Health Center property and develop a plan that protects the public's health and restores this site to use for the community #IL03 https://t.co/8NIoMmtNRe
220,Wishing a Happy #ValentinesDay to all in #IL03! Have a great day with your significant other and spread love to all who are important in your lives. 💘 https://t.co/h9TJtrQkxC
221,"We have an obligation to care for veterans who are sick or dying as a result of their exposure to Agent Orange. Today, I joined with 76 members of Congress in calling for the federal government to provide relief to 190,000 veterans living with the effects of exposure. #veterans https://t.co/CJY9sj9zCS"
222,#CapitolHill at night with my #SOTU guest Bertha Garcia. She’s a small business owner who followed her dreams to open a restaurant. Bertha gives back to the community and is another success story in #IL03. https://t.co/3j8L0wawHi
223,"The #PROAct:

-Establishes penalties for employers who violate workers’ rights

-Strengthens workers power to negotiate

-Secures workers’ right to decide for themselves whether to form a union. https://t.co/NqErE96mJ3"
224,"#Medicaid offers healthcare coverage to low-income &amp; disabled Americans. Today, I'm joining @AARP to oppose #CMS' misguided proposal to cap Medicaid's funding structure, which would undermine this program &amp; harm vulnerable patients. #HRes826 https://t.co/Envkn2I3yC"
225,"I was proud to cosponsor and help pass H.R. 4031 to reauthorize the Great Lakes Restoration Initiative with increased funding. GLRI projects lead to healthier fisheries, cleaner drinking water, and stronger wildlife habitats for America’s Third Coast. #cleanwater #GreatLakes💧 https://t.co/dFnXGi1RcC"
226,I was pleased to vote for House passage of the USPS Fairness Act (H.R. 2382).  This bill would end the burdensome prefunding mandate for retiree health benefits &amp; allow @USPS to invest in the infrastructure to support a high level of customer service into the future. @TTDAFLCIO
227,"Having lived with type-1 diabetes for over 30 years, I know firsthand how important protections are for those with preexisting conditions. We must fight to maintain these protections for the 54 million Americans who would be denied coverage without them. #StateofHealthCare #SOTU"
228,"Sell-out crowd at our climate change forum at @LewisUniversity. Up first  is Doug Sisterson, a Research Meteorologist focused on #climatechange who just retired from @argonne and currently teaches about climate change science at @northcentralcol. #IL03 https://t.co/XlkB6oY3tS"
229,"Got to catch some friendly competition at St Richard’s to wind down #CatholicSchoolsWeek. The 8th Graders took on the Faculty in a volleyball game for bragging rights. As a former teacher &amp; former 8th grader, I was torn who to root for! 🏐 https://t.co/gDRcK4bmv4"
230,There is no need to panic.  We can all do our part by practicing good hygiene and learning more about the virus at https://t.co/NnKtlCB7T0.  I will be monitoring this situation as new developments unfold.  My highest priority is that our communities remain safe.
231,"HHS Secretary Azar has declared the #Wuhan #coronavirus a public health emergency.  #CDC and other agencies believe risk to the public is low, but are taking precautions, including screening at 20 ports of entry, and keeping U.S. citizens returning from China under quarantine. https://t.co/2YhQiSZVGU"
232,"Pleased that @USEPA awarded over $1.5mil to assist #Illinois in testing for lead in schools’ drinking water. Children are especially vulnerable, and we need to ensure that drinking water in schools is safe. EPA funds should build on @ChiPubSchools efforts to protect students."
233,#TBT to when I visited Archer Pharmacy back in 2009. We are continuing to work in Congress to lower the cost of life-sustaining drugs &amp; keep #healthcare costs low &amp; transparent for #IL03 constituents &amp; across the nation🧑‍⚕️👨‍⚕️🏥 #Rx #affordablehealthcare #pricetransparency https://t.co/OqRnvimQlh
234,"75 years after the liberation of Auschwitz we remember the lives of the people who were tortured &amp; killed in the Holocaust. We honor their lives and re-commit to stand against all forms of hatred, prejudice, &amp; bigotry. #HolocaustRemembranceDay #WeRemember https://t.co/mSsAmlfN0r"
235,So very sorry to hear the tragic news about #KobeBryant and his daughter Gianna. Kobe was an NBA icon who brought joy to basketball fans around the world. My deepest sympathies to his wife and entire Bryant family.
236,Wishing all who celebrate a wonderful #LunarNewYear &amp; happy #YearoftheRat! https://t.co/7tlLECd1Qf
237,"I had a very informative meeting with ISOVAC Products in Romeoville. It was interesting to see their products made right here in #IL03 to protect people from chemical, biological, or radiological threats, including the #coronavirus. https://t.co/YgQURrGGuH"
238,"The #DirtyWaterRule will cancel #CleanWaterAct protections for the streams that feed drinking water sources for millions of people. This decision could have long-term impacts on the health of the environment. We need policies that protect streams, not put them at risk. https://t.co/ggHt6TAZJg"
239,"#ICYMI, here’s when I asked @ENERGY Director of the Office of Science about maintaining U.S. leadership in high performance computing for national security &amp; economic purposes. See his response &amp; the whole hearing below ⬇️ https://t.co/GbIRkNHX9s"
240,On this national holiday we honor and recognize an American icon who made an indelible impact on our country through his unwavering commitment to equality. Dr. King epitomized the progress that can be achieved through dedicated service and sacrifice. #MLKDay https://t.co/FqCO2JQX6R
241,"As we are midway through #NationalMentoringMonth, thank you to all the #mentors who have shaped my life and those shaping the lives of others in their #careers. Take time today to give back to those working hard as they begin their career journeys. https://t.co/HXm4dVD0ES"
242,Outstanding news from @ShepardAstros! 60 #APScholars. Congratulations to these great #IL03 students who have worked hard for this well-deserved honor. https://t.co/zrk9Bu5DZI
243,Today’s House vote sends #impeachment articles against POTUS to the Senate. It’s imperative that the Senate conducts a fair trial that considers all the evidence. The trial should include witnesses who can provide firsthand testimony for Senators &amp; the American people to consider
244,I’m proud to support @AFGENational &amp; their #ProtectEPA #BillofRights launch to protect @EPA workers &amp; the EPA’s mission. We must challenge all efforts that weaken workers’ rights or undermine scientific discovery to protect public health and the environment. https://t.co/rlCJakcAjO
245,"This year, House Democrats fought to secure a better future #ForThePeople.
 
Ensuring our veterans have the health care they deserve. Protecting our clean air and water. Strengthening workers’ rights. And so much more. 
 
Stay tuned for 2020."
246,Wishing members of the Jewish faith and all who celebrate a happy first night of #Hanukkah. https://t.co/ou5Kw3H1aI
247,I’m deeply concerned by today’s federal appeals court ruling that leaves the fate of the #AffordableCareAct under threat of being overturned entirely. Overturning the ACA would be devastating to the 130 million Americans w/ pre-existing conditions who depend on #ACA’s protections https://t.co/8uuF34AxmE
248,"Today I voted to support a bipartisan bill that includes—for the 1st time in 20 years—$25 million for gun violence prevention research at @CDCgov &amp; @NIH.

With these funds, we can better understand the gun violence epidemic, how best to save lives, &amp; finally say #EnoughisEnough https://t.co/kQ4FbCv3kc"
249,Senate Republicans would be doing a great service to the country and restore confidence if they conducted a real trial &amp; tried to get direct evidence House didn’t. Those who pushed House Democrats to move #impeachment right now may have handed President Trump a major victory. 4/4
250,"I’ve always strived to vote in the best interest of my constituents &amp; the country, which is why I sometimes deviate from the party line. Unlike others who called for #impeachment as soon as @potus was elected, I did not. But the Ukraine matter required an impeachment inquiry 1/4 https://t.co/HBdtyccxno"
251,"On #WreathsAcrossAmerica Day, we remember those who gave their lives for our nation and the reason behind the wreaths on their graves. Thank you to our service members, volunteers, and Gold Star Families."
252,"In honor of the House’s passage of #HR3 this week to lower #Rx prices for all Americans, here’s a #fbf of me back in 2006 talking about #hospital price disclosures. Couple familiar faces in there! @RahmEmanuel @newtgingrich 👩‍🔬👨‍🔬🏨 https://t.co/l4XIo0neD8"
253,Congress’ work will not end with this vote.Pharma’s been left in charge for too long leading to jaw-dropping prices with no connection to real research costs.I will continue to advocate to protect family pocketbooks &amp; hold Big Pharma accountable for abuse of our healthcare system
254,"For the first time, Medicare will negotiate on prices to get a better deal for patients for some drugs. People with private health insurance will benefit too, because the negotiated discounts will also apply to drugs on the private market. 2"
255,"Chemical innovation is the foundation of countless industries we rely upon every day, from agriculture to energy to healthcare. #GreenChemistry is also an opportunity to grow our economy. @AmerChemSociety @The_GC3 @AmChemistry @ChemMater @ChemistryNews @LEGO_Group @J_A_C_S"
256,The #SustainableChemistry Act passed the House! Thx to my cosponsor @RepMoolenaar for helping me push through this important legislation to prioritize the development of #greenchemistry in all aspects of everyday life to protect our health &amp; environment https://t.co/ShpPWJlTcT
257,"Today, we recognize the day that continues to live in infamy. We remember the victims of Pearl Harbor and we thank the veterans of World War II and all who stepped up to the call of duty at home and overseas to defend liberty across the world. #PearlHarborDay https://t.co/72HlAv8ikJ"
258,".@EPA is asking the public to comment on what information they should consider when developing a regulation for ethylene oxide emissions from sterilization facilities. After our experience with @Sterigenics1, I will be telling them that public health is the highest priority! #ETO"
259,An estimated 164 MILLION robocalls were made in Illinois last month alone. ENOUGH! It’s time to end the #robocall epidemic. That’s why I voted for the bipartisan Pallone-Thune TRACED Act to #StopBadRobocalls Act on the House floor today. I look forward to @potus signing this bill https://t.co/xmS8MAJHkD
260,"Thank you to everyone who came out for my #LaGrange Medicare #OpenEnrollment presentation! Did you know, Medicare has a new Plan Finder to help you compare 2020 plans? Try it out before the enrollment deadline this Saturday, Dec. 7th! https://t.co/OTgnMuqeyK"
261,"#IDPD is a day to celebrate diversity, practice inclusivity, and recognize those who have fought for the rights of people with disabilities. I’m a proud advocate for people with disabilities. #IL03"
262,Great seeing everyone who came out to our #Medicare presentation in Burbank! I’m always glad to connect seniors w/ resources to help them better understand their healthcare options. Thx to @AARP for presenting. Look forward to tomorrow’s session at La Grange American Legion @10 https://t.co/MPcCq9UIlR
263,Thanks to all who came out to our #FAFSA presentation tonight to help students identify opportunities for financial aid. I will continue to advocate for making college more affordable for working class families. Thank you to @LewisUniversity for giving the presentation! 📝📚 https://t.co/52QxuNL6iU
264,Thank you to all of the #PublicHealth professionals in #IL03 and across the country who dedicate their lives to protect the health of all Americans #PHTYD
265,Today is #takeatraintoworkday. Thanks to all the dedicated rail workers who keep the trains running on time. @TrainsMagazine @metra @amtrak @cta @smartunionworks @tcununionhq @BMWEDIBT https://t.co/glYJjxeMi7
266,"#100x50 legislation will ensure that our planet is protected. I am proud to support the 100% Clean Economy Act of 2019, which not only addresses the climate crisis, but also strengthens our economy and public health."
267,"2/2 BLS data shows that workplace violence in healthcare &amp; social services sectors has increased by 80 percent over the last 10 years. We must take action to reverse this disturbing trend. @AFSCME, @NationalNurses, @nasw, @enaorg &amp; other groups stand in strong support of #HR1309"
268,Proud to be a co-sponsor of the workplace violence prevention legislation that passed the House today. #HR1309 compels @OSHA_DOL to issue a standard requiring employers within the health care &amp; social service sectors to implement comprehensive #ViolencePrevention programs. 1/2
269,Only 9% of Americans with #pancreaticcancer survive 5+ years &amp; it’s the 3rd leading cause of cancer-related deaths in the US. I’m raising awareness on #WPCD to bring attention to the world’s deadliest major cancer and prioritize lifesaving research. #PANCaware
270,The public has a legitimate expectation that the #KeystonePipeline System managed by TC Energy operates safely and without repeated incidents that damage the #environment and threaten the public’s health and security. https://t.co/hD0pzERU7E
271,@HouseScience today subpoenaed @EPAAwheeler to explain why @EPA continues to drag its feet as we oversee the critical program that evaluates risk of #chemicals to human health. It’s important we know why EPA stopped its review of the risk formaldehyde may pose.
272,"Canada, UK, Germany, France, &amp; Japan. #Drugmakers who refuse to negotiate in good faith w/ #Medicare would face stiff penalties. Passing this bill could save patients’ lives &amp; save hundreds of millions of dollars. 4/4"
273,"Today I introduced legislation to fight back against #BigPharma's price-gouging on life-sustaining #RxDrugs. As someone who’s been an insulin-dependent diabetic for 30 years, I’m intimately familiar w/ how much the price of this life-sustaining drug has skyrocketed. ¼ https://t.co/fmTPcwd6Hd"
274,.@epa continues to roll back regulations that protect our health &amp; environment. Today @HouseScience heard from experts about dangers of weakening the regulatory process. The dangers of EPA's outdated regs on #EtO emissions exemplifies importance of using best available science
275,Today I called on @Amtrak to give up operational control of @ChiUnionStation to @Metra to ensure that its operations improve to the level that passengers deserve. 90% of all passengers who pass through CUS are Metra passengers. Will discuss further in #Rail Subcommittee. #twill https://t.co/TsbJyhqTna
276,"A few more photos from #VeteransDay events I attended in Lemont &amp; Palos Hills. Made it to a total of 5 services today. Though each ceremony was unique, what they all shared was a sense of gratitude and reverence for all the men and women who’ve served in our nation’s Armed Forces https://t.co/FUYRpee8Vt"
277,"Of all the races I do every year the #MikeHike 5K in Homer Glen is one of the most special. It honors PFC Mike Olivieri, who lost his life serving in Iraq. Race proceeds support community trails &amp; parks. What a great event on Veterans Day weekend in honor of a true #IL03 hero. https://t.co/oc0pADy736"
278,Thank you to all who came out to my #SeniorFair at Bourbon Street today! It was great to meet everybody and connect you with resources in #IL03. Thanks for a great event! https://t.co/2HQXU2DoXI
279,"Happy #STEMDay! It’s been an excellent year for STEM in #IL03 &amp; across the country. I’m seeing more &amp; more enthusiasm for #STEM education, &amp; as a former engineer, that’s exciting. Here’s to those who are passionate about solving our nation’s challenges now &amp; in the years to come. https://t.co/f5f9kSmh8B"
280,It was great meeting with seniors &amp; community members today at the Bridgeview Oremus Center #SeniorFair. My office is always available to assist those who need help connecting with federal agencies. Thank you to the Oremus Center for hosting! #IL03 https://t.co/Qn52fcLKVN
281,"Communities across the US continue to be exposed to #EtO emissions. This @epa announcement is a step in the right direction, but it’s not enough. EPA must act quickly &amp; reduce emissions from commercial sterilizers like #Sterigenics to protect public health
https://t.co/JrmSiubktS"
282,"Medicare Open Enrollment is happening now! To sign up, update your coverage, or learn more about 2020 health plans, visit https://t.co/rEPOduJV2f. Enrollment ends Dec.7th! https://t.co/y72CurXl0J"
283,"Thank you to all who came out to my #SeniorFair in Oak Lawn today! I’m always happy to provide access to my congressional staff for any help you need w/ federal issues. Thanks to all the local organizations, agencies &amp; businesses who came out to answers questions #IL03 #seniors https://t.co/uyMko1bJc5"
284,#CountMeInADA for #AmericanDiabetesMonth! #T1D is a part of my life &amp; I’m proud to fight for low #healthcare &amp; #prescriptiondrug prices. Over 30mil Americans &amp; approx 1.3mil Illinoisians suffer from #diabetes. I’ll continue to advocate for #diabetics in #IL03 &amp; across our country
285,I enjoyed meeting #IL03 residents in Lockport today at our #seniorfair at Dellwood Park Community Center. Thank you to all who joined us.I’m committed to looking out for the interests of seniors &amp; other residents in the district to make sure they have access to services they need https://t.co/dDth93uAeN
286,"October is Domestic Violence Awareness Month, but violence knows no time limits. Even if you haven’t lived through domestic violence, you likely know someone who has. Join your voice w/ voices of survivors to end abuse &amp; foster hope. #DomesticViolenceAwarenessMonth"
287,"Forty-one years after the Pregnancy Discrimination Act, some women are still forced to choose between a paycheck and a healthy pregnancy. That's why I'm proud to cosponsor the Pregnant Workers Fairness Act. #PWFA #PDA41 #ProtectPregnantWorkers https://t.co/JhV44R2jn5"
288,"""I’m not sure what accountability means if accountability means, Mr. Muilenburg, that you received a $15 million bonus after these planes crashed. I’m not sure who’s been held accountable for this."" #boeing #737MAX @TransportDems https://t.co/nq3iOxmJiV"
289,"Today on #WorldPolioDay, we celebrate US support for the global fight to #endpolio. With this support, @Rotary, @ShotatLife &amp; global partners have reduced polio cases by 99.9% since 1988 by working with governments, health workers, &amp; donors. Together, we will end polio! https://t.co/usdIihlhQA"
290,I thank my bipartisan colleagues in @HouseScience for voting to advance the #SustainableChemistry bill I introduced w/ @RepMoolenaar. I look forward to having this important measure to grow the economy &amp; protect #environmental health brought to the floor for a full vote🧪 #HR2051 https://t.co/1c109SF0qT
291,"I’m saddened to hear of the loss of my colleague Rep. Elijah Cummings. He was a thoughtful and committed representative for his district and strong voice in Congress whom many looked up to. We have lost a great American leader. My condolences to his family, friends and staff."
292,@RideIllinois hosted a meet &amp; greet &amp; #bike ride with me along Centennial Trail. We met in Willow Springs then connected w/the Lemont #Bicyle Club for a ride ending @ImperialOak. Stay tuned for upcoming #IL03 trail projects &amp; thanks to all #cyclists who came out for the ride! https://t.co/hgk9EbBCOt
293,Great chili weather today for the first annual St. Joseph’s Chili Cook-Off and Car Show fundraiser in Summit. Fun activities happening for the whole family till 8. https://t.co/I05YpFK6PG
