,Tweet
100,"I'm hosting a Facebook Live event for Seniors on #COVID19 this Monday, June 22 at 10am. Tune in on my Facebook page to hear from representatives from the Illinois Department on Aging, @ILSecOfState, @UChicago, @CookCtyHealth, &amp; more. https://t.co/jVMQiwv3Qi"
101,"Participating in the #2020Census ensures that #IL03 will receive its fair share of funding for schools, hospitals, roads, bridges, first responders, and so much more. Visit https://t.co/oFnoqiZXcV to learn more."
102,"The Families First #Coronavirus Response Act &amp; subsequent federal relief packages ensure access to free #COVID19 testing, whether you have health insurance or not. Learn more about your testing options on my website at https://t.co/Bkmz0u1zPG"
103,Proud to see @thisisUIC will participate in a phase 3 trial administered by @NIAIDNews testing Moderna’s #vaccine to protect individuals from #COVID19. Thank you to #UIC researchers for continuing to fight the #coronavirus. https://t.co/MSiykmdEIE
104,"Congratulations to Congressional Art Competition #IL03 2020 Winner Eliana Anselmo. Eliana’s work, “Worried about the wrong masks,” will be displayed in the Capitol Complex for 1 year. Thank you to all who submitted their work! https://t.co/tG6ghYZT0A"
105,"During the #COVID19 pandemic, we’ve learned even more about how crucial blood donations are. #WorldBloodDonorDay reminds us of the importance of donating blood if you are able. Find a blood drive near you at: https://t.co/l3qtNhofQE"
106,"Happy birthday @USArmy. For 245 years, you have represented the best of us. Thank you to the brave individuals who serve our nation and to Army families who sacrifice so much for our freedom. https://t.co/q287qvDqIV"
107,Today we honor our flag and celebrate this one nation under God. This #FlagDay as you pass by the Star-Spangled Banner take a moment to remember all those who have sacrificed to keep our flag flying over the land of the free and the home of the brave. https://t.co/26MCeGR9mH
108,"#IL03 Chicago residents: @ChicagoParks west of LSD &amp; most @chipublib are now open. Please make sure to take precautions, maintain social distance, and follow posted regulations to prevent the slow of #COVID19. https://t.co/0xx3GmUWOK"
109,COVID testing is important to slowing the speed of the virus. I have compiled some useful resources to help #IL03 residents find testing locations and  answer key questions about how to get tested. https://t.co/kcM4xAcpfT
110,The #PaycheckProtectionFlexibilityAct gives borrowers more flexibility in using #PPP funds to keep the doors open and employees on the payroll through the #COVID19 pandemic. @SBAgov provides more important info on PPP loans at https://t.co/zvY1jhETZJ
111,"Today I joined my colleagues on the House T&amp;I Committee to discuss the impacts of COVID-19 on transportation workers and transit agencies. I am continuing to fight for @CTA, @Metra, and other regional transit providers negatively affected by #COVID19. https://t.co/HZQSU4Co7m"
112,#IL03 residents: Illinois emissions testing resumed on June 1st at most Illinois Air Team testing locations. Learn more and find additional resources online at https://t.co/vht59KZFWK
113,"#IL03 residents: @ILSecOfState has reopened. Through July 31, facilities will focus on serving only new drivers, customers with expired licenses/ID cards, &amp; vehicle transactions. Masks are required, &amp; social distancing measures will be in place. Learn more https://t.co/tUICJb7nyc"
114,Today we honor the bravery and sacrifice of Allied forces who stormed the beaches of Normandy and liberated a continent 76 years ago. Their heroism should be an example for us all. A great example of American leadership. https://t.co/aQMIAKZjzG
115,"This #OlderAmericansMonth we celebrate the contributions seniors have made in our families and communities. As we continue to confront the #COVID19 pandemic, we must ensure that older Americans have the support they need. Photo from Garfield Ridge Senior Fair 2019. https://t.co/hhR5ebDSL7"
116,"China’s hostile move to strip #HongKong of its autonomy under the pretense of national security is wrong. I stand with the people of Hong Kong who deserve freedom, independence, and protection from unjust persecution. https://t.co/zxoiUTMHAt"
117,No family or individual should go hungry. #WorldHungerDay reminds us that we need to fight food insecurity and ensure that everyone has peace of mind knowing they can stay fed. Find #COVID19 food security resources on my website at https://t.co/XrpDDSF1y0.
118,"As the #COVID19 pandemic impacts the US, scammers have seized the opportunity to prey on people. It is important to protect yourself &amp; your family from #coronavirus scams. Learn more at https://t.co/P5ayzthTsp."
119,"In this uncertain time, it’s important to prioritize #mentalhealth &amp; be aware of those in our communities struggling w/mental illness. This #MentalHealthAwarenessMonth, keep updated on resources &amp; tips from @CDCgov to help you cope &amp; reach out to someone who may be struggling."
120,"This #MemorialDay, we give thanks to all the service members who have lost their lives serving our country. Their service lives on long after they’re gone. While we cannot physically be together to honor their service, it is still necessary to remember their courage and bravery. https://t.co/muAW9zdWUt"
121,Wishing the Muslim community and all who celebrate in #IL03 a happy #EidalFitr and end of #Ramadan. Eid Mubarak! https://t.co/Y6GlksvMk3
122,"From disaster relief to global health initiatives, the #RedCross has served our nation and world for the last 139 years. We are thankful for the hard work of countless staff members and volunteers who have dedicated their lives to service. #AmericanRedCross https://t.co/pKIMQq8h2x"
123,"Our colleges &amp; universities educate the next generation, create jobs in their communities, and spark innovation, including new tech to fight #COVID19. I’m proud to join w/@SusanWBrooks in a bipartisan call for investment in our students and universities. https://t.co/ZcONjI2sAa"
124,"During times of crisis, true heroes emerge. From health care professionals to delivery drivers, grocery store employees to caretakers, first responders to sanitation workers—YOU keep our nation going. Thank you, #EssentialWorkers. #ThankEssentialWorkers"
125,"For #IL03 constituents looking for information on unemployment insurance, the IDES has FAQs you may have during #COVID19. Please visit my website for any additional information on unemployment, coronavirus, or e-learning. Stay healthy &amp; well. https://t.co/atJWXIy0dT"
126,"Wearing a cloth face covering correctly can help stop the spread of #COVID19. That's why I introduced the #MASKSOn Act this month to spread awareness about proper use of PPE. For information on #COVID19 and face coverings, visit https://t.co/qRbeCIiAYl https://t.co/CmLLcTEVY9"
127,"In times like these, there are spotlights on our #firstresponders who are serving under difficult circumstances. Thank you to all the #IL03 police officers for your hard work and sacrifices to keep our communities safe, especially during the #COVID19 pandemic. #NationalPoliceWeek https://t.co/zTUjELoUix"
128,"#IL03 healthcare providers: If you have #N95 respirators &amp; need them to be decontaminated, there is a free opportunity to send your masks for decontamination in Northern Illinois. Learn more at https://t.co/3nXAmWoQGN"
129,"@SusanWBrooks &amp; I are leading 100 members calling on House leadership to support students &amp; higher ed. U.S. universities &amp; colleges lead world in teaching, research &amp; innovation. We need them to fight #COVID19 and promote jobs &amp; econ recovery #HigherEd100 https://t.co/wpa62PLbfQ"
130,"Yesterday, @IllinoisIDES Pandemic Unemployment Assistance went live. Make sure to apply for regular UI before applying for #PUA &amp; submit a new app for PUA. You can also set up direct deposit payment in your regular UI account. Learn more ⬇️ https://t.co/YhmqFk7SGC"
131,Today I joined @HouseScience and industry leaders to discuss the importance of American manufacturing in addressing the #COVID19 crisis and rebuilding our economy. Proud to be joined by Chicago-based @MxDInnovates. We agree that we need the #MADEHEREAct to jumpstart innovation. https://t.co/Db3hzrBVn9
132,"#IL03 east residents: the Blue Angels are flying over Chicago, Bedford Park, Burbank, Oak Lawn, &amp; more today between 11:45 AM and 12 PM. Be sure to maintain proper #socialdistancing when viewing. Thank you to our #COVID19 healthcare workers &amp; the Blue Angels for this tribute."
133,#IL03 health centers @pchcares &amp; @imancentral have received @HRSAgov funds for expanding #COVID19 testing capacity. These funds will provide needed support for testing in our community. Learn more how your health organization can apply for COVID-19 support https://t.co/bbAK7pJ23M
134,"Yesterday @NSF celebrated 70 years. We appreciate the role of NSF scientists “to advance the national health, prosperity, and welfare.” As a @HouseScience member I’ll support their work to fight #COVID19 &amp; ensure the U.S. remains a leader in science &amp; tech (Photo from 4/2010)#NSF https://t.co/Ger9N0ltqy"
135,"During this crisis, it is imperative employers maintain safe &amp; sanitary work environments to minimize the risk of spreading #COVID19. If you have concerns about your safety at work, please contact the Workplace Rights Bureau @ILAttyGeneral at workplacerights@atg.state.il.us"
136,"For #IL03 constituents looking for information on unemployment insurance, the IDES has answers to FAQs you may have about benefits during #COVID19. Please visit my website for any additional information on unemployment, coronavirus, or e-learning. https://t.co/atJWXIPBCt"
137,"Thank you to all the teachers in #IL03 &amp; across our country who are staying connected to their students w/#distancelearning during this challenging time. If you know any teachers, please let them know they’re appreciated. #TeacherAppreciationWeek #ThankaTeacher 👨‍🏫👩‍🏫 https://t.co/mZZ43wfhDr"
138,"Now is a time where believers of all faiths rooted in prayer can join together to pray for a better, safer, healthier world. This #NationalDayofPrayer, let's take time to ground &amp; pray for our first responders, our essential workers, our communities, &amp; our world."
139,"Thank you to our #IL03 nurses working hard to keep us healthy during this pandemic. Their response to #COVID19 has shown their constant commitment, dedication, and sacrifice as they work to help patients and protect public health. #NationalNursesDay https://t.co/GRE5jxx67f"
140,"As the COVID-19 crisis goes on, most of Congress has been left on the sidelines. Still, the federal government has spent $2.5 trillion with more to follow. This is unacceptable in our democracy. If businesses can find a way to operate remotely, so can we. https://t.co/HBniRHMtd6"
141,"I was happy to join @HouseScience to learn more about COVID-19 and federal research. In addition to cutting-edge medical research, I'm proud to support @NSF_SBE research into how to battle this virus by empowering people to make informed behavioral choices. https://t.co/X5RgmuiyKV"
142,The Governor's EO requires people in Illinois to wear a face covering or mask for all public places where #socialdistancing can’t be maintained for individuals over 2 &amp; medically able to tolerate one. Learn more how to make a cloth face covering: https://t.co/FlvZjy6axC
143,"As we #StayAtHome, our teachers &amp; parents have been phenomenal &amp; creative to keep kids educated during this difficult time. I’m glad to provide additional #elearning resources, school district #COVID19 info, &amp; more on my website. See more at https://t.co/QCwtQSX8nn. Stay healthy."
144,"As an avid biker, I’m glad to begin #NationalBikeMonth today. #Biking is great for our environment, health, &amp; relationship with nature &amp; our communities. Be sure to follow social distancing guidelines when biking during the extended #StayAtHome order &amp; stay safe. #BikesUnite https://t.co/UmLoeVBiMg"
145,"The current pandemic reminds us that a viral outbreak anywhere impacts us all. While our scientists are working hard to develop a vaccine to fight #COVID19, let’s celebrate those health professionals working to fight preventable diseases w/already developed vaccines #VaccinesWork"
146,"If you are feeling stressed or anxious about #COVID19, make time to do activities that you enjoy and can help you relax. If you or a loved one is feeling overwhelmed, get support 24/7 by calling 1-800-985-5990 or text TalkWithUs to 66746.  https://t.co/JDdwVbR59Q https://t.co/UYY3YaUbDf"
147,Reminder for VA &amp; SSI recipients who have dependents: @IRSnews has issued an alert to act by May 5 if you aren't required to file 2018 or 2019 tax returns to claim your dependents and receive the full amount of your #economicimpact payment. Learn more at https://t.co/DzUI9YTYOd
148,[THREAD 1/2] Remembering today workers who lost their lives while doing their jobs. #WorkersMemorialDay is an opportunity to stand behind workers in America to ensure they're protected &amp; safe. Thank you to our #essentialworkers keeping our economy running while many #StayatHome.
149,"105 years later, let us continue to remember those 1.5 million individuals who lost their lives in the Armenian Genocide and renew our resolve to prevent future mass atrocities. #ArmenianGenocide"
150,Wishing the Muslim community of #IL03 and all who observe a blessed #Ramadan this year. Ramadan Mubarak. https://t.co/vbpRy2gDhh
151,"Today the House will vote on H.R. 266 to extend the #PPP and provide much needed support to hospitals and health care workers. I support this legislation, and I'm disappointed that the House has not amended its rules to allow full participation by all members during this crisis. https://t.co/3N8gDBiDeO"
152,"On this 50th anniversary of #EarthDay, let’s come together to beat this virus and protect our environment, so that future generations can continue to enjoy the wonders of creation. #EarthDay50 https://t.co/NWEMXElQfZ"
153,"RT @stevenmnuchin1: If you are a Social Security, railroad retirement or veterans benefit recipient who has qualifying children and did NOT…"
154,".@IDPH has produced a comprehensive list of FAQ’s about #COVID19 &amp; the State of Illinois’ response efforts. Text COVID to (312) 500-3836 for more information. For Spanish language information, text COVIDESP to the same number. #coronavirus"
155,"Transit workers are on the front lines of this crisis. We owe a debt of gratitude #ToThoseWhoKeepUsMoving. Transit workers are connecting individuals to food, medical care, and other essential services around #IL03. Please #StayatHome to protect these workers and their families."
156,"[Thread] Exploiting the Covid-19 crisis as a cover to arrest pro-democracy activists is deplorable. This past summer I met with one of those arrested, Martin Lee, who is known as the ""Father of Democracy"" in Hong Kong."
157,"Today @EPA determined that it is not “necessary or appropriate” to limit toxic mercury emissions into our environment. As we address this current health crisis, EPA needs to listen to scientists and take action to defend public health, not weaken our existing protections."
158,"I continue work from home “office” to help #IL03 constituents &amp; country get through #COVID19 crisis. Today I’ve had meetings w/@HouseDemocrats, @ProbSolveCaucus &amp; @HouseScience focused on keeping people safe &amp; economically sound. Stay safe, healthy, &amp; #StayatHome🏡 #AllInIllinois https://t.co/qyjHKGP3YV"
159,"Practice social distancing by putting space between yourself and others. Continue to practice healthy habits, like washing your hands for at least 20 seconds and staying home if you’re sick, to help slow the spread of #COVID19. #IL03
Learn more: https://t.co/bAhOYSnqnk https://t.co/rHWFMltsij"
160,"I’m pleased to announce that @HRSAgov has awarded over $51mil to 45 community health centers across IL, including @pchcares &amp; @FriendHealth_ w/clinics in #IL03. Courageous health center staff are working hard against #COVID19. For more information, visit https://t.co/lE3aPhn4cp."
161,"This #WorldHealthDay recognizes the critical work of #nurses &amp; #midwives in the International Year of the Nurse &amp; Midwife. Nurses, midwives, and other healthcare professionals do heroic work. Thank you for all that you do to save lives. https://t.co/CazLjrdACb"
162,"RT @CDCgov: Take action to slow the spread of #COVID19 by wearing a cloth face covering in public spaces, keeping at least 6 feet of physic…"
163,Proud to see Chicago-area researchers @NorthwesternU working to develop facemasks with antiviral properties to help slow the spread of COVID19. As a Senior Member of @HouseScience I will continue to advocate for @NSF funding like this to combat #COVID19. https://t.co/Ce13bdu0YZ
164,"The best way for us to beat COVID-19 &amp; address its impacts is to work together-socially distanced, of course-to put our country over political party. Read  @ProbSolveCaucus co-chairs @RepJoshG @RepTomReed 
op-ed to learn about the PSC bipartisan framework. https://t.co/Uq64XetNCw"
165,Another great teacher parade in #IL03 with @DoreElementary. Thank you to our educators for your hard work to educate students remotely &amp; keep these important connections while #socialdistancing. Stay healthy &amp; safe. https://t.co/VHSFtLPfBk
166,"Together we can stop the spread of #COVID19 by heading the advice of healthcare professionals, practicing social distancing, and by staying #AllInIllinois"
167,I am proud to join with my fellow @HouseBlueDogs in calling for bipartisan solutions to address COVID-19 that put the American people first. https://t.co/3QkIZAYxvO
168,Illinois is encouraging licensed healthcare workers to register for the Illinois HELPS Program. The program allows healthcare professionals to respond when activated during a public health emergency. Licensed healthcare workers can join online by visiting https://t.co/YVjLKSvGfO.
169,"My website offers resources on #COVID19, and what the recently passed #CARESAct means for #IL03 residents and small businesses. At https://t.co/m10ijEFUnW you can find the latest updates, sign up for my COVID-19 newsletter, and learn more about what the stimulus means for you."
170,"Please continue to follow Illinois’ #ShelterinPlace if you are not an essential worker or using essential services. Bring your workouts home, order delivery or cook at home, stay connected online, &amp; #workfromhome if you can. Stay safe &amp; healthy. We save lives when we #StayatHome https://t.co/cKG4fTvGJR"
171,"Jerry Mulvihill is an incredible public servant who always goes above and beyond in support of #IL03 constituents. Working with Jerry is a great honor. We can all learn something from his passion, his willingness to listen, and his desire to help others.https://t.co/ZdjBBvhaxG"
172,"This year #NationalDoctorsDay shines light on the heroism of doctors on the front lines battling #COVID19 and those continuing to care for Americans with serious health conditions. Thank you for your dedication to the study, advancement, &amp; thoughtful practice of medicine. #IL03 https://t.co/0JCVOJZHlI"
173,Thank you to our #transit workers in #IL03 who are still on the job helping essential employees get to work and connecting people to essential services. Please help keep them safe by staying at home unless you are an essential worker or using essential services. https://t.co/L9a3Rra3St
174,"I am proud that @argonne in #IL03 is on the front lines of understanding COVID19 and finding a vaccine. Over the years, I've fought for more funding for work @argonne and today's package included nearly $100 million to support DOE research like this to fight the disease. https://t.co/3YQGX23oaE"
175,"For many Americans, the #COVID19 pandemic has been a source of fear or anxiety. That is especially true of our nation's children. The CDC has created this valuable resource to help kids deal with the ongoing #COVID19 crisis. https://t.co/IbslrwX944"
176,Today the President approved Illinois's Disaster Declaration to pave the way for additional federal support to respond to the COVID-19 outbreak. It is important that these federal funds be released as quickly as possible to protect public health and safety. #IL03
177,"Even as the #COVID19 crisis requires you to stay at home, there may be opportunities for healthy individuals in #IL03 to help respond to the ongoing crisis. Please visit https://t.co/3S8DpB471P to learn more and see if you can help. #tbt https://t.co/5P3F39f0Gw"
178,Great to see our wonderful #IL03 educators seeing their students while #socialdistancing. A heartwarming story from Lockport today! Thank you to all of the teachers who have worked quickly to adapt courses and continue to provide excellent instruction to our young people. https://t.co/rplDJy8ylE
179,Congressman Lipinski issued a statement on the bipartisan COVID-19 bill agreement #IL03. https://t.co/4L63foUJgy
180,"Today, while we recognize the heroism of those in our everyday lives, we should always remember those who have given the ultimate sacrifice for our country #MedalofHonorDay. Thank you #veterans."
181,"Symptoms of #coronavirus include:
1️⃣ Fever
2️⃣ Cough
3️⃣ Shortness of breath
While IL is practicing #shelterinplace, make sure you’re well aware of the symptoms of #COVID19 w/information from @CDCgov at https://t.co/xQmIFPAa4X. Stay safe. https://t.co/u7ueHnO3od"
182,"Blood donations are in urgent demand across the country. If you are well, please consider scheduling an appointment in advance to #donateblood. Your donation can save lives. https://t.co/7IZWXDwuB6 Remember to maintain a healthy distance from others and stay home if you feel sick"
183,"[3/4] Under today’s order, you are still allowed to leave home for groceries, food, medication, health services, or if you are providing any of these essential services for others."
184,"[2/4] To learn more about what is or is not permitted under the order, please visit https://t.co/UJSn0oMs7d. #COVID19"
185,"[THREAD] This afternoon @GovPritzker issued a “stay at home” order for the state. Residents can still leave home for health or safety reasons, for necessary supplies and services, for outdoor activity with a safe distance from others, to care for others, and for essential work."
186,"The ongoing #COVID19 crisis can pose serious mental health risks. If you are experiencing stress or anxiety associated with COVID19, please consult the CDC’s mental health recommendations and reach out to SAMHSA’s Distress Helpline if you need support. https://t.co/4jM54tiUdq"
187,Those of us living w/#diabetes need to take extra precautions to avoid exposure to #COVID19. It’s important to have a plan in place in case you do get sick. Please consult the guidance from @AmDiabetesAssn on how to protect yourself &amp; prepare. https://t.co/00p7DxXjLT
188,"Things are difficult right now in our community. As our healthcare professionals work diligently to combat this crisis, let’s remember the promise of new beginnings and brighter days ahead on this first day of #Spring. https://t.co/9EtH10mjNY"
189,"Veterans, please be sure that you are aware of the VA’s latest recommendations on #COVID19 If you have fever, cough, or shortness of breath, please contact your local VA facility. https://t.co/0B2u6ojmYa"
190,The CDC has offered some suggestions for how to prepare your home for #COVID19. These are basic steps that you can take to help keep yourself and your family safe. https://t.co/UzukYtYVaX
191,Thank you to our #healthcare workers for being on the front lines helping treat #COVID19 patients &amp; keeping us healthy. Our district and nation cannot express our gratitude for your incredible sacrifice. #coronavirus https://t.co/AkCpODQfmD
192,"The long waits at customs at O’Hare are deeply concerning. We must be diligent about stopping the spread of the #coronavirus, but screening must be efficient &amp; not result in large crowds stuck waiting for hours on end. I will be working w/ my House colleagues to fix this process. https://t.co/eR9XsbZvs9"
193,"Thank you to all who called &amp; tuned into my #COVID19 tele-town hall. #ICYMI, listen to the audio recording at https://t.co/odWbFh8ZpU. For the latest updates, follow @CDCgov. Stay healthy &amp; safe this weekend. https://t.co/sAWj8Oa5rr"
194,"In case you missed the tele-town hall &amp; still have COVID-19 questions, please refer to @CDCgov - https://t.co/ayGFwKkYei."
195,Our COVID-19 Tele-Town Hall is live! Call (888) 652-0384 with your questions to hear from a panel of experts on coronavirus.
196,Please join me for a telephone town hall tomorrow at 10 a.m. to discuss the COVID-19 coronavirus. #IL03 https://t.co/jLgXAYhVNE
197,I welcome you to join me Sat. March 14th at 10am for a live tele-town hall about the COVID-19 coronavirus to hear from health experts on steps to prevent the spread of the coronavirus and to address any questions you might have. You can dial in at 888-652-0384 starting at 10am.
198,"Studying the health impacts of #therapydogs can show how our furry companions can also help vulnerable populations. I’ve introduced the #DOGSAct to explore the opportunities therapy dogs can provide for our veterans, seniors, children w/developmental disabilities, &amp; more. 🐶"
199,"For all #IL03 residents – BE ON ALERT for any fake coronavirus “cures.” Please consult this list and be watchful for fraudulent treatments or cures for #coronavirus. https://t.co/xQd2btFU9b

For more information on the coronavirus, please visit https://t.co/rnpCuMiSBI."
