,Tweet
0,This mornings GDP report shows how the Great American Comeback is ready to get even better traction in the face of the pandemic. Our country is strong and resilient and the American people are ready for takeoff. Nancy Pelosi needs to get out of the way and let America grow!
1,"What are members of the Biden family or those who are involved with them afraid of? 

What could have been in those documents that they vanished in such a manner as this? 

Will the American free press ask these and other questions of Joe Biden? https://t.co/PQdtHnAVep"
2,"For those who peddled the tripe of the “Anonymous” author, let this sink in for a while and consider how corrupt the MSM media are who breathlessly claim the allegations about the Biden family are baseless and unsubstantiated. https://t.co/P08qWwBu0n"
3,"Nancy Pelosi’s response to Justice Barrett? Let’s pack the Supreme Court. Let’s pack the lower courts, too. Free and fair elections have consequences for those who fall short. However, these are the ideas of those who seek to erode freedom and liberty, not protect them. https://t.co/lZ48C2SwlY"
4,"Thank God for the @USMarshalsHQ and those in our law enforcement who never give up. I’m hopeful these children’s lives will soon have a better future than what likely was ahead of them before. Great work! Let’s send those responsible away for a long time!
https://t.co/Z9AhY7uo2O"
5,Most of my professional career before public service is because of rodeos and the people who organize and participate in them. I have so many friends to this day because of these events. They are a fabric of rural America and I hope they return! https://t.co/LRIphLqC6t
6,"The Green New Deal will ruin our nations energy policies and decimate sectors like American agriculture who put our food on America’s tables and clothes on our backs. They want to make America a socialist nation, not energy independent."
7,"Surely this isn’t the “Build it Back Better” that Joe Biden wants. Who built the cages, Joe? Better yet, who took them down. https://t.co/zTaYdtG0BB"
8,No President has ever been as tough on China and supported America’s farmers and ranchers than President Trump. Eighty five percent of those who make our food and fiber know he has their backs and that Joe Biden won’t.
9,"America’s farmers and ranchers want a President who will fight for them to be treated fairly and appropriately when global actors want to do otherwise. My interview yesterday with @cvpayne where we talked about the solid support for President Trump:
https://t.co/w3NafWdnip"
10,"Just another liberal white guy talking down to and being nasty to a woman he doesn’t agree with. I’ve always been told it’s this side of the political spectrum who are nice, tolerant, and inclusive. Guess there are exceptions...? https://t.co/s3g6CdUjDQ"
11,RT @SteveScalise: The same people who spent YEARS promoting the phony Steele Dossier are now working overtime to keep you from even seeing…
12,"RT @ArFB: Today, and everyday, we celebrate those who provide food, fiber and shelter for the world. #NationalFarmersDay #AgIsEssential #St…"
13,"RT @GOPLeader: Amy Coney Barrett is a strong woman who will uphold the Constitution as our Founders intended.

And that terrifies the Democ…"
14,"RT @TheCottonBoard: We are so thankful for the families who grow cotton. Today, on #NationalFarmersDay, we wanted to share this glimpse int…"
15,"RT @NeCGA: Today is #NationalFarmersDay! A day to give a well deserved thank you to those who work 365 days a year to feed, fuel and clothe…"
16,RT @AgCouncilofAr: Happy #NationalFarmersDay - A day to recognize American farmers who's work it is to convert seed into a bounty of food &amp;…
17,"When the @WHO comes around:

“Lockdowns just have one consequence that you must never ever belittle, and that is making poor people an awful lot poorer,” he said.”

Newsom, Whitmer, Cuomo, DeBlasio, and others should take note. 
https://t.co/h0UkNNBcaP"
18,"Reliable connectivity is now almost essential for work, education, and even healthcare access. I appreciate @SecretarySonny's continued support for rural America and his investment in these Arkansas communities. #RuralBroadband 
https://t.co/HOUgLBQ4CG"
19,"While many in the media almost seem upset that the President is in great shape and back to work, countless Americans are glad he and the First Lady are well. We all should celebrate when anyone recovers from COVID and mourn with those who tragically lose friends and loved ones."
20,"As a veteran, I’m saddened and perplexed that someone in the American media establishment would want to end the amazing care our badly wounded troops receive at Walter Reed who have been in battle. But, this is where we are. Maybe she will reconsider her opinion. https://t.co/HDicClMSjU"
21,"It’s great news that @POTUS will be departing Walter Reed and heading back to the White House. There are more who are getting better care and treatment who’ve been infected. Sadly, many still suffer and who also pass away. Let’s remain prayerful for the USA and all affected!"
22,"Greedy PBMs have threatened independent pharmacists for far too long. If they cared about providing accessible and efficient healthcare for patients they wouldn't be creating havoc for rural consumers and pharmacists. #PBMs 
https://t.co/YRFX0cUTWm"
23,"The progress that @POTUS is making is great &amp; the medical team who are treating him are to be commended. Our doctors &amp; nurses have been valiant care givers during this entire pandemic. I hope @FLOTUS is recovering just as quickly. Sadly, the press doesn’t seem interested in her."
24,"When times are tough, friends are there to help. What a wonderful gesture by those who were able. #RuralAmerica https://t.co/Vd5LBhwFIn"
25,"I hope you’ll continue to keep the President - along with everyone whose suffering from COVID and who’ve experienced its horrible effects - and our country in your prayers. This scourge of a virus knows no person, creed, or age that it infects. Keep fighting, Mr President! https://t.co/py6DYdtar1"
26,"RT @realDonaldTrump: Doctors, Nurses and ALL at the GREAT Walter Reed Medical Center, and others from likewise incredible institutions who…"
27,"RT @michelepexner: Hi @apalmerdc - Actually, @GOPLeader called for a testing strategy back in May. Your publication reported it and you’re…"
28,"Stacy and I will be praying for a speedy and full recovery for the President, First Lady, and others in the White House who have contracted this horrible disease. Thankfully our understanding of this virus and treatments continues to improve, helping so many fully recover."
29,"RT @HouseGOP: .@China_TaskForce's report is a roadmap to:
+ Hold the CCP accountable for their role in the COVID-19 pandemic
+ Bolster our…"
30,"Antifa is an organization that is wreaking havoc and terror across the country and in many places businesses are closing and cities are burning. They’re assaulting people and in some cases, murdering innocent people.

That’s some kind of “idea”."
31,"Nothing to see here, other than complete incompetence in the country’s largest city, completely messing up ballots for voters. Election fraud is a significant issue and those who are responsible for this on state/local levels are accountable for situations like this. Unacceptable https://t.co/MJhEkkb6SO"
32,"Rural America - where friends look after one another, help when times and are tough, and where everyone chips in when a family has a crisis. America’s farmers and ranchers never stop, and neither do those who can when it’s critical. God bless them all!🇺🇸
https://t.co/PGYRhnJQel"
33,"Democrats are nastily attacking a highly accomplished judge who has a wonderful family, including two adopted children. All indications are Amy Coney Barrett will be nominated today and with it the Democrats true beliefs about women who don’t share their values. Remember that."
34,There’s been a lot news come out of the #RussiaHoax the last 24-hours but no one could tell you what it is because the media is busy working on the next hoax. It’s clear there’s been an ongoing “resistance” for the whole Trump Presidency. And yet he’s persisted in spite of it all
35,RT @SecretarySonny: Farming isn't always the safest profession - we need to improve safety &amp; pursue initiatives that create healthier work…
36,"Meanwhile, it’s harvest time and our producers are tirelessly working to bring in this years crop with uncertainty because House Democrats are going for the socialist grab-bag of demands. They’re so out-of-touch it’s ridiculous. Support those who’ve tirelessly supported us all!"
37,"It was out, then it was in, and now it’s back out. The message is clear that Nancy Pelosi and her lieutenants are using America’s farmers and ranchers for political games. These are the same people who have worked tirelessly to keep us all fed and our shelves stocked. Shameful!"
38,It’s official - the radical left has taken over the Democrat Party and it’s no mystery what their agenda is and what it’s about. I hope America realizes this is who controls Joe Biden. These are the people who say “anything is on the table”. https://t.co/9yd3Zw4kkz
39,"The mirage is lifting from far-left Democrats who’ve only pretended that separation of powers and respect between three, co-equal branches of government actually existed.

They’ve never held those beliefs and they’re showing America it’s about absolute power and control. 
👇🏼 https://t.co/e46ZuMiHwE"
40,"The Founding Fathers believed this nation was given to us all by God and that we have many inalienable rights and liberties, among those our freedom of religion. I greatly appreciate Jim Caviezel and his comments about our rights as Christians during COVID
https://t.co/CyacKXOnRD"
41,RT @realDonaldTrump: .@GOP  We were put in this position of power and importance to make decisions for the people who so proudly elected us…
42,"While many are respectfully mourning the loss of Justice Ginsburg and her time of public service, others are grotesquely calling for violence and destruction over the vacancy. Democrat leaders must condemn those who spew such words or be accountable for enabling them."
43,RT @GOPLeader: Justice Ruth Bader Ginsburg was a trailblazer who served the Supreme Court—and the country—faithfully for 27 years. My praye…
44,Anyone who devotes their lives to public service deserves our respect and admiration. Justice Ginsberg served our nation on the highest court and adjudicated cases that affected countless Americans. May her family find peace in her passing. #RIP
45,It’s despicable that Nancy Pelosi and her lieutenants are holding America’s Ag-producers hostage in the CR negotiations. She’s telling those who kept us fed and our shelves full during a pandemic to go pound sand. Just when you thought she couldn’t go any lower! #FundCCC
46,Where was the Speaker for the many nights of riots in Portland? What about Kenosha? Or New York City? Rochester? All of a sudden she has the temerity to be against those who are ruining small business owners lives and those of their community? Guess she had a hair appointment 🤷🏻‍♂️ https://t.co/hh9TW9W1uU
47,"How wrong was this guy? Here’s a guess... every way possible. Keep trying, John. Meanwhile, the rest of us who want peace and bad actors held to account will keep pressing onward. #PeaceAccord #AbrahamAccords https://t.co/C6AlDorgYJ"
48,RT @PatrickMcHenry: Gig workers have been a lifeline for Americans throughout the #coronavirus pandemic from delivering groceries to a home…
49,"America’s national security is tied directly to us being food and fiber secure. Today, I introduced legislation that would further prioritize our efforts to keep America safe from those who would want to do us harm. #AgriTalk #agriculture #NatSec

https://t.co/uwJB8fKumy"
50,"As this day keeps moving along, so do the number of nations who could choose peace over generations of disagreement and violence. Saying there were detractors to the President is an understatement. Saying he’s done negotiating peace agreements? That’s one, too! #PeaceAccord https://t.co/uuoOhoyirC"
51,"As it has been said, there is nothing new under the sun. Nancy Pelosi has been doing this for some time. Even those in her own party are sick of it.

Let’s hope more Americans see it for how he sees it... a charade. https://t.co/IKMRy85Khw"
52,"September marks the 30th annual Rice Month, where we celebrate the 125,000 folks who play a role in producing America's favorite grain. I'll be posting some fun facts on twitter throughout the month but be sure to check out my Instagram story for trivia Tuesdays. #ARrice https://t.co/M8oFDNTLG3"
53,"Morally bankrupt doesn’t begin to describe the actions of those preventing the ambushed officers from receiving life-saving care. I hope the evil that committed this act is brought to justice, as well as those who tried to prevent them getting care. Absolutely sickening! https://t.co/AkkoQF0Mxp"
54,"This incident has been totally condemned, as it should be. These police officers were there to protect and serve. They were ambushed without provocation and are fighting for their lives. Those who want to “Defund the Police” should cease their efforts immediately. No more! https://t.co/UagD3xEmbv"
55,"Great game by @AStateFB and picking up the win in Manhattan! Proud of the whole team, fighting to the end! 🐺🆙 #HowlYes"
56,"RT @kdamp: Because of COVID-19, our @CityofJonesboro Fire Department was unable to participate in the annual 9/11 Stair Climb event in Nash…"
57,Has the Middle East been more peaceful over the last several decades than it is now? Has Israel had more doors opened to peace and cooperation than now? For those who said the President would usher in harm to our allies this certainly demonstrates the total opposite!
58,RT @afspnational: A8: You can find mental health and suicide prevention resources on our website at https://t.co/5yUjZMp0GS! #BeThe1To #WSP…
59,"RT @TransportGOP: As today’s #Amtrak COVID response hearing continues, a reminder that Ranking Member @RepRickCrawford introduced a biparti…"
60,I find it repugnant that anonymous sources would malign the character of the President when those who were with him during that visit categorically deny it ever happened. The President has done more for our troops and veterans than has been done in some time!
61,"First it was Joe Biden who was avoiding the press and not taking any questions. Now, the Speaker of the House - third in line to the Presidency - cancelled her press conference. They must be realizing how bad it’s getting for them and their policies... #NotASetUp"
62,"It’s game day and our whole family is excited to see my son, Will, play tonight. They get away from you quick and grow up way too fast! #ProudDad https://t.co/PyRYD4tI71"
63,"Americans expect law and order. They expect those who commit crimes to be held accountable and those who are innocent to be acquitted. They expect leaders to stand up for those who aren’t able and support those who want safe and strong communities. 
https://t.co/ZJ3zGZAjor"
64,"It’s often the elitists who want others to abide by rules they believe are not meant for them. The luxuries they enjoy and the rules meant for others never match up, guaranteeing inequity and disadvantage.

It’s their story, for all to see. 

https://t.co/YaQdezAZdn"
65,"RT @GOPLeader: Americans have shuttered businesses, complied with local orders, and sacrificed everything to defeat the virus.

But Nancy P…"
66,"Too bad Joe ran out of time at his speech today answering questions that he didn’t get to answer one about incidents like this in cities who are cutting funding for police. Maybe they’ll get to ask him about it another day... 
https://t.co/Hx48rtup49"
67,"This is some of the best, if not the best, news that happened this week that the media isn’t reporting. Thanks to dedicated law enforcement and investigators, these children are safe. Those who committed these crimes should be prosecuted to the fullest extent possible. https://t.co/xZxdqppBdA"
68,"If mobs and anarchists will do this to our men and women in law enforcement, what will they do to their fellow citizens?

This is the movement Joe Biden has built and enabled. These are the people they support and who control them. 

God bless those who protect and serve! https://t.co/WAtxzfNSuK"
69,"There are those who have spent their lives building up our great nation for current and future generations and there are some who are doing everything they can to tear it down. 

God bless those who’ve built this nation up and those who will continue where they left off! 🇺🇸 https://t.co/hcqtuIKjUC"
70,Today’s announcement by DOJ regarding the decisions by some states to require COVID patients to be placed in long term care facilities is vitally important. Our seniors are some of our most vulnerable and any action that imperiled our elderly should be fully investigated.
71,"Nancy is controlled by the far-left. She continues to say things that escalate division in this country and now she’s labeling those who are in a different political party “enemies”. Nancy, you once said our words should calm and unite. What changed?
https://t.co/SjrD8nmfwT"
72,"The President is doing all he can to ensure anyone who contracts COVID has the best care from the best equipped caregivers. This development in therapeutics should save more lives and ensure we have the best available treatments for all Americans.
https://t.co/7vByD51KLz"
73,"RT @HouseGOP: Speaker Pelosi has called the House back today to vote on her contrived ""emergency” on unfounded conspiracy theories.
 
But s…"
74,"RT @rep_stevewomack: The House has been called back for an “emergency” session. What are we voting on?
 
Not COVID-19 assistance
Not small…"
75,.@HouseDemocrats cannot explain away the fraud currently occurring in New Jersey and the uncertainty in primaries of their own members whose races include significant numbers of “mail-in-ballots” that haven’t been counted. This manufactured...
76,"Yesterday, I had a busy day in Stone County. Highlights of the day include: 
🇺🇸Flag Presentation at the county courthouse 
🧳Visited a business that didn’t have to file for bankruptcy thanks to the CARES act 
📰Chatted with the local newspaper about USPS, and COVID relief https://t.co/zgnzfdEcBp"
77,"The USPS processed 103 billion pieces of first class mail in 2000. 
In 2019, they processed 54 billion pieces of first class mail.  But, there is a conspiracy being peddled by @SpeakerPelosi that the President is subverting the election. What a joke.
https://t.co/l44wHTsEEc"
78,RT @SteveScalise: Don’t let Dems spin this differently: Pelosi fabricated a conspiracy theory about the postal service to attack @realDonal…
79,RT @Melvintorresark: Let us learn from this #Pandemic and focus #America's efforts on #diversifying our #SupplyChain and partnering with ou…
80,"[USMCA], now the most successful free trade agreement the U.S. has, along with the supply chain disruptions during the COVID-19 pandemic, is proving that the next logical step for the USMCA is a robust [Latin America] free trade agreement bloc. #Trade 
https://t.co/cPZllQAeyp"
81,"RT @RepStefanik: 100 YEARS AGO TODAY: the 19th Amendment was ratified. Today, we celebrate all of the women suffragists who fought to give…"
82,"As a father to a son who plays football, I am incredibly saddened to hear of Hunter’s passing. Our prayers are with his family and entire team who are mourning his loss today. https://t.co/ABcOzH8O3o"
83,A great company and a great group of people who help support American agriculture. It’s also great they call the First District home! #agriculture https://t.co/0PFAlZiOt7
84,RT @MemphisVAMC: Vet compliments Memphis VA staff on surviving COVID-19 https://t.co/PApPH1DueD https://t.co/2uUV42O3ZW
85,"The images from the Midwest after yesterday’s storms are hard to see and demonstrate how important support programs are for our Ag-producers. For our friends whose corn, soybeans, and other crops that are lost or badly damaged, we stand ready to help how we can."
86,"Unfortunately, treatment for the opioid epidemic is difficult in rural areas where resources are often very limited. This week @HHSGov announced that Arkansas will be receiving $2,000,000 in grant funding to help with opioid addiction response. #opioidcrisis"
87,It’s hard to imagine what another president would have done or how they would have fared when faced with the unprecedented challenges of COVID. President Trump beat expectations and is fighting hard to restore our country and economy. Chuck and Nancy? No where close.#JobsReport
88,"The heartbreaking conclusion today with the admission by the woman who killed Linda Collins-Smith does not bring her back to her loved ones or friends. However, it shows justice is always served and will always be pursued. May God give Linda’s family continued peace and comfort."
89,"As we send prayers to those who have been affected by the deadly blast in Beirut, let us be mindful about the need to protect our supply chain. Food security is national security, and the U.S. must be ready to feed ourselves &amp; the world. #Beirut 
https://t.co/oMj9xurKzN"
90,"RT @RepDavidTrone: I don't care if it costs a buck more to buy masks that are made in Maryland or Texas -- it's the right thing to do.
The…"
91,"Through this expansion, rural healthcare will change, for the better, for the long haul. Since his actions are hardly reported, it’s important we all see how important this has been and how much rural America will benefit. #Telemedicine #healthcare https://t.co/fjikHzoIDJ"
92,"President Trump has vastly expanded and improved access to healthcare through his actions on #telehealth. In rural areas like Arkansas, this is life-saving when rural hospitals and clinics are struggling to stay afloat. https://t.co/bxPnsWddoP"
93,"Every American who has used @tiktok_us has all of their info run through China. The #CCP controls companies that are based in China, Tik Tok included.

It’s great to see the President banning the app and preventing them from doing any more harm to American citizens. #tiktokban"
94,The invisible enemy has taken another life and deals another blow to a family and loved ones who now mourn like so many who have dealt directly with #COVID. Herman Cain sought the highest office in our country to better the lives of many. Prayers of comfort for his family.
95,".@HouseDemocrats are complicit in China’s genocide of 
Uighurs that is on full display for the world to see and China’s role in #COVID wreaking havoc across the world. Now, they are enabling them to steal from American taxpayers. What are they hiding?"
96,I offered an amendment that would keep tax dollars from being used by those who have ties to #China. The above examples are the tip of the iceberg and congress must protect and defend our country. @SecPompeo said as much earlier this year (6/x): https://t.co/AJhv5CiXDM
97,".@FBI Director Wray has stated they open one new counterintelligence case against #China every ten hours. Of the nearly 5k active cases, many of them relate to our colleges/universities (5/x):
https://t.co/LfwdCw6qUH"
98,".@MayorPerrin has been a great friend for many years and I have been honored to work with him on many important projects for Jonesboro and the entire region. I know he didn’t easily decide to retire but his health is critical. Thank you for all you’ve done, Mayor!"
99,"If Basement Biden believes the “protestors” in Portland are peaceful (who are also calling for the the overthrow of America), what would he say is “dangerous” or “out of control”? His answer is critical to know and too dangerous for us to find out. https://t.co/V1TQKf3SWE"
100,.@GOPLeader this is perfect timing as @TheJusticeDept indicted two Chinese nationals for hacking and attempting to steal vaccine information. China will do anything to get ahead of a virus they’re fully responsible for and the damage it’s caused. https://t.co/YYqYO07JSF
101,"Good to see CFAP payments are making it to our farmers. More needs to be done to ensure they are reaching producers who need it the most. Please contact my office if you have questions about applying. #CFAP
https://t.co/dXbBwGwC20"
102,"There is absolutely no reason for the NY Times to do this, unless of course it is to intimidate Tucker Carlson - or anyone who has views like him. This isn’t “reporting” and should be condemned by any news entity who has any credibility left. https://t.co/BZlIgowIYT"
103,"RT @realDonaldTrump: We are United in our effort to defeat the Invisible China Virus, and many people say that it is Patriotic to wear a fa…"
104,"Learning this morning that John Lewis passed away is yet another heartbreaking chapter in 2020. @repjohnlewis exemplified the character of someone who sought equal treatment and justice for all, in all he did. Please pray for his family as they mourn his passing. #RepJohnLewis"
105,"Serving a warrant for a Constitutional right, on someone who was on *their* property as a group of protestors paraded by on *their* property? This action by the prosecutor is unconstitutional and cannot stand. I’m disgusted by this and will never support such actions. #2A https://t.co/rKDtvExQzc"
106,"You can’t make this stuff up. Reports indicate that a Chinese company - based in Wuhan - bought a pharmaceutical company in S Carolina. And, it was in the early stages of providing DOD items for #COVID19. China buying critical companies must stop! 

https://t.co/JreyJT1nXf"
