,Tweet
97,"I have heard from #GA07 constituents about how some veterans are unable to receive certain benefits &amp; recognition available to their counterparts who served during official periods of war. 

This is unacceptable. 

Here's how the LEGION Act resolves this: 
https://t.co/McrwVZwSYm https://t.co/BUbDpHT7cs"
98,".@GirlScoutsATL has a long history of encouraging young women to be active learners and citizens of the world.

Click on the link below if you know current, or future, #GA07 @GirlScouts who would benefit from programs like Lilburn Day Camp.
https://t.co/qx2kgpVdhK"
99,"It’s incredible to hear stories like that of triplets Rommi, Adam, &amp; Zane Kashlan, whose hard work led to graduating early at @WFHS_HS &amp; being named co-Valedictorians! 

The Kashlan siblings are set to attend college together at @GeorgiaTech this summer.
https://t.co/VPtq3astgM"
100,"Congratulations to Nancy Irungu from #Snellville &amp; Helen Getu from #Lilburn who were selected to be a part of the 2019 WiSCi STEAM camp! This program is sponsored by @StateDept &amp; @GirlUp to ensure young women will continue to play a pivotal role in #STEM. 
https://t.co/Mj3ID7us5y"
101,"This #FathersDay, we take the opportunity to reminisce and appreciate the memories and lessons taught by our #Georgia fathers.

Whether you are a biological father, a step-father, a grandfather, or someone who has stepped-up in a child’s life, I wish you a Happy Father’s Day. https://t.co/LqijEOZjW1"
102,"On June 14, 1775 the Continental Congress established the United States Army. Today, we celebrate the birthday of the @USArmy and those that have bravely defended us for 244 years. Below is one of my academy nominees who graduated from @WestPoint_USMA earlier this year. #ArmyBday https://t.co/5rzo9EqEtR"
103,".@YMCA Youth In Government allows high school students to serve in model governments at the local, state, and national levels. 
 
I had the pleasure of meeting w/ #Forsyth’s Jake Gant, who was chosen to serve as Georgia’s 75th Youth Governor. @stateyofgeorgia @ymca_northga https://t.co/CoeBJ3i7Gk"
104,"As most of you know, June is National Alzheimer's and Brain Awareness Month. Statistics suggest that each one of us is going to know someone or have a family member who will be affected by #Alzheimers or #brain health in one way or another.

We will not give up hope. https://t.co/f3IXyCViGZ"
105,"Protecting victims from the very criminals who perpetrated the crime is our responsibility.

Today, I was honored by @MarsysLawforGA for my support of crime victims’ rights. Georgians overwhelmingly voted in favor of @MarsysLawforAll, in 2018. This law is a win for all Georgians. https://t.co/iSepAmsgj2"
106,"Congrats to @FCSchoolsGA Board of Education Chairwoman Kristin Morrissey, who will represent #GA07 on the “Bright from the Start – DECAL Board!” In her new role, Chairwoman Morrissey will be able to help enhance children’s early educational experiences.
https://t.co/wNgqwT0yzw https://t.co/L2hnUhak4B"
107,"The U.S. was founded on life, liberty, &amp; the pursuit of happiness. We remain a free country b/c we have brave men &amp; women who are willing to lay down their lives to protect us. Thank you @CityofSugarHill for inviting me to attend today’s Veterans Memorial Groundbreaking Ceremony. https://t.co/vQBTK6TQFN"
108,"Today, on the 75th Anniversary of D-Day, we celebrate the brave soldiers who gave everything as they stormed the beaches of Normandy to fight against tyranny and defend freedom. #DDay75 #DDay75thAnniversary https://t.co/vi3nDWWepP"
109,"Today, the House passed the @HouseDemocrats' immigration bill. 

#HR6 fails to:

-Address the current crisis at the border
-Assist those trying to enter the U.S. legally
-Offer protections for those who are lawfully present in the U.S. or standing patiently in line overseas. https://t.co/Ldb5QZQ3s1"
110,"We are so fortunate to have health care institutions that are continually highlighted for their good work in #Forsyth. 

.@NorthsideHosp was recently recognized by Healthgrades with its Outstanding Patient Experience Award for the second consecutive year. 
https://t.co/gWfe4zf76K"
111,".@USCBO put together a report for @HouseBudgetDems about the implications of single-payer health care, but failed to address how many trillions of dollars it would cost.
 
I spoke w/ @FOX5Atlanta’s @RussFox5 about why #MedicareForAll is not a viable health solution for #Georgia. https://t.co/qpGH1WaRaK"
112,"I was honored to join those in our community this past #MemorialDay to pay tribute to all those heroes who made the ultimate sacrifice, including Officer Antwan Toney who was tragically killed in the line of duty this past October. #RememberTheFallen https://t.co/wpwhMZ41tD"
113,"Memorial Day is to honor the brave souls who made the ultimate sacrifice in defense of freedom. I’m proud to join my friends and neighbors as we unite around the families of our fallen heroes, praise their sacrifice, and make sure they know we are a grateful nation. #MemorialDay https://t.co/1yfT9EmFo8"
114,"For over 40 years, @PlaceForsyth has excelled in serving individuals in our area who have experienced financial hardship and are in need of emergency assistance. That good work has not gone unnoticed! 

Read more:
https://t.co/cOpl3P1U0b"
115,"Earlier today, @HouseBudgetGOP and @HouseBudgetDems held a hearing with the Congressional Budget Office @USCBO to discuss its recent report on the risks of imposing a single-payer, one-size-fits-all health care system.

Watch my #MedicareForAll #M4A Q&amp;A with the panel below: https://t.co/VG76kLAYtZ"
116,"Happening Now: @HouseBudgetGOP and @HouseBudgetDems are holding a hearing about establishing a single-payer health care system in the United States. #MedicareForAll #M4A

Click the link below to watch the hearing: 
https://t.co/KGAcHzTwBZ https://t.co/kZYA52dZwP"
117,"It took weeks for @WaysMeansCmte &amp; @WaysandMeansGOP to build bipartisan consensus on #HR1994. Last night, @RulesDemocrats included amendments that erased it all. Today, I spoke out against @HouseDemocrats’ underhanded efforts to antagonize families who homeschool their children. https://t.co/Nco8tWKYNG"
118,"(3) 'So if $2 trillion is so easy to get a hold of, we should probably get a hold of it and fill the budget gaps that we have today.' Still, Mr. Woodall, who sits on @TransportGOP, is optimistic that a deal can be done, as long as everyone keeps an open mind."
119,"As #NationalPoliceWeek comes to an end, I would like to thank #Georgia’s men &amp; women who put their lives on the line to keep us safe. 

We are grateful for your service &amp; your sacrifice.

In November, I was able to pay tribute to Officer Antwan Toney who died in the line of duty. https://t.co/Jr4YvHlond"
120,"Wishing everyone a Happy Mother’s Day! Today, we celebrate the unconditional love that mothers throughout the world have for their children.
 
My mom played a major part in my growth, and I’d like to thank every #Georgia mom who is a guiding light for their family. #MothersDay https://t.co/mNPfw4mjdc"
121,"Yesterday, @HouseDemocrats perpetuated fiction, making it seem like #HR986 is going to stop the #Trump Administration from taking away health insurance for folks with pre-existing conditions. That’s nonsense! 

Here's the real story: 
https://t.co/nfdXXHv7x6 https://t.co/1dz3ux4zMQ"
122,Great meeting today w/ @ACECGA. I wholeheartedly believe that @TransportGOP &amp; @TransportDems can work together to successfully solve some of our nation’s biggest problems. We have to do it together &amp; we need to to partner with our nation’s #engineers to develop the best solutions https://t.co/EnL6cRfngt
123,"This comes as no surprise because we have teachers like Maria Stewart, from @NorthForsythMS and Doug Doblar, from R.D. Head Elementary School, who were the 2019 Georgia Teacher of the Year Runner-Up and Finalist, respectively. #TeacherApprecationDay #TeacherAppreciationWeek (4/4)"
124,"For everyone tuning into the #KentuckyDerby today, make sure to keep an eye out for #Gwinnett County’s very own Tax, who has a 25-to-1 shot. #KentuckyDerby2019 
https://t.co/eH3t8eh2AJ"
125,"(2) Later in the day, I introduced the @GwinnettChamber to Ben Gilbert, a Senior Cybersecurity Adviser for @DHSgov, who talked about increasing threats and how the fed. government is addressing this security challenge. We cannot let personal information fall into the wrong hands. https://t.co/da4PJkQKYG"
126,"This #HolocaustRemembranceDay we honor the 6 million Jews, and millions of other innocent lives, who were murdered during this dark period in history.

As a nation, we say #NeverAgain.

As a community, we will continue to stand against anti-Semitism, racism, and hatred. https://t.co/lPvkIXTI3c"
127,"Hey @JusticeDems, Republicans and Democrats need to work together to tackle the complex issues that affect our communities. When it comes to health care, I believe that there is more that unites us than divides us. I would encourage you to highlight my full dialogue... https://t.co/4kjj5u2fJ9"
128,"Today, @RulesReps argued #MedicareForAll:

✅Takes over the health care industry
✅Requires higher taxes because it cannot pay for itself
✅Eliminates employer sponsored coverage

I raised concerns about how a one-size-fits-all #health #care system would cost taxpayers trillions. https://t.co/bWwHXScELB"
129,"Thank you to everyone who attended this weekend's #Military #ServiceAcademyDay at @DobbinsARB.

I had a pleasure working w/ @SenatorIsakson, @SenDavidPerdue, &amp; @RepLoudermilk to make this event one of the largest Service Academy Days in our nation.

Watch @WSBTV's coverage below: https://t.co/8bqKxgvSnf"
130,"From @GwinnettDaily:

""While a new hurricane season is just a month and a half away, U.S. Rep. Rob Woodall, R-Ga., said Georgia’s congressional delegation is still trying to get aid for residents who were affected by a storm from last season.""

Full story: https://t.co/az4hBTPZ0L https://t.co/xKkeevHUq4"
131,"Great working with @SenatorIsakson, @SenDavidPerdue, &amp; the #Georgia Congressional Delegation to make today’s #ServiceAcademyDay possible. Thanks to everyone who attended the event at @DobbinsARB! With your support, it was one of the largest Service Academy Days in our nation. https://t.co/Oj8gjhxPg4"
132,#NationalPrescriptionDrugTakeBackDay provides a responsible way to dispose of excess #prescription #drugs while raising awareness about the potential for #abuse. We can work together to combat the #opioid epidemic this #TakeBackDay. Find a collection site: https://t.co/gyDV6a7fHt https://t.co/1MDyxL3tL8
133,"#Healthcare simulators are increasingly being used to practice high-risk techniques &amp; establish safe protocols in the name of improving patient safety. 

I had a great time visiting @GwinnettMedical's simulation lab to see how simulators are being used to do just that in #GA07! https://t.co/9f8CsUtSMB"
134,"(3) We truly have the best students in #Forsyth and #Gwinnett counties. It always makes me proud to celebrate the creativity and talent of our high school artists, and I want to say a special thank you to our judges and teachers who make this whole event possible! https://t.co/Hsa4G1CTYo"
135,"(2) Congratulations to Jacob Yu, who came in first place this year with “Knock Knock,” Ashley Kim, who came in second place with “The Aftermath,” Deborah Kug, who came in third place with “Georgia,” &amp; Rachel Long, who won our first ever #ConstituentsChoiceAward, with “A Martyr”! https://t.co/ktdKRiIDzN"
136,"It was an honor to speak to the #RotaryClub of #Lawrenceville about what is happening in #Congress. I appreciated their questions about the #TaxCutsandJobsAct, what Congress is doing to #SecureOurBorder, and what Congress is doing to help #Georgia #farmers, who do so much for us. https://t.co/qTcoKdz3jH"
137,".@AustinScottGA08 recently testified before the @RulesReps about his amendment to #HR2021 which would have provided emergency disaster relief to #farmers &amp; others who were harmed by 2018 natural disasters. 

I introduced a motion to include his amendment to help #Georgia farmers. https://t.co/XAXtyuVIQ2"
138,"I am constantly in awe of the young men &amp; women who pursue admission into our service academies. Their desire to serve is always a reminder that the future is in good hands.

It is my honor to join @SenatorIsakson for his Service Academy Day.

Learn more: 
https://t.co/t6VEbyoRLm https://t.co/I0mC4438TC"
139,".@ForsythCountySO's Detective Drue Green recently received a liver transplant, &amp; our community came together to give back in a big way: raising roughly $50,000! I want to commend everyone who donated their time, and wish Detective Green a speedy recovery.
https://t.co/ctdsBvYBI3"
140,"(2) This legislation requires health care providers who are present at the live birth of a child exercise skill, care, and diligence to preserve the life of the #child—the same degree of care that would be offered to any other child #born #prematurely at the same gestational age."
141,"In today's e-newsletter, I examine @POTUS’s budget request &amp; discuss how @HouseGOP &amp; @HouseDemocrats should work together to make #prescription #drugs more #affordable, eradicate the HIV/AIDS virus, &amp; reduce burdensome regulations stifling job creation.
https://t.co/Rao7WbmNQW"
142,"For the 7th consecutive year, #ForsythCounty has been named as the healthiest county in #Georgia! The County Health Rankings Report examines a number of factors including life expectancy, access to healthy foods, and socio-economic considerations.
https://t.co/D5X33e05iq"
143,"Congratulations to @CityofSuwanee Police Chief Mike Jones who was recently named as #Georgia's Chief of the Year for 2018-2019!
https://t.co/lIhq3nTW1s"
144,"It is always an honor to join @SenatorIsakson for his Annual Military Service Academy Day. 

Every year I am inspired by the commitment, drive and patriotism of these young men and women from across Georgia who seek to honorably serve their country and defend freedom. https://t.co/BEJtuxk8iW"
145,"Thank you to everyone who came out to our community town hall!

It is an honor representing the Seventh District in Congress and I enjoyed answering all of your questions. #GA07 https://t.co/A4f7ghj1Hl"
146,"#CommunityHealthCenters do important work for our family, friends, and neighbors.

I applaud President @realDonaldTrump's commitment to balancing our nation’s budget while reauthorizing CHCs and recognizing their importance in our community. https://t.co/iCiUlQp3LM"
147,"(2) The CASES Act modernizes how constituent claims are submitted and prioritizes a digital filing system.
https://t.co/e3GlIm1Oxa"
148,"(2) Boehringer Ingelheim Animal Health USA Inc., a leading animal health company, will create 225 jobs and invest more than $120 million in Gwinnett, Clarke, and Hall counties. 

This is a win for everyone. 

Read more: 
https://t.co/JUfJtden1M"
149,"It was a pleasure meeting with Mayor @KeishaBottoms to discuss ways @TransportGOP can support Georgia’s infrastructure needs.  

Thank you to Mayor Bottoms, local law enforcement, and everyone whose hard work ensured this year’s Super Bowl back home was a success! #AtlantaProud https://t.co/ptRXNttShf"
150,"Forsyth and Gwinnett counties are made richer by our Chinese, Korean, and Vietnamese American communities. 

On behalf of #GA07, I would like to wish you and your loved ones, happiness, prosperity, and good health in the new year. 🐷

May God bless you and your family. https://t.co/JPWnB5ron2"
151,"Today marks the start of #BlackHistoryMonth, and it is important we take this time to recognize the achievements and sacrifice of those African Americans who came before us, whose life and legacy will surely be remembered long after us, and whose work is still to come. https://t.co/Wh2RDlOeWr"
152,"I would like to offer my sympathies to the family of Army Specialist Octavious Lakes Jr., who recently passed away.

He was a decorated warrior, including two Army Achievement Medals and a National Defense Service Medal, and I am grateful for his service.
https://t.co/gAk2nD8bez"
153,"The secret to finding common ground isn’t to ask “Why don’t you agree with me?”
 
The only movement I’ve seen in this debate is from @POTUS who has proposed a solution to re-open the government.
 
@SpeakerPelosi, let's work together to #SecureOurBorder. https://t.co/MpxEtFPC1l"
154,"Every year, tens of thousands of people travel to Washington, to celebrate &amp; defend life. I am in awe of their passion &amp; energy. It’s their hard work that inspires me each day to protect the rights of the unborn.

Thank you to everyone who came by my office &amp; shared their story. https://t.co/B7Pjjawqxf"
155,".@POTUS is on the side of the American people just as we all are in Congress. @SpeakerPelosi is being held hostage by the new radical left who want to #AbolishICE, have open borders, &amp; have pledged to defeat any Democrat who works w/@HouseGOP to #SecureOurBorder.

@Varneyco: https://t.co/WAX6XT4gPH"
156,"Congratulations to Brian Kemp and Geoff Duncan on being sworn in as Georgia’s 83rd Governor and 12th Lieutenant Governor! I look forward to working with @GovKemp on economic development opportunities in #GA07, combating the opioid epidemic, &amp; rebuilding Georgia's infrastructure. https://t.co/GL35QJdCkh"
157,".@SpeakerPelosi, I am committed to working with anyone – progressive, liberal, moderate, or conservative – who wants to #SecureOurBorder and fund the government. 

#ComeToTheTable so we can negotiate a plan that prioritizes the safety of all Americans. 
https://t.co/psSFLig6kG"
158,"I am committed to working with @HouseGOP &amp; any Democrat who wants to stop drug trafficking, stop human trafficking, and fund the government. #WeCanDoItTogether"
159,"The #PearlHarbor attack on December 7, 1941, changed America forever. Today, we remember those lost, and all those who answered the call to defend freedom here and across the world. #PearlHarborRemembranceDay https://t.co/gwUCeqHRov"
160,"I’m very proud of the work being done to solve the #OpioidEpidemic in America. Sadly, unused Rx medication is often obtained by family, friends, or those with access, &amp; can spur addiction. Learn more about #NationalPrescriptionDrugTakeBackDay below. https://t.co/CwSNOouQAL"
161,"This is such an important step in combating the #OpioidEpidemic, and I’m proud to see it become law. @HouseGOP @POTUS https://t.co/euYlhxG68F"
162,Today we pay tribute to those who lost their lives on this day 17 years ago. We remember their families and the bravery exhibited by our first-responders; and we remember the American unity displayed in the worst of tragedies. #September11th  #NeverForget https://t.co/Vsw3Wa9bWi
163,Great to catch up with my friends at @GHMSINC today to celebrate #NationalHealthCenterWeek! Thank you again for all you do! #GA07 https://t.co/26WBbbM0OA
164,Judge Kavanaugh is a highly credentialed jurist whose record reflects a deep commitment to the Constitution. I believe @POTUS has again made a sound nomination to the #SCOTUS &amp; it is my hope that the Senate moves to confirm quickly. #ScotusPick https://t.co/Q3lEBKh5Ot
165,Happy #IndependenceDay! Thank you to all who have provided and  defended the freedom we celebrate today! #DeclarationofIndependence #4thofJuly https://t.co/DxfjU5MBgw
166,"A great day in #Forsyth County welcoming @USDOT Secretary Elaine Chao as we celebrated the upcoming projects to improve and expand GA400! Thank you to the Secretary, @GADeptofTrans Commissioner McMurry, and all who had a hand in making this possible! https://t.co/8hYTkC81nZ"
167,The #VAMISSIONAct was approved overwhelmingly by Congress &amp; I’m pleased to see the @POTUS sign it into law as we strive to serve our #veterans’ healthcare needs with more access and more choices. https://t.co/lNzGiZSnDB
168,"On #MemorialDay, we pay special tribute to those who gave everything in service to America, and in defense of our freedom. We are forever grateful to them and their families. #MemorialDay2018 #ForeverGrateful https://t.co/m9dpIfwdbx"
169,Thanks to @SenatorIsakson and everyone who made the day such a success! https://t.co/UiMEHo028w
170,"It was one of the darkest episodes in human history, and by remembering – paying tribute to those lost and those who endured – we help guard future generations from such tragedy. #HolocaustRemembranceDay https://t.co/sKmkMgcMyX"
171,"Today, we remember and pay tribute to all of those who served in the Vietnam War. Thank you for your service and sacrifice to America! #NationalVietnamWarVeteransDay"
172,Wishing a very #MerryChristmas to everyone celebrating today! And a special thanks to our service members and first-responders who are away from loved ones. Thank you for all you do! https://t.co/0axqcR1zk9
173,"As #Hanukkah begins this evening, I’d like to wish all who are celebrating a blessed time with family and friends! May it be a wonderful season marked by joy and peace!  #ChagSameach!"
174,"""A date which will live in infamy...” - FDR. It changed the world and prompted the U.S. to enter #WWII. Forever grateful for those who sacrificed so much for freedom here and across the world. #PearlHarborDay #USSArizona https://t.co/p22ievlyjr"
175,Wishing you all a #HappyThanksgivingDay! I’d also like to offer a special message of gratitude to our service members and first-responders who are away from home and their loved ones today. Thank you so much for all you do for us! https://t.co/yEER6SCuL4
176,"Grateful for our amazing #veterans, and all those who made today's luncheon in their honor possible. Thank you for all you do. #GA07 https://t.co/clMqET2hxn"
177,"Today we remember those we lost, those who so heroically served, &amp; celebrate the freedom that endures. #September11 https://t.co/uN08LCkE7W"
178,Thank you to all those who have earned America’s oldest military honor through your tremendous sacrifice. #NationalPurpleHeartDay
179,For over 2 centuries the @USCG has stood ready &amp; willing to answer the call regardless of the mission. Thank you to all who serve. #CG227 https://t.co/1GT9psRtry
180,Thanks to all who provided input on this policy &amp; thanks to @USACEHQ for a quick response! #LakeLanier @forsythnews https://t.co/hDnTBusEf2
181,Thanks again to the @atlchamber and all those who joined our discussion this morning! #local #leadership https://t.co/qRMhg4ikDt
182,May it be a blessed time for all who are celebrating! #HappyPassover https://t.co/rI1PjlsEim
183,More excellence from #GA07! 1st and 4th healthiest counties in #Georgia! #HealthRankings https://t.co/dDBXyaLWdh
184,All who knew Jon Richards are better for it.  His is certainly a life to be celebrated. MORE: https://t.co/YZsFeO9Bo9 #gapol
185,#Healthcare and other updates from #WashingtonDC last week. Read more from - and sign up for - my newsletter here. https://t.co/SgrcMg09FL
186,On the @HouseFloor talking #healthcare solutions and #Obamacare relief. WATCH LIVE: https://t.co/dMYThFxpyU
187,Today Congress took the first step to breathing life back into local health care markets. Proud to support #SConRes3 https://t.co/B7qnt5vVbF
188,"Proud to support passage of #NDAA. This bill supports those who keep America safe every day, and offers troops biggest pay raise in 6 yrs."
189,Small businesses are the driving force for a healthy economy. Let's help support them! #SmallBusinessSaturday #shopsmall #SmallBizSat https://t.co/WEqvVUoQn6
190,Happy 241st Birthday to the @USMC!  Thank you to all who have answered the call to serve. #MarineCorpsBirthday #USMC #SemperFi https://t.co/X2bZ4V8NRk
