,Tweet
324,".@ProtectHarvest is right - As someone who spent considerable time and built a career in #rodeo, these bills are meant to do harm to the industry, not bad actors. It’s misguided and an attack on good people who take care of the animals who are a part of rodeos all across America. https://t.co/kX2XJGsxca"
325,The President is taking the necessary steps to ensure our country is ready for any potential spread of the #coronavirus. @VP Pence is well positioned to lead our response and the political attacks that are common must stop so we can all focus on protecting our country.
326,"RT @SenTomCotton: Well, look at that. The Chinese Communist Party’s propaganda rag finally admits what I’ve said for a month: coronavirus d…"
327,"RT @GOPLeader: Isn't it great to have a President who understands that farming is not easy?

Thank you, President Trump, for delivering on…"
328,.@SenTomCotton getting accused of spreading “conspiracy theories” by the Fake News Media about the #coronavirus makes you think they believe all of the manipulated economic data China releases. Nothing they report is accurate or truthful. That’s what a communist regime does. https://t.co/fZXuWYgBOo
329,"RT @FarmBureau: As America's farmers and ranchers start using new technologies, our food supply will become even safer, healthier and more…"
