,Tweet
0,"After a historic recession, our economy experienced the largest economic growth ever recorded in American history this quarter. 

Sound economic policy and common-sense COVID-19 preventative measures will ensure that the U.S. continues to bounce back. 
https://t.co/cLR5Dc17lF"
1,"This #NationalDayOfTheDeployed, I would like to thank our brave men and women in uniform who serve and have served the United States around the globe and their families who bear that burden. 

Your dedication and sacrifice are truly inspirational. https://t.co/PR8qqpgYaJ"
2,"All mothers deserve access to quality maternal health care, which is why I am calling for #BlanketChange to put moms and babies first. 

To learn more about improving and expanding access to maternal health care, visit https://t.co/Y2HbMeuRAa."
3,"It is time for Congress to put politics aside and come together to deliver #COVID19 relief.
 
The American people deserve an effective, bipartisan solution that serves the needs of our communities."
4,"Tomorrow at 4PM, Georgia's Under Secretary for Benefits is hosting a tele-Town Hall for #Veterans and their families. The discussion will cover the VA's COVID-19 response, the Blue Water Navy Act, and the Solid Start program. 

Veterans, I encourage you to tune in at 833-380-0417"
5,"I appreciate the efforts of our leaders at @ATLairport to ensure the world’s busiest airport is as safe as possible for travelers during the continued public health emergency, as well as their commitment to engaging with the public. Read more below. 

https://t.co/YazR0LuWiO"
6,"L’shanah tovah u’metukah! 

I want to extend my wishes for a happy and healthy new year to all celebrating Rosh Hashanah this weekend. As we move from 5780 to 5781, I hope this High Holiday season brings a special sense of joy and renewal to you and your family. https://t.co/ZfWhgNtO7O"
7,"Today marks 19 years since the horrific attacks committed against America on September 11th. Today, we mourn those whom we lost, and we celebrate the heroism of our police and firefighters who charged into danger to save lives at the risk of their own. #NeverForget https://t.co/vYum7gp1ie"
8,"I was honored to welcome Secretary @BetsyDeVosED to the 7th District today during her visit to Forsyth Central High School. I am proud of the efforts of all those at @FCSchoolsGA who are leading by example to ensure the safety of students, teachers, and staff as schools reopen. https://t.co/npqjd2IFyj"
9,"Today, the @ModernizeCmte passed a series of recommendations to ensure that Congress can continue to serve the American people through the duration of this pandemic and during future emergencies. I was proud to support this bipartisan initiative. 

https://t.co/9c1b4LMRG7"
10,"Congressman John Lewis – who served the people of Georgia in the House for more than three decades – will lie in state today at the U.S. Capitol. You can view a live stream of those services below. 
https://t.co/zXuWpSZBLT https://t.co/CEuReVdMNZ"
11,"Today, as Americans joyfully celebrate #Juneteenth, the world community is drawing awareness to the fight against Sickle Cell Disease, which disproportionately affects people of African and Caribbean descent. Click below to learn more:
https://t.co/alrTZCp4vu"
12,"America’s leaders – from the President and Congress to city councils – are carefully examining additional pandemic response solutions. Click below for the latest from Capitol Hill:
https://t.co/w1Ka9vpg30"
13,I was deeply saddened by the news of Sam Johnson’s passing yesterday. Sam was a great American patriot who served our country with distinction for over 60 years. It is a great honor of mine to have met and worked with him here in Congress.
14,"Gwinnett County will be hosting a drive-thru farmer’s market this Wednesday from 3 – 7 pm at Coolray Field in Lawrenceville. This is an incredible opportunity to support our local farmers and buy fresh, healthy food. Click below to learn more:
https://t.co/mEOfOc3hX9"
15,"Today on #MemorialDay, I would like to honor the brave men and women who paid the ultimate price to protect our freedoms and their families. Their courage and sacrifice will never be forgotten. https://t.co/S8kYdRy613"
16,"To my constituents and all of our Muslim friends and neighbors who observe Ramadan across the nation, I hope this was a month of peaceful reflection, spiritual growth, and generosity. I wish you a Blessed Eid and hope you have a joyful breaking of fast with your loved ones."
17,"The Library of Congress is offering free, one-hour webinars for educators who would like to learn how to use primary sources to teach their students. Click below to learn more:
https://t.co/tVKb5WWo6Q"
18,"Today, the House passed the HEROES Act – a 1,800 page, $3 trillion bill that doesn’t have a chance of ever becoming law. I’m disappointed that my colleagues across the aisle failed to set aside their partisan agenda and address the real issues surrounding this pandemic."
19,"Yesterday in Rules Committee, I offered an amendment to allow the House to pass the emergency, Covid-related parts of the 1,800 bill and leave the liberal wish-list items where they belong; in another bill at another time. This amendment was defeated by every Democrat. @HouseGOP https://t.co/Yg6GHYzh5J"
20,"I would like to thank all of the high school artists throughout the Seventh District who participated in this year’s Congressional Art Competition. It is my honor to announce this year’s winners:
https://t.co/Dr6oWGYPGk"
21,"Amidst increased testing and a gradual, managed reopening of local businesses, Georgia has experienced a declining trend of new cases and deaths in the past 14 days. I’m proud of @GovKemp for making Georgia’s reopening a model for other states to follow.
https://t.co/bbmMBNI83r"
22,"Forsyth County Emergency Management and Georgia Highlands Medical have partnered up to offer free COVID-19 drive through testing on Wednesday, May 13, in Forsyth County. Be sure to call the number below and schedule an appointment prior to arrival: https://t.co/i6Lah4HbFp"
23,"Georgia nonprofits that offer humanities programming can now apply for COVID-related relief through Georgia Humanities. Click below to learn more:
https://t.co/LgXikhbzDs"
24,"Happy Mother's Day to all the Moms here in #GA07! Over the past few months, you have gone above and beyond to meet the incredible challenges posed by the pandemic. You deserve to be celebrated today and everyday."
25,"Thank you to all the students who submitted artwork for this year’s Congressional Art Competition. While our judges are now hard at work selecting the winner, I am asking you all to participate in judging the Constituents’ Choice Award:
https://t.co/c2Qjb6CR9a"
26,"When he’s not working at Northside Hospital, Ryan Hepworth spends his time supporting homeless veterans throughout metro Atlanta.
 
Ryan is a great example of what makes our part of the world so special, and I thank him for his service to our neighbors. https://t.co/0F7zVva5ZQ"
27,"In response to the COVID-19 outbreak, the three big national credit reporting agencies are now offering free weekly credit reports to all Americans for the next year. Click the link below to get started:
https://t.co/3jVdesfMfQ"
28,"In response to the COVID-19 outbreak, the three big national credit reporting agencies are now offering free weekly credit reports to all Americans for the next year. Click the link below to get started:
https://t.co/3jVdesfMfQ"
29,"Social Security and Veteran benefits recipients with dependent children under the age of 17 and who did not file taxes in 2018 or 2019 need to use the IRS non-filer tool today to receive the $500 payment for each child:
https://t.co/G4wNIwCAAD"
30,"United Way of Greater Atlanta and Community Foundation for Greater Atlanta have committed $1.5 million to support those most vulnerable to the economic and health-related impacts of the COVID-19 pandemic. Click below to learn more:
https://t.co/eLus4carwi"
31,"You can now play “bingo” to help support local Forsyth restaurants that have been struggling through the current pandemic. 
 
Click the link below for more information on how to get started:
https://t.co/1RbygtTgqT"
32,"Thank you to the Boys and Girls Club of Metro Atlanta for arranging a comprehensive resource page for anyone in need of assistance during the COVID-19 pandemic.  Click below to find the organizations that can help you best:
https://t.co/K4v5TzTY7A"
33,"National Guard members in Cumming have begun disinfecting long-term care facilities to help protect vulnerable Georgians.
 
Thank you to all these men and women who are risking their health to keep our community safe and stopping the spread of COVID-19.
https://t.co/f8CuPVhNGM"
34,"I would like to thank the ⁦@GwinnettChamber⁩ for hosting yesterday’s webinar on the local, state, and federal response to the COVID-19 outbreak.
 
If you were unable to join us, you can view our informative discussion below: https://t.co/6I6GJnwnVm"
35,"If you’re looking to get tested for COVID-19, CVS has a new test site near GA Tech that will provide same day results.
 
To get started, you will need to pre-register on the website. Click below for more information:
https://t.co/vXV6c9qob4"
36,"ICYMI: For the past few weeks, I have discussed many of the concerns that have been raised about COVID-19 in my weekly e-newsletters. I hope you will take a moment to read about some of the most recent efforts to address this threat and lessen its impact: https://t.co/L0Fi7aPPem"
37,Suwanee medical students have joined together to offer free grocery service for the elderly and medically isolated individuals. This is yet another incredible example of #GA07 residents going above and beyond to lend a helping hand during this pandemic. https://t.co/s3qrFN45G3
38,Volunteers in #GA07 have sewed thousands of medical masks and delivered them to local clinics and hospitals to address the current shortage. It’s incredible to see our community unite during these turbulent times and do what is takes to help those in need.https://t.co/5Oo2OWRVpS
39,"Despite being a difficult time for the industry, restaurants across #GA07 have come together to take care of our health care professionals. These are incredible acts of kindness, and they go a long way to helping our community combat the spread of COVID-19.https://t.co/7z9cypksV6"
40,"Today on #NationalDoctorsDay, it’s important to recognize the strength and hard work of all our health care professionals who are doing everything possible to care for our friends, neighbors, and loved ones during this pandemic.
 
I thank you for your dedicated service. https://t.co/bjExQKCP7a"
41,"Emergency loans are now available for Georgia small businesses impacted by the coronavirus pandemic. Click below for more information:
https://t.co/4W4fkeGIJd"
42,"If you believe that you are experiencing symptoms of COVID-19 or have been exposed to the virus, you can now call Georgia’s new hotline number with any questions or concerns: https://t.co/LWtxUHmAxg"
43,"Yesterday, President Trump presented his Coronavirus Guidelines for America. I encourage you to read through the steps you can take to reduce the spread of COVID-19. You can also check back here or visit my website for any updates on the virus https://t.co/0o36sa33he"
44,RT @CDCgov: Everyone can help prevent the spread of #COVID19. Practice healthy habits like avoiding close contact with people who are sick.…
45,"RT @GovKemp: Please continue to share the following @CDCgov information on #COVID19 with your friends, family, and co-workers &gt;&gt;&gt; 
@GaDPH @…"
46,"Today, the House passed a bipartisan funding bill to help combat the coronavirus. 

These funds will help to expedite vaccine development, procure necessary equipment and hospital supplies, and help local authorities directly address the outbreak."
47,"Read the current COVID-19 testing protocols if you think you’ve been exposed, and call your doctor before you go to the hospital to prevent further disease spread. I’ll share more CDC-approved info as we get it. https://t.co/eFK3oR3Ooi"
48,"The CDC has urged Americans to institute normal procedures for preventing disease, including regular hand washing. Visit the CDC’s website for information about how to stay safe. https://t.co/uYs2dbGGhZ"
49,"The @ModernizeCmte is helping to build a Congress that better serves the American people. 

I would like to thank @RepDerekKilmer and @RepTomGraves who took to the House floor Tuesday to submit the Committee’s first report and highlight our bipartisan work. https://t.co/Ca9zH8GZnI"
50,"During #NationalPublicSchoolsWeek, I want to recognize all the incredible educators who go above and beyond to prepare our children to be the leaders of tomorrow. 

It's always a privilege to visit these bright young minds and see first-hand the success of our schools. https://t.co/ibgmEsWWcg"
51,"Today, on National Caregivers Day, I would like to express my deep appreciation for all the dedicated caregivers who work tirelessly to support our friends and neighbors.

Our community is made better through your incredible compassion #ThankACaregiver
https://t.co/hn6GfVX7KF"
52,"Last week, Forsyth County Schools earned a spot on College Board’s AP District Honor Roll list – 1 of only 5 school districts in GA to receive this honor! 

Congrats to the parents, students, and faculty who worked hard to make this achievement possible. https://t.co/1vLfIG4ctx"
53,"On Friday, Washington, DC, became the site of the world’s largest pro-life march as thousands descended on the nation’s capital. I would like to thank the 7th District constituents and all the folks from across the State of Georgia who stopped by the office before the rally. https://t.co/tA9BpIqsBH"
54,"Today, on #HolocaustRemembranceDay, #WeRemember the 6 million Jews who were murdered by the Nazis. Never again can we allow anti-Semitism and genocide to take root in our world. https://t.co/S59v1kM6oe"
55,"Today on National #LawEnforcementAppreciationDay, I would like to thank the brave men and women who risk their lives every day to protect our community.
 
#GA07 is grateful for your service and sacrifice #ThinBlueLine https://t.co/SNMc8s5kFu"
56,"I agree with President Trump when he says America is ready to embrace peace with all who seek it.  That said, America will fiercely guard the safety of all Americans, especially our men and women in uniform. (1/2)"
57,"Wishing everyone a Merry Christmas! We have so much to be grateful for during this special time of year, especially our loved ones. May we remember those who are away from loved ones today serving America in our Armed Forces or as first responders in our local communities. #GA07 https://t.co/ROziPTP5WN"
58,"Today marks the first night of Hanukkah.

We see this beautiful celebration manifested through the light of a menorah in public parks or outside synagogues in our neighborhoods.

If you are celebrating #Hanukkah, or if you have friends &amp; family who are, I wish you peace and joy! https://t.co/vmGfpnHhV5"
59,"Today, #USMCA passed the House w/ overwhelming bipartisan support!

It is my hope that the Senate will consider this agreement so Congress can deliver on @POTUS @realDonaldTrump's promise to bring back jobs to the hardworking people who embody the very best of our nation’s values https://t.co/uIWoP4NMqX"
60,"Before the #ArmyNavyGame begins, I would like to thank those who serve, who have served, and those who play the game. 

Our nation is grateful for your commitment to defending life, liberty, and freedom. https://t.co/dkknEoaTIn"
61,"(2/3) This is a triumph for Georgians and for our water resources, as well as a testament to all of those Georgians, from @GovKemp to @GwinnettGov's Board of Commissioners Chairman Nash and thousands of others, who are continually working to maximize Georgia’s water stewardship."
62,"Today marks the 78th anniversary of the attack on Pearl Harbor. 

We remember the bravery and courage of the 2,403 Americans who lost their lives defending our nation on that infamous day. 

Their sacrifice will never be forgotten. #PearlHarborRemembranceDay https://t.co/vfifOGm8SO"
63,"There are thousands international adoptees who were legally adopted as children but not granted American citizenship due to a errors in our system. 

.@RepAdamSmith and I have introduced bipartisan legislation to fix this injustice.

Our op-ed in @TheHill:
https://t.co/IOBf5gFZ0z"
64,"(1/2) Eighty years after the @MarchofDimes was created to save lives during the polio epidemic, the organization is forced to choose whether to help its employees retire with dignity and financial security or continue its core mission in service to others."
65,"On the 1st International Whole Grains Day, I would like to recognize @GeneralMills — an important company to us here in #Georgia — for their efforts to demonstrate the healthful benefits of incorporating whole grains into our diet #ChooseWholeGrains #InternationalWGDay @Cheerios"
66,"“Gold Star Father’s Day” was made a statewide holiday in Georgia to honor the fathers whose children made the ultimate sacrifice for our country.

.@RepHankJohnson and I have introduced legislation that would make this special occasion a national holiday. 
https://t.co/jQQEZzmUqZ"
67,"Thank you @KAGrassroots for inviting me to speak at the launch of the National Alliance for Adoptee Equality event. NAAE is a consortium of community organizations, and advocates who believe in a legislative solution to citizenship inequalities among international adoptees. (2/3) https://t.co/rpc69359xP"
68,"November is National #Adoption Month, which raises awareness about the urgent need for adoptive/foster care families. As Members of Congress, we want to use this month to celebrate those families who have adopted children, but also to highlight an unintended injustice. (1/3)"
69,Today we honor the brave men and women who chose to serve our country in the Armed Forces. We owe them a debt of gratitude for their willingness to sacrifice and defend our American values and freedoms. (1/2) https://t.co/2UT5K2Ftgx
70,"One homeless veteran is one too many.

The Shadow Warrior Foundation was created to help homeless veterans who have struggled to adjust to civilian life.

Thank you for coming by my office to discuss how the federal government can better help our heroes. 
https://t.co/cmGFtxZzWt https://t.co/59Bz349sRx"
71,"Today, I was proud to recognize on the House floor an outstanding leader from our #GA07 community, Kerensa Wing from @CollinsHill High School, who was recently named this year’s National Principal of the Year. @GwinnettSchools @NASSP

Congratulations on this tremendous honor! https://t.co/57w9UV2rp6"
72,"(3/4)

We are blessed to live in such a wonderful community that embraces that shared principle, independent of any differences that exist between us. I love that about who we are, and I’m grateful to everyone for making it a reality. https://t.co/kMS4XmIIhX"
73,"I enjoyed meeting with the @American_Heart Association today, especially Juan and Marc Borrego, @BufordHS students who co-founded the nonprofit organization Vaping Attention to Prevention.  

I appreciate you all stopping by to discuss tobacco legislation. @VapingTo https://t.co/iCehvf8p3C"
74,"In #GA07, @SharonElemS has dedicated 20% of its grounds to ecological use including an outdoor classroom &amp; containment pond. Thank you for protecting the health of your students &amp; the environment. 

I was honored to attend the @usedgov’s reception honoring @EDGreenRibbon schools. https://t.co/IQdgCiakZg"
75,I would like to thank everyone from the Georgia Independent Automobile Dealers Association @DealersGeorgia who met with me last week to discuss how passing #USMCA would impact the automobile industry here in #Georgia. https://t.co/FyA7BMFtls
76,"As we get closer to flu season, I am proud that our own @universityofga is primed to lead the effort in developing a revolutionary new flu vaccine, following a $130 million award from @NIH. 

Congratulations to everyone whose hard work made this possible.
https://t.co/JkUMZYiI7v"
77,"(1/3)

.@SkillsUSA is a partnership of students, teachers and local businesses who ensure our nation has an educated and highly trained workforce. https://t.co/ounePQ6Gna"
78,Today I met with representatives from the American Occupational Therapy Association (AOTA) @AOTAInc to discuss legislation to improve our access to mental health services and occupational therapy – an important issue that impacts many of us here in #GA07. https://t.co/j1yrlmJT5U
79,"This week, I met with #GA07 representatives from Novo Nordisk @novonordiskus, a global healthcare company that focuses on #diabetes care.

Thank you all for stopping by to discuss ways we can reduce obesity in our community and improve patient care. https://t.co/7ULtbydsiX"
80,"Yesterday, I met with representatives from the @NationalCouncil for Behavioral Health. 

We talked about a variety of different health issues that impact #GA07, including funding for mental health services and measures to address the nation’s opioid crisis. https://t.co/1oDzqS60bA"
81,"On the 18th anniversary of 9/11, our thoughts are with those who lost loved ones on that day. We also honor the sacrifices of the brave first responders who perished in the attacks and the men and women who have given their lives since then to defend our country and keep us safe. https://t.co/DynvOcuLIN"
82,"(1/2)

Tomorrow, we’ll join together as a community to honor those who lost their lives on 9/11 as well as those heroes who risked their lives in service to their country and community."
83,"It truly warms my heart that there are people in #GA07 who are always eager to help those in need. #Forsyth County’s very own Paige Colwell traveled to the Bahamas to assist with #HurricaneDorian recovery efforts. 

Read @ForsythNews' inspiring story: 
https://t.co/D3Gt4PpB0c"
84,".@GHMSINC serves over 18,750 patients in our community. Of those, 75% are living below the poverty line, &amp; over 50% are uninsured.⁣
⁣
Georgia Highlands Medical Services has leveraged its federal investment to provide top-notch health care in #GA07. Congratulations on 40 years! https://t.co/p6M5BJFIs0"
85,"From @ForsythNews:

“On Friday, Rep. Rob Woodall, who represents #GA07, stopped by The Oaks at Post Road to talk with those that lived there and read a roll call to recognize those who served in the armed forces and their families.”

Read the full article: https://t.co/Tx1hX5mF1Y https://t.co/5ccvdnp596"
86,"Oaks at Post Road held a fantastic event honoring #GA07 veteran residents and their family members. 

Whether you served your country, or you supported a family member who did, your sacrifices have not gone unnoticed. As a country, we wouldn’t be where we are today without you. https://t.co/ZbgmD2zZgm"
87,"The Lupus Foundation of America was founded to help everyone who is affected by #Lupus. 

Thank you for meeting with me to discuss ways we can work together to move the ball forward. 

As a member of the Congressional Lupus Caucus, we share the goal of finding a cure. @LupusOrg https://t.co/rTfj62HSV5"
88,"I hope you will join me in applauding the @CityofNorcross for joining cities throughout #Georgia to participate in the Purple Heart Trail. This trail pays tribute servicemembers who lost their lives/were wounded in the line of duty. #Norcross @Norcross_GA 
https://t.co/d2pL49EcMU"
89,"THREAD:

My office has heard from numerous #Georgians who have been relentlessly harassed by robocalls. (1/4)"
90,"#Japan is one of our most important allies. I recently met w/ Japan’s Congressional Minister Kimitake Nakamura, who is the primary liaison btwn Congress &amp; Tokyo. We discussed the positive impact of Japanese investments in the U.S. &amp; how to counter Chinese expansion in the Pacific https://t.co/0W5qss3JVd"
91,"Today, @HouseBudgetGOP &amp; @HouseBudgetDems held a hearing about the costs of #ClimateChange. 

I believe that preserving the health of our planet is something that we can all get behind; however, we must be unified and smart in the way in which we achieve this goal.

Watch below: https://t.co/L3VRXLc6E9"
92,"Great meeting #GA07's Thomas Hayes, a rising senior at @UNG_News who is an Information Systems major &amp; Summer Undergraduate Research Fellow at @usnistgov. He works in NIST’s Information Technology Laboratory which focuses on measuring public awareness of careers in cybersecurity. https://t.co/hLH9O6YGxy"
93,"With a strong job market, we are seeing historically low unemployment and historically high wage growth. 

.@HouseDemocrats should know that raising the minimum wage only hurts those who they are trying to help. #RaiseTheWage 

My interview w/ @FoxBusiness' @Varneyco: https://t.co/1CydiqPlPu"
94,"Fixing our nation’s broken healthcare system will not be easy. 

Last week’s decision by the Administration to rescind the proposed “Rebate Rule” exemplifies the very difficulties that ensue when such efforts are undertaken. 

Read more in my e-newsletter:
https://t.co/IoYrcV4fx8 https://t.co/D7MK6mRw9q"
95,"In this weekend’s #ICEraid, @ICEgov is pursuing those who had their day in court, and who were ordered to be removed.

I encourage @SpeakerPelosi and @HouseDemocrats to work w/ @HouseGOP to address the humanitarian crisis at our southern border.

My interview w/ @ANHQDC @FoxNews: https://t.co/ZgwjXZCKrg"
96,"Each year without fail, regardless of who’s in power, we come together to protect our national security &amp; support those who fight to defend it. 

On the House floor, I fought to end the politicization of H.R. 2500, the National Defense Authorization Act. #NDAA

My remarks below: https://t.co/aNol6B90HH"
