,Tweet
113,"The coronavirus bill that Speaker Pelosi tried to ram through yesterday had almost no support, even from within her own party. 

She had to shelve her partisan wish list and start negotiating a better deal that will help the American people through this coronavirus outbreak."
114,I just voted against ANOTHER attempt by House majority to stop President Trump from eliminating dangerous terrorists like Qasem Soleimani—who was responsible for murdering hundreds of American service members and slaughtering of thousands of innocent civilians.
115,"When FEMA makes a mistake, FEMA should pay the price for that mistake—not honest disaster victims who are just trying to rebuild their lives. My bill will hold FEMA accountable for their mistakes. https://t.co/PychI00SWu"
116,Coronavirus is in the United States. Here is some more information on the disease and some simple steps you can take to help protect yourself and your family from the disease. https://t.co/EL2LbZLxs9
117,"Last week I introduced the Preventing Disaster Revictimization Act. It’s a short, simple bill that would hold FEMA accountable for their mistakes—instead of allowing FEMA to punish, threaten, &amp; harass honest disaster victims who are awarded aid because of a mistake made by FEMA. https://t.co/CArVIA7MTE"
118,"Thank you to all our incredible teachers, school board members, administrators, paraprofessionals, secretaries, cooks, bus drivers, mechanics, school nurses, social workers, counselors, janitors, volunteers, and parents who make our public schools run! https://t.co/UNAscC4B9U"
119,"I’d also like to recognize @GrandRiverTech for my Career and Technical Education Showcase, which educates students in 17 different career programs, ranging from agriculture to health services technology! https://t.co/Ukv0M1UCHP"
120,"Disaster assistance is often pocket change to the federal government, but it’s life-changing to disaster victims, especially those who have lost their homes. If the money was used for disaster recovery, and there’s no fraud, FEMA needs to move on. https://t.co/UVNo1lA4eR"
121,The first school I’m highlighting today for my Career and Technical Education Showcase is the Hannibal Career and Technical Center which offers 11 different career and technical education programs ranging from building trades to health services. #PublicSchoolsWeek https://t.co/jWKB8gAcX1
122,"A Holt County man who lost his home to the 2019 flooding was mistakenly given $12,000+ from FEMA only to be told later he would have to pay it back. Today I introduced the Preventing Disaster Revictimization Act to stop things like this from happening. https://t.co/2uUSdOFTw4"
123,"Earlier this week at the #SOTU, @realDonaldTrump honored Brigadier General Charles McGee, one of the last surviving Tuskegee Airmen.

Gen. McGee, who just turned 100, is a veteran of WWII, the Korean War, and the Vietnam War. He also happens to be the former Director of @FlyMKC! https://t.co/5VlzHlxeME"
124,Thank you to all our brave law enforcement officers who protect and serve our communities. https://t.co/A6aiw649fJ
125,"Quasem Soleimani was a terrorist responsible for the murder of hundreds of Americans.

I am deeply grateful for the men and women of the U.S. military who brought his reign of terror to an end and for @realDonaldTrump's decisive leadership."
126,Congratulations to all the brave and talented North Missouri students who sought and received these nominations—and volunteered to serve and defend our great nation. We are all grateful for your courage and dedication. https://t.co/QNDV74MVYv
127,"I’d like to take a moment to thank Alec, who served as an intern in my Washington, D.C. office this year. Thanks for all you’ve done to help the folks of North Missouri and I wish you the best of luck in your future endeavors! https://t.co/HsWYyQ824s"
128,Today’s passage of the National Defense Authorization Act conference report is a win for our country and the brave men and women in the Armed Services who are committed to defending it. https://t.co/8Q5Fc1PKDy
129,"I am proud of all the young men and women who have sought out and received nominations, and I thank all of them for their willingness to serve this country. https://t.co/0FkWRNcPXQ"
130,"This move is great news for the whole Kansas City region. Not only does it save taxpayer dollars, but it also brings these agencies closer to the folks they serve.
https://t.co/FDLIkoWhsb"
131,Today we honor the brave men and women who have served and sacrificed so that we might be free. America is the home of the free because of the brave. https://t.co/oBXlQ2gVBs
132,"This is the lawyer who is representing the whistleblower. 

This is nothing more than a politically-motivated witch hunt. https://t.co/zxJuiPX6OV"
133,"This has caused a lot of headaches and heartbreak for families just trying to get back up on their feet—some whom haven't been able to return home since March.

This is bad and it’s affecting the lives of a lot of people. 

FEMA needs to answer how they are going to fix this."
134,"Last Friday demolition started on the old Champ Clark Bridge.
 
The new bridge opened in August.
 
I am glad we were able to get a federal TIGER grant to get this project done and grateful for the folks over at @MoDOT and @MassmanCo who got this project done. https://t.co/Cyw8XwMvIh"
135,Thank you to all the great young leaders who made it out to my Future Leaders Academy in St. Joseph this week. https://t.co/inyBipEBE3
136,"We’ve got 73 miles of border wall system done.
 
We've got another 160 miles under construction—&amp; 276 miles in pre-construction.
 
I've wanted to #BuildtheWall &amp; #SecureOurBorder for years. I'm glad we finally have a President who is getting this done in @realDonaldTrump"
137,"I’ve said it once—and I’ll say it again.
 
We have a violence problem in this country, not a gun problem.
 
We need to address the hatred and sickness that drives people to commit these heinous crimes, not punish law-abiding gun owners.
https://t.co/D9uf6uXsAi"
138,"RT @TransportGOP: Missouri Republican @RepSamGraves, who is the ranking member on the House Transportation Committee, called DeFazio’s requ…"
139,"Happy to celebrate the beginning of final phase of the Kansas City Levees Project earlier this week.

It took a lot of hard work to get this project funded, but i'm thankful for the efforts of my friends @RepCleaver and @JerryMoran who helped us get this project fully funded. https://t.co/dRb9x4TdYp"
140,"So thankful for everyone who made it out to my women’s advisory luncheon. 

It was great to hear from so many wonderful female leaders in the KC area. 

A special thanks to Councilwoman @HeatherHallKC for moderating the event and for everyone who took part in our panel. https://t.co/J7IzpY6DOZ"
141,"It’s based on secondhand claims from a “whistleblower” who we now know has a “prior working relationship” with a current 2020 Democratic candidate.
 
We have the transcript from the call. We know what was said."
142,"Speaker Pelosi doesn’t have the constitutional power of impeachment, that belongs to the whole House.
 
This “impeachment inquiry” is unconstitutional and illegitimate
 
@realDonaldTrump is right not to comply with it."
143,"Every day we waste on political sideshows in Washington is another day we aren’t helping folks impacted by the Flood of 2019.
 
These are real families—some of whom haven’t been able to return home for months now.
 
Finding real solutions to help them should be our top priority. https://t.co/99dw9xaK6f"
144,"It's been 7 months since the national headlines that followed flooding back in March, but we still have families who haven’t been able to return home yet. 
 
I joined @kmbc to talk about why helping these folks should be our top priority in Washington. Full interview coming soon. https://t.co/cUejBAySGZ"
145,RT @RepFrenchHill: I’m proud to work with my House colleagues @repcleaver and @RepSamGraves to ensure that all who served in WWI are honore…
146,"Congrats to Clarksville, Mayor Jo Anne Smiley and the Mark Twain Regional Council of Governments who worked hard to secure this important grant."
147,"This is a good, bipartisan bill that will help our communities recover from flooding and better prepare for future floods. I’m grateful for my colleagues on both sides of the aisle who helped get this important bill out of committee. https://t.co/Xcqe2ZR90t"
148,"For those who never returned home, you are American heroes. You are not forgotten. #POWMIA https://t.co/sFYQ5bM29c"
149,"There’s a lot to celebrate with the repeal of WOTUS.
 
President Trump listened, he made a promise, and he kept it.
 
We can have clean water and healthy rural economies too—and that’s what repealing #WOTUS gives us.
https://t.co/vC9z7wmXqt"
150,"We need to enforce the laws we have, get criminals off the streets, and get folks in mental health crises the help they need, not attack law-abiding gun owners for exercising their #2A rights. https://t.co/vzufX6U99u"
151,@MOHospitals @CCMHMo @Mosaic_Albany Big thanks to @saintlukeskc and @ScotlandCoHosp as well!
152,"Earlier this week I met with @MOHospitals to talk about the difficulties facing rural hospitals in North Missouri. 
 
I’m glad folks from @CCMHMo, @mosaic_albany, and other north MO hospitals took time to meet with me and grateful for all they do to keep our communities healthy. https://t.co/6aBRLK4LrU"
153,"May we never forget,
 
the mothers, fathers, sons, daughters, friends, and loved ones we lost that day,
 
the heroes who rushed into the carnage to save others.
 
May we always remember—today and every day. https://t.co/ORMK713knE"
154,"This green new deal, green dream, or whatever they call it has really turned into a nightmare.
 
Now it’s just a rat race to see who can propose the most radical government takeover of the American economy.
https://t.co/tK3LVmKMwR"
155,"RT @TransportGOP: Prayers for all Urban Search &amp; Rescue Task Forces, incl Missouri Task Force 1 @BooneCountyFire, who are deployed to help…"
156,"You might not recognize the name Adam Olin Smith, but you should. 

Adam was an American hero who gave his life in defense of our freedom. 

You can read more about Adam’s life and legacy in my weekly newsletter: https://t.co/osnBAfLC7r"
157,RT @Brianontheair: ICYMI: A congressman who led the effort to rename a northern Missouri post office for a fallen Navy SEAL describes Adam…
158,We can never repay the debt of gratitude we owe our veterans who have sacrificed so much in defense of freedom. https://t.co/3NTMFgiDAZ
159,"The Flood of 2019 has been incredibly devastating. Unfortunately, the recovery process has been confusing and frustrating for many who have been impacted. 
 
We need to bring transparency to this process so we can ensure folks get the help they need.

https://t.co/X9j2MaUTyd"
160,"Our failure to #SecureTheBorder has hurt all Americans—not just those who live in border states.

I was proud to lead the charge in support of @realDonaldTrump's national emergency declaration in February.

I'm glad the Supreme Court finally gave us the go-ahead to #BuildTheWall. https://t.co/AixiJdpEsi"
161,"I’m proud to be from what some folks call the “middle of nowhere.” 
 
I’m proud to stand side by side with the millions of good, honest, decent folks from North Missouri and all across America who love our great country. 
 
I’m proud to stand with our President, @realDonaldTrump"
162,"Last weekend I held a town hall just at the airport just outside my hometown of Tarkio. These airports are critical to the future of our rural communities—for economic development, rural health, and so much more. Grateful for everyone who joined us for the town hall! https://t.co/GIPjQjuOtB"
163,Had a great annual Aviation Town Hall in Tarkio this morning. Thanks to Acting  @FAANews Administrator Dan Elwell and my colleagues  @RepPeterDeFazio @RepKinzinger @RepDavids @RepRickLarsen and @RepDavidRouzer for being a part of it.  Thanks to all who came out! https://t.co/E2rT1b4ztW
164,"FEMA is encouraging people in Andrew, Atchison, Buchanan, Holt, and Platte counties who were impacted by flooding by flooding as early as March to apply for federal assistance. You can get more information here:

https://t.co/gsx4erWUR5"
165,RT @SpencerMOFB: It’s been a busy day! Thanks to all the members of Missouri’s congressional delegation who made time to visit with @HurstB…
166,"This is why we have immigration laws—&amp; why we must enforce them. We can't allow war criminals, gang members, human traffickers, &amp; drug smugglers to freely live in our country. We must secure our borders &amp; thoroughly vet everyone who comes into our country. https://t.co/BvFARDCjIR"
167,My fourth of July office. Honoring those who have given so much for our independence. https://t.co/4oxNVf2dk8
168,I’m grateful for all the Missourians who are coming together to help our communities recover from these floods. I’m thankful for the leadership of @GovParsonMO and I’m hopeful his second request for a major disaster declaration will be approved soon. https://t.co/ipDoIsRlI6
169,"I couldn’t care less what Nike puts on their shoes, but it’s ridiculous to suggest that the Betsy Ross flag shouldn’t be displayed. It's a symbol of freedom and a reminder of the millions who have given their lives defending that freedom since 1776. https://t.co/LIAx6E5VFI"
170,"This is a disgusting attack on the law enforcement officers who work day in and day out at the border to protect our communities. I wonder if the author is aware that CBP agents have rescued more than 2,500 people at the border since October. https://t.co/zl9ORhRSsb"
171,"When investigating airline crashes, we can’t just look for an easy scapegoat. We must consider all the facts and look at every contributing factor. We owe it to all those who tragically lost their lives in these accidents to get this right. https://t.co/9AaIYvLQLE"
172,"RT @BryanLowry3: .@RepSamGraves: ""We owe it to all of those who tragically lost their lives to get it right."" https://t.co/JOdqZlrXFI"
173,I hope the two criminals who vandalized the National World War I Museum and Memorial in Kansas City are quickly brought to justice. This disgraceful and cowardly act is an insult to the legacy of the more than 4 million Americans who served in World War I. https://t.co/op7NSj3WD3
174,"I’m glad the USDA can finally help farmers who lost stored grain to flooding. The flooding hit so fast this year, many farmers were unable to get grain out of bins before it hit.
https://t.co/tDmlGzR61x"
175,"RT @USArmy: Today, we celebrate 244 years of defending and protecting America, and the generations of Soldiers who have answered the call t…"
176,"Speechless. The damage and destruction in almost unbelievable. 
               
I’m so thankful for our first responders who have helped across North Missouri during these recent floods. https://t.co/q6bi4aMgH4"
177,Yesterday President Trump signed the long-awaited disaster relief bill. I’m glad we finally got this done and I’m glad this bill finally allows the USDA to help farmers who lost on-farm stored grain to flooding. https://t.co/65ZYS56UzY
178,"On June 6th, 1944, 156,000 Allied troops stormed the beaches of Normandy—securing a foothold for freedom in Europe.
 
Today, on the 75th Anniversary of D-Day, we take time to remember and honor their legacy— and to thank these heroes who forever changed the history of the world. https://t.co/HkxukMW6aj"
