,Tweet
0,"The Paycheck Protection Program was highly successful, supporting over 51 million American jobs during this pandemic. It’s time for the Speaker to stop playing politics and get American small businesses the help they need. https://t.co/IWwOdkYktf"
1,Amy Coney Barrett is a constitutional conservative who will uphold the original intent of the law and our founding documents. I applaud President Trump for nominating Judge Barrett and encourage the Senate to swiftly confirm her nomination to the Supreme Court. https://t.co/uc4hYKYc4a
2,"I applaud President Trump for nominating Judge Amy Coney Barrett, a Constitutional conservative who will be steadfast in her pursuit of the original intent of our founding documents and the law. I encourage the Senate to swiftly confirm her. https://t.co/SJol6FBiVn"
3,"Main Street America has taken a beating during the COVID-19 pandemic.
 
Here are some things we can do this Small Business Week, and every week, to keep our favorite local Small Businesses afloat. https://t.co/5gAXSzha1s"
4,Thank you to all the Air Force veterans who have served and sacrificed over the past 73 years! https://t.co/UDFKfeub19
5,I’m proud of all who have worked to bring the old Tarkio College campus full circle and create the new Tarkio Technology Institute. https://t.co/Qxgqm0NM0E
6,"In Kirksville, I met with businesses, healthcare, and university officials about the COVID-19 pandemic how together we can reopen and rebuild our economy safely. https://t.co/QGUwBgWKko"
7,"I stopped in Kirksville last week to talk to businesses, healthcare, and university officials about how the COVID-19 pandemic has impacted Kirksville. The good news is that we’re on track to reopen safely and get more and more folks back to work. https://t.co/1PCX6BG8OC"
8,"Congratulations to Blue Springs South graduate Sarah Luzynski, whose work “Germ” won the 6th Congressional District Art Competition this year. Her incredible artwork will soon hang in the U.S. Capitol Complex. https://t.co/3N9Ue2BEpn"
9,Thank you to everyone who has volunteered to help with the flood relief in St. Joseph. https://t.co/55NiwkNDlK
10,"When deciding how to get students back in the classroom safely, we should be talking about their health and education, not lawsuits and liability. https://t.co/RMFJbnCgIC"
11,Big thanks to LifeFlight Eagle 1 in Chillicothe for showing me around and talking with me about how the COVID-19 pandemic is impacting them. These folks provide an absolutely essential service to North Missouri and we can’t thank them enough for all the lives they’ve saved. https://t.co/vRYBP2hYtn
12,"The miracle of flight has transformed our lives in ways pioneers like Orville and Wilbur Wright could only have imagined. Today, on National Aviation Day, we remember all those who paved the way for modern flight. https://t.co/P2CNO9mIvr"
13,Congratulations to Community Hospital-Fairfax on being recognized as a top performer for patient satisfaction by the Centers for Medicare and Medicaid. Only 3 Missouri hospitals and 266 hospitals in the country received this honor.
14,"There are no easy answers for educating our children during the COVID-19 pandemic, but a great start is trusting parents to make the best decision for their children."
15,"Some have underlying health conditions that make potential exposure to the COVID-19 virus life-threatening, while others suffer from learning disabilities that make at-home learning next to impossible. Kids who need in-person school should have that available."
16,"If you’ve had COVID-19, one of the best ways you can help others struggling with the virus is by donating convalescent plasma. 

For more: ⬇️⬇️⬇️ https://t.co/I666LOdU4L"
17,The bottom line is that reopening our economy and getting folks back to work is the only sustainable path forward. We can and are doing that while continuing to take commonsense steps to fight this virus. https://t.co/or6jBHYKe6
18,Congratulations to Maryville City Manager Greg McDaniel who was awarded the Jay T. Bell Professional Management Award by the Missouri City Managers Association on Monday. Greg is a great asset to the Maryville community. https://t.co/w54dBno2fv
19,"More than 900,000 cattle and calves call North Missouri home. This Cow Appreciation Day, I want to recognize and thank the thousands of North Missouri farmers who raise them and make sure beef is what's for dinner. https://t.co/93WfTQqVDs"
20,"The CARES Act was a saving grace for many of our hospitals, but now safely reopening our country is the only sustainable path forward for our hospitals and small businesses alike.  https://t.co/QDsjBki8Zl"
21,"This bill will ultimately help save the lives and livelihoods of many Americans who live and work along our rivers, all while helping rebuild our water infrastructure and our economy. It’s a big win for North Missouri and our entire country. https://t.co/G2APcODaFE"
22,"The Paycheck Protection Program helped tens of thousands of Missouri small businesses make it through this crisis and helped save nearly 1 million Missouri jobs. Now, we’re reopening and rebuilding our economy while continuing to fight this virus. https://t.co/MUWypAJx2Y"
23,"We’ve added 7.5 million jobs in just the last two months; this is a good indication that folks are getting back to work.
 
This is great news, but we still have a long way to go to rebuild our economy and fight this virus. https://t.co/8ASVbG9BE8"
24,"We added 4.8 million jobs in June, and another 2.5 million in May. 
 
We’ve had back-to-back months of record-breaking job growth as more and more Americans are getting back to work. 
 
We still have a long way to go, to rebuild our economy and fight off this pandemic. https://t.co/si2PJgGfjZ"
25,"ATTENTION SMALL BUSINESS OWNERS: The deadline to apply for the Paycheck Protection Program has been extended!
 
The program offers forgivable loans to small businesses to help keep employees on payroll during the COVID-19 pandemic.
 
More information here: https://t.co/JEuQvgNMlg"
26,"ATTENTION SMALL BUSINESS OWNERS: Today is the last day to apply for the Paycheck Protection Program, which provides forgivable loans to small business owners to keep employees on payroll during the COVID-19 pandemic. 

More info here ⬇️⬇️⬇️
https://t.co/JEuQvgNMlg"
27,Some good news for our healthcare providers looking to expand telemedicine here in Missouri. https://t.co/jYYaMyt2Iw
28,"The Economic Development Administration has approved $400,000 to help the Kansas City region recover from the economic devastation wreaked by COVID-19. https://t.co/wrz3v1v8A6"
29,"We bent the curve. We slowed the spread of COVID-19. We bought our healthcare workers time. And now, thanks to the leadership of @GovParsonMO, Missouri is back open for business!"
30,Shutdowns and slowdowns meant to slow the spread of COVID-19 hit farmers and ranchers hard. The goods news is that there's help on the way. https://t.co/Vc0Fdjap4B
31,"BIG NEWS: the Treasury Department has proposed a new rule to clarify that fixed-fee direct primary care arrangements, including healthcare sharing ministries, are qualified medical expenses that can be paid out of some tax-deferred medical accounts. https://t.co/iAwc7eyAZu"
32,"Thank you to the American farmers for keeping food on all our tables. They don’t stop for anything, even a pandemic."
33,"As Missouri reopens for business, more and more local farmers’ markets are reopening. 
 
If you’re looking for ways to buy food locally to help farmers impacted by COVID-19, take a look at MU-Extension’s Food Finder tool: https://t.co/VAQHlZ2V1C
https://t.co/N1zpD1IKok"
34,Thank you to all the men and women who protect and defend our nation. https://t.co/cpMljTW6cr
35,"We need to get our economy back on track. We need to get people back to work.
 
This virus isn’t going away, no matter how long these shutdowns last.
 
We have to adjust to the new normal and reopen America safely, smartly, and quickly.
https://t.co/5rQIpIhK8u"
36,"The application period of the USDA’s Coronavirus Food Assistance Program (CFAP) opened today. The USDA will be accepting applications until August 28, 2020. Farmers can find out more at https://t.co/dxCr2Ujtnc or by calling your local FSA office. https://t.co/opAk7mxndG"
37,The USDA opened Coronavirus Food Assistance Program (CFAP) applications for farmers this morning. You can learn more at https://t.co/dxCr2UB4eK or by calling your local FSA office.
38,Today we honor the ones who didn't make it back home—those who gave all so that we might be free. https://t.co/D0lApXnnco
39,GOOD NEWS: $225 million is on the way to expand COVID-19 testing in rural America and Missouri’s 351 rural health clinics are getting the biggest chunk of that. https://t.co/fNnXtxWi55
40,"To the EMTS, paramedics, nurses, doctors, dispatchers, and other EMS professionals ready to respond at a moment’s notice to save lives, thank you for keeping our communities healthy and safe. https://t.co/QjycUcXldl"
41,"While the COVID-19 pandemic has devastated all of America, many were already struggling to get back on their feet in the wake of the Flood of 2019.
 
We’ve got to make sure that disaster victims aren’t hurt a second time due to FEMA’s mistakes. https://t.co/HMOBKnySEP"
42,"The USDA has released the details of the Coronavirus Food Assistance Program (CFAP) authorized by the CARES Act to help farmers during this pandemic.

Applications for the program open on May 26. You can find more details about the program here: https://t.co/CXhTawl0Bs https://t.co/QXnEx7ZeeS"
43,"The Federal Housing Finance Agency (FHFA) has announced that both Fannie Mae and Freddie Mac will allow homeowners impacted by COVID-19 to defer loan payments and make those payments when the home is sold, refinanced, or at the end of the loan. https://t.co/8i18U7me2e"
44,"Earlier this week I hosted another telephone town hall to listen to the issues folks are facing here in North Missouri and learn what we can do to help folks through this pandemic. 
 
It’s time to get Americans back to work and get America back on the road to recovery. https://t.co/p1v4YkAnnl"
45,"To our healthcare heroes fighting on the front lines of this pandemic, thank you for keeping us healthy and keeping our communities safe. https://t.co/Lml6jeSllk"
46,"DEADLINE TOMORROW (5/13): If you want to get your COVID-19 Economic Impact Payment faster, you must submit your direct deposit information to the IRS by Wednesday at noon.
 
You can check the status of your payment on the official IRS website here.
https://t.co/oeBV3hWaqK"
47,"To our heroes in blue, who put their lives on the line every day to protect us and our communities, thank you. #NationalPoliceWeek https://t.co/KiBBhvUYyK"
48,"DEADLINE WEDNESDAY: If you want to get your COVID-19 Economic Impact Payment faster, you must submit your direct deposit information to the IRS by Wednesday at noon.

You can check the status of your payment here on the official IRS website.
https://t.co/oeBV3hWaqK"
49,"The funding, authorized by the CARES Act, will help families in need with childcare costs and help them put food on the table during this pandemic. https://t.co/M1MeMg648A"
50,"Today we pray for the health of our families, the safety of our communities, the well-being of our healthcare workers, and the future of our great nation. https://t.co/XHvGVog99e"
51,"On this #NationalNursesDay, we pause to say thank you. Thank you to all our nurses who work to keep us healthy, sacrifice to keep our communities safe, and serve to help America through this pandemic."
52,"On Wednesday, two C-130 Hercules cargo aircraft from the @139AW in St. Joseph will fly over local hospitals in a show of support for our healthcare workers fighting COVID-19. You can get more details here: https://t.co/qqYhIHL3iw https://t.co/sfqth2MCAv"
53,"30 million Americans live on the wrong side of the digital divide with no access to internet for telecommuting, distance learning, or telemedicine. This problem needs to be fixed, and it’s even more pressing now during this pandemic. https://t.co/rIEVxBIvVm"
54,"We often take the food we eat for granted, but millions of Americans work every day to get that food from the field to the dinner table. To the farmers, truckers, grocers, and all who make this miracle possible, thank you. https://t.co/r38KHK788R"
55,"North Missouri Together: Scotland County R-1 Elementary Student Council decided to donate all their funds—$1,000—to the Scotland County Memorial Hospital Foundation to help the hospital meet health challenges in the community during the COVID-19 pandemic. https://t.co/D7RrbApf8t"
56,"Farmers in North Missouri have taken a devastating one-two punch. Last year, we endured record-setting floods. This year, COVID-19 has turned markets on their head. That's why I'm urging the USDA to make assistance to farmers effective, fair, and fast. https://t.co/kudxruCYAL"
57,"North Missouri Together: Triumph Foods donated nearly 5,000 pounds of pork products to Second Harvest Community Food Bank to help feed families during this pandemic."
58,President Trump has invoked the Defense Production Act to order meatpacking plants to stay open during this pandemic. This ensures consumers can still buy meat and it will help stabilize the market for farmers who have been struggling with plummeting livestock prices.
59,"Kansas City International Airport is important for the entire region, and getting this project done on time will help us emerge from this pandemic stronger than before. https://t.co/ecUXvttM8G"
60,"The oldest distillery west of the Mississippi—Holladay Distillery in Weston, MO—has produced 10,000 gallons of hand sanitizer, much of which they donated to local hospitals and first responders. https://t.co/DwS2IPyDaT"
61,"Four T-38 Talons, Two A-10 Thunderbolts &amp; a B-2 Spirit Stealth Bomber from @WhitemanAR flew over hospitals in the KC area today to salute our healthcare workers, first responders, military personnel, essential workers &amp; volunteers on the frontlines in the fight against COVID-19. https://t.co/xVXtPaN6pk"
62,RT @HouseVetAffairs: 🚨🚨🚨 ATTENTION #Veterans: The @IRSnews just announced that the deadline for eligible veterans and/or students who use t…
63,"More help is on the way for our small businesses and rural hospitals. More here⬇️
https://t.co/50ss0pE4NM"
64,The legislation will provide critical resources for our healthcare workers—and get both the Paycheck Protection Program and Economic Injury Disaster Loan Programs back up and running to help small businesses. https://t.co/DVt1PS6Bqh
65,I just voted to get both the Paycheck Protection and the Economic Injury Disaster Loan Program back up and running and provide critical resources to our hospitals fighting this pandemic. My statement: https://t.co/nvPDtO22Mq
66,"Next week Missouri will start using a new FDA-approved system to decontaminate up to 80,000 masks per day and using a Google-developed tool to help connect healthcare providers to PPE suppliers. https://t.co/IzVLe6Gd1O"
67,"There are now 100+ COVID-19 testing sites across the state of Missouri. If you are ill and believe you may have COVID-19, please call the testing site you wish to visit before going to a hospital or testing location.
 
View the interactive map here: https://t.co/pbmq9Vu0fr https://t.co/to8Yws9GnY"
68,EMT Billy Birmingham gave his own life working to save the lives of others. My thoughts and prayers go out to his family and loved ones struggling with this great loss—and to the thousands of first responders fighting on the front lines of this pandemic. https://t.co/MUbwrSwiB9
69,"To those who keep food on the shelves,
 
To those who keep PPE in our hospitals,
 
To those who get everything where it needs to go,
 
#ToThoseWhoKeepUsMoving, thank you."
70,RT @TransportGOP: Watch here📺: Ranking Member @RepSamGraves says thank you #ToThoseWhoKeepUsMoving during #COVID19 https://t.co/oGIAg4UnEc
71,"We rely on you to keep food in our stores, to keep critical medical supplies in our hospitals, and get everything where it needs to go—#ToThoseWhoKeepUsMoving, thank you. https://t.co/kc8TntsAqa"
72,"To all our doctors, nurses, CNAs, pharmacists, EMTS, paramedics, and countless other healthcare professionals and first responders fighting on the front lines of this pandemic—THANK YOU! https://t.co/QqOzmhEPyb"
73,"As we continue battling this pandemic, we have to start thinking about how we reopen our economy safely and quickly to help American workers and the American economy get back to work. https://t.co/yXSGwxf4kE"
74,"The COVID-19 pandemic brought air travel to a standstill, sending revenues plummeting while bills continue to pile up for airports. I appreciate the FAA moving quickly to help Missouri airports—large and small—weather this storm. https://t.co/IeB4lVwt6V"
75,"If you don’t normally file a tax return, you may need to provide the IRS information in order to receive your COVID-19 Economic Impact Payment. 

You can learn more here: https://t.co/BmVZFoo81c"
76,"This Easter will be different, but the reason we celebrate has not changed. We should all work to reconnect with our family and friends while maintaining social distance and slowing the spread of COVID-19. https://t.co/DCbo9uomdj"
77,"While the CARES Act made new resources available to help Americans through the COVID-19 pandemic, scammers will undoubtedly try to take advantage of Missourians trying to access these resources. Please report scams and suspected scams to @AGEricSchmitt’s office at 1-800-392-8222. https://t.co/eprvyGyTy7"
78,"IMPORTANT: Farmers and Ranchers ARE eligible for the SBA's new Paycheck Protection Program. This includes farmers who are sole proprietors, who are eligible to apply starting April 10. 
 
More from the USDA here: https://t.co/6uQs94XXh7"
79,Want to know where coronavirus is in Missouri? Here’s a breakdown. https://t.co/JRaQu44ci9
80,You SHOULD NOT wear surgical masks or N-95 respirators. These critical supplies must be preserved to protect our healthcare workers and first responders. More here: https://t.co/HvTMMEtCpJ
81,"The CDC now recommends that individuals wear cloth face coverings in public, particularly in areas where social distancing is difficult to maintain like pharmacies and drug stores. Here’s a quick video from the Surgeon General on how you can make your own face covering. https://t.co/5AhayUMvN6"
82,"RT @SBAgov: 🚨STAY VIGILANT 🚨

There’s no fee to apply for a #PaycheckProtectionProgram loan. Be aware of fraudulent actors who may charge p…"
83,"If you're a Social Security Recipient, you will receive your COVID-19 economic impact payment automatically. You DO NOT have to file an abbreviated tax return to qualify. https://t.co/ckoNxmkNYB"
84,"Many rural hospitals are struggling to keep their doors open, and this coronavirus pandemic has made things even more difficult. We have to get these funds to rural hospitals quickly to ensure they can continue serving as a lifeline for our communities. https://t.co/U4c4MuukZU"
85,"The Treasury Department and Small Business Administration have begun implementing the new Paycheck Protection Program, which authorizes $349 billion to help small businesses through this pandemic. You can learn more here: https://t.co/VP5LqGLJIV"
86,Our rural hospitals can't fight this coronavirus pandemic alone. Many we're already struggling before this crisis hit. These critical access hospitals are a lifeline for our rural communities and we need them now more than ever. https://t.co/Wdw4rGTqr2
87,"This coronavirus pandemic has posed unprecedented challenges for workers, families, and small businesses—but Americans have responded with unprecedented patriotism, making sacrifices and working together to get through this. https://t.co/lMGsSP6rIk"
88,"Today, on #NationalDoctorsDay, we stop to thank all the physicians who keep us healthy, and all those on the front lines fighting this coronavirus pandemic."
89,President Trump has extended his social distancing guidelines to slow the spread of coronavirus until April 30th. We all must do our part to slow the spread of this deadly virus. https://t.co/PYDeBSoIcz
90,"Last year Anheuser-Busch brought fresh water to flood victims in Missouri. This year, they’re making hand sanitizer to help communities across America dealing with this coronavirus pandemic. https://t.co/3KX5U7kG1W"
91,Today I joined my congressional colleagues from Missouri in writing a letter to the President supporting @GovParsonMO’s request for a disaster declaration to help Missouri fight this coronavirus pandemic. You can read the full letter here 👇https://t.co/D093x2ePyb
92,We need a good bipartisan bill to help America emerge from this coronavirus pandemic stronger than ever. What we don’t need is a mini Green New Deal stuffed with handouts for special interests. https://t.co/4Z8IVl9z3J
93,"This is why staying at home, washing your hands, and avoiding unnecessary contact with others is so important. We all have to do our part to slow the spread of coronavirus. https://t.co/8QKQDhW24Y"
94,"Missouri small businesses are now eligible for low-interest disaster loans to help get through this coronavirus pandemic. More information here⬇️⬇️⬇️
https://t.co/2Dn0iGcycP"
95,Missouri just received additional personal protective equipment from the national stockpile to keep our healthcare providers safe during this coronavirus outbreak. https://t.co/p7LVEbXEGb
96,"Earlier this week, @realDonaldTrump signed the Families First Coronavirus Response Act. I was proud to vote for this legislation and I know that working together we will get through this coronavirus pandemic. https://t.co/Oaprdkgt5F"
97,"My heart goes out to their family, friends, and loved ones as they mourn the loss. This is a painful reminder of how serious this pandemic is and how important it is that we all do our part to slow the spread of this virus. https://t.co/dKa1Wzm9y3"
98,"The President signed the Families First Coronavirus Response Act into law yesterday, which guarantees free coronavirus tests for those that need them, secures paid leave for impacted workers, and helps our communities deal with the economic fallout from this pandemic."
99,"Republican and Democrat, urban, suburban, and rural—we're all in this together. Here's how you can do your part to slow the spread of coronavirus to protect yourself, your family members, and loved ones. https://t.co/gnUYjCLql8"
100,"In order to help older Americans stay at home and avoid risking exposure to coronavirus, the President has dramatically expanded access to telehealth services for Medicare beneficiaries. For more information about utilizing these new telehealth benefits, contact your doctor."
101,"Due to COVID-19, @GovParsonMO and @MissouriSOS Jay Ashcroft have postponed the Missouri municipal elections scheduled for April 7, 2020. These elections will now be held on June 2, 2020."
102,"This is big news, especially with Washington University in St. Louis and the Missouri State Public Health Lab both ramping up their testing capabilities rapidly.  https://t.co/2pnkgVe8IP"
103,I joined @agritalk yesterday to talk about the impact of breached levees on crop insurance premiums and the difficulties this coronavirus pandemic has put on small businesses. https://t.co/0P9U6SbEUI
104,"215 people in Missouri have been tested for Coronavirus

▶️207 Negative
▶️8 Positive (Greene—3, St. Louis—2, St. Louis City—1, Henry—1, TBA—1)

Numbers updated 8:00pm on 3/16. For Guidance, you can call @HealthyLivingMo's 24-hour hotline: 877-435-8411"
105,One of the most important measures we can take to stop the spread of coronavirus is to limit events and implement social distancing. @GovParsonMO has recommended cancelling large public gatherings attended by more than 50 people. https://t.co/WXXynXI8Wy
106,"170 people in Missouri have been tested for Coronavirus

▶️164 Negative
▶️6 Positive (Greene – 2, St. Louis Co.-2, Henry – 2, TBA -1)

Numbers updated 8:42am on 3/16. For Guidance, you can call the @HealthyLivingMo's 24-hour hotline: 877-435-8411"
107,"I just voted for a bipartisan coronavirus bill that guarantees free coronavirus tests for those who need them, secures paid leave for impacted workers, and helps our communities deal with the economic impacts of this outbreak—without punishing small businesses."
108,"If you develop these symptoms, have been in close contact with a person known to have coronavirus, or have recently traveled from an area with widespread coronavirus—call your doctor. Learn more: https://t.co/c0NGVNGWXW https://t.co/iyShVB2zIs"
109,President Trump has declared a national emergency to deal with the coronavirus pandemic. I commend the President for taking this action to unlock more tools to help us meet the challenges posed by this virus as we move forward. This is the right call. https://t.co/EGWmGEUpvm
110,"I continue to receive important updates from Washington on the coronavirus outbreak. As your Member of Congress, one of my top priorities is keeping you informed on pressing issues. You can sign up to receive the latest coronavirus updates here:
https://t.co/EtnHAyWHQi"
111,"Regularly and properly washing your hands is one of the most important steps we can take to stop the spread of coronavirus. This video from the CDC offers some handwashing tips. For more information on coronavirus, visit: https://t.co/ErRv2rJ2Ji https://t.co/u5lEGbXCe4"
112,"73 people in Missouri have been tested for Coronavirus

▶️71 Negative
▶️1 Presumptive Positive [Greene Co] 
▶️1 Positive [St. Louis Co]

Numbers updated 4:45pm on 3/12. For Guidance, you can call @HealthyLivingMo's 24-hour hotline: 877-435-8411"
