,Tweet
99,"When Donald Trump makes fun of those who have fallen in battle, he’s just showing that ""sacrifice"" is so foreign to him it might as well be another language. Service will never mean anything to him other than someone serving him.

My @TheAtlantic op-ed: https://t.co/ERzc2RJkhv"
100,"There are only nine days left to complete your Census! 

To help ensure our schools, hospitals and communities have the funding and resources they need for the next decade, head to https://t.co/mysGJVT7Vo to #BeCounted."
101,She was a 5’1” giant who gave a voice to girls and women everywhere and moved the needle forward in our long fight toward justice and equality for all.
102,"L'Shanah Tovah! Wishing all those who celebrate Rosh Hashanah a very happy, healthy and sweet new year. https://t.co/UPYowSVOja"
103,RT @SenatorDurbin: The Trump Administration is siding with industry over the health and well-being of Illinoisans that are most affected by…
104,"Our country will never fully recover from this pandemic if the next generation is buried in student loan debt made worse by #COVID19. 

I joined @SenWarren, @SenatorDurbin &amp; @SenSchumer today to call on Donald Trump to #CancelStudentDebt. https://t.co/2YFNIdZAKl"
105,"It's no coincidence that after Trump has repeatedly racialized #COVID19, we continue to see a spike in senseless attacks against Asian Americans.
 
Passing @RepGraceMeng's resolution sent a powerful message: Enough. 
 
Now, the Senate must follow suit. https://t.co/CsFwiC1FsP"
106,"Veterans who have sacrificed so much to keep us safe should never have to face unnecessary delays for what may be life-saving medication.
 
@SenGaryPeters just released an investigative report showing that Postmaster Gen. DeJoy’s changes caused harmful mail delays at @USPS ⬇ https://t.co/Z00lSKC8Y4"
107,"At a time when our workers need them most, @OSHA_DOL is failing them.
 
To protect those on the frontlines of #COVID19, Senator McConnell must hold a vote on the COVID-19 Every Worker Protection Act immediately. https://t.co/XX4A7qaXdj"
108,"Is Donald Trump suggesting that our troops—those brave men &amp; women who have volunteered to risk their lives to defend ours—aren't actual ""voters?""

Well, let me remind him that yes, they are. And their vote matters just as much as anyone's. https://t.co/Dc8XqdBv1C"
109,"If you haven't received your #COVID19 $500 stimulus check for your child, there’s still time! The IRS extended the deadline until October 15th.
 
But we can't stop pushing for those parents who had a baby in 2020—making them ineligible to receive their check until 2021."
110,"Clearly, Donald Trump doesn't care about the Gold Star families who might be wondering right now if their son or daughter was killed as a result of a Russian bounty program. 
 
Day 82 of presidential silence on #BountyGate."
111,"If the president had information that could’ve saved any one of the nearly 200,000 American lives lost to #COVID19—he should have. It is literally his job to protect the American people and he has failed. https://t.co/BILaWFSWtu"
112,"While Senate Republicans are AWOL, Donald Trump is continuing to lie to Americans about the seriousness of the #COVID19 crisis while spewing racism &amp; bigotry to distract us.

Don’t let him. The real problem is Donald Trump in the White House. https://t.co/Lqy2ALa804"
113,"The #HEALSAct was a bad movie—and McConnell rolled out an even worse sequel.

The Republican ""Skinny"" COVID-19 relief bill has:

$0 in economic impact payments.
$0 for Medicaid Home &amp; Community Based Services.
$0 for hospitals.

We can &amp; must do better for ALL Americans NOW"
114,"With 51 days until the election, our democracy depends on a fully funded Postal Service so no American is forced to risk their health for their vote.
 
But color me shocked, Senate Republicans offered crumbs for @USPS in their new ""Skinny"" #COVID19 relief bill."
115,"Just when you thought Senator McConnell’s #HEALSAct couldn’t get any worse, the Republican “Skinny” COVID-19 relief bill removes ALL economic stimulus payments. Americans needs financial assistance NOW."
116,"One of the best things we can do is give back through national service—either in or out of uniform. For decades, @Americorps has helped countless Americans serve. That's why we need to pass the #CORPSAct to expand this essential program &amp; help us rebuild from the #COVID19 crisis."
117,"Senate Republican’s last #COVID19 relief proposal sent a clear message to the disability community: We don’t matter.
 
McConnell &amp; Republicans had the chance to course correct—but no. They're doubling down. Their new proposal is 100% identical when it comes to gutting the ADA."
118,"He told us lies about #COVID19.
He told us it would disappear.
He told us not to worry.

Meanwhile, #TrumpKnew that COVID-19 was deadlier than the normal flu, and almost 200,000 Americans are now dead. To say that this was a dereliction of duty is an understatement. https://t.co/yfIh0ylwg5"
119,"19 years ago, a terrorist attack shook the nation &amp; claimed the lives of nearly 3,000 Americans.

It was an attack on our nation. 
On our values.
On our freedom. 

Then and now, we will #NeverForget the lives lost and the first responders who ran into danger as others ran away. https://t.co/UwaMS49L1s"
120,"Apparently, I too am a “loser” and a “sucker” in Trump’s book. But hey—the company of men and women who laid down their lives for this nation is good company to be in. 

Unlike this Coward in Chief in the White House. https://t.co/NLeJ7cu2Aj"
121,"We need to come together in a bold, bipartisan way to help all Americans get through this crisis but, unfortunately, today’s vote shows that Republicans have no interest in doing that.

My statement on why I voted no on the Republican's ""Skinny"" #COVID19 relief proposal: https://t.co/2Iwyc8j8rA"
122,"When it comes to a deadly virus, he claims to be all about not panicking the nation—but stoking fear to try and cheat an election? Sure. That's definitely all ""calm, no panic."" https://t.co/KAxxbV5ajD"
123,"In Trump's America, a reported Russian plot to put bounties on our troops goes unanswered for 76 days. Our military families deserve better than a Commander in Chief who is subservient to some other nation's leader. https://t.co/GYPHmpJlnZ"
124,RT @SenWhitehouse: Proud to join @SenDuckworth and my Democratic colleagues in honoring America’s veterans and those who died in service. h…
125,"According to a number of reports, Donald Trump thinks “nobody wants to see” Wounded Warriors like me.

Nevertheless, I am here on the floor today to honor our nation's Veterans and condemn his ongoing pattern of disrespect for the men and women who serve. https://t.co/0a3IWGHLXc"
126,"Millions of Americans are out of work, our children can't safely go to school and nearly 200,000 Americans have been lost to #COVID19. 

So maybe we should all take a minute to listen to Donald Trump explain why he made this pandemic worse instead of telling America the truth: https://t.co/w6YpqrN95W"
127,"It shouldn’t have been easier for my unit &amp; me to vote from Iraq in 2004 than it is for Veterans to vote in 2020 on US soil.

Donald Trump's attack on vote by mail is a shameless strategy from a man who himself voted by mail weeks ago. This should not be a partisan issue."
128,"“When someone shows you who they are, believe them.” 

Time and time again, Trump has shown us who he is with his demeaning, disparaging comments against those brave enough to wear our nation’s uniform. Shame on him. https://t.co/6wgv1ZZI2C"
129,"Minimum wage.
The right to unionize.
FMLA.

On Labor Day, we celebrate the labor movement that championed these benefits &amp; more for hardworking Americans. And as #COVID19 rages on, keeping up their cause and expanding protections is as important as ever. https://t.co/i6w6IB8dOe"
130,"""If you are an adult who has a young human in your life, please do not teach them that being scared of someone who doesn't look like them is okay.""
 
Thank you, @melissablake, for speaking up on behalf of the disability community &amp; calling out online hate.
https://t.co/rkGI0m9c0a"
131,"When only 30% of our troops who have experienced sexual assault are actually reporting it, that’s a problem. A big one.

If survivors don’t trust the current system in our military enough to report it and get help, it isn’t working. 

Congress must work to fix it. Now."
132,"To wear the uniform of this nation is one of the greatest privileges you could ever have. 

And Donald Trump—someone who doesn't value our Constitution or all the things American stands for—could never understand that. https://t.co/uNQfVVSAyC"
133,"By refusing to expand vote by mail access, Donald Trump is forcing our nation's heroes to choose between their health or their ballot.

That’s just about the least presidential, and least American, thing I’ve ever heard. My @StarsAndStripes op-ed:

https://t.co/2U5G1mLN67"
134,"While this is great news, we can't forget the many families who welcomed a new baby in 2020. Under the #CARESAct, they still can't file for taxes &amp; receive their $500 until 2021.
 
We need my legislation to fix this &amp; help these families get the relief promised to them NOW."
135,"What @realDonaldTrump will never understand is that our Wounded Warriors earned their wounds. They are our badges of honor from our service to the country we love.
 
If he can’t bear to witness those who have sacrificed for our nation, perhaps he should avert his cowardly eyes. https://t.co/wQ8mCLgWei"
136,"As much as Donald Trump must answer for his silence on #BountyGate (69 days and counting), those in the Republican party who enable him will also need to answer for their inaction."
137,"Donald Trump—refusing to work with the rest of the world to find and distribute a vaccine for #COVID19 is the exact opposite of America first.
https://t.co/oSMoX4KrlS"
138,"From one working mom to another, I know what it’s like to bring your newborn onto the chamber floor. We clearly have a long way to go to make sure working moms are supported—no matter what job they do—especially during #COVID19. To do that, we need national paid family leave now. https://t.co/yns54GEmdn"
139,"It's September 1st &amp; millions of renters are at risk of losing their homes now that federal protections have ended—in the middle of a quick spreading &amp; deadly pandemic.
 
McConnell must call the Senate back so we can work out a deal and give Americans #RentReliefNow."
140,"Since LBJ signed the Food Stamp Act into law #OTD in 1964, countless Americans have relied on it to feed their families—including mine when I was a teenager.
 
As families struggle to keep food on the table during COVID-19, let's say it together for Donald Trump: #HandsOffSNAP 🙅🏻‍♀️"
141,"This is good news! I'm glad @USDA is working to ensure students have access to nutritious meals—especially as food insecurity skyrockets during #COVID19. But we must give families even greater certainty.

Let’s extend these waivers till the end of the 2020-2021 school year. https://t.co/Nbgu3SXNns"
142,"With more than 180,000 Americans dead from #COVID19, my @SenateDems colleagues and I sent a clear message to @SecAzar: 

Do your job and put the health and well-being of the American people ahead of the political whims of Donald Trump. https://t.co/CmClJNKVZ7"
143,"Donald Trump vowed to retaliate if it was confirmed other countries offered bounties for our troops in Afghanistan, but what about Russia?
 
Who does our Commander in Chief serve?
 
It's been 64 days since #BountyGate broke news."
144,"Our National Guard troops have been serving as frontline workers since day one of this pandemic—but that didn’t deter Trump from slashing their federal funding.  

I’m partnering with @SenatorLeahy to fix that &amp; ensure their funding is fully restored. https://t.co/Jd1yljTwpe"
145,"School meal programs have been a lifeline for so many kids &amp; their families. I’m urging @USDA to immediately extend all school meal flexibilities &amp; waivers through the 2020-2021 school year. 

Because no child should ever go hungry—not during the #COVID19 pandemic, not ever. https://t.co/Sd2LcGtNd2"
146,"With over 180,000 Americans lost to #COVID19, it's clear we need more testing—not less. I'm proud that workers in Gurnee, Illinois will help us achieve that goal by manufacturing millions of Abbott's new $5 antigen test that delivers results in 15 minutes.
https://t.co/RhrOiBQfHj"
147,"For someone who wants to ""make America great again,"" Donald Trump doesn't seem to grasp that protecting American troops from reported Russian bounties should be a top priority. Day 63."
148,"At 14 years old, Emmett Till was abducted, beaten &amp; lynched by white supremacists—only 65 yrs ago.

There are still sitting U.S. Senators who don’t think lynching should be a federal crime.

We must uproot the systemic racism that killed Emmett &amp; kills Black Americans every day."
149,"Outrageous.

Donald Trump &amp; Rs grossly mishandled this pandemic.
Millions have lost their jobs.
Food insecurity has skyrocketed.

Now, the Admin wants to make it harder for schools to give healthy meals to kids and families who need it most. 

@USDA must reverse this decision. https://t.co/gy7o1KV7E2"
150,"The #COVID19 pandemic killed more than 178,000 Americans in a matter of months. This deadly virus continues spreading throughout the country, killing Americans every day. 

Donald Trump’s response? Bully @CDCgov to reduce diagnostic testing. https://t.co/y1c6rBpIhk"
151,"As we work to ensure equal access to the polls, we do so on the shoulders of women like Abigail Adams, Sojourner Truth &amp; Ida B. Wells who made the adoption of the #19thAmendment possible 100 yrs ago today.

Let's finish what they started &amp; pass the Voting Rights Advancement Act. https://t.co/slT8FJnEdY"
152,"#COVID19 has turned every part of our lives upside down—especially for parents. My call with @C2CChicago leadership was an important reminder that child care funding &amp; paid leave aren't just helpful to families, they're essential—both during this crisis and beyond."
153,"Postmaster General DeJoy’s recent tampering with @USPS is just the latest example of how playing politics can have real consequences on the health &amp; well-being of Americans. 
 
This should never have happened—not in Cook County or anywhere in America. https://t.co/5LGZKQa3n8"
154,"Environmental justice communities are facing 3 crises at once—climate change, racial injustice &amp; #COVID19.

As @EJusticeCaucus co-chair, I’m proud to join @SenDemsClimate in unveiling our #CaseForClimateAction report to tackle these challenges. https://t.co/b11cPTq0CZ"
155,"Today, the very last federal protections to help renters keep a roof over their heads expire.
 
Because Republicans failed to pass the #HEROESAct, landlords can now evict millions of families during a deadly pandemic.
 
This is an outrage.
https://t.co/mo1EVJAZLt"
156,"Strong leaders welcome those who dissent &amp; defend the right to do so. Weak ones try to have them silenced.

Navalny wasn't the first, and he surely won't be the last of Putin's critics to wind up gagged.

The leader of the free world can’t look past this. https://t.co/zgPegupCgg"
157,"Jacob Blake was shot 7 TIMES in the back by Kenosha police—in front of his children.

I’m sick and tired of waking up to stories like Jacob’s.

My heart breaks for his children who saw racial injustice in America in the worst way imaginable. 

We’re better than this. https://t.co/jp0pWWvZu9"
158,"Through thick and thin, American tourist spots like @navypier have been there to show families a good time and provide jobs in our communities. 

The next relief package MUST help our iconic landmarks reach the light at the end of the pandemic tunnel.
https://t.co/XbPowD8EWV"
159,"So we're all on the same page, Donald Trump:
 
➡️Thinks ""it is what it is"" when 1,000 Americans die from COVID-19 each day.

➡️Confessed he's trying to suppress mail-in voting.

➡️Hasn't stood up to Putin for reported bounties on our troops in 55 days.

That's not America First."
160,RT @GovPritzker: I want to share some of the best news we’ve had since this pandemic began: @US_FDA has just given the green light under th…
161,"The 2020 Census will inform the amount of federal $ for schools, hospitals, roads—you name it—for the next decade. My colleagues &amp; I know this is too important to rush. The deadline to complete the Census must be extended. Make sure you're counted today: https://t.co/mysGJVT7Vo. https://t.co/kDagcYQIY0"
162,"Because of your failed leadership, there are at least 170,000 Americans who can’t check the polling—and whose families will take no comfort from the polling. https://t.co/919TJKdTg0"
163,"100 years ago, TN became the last state to ratify the #19thAmendment—paving the way for women to exercise the right to vote. While we are forever indebted to the suffragists who fought for this fundamental right, we can't forget..."
164,"Black Americans dying from #COVID19 &amp; pregnancy complications at higher rates than other Americans stresses what Black people have said for years:

Implicit bias in a hospital room can kill.

#BlackLivesMatter - and they deserve comprehensive healthcare.

https://t.co/WYYuHNYhGa"
165,"Our Veterans, myself included, rely on @USPS to deliver prescriptions from the VA. It is simply not safe to make our Veterans wait for their medicine. I will do everything I can to stop these delays and safeguard our Vets’ health: https://t.co/yUwVEH26ro"
166,"Hey Donald Trump—our National Guard troops across this country have been activated to respond to the #COVID19 crisis, which you've grossly mishandled. The least you could do is restore full funding to states to ensure our servicemembers are taken care of. https://t.co/TO4IeOMD32"
167,"Every incarcerated American has a #right2connect with their loved ones.

Not only does this help reduce recidivism &amp; save taxpayer money, ensuring #PhoneJustice would help families who didn’t do anything wrong.

My colleagues &amp; I are calling for free phone &amp; video call access: https://t.co/CCyvvFbQkw"
168,Trump's inadequate approach to the #COVID19 crisis won’t help us actually get relief &amp; resources into the hands of hardworking Americans that desperately need help right now. We need to take bold action to do that—which is why Democrats passed the #HEROESAct three months ago. https://t.co/J3zjZyhdOm
169,"✅Supporting working families during the #COVID19 pandemic
✅Schools reopening
✅Donald Trump’s attacks on vote by mail

Today, I’ll be joining Amanda Zamora &amp; @19thnews for a discussion on all this &amp; more. Sign up for the livestream here: https://t.co/AMRaNL1PRN"
170,"Let's be clear: For moms &amp; dads across the county, child care is absolutely essential. 

For the countless families that can’t afford to see child care providers close due to #COVID19, congressional leadership must include the Child Care is Essential Act in the next relief bill. https://t.co/wkPLCLEhNx"
171,"Mail-In Ballots.
Medication.
Medical equipment.

As the #COVID19 pandemic rages on, delivery of these goods is dependent on @USPS. Postmaster Gen. DeJoy must correct recent changes that have caused delays in getting packages into the hands of Illinoisans &amp; Americans everywhere. https://t.co/z8Zp4B7VUB"
172,"I would've died in Iraq if my buddies hadn't risked their lives to save mine. From the moment I woke up in Walter Reed, I've spent each day trying find a way to repay them and all those who serve our nation."
173,"I won't sit back &amp; watch Republicans blatantly attack the disability community with their #COVID19 proposal. 
 
I won't let them deprive our community of our right to live full &amp; independent lives. https://t.co/VJn03VOOHl"
174,"For months, millions of Americans have filed unemployment claims—nearly 1.2 million just last week. 

Shame on Senate Republicans for proposing a #COVID19 package that fails to help Americans in need.
https://t.co/buqWD2Aeup"
175,"At least 62,000 Americans in nursing homes have died from #COVID19—that's more than 40% of the total deaths in our country.

Yet, the GOP proposal would rather help corporations than address this crisis &amp; look out for our seniors &amp; Americans with disabilities. https://t.co/dDYlHQT1lt"
176,"Today we're marking the anniversary of the #VRA for the first time without John Lewis. While our hearts are still heavy, let's honor his memory by moving our nation forward. John worked his whole life for an America where every eligible person, regardless of skin color, can vote."
177,"Forcing Gold Star families—who don't know if their sons or daughters were killed because of a Russian bounty scheme—to wrestle with 41 days of silence from the Commander in Chief is an absolute disgrace. 

They deserve to know the truth about #BountyGate."
178,"The GOP #COVID19 proposal is an outright assault on the disability community.

I’m speaking out on the floor b/c I won’t let them reconstruct, brick by brick, the shameful wall of exclusion that Congress tore down when it passed the #ADA three decades ago. https://t.co/Rx2HdRzRjv"
179,"I mourn the loss of these nine brave men—including a new father—who lost their lives in a training accident. 

We must always remember the inherent risk our servicemembers face in order to keep our nation safe. #HonorTheFallen https://t.co/nIsJwDMTmN"
180,"When the Republicans’ COVID-19 proposal includes a $1.7 billion handout to rebuild the FBI building down the street from the Trump hotel, but $0 in rent assistance to help everyday Americans literally keep roofs over their heads. https://t.co/6CX0H5oHrq"
181,"This isn’t just a Texas or a Florida problem, it’s an American problem. Despite the admin’s previous efforts to shortchange National Guard servicemembers who are responding to the #COVID19 crisis, I'll keep pushing for full funding for Title 32 extensions.https://t.co/PQtFtJG0Xl"
182,"Donald Trump's personal message to those who have lost a partner, a parent, a grandparent, a child, a sibling or a friend to #COVID19: 

“It is what it is."" 
https://t.co/muzczoe05Z"
183,Wishing the U.S. Coast Guard a happy 230th birthday! We owe a debt of gratitude to the brave men and women serving in @USCG and all those who have answered the call  since 1790. Thank you for being Semper Paratus! https://t.co/6BsRehEeVr
184,"#COVID19 is surging throughout our state &amp; the country, and Illinois is in need of support. That's why I led the IL congressional delegation in calling for a Title 32 Extension for National Guard servicemembers to keep assisting IL in its response efforts: https://t.co/P2BY0tHEMx https://t.co/sz8ang1Jh9"
185,"If America is going to heal from #COVID19, we need bold, honest efforts to repair the decades of broken trust between communities of color &amp; our healthcare system. We can't move forward if Black &amp; Brown Americans are left behind when a vaccine is ready. https://t.co/42qH6OLIG1"
186,"The truth is right in front of him and he's still concerned about how bad the numbers look for his re-election. Not a shred of sympathy for the 150,000 Americans who have died on his watch or their loved ones and families. https://t.co/KWGYg8rbHX"
187,The combination of this pandemic &amp; the extreme heat this summer poses a serious health threat for pregnant women—especially women of color. Wishful thinking won't make these issues go away. We need real action on the #COVID19 and the climate crises. https://t.co/XR40QWmGbx
188,"RT @SenatorDurbin: Joining @SenDuckworth to call on Pres. Trump to ensure the safe return of Mark Frerichs, who was abducted earlier this y…"
189,"Whether it's a crisis on the home front, like #COVID19, or a crisis abroad, like Putin reportedly offering bounties for the killing of our troops, Trump has failed to lead.

And his failure may be helping Russia get away with murder. #Day39"
190,Yet another example of Trump’s politicization of the military—inserting an unqualified loyalist into the @DeptofDefense who would fail to get Senate confirmation. I urge the White House to reverse course &amp; remove Tata from this post immediately. https://t.co/PdIqZYmSgU
191,"After months of inaction, the GOP's #COVID19 proposal fails to support the environmental justice communities that are disproportionately affected by this pandemic:

Lower-income communities.
Communities of color.
Tribal and indigenous communities.

They deserve so much better. https://t.co/N8VFmk45mG"
192,"RT @TIME: ""I'm not comfortable sending my daughter into a pandemic unprotected and I don't think most other moms would be either."" @SenDuck…"
193,"Donald Trump, do you have an ounce of regret for American troops who've waited 36 days to know whether or not you care that Putin has reportedly put bounties on their heads?
 
Asking for our American troops &amp; on behalf of ALL Americans."
194,"Our troops who are in harm’s way need to know that the Commander in Chief has their back. The fact that Donald Trump has apparently refused to even conduct an investigation into the reported Russian bounty program is a shameful dereliction of duty. 
https://t.co/4UXuwe5Dv7"
195,"We can’t turn our backs on the coal miners who have kept our nation running for decades. This future-forward bill will re-imagine coal country by expanding affordable healthcare options, making higher education tuition-free &amp; incentivizing home buying. https://t.co/jiQtk5oRYo"
