,Tweet
209,"My heart goes out to the folks in Ruston who lost loved ones in the tornado that tore through the city this morning. Please stay safe and be on the alert as more storms are expected across Louisiana today. 
https://t.co/Ousdy0DNpO"
210,"Several banks created anti-gun policies to restrict services to businesses that make and sell firearms. This infringement on our Constitutional rights is a slap in the face to every American taxpayer who bailed out these banks.
https://t.co/NTCadZSF1X"
211,My heart goes out the families in northeast Louisiana who are recovering after the devastating weather that caused the loss of a 12-year-old boy &amp; a disastrous fire at Boley Elementary. Please join me in praying for all of those affected by the storms https://t.co/yzTpnNCukv
212,"In March, health care services across the country led the charge on job creation by adding 61,000 new jobs! In total, we added 196,000 jobs and marked the 13th consecutive month of unemployment below 4%. Our economy is thriving!
https://t.co/CVeBBvim98"
213,"Obamacare was supposed to cut costs in half &amp; make health insurance more accessible. It’s broken both promises. Today in the Appropriations Subcommittee on Labor, Health and Human Services I discussed our growing health care catastrophe with HHS @SecAzar. https://t.co/Su7FBCPBvY"
214,"I don’t know a single person, Republican or Democrat, who thinks we shouldn’t cover pre-existing conditions. It would behoove all of us to have a replacement health care plan ready, &amp; we need to get started now. We need to think about the next generation, not the next election. https://t.co/HPMLSh7oSO"
215,"Thanks to the Medicaid expansion &amp; its poor implementation, 30,500 people received Medicaid support they weren’t qualified for. The Louisiana Department of Health just threw taxpayer money away."
216,"We need to craft a health care program that looks like somebody designed it on purpose, &amp; it starts with coverage of pre-existing conditions. I'm eager to join the @POTUS in creating an affordable health care plan that will replace Obamacare &amp; lower costs for working families."
217,"Today, on National Vietnam War Veterans Day, we remember the 2.7 million Americans who served our country during the Vietnam War. Thank you for your service. We will never forget your bravery or the sacrifice made by those we lost. https://t.co/paqUuaeZ8i"
218,"This month we’ve seen two horrific cases of Hollywood privilege. First was the disgusting college admissions scandal and now Jussie Smollett. The law should apply to everyone equally including the Hollywood elite. 
https://t.co/bRVLE4a1AM"
219,"Banks serve customers all across this country who differ in their political beliefs, occupations &amp; economic status. Our banks should do business based on a customer’s credit worthiness and not political pressures.
https://t.co/2Ftct8Cgc4"
220,"As a graduate of Zachary High School, I was educated and nurtured in our public schools. During #PublicSchoolsWeek, I want to honor the teachers, administrators, coaches, cooks and all the folks who work in our public schools educating our sons and daughters. https://t.co/j5825OyedJ"
221,"Investors who are scammed by con artists like Bernie Madoff and Allen Stanford lose their life savings. Often the victims of financial fraud aren’t wealthy people. They’re middle class Americans who lose every penny they set aside for their retirements. 
https://t.co/fORXQmahhV"
222,"Louisiana farmers and ranchers are stewards of the earth and producers of high quality food. Today we celebrate #NationalAgDay, and I want to thank the men and women in agriculture who work from dawn to dusk growing food for a hungry world. https://t.co/XiT5hJrweH"
223,"Happy #InternationalWomensDay I’m thankful for the intelligent hard-working women on my staff who handle issue portfolios like health care, banking, military &amp; communications. These women play a vital role in the day-to-day operation of my office. I'm honored to work with them. https://t.co/wTRz71rFn2"
224,The @FRCdc is an advocate for religious liberties and pro-life issues. It was an honor to receive the True Blue award from FRC’s President Tony Perkins. https://t.co/VZ7TiKeV90
225,Bureaucratic red tape isn’t an excuse for abandoning Louisiana families who've already waited 2 years for 2016 flood recovery money. @SecretaryCarson please fix this duplication of benefits issue ASAP. Louisiana can’t afford to wait any longer for @HUDgov to fix this simple issue https://t.co/H1SUPdiNKb
226,"Last time I checked, the Constitution provided that we're supposed to advise &amp; consent; not to appease outside interest groups. I don’t appreciate organized efforts to bully &amp; threaten Senators like @SenHawleyPress, who are entitled to express an original thought in his position. https://t.co/9rJciaysDN"
227,"The @LADeptHealth sent letters to 37,000 Medicaid recipients notifying them that they don’t qualify for the program.  I asked the @CMSGov to see what can be done to recover the money that’s been lost to waste &amp; incompetence.
https://t.co/L6MIGUsWMa"
228,"I don't understand how anyone can say ""no"" to saving a child’s life, but tonight I watched 44 of my Senate colleagues vote “no” to protect the lives of born-alive abortion survivors. I will continue fighting for the lives of the unborn &amp; the innocent babies who survive abortions"
229,Tonight the Senate failed to pass the Born-Alive Abortion Survivors-Protection Act.  Anyone who voted against this legislation voted against providing medical care to babies born alive after failed abortions.  Voting against this bill is simply heartless and immoral.
230,The Senate just voted on legislation to defend babies who survive abortions. I voted to condemn infanticide &amp; grant every baby who survives an abortion the same level of care any newborn would receive. https://t.co/KiccTrSOqY
231,"The 6888th Central Postal Directory Battalion was the only an all-black, all-female battalion to serve overseas during WWII. They lived by the motto “No mail, no morale.” Annette Simmons was one of the many Louisiana women who served in the “Six Triple Eight.”  #BlackHistoryMonth https://t.co/QS08BurJxZ"
