,Tweet
112,"While we've worked to get #coronavirus relief out to safeguard lives, abortion advocates want to put more lives at risk by keeping abortion providers up and running. 

Why doesn't even a pandemic seem to dampen their quest to end innocent lives?

https://t.co/T3Kf8Jp81q"
113,"Incredible to see the way Louisianians come together. @LA_College professor Natalie Maxey is using a 3D printer to make face masks for health care workers fighting the #coronavirus, and locals are pitching in!

https://t.co/LYh0nezG28"
114,"The CARES Act is the best path open to us for preserving and reviving our economy as Louisiana battles the #coronavirus.

While far from perfect, this bill gives families, workers, and employers the resources they need to be RESILIENT.

https://t.co/ClaKXpjUlT"
115,"The Senate's #coronavirus relief bill provides money to supplement state and local governments as they fight this virus.

What does that mean for Louisiana? $1.8B in aid, according to a Congressional Research Service estimate https://t.co/QmLHF9B5b4"
116,"Thank you, @realDonaldTrump, for sending vital resources to help Louisiana recover from #coronavirus by granting a major disaster declaration. This will protect lives and livelihoods in our great state. https://t.co/VOUWmc3MSG"
117,"It is no secret that Louisiana workers and families need practical help to get through this #coronavirus crisis. 
 
I’m asking @realDonaldTrump to make critical resources available to our communities by issuing a major disaster declaration for Louisiana. https://t.co/1MyHk9M9K1"
118,"Unfortunately, China was more interested in its image than the world's health so they sat on the truth about the #coronavirus. 

I'm asking @realDonaldTrump to declare Louisiana a major disaster so that we can get major relief for workers and families. https://t.co/xRPZSGgvGJ"
119,"This $31M grant from @fema brings resources to slow the spread of the #coronavirus.

But Louisiana workers need more help from Congress, yet Democrats still refuse to let us move forward. 

Why? Democrats want wind &amp; solar tax credits more than jobs.

https://t.co/n5Bt4ytEEJ"
120,"Reality is calling, but Democrats keep hanging up. 

In the middle of the #coronavirus health crisis, Democrats demand Congress offsets carbon emissions or else they'll strangle Americans economically. 

We have days—not months—to get help to businesses &amp; workers. End the games. https://t.co/KZAxbdtWVi"
121,"We have to stop thinking about the next election and start thinking about the next generation. 

What are we going to leave to our children if Democrats allow this economy to crash? 

Let’s pass the CARES Act for immediate #coronavirus relief! https://t.co/JKExG0i7OK"
122,"Democrats are holding funding for hospitals &amp; salaries for workers hostage while they try to resurrect the Green New Deal. 

Our priority should be people, but today Democrats are playing vampire politics—sucking hope &amp; help from Americans who need it now more than ever."
123,"This afternoon, Louisiana was issued a stay-at-home order that lasts through April 12. 

As we all work to combat the spread of the #coronavirus, here's what this order means for you and your loved ones: https://t.co/Q0zNh25WJr"
124,"Louisianians, like Americans, are victors. We are not victims.

Right now, the Senate is working out a way to get money to businesses and people who are laid off to keep them going until our economy can get back to normal.  

We will get through the #coronavirus together. https://t.co/PiBfkmBMJY"
125,"#coronavirus update:

Americans now have until July 15 to file their taxes without risking penalties. 

For many taxpayers and businesses expecting refunds, filing sooner still means getting your money faster.

Louisiana has also extended the state sales tax deadline to May 20. https://t.co/3dRkqHTv3N"
126,"Encouraging news in our fight against the #coronavirus: 

@HHSgov is launching 3 community-based testing sites in Louisiana today. The federal government is providing these drive-through sites with supplies in order to expand the availability of tests in our state."
127,"Louisiana businesses and employees are struggling through no fault of their own, and they need relief fast. 

@SBAgov has now made low-interest disaster loans available to hardworking Louisianians in the wake of the #coronavirus.

Apply here: https://t.co/zMQi1kI6Zx"
128,"While @realDonaldTrump takes the bold step of filling up our strategic reserve as we fight the #coronavirus, we also need to remember the offshore oil workers and independent operators who support America’s economy as well as our energy independence."
129,"If we’re smart about this, we can address the #coronavirus on both health and economic fronts. 

I’m working with Senate colleagues right now to support families, vaccine development, and the small businesses that employee countless American workers. https://t.co/gW66i09T9C"
130,"On this National Day of Prayer, we turn to a God who is strong, wise, &amp; loving. 

Becky &amp; I are praying for everyone in Louisiana affected by the coronavirus—those who are suffering, the families who have lost loved ones, &amp; the health care providers who are caring for the sick."
131,"Terrorists who target U.S. citizens don’t deserve the public assistance that law-abiding families receive. 

Instead, we should focus our limited resources on protecting innocent lives from terrorists. Here’s one way:

https://t.co/AmLIgWOTje"
132,"You know how Americans handle their fears? 

We face them. 

Thankful @realDonaldTrump is on this #coronavirus challenge like wet on water. https://t.co/P4B2MfhEll"
133,"This $7.8M in funding from the @CDCgov will help Louisiana respond to coronavirus. 
 
I’ll continue to work with @realDonaldTrump to protect the health and safety of our communities. 
 
https://t.co/amxXrJJ9EX"
134,"I want to say as emphatically as I can: We're going to be ok.

1. We have the best health care delivery system in the entire universe and are working hard on a coronavirus vaccine.

2. The fundamentals of our economy—the strongest economy in all of human history—are intact. https://t.co/oaqTmlTYiu"
135,"Louisiana is a #ProLife state that’s helping lead our country’s pro-life movement.
 
We know we can’t safeguard unborn children if we don’t also prioritize the health and wellbeing of their mothers. 

I’m thankful Louisiana is doing both.

#ProtectWomen #ProtectLife https://t.co/YaB6l924ao"
136,"Americans with preexisting health conditions should have confidence they can keep the coverage they’ve been paying for. 

The Continuing Coverage for Preexisting Conditions Act would do that no matter what #SCOTUS may decide about Obamacare.

https://t.co/ZOC4MYmCHo"
137,"The #coronavirus is not a time for politics.

This is a time to look the American people in the eye and tell them the truth. 

Thanks, @realDonaldTrump https://t.co/JQMInjiJNQ"
138,"Abortion survivors deserve the same quality of medical care as any other infant. 
 
The Born Alive Abortion Survivors Act would help preserve the lives of babies who survive botched abortions. 
 
Life is too valuable to be abandoned or ignored. #ProLife"
139,"The abortion industry shouldn’t give women lower standards of care than other medical procedures. 
 
The Pregnant Women Health and Safety Act would help us make women and children safer. #ProLife

https://t.co/vcvtBdngQo"
140,"Louisiana is a #ProLife leader, and the Pregnant Women Health and Safety Act would help make sure that the health care of women and the unborn is a top priority nationwide.

https://t.co/CRymrpV2to"
141,"It’s time for Societe General to repay 1000s of victims who lost their life savings in the Stanford Ponzi scheme.
 
I’m proud to work with @SenBillCassidy to hunt down these assets, which belong to many seniors and hard-working people in Louisiana.
 
https://t.co/3w7Vk7PMi4"
142,"It’s my honor to attend #SOTU with Felicia, who pours her talents into helping the Senate run day in and day out. 

Her dedication to her work is inspiring. I’m glad to share this historic moment with someone whose kindness and professionalism make the Capitol a brighter place. https://t.co/7LsjXZq95u"
143,"Expectant mothers and unborn children need access to quality medical care, but the abortion industry cuts corners at their expense. 

I introduced the Pregnant Women Health &amp; Safety Act to ensure women have access to protective care.

#ProLifeIsProWoman
https://t.co/tnTnpo6zSj"
144,"@drewbrees delivered a powerful speech at @stevegleason’s Congressional Gold Medal ceremony yesterday. 

I enjoyed getting to meet him after the event. Who dat! https://t.co/5NjEd1uck5"
145,"It’s game day! 

Who’s ready to watch @LSUfootball play for another national title in the Superdome tonight? 

Geaux Tigers!"
146,"Please join me in praying for the families who lost loved ones to the storms in northwest Louisiana this weekend. 

Together, we can encourage these communities that they're not alone, even as they face incredible loss. 

https://t.co/3tJHh1lDA0"
147,"While chairing a Senate Judiciary Committee hearing yesterday, I heard from U.S. Attorney David Joseph, who is nominated for U.S. District Judge for the Western District in Louisiana. As U.S. attorney, Mr. Joseph has proven his experience and dedication. https://t.co/YUtPq6qbpt"
148,"People like you and me, who had the same hopes, dreams, families and basic human rights that you and I have. And he was going to keep doing it. This I also know:  With evil people, weakness invites the wolves."
149,The FCC should conduct a public auction of the C-band spectrum because it belongs to the American people. Swamp creatures almost gave away our spectrum to 3 foreign satellite companies. I’m thankful for the good people at the FCC who are working hard for a fair &amp; public auction. https://t.co/K5IR6PJi7F
150,"Joe Burrow is a one-of-a-kind quarterback. He’s led LSU to a winning season, and he deserves this distinction.  Let’s win the whole thing, Joe! https://t.co/0dewkgw6rL"
151,"I met some great students from @BMHSCrusaders and @UrsulineNOLA in New Orleans, who visited me at the United States Capitol.  I was encouraged by their friendly faces and great questions. They have bright futures ahead of them. https://t.co/H4mKZcfhqk"
152,"As we gather around good food and great company, I’m reminded of the many blessings God has given us.  I’m grateful to call Louisiana home, and I’m so thankful for all the wonderful people who make Louisiana such a great state. I hope you all have a wonderful Thanksgiving. https://t.co/NNsGrTfG6K"
153,I think it’s so important that every person in government who makes policy for K-12 education to substitute teach at least once a year. I substitute teach in a Louisiana classroom every year &amp; I've introduced a Senate resolution to encourage my Senate colleagues to do the same. https://t.co/QBQ0wzLmpG
154,"It looks like the @Saints have the edge in the game today. Let’s dominate the NFC South. Who Dat! 
https://t.co/lRwWpnf0Om"
155,"A bet’s a bet, and @SenShelby delivered today by bringing delicious Conecuh sausage to the office. I surprised him with Popeyes chicken sandwiches because everyone should be a winner. But we know who won. LSU. 46-41. https://t.co/blhbtWKMTz"
156,"Glorifying drug trafficking &amp; cartels isn't just wrong, it’s sickening. VH1 cast El Chapo’s wife, Emma Coronel Aispuro, on a show called Cartel Crew. She’s married to an absolute monster who was the world's 2nd most wanted fugitive behind bin Laden. @VH1 needs to cancel this show https://t.co/XYDk3Pl0BQ"
157,"Veterans Day is a day set aside to honor the men and women who fought in our military to protect our freedom and keep us safe. Today, and every day, we salute our veterans and thank them for their service. https://t.co/Bc1KE37h9T"
158,"We don’t need a new federal agency to protect your private data. There are plenty of data privacy bills we can consider, including one I introduced. Let’s debate, deliberate &amp; hold a vote. For my colleagues who forgot, here’s how a bill becomes a law: https://t.co/Us5OnQdSKS"
159,"The death of al-Baghdadi is a major victory for the U.S. &amp; a warning to all international terrorists, who dare to threaten the U.S. &amp; our allies. We live in a safer world today thanks to the work of our highly-skilled special forces &amp; our commander in chief @realDonaldTrump"
160,"Between 2007 &amp; 2017, the number of suicides among people ages 10 to 24 increased an alarming 56%. I introduced legislation to require universities to print the contact information for mental health resources on the back of every college student ID.
https://t.co/HJcbJIu4Ez"
161,"Americans spend $1,200 on prescription drugs each year for every man, woman and child. That’s more than any other developed country in the world.  We can’t allow drug prices to continue to rise, putting millions of people’s health at risk.
https://t.co/AgONz1NhBa"
162,"America is the most generous country on earth. We take care of our sick and our poor. But the American people don’t pay taxes so that millionaires can eat for free. I introduced legislation to close a loophole that is wasting hard-earned taxpayer money.
https://t.co/bolSFc94bA"
163,"College is a tough time for young adults, &amp; many students suffer from anxiety and depression. I introduced a bill that would require colleges to print the phone number for the Crisis Text Line and other mental health resources on the back of student IDs.
https://t.co/zk7rF3dUf3"
164,"I’m saddened to learn about this tragic accident at Fort Polk.  My thoughts are with the family of the fallen, with the service members who were injured and with all the men and women at Fort Polk who are mourning the loss of a friend. 
https://t.co/xDyMXTqAUW"
165,"The Municipal Securities Rulemaking Board is supposed to protect the public interest, investors &amp; state &amp; local governments. In practice, the MSRB membership structure is more shaded toward protecting the financial professionals who broker the deals.
https://t.co/sRZKWVyMvf"
166,Today marks the 72nd birthday of the U.S. Air Force! We salute the brave men and women in the @usairforce who are defending our liberty. I’m especially grateful for the service members at Barksdale Air Force Base who are serving us here at home and overseas. https://t.co/iiIFWzUyV5
167,"On this day, we remember the tragedy that shook our nation 18 years ago.  We pay tribute to the thousands of Americans who lost their lives.  We will #NeverForget the pain we faced on September 11, 2001, and we will continue to show strength, unity and resilience as a nation. https://t.co/7on0QqHt7D"
168,"Only a tiny percentage of imported seafood is inspected to make sure it is safe for consumption.  As a result, other countries are importing seafood chock full of antibiotics and other contaminants putting Americans’ health at risk. https://t.co/QfDXxtHg3x"
169,I was honored today to meet with Corporal Jarvis Renfroun who served with the 82nd Airborne Division during the Korean War. He's now enjoying retirement at the Northeast Louisiana War Veterans Homes. https://t.co/tDJJ46ouee
170,Who dat ready to take on the Houston Texans? Thanks to the @Saints and Gayle Benson for hosting the extended Kennedy family today at practice. Louisiana is ready for some Monday night football! https://t.co/qtBuVNkb2u
171,"The Safe Haven crisis center will provide life-saving services for people struggling with drug addiction &amp; mental health disorders. The folks at Safe Haven are working hard to create a program that will help Louisianans who are struggling with addiction.  
https://t.co/s3JJtxX18m"
172,"Fallen Army Spc. Clayton Horne will return home to Louisiana this week. There will be a gathering at 9 a.m. on Friday at the England Airpark in Alexandria for those who would like to escort this American hero home and support his family.
 
https://t.co/O4dnews2o2"
173,"Sgt. Stayskal is fighting for his life after military doctors ignored a tumor growing in his lungs. Under current law, Stayskal can’t sue military hospitals for medical malpractice. I introduced legislation that would allow military members to seek justice for medical malpractice https://t.co/hLSUxkfBMx"
174,"Several health care centers across Louisiana were awarded $5 million in grants.  Mental health is a growing concern, and these grants will help provide treatment for mental health disorders and related conditions to the folks in Louisiana.
https://t.co/j1UHBMEWMP"
175,"I had a great time at the Gulf Intracoastal Canal Association today in New Orleans. It’s always great to spend time with folks dedicated to promoting commerce along our Gulf coast. I was also honored to meet LCDR Rios, a member of the @USCG, who works to keep our shorelines safe. https://t.co/WzhQkI6nZw"
176,"On this Purple Heart Day, we celebrate the dedicated men and women in our armed forces, who are wholeheartedly devoted to defending our nation.  Our freedom and safety would not be possible without our great U.S. military. https://t.co/HGHe3AHYpG"
177,"What happened today in El Paso was horrific. It was evil. Please join me in praying for Texas. The families of the victims, the people injured and the brave officers who rushed to help all need our prayers tonight."
178,"I believe it is very important to fill our judgeships around the country with smart, qualified people who will say what the law is, not what the law ought to be. I enjoyed questioning nominees today in the Senate Judiciary Committee. https://t.co/3LVGj9QU2I"
179,"Our @CBP officers are on the front lines of the crisis at our southern border. I’m proud to cosponsor this resolution recognizing the men &amp; women who are working hard to keep our borders safe despite minimal support &amp; outdated asylum laws.
https://t.co/tWSeBfiaQY"
180,The 9/11 first responders risked their health &amp; their lives to save thousands of people during the horrific attacks on our country. The passage of this legislation will make sure we take care of those heroes and their families for decades to come. https://t.co/f9GyeIeTT8
181,"My legislation, the CASE Act, would create a small claims court within the 
@CopyrightOffice for rising artists. High costs &amp; complexity of the court system shouldn't be barriers for creators who need to defend their work against copyright infringers.  https://t.co/JIqgz4oAEo"
182,"If you are a combat-injured veteran who received disability severance payments after 1991 and claimed it as income, you may be eligible for a tax refund. But you need to claim it soon! This month is the deadline for applying.
https://t.co/K9ELcQYiza"
183,"WARNING: It is not safe to swim in floodwater. Health experts are warning New Orleans residents to stay out of the floodwaters as much as possible because they contain waste and chemicals.
https://t.co/oDlEcitfGw"
184,What a great way to honor the military dogs who loyally serve our country and support our men and women in uniform! You can now buy stamps that feature the most common breeds of military-trained canines. https://t.co/gQ9zdCtDzz
185,"ICYMI: Swiss government has ordered a bank to pay $105M to the victims of Stanford Ponzi scheme. Hard-working, middle class families lost everything. This is a big step toward making them whole. https://t.co/8Q45hEOyco"
186,"After the #DemDebates, it seems that the Democratic position is that everything is going to be free: free education, free health care, free housing, free kittens. I just find it bizarre. I don’t know how we’re going to pay for it. It’s just not feasible. https://t.co/63hLQBoJRV"
187,Tune in now to hear me talk important issues with @dbongino who's filling in for @seanhannity on @FoxNews
188,"The Congressional Medal of Honor is awarded annually to three citizens who have demonstrated extraordinary acts of courage, sacrifice &amp; valor. If you know someone who has answered the call &amp; served their community in a time of crisis, use the link below to nominate them."
189,CONFIRMED: Congratulations to Justice Guidry who was just confirmed 53-46 by the U.S. Senate to be the U.S. judge for the Eastern District of Louisiana. Justice Guidry distinguished himself as a Louisiana Supreme Court justice. He will serve the state well. https://t.co/AheYO4pTZS
190,"I cosponsored the Blue Water Navy Vietnam Veterans Act, which will extend disability compensation to Vietnam veterans whose lives were impacted by exposure to Agent Orange, a harmful chemical used during the Vietnam War to defoliate forests. 
https://t.co/NOT608yB1b"
191,"Louisiana’s Medicaid program will save $400 million after running simple income eligibility checks &amp; finding thousands of enrollees who didn't qualify. This is why I filed a bill to mandate widespread checks of all taxpayer-funded assistance programs. 
https://t.co/I0YbSU1gPu"
192,"I introduced mental health legislation to connect students with life-saving resources. Through a simple addition to their campus ID cards, students will know that help through resources like the National Suicide Prevention Lifeline, Crisis Text Line is just a phone call away. https://t.co/NNDwmUgBmF"
193,Good News! @realDonaldTrump signed the Disaster Relief Act which will help Americans who have been hurt by recent storms. The legislation also funds the National Flood Insurance Program through the end of September.
194,"On the 75th anniversary of D-Day, it is important to remember those who fought on the beaches of Normandy and sacrificed their lives for a cause greater than themselves. I am filled with gratitude for those who served during this time. https://t.co/2UhCTxVBKL"
195,"I’m wearing a yellow rose to commemorate the 100th anniversary of the U.S. Senate passing the 19th amendment, which gave women the right to vote. Today, we remember the women trailblazers who fought for their right to vote &amp; for the voting rights of millions of future women. https://t.co/YbCXxKBKOC"
196,There are many members of the House leadership who are in bad faith in these talks of impeachment. It’s not about justice. It’s about politics. They’re determined to make demonizing Trump their lives’ mission. It’s time to stop whining &amp; get back to work. https://t.co/ncP1Xw2yvn
197,Today we take time to remember and honor those who sacrificed their lives to make the United States of America a better place. I am eternally grateful to the men and women who have served our great country and gave their lives for us. https://t.co/Uaam32FuC7
198,"During #MentalHealthAwarenessMonth, it's important to recognize the stigma surrounding mental illnesses. Last August I passed an amendment to increase funding for the National Suicide Prevention Lifeline. This provides a lifesaving resource &amp; serves as a light during dark times. https://t.co/3ZPmdMANlB"
199,"New Orleans ICE officers arrested a man who entered the country illegally multiple times &amp; is facing domestic violence charges for choking a victim. He is one of 33 illegal immigrants with criminal histories recently arrested by New Orleans ICE officers.
https://t.co/xgUrNHuLKm"
200,"We owe a debt to our service members &amp; their families. I cosponsored the Gold Star Fix, which corrects an unfair tax placed on the children of fallen service members who receive survivor benefits. We need to take care of military families &amp; fix this issue.
https://t.co/tD6ShL8eNf"
201,"Taxpayer dollars shouldn’t be spent paying benefits to dead people. That seems pretty obvious, but several federal agencies have made payments to people who are deceased. I introduced a bill with Sen. Carper to stop wasting taxpayers’ hard-earned money. 
https://t.co/J8qcWFCvOq"
202,"Today &amp; every day we salute the law enforcement officers who gave the ultimate sacrifice in the line of duty &amp; the men &amp; women who serve &amp; protect our communities. #NationalPoliceWeek is coming to an end, but we should always thank &amp; honor our law enforcement officers. https://t.co/XJuFrVugvj"
203,"Today thousands of law enforcement officers &amp; their families gathered in Washington, D.C., to honor their friends, family members &amp; officers who died in the line of duty. Among the officers honored, was one of Louisiana’s finest, Christopher Lawton.
https://t.co/5sTgDGWrrO"
204,Robocalls are as annoying as mosquitoes &amp; about as common. I questioned the @FFC &amp; @FTC chairmen on steps they can take to stop robocalls. I’ve also cosponsored the TRACED Act which would give the FCC more resources to catch &amp; punish those who violate telemarketing restrictions. https://t.co/4wShKc4LcE
205,"As a substitute teacher, I learned that teaching is hard work. Teachers aren’t just educating our children; they’re shaping them into young adults. This week is #TeacherAppreciationWeek, &amp; I want to thank all the teachers who are investing in our children. https://t.co/RYpH5PBOG0"
206,"Last month was the 10th anniversary of the Stanford Ponzi Scheme. The victims of the scheme were regular folks who lost their hard earned money. Today I asked Jay Clayton, chairman of the SEC, about recovering the stolen funds. Watch the video to hear his response. https://t.co/4dyBT97ohf"
207,"In today's Appropriations Subcommittee hearing, @FBI Director Wray &amp; I discussed removing the perception associated w/ a handful of people at the FBI &amp; DOJ who acted on their political beliefs &amp; tried to influence the 2016 election. We need to move forward &amp; fix that perception. https://t.co/2WR3jcI8ow"
208,On #HolocaustRemembranceDay we honor the 6 million Jews who were brutally murdered under the Nazi regime. We also celebrate those who survived and the soldiers who fought around the world to root out hatred and anti-Semitism. https://t.co/yqkU0W31Cr
